,reviewerID,asin,reviewerName,helpful,reviewText,overall,summary,unixReviewTime,reviewTime,reviewYear,reviewLength,meaningfulWords,Title
197689,A1J5TC13BSPA2M,6300158772,"James Simpson ""James Simpson""","[3, 3]","Timeless Comedy about Little Tramp arriving in the Yukon as a prospector looking for Gold and finding hilarity, success and romance. Classic sequences abound from the unforgettable Shoe eating scene to the dance of the dinner rolls and the Cabin teetering over the cliff.Chaplin is brilliant in this picture as the lonely and courageous Tramp. His story in this one is somewhat simpler than his later films but perhaps that's what makes this his best. This is a simply told tale that is brought off incredibly well. Chaplin's film and character is the most miraculous combination of slapstick and sentiment ever seen. We relate to this tramp and empathize with his plight and we feel joy when he finds purpose.The cast adds immeasurably, particularly the unforgettable Mack Swain as the burly prospector, Big Jim Mckay who so memorably chases Chaplin through the cabin as he mistakes him for a chicken. The actor and Chaplin play off each other incredibly well and there friendship is one of the film's highlights.Georgia Hale is a gorgeous lead. Independant and yet, vulnerable, her character is probally Chaplin's best developed female lead with the possible exception of Paulette Goddard in ""Modern Times(1935)"". Hale's character is in need of fullfillment and redemption, just as much as Charlie is and the conclusion where both end up with each other romantically, we feel that she has won just as much as he has. She is better off with earning the love of this good man. It should be noted that thsi ending is probally one of the only REAL happy endings in Chaplin's career. There's no ambiguity or message. Things just work out and that's the way it is.Chaplin's film strikes a chord with it's emotional complexity. The film has several funny stand out moments but it's the warmth that forms the center of the film. Chaplin dervies most of the humor through the darkest means. Alot of the ideas were found from his own childhood and the theme of Starvation and the importance of food plays a large role in the film. Even taboo subjects like CANNIBALSIM play a large role in the Comedy. Several films have used the concept of starvation making one mistake another for a food, but it's Chaplin that made it his own. Chaplin as the Chicken from Big Jim's imagination is one of the great comic images. Chaplin himself performed inside the suit.There are no standard villians in the role, only catalysts. There is a villainous character named ""Black Larsen"" but he is killed off halfway through and the true ""bad guy' is the elements themselves. In a way this may seem more Keaton than Chaplin but it works immeasurably and is more relateable for Chaplin in his general battle against adversity. The world may be seemingly against Chaplin but he'll battle it and we the audience are convinced that he'll come out on top. It's a wonderful, enpowering message that few but Chaplin could make so uterly believable.This film was my introduction to the Little Tramp properly. I had first seen the film as part of a Comedy Triple Feature Video that my grandmother had bought for me. The other two films were Laurel and Hardy's ""The Flying Deauces"" and the Martin and Lewis vehicle, ""At War With the Army"". The Chaplin film was last on the video and it mesmerized me. Rarely did a film amaze me enough that I found myself watching immediately after it had finished, but that's exactly what I did. I watched the film numerous times over the years until this wonderful DVD release became available.Despite the price tag the DVD is completely worthwhile. The film has never looked better and the set is filled with extras. They include the 1940 reissue version with Chaplin's narration and the 1925 Original, restored and remastered as well as being rescored with Chaplin's original score. Both are VERY different versions with alternate takes and extended scenes in the 1925 version and an abridged ending in the 1940 version.The DVD also includes an informative documentary on the film's impact and an introduction to the film that serves as a making of feature. Also several photos and posters are included as well.This is simply put one of the greatest motion pictures of all time and essential viewing for the serious film buff and Comedy afficionado alike. If you have not have had the pleasure of meeting Charlie yet, it's about time to make your first meeting via this imperishable Classic.Enjoy.",5,Immortal Chaplin Classic is one of the Great Films of all time.,1245801600,"06 24, 2009",2009,4396,"['Timeless', 'Comedy', 'Little', 'Tramp', 'arriving', 'Yukon', 'prospector', 'looking', 'Gold', 'finding', 'hilarity', 'success', 'romance', 'Classic', 'sequences', 'abound', 'unforgettable', 'Shoe', 'eating', 'scene', 'dance', 'dinner', 'rolls', 'Cabin', 'teetering', 'cliff.Chaplin', 'brilliant', 'picture', 'lonely', 'courageous', 'Tramp', 'story', 'one', 'somewhat', 'simpler', 'later', 'films', 'perhaps', 'what', 'best', 'simply', 'told', 'tale', 'brought', 'off', 'incredibly', 'well', 'Chaplin', 'film', 'character', 'most', 'miraculous', 'combination', 'slapstick', 'sentiment', 'ever', 'seen', 'relate', 'tramp', 'empathize', 'plight', 'feel', 'joy', 'when', 'purpose.The', 'cast', 'immeasurably', 'particularly', 'unforgettable', 'Mack', 'Swain', 'burly', 'prospector', 'Big', 'Jim', 'Mckay', 'who', 'so', 'memorably', 'Chaplin', 'cabin', 'chicken', 'actor', 'Chaplin', 'play', 'off', 'other', 'incredibly', 'well', 'there', 'friendship', 'one', 'film', 'highlights.Georgia', 'Hale', 'gorgeous', 'lead', 'Independant', 'yet', 'vulnerable', 'character', 'probally', 'Chaplin', 'best', 'developed', 'female', 'lead', 'possible', 'exception', 'Paulette', 'Goddard', 'Modern', 'Times', '1935', 'Hale', 'character', 'need', 'fullfillment', 'redemption', 'just', 'as', 'much', 'Charlie', 'conclusion', 'where', 'end', 'up', 'other', 'romantically', 'feel', 'won', 'just', 'as', 'much', 'better', 'off', 'earning', 'love', 'good', 'man', 'should', 'be', 'noted', 'thsi', 'ending', 'probally', 'one', 'only', 'REAL', 'happy', 'endings', 'Chaplin', 'career', 'ambiguity', 'message', 'Things', 'just', 'work', 'out', 'way', 'is.Chaplin', 'film', 'chord', 'emotional', 'complexity', 'film', 'several', 'funny', 'stand', 'moments', 'warmth', 'center', 'film', 'Chaplin', 'most', 'humor', 'darkest', 'means', 'Alot', 'ideas', 'were', 'found', 'own', 'childhood', 'theme', 'Starvation', 'importance', 'food', 'plays', 'large', 'role', 'film', 'Even', 'taboo', 'subjects', 'CANNIBALSIM', 'play', 'large', 'role', 'Comedy', 'Several', 'films', 'have', 'used', 'concept', 'starvation', 'making', 'one', 'mistake', 'food', 'Chaplin', 'made', 'own', 'Chaplin', 'Chicken', 'Big', 'Jim', 'imagination', 'one', 'great', 'comic', 'images', 'Chaplin', 'performed', 'are', 'standard', 'villians', 'role', 'only', 'villainous', 'character', 'named', 'Black', 'Larsen', 'killed', 'off', 'halfway', 'true', 'bad', 'guy', 'elements', 'way', 'may', 'seem', 'more', 'Keaton', 'Chaplin', 'immeasurably', 'more', 'relateable', 'Chaplin', 'general', 'battle', 'adversity', 'world', 'may', 'be', 'seemingly', 'Chaplin', ""'ll"", 'battle', 'audience', 'are', 'convinced', ""'ll"", 'come', 'out', 'top', 'wonderful', 'enpowering', 'message', 'few', 'Chaplin', 'could', 'make', 'so', 'uterly', 'believable.This', 'film', 'was', 'introduction', 'Little', 'Tramp', 'properly', 'had', 'first', 'seen', 'film', 'part', 'Comedy', 'Triple', 'Feature', 'Video', 'grandmother', 'had', 'bought', 'other', 'two', 'films', 'were', 'Laurel', 'Hardy', 'Flying', 'Deauces', 'Martin', 'Lewis', 'vehicle', 'War', 'Army', 'Chaplin', 'film', 'was', 'last', 'video', 'mesmerized', 'Rarely', 'did', 'film', 'found', 'watching', 'immediately', 'had', 'finished', 'exactly', 'what', 'did', 'watched', 'film', 'numerous', 'times', 'years', 'wonderful', 'DVD', 'release', 'became', 'available.Despite', 'price', 'tag', 'DVD', 'completely', 'worthwhile', 'film', 'never', 'looked', 'better', 'set', 'filled', 'extras', 'include', '1940', 'reissue', 'version', 'Chaplin', 'narration', '1925', 'Original', 'restored', 'remastered', 'as', 'well', 'being', 'rescored', 'Chaplin', 'original', 'score', 'are', 'VERY', 'different', 'versions', 'alternate', 'extended', 'scenes', '1925', 'version', 'abridged', 'ending', '1940', 'version.The', 'DVD', 'also', 'informative', 'documentary', 'film', 'impact', 'introduction', 'film', 'making', 'feature', 'Also', 'several', 'photos', 'posters', 'are', 'included', 'well.This', 'simply', 'put', 'one', 'greatest', 'motion', 'pictures', 'time', 'essential', 'viewing', 'serious', 'film', 'buff', 'Comedy', 'afficionado', 'alike', 'have', 'not', 'have', 'had', 'pleasure', 'meeting', 'Charlie', 'yet', 'time', 'make', 'first', 'meeting', 'imperishable', 'Classic.Enjoy']",The Gold Rush
197690,A140XH16IKR4B0,6300158772,Jean E. Pouliot,"[4, 4]","This 2-disk set is a great resource for those interested in ""The Gold Rush,"" Charlie Chaplin's 1925 comedy about Alaskan gold prospecting. The main disk contains the 1942 re-release, which did away with interscene placards, replacing them with a voiceover by Chaplin himself. The second disk included the original 1925 silent release. Both versions were accompanied by a wonderful piano arrangement that was timed with the movie action. The second disk also contains a ""making of"" shorts that described Chaplin's off-screen romances with his leading ladies as well as footage of an older Chaplin reprieving one of his movie routines. Another short describes the effect that Chaplin had on an African filmmaker. The extras are by no means comprehensive, but have enough meat to satisfy the casual student of Chaplin and early cinema.The film is terrific and sometimes funny, and always watchable. Chaplin's ""Little Tramp"" character delves into the Alaskan wilderness, seeking his fortune as a gold prospector. He encounters other prospectors, good and bad, and falls in love with the lovely Georgia, who seems at first not to notice him. There is great pathos as well as comedy in the film. A scene in which Chaplin prepares a New Years' Eve party for Georgia and her friends, who have forgotten their promise to attend, is quite affecting. The misery is offset somewhat by one of Chaplin's great routines -- set in a scene that imagines how the party would have gone -- in which Chaplin sticks forks into two dinner rolls and makes these ""feet"" dance beneath his sad sack face. Other notable scenes include one in which the Little Tramp, being thrown out of the rude cabin he shares with Black Larsen, slips and slides in his struggle against a fierce wind that blows him back into the cabin. Another scene in which Larsen fights another prospector for control of a shotgun -- managing to point it at the Little Tramp no matter where he flees -- is perfectly-choreographed and fraught with comedic tension. AN early scene, in which a lone Chaplin navigates a narrow mountain ledge -- sometimes followed by a live bear -- are beautifully timed.I preferred the 1925 version to the slicker 1942 release, but it's nice that both versions are here. YMMV. The film quality was superb, almost too perfect, and Chaplin's pancake makeup was quite obvious, especially in close-ups. You'll wonder whether a little-used print was located, or whether this version was cleaned up digitally. In any event, ""The Gold Rush"" disks is both educational and entertaining. Not a must-see, but not at all disappointing.",4,Silent gold,1196208000,"11 28, 2007",2007,2596,"['2-disk', 'set', 'great', 'resource', 'interested', 'Gold', 'Rush', 'Charlie', 'Chaplin', '1925', 'comedy', 'Alaskan', 'gold', 'prospecting', 'main', 'disk', '1942', 're-release', 'did', 'away', 'interscene', 'placards', 'replacing', 'voiceover', 'Chaplin', 'second', 'disk', 'included', 'original', '1925', 'silent', 'release', 'versions', 'were', 'accompanied', 'wonderful', 'piano', 'arrangement', 'was', 'timed', 'movie', 'action', 'second', 'disk', 'also', 'making', 'shorts', 'described', 'Chaplin', 'off-screen', 'romances', 'leading', 'ladies', 'as', 'well', 'footage', 'older', 'Chaplin', 'reprieving', 'one', 'movie', 'routines', 'short', 'effect', 'Chaplin', 'had', 'African', 'filmmaker', 'extras', 'are', 'means', 'comprehensive', 'have', 'enough', 'meat', 'satisfy', 'casual', 'student', 'Chaplin', 'early', 'cinema.The', 'film', 'terrific', 'sometimes', 'funny', 'always', 'watchable', 'Chaplin', 'Little', 'Tramp', 'character', 'Alaskan', 'wilderness', 'seeking', 'fortune', 'gold', 'prospector', 'other', 'prospectors', 'good', 'bad', 'love', 'lovely', 'Georgia', 'who', 'first', 'not', 'notice', 'great', 'pathos', 'as', 'well', 'comedy', 'film', 'scene', 'Chaplin', 'New', 'Years', 'Eve', 'party', 'Georgia', 'friends', 'who', 'have', 'forgotten', 'promise', 'attend', 'quite', 'affecting', 'misery', 'offset', 'somewhat', 'one', 'Chaplin', 'great', 'routines', 'set', 'scene', 'how', 'party', 'would', 'have', 'gone', 'Chaplin', 'forks', 'two', 'dinner', 'rolls', 'feet', 'dance', 'beneath', 'sad', 'sack', 'face', 'Other', 'notable', 'scenes', 'include', 'one', 'Little', 'Tramp', 'being', 'thrown', 'rude', 'cabin', 'shares', 'Black', 'Larsen', 'slips', 'slides', 'struggle', 'fierce', 'wind', 'back', 'cabin', 'scene', 'Larsen', 'prospector', 'control', 'shotgun', 'managing', 'point', 'Little', 'Tramp', 'matter', 'where', 'perfectly-choreographed', 'fraught', 'comedic', 'tension', 'AN', 'early', 'scene', 'lone', 'Chaplin', 'narrow', 'mountain', 'ledge', 'sometimes', 'followed', 'live', 'bear', 'are', 'beautifully', 'timed.I', 'preferred', '1925', 'version', 'slicker', '1942', 'release', 'nice', 'versions', 'are', 'here', 'YMMV', 'film', 'quality', 'was', 'superb', 'almost', 'too', 'perfect', 'Chaplin', 'pancake', 'makeup', 'was', 'quite', 'obvious', 'especially', 'close-ups', ""'ll"", 'wonder', 'little-used', 'print', 'was', 'located', 'version', 'was', 'cleaned', 'up', 'digitally', 'event', 'Gold', 'Rush', 'disks', 'educational', 'entertaining', 'Not', 'must-see', 'not', 'disappointing']",The Gold Rush
197691,A2FEGRJQNU51P9,6300158772,Joe Sherry,"[1, 3]","The Gold Rush is a silent Charlie Chaplin film from 1925.  The version that I watched on this DVD was a reissue of the film where Chaplin himself adds narration to the film.  Not having seen the unaltered original, I can't make any comparisons to that.  However, for the film that I saw the narration mostly helps the story.  The acting is done well enough that you would know exactly what is happening without any narration (the mark of a good silent film), but the narration does not take anything away from the film and it does not run through every scene.  According to what I've read, the silent version is almost 30 minutes longer, but the 69 minute length of the film I saw was just right for The Gold Rush.  The new DVD in the Chaplin Collection includes both versions.The story is that the Tramp (Charlie Chaplin) is a prospector heading to the Yukon Territory during the Gold Rush.  He meets up with two other prospectors and during a storm they get stuck in one cabin.  Here The Tramp cooks his own shoe and he and another man eat the shoe.  The hunger scenes are actually quite funny.  Later on in the film we see Chaplin do the little dance with dinner rolls that is later revisited in the film Benny and Joon.  This is absolutely classic.  The Tramp also falls for a dance hall girl (Georgia Hale) and throughout the film there is a definite air of loneliness.This is a fun movie and there is something intriguing about watching classic Chaplin films.  Even 80 years later, it is easy to see why Charlie Chaplin was one of the masters of early film and why he is still considered a comic genius.  To top it all off, Chaplin usually wrote, directed, and starred in all of his movies.  You can't get much better than that.",4,classic Chaplin,1058227200,"07 15, 2003",2003,1734,"['Gold', 'Rush', 'silent', 'Charlie', 'Chaplin', 'film', '1925', 'version', 'watched', 'DVD', 'was', 'reissue', 'film', 'where', 'Chaplin', 'narration', 'film', 'Not', 'having', 'seen', 'unaltered', 'original', 'ca', ""n't"", 'make', 'comparisons', 'However', 'film', 'saw', 'narration', 'mostly', 'story', 'acting', 'done', 'well', 'enough', 'would', 'know', 'exactly', 'what', 'happening', 'narration', 'mark', 'good', 'silent', 'film', 'narration', 'not', 'take', 'anything', 'away', 'film', 'not', 'run', 'scene', 'According', 'what', ""'ve"", 'read', 'silent', 'version', 'almost', '30', 'minutes', 'longer', '69', 'minute', 'length', 'film', 'saw', 'was', 'just', 'right', 'Gold', 'Rush', 'new', 'DVD', 'Chaplin', 'Collection', 'versions.The', 'story', 'Tramp', 'Charlie', 'Chaplin', 'prospector', 'heading', 'Yukon', 'Territory', 'Gold', 'Rush', 'up', 'two', 'other', 'prospectors', 'storm', 'get', 'stuck', 'one', 'cabin', 'Here', 'Tramp', 'own', 'shoe', 'man', 'shoe', 'hunger', 'scenes', 'are', 'actually', 'quite', 'funny', 'Later', 'film', 'see', 'Chaplin', 'do', 'little', 'dance', 'dinner', 'rolls', 'later', 'revisited', 'film', 'Benny', 'Joon', 'absolutely', 'classic', 'Tramp', 'also', 'dance', 'hall', 'girl', 'Georgia', 'Hale', 'film', 'definite', 'air', 'loneliness.This', 'fun', 'movie', 'something', 'intriguing', 'watching', 'classic', 'Chaplin', 'films', 'Even', '80', 'years', 'later', 'easy', 'see', 'why', 'Charlie', 'Chaplin', 'was', 'one', 'masters', 'early', 'film', 'why', 'still', 'considered', 'comic', 'genius', 'top', 'off', 'Chaplin', 'usually', 'wrote', 'directed', 'starred', 'movies', 'ca', ""n't"", 'get', 'much', 'better']",The Gold Rush
197692,A10ODC971MDHV8,6300158772,John Farr,"[0, 0]","This brilliant Klondike comedy follows the antics of Chaplin's Little Tramp character through the trials and tribulations of frenzied fortune hunting in the Alaskan wilderness. In addition to the famous boiled-boot sequence, the visual gags are plentiful and hilarious, especially concerning the three prospectors' impending starvation (just watch Big Jim chase Chaplin around with an axe). But it's the bittersweet love story involving Hale's contemptuous saloon girl that makes ""The Gold Rush"" quintessentially Chaplinesque.",5,The Gold Rush,1182297600,"06 20, 2007",2007,526,"['brilliant', 'Klondike', 'comedy', 'antics', 'Chaplin', 'Little', 'Tramp', 'character', 'trials', 'tribulations', 'frenzied', 'fortune', 'hunting', 'Alaskan', 'wilderness', 'addition', 'famous', 'boiled-boot', 'sequence', 'visual', 'gags', 'are', 'plentiful', 'hilarious', 'especially', 'concerning', 'three', 'prospectors', 'impending', 'starvation', 'just', 'watch', 'Big', 'Jim', 'chase', 'Chaplin', 'axe', 'bittersweet', 'love', 'story', 'involving', 'Hale', 'contemptuous', 'saloon', 'girl', 'Gold', 'Rush', 'quintessentially', 'Chaplinesque']",The Gold Rush
197693,A1S2261MW4EU4S,6300158772,"J. Stillman ""Movie Man""","[2, 2]","""The Gold Rush"" is proof of what a comic genius Charlie Chaplin truly was.  This film is over eighty years old, and somehow it remains timeless.  From the dance of the rolls to the boiling of the shoe, just about every scene is a classic.If only more contemporary comic actors and filmmakers would learn from the master that silence really is golden, we would laugh more at the movies made today.",5,Silence is Golden: Possibly the Greatest Comedy Ever,1129334400,"10 15, 2005",2005,396,"['Gold', 'Rush', 'proof', 'what', 'comic', 'genius', 'Charlie', 'Chaplin', 'truly', 'was', 'film', 'eighty', 'years', 'old', 'somehow', 'timeless', 'dance', 'rolls', 'boiling', 'shoe', 'just', 'scene', 'classic.If', 'only', 'more', 'contemporary', 'comic', 'actors', 'filmmakers', 'would', 'learn', 'master', 'silence', 'really', 'golden', 'would', 'laugh', 'more', 'movies', 'made', 'today']",The Gold Rush
197694,A6ADO7B6FUVN,6300158772,"Kim Anehall ""www.cinematica.org""","[6, 7]","Gold Rush is one of Charlie Chaplin's legendary films about the Tramp who seeks fortune and a better life in Klondike, Alaska, during the gold rush.  In his quest for fortune he encounters several questionable characters which often lead to comic situations.  Underneath the comedy there is a serious undertone of struggle for happiness and prosperity where the Tramp becomes easy prey as he helps those in need.  However, through his kindness he ends up being hurt in several ways.  Throughout the film, Chaplin conveys his messages with comedy that makes it easier to look at the hardships the Tramp encounters, and through this comedy he teaches the audience valuable morals.  Overall, Gold Rush offers a brilliant cinematic experience that offers something for everybody.",5,The Tramps Suffering is eased with Brilliant Comedy...,1073433600,"01 7, 2004",2004,775,"['Gold', 'Rush', 'one', 'Charlie', 'Chaplin', 'legendary', 'films', 'Tramp', 'who', 'fortune', 'better', 'life', 'Klondike', 'Alaska', 'gold', 'rush', 'quest', 'fortune', 'several', 'questionable', 'characters', 'often', 'lead', 'comic', 'situations', 'comedy', 'serious', 'undertone', 'struggle', 'happiness', 'prosperity', 'where', 'Tramp', 'easy', 'prey', 'need', 'However', 'kindness', 'up', 'being', 'hurt', 'several', 'ways', 'film', 'Chaplin', 'conveys', 'messages', 'comedy', 'easier', 'look', 'hardships', 'Tramp', 'encounters', 'comedy', 'audience', 'valuable', 'morals', 'Overall', 'Gold', 'Rush', 'brilliant', 'cinematic', 'experience', 'something', 'everybody']",The Gold Rush
197695,A37563JES12QF,6300158772,Mary,"[3, 4]","&quot;The Gold Rush&quot; is Charlie Chaplin's best movie. It has some terrific comic set pieces (the dinner roll dance, the cabin teetering over a cliff) as well as some well-executed pathos. Chaplin himself is at top form here, and the production values and special effects are very good (at least by 1925 standards).This movie has not seen a better home video release than here. This two-disc DVD includes Chaplin's revised 1942 version, with some snipped scenes and, regrettably, Chaplin's narration. The second disc contains the original 1925 version with a pretty good new musical score. The 1942 cut looks absolutely beautiful. The 1925 version is a little scratchier, but it still looks as good as possible.All of the extras are on the second disc. Like other films in this series (&quot;Limelight,&quot; &quot;Great Dictator,&quot; &quot;Modern Times&quot;), there is a good introduction by David Robinson, a Chaplin biographer, as well as a &quot;Chaplin Today&quot; documentary. The documentary is quite good. It contains vintage interviews with leading-lady Georgia Hale and Lita Gray, one of Chaplin's wives, as well as some comments from filmmaker Idrissa Ouedraoge. Also included are an enormous amount of photos, as well as posters, trailers, and some scenes from other Chaplin films.",5,Chaplin's Best Movie,1072828800,"12 31, 2003",2003,1300,"['quot', 'Gold', 'Rush', 'quot', 'Charlie', 'Chaplin', 'best', 'movie', 'terrific', 'comic', 'set', 'pieces', 'dinner', 'roll', 'dance', 'cabin', 'teetering', 'cliff', 'as', 'well', 'well-executed', 'pathos', 'Chaplin', 'top', 'form', 'here', 'production', 'values', 'special', 'effects', 'are', 'very', 'good', 'least', '1925', 'standards', '.This', 'movie', 'not', 'seen', 'better', 'home', 'video', 'release', 'here', 'two-disc', 'DVD', 'Chaplin', 'revised', '1942', 'version', 'snipped', 'scenes', 'regrettably', 'Chaplin', 'narration', 'second', 'disc', 'original', '1925', 'version', 'pretty', 'good', 'new', 'musical', 'score', '1942', 'cut', 'absolutely', 'beautiful', '1925', 'version', 'little', 'scratchier', 'still', 'as', 'good', 'possible.All', 'extras', 'are', 'second', 'disc', 'other', 'films', 'series', 'quot', 'Limelight', 'quot', 'quot', 'Great', 'Dictator', 'quot', 'quot', 'Modern', 'Times', 'quot', 'good', 'introduction', 'David', 'Robinson', 'Chaplin', 'biographer', 'as', 'well', 'quot', 'Chaplin', 'Today', 'quot', 'documentary', 'documentary', 'quite', 'good', 'vintage', 'interviews', 'leading-lady', 'Georgia', 'Hale', 'Lita', 'Gray', 'one', 'Chaplin', 'wives', 'as', 'well', 'comments', 'filmmaker', 'Idrissa', 'Ouedraoge', 'Also', 'included', 'are', 'enormous', 'amount', 'photos', 'as', 'well', 'posters', 'trailers', 'scenes', 'other', 'Chaplin', 'films']",The Gold Rush
