,reviewerID,asin,reviewerName,helpful,reviewText,overall,summary,unixReviewTime,reviewTime,reviewYear,reviewLength,meaningfulWords,Title
197680,A1EAN2SFKYBJ05,6300158772,E. Hunter Hale,"[18, 18]","This has been a long time coming but we now finally have Chaplin's 1925 original release in a form that does justice to what many feel is his masterpiece. Kevin Brownlow and the late David Gill have worked many years on gathering the material from archives and collectors that would allow for a decent reconstruction of THE GOLD RUSH as it was originally shown. In 1942 Chaplin prepared a sound release in which he removed the titles, added a delightful narration that he spoke himself (at least in the English language release) and composed a music score that is perfect for the film. In doing so he went back to his vaults and chose different takes that played better at the 24fps sound speed. In the process the original 1925 negative was partly used and the sound version became the version that Chaplin preferred. In 1942 audiences were delighted with the new approach as films from the silent era as a rule were not being reissued. Over the years interest in silent films has made a come back and there are many who regret not being able to enjoy THE GOLD RUSH as it was original shown. Now on the Criterion release we have a beautifully restored copy of both releases. Criterion has gone the extra mile with the 1925 version and removed scratches and dirt so that the film looks the best it has since its original release. Now thorough the efforts of Timothy Brock, who has reconstructed Chaplin's music from the 1942 release, we can watch the film with the music that it should be heard with. With the excellent extras, booklet and restoration there is no question that the Criterion release is one of the most important releases ever. While the Blu-ray is marvelous the DVD release will also be a big improvement over any previous release. And even if you are not a fan of the 1942 release you can use this version to introduce younger children (who do not yet read well enough for silent titles) to the art of Chaplin. I've done this and their response is wonderful. And yes there are some differences between the two releases. Take a look at the letter Georgia Hale writes after not showing up for the New Year's dinner that Charlie has worked so hard to prepare. And for my money the ending of the film works far better in the 1925 release. Judge for yourself.",5,Criterion's THE GOLD RUSH Sets New Standard for Classic!,1340409600,"06 23, 2012",2012,2272,"['been', 'long', 'time', 'coming', 'now', 'finally', 'have', 'Chaplin', '1925', 'original', 'release', 'form', 'justice', 'what', 'many', 'feel', 'masterpiece', 'Kevin', 'Brownlow', 'late', 'David', 'Gill', 'have', 'worked', 'many', 'years', 'gathering', 'material', 'archives', 'collectors', 'would', 'allow', 'decent', 'reconstruction', 'THE', 'GOLD', 'RUSH', 'was', 'originally', 'shown', '1942', 'Chaplin', 'prepared', 'sound', 'release', 'removed', 'titles', 'added', 'delightful', 'narration', 'spoke', 'least', 'English', 'language', 'release', 'composed', 'music', 'score', 'perfect', 'film', 'doing', 'so', 'went', 'back', 'vaults', 'chose', 'different', 'played', 'better', '24fps', 'sound', 'speed', 'process', 'original', '1925', 'negative', 'was', 'partly', 'used', 'sound', 'version', 'became', 'version', 'Chaplin', 'preferred', '1942', 'audiences', 'were', 'delighted', 'new', 'approach', 'films', 'silent', 'era', 'rule', 'were', 'not', 'being', 'reissued', 'years', 'interest', 'silent', 'films', 'made', 'come', 'back', 'are', 'many', 'who', 'regret', 'not', 'being', 'able', 'enjoy', 'THE', 'GOLD', 'RUSH', 'was', 'original', 'shown', 'Now', 'Criterion', 'release', 'have', 'beautifully', 'restored', 'copy', 'releases', 'Criterion', 'gone', 'extra', 'mile', '1925', 'version', 'removed', 'scratches', 'dirt', 'so', 'film', 'best', 'original', 'release', 'Now', 'efforts', 'Timothy', 'Brock', 'who', 'reconstructed', 'Chaplin', 'music', '1942', 'release', 'can', 'watch', 'film', 'music', 'should', 'be', 'heard', 'excellent', 'extras', 'booklet', 'restoration', 'question', 'Criterion', 'release', 'one', 'most', 'important', 'releases', 'ever', 'Blu-ray', 'marvelous', 'DVD', 'release', 'will', 'also', 'be', 'big', 'improvement', 'previous', 'release', 'even', 'are', 'not', 'fan', '1942', 'release', 'can', 'use', 'version', 'introduce', 'younger', 'children', 'who', 'do', 'not', 'yet', 'read', 'well', 'enough', 'silent', 'titles', 'art', 'Chaplin', ""'ve"", 'done', 'response', 'wonderful', 'yes', 'are', 'differences', 'two', 'releases', 'Take', 'look', 'letter', 'Georgia', 'Hale', 'writes', 'not', 'showing', 'up', 'New', 'Year', 'dinner', 'Charlie', 'worked', 'so', 'hard', 'prepare', 'money', 'ending', 'film', 'far', 'better', '1925', 'release', 'Judge']",The Gold Rush
197681,ACJTUFZEUCCBL,6300158772,"Eolake ""eolake (.com)""","[0, 0]","""I'm going away, and when I return I shall come back!"" - Charlie Chaplin, Gold RushI hadn't watched any Chaplin since I was a child, and a couple years back I rented a DVD with his *very* early material, and I was sorely disappointed. But Gold Rush is really good, surprisingly funny. I was in stitches at his physical comedy, like when two big men fight over a loaded shotgun, and the gun keeps pointing at Charlie (""the Little Fellow"") no matter where he tries to flee to in the room.",5,Rushing for Gold,1171756800,"02 18, 2007",2007,486,"[""'m"", 'going', 'away', 'when', 'return', 'shall', 'come', 'back', 'Charlie', 'Chaplin', 'Gold', 'RushI', 'had', ""n't"", 'watched', 'Chaplin', 'was', 'child', 'couple', 'years', 'back', 'rented', 'DVD', '*very*', 'early', 'material', 'was', 'sorely', 'disappointed', 'Gold', 'Rush', 'really', 'good', 'surprisingly', 'funny', 'was', 'stitches', 'physical', 'comedy', 'when', 'two', 'big', 'men', 'fight', 'loaded', 'shotgun', 'gun', 'pointing', 'Charlie', 'Little', 'Fellow', 'matter', 'where', 'flee', 'room']",The Gold Rush
197682,A1JSGFF6ZHX8KG,6300158772,Eric Evans(EricRover5@aol.com),"[0, 0]","Of all the silent films available today, this is the most watchable: it is a timeless film.If you have never seen a silent film, you won't be disappointed in viewing this &quot;Little Tramp&quot; classic. Chaplin's  famous &quot;dancing dinner rolls&quot;  stands out in my mind as one of  the most clever and charming scenes ever filmed.The film still evokes  emotion even today.One of the greatest films ever made.",5,Charming film of the silent era,928713600,"06 7, 1999",1999,416,"['silent', 'films', 'available', 'today', 'most', 'watchable', 'timeless', 'film.If', 'have', 'never', 'seen', 'silent', 'film', 'wo', ""n't"", 'be', 'disappointed', 'viewing', 'quot', 'Little', 'Tramp', 'quot', 'classic', 'Chaplin', 'famous', 'quot', 'dancing', 'dinner', 'rolls', 'quot', 'out', 'mind', 'one', 'most', 'clever', 'charming', 'scenes', 'ever', 'filmed.The', 'film', 'still', 'emotion', 'even', 'today.One', 'greatest', 'films', 'ever', 'made']",The Gold Rush
197683,A29QA79VLQGHY6,6300158772,Flipper Campbell,"[6, 7]","""The Gold Rush"" has been delighting audiences for almost 80 years -- it's one of the flat-out funniest films made in the silent era or any other. This is the movie Chaplin wanted to be remembered for.Like other films in the Chaplin Collection (at least so far) the ""Gold Rush"" enjoys across-the-board improvements in video and audio, including digital transfers from Chaplin family elements and Dolby Digital 5.1 mixes. Imaginative bonus features inform and entertain without wearing out their welcome.But this is Chaplin and so there is controversy. Image and Fox Home Entertainment felt the wrath of the faithful a few years back when they released Chaplin's audience-friendly 1942 sound version of the film, ignoring the classic all-silent film.MK2 and Warner didn't dare blow off the original, but their ""Gold Rush"" package relegates the 96-minute silent to disc 2, as an extra. The 1942 version gets the star treatment, taking up all of disc 1. It runs 69 minutes, as transformed by Chaplin when he recut the film, added narration and recorded an orchestral score.The 1942 edition will be more accessible to mainstream audiences, but it's a shame that most viewers will bypass the original, probably the grandest silent-movie entertainment of them all. (A new piano track by Neil Brand adds even more zest to the silent.)The Chaplin Collection's 1942 film looks great, with most of the wear digitally scrubbed out., but some videophiles will stay with Fox's 2001 release, which retains a bit more contrast and detail with the tradeoff of wear. The Warner silent sports a decent restoration job, from Kevin Brownlow and David Gill, but its images tend to be flat and inconsistent, with wear throughout. Warner's two versions are presented full-screen (1.33:1, as Chaplin intended), lacking a bit of picture information found on Fox's widow-boxed film, which runs 72-minutes. And the Warner silent employs some subtly different takes than the updated film.A half-hour MK2 TV documentary retells the tale of the production, which started in the Sierra Nevada before  retreating to an elaborate set in L.A., where 100 barrels of flour stood in for mountain snow.  The docu points out that Chaplin's humor frequently revolved around hunger, the curse of his childhood. ""The Gold Rush's"" comic tale of starving prospectors was based, in part, on the real-life horrors of the Donner party. The DVD includes rare outtakes of Big Jim the miner chasing his hallucinatory chicken (Chaplin) through the woods.The Chaplin Collection's next releases, due in early 2004, include ""The Kid,"" ""City Lights,"" ""Monsieur Verdoux"" and ""The Circus."" All but ""Verdoux"" are double-disc sets.",4,"Please take off your boot, we're hungry",1058400000,"07 17, 2003",2003,2671,"['Gold', 'Rush', 'been', 'delighting', 'audiences', 'almost', '80', 'years', 'one', 'flat-out', 'funniest', 'films', 'made', 'silent', 'era', 'other', 'movie', 'Chaplin', 'wanted', 'be', 'remembered', 'other', 'films', 'Chaplin', 'Collection', 'least', 'so', 'far', 'Gold', 'Rush', 'across-the-board', 'improvements', 'video', 'audio', 'including', 'digital', 'transfers', 'Chaplin', 'family', 'elements', 'Dolby', 'Digital', '5.1', 'mixes', 'Imaginative', 'bonus', 'features', 'inform', 'entertain', 'wearing', 'out', 'welcome.But', 'Chaplin', 'so', 'controversy', 'Image', 'Fox', 'Home', 'Entertainment', 'felt', 'wrath', 'faithful', 'few', 'years', 'back', 'when', 'released', 'Chaplin', 'audience-friendly', '1942', 'sound', 'version', 'film', 'ignoring', 'classic', 'all-silent', 'film.MK2', 'Warner', 'did', ""n't"", 'dare', 'blow', 'off', 'original', 'Gold', 'Rush', 'package', '96-minute', 'silent', 'disc', '2', 'extra', '1942', 'version', 'star', 'treatment', 'taking', 'up', 'disc', '1', '69', 'minutes', 'transformed', 'Chaplin', 'when', 'recut', 'film', 'added', 'narration', 'recorded', 'orchestral', 'score.The', '1942', 'edition', 'will', 'be', 'more', 'accessible', 'mainstream', 'audiences', 'shame', 'most', 'viewers', 'will', 'bypass', 'original', 'probably', 'grandest', 'silent-movie', 'entertainment', 'new', 'piano', 'track', 'Neil', 'Brand', 'even', 'more', 'zest', 'silent', 'Chaplin', 'Collection', '1942', 'film', 'great', 'most', 'wear', 'digitally', 'scrubbed', 'out.', 'videophiles', 'will', 'stay', 'Fox', '2001', 'release', 'bit', 'more', 'contrast', 'detail', 'tradeoff', 'wear', 'Warner', 'silent', 'sports', 'decent', 'restoration', 'job', 'Kevin', 'Brownlow', 'David', 'Gill', 'images', 'tend', 'be', 'flat', 'inconsistent', 'wear', 'Warner', 'two', 'versions', 'are', 'presented', 'full-screen', '1.33:1', 'Chaplin', 'intended', 'lacking', 'bit', 'picture', 'information', 'found', 'Fox', 'widow-boxed', 'film', '72-minutes', 'Warner', 'silent', 'subtly', 'different', 'updated', 'film.A', 'half-hour', 'MK2', 'TV', 'documentary', 'tale', 'production', 'started', 'Sierra', 'Nevada', 'retreating', 'elaborate', 'set', 'L.A.', 'where', '100', 'barrels', 'flour', 'stood', 'mountain', 'snow', 'docu', 'out', 'Chaplin', 'humor', 'frequently', 'revolved', 'hunger', 'curse', 'childhood', 'Gold', 'Rush', 'comic', 'tale', 'starving', 'prospectors', 'was', 'based', 'part', 'real-life', 'horrors', 'Donner', 'party', 'DVD', 'rare', 'outtakes', 'Big', 'Jim', 'miner', 'chasing', 'hallucinatory', 'chicken', 'Chaplin', 'woods.The', 'Chaplin', 'Collection', 'next', 'releases', 'due', 'early', '2004', 'include', 'Kid', 'City', 'Lights', 'Monsieur', 'Verdoux', 'Circus', 'Verdoux', 'are', 'double-disc', 'sets']",The Gold Rush
197684,A1XOZW9A8TL7JY,6300158772,Four Star Film Fan,"[0, 0]","In this Charlie Chaplin flick we follow the little man or the Tramp as he prospects for gold in the Yukon. All alone and cold he stumbles upon a cabin where a corrupt man lives. However, the weather wreaks havoc and the Tramp finds himself eventually left with a fellow prospector. After a time the two friends split up. In the city the little man finds love while his former partner meets up with trouble on the road. Eventually they  do reunite, strike it rich, and become millionaires. Along the way there are many characteristic Charlie Chaplin antics. It is extraordinary, because for a film that is not a ""talkie,"" The Gold Rush is surprisingly complex with humor, drama, and romance. If you take into consideration the era of this film, it is very good.",4,The Gold Rush (1925),1370044800,"06 1, 2013",2013,760,"['Charlie', 'Chaplin', 'flick', 'follow', 'little', 'man', 'Tramp', 'gold', 'Yukon', 'alone', 'cold', 'cabin', 'where', 'corrupt', 'man', 'However', 'weather', 'havoc', 'Tramp', 'eventually', 'left', 'fellow', 'prospector', 'time', 'two', 'friends', 'split', 'up', 'city', 'little', 'man', 'love', 'former', 'partner', 'up', 'trouble', 'road', 'Eventually', 'do', 'reunite', 'strike', 'rich', 'become', 'millionaires', 'way', 'are', 'many', 'characteristic', 'Charlie', 'Chaplin', 'antics', 'extraordinary', 'film', 'not', 'talkie', 'Gold', 'Rush', 'surprisingly', 'complex', 'humor', 'drama', 'romance', 'take', 'consideration', 'era', 'film', 'very', 'good']",The Gold Rush
197685,AK7D1BHZOSOL1,6300158772,General Pete,"[0, 0]","Sometimes it only takes a few words.  5 stars to Charlie who can still show everyone today that you don't have to have sound to be funny.  Even if you don't like silent movies you have to give this one a silent nod of respect and be sure to dance the ""roll dance.""",5,His Best Ever,1192060800,"10 11, 2007",2007,264,"['Sometimes', 'only', 'few', 'words', '5', 'stars', 'Charlie', 'who', 'can', 'still', 'show', 'everyone', 'today', 'do', ""n't"", 'have', 'have', 'sound', 'be', 'funny', 'Even', 'do', ""n't"", 'like', 'silent', 'movies', 'have', 'give', 'one', 'silent', 'nod', 'respect', 'be', 'sure', 'dance', 'roll', 'dance']",The Gold Rush
197686,A16CZRQL23NOIW,6300158772,Hiram Gomez Pardo,"[1, 1]","The gold rush is a extraordinary film . Moreover , it's a masterpiece . A careful work made for Charlot for all the viewers of the future .The script turns around the ancient myth of the easy richness ; the search of gold and the immortality behind an accident ; to find a gem of two pounds and live as a king in the earth . Hundred and hundred of human beings have played hard with this illusion . But just a few have had the weird privilige to trnsform their lives for this random cause .Charlot focuses his attention around the myth and the loss of humanity which this seek carries on its requirements .He will travel through this journey to show the dark side of these dreams ; the disventures and broken expectations ; the crewness and the greed ; the ambition and the selfishness ; the high prize you have to pay for that .Obviously this simply tale reminds us to Alberich (Gotterdammenung)who decides to steal the gold of the ring to win power and neglect the love .But Chaplin goes beyond the human ambitions and thanks to his character , he gets turn the rules of fate , showing a charming person and obviously to get unforgettable and immortal laughable sequences  which belongs to legend status .If you have not seen yet this film ; do not wait for acquiring . This film overpassed its own age and blended with the cinema myth to become in a reference issue now and ever.Refinement , beauty , naifness and eloquent visual speechs make this film a must see .The transfer to DVD is simply anthological.",5,One of the glorious masterpieces in any age !,1097020800,"10 6, 2004",2004,1511,"['gold', 'rush', 'extraordinary', 'film', 'Moreover', 'masterpiece', 'careful', 'work', 'made', 'Charlot', 'viewers', 'future', '.The', 'script', 'ancient', 'myth', 'easy', 'richness', 'search', 'gold', 'immortality', 'accident', 'find', 'gem', 'two', 'pounds', 'live', 'king', 'earth', 'Hundred', 'hundred', 'human', 'beings', 'have', 'played', 'hard', 'illusion', 'just', 'few', 'have', 'had', 'weird', 'privilige', 'trnsform', 'lives', 'random', 'cause', '.Charlot', 'attention', 'myth', 'loss', 'humanity', 'seek', 'requirements', '.He', 'will', 'travel', 'journey', 'show', 'dark', 'side', 'dreams', 'disventures', 'broken', 'expectations', 'crewness', 'greed', 'ambition', 'selfishness', 'high', 'prize', 'have', 'pay', '.Obviously', 'simply', 'tale', 'reminds', 'Alberich', 'Gotterdammenung', 'who', 'steal', 'gold', 'ring', 'win', 'power', 'neglect', 'love', '.But', 'Chaplin', 'human', 'ambitions', 'thanks', 'character', 'turn', 'rules', 'fate', 'showing', 'charming', 'person', 'obviously', 'get', 'unforgettable', 'immortal', 'laughable', 'sequences', 'belongs', 'legend', 'status', 'have', 'not', 'seen', 'yet', 'film', 'do', 'not', 'wait', 'acquiring', 'film', 'overpassed', 'own', 'age', 'blended', 'cinema', 'myth', 'become', 'reference', 'issue', 'now', 'ever.Refinement', 'beauty', 'naifness', 'eloquent', 'visual', 'speechs', 'make', 'film', 'must', 'see', '.The', 'transfer', 'DVD', 'simply', 'anthological']",The Gold Rush
197687,A2YNT4QDEQX30F,6300158772,H. Snyder,"[1, 1]","Chronicling the misadventures of Charlie Chaplin's tramp character in the gold fields of the Klondike in 1898, The Gold Rush is remembered for numerous iconic scenes, the two most famous being the eating of the boiled shoe, and the dance of the Oceana rolls. Criterion's recent release offers viewers a chance to own a piece of movie history, a film which is deservedly in the top-ten for box office receipts. Featuring newly restored prints of the original 1925 silent film as well as the 1942 sound-added re-issue, plus a fine lineup of extras, this home video permits an in-depth look at an all-time classic.Aside from early two-reelers, Chaplin retained ownership of his films. When he cut The Gold Rush from 89 minutes to 72 minutes for the 1942 re-issue, he ordered that all of the 1925 versions be destroyed. Fortunately, copies were too widely distributed for this to happen, and film historians Kevin Brownlow and David Gill combined two nearly complete prints to come up with a reconstructed version of the 1925 film. In comparing the two versions released 17 years apart, I was a bit surprised that the shortened film is actually superior, with Chaplin's narration delightful, and his music a real enhancement.I thought a reduction of 17 minutes in running time would mean the loss of large chunks of the story, but in fact nothing of importance was lost. The time difference was made up mostly by the removal of on-screen inter-titles, not needed in the 1942 narrated version; and tightening of scenes by trimming redundant footage. The only substantive alteration was slight, changing a cruel love-note joke perpetrated by a rival into a real note sent directly to ""the little fellow"", as Chaplin called his character.As is usually the case with Criterion, the extras alone are worth the price of admission. Among the extras are details of the rescue and restoration of the 1925 cut, the creation of special effects, an extensive interview with composer/conductor Timothy Brock about Chaplin's movie music, an audio commentary with the film, and an essay in booklet form. Another extra is an interview with a filmmaker in Burkina Faso, which includes scenes of African school children seeing Chaplin for the first time on a small television screen.While this film is a treasure for movie fanatics and Chaplin fans, it is first-time viewers who have the most to gain. For them The Gold Rush is a revelation, and it will remain a fond memory for life.",5,You Too Can Strike It Rich,1380326400,"09 28, 2013",2013,2462,"['Chronicling', 'misadventures', 'Charlie', 'Chaplin', 'tramp', 'character', 'gold', 'fields', 'Klondike', '1898', 'Gold', 'Rush', 'remembered', 'numerous', 'iconic', 'scenes', 'two', 'most', 'famous', 'being', 'eating', 'boiled', 'shoe', 'dance', 'Oceana', 'rolls', 'Criterion', 'recent', 'release', 'viewers', 'chance', 'own', 'piece', 'movie', 'history', 'film', 'deservedly', 'top-ten', 'box', 'office', 'receipts', 'Featuring', 'newly', 'restored', 'prints', 'original', '1925', 'silent', 'film', 'as', 'well', '1942', 'sound-added', 're-issue', 'fine', 'lineup', 'extras', 'home', 'video', 'in-depth', 'look', 'all-time', 'classic.Aside', 'early', 'two-reelers', 'Chaplin', 'retained', 'ownership', 'films', 'When', 'cut', 'Gold', 'Rush', '89', 'minutes', '72', 'minutes', '1942', 're-issue', 'ordered', '1925', 'versions', 'be', 'destroyed', 'Fortunately', 'copies', 'were', 'too', 'widely', 'distributed', 'happen', 'film', 'historians', 'Kevin', 'Brownlow', 'David', 'Gill', 'combined', 'two', 'nearly', 'complete', 'prints', 'come', 'up', 'reconstructed', 'version', '1925', 'film', 'comparing', 'two', 'versions', 'released', '17', 'years', 'apart', 'was', 'bit', 'surprised', 'shortened', 'film', 'actually', 'superior', 'Chaplin', 'narration', 'delightful', 'music', 'real', 'enhancement.I', 'thought', 'reduction', '17', 'minutes', 'running', 'time', 'would', 'mean', 'loss', 'large', 'chunks', 'story', 'fact', 'nothing', 'importance', 'was', 'lost', 'time', 'difference', 'was', 'made', 'up', 'mostly', 'removal', 'on-screen', 'inter-titles', 'not', 'needed', '1942', 'narrated', 'version', 'tightening', 'scenes', 'trimming', 'redundant', 'footage', 'only', 'substantive', 'alteration', 'was', 'slight', 'changing', 'cruel', 'love-note', 'joke', 'perpetrated', 'rival', 'real', 'note', 'sent', 'directly', 'little', 'fellow', 'Chaplin', 'called', 'character.As', 'usually', 'case', 'Criterion', 'extras', 'alone', 'are', 'worth', 'price', 'admission', 'extras', 'are', 'details', 'rescue', 'restoration', '1925', 'cut', 'creation', 'special', 'effects', 'extensive', 'interview', 'composer/conductor', 'Timothy', 'Brock', 'Chaplin', 'movie', 'music', 'audio', 'commentary', 'film', 'essay', 'booklet', 'form', 'extra', 'interview', 'filmmaker', 'Burkina', 'Faso', 'scenes', 'African', 'school', 'children', 'seeing', 'Chaplin', 'first', 'time', 'small', 'television', 'screen.While', 'film', 'treasure', 'movie', 'fanatics', 'Chaplin', 'fans', 'first-time', 'viewers', 'who', 'have', 'most', 'gain', 'Gold', 'Rush', 'revelation', 'will', 'remain', 'fond', 'memory', 'life']",The Gold Rush
197688,A2XLM6K0TS90NI,6300158772,"Iwa Iniki ""Kaiulanishinju""","[2, 4]",This is one of the funniest movies Charlie Chaplin ever made.  He was one of the best comedians and actors ever.,5,The Gold Rush,1353110400,"11 17, 2012",2012,112,"['one', 'funniest', 'movies', 'Charlie', 'Chaplin', 'ever', 'made', 'was', 'one', 'best', 'comedians', 'actors', 'ever']",The Gold Rush
