,reviewerID,asin,reviewerName,helpful,reviewText,overall,summary,unixReviewTime,reviewTime,reviewYear,reviewLength,meaningfulWords,Title
197696,A2R6RA8FRBS608,6300158772,Matthew G. Sherwin,"[2, 2]","I agree with the other reviewer who writes that this is indeed one of Chaplin's greatest films. He plays ""The Tramp,"" the role of the Everyman who in this story comes to the Klondike region to find gold during the Gold Rush of 1898. Despite his diminutive stature compared to other stalwart gold miners like ""Big Jim"" and the evil ""Black Larsen,"" Chaplin's character seems just as sturdy for the task in an incredibly harsh winter environment.At first The Tramp and Big Jim are duped by Black Larsen who is supposed to go out for food when they are all trapped in a cabin seeking shelter from unbearable cold. Black Larsen kills the lawmen after him and takes their food and possessions for himself. Yet good wins over evil-Black Larsen is killed by an avalanche! Big Jim is also a victim of a bad memory after a fight with Larsen. Yet in the end Jim and The Tramp become millionaires after striking gold!And there's romance, too! The Tramp meets and falls in love with Georgia, a young woman who came to the region to be a show girl at the local tavern. Georgia snubs The Tramp initially but things change for a happy ending-of course!I recommend this video for Chaplin fans and fans of the silent film era. It is an excellent example of silent film at its best. There is also a second version of the movie which was made in 1942 with Chaplin himself narrating.",5,A silent film classic that you will love!,1093824000,"08 30, 2004",2004,1362,"['agree', 'other', 'reviewer', 'who', 'indeed', 'one', 'Chaplin', 'greatest', 'films', 'Tramp', 'role', 'Everyman', 'who', 'story', 'Klondike', 'region', 'find', 'gold', 'Gold', 'Rush', '1898', 'diminutive', 'stature', 'compared', 'other', 'stalwart', 'gold', 'miners', 'Big', 'Jim', 'evil', 'Black', 'Larsen', 'Chaplin', 'character', 'just', 'sturdy', 'task', 'incredibly', 'harsh', 'winter', 'environment.At', 'first', 'Tramp', 'Big', 'Jim', 'are', 'duped', 'Black', 'Larsen', 'who', 'supposed', 'go', 'out', 'food', 'when', 'are', 'trapped', 'cabin', 'seeking', 'shelter', 'unbearable', 'cold', 'Black', 'Larsen', 'lawmen', 'food', 'possessions', 'Yet', 'good', 'wins', 'evil-Black', 'Larsen', 'killed', 'avalanche', 'Big', 'Jim', 'also', 'victim', 'bad', 'memory', 'fight', 'Larsen', 'end', 'Jim', 'Tramp', 'become', 'millionaires', 'striking', 'gold', 'romance', 'too', 'Tramp', 'meets', 'falls', 'love', 'Georgia', 'young', 'woman', 'who', 'came', 'region', 'be', 'show', 'girl', 'local', 'tavern', 'Georgia', 'snubs', 'Tramp', 'initially', 'things', 'change', 'happy', 'ending-of', 'course', 'recommend', 'video', 'Chaplin', 'fans', 'fans', 'silent', 'film', 'era', 'excellent', 'example', 'silent', 'film', 'best', 'also', 'second', 'version', 'movie', 'was', 'made', '1942', 'Chaplin', 'narrating']",The Gold Rush
197697,AJC962LFF93VC,6300158772,Michael Gebert,"[14, 14]","The real news here isn't the second video release of Chaplin's 1942 talkie reissue of the 1925 film, with narration in his plummy later voice detracting from much of the fun.  What's significant here is on Disc 2-- the first video release of a definitive version of the original silent classic, which has been restored by Kevin Brownlow and David Gill from Chaplin family material and is about 14 minutes longer and noticeably better quality than the best previous version, the Killiam print which had seen assorted releases on tape and laserdisc.  The Chaplin family had previously refused to release that version, believing that the 1942 version represented Chaplin's final thoughts on the film, when what it in fact represented was Chaplin's best idea of how to make an old silent film seem relevant to Casablanca-era audiences.  Now it's the '42 version which seems old fashioned, while the '25 one is timeless as ever.  Be sure you get this new Warner/MK2 version.",5,"At last, the REAL Gold Rush is on DVD",1058832000,"07 22, 2003",2003,969,"['real', 'news', 'here', ""n't"", 'second', 'video', 'release', 'Chaplin', '1942', 'talkie', 'reissue', '1925', 'film', 'narration', 'plummy', 'later', 'voice', 'detracting', 'much', 'fun', 'What', 'significant', 'here', 'Disc', '2', 'first', 'video', 'release', 'definitive', 'version', 'original', 'silent', 'classic', 'been', 'restored', 'Kevin', 'Brownlow', 'David', 'Gill', 'Chaplin', 'family', 'material', 'about', '14', 'minutes', 'longer', 'noticeably', 'better', 'quality', 'best', 'previous', 'version', 'Killiam', 'print', 'had', 'seen', 'assorted', 'releases', 'tape', 'laserdisc', 'Chaplin', 'family', 'had', 'previously', 'refused', 'release', 'version', 'believing', '1942', 'version', 'represented', 'Chaplin', 'final', 'thoughts', 'film', 'when', 'what', 'fact', 'represented', 'was', 'Chaplin', 'best', 'idea', 'how', 'make', 'old', 'silent', 'film', 'seem', 'relevant', 'Casablanca-era', 'audiences', 'Now', ""'42"", 'version', 'old', 'fashioned', ""'25"", 'one', 'timeless', 'ever', 'Be', 'sure', 'get', 'new', 'Warner/MK2', 'version']",The Gold Rush
197698,A22O522SB7L9OE,6300158772,M. Winelid,"[29, 31]","I cannot agree more with &quot;A viewer from Dallas, TX&quot; -- this 1942 version lessens the whole &quot;Gold Rush&quot; experience, even though the video quality is astounding. Having just watched &quot;The Kid&quot; and  &quot;City Lights&quot;, I found the commentary on this version most  annoying and distracting from Chaplin's fantastic pantomime. While in the  other films one becomes engrossed in the visual elements, in this version  of the film it is impossible to become fully involved, as the commentary  actually distances you from what is going on. It would be such a grave  mistake if this version would be the only one available for today's  audiences, so I urge and plead: Image, please release the original 1925  version on DVD too, please!",4,"Wrong version, Image DVD!",959212800,"05 25, 2000",2000,760,"['can', 'not', 'agree', 'more', 'quot', 'viewer', 'Dallas', 'TX', 'quot', '1942', 'version', 'whole', 'quot', 'Gold', 'Rush', 'quot', 'experience', 'even', 'video', 'quality', 'astounding', 'Having', 'just', 'watched', 'quot', 'Kid', 'quot', 'quot', 'City', 'Lights', 'quot', 'found', 'commentary', 'version', 'most', 'annoying', 'distracting', 'Chaplin', 'fantastic', 'pantomime', 'other', 'films', 'one', 'becomes', 'engrossed', 'visual', 'elements', 'version', 'film', 'impossible', 'become', 'fully', 'involved', 'commentary', 'actually', 'what', 'going', 'would', 'be', 'such', 'grave', 'mistake', 'version', 'would', 'be', 'only', 'one', 'available', 'today', 'audiences', 'urge', 'plead', 'Image', 'please', 'release', 'original', '1925', 'version', 'DVD', 'too', 'please']",The Gold Rush
197699,AL7LEBKKW8XCC,6300158772,"Neel Aroon ""jaroon7648""","[0, 4]","Gold Rush may not be Chaplin's best movie but the movie helps to showcase his talents as an actor and director. His talent took a while to develop, as can be seen in movies like Great Dictator and City Lights but Gold Rush helps to show where Chaplin started of from.",4,"not the best chaplin, but still good",1010880000,"01 13, 2002",2002,267,"['Gold', 'Rush', 'may', 'not', 'be', 'Chaplin', 'best', 'movie', 'movie', 'showcase', 'talents', 'actor', 'director', 'talent', 'took', 'while', 'develop', 'can', 'be', 'seen', 'movies', 'Great', 'Dictator', 'City', 'Lights', 'Gold', 'Rush', 'show', 'where', 'Chaplin', 'started']",The Gold Rush
197700,A12Y3GHRFRXBU,6300158772,OperablePig,"[11, 11]","The four stars goes to the DVD - I give the original silent version of GOld Rush 5 stars, and the re-edited sound-era version 2 stars. This DVD edition lost a star for putting the inferior remake on the first disc. I am mainly writing this review to urge Chaplin newcomers, or anyone for that matter, to watch the original 1925 version first. The re-release has highly distracting and tedious narration throughout the entire film, as all the intertitles have been deleted. At times this narration comes across as bad dubbing, as the words are very roughly synced up with characters talking on the screen. Even though Chaplin himself did the narration, the effect is very cheesy and amaturish, and makes the film MUCH more dated, while taking away much of the emotional effect of the original film. I also prefer the slightly longer, more dramatic 1925 edit, and the original ending, which is just perfect. It seems like the 1942 re-release was more of a gimmick and a chance to make an extra buck than a serious artistic endeavor (kind of like the Star Wars ""special editions""). Some would say that at least the re-release had Chaplin's own score. However I think the piano score for the silent version is excellent, despite reviews here to the contrary. First off, the score is based on the original cue sheets, so it is quite authentic to the time. It is played excellently, is well recorded, and is very fitting to the overall mood of the film.",4,silent version is one of my favorite films,1108944000,"02 21, 2005",2005,1447,"['four', 'stars', 'DVD', 'give', 'original', 'silent', 'version', 'GOld', 'Rush', '5', 'stars', 're-edited', 'sound-era', 'version', '2', 'stars', 'DVD', 'edition', 'lost', 'star', 'putting', 'inferior', 'remake', 'first', 'disc', 'am', 'mainly', 'writing', 'review', 'urge', 'Chaplin', 'newcomers', 'anyone', 'matter', 'watch', 'original', '1925', 'version', 'first', 're-release', 'highly', 'distracting', 'tedious', 'narration', 'entire', 'film', 'intertitles', 'have', 'been', 'deleted', 'times', 'narration', 'across', 'bad', 'dubbing', 'words', 'are', 'very', 'roughly', 'synced', 'up', 'characters', 'talking', 'screen', 'Even', 'Chaplin', 'did', 'narration', 'effect', 'very', 'cheesy', 'amaturish', 'film', 'MUCH', 'more', 'dated', 'taking', 'away', 'much', 'emotional', 'effect', 'original', 'film', 'also', 'prefer', 'slightly', 'longer', 'more', 'dramatic', '1925', 'edit', 'original', 'ending', 'just', 'perfect', '1942', 're-release', 'was', 'more', 'gimmick', 'chance', 'make', 'extra', 'buck', 'serious', 'artistic', 'endeavor', 'kind', 'Star', 'Wars', 'special', 'editions', 'would', 'say', 'least', 're-release', 'had', 'Chaplin', 'own', 'score', 'However', 'think', 'piano', 'score', 'silent', 'version', 'excellent', 'reviews', 'here', 'contrary', 'First', 'score', 'based', 'original', 'cue', 'sheets', 'quite', 'authentic', 'time', 'played', 'excellently', 'well', 'recorded', 'very', 'fitting', 'overall', 'mood', 'film']",The Gold Rush
197701,A1K2DQS4C373GM,6300158772,"Peter M. Haugo ""PeterHaugo""","[0, 2]","There was a problem with the product and the seller alleviated the situation. I definately would recommend this seller to anyone. They showed that they are truly dedicated to customer service. As for the film itself, very delightful. Chaplin wanted to be known for this movie the most. I don't know if I would say that this movie is as funny as some of his others but it is worth the time seeing.--peter  --jn 3:16",4,They took care of the problem,1351036800,"10 24, 2012",2012,414,"['was', 'problem', 'product', 'seller', 'alleviated', 'situation', 'definately', 'would', 'recommend', 'seller', 'anyone', 'showed', 'are', 'truly', 'dedicated', 'customer', 'service', 'film', 'very', 'delightful', 'Chaplin', 'wanted', 'be', 'known', 'movie', 'most', 'do', ""n't"", 'know', 'would', 'say', 'movie', 'as', 'funny', 'others', 'time', 'seeing.', 'peter', 'jn', '3:16']",The Gold Rush
197702,AGZVS6M8XJGN6,6300158772,"Roberto Frangie ""Robert""","[4, 4]","If any single figure can fairly be said to symbolize the glory years of the silent films--the cinema's truly international epoch--it is Charles Chaplin's indomitable tramp... The Little Fellow, as millions came to call him, was at once tatty and debonair, brow-beaten and irrepressibly optimistic--and he was, without question, the best-loved international star in all of film history...His coat was too small, his pants too large, his mustache patently false--and the resultant silhouette instantly recognizable wherever movies were shown... Charlie Chaplin's tramp spoke to all walks of life--and never more eloquently than in such silent films as ""The Kid,"" and ""The Gold Rush.""""The Gold Rush"" is superb... It deals with Charlie's adventures to win the affection of a local dance-hall girl, and his hilarious efforts to avoid being eaten by bears and by prospectors who are bigger and hungrier than he...The most memorable scene is one in which he dines on an old shoe... Chaplin's exquisite grace, turned the boiled shoe into a gourmet feast: he carves it carefully, smacks his lips in anticipation, and then eats it with gusto and appreciation, sucking the nails as if they contained the most juices and twirling the laces around his fork as if they were spaghetti...",5,The Little Fellow is simply superb!,1167609600,"01 1, 2007",2007,1272,"['single', 'figure', 'can', 'fairly', 'be', 'said', 'symbolize', 'glory', 'years', 'silent', 'films', 'cinema', 'truly', 'international', 'epoch', 'Charles', 'Chaplin', 'indomitable', 'tramp', 'Little', 'Fellow', 'millions', 'came', 'call', 'was', 'once', 'tatty', 'debonair', 'brow-beaten', 'irrepressibly', 'optimistic', 'was', 'question', 'best-loved', 'international', 'star', 'film', 'history', 'coat', 'was', 'too', 'small', 'pants', 'too', 'large', 'mustache', 'patently', 'false', 'resultant', 'silhouette', 'instantly', 'recognizable', 'wherever', 'movies', 'were', 'shown', 'Charlie', 'Chaplin', 'tramp', 'spoke', 'walks', 'life', 'never', 'more', 'eloquently', 'such', 'silent', 'films', 'Kid', 'Gold', 'Rush', 'Gold', 'Rush', 'superb', 'Charlie', 'adventures', 'win', 'affection', 'local', 'dance-hall', 'girl', 'hilarious', 'efforts', 'avoid', 'being', 'eaten', 'bears', 'prospectors', 'who', 'are', 'bigger', 'hungrier', 'most', 'memorable', 'scene', 'one', 'old', 'shoe', 'Chaplin', 'exquisite', 'grace', 'turned', 'boiled', 'shoe', 'gourmet', 'feast', 'carefully', 'lips', 'anticipation', 'then', 'eats', 'gusto', 'appreciation', 'sucking', 'nails', 'contained', 'most', 'juices', 'twirling', 'laces', 'fork', 'were', 'spaghetti']",The Gold Rush
197703,A1ABDWJU9RTUWU,6300158772,Rockinghorse Winner,"[1, 1]","It's hard to say which Chaplin masterpiece is the *best.* But having just viewed this 1925 release I have to say that right now I would have to give that honor to this film.  Why?  Well, to start with, it is really quite funny.  Just watch Big Jim Mckay's face during the famous *cooked shoe* scene. No straight man has ever played it straighter or funnier. There's the *dog tied to his belt* scene, the *house perched on a cliff* scene, the *chicken suit* scene, all seasoned with Chaplin's small detailed quirks that make repeated watchings rewarding.Second, the supporting cast is extraordinary, perhaps the best in any other Chaplin film except perhaps A Woman of Paris.  The comedy is shared by Chaplin with these capable folk, and the result is very very funny.  A special nod must go to Georgia Hale, who turns in a great performance as the love interest.  The scene when she comes into Chaplin's empty cabin on New Years Eve, and realizes what she has done to him is a performance for the ages.The look of the film is very fine.  All the outdoor scenes really do look like they were shot in a blizzard.  The interiors are very detailed and interesting.  I don't think Chaplin paid so much attention to detail as in this film.Lastly, one must say something about the dramatic elements of this film. Much has been written about Chaplin's sentimentality.  While there is that here, there is also a very faithful rendering of romantic isolation which comes off VERY authentically, very powerfully.  The scene of Chaplin standing in his room, listening to the New Year's Eve bar crowd is exquisitely heart-rending.  Chaplin expresses it all with his still back to the camera. Amazing.",5,The Best,1145836800,"04 24, 2006",2006,1687,"['hard', 'say', 'Chaplin', 'masterpiece', '*best', '*', 'having', 'just', 'viewed', '1925', 'release', 'have', 'say', 'right', 'now', 'would', 'have', 'give', 'honor', 'film', 'Why', 'Well', 'start', 'really', 'quite', 'funny', 'Just', 'watch', 'Big', 'Jim', 'Mckay', 'face', 'famous', '*cooked', 'shoe*', 'scene', 'straight', 'man', 'ever', 'played', 'straighter', 'funnier', '*dog', 'tied', 'belt*', 'scene', '*house', 'perched', 'cliff*', 'scene', '*chicken', 'suit*', 'scene', 'seasoned', 'Chaplin', 'small', 'detailed', 'quirks', 'make', 'repeated', 'watchings', 'rewarding.Second', 'supporting', 'cast', 'extraordinary', 'perhaps', 'best', 'other', 'Chaplin', 'film', 'perhaps', 'A', 'Woman', 'Paris', 'comedy', 'shared', 'Chaplin', 'capable', 'folk', 'result', 'very', 'very', 'funny', 'special', 'nod', 'must', 'go', 'Georgia', 'Hale', 'who', 'great', 'performance', 'love', 'interest', 'scene', 'when', 'Chaplin', 'empty', 'cabin', 'New', 'Years', 'Eve', 'what', 'done', 'performance', 'ages.The', 'look', 'film', 'very', 'fine', 'outdoor', 'scenes', 'really', 'do', 'look', 'were', 'shot', 'blizzard', 'interiors', 'are', 'very', 'detailed', 'interesting', 'do', ""n't"", 'think', 'Chaplin', 'paid', 'so', 'much', 'attention', 'detail', 'film.Lastly', 'must', 'say', 'something', 'dramatic', 'elements', 'film', 'Much', 'been', 'written', 'Chaplin', 'sentimentality', 'here', 'also', 'very', 'faithful', 'rendering', 'romantic', 'isolation', 'off', 'VERY', 'authentically', 'very', 'powerfully', 'scene', 'Chaplin', 'standing', 'room', 'listening', 'New', 'Year', 'Eve', 'bar', 'crowd', 'exquisitely', 'heart-rending', 'Chaplin', 'still', 'back', 'camera', 'Amazing']",The Gold Rush
197704,A1CITRQE2HRW45,6300158772,"Scamp Lumm ""Littlesorrel/christian zionist""","[2, 2]","Charlie Chaplin, 'the little fellow', in this movie, backpacks into the wilderness of Alaska in search of gold.  He shacks up with two other grizzly fellows, Black Larsen and Big Jim McKay high up in the mountains.  Friends are scarce, except for a few four-legged, furry ones and so is food.  Thanksgiving fare consists of boiled shoe with a side of shoe strings.  After so many days without food, Big Jim starts hallucinating and sees a gigantic, walking chicken in their cabin without wondering where has 'the little fellow' gone.  Luckily for Charlie, a four legged critter soon walks through the door.  Such is the life of lone prospectors.  'The little fellow' later ventures down into the valley and discovers Georgia, a dance hall girl, in the mining town.The second disc contains the original silent film made in 1925; the first disc has the 1942 version which Charlie Chaplin narrates.  The second disc also explains how and where the movie was made and what gave Charlie Chaplin the inspiration to make it.  Neither disc explains how they managed to get a black bear to follow Charlie in one of the opening scenes of the film-that's what I'd like to know!  If you need a good laugh, The Gold Rush will give you the giggles.  I love this movie!  I have yet to see a bad Charlie Chaplin film.  I'm not sure which one's my favorite-I love them all!",5,"""We Shall Be Millionaires!""-Prospector Big Jim",1099958400,"11 9, 2004",2004,1356,"['Charlie', 'Chaplin', 'little', 'fellow', 'movie', 'wilderness', 'Alaska', 'search', 'gold', 'up', 'two', 'other', 'grizzly', 'fellows', 'Black', 'Larsen', 'Big', 'Jim', 'McKay', 'high', 'up', 'mountains', 'Friends', 'are', 'scarce', 'few', 'four-legged', 'furry', 'ones', 'so', 'food', 'Thanksgiving', 'fare', 'boiled', 'shoe', 'side', 'shoe', 'strings', 'so', 'many', 'days', 'food', 'Big', 'Jim', 'hallucinating', 'gigantic', 'walking', 'chicken', 'cabin', 'wondering', 'where', ""'the"", 'little', 'fellow', 'gone', 'Luckily', 'Charlie', 'four', 'legged', 'critter', 'soon', 'walks', 'door', 'Such', 'life', 'lone', 'prospectors', 'little', 'fellow', 'later', 'ventures', 'down', 'valley', 'discovers', 'Georgia', 'dance', 'hall', 'girl', 'mining', 'town.The', 'second', 'disc', 'original', 'silent', 'film', 'made', '1925', 'first', 'disc', '1942', 'version', 'Charlie', 'Chaplin', 'second', 'disc', 'also', 'how', 'where', 'movie', 'was', 'made', 'what', 'gave', 'Charlie', 'Chaplin', 'inspiration', 'make', 'disc', 'how', 'managed', 'get', 'black', 'bear', 'follow', 'Charlie', 'one', 'opening', 'scenes', 'film-that', 'what', ""'d"", 'like', 'know', 'need', 'good', 'laugh', 'Gold', 'Rush', 'will', 'give', 'giggles', 'love', 'movie', 'have', 'yet', 'see', 'bad', 'Charlie', 'Chaplin', 'film', ""'m"", 'not', 'sure', 'one', 'favorite-I', 'love']",The Gold Rush
197705,A1J03J0HZ7KU5T,6300158772,Scott T. Rivers,"[1, 1]","Despite one's preference for ""Modern Times,"" the original release of Charlie Chaplin's ""The Gold Rush"" remains the best structured of his feature-length films. Everything works beautifully in this epic comedy-drama, with the pathos and humor perfectly integrated. The comic setpieces are too numerous to mention, but a personal favorite is the classic ""Dance of the Rolls."" Warner's two-disc set is worth owning for the wonderfully restored 1925 silent version - far superior to Chaplin's mutilated 1942 reissue.",5,Chaplin's Klondike Epic,1119225600,"06 20, 2005",2005,512,"['one', 'preference', 'Modern', 'Times', 'original', 'release', 'Charlie', 'Chaplin', 'Gold', 'Rush', 'best', 'structured', 'feature-length', 'films', 'Everything', 'works', 'beautifully', 'epic', 'comedy-drama', 'pathos', 'humor', 'perfectly', 'integrated', 'comic', 'setpieces', 'are', 'too', 'numerous', 'mention', 'personal', 'favorite', 'classic', 'Dance', 'Rolls', 'Warner', 'two-disc', 'set', 'worth', 'owning', 'wonderfully', 'restored', '1925', 'silent', 'version', 'far', 'superior', 'Chaplin', 'mutilated', '1942', 'reissue']",The Gold Rush
197706,A14GEK6M9GQADJ,6300158772,"S. D. Wauneka ""Names72""","[0, 1]",Started watching Charlie at a very young age. This DVD is grand. The picture quality is great. Two version of the film included. Original release and a Charlie Chaplin Approved version. A lot of interesting facts in the booklet included. Thank you for this DVD. Do buy this DVD.,5,Love It,1362873600,"03 10, 2013",2013,278,"['Started', 'watching', 'Charlie', 'very', 'young', 'age', 'DVD', 'grand', 'picture', 'quality', 'great', 'Two', 'version', 'film', 'included', 'Original', 'release', 'Charlie', 'Chaplin', 'Approved', 'version', 'lot', 'interesting', 'facts', 'booklet', 'included', 'Thank', 'DVD', 'Do', 'buy', 'DVD']",The Gold Rush
197707,A3U56M0Y8LYO6J,6300158772,"Steven Y. ""Pop Culture Addict""","[0, 15]","Charlie Chaplin's ""The Gold Rush"" is a mixed bag.  The film itself is uneven as it is entertaining for certain stretches and just adequate in others.  Yet the general public as a whole still owe it a measure of thanks for its contribution of the wonderful ""dancing bread rolls"" sequence to cinema lore.  Playing with one's food was never so visually amusing.The Tramp (Chaplin) tries his luck at prospecting for gold but finds himself being harassed by the nasty weather, a criminal on the loose named Black Larson (Tom Murray), and a desperate and hungry man named Big Jim McKay (Mack Swain).  Failing to strike it rich despite his best efforts, The Tramp treks to a nearby village to start over.  A village woman named Georgia (Georgia Hale) catches his eye and soon The Tramp is using all the resources at his disposal to prepare a memorable New Year's Eve dinner for her.In the pantheon of Chaplin works, ""The Gold Rush"" ranks behind ""City Lights"" (1931), and ""The Great Dictator"" (1940), and is generally on par with ""Modern Times"" (1936).  In other words, this film is a serviceable Chaplin vehicle but nothing more than that.  The silent comedian is his usual charming self from the moment he first appears and he marvelously displays that impeccable comic timing that made him so great at physical comedy in every routine he finds himself in.  But ""The Gold Rush"" flounders because the material he is working with this time around is not that strong.  The pathos and social relevance that define Chaplin's better efforts are in short supply here and the film suffers for it.",2,"""Fate guided them to a spot where all was calm.""",1079568000,"03 18, 2004",2004,1582,"['Charlie', 'Chaplin', 'Gold', 'Rush', 'mixed', 'bag', 'film', 'uneven', 'entertaining', 'certain', 'stretches', 'just', 'adequate', 'others', 'general', 'public', 'whole', 'still', 'measure', 'thanks', 'contribution', 'wonderful', 'dancing', 'bread', 'rolls', 'sequence', 'cinema', 'lore', 'Playing', 'one', 'food', 'was', 'never', 'so', 'visually', 'amusing.The', 'Tramp', 'Chaplin', 'luck', 'prospecting', 'gold', 'being', 'harassed', 'nasty', 'weather', 'criminal', 'loose', 'named', 'Black', 'Larson', 'Tom', 'Murray', 'desperate', 'hungry', 'man', 'named', 'Big', 'Jim', 'McKay', 'Mack', 'Swain', 'Failing', 'strike', 'rich', 'best', 'efforts', 'Tramp', 'treks', 'nearby', 'village', 'start', 'over', 'village', 'woman', 'named', 'Georgia', 'Georgia', 'Hale', 'eye', 'soon', 'Tramp', 'using', 'resources', 'disposal', 'prepare', 'memorable', 'New', 'Year', 'Eve', 'dinner', 'pantheon', 'Chaplin', 'works', 'Gold', 'Rush', 'City', 'Lights', '1931', 'Great', 'Dictator', '1940', 'generally', 'par', 'Modern', 'Times', '1936', 'other', 'words', 'film', 'serviceable', 'Chaplin', 'vehicle', 'nothing', 'more', 'silent', 'comedian', 'usual', 'charming', 'self', 'moment', 'first', 'marvelously', 'impeccable', 'comic', 'timing', 'made', 'so', 'great', 'physical', 'comedy', 'routine', 'Gold', 'Rush', 'flounders', 'material', 'working', 'time', 'around', 'not', 'strong', 'pathos', 'social', 'relevance', 'Chaplin', 'better', 'efforts', 'are', 'short', 'supply', 'here', 'film', 'suffers']",The Gold Rush
