,reviewerID,asin,reviewerName,helpful,reviewText,overall,summary,unixReviewTime,reviewTime,reviewYear,reviewLength,meaningfulWords,Title
257717,A2168F211PR3O7,630159942X,"Marvin P. Ferguson ""book fergy""","[1, 1]","Lou Gehrig is the pride of the New York Yankees. No doubt about it. A young boy's dreams are turned into reality for this Hall-of-Fame baseball player when he signs up with the New York Yankees along with other greats like Babe Ruth.In his role as Lou Gehrig, Gary Cooper does an excellent job portraying this true to life character. Put yourself in Lou's shoes and feel the heart beat of your pause as this boy struggles from the beginning of his boyhood life to his success as a New York Yankee, and then to be challenged with a devastating illness.I like to watch biographies about great baseball hero's like Lou Gehrig who brought lots of excitement and cheers to baseball fanatics. Yes, the pride of the Yankees is an inspiring sports classic that brought a lot of dignity to the game of baseball. And what baseball fan could ever forget this bigger than life character? I like this movie, give it five stars, and encourage everybody to watch it. Marvin P. Ferguson, author of THE UNKNOWN BASEBALL PLAYER.",5,Bigger Than Life,1401667200,"06 2, 2014",2014,1010,"['Lou', 'Gehrig', 'pride', 'New', 'York', 'Yankees', 'doubt', 'young', 'boy', 'dreams', 'are', 'turned', 'reality', 'Hall-of-Fame', 'baseball', 'player', 'when', 'signs', 'up', 'New', 'York', 'other', 'greats', 'Babe', 'Ruth.In', 'role', 'Lou', 'Gehrig', 'Gary', 'Cooper', 'excellent', 'job', 'portraying', 'true', 'life', 'character', 'Put', 'Lou', 'shoes', 'feel', 'heart', 'beat', 'pause', 'boy', 'beginning', 'boyhood', 'life', 'success', 'New', 'York', 'Yankee', 'then', 'be', 'challenged', 'devastating', 'illness.I', 'watch', 'biographies', 'great', 'baseball', 'hero', 'Lou', 'Gehrig', 'who', 'brought', 'lots', 'excitement', 'cheers', 'baseball', 'fanatics', 'Yes', 'pride', 'Yankees', 'inspiring', 'sports', 'classic', 'brought', 'lot', 'dignity', 'game', 'baseball', 'what', 'baseball', 'fan', 'could', 'ever', 'forget', 'bigger', 'life', 'character', 'movie', 'give', 'five', 'stars', 'encourage', 'everybody', 'watch', 'Marvin', 'P.', 'Ferguson', 'author', 'THE', 'UNKNOWN', 'BASEBALL', 'PLAYER']",N/A
257718,A3JJ1P31SKK1UE,630159942X,"Michael A. Cortez ""michael angel cortez""","[0, 0]",i have the annuversery edition and just ordered the coolectors edition. the film is one of base balls famouse films to come out. back then and still today. give it a shot,5,pride of the yankees,1207785600,"04 10, 2008",2008,170,"['i', 'have', 'annuversery', 'edition', 'just', 'ordered', 'coolectors', 'edition', 'film', 'one', 'base', 'balls', 'famouse', 'films', 'come', 'out', 'back', 'then', 'still', 'today', 'give', 'shot']",N/A
257719,A1CDNTB7377YH2,630159942X,Michael A. Newman,"[4, 4]","This may not be the best baseball movie made but it is definately my favorite!  It is a little campy at times but Babe Ruth gives an enjoyable and convincing portrayal of himself and other greats including Bill Dickey also appear.Teresa Wright and Gary Cooper have great chemistry and their interactions are classic 1940's.  The movie does stretch the truth somewhat (Gerhig promising to hit three home runs for a crippled boy and hitting the third in dramatic fashion, never occurred) but it is all in good fun.Walter Brennen is phenominal as the friendly reporter who follows Gehrig from city to city and chronicles his career.There are priceless scenes on trains as the Yankees traveled from city to city (this has been replaced by corporate and charter jets) especially when the player try to make Babe Ruth angry!The re-creation of Gehrig's farewell at Yankee Stadium is one of the most heart warming scenes in movie history!",5,My Favorite Baseball Movie!,1106784000,"01 27, 2005",2005,930,"['may', 'not', 'be', 'best', 'baseball', 'movie', 'made', 'definately', 'favorite', 'little', 'campy', 'times', 'Babe', 'Ruth', 'enjoyable', 'convincing', 'portrayal', 'other', 'greats', 'including', 'Bill', 'Dickey', 'also', 'appear.Teresa', 'Wright', 'Gary', 'Cooper', 'have', 'great', 'chemistry', 'interactions', 'are', 'classic', '1940', 'movie', 'stretch', 'truth', 'somewhat', 'Gerhig', 'promising', 'hit', 'three', 'home', 'runs', 'crippled', 'boy', 'hitting', 'third', 'dramatic', 'fashion', 'never', 'occurred', 'all', 'good', 'fun.Walter', 'Brennen', 'phenominal', 'friendly', 'reporter', 'who', 'Gehrig', 'city', 'city', 'career.There', 'are', 'priceless', 'scenes', 'trains', 'Yankees', 'traveled', 'city', 'city', 'been', 'replaced', 'corporate', 'charter', 'jets', 'especially', 'when', 'player', 'try', 'make', 'Babe', 'Ruth', 'angry', 're-creation', 'Gehrig', 'farewell', 'Yankee', 'Stadium', 'one', 'most', 'heart', 'warming', 'scenes', 'movie', 'history']",N/A
257720,A2VPEDJQCOQM9D,630159942X,"Mr. Dana ""Dana_Franklin""","[0, 0]","What a wonderful, and touching movie.  I first saw this about eight years ago and my wife and I loved it.  I wanted to have a copy of this wonderful movie.  It was a time when baseball was more about what was one the field, that upstairs in the Corporate Offices (with some obivious exceptions).  The story behind one of Baseball's all time great legends is a must for your collection.",5,Touching Movie,1374192000,"07 19, 2013",2013,385,"['What', 'wonderful', 'touching', 'movie', 'first', 'saw', 'eight', 'years', 'ago', 'wife', 'loved', 'wanted', 'have', 'copy', 'wonderful', 'movie', 'was', 'time', 'when', 'baseball', 'was', 'more', 'what', 'was', 'one', 'field', 'Corporate', 'Offices', 'obivious', 'exceptions', 'story', 'one', 'Baseball', 'time', 'great', 'legends', 'must', 'collection']",N/A
257721,AB5DVSNPX1JSK,630159942X,"Mr. Fisher ""grand_clown""","[9, 9]","Arguably the greatest sports biography ever filmed, the movie that encompasses the life of Lou Gehrig is remarkable.  Nominated for best picture and actor in 1943, the film is an inspirational and emotionally charged story about one man in both life and sport that was and is loved even to this day.  Lou Gehrig (G. Cooper) is portrayed as an honest, simple and selfless man who simply wants to play the game of baseball.  Although he means well, Gehrig is depicted as being both clumsy and reckless in his pursuit of the game.  The film begins with Gehrig as a young, poor immigrant boy who yearns to play ball but is pressured by his mother to become an engineer in college.  Being a mama's boy, Gehrig does what his mother wants and heads for college to become successful and rich.  When his mother grows ill, Gehrig finds himself in desperate need for money.  While playing ball on the side in college, a scout for the New York Yankees (W. Brennan) spots him and wants him to sign a contract.  Needing the money Gehrig accepts and the rest is Major League Baseball history.The great thing about this movie is that it doesn't entirely focus on Gehrig's success on the diamond, but his success as a man.  We learn of Gehrig's internal struggles with his mother, his subtle rivalry with teamate Babe Ruth (who portrays himself in this film), and his loving relationship with his wife (T. Wright) which gives a full biography of his greatness.As the film moves on from Gehrig's early years as a Yankee to a superstar and ""The Iron Horse"" of Baseball, the climax is revealed as an unfortunate turn for the worse.  The tragedy over Lou Gehrig's life is what detours this film from a giddy feel good bio of a great athlete and man to a movie about physical decline and death, while facing all these inevitable fates with dignity and honor.  The movie is humbling, to say the least, and powerful with hope.  It's difficult not to get choked up as the final scene fades away.Like all good sports films, the success of it isn't in the sport itself or the record setting highlights of a memorable career.  The success is in the human development of the real life character(s) and their real life struggles.  As imagined, this isn't a story about home runs or Lou Gehrig winning the World Series.  It's about Lou Gehrig---the man.One cannot say enough for the realism Gary Cooper poured into the character of Lou Gehrig.  After seeing real footage of Gehrig the likeness between both the athlete and actor are eerie in its similarity.  Gary Cooper won the oscar the year before for his role as Sgt. Alvin York and ten years later as Will Kane in ""High Noon,"" but in the humble opinion of this reviewer this was his finest performance of his entire career.There is no warnings to speak of with this movie.  In 1943 there were no such things as rating systems because movies didn't have to be rated.  The only thing to keep in mind is that the movie does end in a form of tragedy, which may come across as depressing to certain audiences.In summary, ""Pride of the Yankees"" is one of the best films of the 1940s and is easily among the greatest sports films ever done.  It is important to note that it is also a rareity for Hollywood to focus a story on a clean and uncontroversial athlete, such as Gehrig, whereas in recent sports biographies over Muhammed Ali and Babe Ruth have nothing but controversy painted all over them. It can be said that hope can sell over controversy.",5,Pride of the 40's,1151193600,"06 25, 2006",2006,3468,"['Arguably', 'greatest', 'sports', 'biography', 'ever', 'filmed', 'movie', 'life', 'Lou', 'Gehrig', 'remarkable', 'Nominated', 'best', 'picture', 'actor', '1943', 'film', 'inspirational', 'emotionally', 'charged', 'story', 'one', 'man', 'life', 'sport', 'was', 'loved', 'even', 'day', 'Lou', 'Gehrig', 'G.', 'Cooper', 'portrayed', 'honest', 'simple', 'selfless', 'man', 'who', 'simply', 'play', 'game', 'baseball', 'well', 'Gehrig', 'depicted', 'being', 'clumsy', 'reckless', 'pursuit', 'game', 'film', 'Gehrig', 'young', 'poor', 'immigrant', 'boy', 'who', 'play', 'ball', 'pressured', 'mother', 'become', 'engineer', 'college', 'Being', 'mama', 'boy', 'Gehrig', 'what', 'mother', 'heads', 'college', 'become', 'successful', 'rich', 'When', 'mother', 'grows', 'ill', 'Gehrig', 'desperate', 'need', 'money', 'playing', 'ball', 'side', 'college', 'scout', 'New', 'York', 'Yankees', 'W.', 'Brennan', 'spots', 'sign', 'contract', 'Needing', 'money', 'Gehrig', 'accepts', 'rest', 'Major', 'League', 'Baseball', 'great', 'thing', 'movie', ""n't"", 'entirely', 'focus', 'Gehrig', 'success', 'diamond', 'success', 'man', 'learn', 'Gehrig', 'internal', 'struggles', 'mother', 'subtle', 'rivalry', 'teamate', 'Babe', 'Ruth', 'who', 'film', 'loving', 'relationship', 'wife', 'T.', 'Wright', 'full', 'biography', 'greatness.As', 'film', 'moves', 'Gehrig', 'early', 'years', 'Yankee', 'superstar', 'Iron', 'Horse', 'Baseball', 'climax', 'revealed', 'unfortunate', 'turn', 'worse', 'tragedy', 'Lou', 'Gehrig', 'life', 'what', 'film', 'giddy', 'feel', 'good', 'bio', 'great', 'athlete', 'man', 'movie', 'physical', 'decline', 'death', 'facing', 'inevitable', 'fates', 'dignity', 'honor', 'movie', 'humbling', 'say', 'least', 'powerful', 'hope', 'difficult', 'not', 'get', 'choked', 'up', 'final', 'scene', 'fades', 'good', 'sports', 'films', 'success', ""n't"", 'sport', 'record', 'setting', 'highlights', 'memorable', 'career', 'success', 'human', 'development', 'real', 'life', 'character', 's', 'real', 'life', 'struggles', 'imagined', ""n't"", 'story', 'home', 'runs', 'Lou', 'Gehrig', 'winning', 'World', 'Series', 'Lou', 'Gehrig', '-the', 'man.One', 'can', 'not', 'say', 'enough', 'realism', 'Gary', 'Cooper', 'poured', 'character', 'Lou', 'Gehrig', 'seeing', 'real', 'footage', 'Gehrig', 'likeness', 'athlete', 'actor', 'are', 'eerie', 'similarity', 'Gary', 'Cooper', 'won', 'oscar', 'year', 'role', 'Sgt', 'Alvin', 'York', 'ten', 'years', 'later', 'Will', 'Kane', 'High', 'Noon', 'humble', 'opinion', 'reviewer', 'was', 'finest', 'performance', 'entire', 'career.There', 'warnings', 'speak', 'movie', '1943', 'were', 'such', 'things', 'rating', 'systems', 'movies', 'did', ""n't"", 'have', 'be', 'rated', 'only', 'thing', 'keep', 'mind', 'movie', 'end', 'form', 'tragedy', 'may', 'come', 'depressing', 'certain', 'audiences.In', 'summary', 'Pride', 'Yankees', 'one', 'best', 'films', '1940s', 'easily', 'greatest', 'sports', 'films', 'ever', 'done', 'important', 'note', 'also', 'rareity', 'Hollywood', 'focus', 'story', 'clean', 'uncontroversial', 'athlete', 'such', 'Gehrig', 'whereas', 'recent', 'sports', 'biographies', 'Muhammed', 'Ali', 'Babe', 'Ruth', 'have', 'nothing', 'controversy', 'painted', 'can', 'be', 'said', 'hope', 'can', 'sell', 'controversy']",N/A
257722,A1LDQF92H8UXIJ,630159942X,msmartha,"[0, 0]",I have since read Eleanor Gehrig's book &#34;My Luke and I&#34; and have seen the movie based on that book. This was the first however and I am glad to have it,5,A classic,1377993600,"09 1, 2013",2013,159,"['have', 'read', 'Eleanor', 'Gehrig', 'book', '34', 'Luke', '34', 'have', 'seen', 'movie', 'based', 'book', 'was', 'first', 'however', 'am', 'glad', 'have']",N/A
257723,A3G31GW1MCNQXJ,630159942X,Nan,"[0, 0]","I saw this movie when I was a boy playing baseball and remembered how much I enjoyed it, it's a classic made the way movies should still be made. A movie for all ages.",5,the pride of the yankees,1383091200,"10 30, 2013",2013,167,"['saw', 'movie', 'when', 'was', 'boy', 'playing', 'baseball', 'remembered', 'how', 'much', 'enjoyed', 'classic', 'made', 'way', 'movies', 'should', 'still', 'be', 'made', 'movie', 'ages']",N/A
257724,A35ZNG4UY9VOWL,630159942X,Paul G. Maier,"[0, 0]","Saw it when it first came out ( I'm an Old Veteran - who loves movies). One of Gary Coopers best Movies, and with superb back-up actors with him. Still get a Lump in my throat at the End!",5,Wonderful!,1386288000,"12 6, 2013",2013,187,"['Saw', 'when', 'first', 'came', 'out', ""'m"", 'Old', 'Veteran', 'who', 'movies', 'One', 'Gary', 'Coopers', 'best', 'Movies', 'superb', 'back-up', 'actors', 'Still', 'get', 'Lump', 'throat', 'End']",N/A
257725,AHRBR6Z4QDG69,630159942X,Paul W. Siegel,"[0, 0]",ONE OF THE GREATEST MOVIES OF ALL TIME. GARY COOPER AT HIS BEST. A CLASSIC FOR ALL TIME AND ALWAYS WILLBE,5,GREAT MOVIE I ENJOYED IT.,1386201600,"12 5, 2013",2013,105,"['ONE', 'THE', 'GREATEST', 'MOVIES', 'ALL', 'TIME', 'GARY', 'COOPER', 'AT', 'HIS', 'BEST', 'A', 'CLASSIC', 'ALL', 'TIME', 'AND', 'ALWAYS', 'WILLBE']",N/A
257726,A1GHZUC1SD5XKV,630159942X,"P. Conable ""Pat C""","[0, 0]",This was another older movie given to a baseball loving grandson. He knew of the Lou Gehrig fame from his collecting cards & books of baseball involved people. This was not a disappointment to him at all. He really was very pleased with it.,5,This Story of Lou Gehrig Never Out Of Date,1371945600,"06 23, 2013",2013,240,"['was', 'older', 'movie', 'given', 'baseball', 'loving', 'grandson', 'knew', 'Lou', 'Gehrig', 'fame', 'collecting', 'cards', 'books', 'baseball', 'involved', 'people', 'was', 'not', 'disappointment', 'really', 'was', 'very', 'pleased']",N/A
257727,A1Q1AAL99NKJD1,630159942X,Penny Robichaux-Koontz,"[0, 0]",This is a fabulous movie with a powerful story line.  Romance and commitment that is necessary in times of trouble. A moving story of a life well lived.,5,The Pride of the Yankees,1285545600,"09 27, 2010",2010,152,"['fabulous', 'movie', 'powerful', 'story', 'line', 'Romance', 'commitment', 'necessary', 'times', 'trouble', 'moving', 'story', 'life', 'well', 'lived']",N/A
257728,AL9TBVIEZJUNW,630159942X,Philly,"[4, 16]","How many editions are there going to be? They have special editions, ultimate, anniversary, etc. Instead of coming out with the same movie over and over again, how about putting some more classics out there. The African Queen, Cavalcade, Samson and Delilah and The Uninvited, to name just 4, still aren't on DVD yet!",1,NOT ANOTHER EDITION!,1216598400,"07 21, 2008",2008,316,"['How', 'many', 'editions', 'are', 'there', 'going', 'be', 'have', 'special', 'editions', 'ultimate', 'anniversary', 'etc', 'Instead', 'coming', 'out', 'same', 'movie', 'over', 'again', 'how', 'putting', 'more', 'classics', 'there', 'African', 'Queen', 'Cavalcade', 'Samson', 'Delilah', 'Uninvited', 'name', 'just', '4', 'still', 'are', ""n't"", 'DVD', 'yet']",N/A
257729,A2P1R6NGWALE85,630159942X,"PJ ""arataman_79""","[3, 3]","&quot;Pride of the Yankees&quot; is possibly the greatest  movie ever made on the topic of baseball. I'm a sap when it comes to Gary Cooper and after seeing this film I became more and more interested in Baseball. I'm a  basketcase at the end of the movie when Coop makes his farewell speech as  I'm sure are millions of other guys. Of course a lot of the film's  greatness is lost due to the annoying coloroization but see it anyway if  you havn't yet. Colorized or not, it's still a great film.",5,A great movie with an ugly colorization,936316800,"09 3, 1999",1999,496,"['quot', 'Pride', 'Yankees', 'quot', 'possibly', 'greatest', 'movie', 'ever', 'made', 'topic', 'baseball', ""'m"", 'sap', 'when', 'Gary', 'Cooper', 'seeing', 'film', 'became', 'more', 'more', 'interested', 'Baseball', ""'m"", 'basketcase', 'end', 'movie', 'when', 'Coop', 'farewell', 'speech', ""'m"", 'sure', 'are', 'millions', 'other', 'guys', 'course', 'lot', 'film', 'greatness', 'lost', 'due', 'annoying', 'coloroization', 'see', 'anyway', 'hav', ""n't"", 'yet', 'Colorized', 'not', 'still', 'great', 'film']",N/A
257730,A3J7FCYSYD8XP7,630159942X,ppauls@webtv.net Paul C. Scibetta Jr.,"[0, 1]",Loved the movie I first seen it when I was 12 years old and cried at the end.All of Gehrigs statts are right.Gary Cooper plays a tremendous part but could not bat left handed so they had to shoot all the back wards.Teresa  Wright was good as Ellie but that is not how she really was not that sqeaky  all american girl. Ellie smoked and drank not in that movie. I still watch  it 2 to 3 times a year,5,Very good movie,930355200,"06 26, 1999",1999,398,"['Loved', 'movie', 'first', 'seen', 'when', 'was', '12', 'years', 'old', 'cried', 'end.All', 'Gehrigs', 'statts', 'are', 'right.Gary', 'Cooper', 'tremendous', 'part', 'could', 'not', 'bat', 'left', 'handed', 'so', 'had', 'shoot', 'back', 'wards.Teresa', 'Wright', 'was', 'good', 'Ellie', 'not', 'how', 'really', 'was', 'not', 'sqeaky', 'american', 'girl', 'Ellie', 'smoked', 'drank', 'not', 'movie', 'still', 'watch', '2', '3', 'times', 'year']",N/A
257731,AC8J9720ALDAT,630159942X,"P. Skalisky ""Musicals Fan""","[2, 3]",As a die-hard Yankee fan this movie still ranks way at the top.  The story and the acting along with the fact that Babe Ruth himself appears in it makes awesome.  Lou Gehrig was one great baseball player and it is sad he died too soon.  A great movie for ANY fan of baseball.,5,GO YANKEES!,1212537600,"06 4, 2008",2008,275,"['die-hard', 'Yankee', 'fan', 'movie', 'still', 'way', 'top', 'story', 'acting', 'along', 'fact', 'Babe', 'Ruth', 'awesome', 'Lou', 'Gehrig', 'was', 'one', 'great', 'baseball', 'player', 'sad', 'died', 'too', 'soon', 'great', 'movie', 'ANY', 'fan', 'baseball']",N/A
257732,A1PFPUNQ0MQASR,630159942X,Randy G. Hutchison,"[0, 0]","Ireally like this movie and I gIVE IT  A 10, AND WOULD GLADLY  RECOMMEND IT TO MY FAMILY AND FRIENDS ,IF I HAD ANY.And  I would give Amazon.Com a 10 too for their fast and reliable service to me.",5,The Pride Of the Yankees,1364601600,"03 30, 2013",2013,195,"['Ireally', 'movie', 'gIVE', 'IT', 'A', '10', 'AND', 'WOULD', 'GLADLY', 'RECOMMEND', 'IT', 'TO', 'MY', 'FAMILY', 'AND', 'FRIENDS', 'IF', 'HAD', 'ANY.And', 'would', 'give', 'Amazon.Com', '10', 'too', 'fast', 'reliable', 'service']",N/A
257733,A1EMDSTJDUE6B0,630159942X,Randy Given,"[2, 5]","This movie is good, but nowhere near where the hype has put it. I am a Yankees fan, so I appreciated many aspects of it. However, some of it was too long (some looong dance sequences that might have been entertaining 50 years ago, but not now). It was good to see Babe Ruth as himself. The story was informative and accurate. The emotional aspect was present but not real strong or overwhelming. Still, it was not up there with other five-star movies.",4,"Not Up to Hype, But Good",1057622400,"07 8, 2003",2003,451,"['movie', 'good', 'nowhere', 'where', 'hype', 'put', 'am', 'Yankees', 'fan', 'appreciated', 'many', 'aspects', 'However', 'was', 'too', 'long', 'looong', 'dance', 'sequences', 'might', 'have', 'been', 'entertaining', '50', 'years', 'ago', 'not', 'now', 'was', 'good', 'see', 'Babe', 'Ruth', 'story', 'was', 'informative', 'accurate', 'emotional', 'aspect', 'was', 'present', 'not', 'real', 'strong', 'overwhelming', 'Still', 'was', 'not', 'there', 'other', 'five-star', 'movies']",N/A
