,reviewerID,asin,reviewerName,helpful,reviewText,overall,summary,unixReviewTime,reviewTime,reviewYear,reviewLength,meaningfulWords,Title
257661,A3MV1KKHX51FYT,630159942X,Acute Observer,"[1, 2]","Pride of the Yankees, 1942 filmThis is the Hollywood biography of Lou Gehrig, who died before this move was produced. Lou was talented in baseball (and other sports), went to Columbia, and then the New York Yankees baseball club. It was unusual for a college graduate to become a baseball player then. Most had a grammar school education at best, left school to work at 14, played on a company team until their talents were noticed. This film presents a view of life and culture before WW II. You get a chance to see Babe Ruth (as himself), other Yankee players, and the old stadiums. [They did not need taxpayer subsidies in those days.] Lou's mother expected him to become a professional and work in an office, not as an entertainer. Fame and fortune are there, then afterwards an ordinary job like an accountant or engineer.Teams and people traveled by train. Players gambled with cards on the train. Ruth's straw hat is nibbled. [An example of rough humor by baseball players, whose careers can end with any serious injury.] Eleanor Twichell meets Lou Gehrig. [Marry the boss' daughter?] They visit a carnival, an entertainment that is as obsolete as those steam trains. There is a pair of ballroom dancers to provide entertainment, serve as symbolism, and pad out the story. ""I'll be loving you always."" [Note the names of the cities, all east of the Mississippi except St. Louis.] There is the famous scene where the Babe promises a home run for a sick boy. Can you do anything if you try hard enough? Lou hits two home runs in a World Series game! These scenes tell of pre-war America [no mention of the Great Depression].Lou returns home with Eleanor - a surprise party. We see a woman scrubbing a floor on her knees. ""It's second hand."" ""It's an antique."" ""Can't we afford new?"" Can a mother-in-law be too authoritarian? Can she know her limits? [No church wedding?] A honeymoon in Yankee stadium? [Lou loves his job.] Baseball star Lou has perquisites on the highway. [Simpler times, and a lot less traffic.] Did they have a perfect marriage? Lou wants to keep his personal life private. Lou sets a record for playing 2,000 consecutive games.""I won"" says Eleanor. But something is wrong! Lou has a problem with his shoulder. He tries exercise, but to no avail. ""I can't make it anymore."" Lou visits the Scripps Clinic. ""It's three strikes."" Elly surmises the truth. There is a celebration for ""Lou Gehrig Day"". Lou thanks his fans, his teammates, his parents. He considers himself ""the luckiest man on the face of the earth"". And so he leaves the playing field. The ending is implied, and a symbol for the future of many other Americans who were not famous in the coming years.",5,The Lou Gehrig Story,1280275200,"07 28, 2010",2010,2687,"['Pride', 'Yankees', '1942', 'filmThis', 'Hollywood', 'biography', 'Lou', 'Gehrig', 'who', 'died', 'move', 'was', 'produced', 'Lou', 'was', 'talented', 'baseball', 'other', 'sports', 'went', 'Columbia', 'then', 'New', 'York', 'Yankees', 'baseball', 'club', 'was', 'unusual', 'college', 'graduate', 'become', 'baseball', 'player', 'then', 'Most', 'had', 'grammar', 'school', 'education', 'best', 'left', 'school', 'work', '14', 'played', 'company', 'team', 'talents', 'were', 'noticed', 'film', 'view', 'life', 'culture', 'WW', 'II', 'get', 'chance', 'see', 'Babe', 'Ruth', 'other', 'Yankee', 'players', 'old', 'stadiums', 'did', 'not', 'need', 'taxpayer', 'subsidies', 'days', ']', 'Lou', 'mother', 'expected', 'become', 'professional', 'work', 'office', 'not', 'entertainer', 'Fame', 'fortune', 'are', 'there', 'then', 'ordinary', 'job', 'accountant', 'engineer.Teams', 'people', 'traveled', 'train', 'Players', 'gambled', 'cards', 'train', 'Ruth', 'straw', 'hat', 'nibbled', '[', 'example', 'rough', 'humor', 'baseball', 'players', 'careers', 'can', 'end', 'serious', 'injury', 'Eleanor', 'Twichell', 'Lou', 'Gehrig', '[', 'Marry', 'boss', 'daughter', 'visit', 'carnival', 'entertainment', 'as', 'obsolete', 'steam', 'trains', 'pair', 'ballroom', 'dancers', 'provide', 'entertainment', 'serve', 'symbolism', 'out', 'story', ""'ll"", 'be', 'loving', 'always', '[', 'Note', 'names', 'cities', 'east', 'Mississippi', 'St', 'Louis', ']', 'famous', 'scene', 'where', 'Babe', 'home', 'run', 'sick', 'boy', 'Can', 'do', 'anything', 'try', 'hard', 'enough', 'Lou', 'two', 'home', 'runs', 'World', 'Series', 'game', 'scenes', 'tell', 'pre-war', 'America', '[', 'mention', 'Great', 'Depression', ']', '.Lou', 'home', 'Eleanor', 'surprise', 'party', 'see', 'woman', 'scrubbing', 'floor', 'knees', 'second', 'hand', 'antique', 'Ca', ""n't"", 'afford', 'new', 'Can', 'mother-in-law', 'be', 'too', 'authoritarian', 'Can', 'know', 'limits', '[', 'church', 'wedding', ']', 'honeymoon', 'Yankee', 'stadium', '[', 'Lou', 'job', ']', 'Baseball', 'star', 'Lou', 'perquisites', 'highway', 'Simpler', 'times', 'lot', 'less', 'traffic', ']', 'Did', 'have', 'perfect', 'marriage', 'Lou', 'keep', 'personal', 'life', 'private', 'Lou', 'record', 'playing', '2,000', 'consecutive', 'games', 'won', 'Eleanor', 'something', 'wrong', 'Lou', 'problem', 'shoulder', 'exercise', 'avail', 'ca', ""n't"", 'make', 'anymore', 'Lou', 'Scripps', 'Clinic', 'three', 'strikes', 'Elly', 'truth', 'celebration', 'Lou', 'Gehrig', 'Day', 'Lou', 'thanks', 'fans', 'teammates', 'parents', 'luckiest', 'man', 'face', 'earth', 'so', 'playing', 'field', 'ending', 'implied', 'symbol', 'future', 'many', 'other', 'Americans', 'who', 'were', 'not', 'famous', 'coming', 'years']",N/A
257662,A1OT4PZSMSCLR8,630159942X,"Alamo2 ""alamo2""","[22, 26]","As usual, MGM, which was a fine studio, puts out a mediocre DVD, trying to put one past the consumer.  Don't be fooled.  Let the reviewer from DVDBeaver speak for this ""new"" version:""These MGM DVD editions are EXACTLY the same. The only difference is that the Anniversary Edition package offers a cardboard sleeve (funnily enough it doesn't even have new text - it is the same spiel written on the keep case insert). And for your trouble the Anniversary Edition is minutely more money ($0.20). In all fairness they should have just called this a re-issue instead of trying to fool the public - this DVD does nothing at all to celebrate the 65th Anniversary.""The transfer that came out in 2002 is not bad at all - progressive and quite acceptable contrast. There are a few blemishes (speckles) but nothing to get riled up about. There are yellow optional subtitles and clear and consistent mono audio. No extras at all where to properly celebrate the 65 Anniversary you would think some video featurette or commentary would be called for. The film certainly deserves at least that.""Wholesome good nostalgic fun that purports the virtues of courage and determination in a story of how one man and his quiet demeanour was able to touch so many with his gift. Yeah, they don't make'm like this anymore.""All we have to say to MGM is 'not on DVDBeaver's watch'. A great reasonably priced DVD but obviously NO reason to double dip (as many would expect) and shame on MGM!""",1,DVD Exactly the Same as Older Version - MGM Rip-Off!,1175731200,"04 5, 2007",2007,1465,"['usual', 'MGM', 'was', 'fine', 'studio', 'out', 'mediocre', 'DVD', 'trying', 'put', 'one', 'consumer', 'Do', ""n't"", 'be', 'fooled', 'Let', 'reviewer', 'DVDBeaver', 'speak', 'new', 'version', 'MGM', 'DVD', 'editions', 'are', 'EXACTLY', 'same', 'only', 'difference', 'Anniversary', 'Edition', 'package', 'cardboard', 'sleeve', 'funnily', 'enough', ""n't"", 'even', 'have', 'new', 'text', 'same', 'spiel', 'written', 'keep', 'case', 'insert', 'trouble', 'Anniversary', 'Edition', 'minutely', 'more', 'money', '0.20', 'fairness', 'should', 'have', 'just', 'called', 're-issue', 'instead', 'trying', 'fool', 'public', 'DVD', 'nothing', 'celebrate', '65th', 'Anniversary', 'transfer', 'came', 'out', '2002', 'not', 'bad', 'progressive', 'quite', 'acceptable', 'contrast', 'are', 'few', 'blemishes', 'speckles', 'nothing', 'get', 'riled', 'up', 'about', 'are', 'yellow', 'optional', 'subtitles', 'clear', 'consistent', 'mono', 'audio', 'extras', 'where', 'properly', 'celebrate', '65', 'Anniversary', 'would', 'think', 'video', 'featurette', 'commentary', 'would', 'be', 'called', 'film', 'certainly', 'least', 'Wholesome', 'good', 'nostalgic', 'fun', 'virtues', 'courage', 'determination', 'story', 'how', 'one', 'man', 'quiet', 'demeanour', 'was', 'able', 'touch', 'so', 'many', 'gift', 'Yeah', 'do', ""n't"", 'make', ""'m"", 'anymore', 'have', 'say', 'MGM', ""'not"", 'DVDBeaver', 'watch', 'great', 'reasonably', 'priced', 'DVD', 'obviously', 'NO', 'reason', 'double', 'dip', 'many', 'would', 'expect', 'shame', 'MGM']",N/A
257663,A3FVAWZNKW9GX,630159942X,"A.Trendl HungarianBookstore.com ""What should ...","[13, 13]","Gary Cooper plays Lou Gehrig, one of the greatest players ever to wear a uniform in any sport.In one movie, we are given a hero who lives out his dream, a celebrity who did more off-camera than on, a husband who loves his wife, parents who sacrifice so their son may have a better life, a man who also loves his parents and in-laws, and a sports star who never cheated in the game or on his wife.It could be a perfect family movie.Lou is born to immigrant parents who believe in traditional America. His parent's hopes are set on Lou becoming like his Uncle Otto, a successful engineer. Baseball means nothing to them but trouble until Lou shows he is the best.Lou falls in love with Miss Twitchell. She soon becomes Mrs. Gehrig, played by Teresa Wright, his doting wife, reminiscent of Donna Reed's character in ""It's a Wonderful Life."" A storybook life follows, and Lou outshines his childhood hero the Sultan of Swat, played by Babe Ruth himself.You know how it ends. Lou contracts what is now known as Lou Gehrig's disease. He not only must end his Iron Horse record of playing 2,130 straight games, but knows his life is ending. He retires and America swoons in grief. His retirement speech is full of dignity and power, and nothing like it has ever been seen since. The actual speech is barely edited in the movie.Impressive is not just the life of Lou Gehrig. It is also the respect of his teammates, especially Babe Ruth. Ruth was in his last years of playing when Gehrig showed up. However, as he saw how Ruth really lived as an undisciplined show-off, some rifts between them followed. When push came to shove, both on the field and during Ruth's retirement, they respected each other's abilities. Ruth did not need to be in the movie. His status as a legend was secure. He came to honor a great man. Ruth's presence and self-effacement is crucial to appreciate the depth of Gehrig's character.I bought into every character, from Gehrig's parents, to Gary Cooper as Gehrig, to the goofy cop who catches Gehrig nervously approaching Twitchell's door on his way to propose.The movie seems like part fantasy -- Could anyone be that decent of a guy? Further reading will tell you yes. It is that quality of humanity that might make it unpopular today, as movie goers are used to the antihero and imperfect man saving the day.""Pride of the Yankees"" might be a great movie that has passed its prime. The movie includes a strong message that immigrants are a great part of the American dream. The possibilities of America are still true, as seen through the current evidence of throngs of Mexican immigrants, but a patriotic movie might be snidely received by cynics and critics. Baseball also has found itself tainted by steroids, and today's homerun heroes are suspect.I fully recommend ""Pride of the Yankees.""Anthony Trendleditor, HungarianBookstore.com",5,We Need Another Lou Gehrig.,1149465600,"06 5, 2006",2006,2859,"['Gary', 'Cooper', 'Lou', 'Gehrig', 'one', 'greatest', 'players', 'ever', 'wear', 'uniform', 'sport.In', 'one', 'movie', 'are', 'given', 'hero', 'who', 'out', 'dream', 'celebrity', 'who', 'did', 'more', 'off-camera', 'husband', 'who', 'wife', 'parents', 'who', 'sacrifice', 'so', 'son', 'may', 'have', 'better', 'life', 'man', 'who', 'also', 'parents', 'in-laws', 'sports', 'star', 'who', 'never', 'cheated', 'game', 'wife.It', 'could', 'be', 'perfect', 'family', 'movie.Lou', 'born', 'immigrant', 'parents', 'who', 'believe', 'traditional', 'America', 'parent', 'hopes', 'are', 'set', 'Lou', 'becoming', 'Uncle', 'Otto', 'successful', 'engineer', 'nothing', 'trouble', 'Lou', 'shows', 'best.Lou', 'love', 'Miss', 'Twitchell', 'soon', 'Mrs.', 'Gehrig', 'played', 'Teresa', 'Wright', 'doting', 'wife', 'reminiscent', 'Donna', 'Reed', 'character', 'Wonderful', 'Life', 'storybook', 'life', 'Lou', 'childhood', 'hero', 'Sultan', 'Swat', 'played', 'Babe', 'Ruth', 'himself.You', 'know', 'how', 'Lou', 'contracts', 'what', 'now', 'known', 'Lou', 'Gehrig', 'disease', 'not', 'only', 'must', 'end', 'Iron', 'Horse', 'record', 'playing', '2,130', 'straight', 'games', 'life', 'ending', 'America', 'swoons', 'grief', 'retirement', 'speech', 'full', 'dignity', 'power', 'nothing', 'ever', 'been', 'seen', 'actual', 'speech', 'barely', 'edited', 'movie.Impressive', 'not', 'just', 'life', 'Lou', 'Gehrig', 'also', 'respect', 'teammates', 'especially', 'Babe', 'Ruth', 'Ruth', 'was', 'last', 'years', 'playing', 'when', 'Gehrig', 'showed', 'up', 'However', 'saw', 'how', 'Ruth', 'really', 'lived', 'undisciplined', 'show-off', 'rifts', 'followed', 'When', 'push', 'came', 'shove', 'field', 'Ruth', 'retirement', 'respected', 'other', 'abilities', 'Ruth', 'did', 'not', 'need', 'be', 'movie', 'status', 'legend', 'was', 'secure', 'came', 'honor', 'great', 'man', 'Ruth', 'presence', 'self-effacement', 'crucial', 'appreciate', 'depth', 'Gehrig', 'character.I', 'bought', 'character', 'Gehrig', 'parents', 'Gary', 'Cooper', 'Gehrig', 'goofy', 'cop', 'who', 'Gehrig', 'nervously', 'approaching', 'Twitchell', 'door', 'way', 'propose.The', 'movie', 'part', 'fantasy', 'Could', 'anyone', 'be', 'decent', 'guy', 'Further', 'reading', 'will', 'tell', 'yes', 'quality', 'humanity', 'might', 'make', 'unpopular', 'today', 'movie', 'goers', 'are', 'used', 'antihero', 'imperfect', 'man', 'saving', 'day', 'Pride', 'Yankees', 'might', 'be', 'great', 'movie', 'passed', 'prime', 'movie', 'strong', 'message', 'immigrants', 'are', 'great', 'part', 'American', 'dream', 'possibilities', 'America', 'are', 'still', 'true', 'seen', 'current', 'evidence', 'throngs', 'Mexican', 'immigrants', 'patriotic', 'movie', 'might', 'be', 'snidely', 'received', 'cynics', 'critics', 'Baseball', 'also', 'found', 'tainted', 'steroids', 'today', 'homerun', 'heroes', 'are', 'suspect.I', 'fully', 'recommend', 'Pride', 'Yankees', 'Anthony', 'Trendleditor', 'HungarianBookstore.com']",N/A
257664,A1184B1I5G87YF,630159942X,"Austin ""atticus101""","[2, 2]","Baseball films are run the gamut these days.  You have the great ones like Bull Durham and Eight Men Out to Major League (actually not a half bad movie) silliness to just plain bad For the Love of the Game.  It seems funny to me that probably one of the best baseball movie is about one of the most beloved players on one of the most hated teams in baseball, Lou Gehrig of the Yankees.  The movie, Pride of the Yankees is a must see for any sports fan or anyone with a heartbeat for that matter.The movie follows Lou Gehrig (Gary Cooper), growing up in New York, son of immigrant parents who work themselves into exhaustion to make sure Lou goes to college at Columbia and becomes an engineer.  Gehrig, of course, has other interests and doesn't really want to do engineering but has a passion for baseball and wants to play that for a living.  While playing baseball for Columbia, is discovered by the Yankees who try to get Gehrig to play for them, though Gehrig's mom does not want Lou abandoning his pursuit of being an engineer.  After Gehrig's mother falls ill, he signs with the Yankees to pay for his mother's hospital bills and moves up to New England area to being playing in the minors.  Gehrig and his father keep the secret of Lou's new profession from his mother until circumstance prevent it from being heard any more.  During his rookie season with the Yankees, Gehrig meets his future wife, Eleanor and begins the road to becoming baseball's ""Iron Man"".Pride of the Yankees isn't really isn't a baseball movie outright, but more of a drama/love story with a baseball subplot.  Gary Cooper, who was fresh off his Oscar winning performance in Sergeant York, plays Gehrig superbly.  His humbleness and good nature allow Gehrig to come to life on screen again without allowing the character to become bigger than himself.  Cooper was nominated for another Academy Award for this role but did not win (he lost to James Cagney in Yankee Doodle Dandy), his acting seems more polished and refined than his Oscar winning Sergeant Alvin York.  Cooper was notoriously bad at baseball but, thanks to camera tricks and hard work of Coopers' part, he does his best to recreate to swing and motions of Gehrig on film.The other characters in the film help support it move it along without their scenes feeling rushed.  The baseball writers, played by Walter Brennan and Dan Duryea provide comic relief along with Gehrig's parents Elsa Janssen and Ludwig Stossel.  Teresa Wright has a good turn as Gehrig's wife; Eleanor is played with a mix of All-American girl and socialite suaveness.  In almost all her scenes, Ms. Wright is never allowed the chance to give her character more depth than that of being Ms. Lou Gehrig and even in her scenes without Cooper, we have a visual or audible reminder that Gehrig's presence isn't far off.To top off the film, cameos from some of the real life Yankees are in the film, such as Bill Dickey, Mark Koenig, Bob Meusel, and Babe Ruth, who's turn in the film doesn't show a hint of the supposed rivalry between the Babe and Gehrig.This movie tugs at your heart strings throughout the movie.  The film welcomes you into the Gehrig home and his life growing up and allows you to triumph in all his glories without touching on any real failures along the way.  The movie ends with Gehrig's now famous speech at Yankee stadium in 1939 and then ends with him walking into the shadows of the stadium.  We never see him suffer in the end or the trauma done to his family, though the ending is powerful enough to make you think you did see all these things and more.A great movie for all ages to see, especially history and sports fans, this movie is a true classic that deserves to be rediscovered.",5,Great historical baseball film,1195948800,"11 25, 2007",2007,3730,"['films', 'are', 'run', 'gamut', 'days', 'have', 'great', 'ones', 'Bull', 'Durham', 'Eight', 'Men', 'Out', 'Major', 'League', 'actually', 'not', 'half', 'bad', 'movie', 'silliness', 'just', 'plain', 'bad', 'Love', 'Game', 'funny', 'probably', 'one', 'best', 'baseball', 'movie', 'one', 'most', 'beloved', 'players', 'one', 'most', 'hated', 'teams', 'baseball', 'Lou', 'Gehrig', 'Yankees', 'movie', 'Pride', 'Yankees', 'must', 'see', 'sports', 'fan', 'anyone', 'heartbeat', 'matter.The', 'movie', 'Lou', 'Gehrig', 'Gary', 'Cooper', 'growing', 'up', 'New', 'York', 'son', 'immigrant', 'parents', 'who', 'work', 'exhaustion', 'make', 'sure', 'Lou', 'college', 'Columbia', 'engineer', 'Gehrig', 'course', 'other', 'interests', ""n't"", 'really', 'want', 'do', 'engineering', 'passion', 'baseball', 'play', 'living', 'playing', 'baseball', 'Columbia', 'discovered', 'Yankees', 'who', 'try', 'get', 'Gehrig', 'play', 'Gehrig', 'mom', 'not', 'want', 'Lou', 'abandoning', 'pursuit', 'being', 'engineer', 'Gehrig', 'mother', 'ill', 'signs', 'Yankees', 'pay', 'mother', 'hospital', 'bills', 'up', 'New', 'England', 'area', 'being', 'playing', 'minors', 'Gehrig', 'father', 'keep', 'secret', 'Lou', 'new', 'profession', 'mother', 'circumstance', 'prevent', 'being', 'heard', 'more', 'rookie', 'season', 'Yankees', 'Gehrig', 'future', 'wife', 'Eleanor', 'road', 'becoming', 'baseball', 'Iron', 'Man', '.Pride', 'Yankees', ""n't"", 'really', ""n't"", 'baseball', 'movie', 'outright', 'more', 'drama/love', 'story', 'baseball', 'subplot', 'Gary', 'Cooper', 'who', 'was', 'fresh', 'Oscar', 'winning', 'performance', 'Sergeant', 'York', 'Gehrig', 'superbly', 'humbleness', 'good', 'nature', 'allow', 'Gehrig', 'come', 'life', 'screen', 'again', 'allowing', 'character', 'become', 'bigger', 'Cooper', 'was', 'nominated', 'Academy', 'Award', 'role', 'did', 'not', 'win', 'lost', 'James', 'Cagney', 'Yankee', 'Doodle', 'Dandy', 'acting', 'more', 'polished', 'refined', 'Oscar', 'winning', 'Sergeant', 'Alvin', 'York', 'Cooper', 'was', 'notoriously', 'bad', 'baseball', 'thanks', 'camera', 'tricks', 'hard', 'work', 'Coopers', 'part', 'best', 'recreate', 'swing', 'motions', 'Gehrig', 'film.The', 'other', 'characters', 'film', 'help', 'support', 'move', 'along', 'scenes', 'feeling', 'rushed', 'baseball', 'writers', 'played', 'Walter', 'Brennan', 'Dan', 'Duryea', 'provide', 'comic', 'relief', 'Gehrig', 'parents', 'Elsa', 'Janssen', 'Ludwig', 'Stossel', 'Teresa', 'Wright', 'good', 'turn', 'Gehrig', 'wife', 'Eleanor', 'played', 'mix', 'All-American', 'girl', 'socialite', 'suaveness', 'almost', 'scenes', 'Ms.', 'Wright', 'never', 'allowed', 'chance', 'give', 'character', 'more', 'depth', 'being', 'Ms.', 'Lou', 'Gehrig', 'even', 'scenes', 'Cooper', 'have', 'visual', 'audible', 'reminder', 'Gehrig', 'presence', ""n't"", 'far', 'off.To', 'top', 'film', 'cameos', 'real', 'life', 'Yankees', 'are', 'film', 'such', 'Bill', 'Dickey', 'Mark', 'Koenig', 'Bob', 'Meusel', 'Babe', 'Ruth', 'who', 'turn', 'film', ""n't"", 'show', 'hint', 'supposed', 'rivalry', 'Babe', 'Gehrig.This', 'movie', 'tugs', 'heart', 'strings', 'movie', 'film', 'Gehrig', 'home', 'life', 'growing', 'up', 'triumph', 'glories', 'touching', 'real', 'failures', 'way', 'movie', 'Gehrig', 'now', 'famous', 'speech', 'Yankee', 'stadium', '1939', 'then', 'walking', 'shadows', 'stadium', 'never', 'see', 'suffer', 'end', 'trauma', 'done', 'family', 'ending', 'powerful', 'enough', 'make', 'think', 'did', 'see', 'things', 'more.A', 'great', 'movie', 'ages', 'see', 'especially', 'history', 'sports', 'fans', 'movie', 'true', 'classic', 'be', 'rediscovered']",N/A
257665,A1PASRZ81DY9C,630159942X,Austin Somlo,"[0, 1]","Viewed: 4/14Rate: 64/14: The Pride of the Yankees is a long, uneven, and dull picture about the famous Yankee player named Lou Gehrig who was struck by the fatal eponymous disease. There are scenes that run far too long or are often repeated throughout, causing an interminable drag in the pacing of the film. Sometimes, they are too much to take. One particular scene where Lou Gehrig the kid hits a home run is hysterical in a bad way because the ball did not actually come from his bat but all the way on the left side. In other words, it's fair to assume that the kid couldn't hit worth squat. So, either the certain scenes be cut out and replaced with diverse ones or the length of the film be significantly cut down to 90 minutes total is an ideal way to go about it. Babe Ruth looks like a total boob and is somewhat of a caricature. On the other hand, Gary Cooper and Teresa Wright are very good and do everything as they can in their roles. But really, the negatives outweigh the positives. All in all, I am not in favor of seeing The Pride of the Yankees ever again; just remember I am speaking from cinematic point of view, not the man Lou Gehrig himself.",3,"Long, Uneven, and Dull.",1397952000,"04 20, 2014",2014,1166,"['Viewed', '4/14Rate', '64/14', 'Pride', 'Yankees', 'long', 'uneven', 'dull', 'picture', 'famous', 'Yankee', 'player', 'named', 'Lou', 'Gehrig', 'who', 'was', 'struck', 'fatal', 'eponymous', 'disease', 'are', 'scenes', 'run', 'far', 'too', 'long', 'are', 'often', 'repeated', 'causing', 'interminable', 'drag', 'pacing', 'film', 'Sometimes', 'are', 'too', 'much', 'take', 'One', 'particular', 'scene', 'where', 'Lou', 'Gehrig', 'kid', 'home', 'run', 'hysterical', 'bad', 'way', 'ball', 'did', 'not', 'actually', 'come', 'bat', 'way', 'left', 'side', 'other', 'words', 'fair', 'assume', 'kid', 'could', ""n't"", 'hit', 'worth', 'squat', 'So', 'certain', 'scenes', 'be', 'cut', 'out', 'replaced', 'diverse', 'ones', 'length', 'film', 'be', 'significantly', 'cut', 'down', '90', 'minutes', 'total', 'ideal', 'way', 'go', 'Babe', 'Ruth', 'total', 'boob', 'somewhat', 'caricature', 'other', 'hand', 'Gary', 'Cooper', 'Teresa', 'Wright', 'are', 'very', 'good', 'do', 'everything', 'can', 'roles', 'really', 'negatives', 'outweigh', 'positives', 'am', 'not', 'favor', 'seeing', 'Pride', 'Yankees', 'ever', 'again', 'just', 'remember', 'am', 'speaking', 'cinematic', 'point', 'view', 'not', 'man', 'Lou', 'Gehrig']",N/A
