,reviewerID,asin,reviewerName,helpful,reviewText,overall,summary,unixReviewTime,reviewTime,reviewYear,reviewLength,meaningfulWords,Title
257709,A2NJO6YE954DBH,630159942X,Lawrance M. Bernabo,"[42, 46]","There are all sorts of little imperfections in the 1943 film ""The Pride of the Yankees.""  The screenwriters rearranged Lou Gehrig's famous farewell speech at Yankee Stadium so that the best line, ""Today, I consider myself the luckiest man on the face of the earth,"" becomes his exit line (it was the second line in his speech with his actual last line being, ""So I close in saying that I may have had a tough break, but I have an awful lot to live for"").  Gary Cooper had enough problems batting right-handed let alone left-handed like Gehrig, so the actor wore a uniform with ""KROY WEN"" on the front, ran to third base when he managed to hit the ball, and then they reversed the print.  Gehrig is shown wearing his famous number 4 when the Yankees play the World Series, but that happened in 1926 and 1928 while the Bronx Bombers did not start wearing uniform numbers until 1929 (Gehrig batted cleanup and was 4, Babe Ruth batted in front of him and was therefore 3).  The film talks about how Gehrig won the Triple Crown on the day he was married but Gehrig won the Triple Crown in the 1934 season, the year after Lou and Eleanor were married in 1933.But none of that really matters because ""The Pride of the Yankees"" remains the standard by which all sports biopics, whether of baseball players or anyone else, are judged.  Even those who were not weaned and raised on baseball know that the title character is going to die of Lou Gehrig's disease and the film takes full advantage of that foreshadowing: when Gehrig gets into his first game and refuses to come out after being hit in the head by a thrown ball, manager Miller Huggins asks, ""What do we have to do to get you out of the game?  Kill you?""  Irving Berlin's song ""Always"" becomes a recurring musical theme throughout the film, another reminder of Gehrig's mortality.In many ways ""The Pride of the Yankees"" is more of a love story than a baseball theme.  It starts off as a rags-to-riches story, where Gehrig's mother (Elsa Janssen) insists her son will be an engineer and does want him wasting time playing baseball.  Eventually the fame and money opens her eyes, but then Lou meets Eleanor Twitchell (Teresa Wright) and has a new ""best girl.""  One of the most impressive aspects of this film is how it touches on the two darker sides of the Lou Gehrig story, the friction between his overbearing mother and his society wife along with the strained relationship that developed between Gehrig and Babe Ruth.  The film really only touches on these aspects and Ruth, playing himself, is usually a smiling figure when he shows up on screen, except for when Gehrig is eating his new hat and he is listening to Gehrig's farewell speech.Cooper was nominated for an Oscar for his performance and even though he is rather awkward and a bit old for the role, he captures the essential dignity and class of Gehrig.  It makes sense that one American icon is being played by another.  Having been nominated of a Best Actress in a Supporting Role Oscar for ""The Little Foxes"" in 1941 she received another nomination in that category in 1942 for ""Mrs. Miniver"" and also one for Best Actress that same year for ""The Pride of the Yankees.""  Wright won for ""Mrs. Miniver"" and lost out to Greer Garson for Best Actress (because of the war the Oscars were made of plaster for the first time, but were replaced by ""real"" Oscars when the war ended).  ""The Pride of the Yankees"" was nominated for 11 Oscars, including Best Picture, but only won for Daniel Mandell's Film Editing.Walter Brennan as sportswriter Sam Blake and Ludwig St&ouml;ssel as Pop Gehrig provide a lot of the comic relief in the film.  Brennan's role is rather low-keyed for him while St&ouml;ssel has several fine moments where he tries, usually without success, to stand up to his wife.  Appearing as themselves are Yankee players Bill Dickey, Bob Meusel, and Mark Koenig, and the familiar voice of Bill Stern makes it on screen as well.Gehrig's tragic death at the age of 38 makes all of his records even more astounding given that his career was cut short. Sportswriter Jim Murray once described the tall, strong Gehrig as a ""Gibraltar in cleats,"" and ""The Pride of the Yankees"" provides a sense of that.  For me the most poignant scene comes before Gehrig enters Yankee Stadium on July 4, 1939, when he encounter 17-year-old Billy (David Holt), the lame boy in the hospital (Gene Collins) for whom Gehrig hit two home runs in a World Series game in the film's most extended baseball sequence.  The irony that Gehrig could inspire Billy to rise up and walk but Fate had conspired to strike down the Iron Horse who played in 2,130 is enough to reduce most of us to tears before Gehrig ever steps to the plate for the last time to talk about how lucky he is.",5,The story of Lou Gehrig and the classiest sports biopic,1083888000,"05 7, 2004",2004,4773,"['are', 'sorts', 'little', 'imperfections', '1943', 'film', 'Pride', 'Yankees', 'screenwriters', 'rearranged', 'Lou', 'Gehrig', 'famous', 'farewell', 'speech', 'Yankee', 'Stadium', 'best', 'line', 'Today', 'consider', 'luckiest', 'man', 'face', 'earth', 'exit', 'line', 'was', 'second', 'line', 'speech', 'actual', 'last', 'line', 'being', 'So', 'close', 'saying', 'may', 'have', 'had', 'tough', 'break', 'have', 'awful', 'lot', 'live', 'Gary', 'Cooper', 'had', 'enough', 'problems', 'batting', 'right-handed', 'let', 'alone', 'left-handed', 'Gehrig', 'actor', 'wore', 'uniform', 'KROY', 'WEN', 'front', 'ran', 'third', 'base', 'when', 'managed', 'hit', 'ball', 'then', 'reversed', 'print', 'Gehrig', 'shown', 'wearing', 'famous', 'number', '4', 'when', 'Yankees', 'play', 'World', 'Series', 'happened', '1926', '1928', 'Bronx', 'Bombers', 'did', 'not', 'start', 'wearing', 'uniform', 'numbers', '1929', 'Gehrig', 'batted', 'cleanup', 'was', '4', 'Babe', 'Ruth', 'batted', 'front', 'was', 'therefore', '3', 'film', 'talks', 'how', 'Gehrig', 'won', 'Triple', 'Crown', 'day', 'was', 'married', 'Gehrig', 'won', 'Triple', 'Crown', '1934', 'season', 'year', 'Lou', 'Eleanor', 'were', 'married', '1933.But', 'none', 'really', 'matters', 'Pride', 'Yankees', 'standard', 'sports', 'biopics', 'baseball', 'players', 'anyone', 'else', 'are', 'judged', 'Even', 'who', 'were', 'not', 'weaned', 'raised', 'baseball', 'know', 'title', 'character', 'going', 'die', 'Lou', 'Gehrig', 'disease', 'film', 'full', 'advantage', 'foreshadowing', 'when', 'Gehrig', 'first', 'game', 'come', 'out', 'being', 'hit', 'head', 'thrown', 'ball', 'manager', 'Miller', 'Huggins', 'What', 'do', 'have', 'do', 'get', 'game', 'Kill', 'Irving', 'Berlin', 'song', 'Always', 'recurring', 'musical', 'theme', 'film', 'reminder', 'Gehrig', 'mortality.In', 'many', 'ways', 'Pride', 'Yankees', 'more', 'love', 'story', 'baseball', 'theme', 'off', 'rags-to-riches', 'story', 'where', 'Gehrig', 'mother', 'Elsa', 'Janssen', 'son', 'will', 'be', 'engineer', 'want', 'wasting', 'time', 'playing', 'baseball', 'Eventually', 'fame', 'money', 'eyes', 'then', 'Lou', 'meets', 'Eleanor', 'Twitchell', 'Teresa', 'Wright', 'new', 'best', 'girl', 'One', 'most', 'impressive', 'aspects', 'film', 'how', 'two', 'darker', 'sides', 'Lou', 'Gehrig', 'story', 'friction', 'overbearing', 'mother', 'society', 'wife', 'strained', 'relationship', 'developed', 'Gehrig', 'Babe', 'Ruth', 'film', 'really', 'only', 'aspects', 'Ruth', 'playing', 'usually', 'smiling', 'figure', 'when', 'up', 'screen', 'when', 'Gehrig', 'eating', 'new', 'hat', 'listening', 'Gehrig', 'farewell', 'speech.Cooper', 'was', 'nominated', 'Oscar', 'performance', 'even', 'rather', 'awkward', 'bit', 'old', 'role', 'essential', 'dignity', 'class', 'Gehrig', 'sense', 'one', 'American', 'icon', 'being', 'played', 'Having', 'been', 'nominated', 'Best', 'Actress', 'Supporting', 'Role', 'Oscar', 'Little', 'Foxes', '1941', 'received', 'nomination', 'category', '1942', 'Mrs.', 'Miniver', 'also', 'one', 'Best', 'Actress', 'same', 'year', 'Pride', 'Yankees', 'Wright', 'won', 'Mrs.', 'Miniver', 'lost', 'out', 'Greer', 'Garson', 'Best', 'Actress', 'war', 'Oscars', 'were', 'made', 'plaster', 'first', 'time', 'were', 'replaced', 'real', 'Oscars', 'when', 'war', 'ended', 'Pride', 'Yankees', 'was', 'nominated', '11', 'Oscars', 'including', 'Best', 'Picture', 'only', 'won', 'Daniel', 'Mandell', 'Film', 'Editing.Walter', 'Brennan', 'sportswriter', 'Sam', 'Blake', 'Ludwig', 'St', 'ouml', 'Pop', 'Gehrig', 'provide', 'lot', 'comic', 'relief', 'film', 'Brennan', 'role', 'rather', 'low-keyed', 'St', 'ouml', 'ssel', 'several', 'fine', 'moments', 'where', 'usually', 'success', 'stand', 'up', 'wife', 'Appearing', 'are', 'Yankee', 'players', 'Bill', 'Dickey', 'Bob', 'Meusel', 'Mark', 'Koenig', 'familiar', 'voice', 'Bill', 'Stern', 'screen', 'well.Gehrig', 'tragic', 'death', 'age', '38', 'records', 'even', 'more', 'astounding', 'given', 'career', 'was', 'cut', 'short', 'Sportswriter', 'Jim', 'Murray', 'once', 'described', 'tall', 'strong', 'Gehrig', 'Gibraltar', 'cleats', 'Pride', 'Yankees', 'sense', 'most', 'poignant', 'scene', 'Gehrig', 'enters', 'Yankee', 'Stadium', 'July', '4', '1939', 'when', 'encounter', '17-year-old', 'Billy', 'David', 'Holt', 'lame', 'boy', 'hospital', 'Gene', 'Collins', 'whom', 'Gehrig', 'hit', 'two', 'home', 'runs', 'World', 'Series', 'game', 'film', 'most', 'extended', 'baseball', 'sequence', 'irony', 'Gehrig', 'could', 'inspire', 'Billy', 'rise', 'up', 'walk', 'Fate', 'had', 'conspired', 'strike', 'down', 'Iron', 'Horse', 'who', 'played', '2,130', 'enough', 'reduce', 'most', 'tears', 'Gehrig', 'ever', 'plate', 'last', 'time', 'talk', 'how', 'lucky']",N/A
257710,A1SK116SYZKKVD,630159942X,Leonard Norwitz,"[15, 19]","Buyer Beware!  This is a COLORIZED movie, and a poor one at that.  Gone is any sense of character, drama, tonal texture, or depth of picture that we remember from the original.  The manufacturer didn't even give us the  opportunity to select either Black &amp; White or colorized versions, an  obvious possibility in DVD.",1,BUYER BEWARE,947808000,"01 14, 2000",2000,321,"['Buyer', 'Beware', 'COLORIZED', 'movie', 'poor', 'one', 'Gone', 'sense', 'character', 'drama', 'tonal', 'texture', 'depth', 'picture', 'remember', 'original', 'manufacturer', 'did', ""n't"", 'even', 'give', 'opportunity', 'select', 'Black', 'amp', 'White', 'colorized', 'versions', 'obvious', 'possibility', 'DVD']",N/A
257711,A1D3HQWSVEMBAV,630159942X,"likes good books, music, movies","[0, 0]","The movie opens with a young Gehrig (Cooper) trading baseball cards of legendary players to get into a sandlot game. He hits a homer that clears the street beyond the fence and breaks a store window, causing a showdown with his parents, police, and store owner. Then the conflict shifts to parents' expectataions of him being an engineer instead of following his dream to play major league ball.Fictionalized at many points, the movie at least stays true to Gehrig's farewell speech to a packed Yankee stadium. Cooper's cool levelheaded acting enshrines that moment as one of the best in sports. His slow shuffle back to the dugout with head bowed is a perfect ending.",4,cooper plays ball,1362960000,"03 11, 2013",2013,668,"['movie', 'young', 'Gehrig', 'Cooper', 'trading', 'baseball', 'cards', 'legendary', 'players', 'get', 'sandlot', 'game', 'homer', 'street', 'fence', 'store', 'window', 'causing', 'showdown', 'parents', 'police', 'store', 'owner', 'Then', 'conflict', 'shifts', 'parents', 'expectataions', 'being', 'engineer', 'instead', 'following', 'dream', 'play', 'major', 'league', 'ball.Fictionalized', 'many', 'points', 'movie', 'least', 'stays', 'true', 'Gehrig', 'farewell', 'speech', 'packed', 'Yankee', 'stadium', 'Cooper', 'cool', 'levelheaded', 'acting', 'enshrines', 'moment', 'one', 'best', 'sports', 'slow', 'shuffle', 'back', 'dugout', 'head', 'bowed', 'perfect', 'ending']",N/A
257712,ADKKPQW5FQQME,630159942X,"Linda M. Carter ""mtc1231""","[2, 2]","""The Pride of the Yankees"" was an excellent movie.  It will be especially interesting and enjoyable for those who love baseball and history of the players, as well.  Thank you for shipping it so promptly and it was received in excellent condition.",5,Baseball memories...,1181520000,"06 11, 2007",2007,247,"['Pride', 'Yankees', 'was', 'excellent', 'movie', 'will', 'be', 'especially', 'interesting', 'enjoyable', 'who', 'love', 'baseball', 'history', 'players', 'as', 'well', 'Thank', 'shipping', 'so', 'promptly', 'was', 'received', 'excellent', 'condition']",N/A
257713,A3EHDOGAPUR9A4,630159942X,Lone Star Bob,"[1, 1]","Anyone who likes baseball will likely to like this movie.  I suspect it is a screen writer's version of Gehrig's actual life, but it is enjoyable and I'm not a Yankee fan.  Several players who played with Gehrig appear in the movie including George Herman (Babe) Ruth.",5,The Pride of the Yankees,1395273600,"03 20, 2014",2014,268,"['Anyone', 'who', 'baseball', 'will', 'likely', 'like', 'movie', 'suspect', 'screen', 'writer', 'version', 'Gehrig', 'actual', 'life', 'enjoyable', ""'m"", 'not', 'Yankee', 'fan', 'Several', 'players', 'who', 'played', 'Gehrig', 'appear', 'movie', 'including', 'George', 'Herman', 'Babe', 'Ruth']",N/A
257714,A36NW00607K49I,630159942X,"Long Island, East, member","[3, 5]","Colorized version of 1942 movie. Gary Cooper, Babe Ruth, and Teresa Wright present story of Lou Gehrig of the New York Yankees who became cripled with  &quot;Lou Gehrig's disease.&quot; The finest scene for us was his  historical speech. Gehrig's final goodbye was a lesson in true character.  Beautifully down by Gary Cooper.  **Note:  Since Gary Cooper was a natural  right-hander and Lou Gehrig a lefty, the baseball hitting scenes were  filmed with Cooper swinging as a righty then the film was reversed to make  him appear to be a natural left. Kewl eh?",5,Heartfelt Story,966816000,"08 21, 2000",2000,558,"['Colorized', 'version', '1942', 'movie', 'Gary', 'Cooper', 'Babe', 'Ruth', 'Teresa', 'Wright', 'present', 'story', 'Lou', 'Gehrig', 'New', 'York', 'Yankees', 'who', 'became', 'cripled', 'quot', 'Lou', 'Gehrig', 'disease.', 'quot', 'finest', 'scene', 'was', 'historical', 'speech', 'Gehrig', 'final', 'goodbye', 'was', 'lesson', 'true', 'character', 'Beautifully', 'down', 'Gary', 'Cooper', '**Note', 'Gary', 'Cooper', 'was', 'natural', 'right-hander', 'Lou', 'Gehrig', 'lefty', 'baseball', 'hitting', 'scenes', 'were', 'filmed', 'Cooper', 'swinging', 'righty', 'then', 'film', 'was', 'reversed', 'make', 'appear', 'be', 'natural', 'left', 'Kewl', 'eh']",N/A
257715,A25KKXUQQ0OLWB,630159942X,"Lynn Ellingwood ""The ESOL Teacher""","[2, 2]","I have loved this movie since I was a child and it still packs a wallop.  Gary Cooper stars in his greatest role as Lou Gehrig, a famous baseball player of the 20s.  The movie covers his rise to baseball greatness from an immigrant household with a loving but domineering mother to his marriage to his illness.  The disease is now called Lou Gehrig's disease and is a nervous disorder which destroys the muscles.  The ending is Lou's great speech retiring from the Yankees.  Teresa Wright stars has his wife and the other actors are perfect.  A well made film with few if any flaws.  One of the greats, a classic.",5,"Touching, Tear-Jerking Story",1248912000,"07 30, 2009",2009,613,"['have', 'loved', 'movie', 'was', 'child', 'still', 'wallop', 'Gary', 'Cooper', 'greatest', 'role', 'Lou', 'Gehrig', 'famous', 'baseball', 'player', '20s', 'movie', 'rise', 'baseball', 'greatness', 'immigrant', 'household', 'loving', 'domineering', 'mother', 'marriage', 'illness', 'disease', 'now', 'called', 'Lou', 'Gehrig', 'disease', 'nervous', 'disorder', 'muscles', 'ending', 'Lou', 'great', 'speech', 'retiring', 'Yankees', 'Teresa', 'Wright', 'wife', 'other', 'actors', 'are', 'perfect', 'well', 'made', 'film', 'few', 'flaws', 'One', 'greats', 'classic']",N/A
257716,A3O2RCKAMSE9X7,630159942X,Martin Asiner,"[6, 7]","There are movies that involve the audience about the life of its star and there are others that use gimmicks to hide the fact that the audience never gets to look at the star from the inside.  In PRIDE OF THE YANKEES director Sam Wood gave us a movie that has already stood the test of time as one of the best movies to come out of Hollywood.  The high quality of this film is mostly because of Gary Cooper's startlingly realistic portrayal of a baseball icon whose playing career overlapped the cinematic career of the film icon who played him. The audience sees the man in a way that the fans in the stands could not.  Cooper carries the movie in the same way that he carries SERGEANT YORK, by his straightforward radiating of emotion that is often at odds with the face that says one thing but the eyes that say another.The young Lou Gehrig starts off as a youth loving baseball so much that he has to hide his love from a mother who wants Lou to surpass Uncle Otto as a symbol of success.  Lou hears his mother praise Uncle Otto and assures her that he will follow in his footsteps, but his eyes tell another story.  In fact, throughout this movie, it is his eyes that speak more eloquently than anything else he can say or do. Lou winds up in Columbia on a scholarship, and during a frat party hazing designed to test his ability to endure a razzing, Lou retreats within himself until he can retreat no more.  For the first time in this film, and very nearly for his entire movie career as well, Cooper shows the anger that we all knew lay buried deep. Cooper made a career out of rechanneling emotion into productive ends, and as Lou Gehrig, he can redirect his inner chi into belting baseballs over walls well enough to earn a tryout with the New York Yankees.  By this time, the audience is hooked by their caring for a man who combines the best of the American ideals of hard work and talent with the self-effacing that marks most film icons of that time.Theresa Wright plays first his girlfriend, then later his wife. She is simply wonderful as the cultured girl who falls for the small town hero. They poke fun of each other but the audience knows that what they are really saying is the Real Thing.  Theresa Wright knows exactly when to back off and let Cooper be at center stage and when to interact with him to produce some truly stirring moments.  There are two scenes that stand out as unforgettable, one with Wright, the other without.  The first occurs when Lou has been playing poorly.  He has been striking out, dropping easy catches, and running awkwardly. His teammates are puzzled and mix anger with concern.  After a loss caused by his poor play, Lou sits on a bench, trying to make sense of a body that had never before betrayed him.  As he leans forward to untie his laces, he continues to fall, rolling over onto the floor.  His mates pretend not to notice.  Lou says nothing but his face tells the audience all that they need to know.  The fear that often bubbles just beneath the skin in many of Cooper's movies surfaces, and that fear clicks in the hearts of all.  Later, when he has seen a doctor and knows that his illness, Amyotrophic Lateral Sclerosis, is terminal, he decides to hide this knowledge from his wife who nevertheless has already guessed the truth, but tries to hide that from him. There is a heartbreaking scene in which she tries to raise his spirits by donning a barker's hat and mustache.  As she stares at him, she laughs.  As she hugs him, her eyes reveal her own torment.  Each actor is absolutely convincing in their respective attempts to hide what they know, while pretending all is well.PRIDE OF THE YANKEES tells a story well-known to anyone who reads the sports pages.  It features Cooper in center stage, with a supporting cast including Walter Brennan and Dan Duryea, both of whom interact credibly with him and Ms. Wright.  This is more than a baseball bio of a man who hits it big in his game.  It is more the story of a giant who continued to hit it big even after the fans have left the stadium.",5,Pride of the Yankees: Lou Gehrig as True Hero,1025568000,"07 2, 2002",2002,4061,"['are', 'movies', 'involve', 'audience', 'life', 'star', 'are', 'others', 'use', 'gimmicks', 'hide', 'fact', 'audience', 'never', 'look', 'star', 'inside', 'PRIDE', 'THE', 'YANKEES', 'director', 'Sam', 'Wood', 'gave', 'movie', 'already', 'stood', 'test', 'time', 'one', 'best', 'movies', 'come', 'Hollywood', 'high', 'quality', 'film', 'mostly', 'Gary', 'Cooper', 'startlingly', 'realistic', 'portrayal', 'baseball', 'icon', 'playing', 'career', 'overlapped', 'cinematic', 'career', 'film', 'icon', 'who', 'played', 'audience', 'man', 'way', 'fans', 'stands', 'could', 'not', 'Cooper', 'movie', 'same', 'way', 'SERGEANT', 'YORK', 'straightforward', 'radiating', 'emotion', 'often', 'odds', 'face', 'one', 'thing', 'eyes', 'say', 'another.The', 'young', 'Lou', 'Gehrig', 'off', 'youth', 'loving', 'baseball', 'so', 'much', 'hide', 'love', 'mother', 'who', 'Lou', 'surpass', 'Uncle', 'Otto', 'symbol', 'success', 'Lou', 'mother', 'praise', 'Uncle', 'Otto', 'will', 'follow', 'footsteps', 'eyes', 'tell', 'story', 'fact', 'movie', 'eyes', 'speak', 'more', 'eloquently', 'anything', 'else', 'can', 'say', 'do', 'Lou', 'up', 'Columbia', 'scholarship', 'frat', 'party', 'hazing', 'designed', 'test', 'ability', 'endure', 'razzing', 'Lou', 'can', 'retreat', 'more', 'first', 'time', 'film', 'very', 'nearly', 'entire', 'movie', 'career', 'well', 'Cooper', 'anger', 'knew', 'lay', 'buried', 'deep', 'Cooper', 'made', 'career', 'rechanneling', 'emotion', 'productive', 'ends', 'Lou', 'Gehrig', 'can', 'redirect', 'inner', 'chi', 'belting', 'baseballs', 'walls', 'well', 'enough', 'earn', 'tryout', 'New', 'York', 'Yankees', 'time', 'audience', 'hooked', 'caring', 'man', 'who', 'best', 'American', 'ideals', 'hard', 'work', 'talent', 'self-effacing', 'most', 'film', 'icons', 'time.Theresa', 'Wright', 'plays', 'first', 'girlfriend', 'then', 'later', 'wife', 'simply', 'wonderful', 'cultured', 'girl', 'who', 'small', 'town', 'hero', 'poke', 'fun', 'other', 'audience', 'what', 'are', 'really', 'saying', 'Real', 'Thing', 'Theresa', 'Wright', 'exactly', 'when', 'back', 'off', 'let', 'Cooper', 'be', 'center', 'stage', 'when', 'interact', 'produce', 'truly', 'stirring', 'moments', 'are', 'two', 'scenes', 'stand', 'out', 'unforgettable', 'one', 'Wright', 'other', 'first', 'when', 'Lou', 'been', 'playing', 'poorly', 'been', 'striking', 'out', 'dropping', 'easy', 'catches', 'running', 'awkwardly', 'teammates', 'are', 'puzzled', 'mix', 'anger', 'concern', 'loss', 'caused', 'poor', 'play', 'Lou', 'bench', 'trying', 'make', 'sense', 'body', 'had', 'never', 'before', 'betrayed', 'forward', 'untie', 'laces', 'fall', 'rolling', 'floor', 'mates', 'pretend', 'not', 'notice', 'Lou', 'nothing', 'face', 'audience', 'need', 'know', 'fear', 'often', 'just', 'beneath', 'skin', 'many', 'Cooper', 'movies', 'surfaces', 'fear', 'clicks', 'hearts', 'Later', 'when', 'seen', 'doctor', 'illness', 'Amyotrophic', 'Lateral', 'Sclerosis', 'terminal', 'hide', 'knowledge', 'wife', 'who', 'nevertheless', 'already', 'guessed', 'truth', 'tries', 'hide', 'heartbreaking', 'scene', 'raise', 'spirits', 'donning', 'barker', 'hat', 'mustache', 'hugs', 'eyes', 'reveal', 'own', 'torment', 'actor', 'absolutely', 'convincing', 'respective', 'attempts', 'hide', 'what', 'know', 'pretending', 'well.PRIDE', 'THE', 'YANKEES', 'story', 'well-known', 'anyone', 'who', 'sports', 'pages', 'Cooper', 'center', 'stage', 'supporting', 'cast', 'including', 'Walter', 'Brennan', 'Dan', 'Duryea', 'whom', 'interact', 'credibly', 'Ms.', 'Wright', 'more', 'baseball', 'bio', 'man', 'who', 'big', 'game', 'more', 'story', 'giant', 'who', 'continued', 'hit', 'big', 'even', 'fans', 'have', 'left', 'stadium']",N/A
