,reviewerID,asin,reviewerName,helpful,reviewText,overall,summary,unixReviewTime,reviewTime,reviewYear,reviewLength,meaningfulWords,Title
257681,A315K47GRB024C,630159942X,Daniel C. Markel,"[7, 7]","This review is for the DVD released by MGM in 2002.The Pride of the Yankees is the story of baseball Hall of Famer Lou Gehrig.  His nickname was the ""Iron Horse"" which he earned for playing 2,130 consecutive games for the New York Yankees from the mid 1920's to the late 1930's.  That was a major league record for many years until Cal Ripken Jr. broke it 1995.  Of course Lou Gehrig will also be remembered as a courageous man who died from Amyotrophic Lateral Sclerosis, sometimes also referred to as ""Lou Gehrig's Disease"".The movie stars Gary Cooper as Lou Gehrig.  The movie is a gem and has essentially four facets to it.  One area of lengthy coverage was his relationship with his domineering German mother (played by Elsa Janssen).  A second subplot is courting and marrying his wife (played by Teresa Wright).  The third subject of lengthy coverage was his great baseball career and the final facet of the film was Gehrig facing his mortality at a relatively early age.  Of course these four areas overlap into each other throughout the movie.  From a personal viewpoint, I would have liked to have seen a lot more about his baseball career and less of his love life.  (I'm sure this was done intentionally to get women to into the theaters.)  The movie is sugarcoated and squeaky clean and very corny at times, but personally I'd rather watch a movie like this than films like the Babe Ruth or Ty Cobb movies that were made in the 1990's where they exposed all of the dirty laundry in their private lives.Pride of the Yankees is a classic, especially with the unforgettable ""I consider myself the luckiest guy on the face of the earth"" speech at Yankee Stadium.  Another wonderful treat is to see Babe Ruth play himself in the movie and there are also a few brief scenes with another Yankee great: Bill Dickey.  Another nice feature were the shots of the various American League ball barks Gehrig played in.  It was also great to see some shots of the old grandstands of Yankee Stadium before it was renovated in the mid-`70s.  Overall, this a movie the whole family, from 6 to 96, can enjoy.The DVD picture quality is outstanding.  The black and white transfer is impeccable.  I don't recall seeing the slightest flaw throughout the entire movie and the sharpness is excellent.  The sound is fine too.  The DVD lacked bonus features which is a shame for a movie that has been so highly acclaimed for so many generations.  There was a lot of about his baseball career that wasn't covered in the movie, but could have been covered in a documentary by sportswriters and sports historians.  The movie itself had some interesting stories regarding how it was filmed.  I had once read an article regarding how they filmed Cooper playing Gehrig.  Since Cooper was right handed and Gehrig was left handed, they would film Cooper running to third base from home instead of from home to first after getting a hit and then reverse the negative.Movie: ADVD Quality: A+",5,The story of a great man on the field as well as off the field!,1123113600,"08 4, 2005",2005,2967,"['review', 'DVD', 'released', 'MGM', '2002.The', 'Pride', 'Yankees', 'story', 'baseball', 'Hall', 'Famer', 'Lou', 'Gehrig', 'nickname', 'was', 'Iron', 'Horse', 'earned', 'playing', '2,130', 'consecutive', 'games', 'New', 'York', 'mid', '1920', 'late', '1930', 'was', 'major', 'league', 'record', 'many', 'years', 'Cal', 'Ripken', 'Jr.', 'broke', '1995', 'course', 'Lou', 'Gehrig', 'will', 'also', 'be', 'remembered', 'courageous', 'man', 'who', 'died', 'Amyotrophic', 'Lateral', 'Sclerosis', 'sometimes', 'also', 'referred', 'Lou', 'Gehrig', 'Disease', 'movie', 'stars', 'Gary', 'Cooper', 'Lou', 'Gehrig', 'movie', 'gem', 'essentially', 'four', 'facets', 'One', 'area', 'lengthy', 'coverage', 'was', 'relationship', 'domineering', 'German', 'mother', 'played', 'Elsa', 'Janssen', 'second', 'subplot', 'courting', 'marrying', 'wife', 'played', 'Teresa', 'Wright', 'third', 'subject', 'lengthy', 'coverage', 'was', 'great', 'baseball', 'career', 'final', 'facet', 'film', 'was', 'Gehrig', 'facing', 'mortality', 'relatively', 'early', 'age', 'course', 'four', 'areas', 'overlap', 'other', 'movie', 'personal', 'viewpoint', 'would', 'have', 'liked', 'have', 'seen', 'lot', 'more', 'baseball', 'career', 'less', 'love', 'life', ""'m"", 'sure', 'was', 'done', 'intentionally', 'get', 'women', 'theaters', 'movie', 'sugarcoated', 'squeaky', 'clean', 'very', 'corny', 'times', 'personally', ""'d"", 'rather', 'watch', 'movie', 'films', 'Babe', 'Ruth', 'Ty', 'Cobb', 'movies', 'were', 'made', '1990', 'where', 'exposed', 'dirty', 'laundry', 'private', 'lives.Pride', 'Yankees', 'classic', 'especially', 'unforgettable', 'consider', 'luckiest', 'guy', 'face', 'earth', 'speech', 'Yankee', 'Stadium', 'wonderful', 'treat', 'see', 'Babe', 'Ruth', 'play', 'movie', 'are', 'also', 'few', 'brief', 'scenes', 'Yankee', 'great', 'Bill', 'Dickey', 'nice', 'feature', 'were', 'shots', 'various', 'American', 'League', 'ball', 'barks', 'Gehrig', 'played', 'was', 'also', 'great', 'see', 'shots', 'old', 'grandstands', 'Yankee', 'Stadium', 'was', 'renovated', 'mid-', '70s', 'Overall', 'movie', 'whole', 'family', '6', '96', 'can', 'enjoy.The', 'DVD', 'picture', 'quality', 'outstanding', 'black', 'white', 'transfer', 'impeccable', 'do', ""n't"", 'recall', 'seeing', 'slightest', 'flaw', 'entire', 'movie', 'sharpness', 'excellent', 'sound', 'fine', 'too', 'DVD', 'lacked', 'bonus', 'features', 'shame', 'movie', 'been', 'so', 'highly', 'acclaimed', 'so', 'many', 'generations', 'was', 'lot', 'baseball', 'career', 'was', ""n't"", 'covered', 'movie', 'could', 'have', 'been', 'covered', 'documentary', 'sportswriters', 'sports', 'historians', 'movie', 'had', 'interesting', 'stories', 'regarding', 'how', 'was', 'filmed', 'had', 'once', 'read', 'article', 'regarding', 'how', 'filmed', 'Cooper', 'playing', 'Gehrig', 'Cooper', 'was', 'right', 'handed', 'Gehrig', 'was', 'left', 'handed', 'would', 'film', 'Cooper', 'running', 'third', 'base', 'home', 'instead', 'home', 'first', 'getting', 'hit', 'then', 'reverse', 'negative.Movie', 'ADVD', 'Quality', 'A+']",N/A
257682,A2XBDRWX6UX6H8,630159942X,DavJan,"[0, 0]","I ordered this movie and low and behold I found one exactly like it at a yard sale the next day,  that gave me one to give to my son-in-law.",4,Great Movie,1364083200,"03 24, 2013",2013,140,"['ordered', 'movie', 'low', 'behold', 'found', 'one', 'exactly', 'yard', 'sale', 'next', 'day', 'gave', 'one', 'give', 'son-in-law']",N/A
257683,A2SPTQL4986HYY,630159942X,Deborah J. Dirk-Haley,"[1, 1]","This is a kind of movie a person can watch over and over again. The actors in the movie were very believeable, and what made the movie complete was the appearance of Babe Ruth in the movie. The movie was as accurate of the facts of the life of Lou Gerig more so than most movie biographicals. Sometimes Hollywood has a tendecy to exagerate the life of a person or persons they are trying to portray. A well done movie.",5,A Classic Movie,1273449600,"05 10, 2010",2010,418,"['kind', 'movie', 'person', 'can', 'watch', 'over', 'again', 'actors', 'movie', 'were', 'very', 'believeable', 'what', 'made', 'movie', 'complete', 'was', 'appearance', 'Babe', 'Ruth', 'movie', 'movie', 'was', 'accurate', 'facts', 'life', 'Lou', 'Gerig', 'more', 'so', 'most', 'movie', 'biographicals', 'Sometimes', 'Hollywood', 'tendecy', 'exagerate', 'life', 'person', 'persons', 'are', 'trying', 'portray', 'well', 'done', 'movie']",N/A
257684,A3DAJBWIBCNL0D,630159942X,Denise McLemore,"[0, 0]",I got this movie as a gift for my husband.  He loves it!  It is one of the best movies ever!,5,Great movie!,1355788800,"12 18, 2012",2012,92,"['got', 'movie', 'gift', 'husband', 'one', 'best', 'movies', 'ever']",N/A
257685,AGNOPNCN6FHB6,630159942X,DoMeNiQuE  CoE,"[0, 0]","wonderful story of hard working talented humble man who gained the respect of even the most jaded journalist fishing for salicious headlines... don't have to be a baseball fan to appreciate the many accomplishments and a man beating to his own drum, heartfelt rollercoaster ride of joys and the depth of sorrow for a phenomenal career ending in debilitating illness.... the horseshoe flower fight perhaps reveals the most telling aspect of his condition given how he persevered through many injuries and illness so as to not break his 2,130 game attendance streak, terrible cost but hard to judge the impact of this resolve... high recommend for Cooper fans, immigrant assimilation, good clean hardworking man makes for an American hero.... wish there were more like them!!",4,Pride of America!!,1346025600,"08 27, 2012",2012,773,"['wonderful', 'story', 'hard', 'working', 'talented', 'humble', 'man', 'who', 'gained', 'respect', 'even', 'most', 'jaded', 'journalist', 'fishing', 'salicious', 'headlines', 'do', ""n't"", 'have', 'be', 'baseball', 'fan', 'appreciate', 'many', 'accomplishments', 'man', 'beating', 'own', 'drum', 'heartfelt', 'rollercoaster', 'ride', 'joys', 'depth', 'sorrow', 'phenomenal', 'career', 'ending', 'debilitating', 'illness', 'horseshoe', 'flower', 'fight', 'perhaps', 'most', 'telling', 'aspect', 'condition', 'given', 'how', 'persevered', 'many', 'injuries', 'illness', 'so', 'as', 'not', 'break', '2,130', 'game', 'attendance', 'streak', 'terrible', 'cost', 'hard', 'judge', 'impact', 'resolve', 'high', 'recommend', 'Cooper', 'fans', 'immigrant', 'assimilation', 'good', 'clean', 'hardworking', 'man', 'American', 'hero', 'wish', 'were', 'more']",N/A
257686,A1LACH6MLQWZ,630159942X,Doug Erlandson,"[4, 4]","""Pride of the Yankees"" has two things going for it that many sports movies lack. First, it has one of the greatest actors of all time, Gary Cooper, who, whether he is playing Sergeant York or the sheriff in ""High Noon"" or Lou Gehrig, always rises to the top. Second, it is the story of Lou Gehrig, a truly legendary ballplayer, who played in a simpler era long before the age of multimillion dollar contracts and steroids, when character stood for something. And Lou Gehrig, by all accounts, had a stellar character. But the movie is more than a sports movie, for it also takes us into the immigrant home in which he grew up, his love for the game, exemplified by his willingness to play ball with the kids on the neighborhood field, and his ultimately losing battle with ALS.While there are some minor inaccuracies in the movie, they do not in any way detract from the overall story, one that is as compelling today as it was when the movie was first made in 1943. But these are more than offset by the positive message that is conveyed, which is that whether we live a long life or one cut short, as was Gehrig's, it is far better for us to count our blessings than to dwell on our woes. For in every way Gehrig, despite the blow that he was dealt, realized that he had had a great life and was truly thankful for it.This is a movie for everyone, not just for baseball junkies, although the latter will appreciate the cameo appearances of Babe Ruth, Bob Meusel, and Bill Dickey, among others.",5,Timeless movie,1381968000,"10 17, 2013",2013,1494,"['Pride', 'Yankees', 'two', 'things', 'going', 'many', 'sports', 'movies', 'lack', 'First', 'one', 'greatest', 'actors', 'time', 'Gary', 'Cooper', 'who', 'playing', 'Sergeant', 'York', 'sheriff', 'High', 'Noon', 'Lou', 'Gehrig', 'always', 'top', 'Second', 'story', 'Lou', 'Gehrig', 'truly', 'legendary', 'ballplayer', 'who', 'played', 'simpler', 'era', 'long', 'age', 'multimillion', 'dollar', 'contracts', 'steroids', 'when', 'character', 'stood', 'something', 'Lou', 'Gehrig', 'accounts', 'had', 'stellar', 'character', 'movie', 'more', 'sports', 'movie', 'also', 'immigrant', 'home', 'grew', 'up', 'love', 'game', 'exemplified', 'willingness', 'play', 'ball', 'kids', 'neighborhood', 'field', 'ultimately', 'losing', 'battle', 'ALS.While', 'are', 'minor', 'inaccuracies', 'movie', 'do', 'not', 'way', 'detract', 'overall', 'story', 'one', 'compelling', 'today', 'was', 'when', 'movie', 'was', 'first', 'made', '1943', 'are', 'more', 'offset', 'positive', 'message', 'conveyed', 'live', 'long', 'life', 'one', 'cut', 'short', 'was', 'Gehrig', 'far', 'better', 'count', 'blessings', 'dwell', 'woes', 'way', 'Gehrig', 'blow', 'was', 'dealt', 'realized', 'had', 'had', 'great', 'life', 'was', 'truly', 'thankful', 'it.This', 'movie', 'everyone', 'not', 'just', 'baseball', 'junkies', 'latter', 'will', 'appreciate', 'cameo', 'appearances', 'Babe', 'Ruth', 'Bob', 'Meusel', 'Bill', 'Dickey', 'others']",N/A
257687,A3IZBECX6PQBD7,630159942X,Dr. S. G. Ph D,"[0, 2]","First introduction to the Iron Horse, it is a must have for any sports fan",5,I grew up on this.,1255651200,"10 16, 2009",2009,74,"['First', 'introduction', 'Iron', 'Horse', 'must', 'have', 'sports', 'fan']",N/A
257688,A2BT7IC8PT1ZC9,630159942X,earth1,"[9, 9]","This is my favorite sports movie to date. Most peopledon't know how great Gehrig really was! Or the factthat he played his 2130 game streak, with 17 fracturesin his hands, over that period! Imagine if he could haveplayed another 5 years, what he could have done! He holdsmany records that will never be broken. He is truly alegend! Gary Cooper did a great job playing Gehrig! Onceyou see this classic film, you'll never forget it! Thismovie is close to me, because I also have (A.L.S.)Lou Gehrigs Disease, but I'm proud to know, that I sharethis devistating disease, with such a legend!",5,A VERY UNDERRATED LEGEND!!!,1111449600,"03 22, 2005",2005,586,"['favorite', 'sports', 'movie', 'date', 'Most', 'peopledo', ""n't"", 'know', 'how', 'great', 'Gehrig', 'really', 'was', 'factthat', 'played', '2130', 'game', 'streak', '17', 'fracturesin', 'hands', 'period', 'Imagine', 'could', 'haveplayed', '5', 'years', 'what', 'could', 'have', 'done', 'holdsmany', 'records', 'will', 'never', 'be', 'broken', 'truly', 'alegend', 'Gary', 'Cooper', 'did', 'great', 'job', 'playing', 'Gehrig', 'Onceyou', 'see', 'classic', 'film', ""'ll"", 'never', 'forget', 'Thismovie', 'close', 'also', 'have', 'A.L.S', 'Lou', 'Gehrigs', 'Disease', ""'m"", 'proud', 'know', 'sharethis', 'devistating', 'disease', 'legend']",N/A
257689,A3B9XTIDLP6BKN,630159942X,ellison,"[0, 1]",Story of New York Yankee Lou Gehrig who played a record amount of consecutive games but his career was brought to a halt when he gets ALS which is eventually associated with his name.,4,The Iron Horse is felled,1401494400,"05 31, 2014",2014,183,"['Story', 'New', 'York', 'Yankee', 'Lou', 'Gehrig', 'who', 'played', 'record', 'amount', 'consecutive', 'games', 'career', 'was', 'brought', 'halt', 'when', 'ALS', 'eventually', 'associated', 'name']",N/A
257690,A2II64KQ6ESWRX,630159942X,Gary Cooper Fan,"[14, 17]","Also I would like to warn all people on MGM special anniversary editions to movies. I picked up Pride of the Yankees for the dvd art work eventhough I knew it was the exact same movie transfer of the film as it the cheapest mgm Gary cooper movie at only 7.99. I found out why it is the cheapest. Be warned that MGM while quite good at releasing basic movies are the worst at releasing special anniversary editions to any film that they own. Pride of the Yankees 35th anniversary edition comes in a cardboard sleeve. Upon removing this cardboard sleeve, I discovered that the actual artwork on the dvd case is the same as the previous release. In fact it is the previous release with just a cardboard slip case over top of it. They were too lazy to update the artwork to the actual inside dvd case. I am not sure but I don't think they have ever restored or given any extras to any classic movie they own. It is all an evil marketing sceme to fool the customer on their latest anniversary releases where they only update the slip case and not even the dvd case inside.  This is a very unerhanded practice that I will never support again. Despite the 8 Gary Cooper releases last year, I do believe that MGM is the bottom of the barrel for movie companies releasing dvds.This is a five star movie and one of Gary Cooper's top five movies in my opinion, but will not rate it any higher than one star for the rip off dvd from MGM.",1,Same dvd as previous release with updated slip case,1196294400,"11 29, 2007",2007,1425,"['Also', 'would', 'like', 'warn', 'people', 'MGM', 'special', 'anniversary', 'editions', 'movies', 'picked', 'up', 'Pride', 'Yankees', 'dvd', 'art', 'work', 'knew', 'was', 'exact', 'same', 'movie', 'transfer', 'film', 'cheapest', 'mgm', 'Gary', 'cooper', 'movie', 'only', '7.99', 'found', 'out', 'why', 'cheapest', 'Be', 'warned', 'MGM', 'quite', 'good', 'releasing', 'basic', 'movies', 'are', 'worst', 'releasing', 'special', 'anniversary', 'editions', 'film', 'own', 'Pride', 'Yankees', '35th', 'anniversary', 'edition', 'cardboard', 'sleeve', 'removing', 'cardboard', 'sleeve', 'discovered', 'actual', 'artwork', 'dvd', 'case', 'same', 'previous', 'release', 'fact', 'previous', 'release', 'just', 'cardboard', 'slip', 'case', 'top', 'were', 'too', 'lazy', 'update', 'artwork', 'actual', 'inside', 'dvd', 'case', 'am', 'not', 'sure', 'do', ""n't"", 'think', 'have', 'ever', 'restored', 'given', 'extras', 'classic', 'movie', 'own', 'evil', 'marketing', 'sceme', 'fool', 'customer', 'latest', 'anniversary', 'releases', 'where', 'only', 'update', 'slip', 'case', 'not', 'even', 'dvd', 'case', 'inside', 'very', 'unerhanded', 'practice', 'will', 'never', 'support', 'again', '8', 'Gary', 'Cooper', 'last', 'year', 'do', 'believe', 'MGM', 'bottom', 'barrel', 'movie', 'companies', 'releasing', 'dvds.This', 'five', 'star', 'movie', 'one', 'Gary', 'Cooper', 'top', 'five', 'movies', 'opinion', 'will', 'not', 'rate', 'higher', 'one', 'star', 'rip', 'dvd', 'MGM']",N/A
257691,A37BTU85F17716,630159942X,"Glenn R. Smith ""WHO FREAK""","[0, 0]",This is a truly great film and one of the most poerful stories and performances ever. Cooper is stunning in this film. Heartbreaking story.I'm not a Yankees fan but you gotta be inhuman not to be touched by this film!,5,LOU!,1378944000,"09 12, 2013",2013,217,"['truly', 'great', 'film', 'one', 'most', 'poerful', 'stories', 'performances', 'ever', 'Cooper', 'stunning', 'film', 'Heartbreaking', 'story.I', ""'m"", 'not', 'Yankees', 'fan', 'got', 'ta', 'be', 'inhuman', 'not', 'be', 'touched', 'film']",N/A
257692,A3UOYFUDSXJLVX,630159942X,Hal,"[0, 0]",This was an excellent movie and I would recommend it to anyone who loves Baseball.  My wife and I really enjoyed it.,5,The Pride of the Yankees,1402531200,"06 12, 2014",2014,116,"['was', 'excellent', 'movie', 'would', 'recommend', 'anyone', 'who', 'Baseball', 'My', 'wife', 'really', 'enjoyed']",N/A
257693,A16CZRQL23NOIW,630159942X,Hiram Gomez Pardo,"[2, 2]","This is the masterpiece of SamWood. Never, in the story of the American Cinema we will have the chance and delight of watching a perfect film, loaded with diginity, humanity and powerful human quality of Lou Gehrig like this one.To affirm that Gary Cooper at least deserved to share the Prize as Best Actor with James Cagney it would not sound exaggerate.Nine nominations to the Academy Awards. And winner in just one issue: Set up.2130 games all the honors and the final speech, radiant humor, adequate balance and kinetic pulse , a splendid cast with Teresa Wright and that Super Nova actor as Walter Breenan was make of this film one of the one hundred American films in any age.Touching, emotive and poignant portrait. And if besides you are a Yankee fan as I do, the pleasure will be the double.A feast to the spirit.!",5,The best baseball picture ever made!,1108166400,"02 12, 2005",2005,823,"['masterpiece', 'SamWood', 'Never', 'story', 'American', 'Cinema', 'will', 'have', 'chance', 'delight', 'watching', 'perfect', 'film', 'loaded', 'diginity', 'humanity', 'powerful', 'human', 'quality', 'Lou', 'Gehrig', 'one.To', 'affirm', 'Gary', 'Cooper', 'least', 'deserved', 'share', 'Prize', 'Best', 'Actor', 'James', 'Cagney', 'would', 'not', 'sound', 'exaggerate.Nine', 'nominations', 'Academy', 'Awards', 'winner', 'just', 'one', 'issue', 'Set', 'up.2130', 'games', 'honors', 'final', 'speech', 'radiant', 'humor', 'adequate', 'balance', 'kinetic', 'pulse', 'splendid', 'cast', 'Teresa', 'Wright', 'Super', 'Nova', 'actor', 'Walter', 'Breenan', 'was', 'make', 'film', 'one', 'one', 'hundred', 'American', 'films', 'age.Touching', 'emotive', 'poignant', 'portrait', 'are', 'Yankee', 'fan', 'do', 'pleasure', 'will', 'be', 'double.A', 'feast', 'spirit']",N/A
257694,AIFLON67HP637,630159942X,"James Fontanetta ""James Fontanetta""","[0, 8]","Every Yankee fan will consider October 30, 2007 a bittersweet day.Firstly, you have Joe Girardi at only 43 and very much respectedaround baseball named as the 32nd Manager of this storied franchise.In Girardi's only year managing (2006 Florida Marlins), he was namedNational League Manager of the Year.Then there's Joe Torre; Beloved Yankee skipper for 12 years.  12postseason appearances, 6 World Series appearances, 4 WorldChampionships, no argument here.So is this the right move?By turning the club over to a much younger manager and giving him athree-year deal, the Yankees have created a situation in which themanager's incentives more closely reflect the long-term goals of theclub, which revolve around young pitchers (Specifically JabaChamberlain, Philip Hughes and Ian Kennedy). All though he onlymanaged the one year, Girardi had a positive affect on the youngMarlins staff (in particular Josh Johnson, Anibal Sanchez, ScottOlsen).  A staff that struggled mightily following Girardi's prematuredeparture.Was it Girardi's overuse of the staff or a coincidence that all ofthese pitchers struggled in 2007?  If it's the former, then Girardican take solace in that the Yankee bullpen is more solid thanFlorida's 2006 version so that question is answered.Torre's makeup is geared more towards veterans.  All though from thisangle it is hard to argue that he didn't use the young pitcherscorrectly.  Most of the Yankee brass seem to believe he misused them.Perhaps this is the reason for their ""insulting"" contract offer toTorre all but sealing his fate.  In addition, Torre has never beenknown for developing young pitchers (Donovan Osbourne and Allen Watsonin St. Louis to name two).The Yankees are hopeful that Mariano Rivera, Jorge Posada, and maybeeven Alex Rodriguez don't follow Torre to Los Angeles (where he isabout to be named manager) and return to the Bronx and that AndyPettite exercises his 2008 player option.Even though Rodriguez opted out of his deal and unless Agent ScottBoras has a backdoor deal in place, ARod could return (provided theYankees can make it seem like they didn't give in).All things being considered and as much as Yankee fans wanted Torreback, the right move was made.",5,James Fontanetta,1193788800,"10 31, 2007",2007,2210,"['Yankee', 'fan', 'will', 'consider', 'October', '30', '2007', 'bittersweet', 'day.Firstly', 'have', 'Joe', 'Girardi', 'only', '43', 'very', 'much', 'respectedaround', 'baseball', 'named', '32nd', 'Manager', 'storied', 'franchise.In', 'Girardi', 'only', 'year', 'managing', '2006', 'Florida', 'Marlins', 'was', 'namedNational', 'League', 'Manager', 'Year.Then', 'Joe', 'Torre', 'Beloved', 'Yankee', 'skipper', '12', 'years', '12postseason', 'appearances', '6', 'World', 'Series', 'appearances', '4', 'WorldChampionships', 'argument', 'here.So', 'right', 'move', 'turning', 'club', 'much', 'younger', 'manager', 'giving', 'athree-year', 'deal', 'Yankees', 'have', 'created', 'situation', 'themanager', 'incentives', 'more', 'closely', 'reflect', 'long-term', 'goals', 'theclub', 'revolve', 'young', 'pitchers', 'Specifically', 'JabaChamberlain', 'Philip', 'Hughes', 'Ian', 'Kennedy', 'onlymanaged', 'one', 'year', 'Girardi', 'had', 'positive', 'affect', 'youngMarlins', 'staff', 'particular', 'Josh', 'Johnson', 'Anibal', 'Sanchez', 'ScottOlsen', 'staff', 'struggled', 'mightily', 'following', 'Girardi', 'prematuredeparture.Was', 'Girardi', 'overuse', 'staff', 'coincidence', 'ofthese', 'pitchers', 'struggled', '2007', 'former', 'then', 'Girardican', 'take', 'solace', 'Yankee', 'bullpen', 'more', 'solid', 'thanFlorida', '2006', 'version', 'question', 'answered.Torre', 'makeup', 'geared', 'more', 'towards', 'veterans', 'thisangle', 'hard', 'argue', 'did', ""n't"", 'use', 'young', 'pitcherscorrectly', 'Most', 'Yankee', 'brass', 'seem', 'believe', 'misused', 'them.Perhaps', 'reason', 'insulting', 'contract', 'offer', 'sealing', 'fate', 'addition', 'Torre', 'never', 'beenknown', 'developing', 'young', 'pitchers', 'Donovan', 'Osbourne', 'Allen', 'Watsonin', 'St.', 'Louis', 'name', 'two', '.The', 'Yankees', 'are', 'hopeful', 'Mariano', 'Rivera', 'Jorge', 'Posada', 'maybeeven', 'Alex', 'Rodriguez', 'do', ""n't"", 'follow', 'Torre', 'Los', 'Angeles', 'where', 'be', 'named', 'manager', 'return', 'Bronx', 'AndyPettite', '2008', 'player', 'option.Even', 'Rodriguez', 'opted', 'deal', 'Agent', 'ScottBoras', 'backdoor', 'deal', 'place', 'ARod', 'could', 'return', 'provided', 'theYankees', 'can', 'make', 'seem', 'did', ""n't"", 'give', '.All', 'things', 'being', 'considered', 'as', 'much', 'Yankee', 'fans', 'wanted', 'Torreback', 'right', 'move', 'was', 'made']",N/A
