,reviewerID,asin,reviewerName,helpful,reviewText,overall,summary,unixReviewTime,reviewTime,reviewYear,reviewLength,meaningfulWords,Title
322705,ACIBQ6BQ6AWEV,6302605156,"Gary F. Taylor ""GFT""","[8, 10]","Fine performances help this otherwise silly story of a World I-era show girl whose romantic entanglements lead her to uncover a German spy ring. Harlow and Tone are acceptable in their roles, and Harlow's charisma is given full play with her singing voice believably dubbed by vocalist Virginia Verrill; Lewis Stone also stands out in a supporting role. But the film belongs to Cary Grant, who gives a truly fine performance as the reckless, philandering flying ace that Harlow loves.The first half hour or so of the film is both slow and improbable; the remainder of the film is just as silly, but with the entrance of Cary Grant, however, the film picks up steam. Most viewers will enjoy the dog-fight scenes; discerning viewers will be amused to find Harlow's 1930s gowns uneasily mixed with the WWI background. Fans of the stars will certainly want the film in their collection, but the claptrap plot reduces it to a minor effort that few others will enjoy.",3,Fine Performances In Claptrap Melodrama,1008806400,"12 20, 2001",2001,961,"['Fine', 'help', 'otherwise', 'silly', 'story', 'World', 'I-era', 'show', 'girl', 'romantic', 'entanglements', 'lead', 'uncover', 'German', 'spy', 'ring', 'Harlow', 'Tone', 'are', 'acceptable', 'roles', 'Harlow', 'charisma', 'given', 'full', 'play', 'singing', 'voice', 'believably', 'dubbed', 'vocalist', 'Virginia', 'Verrill', 'Lewis', 'Stone', 'also', 'out', 'supporting', 'role', 'film', 'belongs', 'Cary', 'Grant', 'who', 'truly', 'fine', 'performance', 'reckless', 'philandering', 'flying', 'ace', 'Harlow', 'loves.The', 'first', 'half', 'hour', 'so', 'film', 'slow', 'improbable', 'remainder', 'film', 'just', 'silly', 'entrance', 'Cary', 'Grant', 'however', 'film', 'up', 'steam', 'Most', 'viewers', 'will', 'enjoy', 'dog-fight', 'scenes', 'discerning', 'viewers', 'will', 'be', 'amused', 'find', 'Harlow', '1930s', 'gowns', 'uneasily', 'mixed', 'WWI', 'background', 'Fans', 'stars', 'will', 'certainly', 'want', 'film', 'collection', 'claptrap', 'plot', 'minor', 'effort', 'few', 'others', 'will', 'enjoy']",Suzy VHS
322706,A2MFNDNS1L7D16,6302605156,JOHN GODFREY,"[4, 5]","We were robbed. Jean Harlow was just so beautiful & swinging into her prime. She was becoming a good actress, such as in Suzy. Yeah another goldigger part, but she not cheap, just cheeky. She's a showgirl, visiting England & looking for a rich husband. Instead she falls for a poor working-class inventor, Terry (Franchot Tome). She can cause men to act inplusively & Terry marries her almost immediately. So does Capt. Andre (Cary Grant). She flees to Paris when she thinks Terry has been murdered. Andre is a hotshot French pilot & is quite a philanderer, cheating on Suzy. That's the most unbelievable thing in this movie. He's newly-wed to Jean Harlow & she's spending nights alone pinning for him. It's war & of course Terry has recovered. He's in the RAF, finds, & confronts Suzy, who plans to tell Andre...soon. It all resolves itself as Andre is killed & buried with honors. Not even in the top 10 of Cary Grant's movies. He was still learning his ""craft"" as he put it. Jean Harlow didn't get much of a  chance to get better. Some good old time dog-fight & air battle scenes. Typical MGM mellow-drama from the 30's. But I like 'em.",5,"Suzy, Suzy, Suzy.",1142985600,"03 22, 2006",2006,1139,"['were', 'robbed', 'Jean', 'Harlow', 'was', 'just', 'so', 'beautiful', 'swinging', 'prime', 'was', 'becoming', 'good', 'actress', 'such', 'Suzy', 'Yeah', 'goldigger', 'part', 'not', 'cheap', 'just', 'cheeky', 'showgirl', 'visiting', 'England', 'looking', 'rich', 'husband', 'Instead', 'poor', 'working-class', 'inventor', 'Terry', 'Franchot', 'Tome', 'can', 'cause', 'men', 'act', 'inplusively', 'Terry', 'almost', 'immediately', 'So', 'Capt', 'Andre', 'Cary', 'Grant', 'Paris', 'when', 'Terry', 'been', 'murdered', 'Andre', 'hotshot', 'French', 'pilot', 'quite', 'philanderer', 'cheating', 'Suzy', 'most', 'unbelievable', 'thing', 'movie', 'newly-wed', 'Jean', 'Harlow', 'spending', 'nights', 'alone', 'pinning', 'war', 'course', 'Terry', 'recovered', 'RAF', 'confronts', 'Suzy', 'who', 'tell', 'Andre', 'soon', 'Andre', 'killed', 'buried', 'honors', 'Not', 'even', 'top', '10', 'Cary', 'Grant', 'movies', 'was', 'still', 'learning', 'craft', 'put', 'Jean', 'Harlow', 'did', ""n't"", 'get', 'much', 'chance', 'get', 'better', 'good', 'old', 'time', 'dog-fight', 'air', 'battle', 'scenes', 'Typical', 'MGM', 'mellow-drama', '30', 'like']",Suzy VHS
322707,A30P9NCFHZJ6MR,6302605156,Post Scriptum,"[15, 16]","This relatively overlooked movie has a little of everything:romance, comedy, tragedy, Paris, war, espionage and some eminentlywatchable stars. Harlow is beautiful, Grant is handsome and both are hugely talented,able to play light comedy in one scene and affecting drama in the next.The story is not particularly well-str uctured - it tries a little too hard to please every kind of viewer in every kind of way - but George Fitzmaurice's direction is disciplined enough to drive the movie on in a brisk and and engaging manner.If you are an admirer of Harlow or Grant,then this is simply unavoidable.If you want to find out why either star is so fondly remembered,then try this (along with,say,Platinum Blonde and Dinner at Eight) for Harlow,but look elsewhere (at those movies from a year or so later,like The Awful Truth or Bringing Up Baby,or any others up to 1966) for Grant.If you just want to see an entertaining, unpretentious black-and-white movie from the mid-thirties,then this is well worth giving a try.",4,Well worth discovering,964483200,"07 25, 2000",2000,1014,"['relatively', 'overlooked', 'movie', 'little', 'everything', 'romance', 'comedy', 'tragedy', 'Paris', 'war', 'espionage', 'eminentlywatchable', 'stars', 'Harlow', 'beautiful', 'Grant', 'handsome', 'are', 'hugely', 'talented', 'able', 'play', 'light', 'comedy', 'one', 'scene', 'affecting', 'drama', 'next.The', 'story', 'not', 'particularly', 'well-str', 'uctured', 'little', 'too', 'hard', 'please', 'kind', 'viewer', 'kind', 'way', 'George', 'Fitzmaurice', 'direction', 'disciplined', 'enough', 'drive', 'movie', 'brisk', 'engaging', 'manner.If', 'are', 'admirer', 'Harlow', 'Grant', 'then', 'simply', 'unavoidable.If', 'want', 'find', 'out', 'why', 'star', 'so', 'fondly', 'remembered', 'then', 'try', 'say', 'Platinum', 'Blonde', 'Dinner', 'Eight', 'Harlow', 'look', 'elsewhere', 'movies', 'year', 'so', 'later', 'Awful', 'Truth', 'Bringing', 'Up', 'Baby', 'others', '1966', 'Grant.If', 'just', 'want', 'see', 'entertaining', 'unpretentious', 'black-and-white', 'movie', 'mid-thirties', 'then', 'well', 'worth', 'giving', 'try']",Suzy VHS
322708,A37S3ACL57LN62,6302605156,"Samantha Glasser ""Maliejandra""","[4, 4]","Suzy is pure melodrama, so if you aren't game, stop right now. The film starts out with a generous and beautiful chorus girl named Suzy (Jean Harlow). She hopes to make it big on the stage, but she refuses to submit to the advances of directors along the way. The result? She's penniless and hoping to find a rich man when she stumbles upon an elegant lad in a Rolls Royce (Franchot Tone). Although it isn't his car, she agrees to a date and soon the pair are married. However, he gets mixed up with some shady business and is shot. Suzy flees in fear of being accused of murder and finds herself married to a famous pilot on WWI (Cary Grant). Life is not perfect though, for her husband is a womanizer, and is friends with her first spouse who is very much alive.This whole movie is a ball of emotional scenes and bits that break your heart. The romantic story is very similar to that in the silent Wings and the more recent Pearl Harbor. However, it is done very elegantly in true 1930s fashion. Each cast member is perfect in his/her role. Harlow is softly beautiful and not brash the way she was in her earlier films. Though if you study her, you might think she wasn't trying, she manages to tear you apart without emoting too much. Tone is sophisticated and intelligent as always, but also much sweeter. Despite being cast opposite Grant who was very popular with female audience members, Tone is the one we're meant to fall in love with. Grant is more of a scoundrel, the type that every woman knows is bad for her.The story definitely translates well to modern audiences. Hopefully it will see a DVD release soon.",5,Fantastic Melodrama,1166486400,"12 19, 2006",2006,1621,"['Suzy', 'pure', 'melodrama', 'so', 'are', ""n't"", 'game', 'stop', 'right', 'now', 'film', 'out', 'generous', 'beautiful', 'chorus', 'girl', 'named', 'Suzy', 'Jean', 'Harlow', 'make', 'big', 'stage', 'submit', 'advances', 'directors', 'way', 'result', 'penniless', 'hoping', 'find', 'rich', 'man', 'when', 'elegant', 'lad', 'Rolls', 'Royce', 'Franchot', 'Tone', ""n't"", 'car', 'date', 'soon', 'pair', 'are', 'married', 'However', 'mixed', 'up', 'shady', 'business', 'shot', 'Suzy', 'flees', 'fear', 'being', 'accused', 'murder', 'married', 'famous', 'pilot', 'WWI', 'Cary', 'Grant', 'Life', 'not', 'perfect', 'husband', 'womanizer', 'friends', 'first', 'spouse', 'who', 'very', 'much', 'whole', 'movie', 'ball', 'emotional', 'scenes', 'bits', 'break', 'heart', 'romantic', 'story', 'very', 'similar', 'silent', 'Wings', 'more', 'recent', 'Pearl', 'Harbor', 'However', 'done', 'very', 'elegantly', 'true', '1930s', 'fashion', 'cast', 'member', 'perfect', 'role', 'Harlow', 'softly', 'beautiful', 'not', 'brash', 'way', 'was', 'earlier', 'films', 'study', 'might', 'think', 'was', ""n't"", 'trying', 'tear', 'apart', 'emoting', 'too', 'much', 'Tone', 'sophisticated', 'intelligent', 'always', 'also', 'much', 'sweeter', 'being', 'cast', 'opposite', 'Grant', 'who', 'was', 'very', 'popular', 'female', 'audience', 'members', 'Tone', 'one', ""'re"", 'meant', 'fall', 'love', 'Grant', 'more', 'scoundrel', 'type', 'woman', 'bad', 'her.The', 'story', 'definitely', 'well', 'modern', 'audiences', 'Hopefully', 'will', 'see', 'DVD', 'release', 'soon']",Suzy VHS
322709,A2TOU0N8XE68W4,6302605156,Simon Davis,"[1, 1]","MGM's World War I romance ""Suzy"", is unique in being one of Cary Grant's rare forays into working for that studio of studios and his once only teaming with legendary MGM leading lady Jean Harlow. While Jean rather sadly only had a little more than twelve months left to live at the time of production on ""Suzy"", this 1936-37 period saw the real beginnings; (with his later smash hit role in Columbia Studios ""The Awful Truth""),of the ""Cary Grant"", that movie goers would grow to love so much over the next thirty years and beyond. While ""Suzy"", could never be called a movie masterpiece it is a typically polished product of the studio system that MGM in particular developed and nutured so well through the 1930's with its ""more stars than there are in heaven"" motto.",3,Hollywood Legends Jean Harlow And Cary Grant In Their Only Teaming On Screen,1137369600,"01 16, 2006",2006,768,"['MGM', 'World', 'War', 'romance', 'Suzy', 'unique', 'being', 'one', 'Cary', 'Grant', 'rare', 'forays', 'working', 'studio', 'studios', 'once', 'only', 'teaming', 'legendary', 'MGM', 'leading', 'lady', 'Jean', 'Harlow', 'Jean', 'rather', 'sadly', 'only', 'had', 'little', 'more', 'twelve', 'months', 'left', 'live', 'time', 'production', 'Suzy', '1936-37', 'period', 'saw', 'real', 'beginnings', 'later', 'smash', 'hit', 'role', 'Columbia', 'Studios', 'Awful', 'Truth', 'Cary', 'Grant', 'movie', 'goers', 'would', 'grow', 'love', 'so', 'much', 'next', 'thirty', 'years', 'Suzy', 'could', 'never', 'be', 'called', 'movie', 'masterpiece', 'typically', 'polished', 'product', 'studio', 'system', 'MGM', 'particular', 'developed', 'nutured', 'so', 'well', '1930', 'more', 'stars', 'are', 'heaven', 'motto']",Suzy VHS
322710,AF3X7J0XC391L,6302605156,"Stratiotes Doxha Theon ""2 Thes 2:15""","[0, 0]","The plot is shallow and the ariel combat action is rather poor, but Mr. Grant, Ms. Harlow, and Mr. Tone save it from less than mediocrity with their performances.  It was a poor plot done in good taste to make a rather pointless story of a playboy, his friend, and his longsuffering wife during  the first world war.  If it were not for the acting, there would be little to save this film.  Still, I could not stop myself from watching.",3,Narrowly saved from mediocrity,1169078400,"01 18, 2007",2007,436,"['plot', 'shallow', 'ariel', 'combat', 'action', 'rather', 'poor', 'Mr.', 'Grant', 'Ms.', 'Harlow', 'Mr', 'Tone', 'save', 'less', 'mediocrity', 'performances', 'was', 'poor', 'plot', 'done', 'good', 'taste', 'make', 'rather', 'pointless', 'story', 'playboy', 'friend', 'longsuffering', 'wife', 'first', 'world', 'war', 'were', 'not', 'acting', 'would', 'be', 'little', 'save', 'film', 'Still', 'could', 'not', 'stop', 'watching']",Suzy VHS
