,reviewerID,asin,reviewerName,helpful,reviewText,overall,summary,unixReviewTime,reviewTime,reviewYear,reviewLength,meaningfulWords,Title
364999,A2UBEP2JFS8YCU,6303224407,Adam M. Palm,"[0, 0]",My kids loved it - my wife loved it as a kid.  I do my best to forget that Culkin is in it.,5,The Nutcracker is family-friendly,1353715200,"11 24, 2012",2012,91,"['kids', 'loved', 'wife', 'loved', 'kid', 'do', 'best', 'forget', 'Culkin']",George Balanchine's The Nutcracker VHS
365000,A1933VQS8E23J5,6303224407,"AGUSTIN DIAZ ""agudiaz""","[0, 3]",Just lovely. A timeless musical . My kids took it in a re-run for two whole days.,4,A timeless play for a nonsense fast life!,1097193600,"10 8, 2004",2004,81,"['Just', 'lovely', 'A', 'timeless', 'musical', 'kids', 'took', 're-run', 'two', 'whole', 'days']",George Balanchine's The Nutcracker VHS
365001,A2Z336TO4FNZKA,6303224407,"Alice Kingsley ""Esmeralda""","[1, 2]","I love The Nutcracker. It is Brilliant. It makes me think of my inspirations and once I did not know that Kevin Kline narrated that. I did not know who was in there until I felt like I was ready. Whenever I felt scared or something I say the kinds of delights the sugar plum fairy brought out. I like the part where the Snowfflakes were dancing and also the part where Marie knew it was her Godfather. I even saw some versions of The Nutcracker and out of all of them, I like this one. Later before I had it, I just chose not to see it but once I found it at the Public Library, I was like, ""Come About!"" and I was so excited. When I saw this first I noticed that it was absolute silence with nothing but music and ballet dancing and nobody, not one, except Kline who narrates it. I was just telling you fellas how much I loved it.",5,GBTN,1280275200,"07 28, 2010",2010,831,"['love', 'Nutcracker', 'Brilliant', 'think', 'inspirations', 'once', 'did', 'not', 'know', 'Kevin', 'Kline', 'narrated', 'did', 'not', 'know', 'who', 'was', 'felt', 'was', 'ready', 'Whenever', 'felt', 'scared', 'something', 'say', 'kinds', 'delights', 'sugar', 'plum', 'fairy', 'brought', 'out', 'part', 'where', 'Snowfflakes', 'were', 'dancing', 'also', 'part', 'where', 'Marie', 'knew', 'was', 'Godfather', 'even', 'saw', 'versions', 'Nutcracker', 'like', 'one', 'Later', 'had', 'just', 'chose', 'not', 'see', 'once', 'found', 'Public', 'Library', 'was', 'Come', 'was', 'so', 'excited', 'When', 'saw', 'first', 'noticed', 'was', 'absolute', 'silence', 'nothing', 'music', 'ballet', 'dancing', 'nobody', 'not', 'one', 'Kline', 'who', 'was', 'just', 'telling', 'fellas', 'how', 'much', 'loved']",George Balanchine's The Nutcracker VHS
365002,A1T4D1PRDI2YPB,6303224407,Andrea Dejarnett,"[0, 3]","Great quality, great condition, SUCKY BALLET! Does not help that they had NO GOOD TALENT on this one. I am still the greatest Nutcracker fan in the multiverse.",2,Great,1379289600,"09 16, 2013",2013,159,"['Great', 'quality', 'great', 'condition', 'SUCKY', 'BALLET', 'Does', 'not', 'help', 'had', 'NO', 'GOOD', 'TALENT', 'one', 'am', 'still', 'greatest', 'Nutcracker', 'fan', 'multiverse']",George Balanchine's The Nutcracker VHS
365003,A1OT2MIP90KZK3,6303224407,candicegaud,"[0, 0]","I wanted something that told the story the whole way through, this doesn't. It's got huge parts where there is no narration at all and just the ballet. I remember being entranced with a VHS version as a child that had narration throughout and I wanted that one. My niece just wasn't into watching the ballet aspect for minutes in between with nothing to really keep her attention. Maybe when she's older.  When I was a little girl my Mom bought me a VHS tape of the Nutcracker that told the story the whole way through, I hope I find it some day so my kids can enjoy it as much as I did.",4,"Good. Just what I expected. Doesn't narrate the whole time, just during scene changes and certain moments throughout.",1359244800,"01 27, 2013",2013,587,"['wanted', 'something', 'told', 'story', 'whole', 'way', ""n't"", 'got', 'huge', 'parts', 'where', 'narration', 'just', 'ballet', 'remember', 'being', 'entranced', 'VHS', 'version', 'child', 'had', 'narration', 'wanted', 'one', 'niece', 'just', 'was', ""n't"", 'watching', 'ballet', 'aspect', 'minutes', 'nothing', 'really', 'keep', 'attention', 'Maybe', 'when', 'older', 'When', 'was', 'little', 'girl', 'Mom', 'bought', 'VHS', 'tape', 'Nutcracker', 'told', 'story', 'whole', 'way', 'hope', 'find', 'day', 'kids', 'can', 'enjoy', 'as', 'much', 'did']",George Balanchine's The Nutcracker VHS
365004,A396SBGKAOLTZE,6303224407,Chris Aldridge,"[8, 8]","I can easily give this DVD four stars- maybe even five in time. This tale is interesting to dissect, because there are apparently two camps for this very famous, 110 year-old ballet: those who like it as a children's story and those who like it as an adult's. It's been staged both ways in the past, as others have already mentioned (and I won't repeat here, I promise). This version, which allows the kids to be front and center, has some stellar 'adult' moments in it: the Act 1 finale dance of the snowflakes, while not adult in content, is the personification of sophistication and beauty with its ice-blue lighting and costuming and multiracial corps de ballet. A beautiful sequence of dance which stands on its own, and which you'd enjoy replaying. The other moment comes in the second act, when the relatively innocent dances of various sweets give way to the Arabian solo of Wendy Whelan. The pink-and-purple lighting, the floating camera work, and the dancer's sexy, serpent-like movements (jeeez!!) do not resemble any other moment in this already polished film, and one can't help but think that either the director or the choreographer wanted it that way. (It's like watching Ann Reinking, Vicki Frederick, or Carol Haney on the Broadway stage.) As far as Macaulay Culkin- it didn't bother me since he was the right age (12) at the time of filming, and, frankly, he looks bored in *most* films he's in. What're you gonna do?",4,While I'm not a ballet afficinado....,1039392000,"12 9, 2002",2002,1436,"['can', 'easily', 'give', 'DVD', 'four', 'stars-', 'maybe', 'even', 'five', 'time', 'tale', 'interesting', 'dissect', 'are', 'apparently', 'two', 'camps', 'very', 'famous', '110', 'year-old', 'ballet', 'who', 'like', 'children', 'story', 'who', 'like', 'adult', 'been', 'staged', 'ways', 'past', 'others', 'have', 'already', 'mentioned', 'wo', ""n't"", 'repeat', 'here', 'promise', 'version', 'kids', 'be', 'front', 'center', 'stellar', ""'adult"", 'moments', 'Act', '1', 'finale', 'dance', 'snowflakes', 'not', 'adult', 'content', 'personification', 'sophistication', 'beauty', 'ice-blue', 'lighting', 'costuming', 'multiracial', 'corps', 'ballet', 'beautiful', 'sequence', 'dance', 'own', ""'d"", 'enjoy', 'replaying', 'other', 'moment', 'second', 'act', 'when', 'relatively', 'innocent', 'dances', 'various', 'sweets', 'give', 'way', 'Arabian', 'solo', 'Wendy', 'Whelan', 'pink-and-purple', 'lighting', 'floating', 'camera', 'work', 'dancer', 'sexy', 'serpent-like', 'movements', 'jeeez', 'do', 'not', 'resemble', 'other', 'moment', 'already', 'polished', 'film', 'one', 'ca', ""n't"", 'help', 'think', 'director', 'choreographer', 'wanted', 'way', 'watching', 'Ann', 'Reinking', 'Vicki', 'Frederick', 'Carol', 'Haney', 'Broadway', 'stage', 'As', 'far', 'Macaulay', 'Culkin-', 'did', ""n't"", 'bother', 'was', 'right', 'age', '12', 'time', 'filming', 'frankly', 'bored', '*most*', 'films', 'What', ""'re"", 'gon', 'do']",George Balanchine's The Nutcracker VHS
365005,A2VJ80PM1G00QV,6303224407,drkhimxz,"[5, 9]","There is another listing for the Nutcracker suite bearing an almost identical disc cover (save for the printing in the open mouth)which has nothing to do with this film version. From reviews there, it appears to be a non-professionally recorded version taken from the audience of the staged Balanchine performance.Certainly, I have nothing to add to the other reviews as to the content. As far as I was concerned, never have seen the staged version by the NYC Ballet, this is what it purports to be, a film taking what it can from Balanchine but a film in its own right to be seen as that. As a ballet, certainly it would be better to have the children played by adults, as a movie it makes sense to have it as it is (I assume this is true for the projected audience for the film). What we see of the children dancing is charming, for children dancing. None stood out as the next Gelcey kirkland, but then, who can tell at that age. Where the NYC Ballet appears, in adaptations by Peter Martins, who succeeded Balanchine, they look good in lush settings appropriate to the season.I can only guess at how well the film goes over with various age groups and types of audience; my guess is, that it will be fully appreciated by people who fully appreciate this sort of film. Since the last child actor I saw singing was Margaret O'Brien (no singer then or later) in a duet with Judy Garland, I found it a pleasing film when one is in a holiday mood or cares to be reminded of the holiday mood.",5,Just a warning for amazon users,1276905600,"06 19, 2010",2010,1490,"['listing', 'Nutcracker', 'suite', 'bearing', 'almost', 'identical', 'disc', 'cover', 'save', 'printing', 'open', 'mouth', 'nothing', 'do', 'film', 'version', 'reviews', 'there', 'be', 'non-professionally', 'recorded', 'version', 'taken', 'audience', 'staged', 'Balanchine', 'performance.Certainly', 'have', 'nothing', 'add', 'other', 'reviews', 'content', 'As', 'far', 'was', 'concerned', 'never', 'have', 'seen', 'staged', 'version', 'NYC', 'Ballet', 'what', 'be', 'film', 'taking', 'what', 'can', 'Balanchine', 'film', 'own', 'right', 'be', 'seen', 'ballet', 'certainly', 'would', 'be', 'better', 'have', 'children', 'played', 'adults', 'movie', 'sense', 'have', 'assume', 'true', 'projected', 'audience', 'film', 'What', 'see', 'children', 'dancing', 'charming', 'children', 'dancing', 'None', 'stood', 'out', 'next', 'Gelcey', 'kirkland', 'then', 'who', 'can', 'tell', 'age', 'Where', 'NYC', 'Ballet', 'adaptations', 'Peter', 'Martins', 'who', 'succeeded', 'Balanchine', 'look', 'good', 'lush', 'settings', 'appropriate', 'season.I', 'can', 'only', 'guess', 'how', 'well', 'film', 'various', 'age', 'groups', 'types', 'audience', 'guess', 'will', 'be', 'fully', 'appreciated', 'people', 'who', 'fully', 'appreciate', 'sort', 'film', 'last', 'child', 'actor', 'saw', 'singing', 'was', 'Margaret', ""O'Brien"", 'singer', 'then', 'later', 'duet', 'Judy', 'Garland', 'found', 'pleasing', 'film', 'when', 'one', 'holiday', 'mood', 'cares', 'be', 'reminded', 'holiday', 'mood']",George Balanchine's The Nutcracker VHS
365006,A3H82LUT1EC655,6303224407,Erika Sorocco,"[4, 5]","This is truly the best version of &quot;The Nutcracker&quot; I have ever seen. The New York City Ballet is wonderful in it. From the dancing, to the whole performance. The sets and costumes were put together perfectly, and it's just all beautiful.I recommend this movie to anyone who has ever wanted to see &quot;The Nutcracker&quot; ballet live, or for anyone looking for a great movie to share this Christmas.",5,The Best,1010188800,"01 5, 2002",2002,411,"['truly', 'best', 'version', 'quot', 'Nutcracker', 'quot', 'have', 'ever', 'seen', 'New', 'York', 'City', 'Ballet', 'wonderful', 'dancing', 'whole', 'performance', 'sets', 'costumes', 'were', 'put', 'together', 'perfectly', 'just', 'beautiful.I', 'recommend', 'movie', 'anyone', 'who', 'ever', 'wanted', 'see', 'quot', 'Nutcracker', 'quot', 'live', 'anyone', 'looking', 'great', 'movie', 'share', 'Christmas']",George Balanchine's The Nutcracker VHS
365007,A3JQY022VCBKB7,6303224407,Harold M. Clayton,"[0, 0]",I REALLY LIKE THIS I HAVE SERVAL DRIFFERNT COPIES OF DRIFFERNT DVDS ON THE NUTCRACKER THEY ARE ALL GREAT DVDS.,5,The Nutcracker,1329264000,"02 15, 2012",2012,110,"['REALLY', 'THIS', 'HAVE', 'SERVAL', 'DRIFFERNT', 'COPIES', 'OF', 'DRIFFERNT', 'DVDS', 'ON', 'THE', 'NUTCRACKER', 'THEY', 'ARE', 'ALL', 'GREAT', 'DVDS']",George Balanchine's The Nutcracker VHS
365008,A3K4GHTXGOCIVT,6303224407,Jaimie Harris,"[0, 0]",Loved the nutcracker as a child and now I can watch it whenever I want. This is one of my favorite versions of the nutcracker on DVD. The only thing better is seeing it person.,5,Classic!!,1364860800,"04 2, 2013",2013,176,"['Loved', 'nutcracker', 'child', 'now', 'can', 'watch', 'whenever', 'want', 'one', 'favorite', 'versions', 'nutcracker', 'DVD', 'only', 'thing', 'better', 'seeing', 'person']",George Balanchine's The Nutcracker VHS
365009,A2MEB0E5XL79AF,6303224407,Jenn's Mom,"[0, 3]","I would be very disappointed if I had actually paid to see this. I couldn't watch the whole thing; smirking Macauley Culkin prevented that. I don't recommend this version of Nutcracker at all. If there was an option for no stars, that's how I'd rate it.",1,"Instant View, so only my time was wasted",1354924800,"12 8, 2012",2012,253,"['would', 'be', 'very', 'disappointed', 'had', 'actually', 'paid', 'see', 'could', ""n't"", 'watch', 'whole', 'thing', 'smirking', 'Macauley', 'Culkin', 'prevented', 'do', ""n't"", 'recommend', 'version', 'Nutcracker', 'was', 'option', 'stars', 'how', ""'d"", 'rate']",George Balanchine's The Nutcracker VHS
365010,A3S5C7Y0WT2Q9N,6303224407,J. Lizzi,"[127, 130]","All things considered, I have to say that this is quite an enjoyable theatrical presentation of Balanchine's &quot;The Nutcracker.&quot;  Looking at &quot;the show&quot; itself, its most rave-worthy characteristic is how well the team of Peter Martins (ballet master), Emile Ardolino (director) and Ralf Bode (cinematographer) collaborated to actually &quot;choreograph the camera&quot; to the movements of the performers.  Thanks to a talented movie crew and an incredible amount of consideration given to viewing angles (read the description in the disc's &quot;special features&quot;), the TV always seemed to be showing exactly what I wanted to look at on the stage.  Add in some nice work by Industrial Light &amp; Magic, decent narration, and a top-notch production team, and the result is a superb presentation.From a performance standpoint, I'd give this an A-minus mainly because the versions of &quot;The Nutcracker&quot; I've seen most often cast the Nutcracker Prince in a much more active role dancewise.  Still, everyone else did a fantastic job.  Noteworthy were the Pas de Deux by the Cavalier (Damian Woetzel) and Sugarplum Fairy (Darci Kistler), and the powerful dance presence of Coffee (Wendy Whelan).  The other &quot;Sweets&quot; performed very well also.  So long as you try not to picture Macaulay Culkin as a ballet dancer, you'll be okay.  Let's face it:  you can't expect the little guy to measure up next to the NYC Ballet, but he is there to add a little star appeal and possibly sell ballet to your kids (which may not be a bad idea).  Nuff said.  By the way, the younger performers from the School of American Ballet were wonderful.Regarding disc features, the DVD has some cool stuff to offer:  two viewing formats, 30-scene index, and some good production notes regarding the history of the show, camera choreography and description of ILM's special effects.",5,Impressive production; all-around fine performance; good DVD,1010102400,"01 4, 2002",2002,1891,"['things', 'considered', 'have', 'say', 'quite', 'enjoyable', 'theatrical', 'presentation', 'Balanchine', 'quot', 'Nutcracker.', 'quot', 'Looking', 'quot', 'show', 'quot', 'most', 'rave-worthy', 'characteristic', 'how', 'well', 'team', 'Peter', 'Martins', 'ballet', 'master', 'Emile', 'Ardolino', 'director', 'Ralf', 'Bode', 'cinematographer', 'collaborated', 'actually', 'quot', 'choreograph', 'camera', 'quot', 'movements', 'performers', 'Thanks', 'talented', 'movie', 'crew', 'incredible', 'amount', 'consideration', 'given', 'viewing', 'angles', 'read', 'description', 'disc', 'quot', 'special', 'features', 'quot', 'TV', 'always', 'seemed', 'be', 'showing', 'exactly', 'what', 'wanted', 'look', 'stage', 'Add', 'nice', 'work', 'Industrial', 'Light', 'amp', 'Magic', 'decent', 'narration', 'top-notch', 'production', 'team', 'result', 'superb', 'performance', 'standpoint', ""'d"", 'give', 'A-minus', 'mainly', 'versions', 'quot', 'Nutcracker', 'quot', ""'ve"", 'seen', 'most', 'often', 'cast', 'Nutcracker', 'Prince', 'much', 'more', 'active', 'role', 'dancewise', 'Still', 'everyone', 'else', 'did', 'fantastic', 'job', 'were', 'Pas', 'de', 'Deux', 'Cavalier', 'Damian', 'Woetzel', 'Sugarplum', 'Fairy', 'Darci', 'Kistler', 'powerful', 'dance', 'presence', 'Coffee', 'Wendy', 'Whelan', 'other', 'quot', 'Sweets', 'quot', 'performed', 'very', 'well', 'also', 'So', 'long', 'try', 'not', 'picture', 'Macaulay', 'Culkin', 'ballet', 'dancer', ""'ll"", 'be', 'okay', 'Let', 'face', 'ca', ""n't"", 'expect', 'little', 'guy', 'measure', 'up', 'next', 'NYC', 'Ballet', 'there', 'add', 'little', 'star', 'appeal', 'possibly', 'sell', 'ballet', 'kids', 'may', 'not', 'be', 'bad', 'idea', 'Nuff', 'said', 'way', 'younger', 'performers', 'School', 'American', 'Ballet', 'were', 'wonderful.Regarding', 'disc', 'features', 'DVD', 'cool', 'stuff', 'offer', 'two', 'viewing', 'formats', '30-scene', 'index', 'good', 'production', 'notes', 'regarding', 'history', 'show', 'camera', 'choreography', 'description', 'ILM', 'special', 'effects']",George Balanchine's The Nutcracker VHS
365011,AF9A6K70QY9CU,6303224407,Kallina,"[1, 1]","welcome to the land of your childhood dreams! amazing choreography, beautiful colors, and great dancing create the atmoshere i used to dream about when i was a kid... it's simply great.. adults will feel like children again, and for children it'll be just a dream come true! it's a great video for all the family! this one no one should miss!",5,wonderful!,1012262400,"01 29, 2002",2002,342,"['welcome', 'land', 'childhood', 'dreams', 'amazing', 'choreography', 'beautiful', 'colors', 'great', 'dancing', 'create', 'atmoshere', 'i', 'used', 'dream', 'when', 'i', 'was', 'kid', 'simply', 'great..', 'adults', 'will', 'feel', 'children', 'again', 'children', ""'ll"", 'be', 'just', 'dream', 'come', 'true', 'great', 'video', 'family', 'one', 'one', 'should', 'miss']",George Balanchine's The Nutcracker VHS
365012,A1LEV4QF8HLL5M,6303224407,Kascadian,"[0, 0]",The Nutcracker is one of my favorite ballets and I love the music!  This film version is very good!  It is a wonderful addition to my holiday video collection!,5,A great buy!,1356652800,"12 28, 2012",2012,159,"['Nutcracker', 'one', 'favorite', 'ballets', 'love', 'music', 'film', 'version', 'very', 'good', 'wonderful', 'addition', 'holiday', 'video', 'collection']",George Balanchine's The Nutcracker VHS
365013,A23IFXH13UI6C0,6303224407,KKizmo,"[0, 0]","Glad I found this! Been collecting Nutcrackers for decorations, but had never seen the entire play. Made for a great Sunday afternoon movie!",5,Favorite Nutcracker,1357862400,"01 11, 2013",2013,140,"['Glad', 'found', 'Been', 'collecting', 'Nutcrackers', 'decorations', 'had', 'never', 'seen', 'entire', 'play', 'Made', 'great', 'Sunday', 'afternoon', 'movie']",George Balanchine's The Nutcracker VHS
365014,A308QC9XPFHFGJ,6303224407,"Malfoyfan ""Cath""","[0, 0]","I wanted to view this recording of Balanchine's Nutcracker ballet because of a book I've owned for a long time called A Very Young Dancer, a photo essay documenting a young ballet student's participation in this production, back in the 70s.The production and filming of it are overall good - the DVD picture is fine and the photography is good - it's not easy to capture dance on film - some productions edit too much or don't focus on the whole dancer.  Some reviewers have noted that the production looks a little dated, but for me that's part of its charm.  It's true that the costumes and sets haven't changed much over the years, judging by photos I have seen, but I like that it has that continuity.I don't like the narration, but I think it's good to have it for first-time viewers and kids so they understand the story line.I wouldn't have cast Macauley Culkin, but I realize they probably did it because he was well-known at the time and I imagine the filmmakers were thinking that a &#34;name&#34; would bring in people who don't normally watch ballet.  I'd have preferred an anonymous young dancer, the way it would be in the actual stage production.As far as the performances, the child dancers sometimes look nervous or stiff - understandable because they're kids and if one were watching the performance on stage, their faces would be too far away to see the expressions.  I like the fact that Balanchine used children in his productions when it was appropriate, rather than short dancers impersonating children.  As for the adults - WOW!  The &#34;Coffee&#34; dance and the Sugar Plum Fairy/Cavalier pas de deux are worth the price of the DVD alone.  Both are absolutely breathtaking.  The &#34;tree angels&#34; were great - I loved how they looked like they were floating across the stage.  The rest of the cast are across-the-board very good too.If watching this with kids, bear in mind that the first part is mostly the party scene and there isn't much dance.  I got a little bored and I can see kids losing interest quickly.  It really picks up in the &#34;land of sweets&#34; second act.  While I was watching, I kept thinking that I prefer the first act of Baryshnikov's Nutcracker and the second act of this one.  It's probably better live - most things like this are - but as I said, I think it's worth watching for the performances of the adult dancers alone.I think this recording is valuable because we need to preserve performance - whether dance, music, or theater - as a cultural reference for the future.  I would highly recommend watching this if you are a ballet fan or if you have an aspiring dancer in the house.  It's also fun to watch the other well-known version starring Baryshnikov and Gelsey Kirkland and compare the two, as I was doing in my head while watching this one.  They're both quite worthwhile.",4,Fine record of Balanchine's Nutcracker ballet,1403827200,"06 27, 2014",2014,2844,"['wanted', 'view', 'recording', 'Balanchine', 'Nutcracker', 'ballet', 'book', ""'ve"", 'owned', 'long', 'time', 'called', 'Very', 'Young', 'Dancer', 'photo', 'essay', 'documenting', 'young', 'ballet', 'student', 'participation', 'production', 'back', '70s.The', 'production', 'filming', 'are', 'overall', 'good', 'DVD', 'picture', 'fine', 'photography', 'good', 'not', 'easy', 'capture', 'dance', 'film', 'productions', 'edit', 'too', 'much', 'do', ""n't"", 'focus', 'whole', 'dancer', 'reviewers', 'have', 'noted', 'production', 'little', 'dated', 'part', 'charm', 'true', 'costumes', 'sets', 'have', ""n't"", 'changed', 'much', 'years', 'judging', 'photos', 'have', 'seen', 'like', 'continuity.I', 'do', ""n't"", 'like', 'narration', 'think', 'good', 'have', 'first-time', 'viewers', 'kids', 'so', 'understand', 'story', 'line.I', 'would', ""n't"", 'have', 'cast', 'Macauley', 'Culkin', 'realize', 'probably', 'did', 'was', 'well-known', 'time', 'imagine', 'filmmakers', 'were', 'thinking', '34', 'name', '34', 'would', 'bring', 'people', 'who', 'do', ""n't"", 'normally', 'watch', 'ballet', ""'d"", 'have', 'preferred', 'anonymous', 'young', 'dancer', 'way', 'would', 'be', 'actual', 'stage', 'production.As', 'far', 'performances', 'child', 'dancers', 'sometimes', 'look', 'nervous', 'stiff', 'understandable', ""'re"", 'kids', 'one', 'were', 'watching', 'performance', 'stage', 'would', 'be', 'too', 'far', 'away', 'see', 'expressions', 'fact', 'Balanchine', 'used', 'children', 'productions', 'when', 'was', 'appropriate', 'rather', 'short', 'dancers', 'impersonating', 'children', 'adults', 'WOW', '34', 'Coffee', '34', 'dance', 'Sugar', 'Plum', 'Fairy/Cavalier', 'pas', 'de', 'deux', 'are', 'price', 'DVD', 'alone', 'are', 'absolutely', 'breathtaking', '34', 'tree', 'angels', '34', 'were', 'great', 'loved', 'how', 'looked', 'were', 'floating', 'stage', 'rest', 'cast', 'are', 'across-the-board', 'very', 'good', 'too.If', 'watching', 'kids', 'bear', 'mind', 'first', 'part', 'mostly', 'party', 'scene', ""n't"", 'much', 'dance', 'got', 'little', 'bored', 'can', 'see', 'kids', 'losing', 'interest', 'quickly', 'really', 'up', '34', 'land', 'sweets', '34', 'second', 'act', 'was', 'watching', 'kept', 'thinking', 'prefer', 'first', 'act', 'Baryshnikov', 'Nutcracker', 'second', 'act', 'one', 'probably', 'better', 'live', 'most', 'things', 'are', 'said', 'think', 'worth', 'watching', 'performances', 'adult', 'dancers', 'alone.I', 'think', 'recording', 'valuable', 'need', 'preserve', 'performance', 'dance', 'music', 'theater', 'cultural', 'reference', 'future', 'would', 'highly', 'recommend', 'watching', 'are', 'ballet', 'fan', 'have', 'aspiring', 'dancer', 'house', 'also', 'fun', 'watch', 'other', 'well-known', 'version', 'starring', 'Baryshnikov', 'Gelsey', 'Kirkland', 'compare', 'two', 'was', 'doing', 'head', 'watching', 'one', ""'re"", 'quite', 'worthwhile']",George Balanchine's The Nutcracker VHS
365015,A2JCW6AAQ926RW,6303224407,Marcus Aurelius,"[1, 3]",Treat your kids at Christmastime to good music and performance.,5,Fun for the kids to watch,1177804800,"04 29, 2007",2007,63,"['Treat', 'kids', 'Christmastime', 'good', 'music', 'performance']",George Balanchine's The Nutcracker VHS
365016,A2Z93U66H1KT36,6303224407,Mavis E. Krause,"[1, 3]",I thoroughly enjoyed the dancing.  Macaulay Culkin seemed awkward; he should not have been in the movie.  A dancer should have played his part.,4,The Nutcracker,1171238400,"02 12, 2007",2007,143,"['thoroughly', 'enjoyed', 'dancing', 'Macaulay', 'Culkin', 'seemed', 'awkward', 'should', 'not', 'have', 'been', 'movie', 'dancer', 'should', 'have', 'played', 'part']",George Balanchine's The Nutcracker VHS
