,reviewerID,asin,reviewerName,helpful,reviewText,overall,summary,unixReviewTime,reviewTime,reviewYear,reviewLength,meaningfulWords,Title
365017,A16RAMIXBUHVKV,6303224407,michael a. draper,"[1, 1]",Watched this at Christmas day with the grandchildren. The dancing was excellent and the music superb.With a six year old and a three year old both glued to the TV it was also a relaxing break for adults.,4,Good for the children,1388188800,"12 28, 2013",2013,203,"['Watched', 'Christmas', 'day', 'grandchildren', 'dancing', 'was', 'excellent', 'music', 'six', 'year', 'old', 'three', 'year', 'old', 'glued', 'TV', 'was', 'also', 'relaxing', 'break', 'adults']",George Balanchine's The Nutcracker VHS
365018,A29ZFNVG727RGU,6303224407,Midwesterner,"[0, 0]","Film quality wasn't bad, neither was it good.  The worst thing was the acting with portrayal of the characters.  There are a lot of 'Nutcrackers' out there - find another one.",3,Mediocre at best,1322006400,"11 23, 2011",2011,175,"['Film', 'quality', 'was', ""n't"", 'bad', 'was', 'good', 'worst', 'thing', 'was', 'acting', 'portrayal', 'characters', 'are', 'lot', ""'Nutcrackers"", 'find', 'one']",George Balanchine's The Nutcracker VHS
365019,A29Q1SCC4OCO67,6303224407,mypetconcubine,"[2, 2]","I enjoy going to the theathre and watching this play. The Nutcracker is a classic. I owned the older versions of this play but when this version of the nutcracker came on the tele during christmas i just had to get it. My family gather around during christmas time and watch this timeless tale of love, faith and some big mice. I think at least once you should se this at the theathre if you can't buy the video and sit back and relax and prepare to be dazzled.",5,A chrsitmas classic,1024617600,"06 21, 2002",2002,461,"['enjoy', 'going', 'theathre', 'watching', 'play', 'Nutcracker', 'classic', 'owned', 'older', 'versions', 'play', 'when', 'version', 'nutcracker', 'came', 'tele', 'christmas', 'i', 'just', 'had', 'get', 'My', 'family', 'gather', 'christmas', 'time', 'watch', 'timeless', 'tale', 'love', 'faith', 'big', 'mice', 'think', 'least', 'once', 'should', 'se', 'theathre', 'ca', ""n't"", 'buy', 'video', 'sit', 'back', 'relax', 'prepare', 'be', 'dazzled']",George Balanchine's The Nutcracker VHS
365020,A31OPR47BRX2EQ,6303224407,"NK ""NK""","[17, 18]","If you have a young child who wants to see the Nutcracker at home, this is the version to buy (I bought it for my 3 year old boy who loved the ballet):  Here are its selling points and comments on some previous remarks1.  There really aren't that many versions out there.  Baryshnikov's is not a very child friendly version.  Yes it's true, this does not have the precision of some of the other corps but this version is really geared to young children.  And it's a great version for them to see.2.  It is a plus that it features many child dancers.  It allows children to see others like them dancing.  Additionally, a big bonus is that there are acutally boys dancing male parts - parents of boys who love ballet like myself will appreciate this.3.  Yes, Culkinis a bad dancer but as someone else noted - if it  helps sell the movie, then it gets ballet out to more people which is a plus (I personally think it's better than a Barbie doll version of Swan Lake).  Again, for parents of boy dancers, it's nice to see a boy with a real dancing part.4.  The main character is called Marie because that's her name in the original book by ETA Hoffman (which by the way, is a VERY different story from the one we traditionally see in the ballet.  It's a great book and for a special treat of the video performance of the real story see the Milwaukee Orchestra's Notes Alive: The Nutcracker:  The Untold Story, based on Maurice Sendak's illustrations).  In the original story, Clara is one of Marie's dolls.5.  I did not find Culkin's expressions to be disinterested or bored.  To the contrary, I was impressed with  his focus and respect throughout the show.  There is a nice photo text book that accompanies this video.  The book explains that the expression on his face early in the show may be his attempt to show that he is different, more refined, than the other more boisterous boys at the party including Fritz, Marie's brother.",4,Good choice for young children,1085616000,"05 27, 2004",2004,1931,"['have', 'young', 'child', 'who', 'see', 'Nutcracker', 'home', 'version', 'buy', 'bought', '3', 'year', 'old', 'boy', 'who', 'loved', 'ballet', 'Here', 'are', 'selling', 'points', 'comments', 'previous', 'remarks1', 'really', 'are', ""n't"", 'many', 'versions', 'out', 'there', 'Baryshnikov', 'not', 'very', 'child', 'friendly', 'version', 'Yes', 'true', 'not', 'have', 'precision', 'other', 'corps', 'version', 'really', 'geared', 'young', 'children', 'great', 'version', 'see.2', 'plus', 'many', 'child', 'dancers', 'children', 'see', 'others', 'dancing', 'Additionally', 'big', 'bonus', 'are', 'acutally', 'boys', 'dancing', 'male', 'parts', 'parents', 'boys', 'who', 'love', 'ballet', 'will', 'appreciate', 'this.3', 'Yes', 'Culkinis', 'bad', 'dancer', 'someone', 'else', 'noted', 'sell', 'movie', 'then', 'ballet', 'out', 'more', 'people', 'plus', 'personally', 'think', 'better', 'Barbie', 'doll', 'version', 'Swan', 'Lake', 'Again', 'parents', 'boy', 'dancers', 'nice', 'see', 'boy', 'real', 'dancing', 'part.4', 'main', 'character', 'called', 'Marie', 'name', 'original', 'book', 'ETA', 'Hoffman', 'way', 'VERY', 'different', 'story', 'one', 'traditionally', 'see', 'ballet', 'great', 'book', 'special', 'treat', 'video', 'performance', 'real', 'story', 'see', 'Milwaukee', 'Orchestra', 'Notes', 'Alive', 'Nutcracker', 'Untold', 'Story', 'based', 'Maurice', 'Sendak', 'illustrations', 'original', 'story', 'Clara', 'one', 'Marie', 'dolls.5', 'did', 'not', 'find', 'Culkin', 'expressions', 'be', 'disinterested', 'bored', 'contrary', 'was', 'impressed', 'focus', 'respect', 'show', 'nice', 'photo', 'text', 'book', 'video', 'book', 'expression', 'face', 'early', 'show', 'may', 'be', 'attempt', 'show', 'different', 'more', 'refined', 'other', 'more', 'boisterous', 'boys', 'party', 'including', 'Fritz', 'Marie', 'brother']",George Balanchine's The Nutcracker VHS
365021,A217G6GXY85KGF,6303224407,Nuclear Me,"[0, 0]","Great dancing. Great costumes. Great scenery. And who knew that Macauley Culkin was also graceful on his feet? Good job, kid!",5,A Well-Done Classic,1390262400,"01 21, 2014",2014,125,"['Great', 'dancing', 'Great', 'costumes', 'Great', 'scenery', 'who', 'knew', 'Macauley', 'Culkin', 'was', 'also', 'graceful', 'feet', 'Good', 'job', 'kid']",George Balanchine's The Nutcracker VHS
365022,A14PTJ17T1GTCE,6303224407,Olaf the Bear,"[5, 5]","... this was pretty good. I bought it so my girlfriend and i could watch it, because it was always something on our &quot;to do&quot; list. Well, i have to admit, it was entertaining. I'd never seen the play or heard about the story, so the content was very fresh to me. The musical score is, of course, very solid, and the extras on the DVD are also good to flip through. I like to know the historical background of stuff like this, so the extras did a very good job on those terms.If you haven't seen the nutcracker and want to be entertained, pick this up. It's cheap!",4,Even as an unsophisticated ruffian like myself....,981849600,"02 11, 2001",2001,571,"['was', 'pretty', 'good', 'bought', 'girlfriend', 'i', 'could', 'watch', 'was', 'always', 'something', 'quot', 'do', 'quot', 'list', 'Well', 'i', 'have', 'admit', 'was', 'entertaining', ""'d"", 'never', 'seen', 'play', 'heard', 'story', 'content', 'was', 'very', 'fresh', 'musical', 'score', 'course', 'very', 'solid', 'extras', 'DVD', 'are', 'also', 'good', 'flip', 'like', 'know', 'historical', 'background', 'stuff', 'extras', 'did', 'very', 'good', 'job', 'terms.If', 'have', ""n't"", 'seen', 'nutcracker', 'want', 'be', 'entertained', 'pick', 'up', 'cheap']",George Balanchine's The Nutcracker VHS
365023,A1OJF381IKR7LF,6303224407,"Pamela J. Cohen ""dancin withpam.com""","[0, 1]",One of the best filmed Nutcracker performances.  Kids love it.  Keeps all dance enthusiasts enthralled for hours.,5,Nutcracker ballet,1168300800,"01 9, 2007",2007,113,"['One', 'best', 'filmed', 'Nutcracker', 'performances', 'Kids', 'love', 'Keeps', 'dance', 'enthusiasts', 'enthralled', 'hours']",George Balanchine's The Nutcracker VHS
365024,A3MVDJG4X2IHLU,6303224407,Patricia D. Kichinko,"[0, 1]","The music is always wonderful, and the dancing in this timeless tale is truly professional.  My students, ages Kindergarten and up, ask to see this every year.",5,"George Balanchine's ""The Nutcracker"" is GREAT!!",1168387200,"01 10, 2007",2007,159,"['music', 'always', 'wonderful', 'dancing', 'timeless', 'tale', 'truly', 'professional', 'students', 'ages', 'Kindergarten', 'up', 'ask', 'see', 'year']",George Balanchine's The Nutcracker VHS
365025,A26KPG4EY0JLXM,6303224407,Philip A. Kraus,"[8, 9]","I saw George Ballachine's Nutcracker when I was in high school back in the late 60's!!! It was an unforgetable experience in the theater. I'll never forget how enthralling it was to see the Christmas tree growing accompanied by Tchaikovsky's incredible music. It could be argued persuasively that it is the finest staging of the work ever conceived. I've not seen one to equal it!This DVD is a beautiful document of the classic production. No expense has been spared in bringing the production to life. The costumes and the sets are as I remember them. A few sections have been done by ILM to enhance the video presentation of essentially a stage work. The ballet flows beautifully. Video quality is excellent; vibrant colors and clear picture unlike alot of ballet videos.The dancing couldn't be finer. The cast is attractive and energetic including the children. The presence of Mr. Culkin does not detract at all from the quality of the performance. He's there to help sell the thing and he is just fine.The NYC Ballet Orchestra has been playing this score for decades and their mastery of it under Zinman's baton is evident throughout. This is simply gorgeously played and rivals any other Nutcacker played by world class orchestras.A benefit to the proceedings is the fact that Zinman is conducting an actual balletic performance and his zippy tempi add just the right amount of panache. It is a very transparent reading and makes Tchaikovsky's delicious orchestrations sound like a shiny new car! The dancer's tempi doesn't mean that there is a lack of ""symphonic"" presence. The recording engineers have done a beautiful job in capturing the majesty of the performance as well.If you love the Nutcracker, this DVD is essential. We are fortunate to have Balanchine's masterpiece so beautifully documented for posterity! This is the perfect holiday gift to introduce young people to this glorious work of art!",5,A Classic,1100476800,"11 15, 2004",2004,1913,"['saw', 'George', 'Ballachine', 'Nutcracker', 'when', 'was', 'high', 'school', 'back', 'late', '60', 'was', 'unforgetable', 'experience', 'theater', ""'ll"", 'never', 'forget', 'how', 'enthralling', 'was', 'see', 'Christmas', 'tree', 'growing', 'accompanied', 'Tchaikovsky', 'incredible', 'music', 'could', 'be', 'argued', 'persuasively', 'finest', 'staging', 'work', 'ever', 'conceived', ""'ve"", 'not', 'seen', 'one', 'equal', 'DVD', 'beautiful', 'document', 'classic', 'production', 'expense', 'been', 'spared', 'bringing', 'production', 'life', 'costumes', 'sets', 'are', 'remember', 'few', 'sections', 'have', 'been', 'done', 'ILM', 'enhance', 'video', 'presentation', 'essentially', 'stage', 'work', 'ballet', 'beautifully', 'Video', 'quality', 'excellent', 'vibrant', 'colors', 'clear', 'picture', 'alot', 'ballet', 'videos.The', 'dancing', 'could', ""n't"", 'be', 'finer', 'cast', 'attractive', 'energetic', 'including', 'children', 'presence', 'Mr.', 'Culkin', 'not', 'detract', 'quality', 'performance', 'there', 'help', 'sell', 'thing', 'just', 'fine.The', 'NYC', 'Ballet', 'Orchestra', 'been', 'playing', 'score', 'decades', 'mastery', 'Zinman', 'baton', 'evident', 'simply', 'gorgeously', 'played', 'rivals', 'other', 'Nutcacker', 'played', 'world', 'class', 'orchestras.A', 'benefit', 'proceedings', 'fact', 'Zinman', 'conducting', 'actual', 'balletic', 'performance', 'zippy', 'tempi', 'add', 'just', 'right', 'amount', 'panache', 'very', 'transparent', 'reading', 'Tchaikovsky', 'delicious', 'orchestrations', 'sound', 'shiny', 'new', 'car', 'dancer', 'tempi', ""n't"", 'mean', 'lack', 'symphonic', 'presence', 'recording', 'engineers', 'have', 'done', 'beautiful', 'job', 'capturing', 'majesty', 'performance', 'well.If', 'love', 'Nutcracker', 'DVD', 'essential', 'are', 'fortunate', 'have', 'Balanchine', 'masterpiece', 'so', 'beautifully', 'documented', 'posterity', 'perfect', 'holiday', 'gift', 'introduce', 'young', 'people', 'glorious', 'work', 'art']",George Balanchine's The Nutcracker VHS
365026,A3FT799OERFPOX,6303224407,R. G. Rosa,"[6, 6]","Was Balanchine the most imaginative choreographer of the 20thCentury?I think so.How many of us have seen the Nutcracker ? Since it is such a staple and so popular with community and school groups, I would say that a huge percentage of us have seen it in one form or another.But I don't think anyone has put together a more creative, magical version than Balanchine.There are many Nutcracker DVDs available, many different approaches to the piece, but this is the one that I like best.This film is a fairly exact, expanded for film, version of the stage production that the NYC Ballet puts on stage for about 6 weeks each year during the holiday season. Although the Balanchine version is now 50 years old, it is still fresh and endlessly entertaining.Although the first act can often be uninteresting with so much of it being pantomime, Balanchine treats the two lead children as the main players. Balanchine wisely casts Marie/Masha/Clara(the girl has different names in different versions) as a child rather than have an adult ballerina play the role. Most ballerinas can't stand the close scrutiny and tend to look ridiculous as a child. Perhaps the only exception here is the latest Royal Ballet version with Alina Cojocaru, if any ballerina has the looks and charm of a little girl, she has.But this version is spoiled with Anthony Dowell's fussy, hammy Drosselmeyer. Some one needs to take that cape away from him, he fiddles and swirls it endlessly.Back to Balanchine. I don't think there has been any version of the mouse fight that is more fun. I love how the mice cheer from the sidelines as the King Mouse seems to be winning the battle with the soldiers.All the adult dancers are very effective in their roles and again Balanchine's great imagination comes into play with the wonderful staging of the Act 2 divertissments in the Land of the Sweets.Just a few quibbles. I can understand the logic of casting Macaulay Culkin as the young prince with his box office draw. But he is the single biggest flaw here. The young prince has been done far less self consciously by other children from the SAB.Balanchine painstakingly recreated the young prince's famous mime scene in Act 2 where he describes so beautifully the battle scene with the mice. As a child, Balanchine knew this from the early 20th century Kirov production under what was still the Imperial Russian Era. In the theater this scene has tremendous effect , the children in the audience inevitably break into cheers.Here Caulkin does the mime in a fuzzy, sloppy , unmusical manner. This blunts the impact of one of the major scenes. He also lacks the grace of movement needed here.Also, although I'm sure the effect was to open up the ballet for film, I dislike the bed flying through the air as the children leave the house and go into the snowy forest. The effect is somewhat cheesy, the directer should have stayed closer to the stage version where the house vanishes and the children walk immediately into the forest where the snow starts falling. It's a magical effect that is missing here.Still, let me not appear to quibble too much. This is a wonderful DVD and both adults and children will enjoy it immensely",5,A  Tasty Treat from the Land of the Sweets.,1109376000,"02 26, 2005",2005,3190,"['Was', 'Balanchine', 'most', 'imaginative', 'choreographer', '20thCentury', 'think', 'so.How', 'many', 'have', 'seen', 'Nutcracker', 'such', 'staple', 'so', 'popular', 'community', 'school', 'groups', 'would', 'say', 'huge', 'percentage', 'have', 'seen', 'one', 'form', 'another.But', 'do', ""n't"", 'think', 'anyone', 'put', 'together', 'more', 'creative', 'magical', 'version', 'Balanchine.There', 'are', 'many', 'Nutcracker', 'DVDs', 'available', 'many', 'different', 'approaches', 'piece', 'one', 'like', 'best.This', 'film', 'fairly', 'exact', 'expanded', 'film', 'version', 'stage', 'production', 'NYC', 'Ballet', 'stage', 'about', '6', 'weeks', 'year', 'holiday', 'season', 'Balanchine', 'version', 'now', '50', 'years', 'old', 'still', 'fresh', 'endlessly', 'first', 'act', 'can', 'often', 'be', 'uninteresting', 'so', 'much', 'being', 'pantomime', 'Balanchine', 'two', 'lead', 'children', 'main', 'players', 'Balanchine', 'wisely', 'Marie/Masha/Clara', 'girl', 'different', 'names', 'different', 'versions', 'child', 'rather', 'have', 'adult', 'ballerina', 'play', 'role', 'Most', 'ballerinas', 'ca', ""n't"", 'stand', 'close', 'scrutiny', 'tend', 'look', 'ridiculous', 'child', 'Perhaps', 'only', 'exception', 'here', 'latest', 'Royal', 'Ballet', 'version', 'Alina', 'Cojocaru', 'ballerina', 'looks', 'charm', 'little', 'girl', 'has.But', 'version', 'spoiled', 'Anthony', 'Dowell', 'fussy', 'hammy', 'Drosselmeyer', 'one', 'take', 'cape', 'away', 'swirls', 'endlessly.Back', 'Balanchine', 'do', ""n't"", 'think', 'been', 'version', 'mouse', 'fight', 'more', 'fun', 'love', 'how', 'mice', 'cheer', 'sidelines', 'King', 'Mouse', 'be', 'winning', 'battle', 'soldiers.All', 'adult', 'dancers', 'are', 'very', 'effective', 'roles', 'again', 'Balanchine', 'great', 'imagination', 'play', 'wonderful', 'staging', 'Act', '2', 'divertissments', 'Land', 'Sweets.Just', 'few', 'quibbles', 'can', 'understand', 'logic', 'casting', 'Macaulay', 'Culkin', 'young', 'prince', 'box', 'office', 'draw', 'single', 'biggest', 'flaw', 'here', 'young', 'prince', 'been', 'done', 'far', 'less', 'self', 'consciously', 'other', 'children', 'SAB.Balanchine', 'painstakingly', 'recreated', 'young', 'prince', 'famous', 'mime', 'scene', 'Act', '2', 'where', 'so', 'beautifully', 'battle', 'scene', 'mice', 'child', 'Balanchine', 'knew', 'early', '20th', 'century', 'Kirov', 'production', 'what', 'was', 'still', 'Imperial', 'Russian', 'Era', 'theater', 'scene', 'tremendous', 'effect', 'children', 'audience', 'inevitably', 'break', 'cheers.Here', 'Caulkin', 'mime', 'fuzzy', 'sloppy', 'unmusical', 'manner', 'impact', 'one', 'major', 'scenes', 'also', 'grace', 'movement', 'needed', 'here.Also', ""'m"", 'sure', 'effect', 'was', 'open', 'up', 'ballet', 'film', 'dislike', 'bed', 'flying', 'air', 'children', 'leave', 'house', 'go', 'snowy', 'forest', 'effect', 'somewhat', 'cheesy', 'directer', 'should', 'have', 'stayed', 'closer', 'stage', 'version', 'where', 'house', 'vanishes', 'children', 'walk', 'immediately', 'forest', 'where', 'snow', 'falling', 'magical', 'effect', 'missing', 'here.Still', 'let', 'not', 'appear', 'quibble', 'too', 'much', 'wonderful', 'DVD', 'adults', 'children', 'will', 'enjoy', 'immensely']",George Balanchine's The Nutcracker VHS
365027,A32ASMR822BFSE,6303224407,"Richard Rawls ""Richard Ardle Rawls""","[0, 0]","With over 60 reviews I doubt if this one is needed. It's too bad that some of the truely great ballets, like ""Giselle"" get so few reviews.This is a well done ballet with some very good dancing even from the children. Macaulay Caulkin sometimes turns me off with that smirk of his, however. One can tell that these children are well trained, especially the Marie character.The computer animation is also another turnoff as it lacks the spontaneity of a live performance with audience reaction. It goes down as a spectacle instead of a performance. Of course the music was delightful as usual, but  the narration during the action is not needed and is detracting unless this is strictly for children, and they do not buy many ballet DVDs. If you are a parent or grandparent buy this for your children.",5,A common man's point of view.,1216512000,"07 20, 2008",2008,799,"['60', 'reviews', 'doubt', 'one', 'needed', 'too', 'bad', 'truely', 'great', 'ballets', 'Giselle', 'get', 'few', 'reviews.This', 'well', 'done', 'ballet', 'very', 'good', 'dancing', 'even', 'children', 'Macaulay', 'Caulkin', 'sometimes', 'off', 'smirk', 'however', 'One', 'can', 'tell', 'children', 'are', 'well', 'trained', 'especially', 'Marie', 'character.The', 'computer', 'animation', 'also', 'turnoff', 'spontaneity', 'live', 'performance', 'audience', 'reaction', 'down', 'spectacle', 'instead', 'performance', 'course', 'music', 'was', 'delightful', 'usual', 'narration', 'action', 'not', 'needed', 'detracting', 'strictly', 'children', 'do', 'not', 'buy', 'many', 'ballet', 'DVDs', 'are', 'parent', 'grandparent', 'buy', 'children']",George Balanchine's The Nutcracker VHS
365028,A1D0PLAD8CNQT3,6303224407,Rita Deeb,"[0, 0]",I had been looking for the nutcracker for a long time and when i got this i was sooo excited i love to watch it around the holidays it is perfect,5,Great,1381622400,"10 13, 2013",2013,145,"['had', 'been', 'looking', 'nutcracker', 'long', 'time', 'when', 'i', 'got', 'i', 'was', 'sooo', 'excited', 'i', 'love', 'watch', 'holidays', 'perfect']",George Balanchine's The Nutcracker VHS
365029,A1XN6MBYDBTX16,6303224407,Rosella Ann  Myles,"[1, 2]",This is the best version of &quot;The Nutcraker&quot; that I've everseen.  I highly recommend ii!  It is a truly beautiful and colorful ballet.,5,Beautiful!,1015977600,"03 13, 2002",2002,143,"['best', 'version', 'quot', 'Nutcraker', 'quot', ""'ve"", 'everseen', 'highly', 'recommend', 'ii', 'truly', 'beautiful', 'colorful', 'ballet']",George Balanchine's The Nutcracker VHS
365030,A2C2H81GT5VHZA,6303224407,Sierra N. Crane,"[2, 7]","The first act of this is completely boring, with no good dancing or acting. Macauley Culkin is (as always) blah, and since he is not a ballet dancer, he doesn't fit the role. Jessica Lynn Cohen is also boring as Marie.However, the second half is very good. Darci Kistler is incredible at her age, and Damian Woetzel does some magnificent jumps and a superb turn section. Kyra Nichols' triple pirouettes are perfect, and Tom Gold radiates energy as the candy-cane.Worth buying, I would say, but I always fast-forward through the beginning.",3,A good version.,1047340800,"03 11, 2003",2003,538,"['first', 'act', 'completely', 'boring', 'good', 'dancing', 'acting', 'Macauley', 'Culkin', 'always', 'blah', 'not', 'ballet', 'dancer', ""n't"", 'fit', 'role', 'Jessica', 'Lynn', 'Cohen', 'also', 'boring', 'Marie.However', 'second', 'half', 'very', 'good', 'Darci', 'Kistler', 'incredible', 'age', 'Damian', 'Woetzel', 'magnificent', 'jumps', 'superb', 'turn', 'section', 'Kyra', 'Nichols', 'triple', 'pirouettes', 'are', 'perfect', 'Tom', 'Gold', 'energy', 'candy-cane.Worth', 'buying', 'would', 'say', 'always', 'fast-forward', 'beginning']",George Balanchine's The Nutcracker VHS
365031,AQS63BRZVS2AU,6303224407,S. Strothmann,"[1, 2]",One of the best performances of the Nutcracker that I've seen. I grew up watching the Indiana University Ballet Theater perform and this comes as close to that as any that I've seen either live or on video.,5,Don't Pay Money for Theater Tickets-- Just watch this one!,1252195200,"09 6, 2009",2009,206,"['One', 'best', 'performances', 'Nutcracker', ""'ve"", 'seen', 'grew', 'up', 'watching', 'Indiana', 'University', 'Ballet', 'Theater', 'perform', 'as', 'close', ""'ve"", 'seen', 'live', 'video']",George Balanchine's The Nutcracker VHS
