,reviewerID,asin,reviewerName,helpful,reviewText,overall,summary,unixReviewTime,reviewTime,reviewYear,reviewLength,meaningfulWords,Title
491586,A1TX3VNWII1TOJ,B0000042BZ,Rosomax,"[103, 104]","Okay, first off, it's a FILM version of the opera, so one can't quite judge it by the standards of a recorded live opera.  After being a devoted opera fan for over 20 years, I need to mention that ANYONE, not only ""newbies"" will enjoy it.  What I immediately noticed was the fact that the opera score is here without omissions, a problem that haunts many attempts of making a good opera film.  ""Otello"" or ""La Traviata"", for instance, are superbly staged, but they suffer from many scene omissions, which can be upsetting to the fans.  Not the case here, at least I could not find any without having to retrieve my copy of the score and compare it line by line.The absolute revelation for me was Mr. Ingwar Wixell.  I've heard his voice many times, particularly on early Verdi recordings brought to life by Lamberto Gardelli.  Well, here he sounds even better, plus he proves himself as one of the best singing actors I've ever seen.  At the first scene at Duke's palace, Rigoletto is plain disgusting, no wonder Monterone curses him.  By the way, Monterone is played by Wixell as well, and I was surprised by the sonority and great low register that his baritone is able to produce.  Later, he's a obsessively loving father and a mischievous ""vendicator"".  Loved Feruccio Furlanetto's Sparafucile!  I could not believe it was him under all that makeup, but the pitch-black quality of his voice is unmistakable.  Edita Gruberova has long been one of the world's leading high coloratura sopranos.  Indeed, to be able to accurately negotiate Gilda's tessitura, one needs a spectacular high range.  Sutherland also had that kind of high register, but Gruberova was a better choice cinematically, I suppose.  Still, I wished for a subtler portrait of Gilda, but it had to do.  Pavarotti's Duke is why, of course, most folks will buy this DVD.  Well, he definitely gives a dashing Duke.  He sings up a storm on a soundtrack (including the impossible high-flying ending of ""possente amor"") and a tongue-in-cheek ""la donna e mobile"", his signature aria.  He overplays a bit, but he's a lot of fun to watch.  Since he does not have to sing and move at the same time, he really bounces around quite a bit and looks very much at home throughout.The film depicted the court of the Duke in the most accurate way.  They're quite like vultures, and appropriately dressed in black.  Marullo is sang by none other than Bernd Weikl, but played (wonderfully) by an actor.  Even Giovanna is cast luxuriously - it's Fedora Barbieri who does not only provide a great voice, but also some much-needed comic relief in this fairly dark opera based on Hugo's ""The King Amuses Himself"".  Riccardo Chailly conducts with gusto, but also with proper sensitivity.Overall, it's a well thought-out film, I could not think of a way of making it any better.  Even the often messed-up abduction scene is quite believable here.  The subtitles are not bad, and the picture on DVD is a LOT better than on VHS or LaserDisc.",5,One of the best opera on film ventures,1043712000,"01 28, 2003",2003,2984,"['Okay', 'first', 'FILM', 'version', 'opera', 'one', 'ca', ""n't"", 'quite', 'judge', 'standards', 'recorded', 'live', 'opera', 'being', 'devoted', 'opera', 'fan', '20', 'years', 'need', 'mention', 'ANYONE', 'not', 'only', 'newbies', 'will', 'enjoy', 'What', 'immediately', 'noticed', 'was', 'fact', 'opera', 'score', 'here', 'omissions', 'problem', 'many', 'attempts', 'making', 'good', 'opera', 'film', 'Otello', 'La', 'Traviata', 'instance', 'are', 'superbly', 'staged', 'suffer', 'many', 'scene', 'omissions', 'can', 'be', 'upsetting', 'fans', 'Not', 'case', 'here', 'least', 'could', 'not', 'find', 'having', 'retrieve', 'copy', 'score', 'compare', 'line', 'line.The', 'absolute', 'revelation', 'was', 'Mr.', 'Ingwar', 'Wixell', ""'ve"", 'heard', 'voice', 'many', 'times', 'particularly', 'early', 'Verdi', 'recordings', 'brought', 'life', 'Lamberto', 'Gardelli', 'Well', 'here', 'even', 'better', 'one', 'best', 'singing', 'actors', ""'ve"", 'ever', 'seen', 'first', 'scene', 'Duke', 'palace', 'Rigoletto', 'plain', 'disgusting', 'wonder', 'Monterone', 'way', 'Monterone', 'played', 'Wixell', 'as', 'well', 'was', 'surprised', 'sonority', 'great', 'low', 'register', 'baritone', 'able', 'produce', 'Later', 'obsessively', 'loving', 'father', 'mischievous', 'vendicator', 'Loved', 'Feruccio', 'Furlanetto', 'Sparafucile', 'could', 'not', 'believe', 'was', 'makeup', 'pitch-black', 'quality', 'voice', 'unmistakable', 'Edita', 'Gruberova', 'long', 'been', 'one', 'world', 'leading', 'high', 'coloratura', 'sopranos', 'Indeed', 'be', 'able', 'accurately', 'negotiate', 'Gilda', 'tessitura', 'one', 'spectacular', 'high', 'range', 'Sutherland', 'also', 'had', 'kind', 'high', 'register', 'Gruberova', 'was', 'better', 'choice', 'cinematically', 'suppose', 'Still', 'wished', 'subtler', 'portrait', 'Gilda', 'had', 'do', 'Pavarotti', 'Duke', 'why', 'course', 'most', 'folks', 'will', 'buy', 'DVD', 'Well', 'definitely', 'dashing', 'Duke', 'up', 'storm', 'soundtrack', 'including', 'impossible', 'high-flying', 'ending', 'possente', 'amor', 'tongue-in-cheek', 'la', 'donna', 'e', 'mobile', 'signature', 'aria', 'bit', 'lot', 'fun', 'watch', 'not', 'have', 'sing', 'move', 'same', 'time', 'really', 'around', 'quite', 'bit', 'very', 'much', 'home', 'throughout.The', 'film', 'depicted', 'court', 'Duke', 'most', 'accurate', 'way', ""'re"", 'quite', 'like', 'vultures', 'appropriately', 'dressed', 'black', 'Marullo', 'sang', 'none', 'other', 'Bernd', 'Weikl', 'played', 'wonderfully', 'actor', 'Even', 'Giovanna', 'cast', 'luxuriously', 'Fedora', 'Barbieri', 'who', 'not', 'only', 'provide', 'great', 'voice', 'also', 'much-needed', 'comic', 'relief', 'fairly', 'dark', 'opera', 'based', 'Hugo', 'King', 'Himself', 'Riccardo', 'Chailly', 'gusto', 'also', 'proper', 'sensitivity.Overall', 'well', 'thought-out', 'film', 'could', 'not', 'think', 'way', 'making', 'better', 'Even', 'often', 'messed-up', 'abduction', 'scene', 'quite', 'believable', 'here', 'subtitles', 'are', 'not', 'bad', 'picture', 'DVD', 'LOT', 'better', 'VHS', 'LaserDisc']","Verdi - Rigoletto / Chailly, Pavarotti, Wixell, Gruberova, Vienna Philharmonic VHS"
491587,A3MSLHGXFC4T6D,B0000042BZ,"S. Bernard ""suepera""","[7, 7]","There are so many reasons to like this film version of Verdi's Rigoletto. So many people have already listed them I feel somewhat redundant in listing them again, but I had to add my ""2 cents.""The main reason to get this really is Ingvar Wixell's Rigoletto. He is to baritones what Callas was to sopranos... A SINGING ACTOR. He has the ability to make you feel for him, to despise him, to laugh with him, all the emotions. His is the most believeable jester I've ever had the pleasure of seeing and hearing. His singing is excellent as well, like molten lava, even if his top is a bit pushed. I also thought it wonderfully ironic to have him play both Rigoletto & Monterone- that way the curse is even more like a personal thing. If you liked Wixell in this, you'll love him as Scarpia in the Arena di Verona production of Tosca with Eva Marton (available from Kultur on DVD).Obviously Pavarotti is another reason to get this. Vocally his Duke is impressive and no one captures that same kind of mischeiviousness like he can. That said I do agree with another review that the recording of his part seems to be overly loud- like he was mic'd too closely. I didn't find the same true with the other singers and in fact, Gilda's ""Caro nome"" required me to raise the volume a lot.Gruberova's Gilda is wonderful as well. To me she has one of the most sumptuous coloratura voices ever. Her voice is never reedy or thin like some coloraturas, she has a heft and richness that is throughout her range. Her floating pianissimos are also simply astounding.There are really no weak links here to me- I can cite some flaws, but overall this is a quality production and lots of fun to watch.Highly recommended ******",5,JUST GET IT... you won't regret it!,1195344000,"11 18, 2007",2007,1703,"['are', 'so', 'many', 'reasons', 'like', 'film', 'version', 'Verdi', 'Rigoletto', 'So', 'many', 'people', 'have', 'already', 'listed', 'feel', 'somewhat', 'redundant', 'listing', 'again', 'had', 'add', '2', 'cents', 'main', 'reason', 'get', 'really', 'Ingvar', 'Wixell', 'Rigoletto', 'baritones', 'what', 'Callas', 'was', 'sopranos', 'SINGING', 'ACTOR', 'ability', 'make', 'feel', 'despise', 'laugh', 'emotions', 'most', 'believeable', 'jester', ""'ve"", 'ever', 'had', 'pleasure', 'seeing', 'hearing', 'singing', 'excellent', 'as', 'well', 'molten', 'lava', 'even', 'top', 'bit', 'pushed', 'also', 'thought', 'wonderfully', 'ironic', 'have', 'play', 'Rigoletto', 'Monterone-', 'way', 'curse', 'even', 'more', 'personal', 'thing', 'liked', 'Wixell', ""'ll"", 'love', 'Scarpia', 'Arena', 'di', 'Verona', 'production', 'Tosca', 'Eva', 'Marton', 'available', 'Kultur', 'DVD', '.Obviously', 'Pavarotti', 'reason', 'get', 'Vocally', 'Duke', 'impressive', 'one', 'same', 'kind', 'mischeiviousness', 'can', 'said', 'do', 'agree', 'review', 'recording', 'part', 'be', 'overly', 'loud-', 'was', 'mic', ""'d"", 'too', 'closely', 'did', ""n't"", 'find', 'same', 'true', 'other', 'singers', 'fact', 'Gilda', 'Caro', 'nome', 'required', 'raise', 'volume', 'lot.Gruberova', 'Gilda', 'wonderful', 'as', 'well', 'one', 'most', 'sumptuous', 'coloratura', 'voices', 'ever', 'voice', 'never', 'reedy', 'thin', 'coloraturas', 'heft', 'richness', 'range', 'floating', 'pianissimos', 'are', 'also', 'simply', 'are', 'really', 'weak', 'links', 'here', 'me-', 'can', 'cite', 'flaws', 'overall', 'quality', 'production', 'lots', 'fun', 'watch.Highly', 'recommended', '******']","Verdi - Rigoletto / Chailly, Pavarotti, Wixell, Gruberova, Vienna Philharmonic VHS"
491588,A1FPHI7OOOBH1T,B0000042BZ,sergei kochkin,"[2, 2]",I bought this DVD over all others because of the fine reviews. The reviewers were correct. An incredible cast and story absolutely shocking with great location scenary which I always prefer over most staged performances. The whole show is Ingvar Wixell with a couple great famous arias by the then young Pavarotti. My only complaint as always is not enough subtitles. This is a keeper.,5,Perfection,1300665600,"03 21, 2011",2011,385,"['bought', 'DVD', 'others', 'fine', 'reviews', 'reviewers', 'were', 'correct', 'incredible', 'cast', 'story', 'absolutely', 'shocking', 'great', 'location', 'scenary', 'always', 'prefer', 'most', 'staged', 'performances', 'whole', 'show', 'Ingvar', 'Wixell', 'couple', 'great', 'famous', 'arias', 'then', 'young', 'Pavarotti', 'only', 'complaint', 'always', 'not', 'enough', 'subtitles', 'keeper']","Verdi - Rigoletto / Chailly, Pavarotti, Wixell, Gruberova, Vienna Philharmonic VHS"
491589,A2PQPTFYTTUXBL,B0000042BZ,"Snake Man ""The unmentionable one""","[2, 5]","There are two main reasons to get this dvd - 1) the cinematographic and artistic realization of a very literal interpretation of Verdi's favourite opera, 2) Gruberova.This is a sort of verismo version of Rigoletto. I think this is deliberate - it is filmed in a lavish Parmesan location, the characters, particularly Rigoletto, are played in a fairly non-stereotyped way (except perhaps Pavarotti but that owes more to the fact that he actually can't act very well), there is an emphasis on providing a coherent, integrated vision of the work.This is probably quite apt given that it is a film rather than a staged adaptation of the work - a lot of effort has gone into the acting and making the characters seem very real human beings.The key to this is perhaps Gruberova since I have always found Gilda to be the least convincing of characters in the opera yet with this nuanced performance, not to mention utterly beautiful singing replete with superb coloratura, she does cast a really credible Gilda that comes of age and is fatally abused.Gruberova is truly terrific; if Gobbi is the ultimate Rigoletto, then Gruberova is the ultimate Gilda - forget Callas who is not sweet sounding enough and not convincing as an 'innocent flower', forget Sutherland, forget modern performers such as Cortrubas and Schafer, Gruberova is the one!Gruberova apart, we have Pavarotti at his peak - not the greatest of actors but not terrible at least, and at this age he looks the part, Wixell - fine acting performance whereby he plays Rigoletto as a fairly normal human being that is just a bit smaller and uglier than the rest, as compared to, for example, Gobbi who plays Rigoletto in a more stereotyped manner. Wixell has a powerful but not beautiful voice and consequently such great solos as 'deh non parlar' and the final death scene perhaps transmit a little less emotional meaning than might otherwise be the case with a more tender sounding Rigoletto. Nevertheless, such scenes are still imbued with emotion such is Ponelle's cinematographic work - I particularly like the cinematographic realization of the death scene where father and daughter are sort of isolated in a boat on the river and Gilda's death appears as if not noticeable to anyone in the world but Rigoletto which somewhat highlights Rigoletto's isolation; however, Gobbi and also Gavanelli from the recent Covent Garden/McVicar production have far superior tonality which allows for Rigoletto's hidden tenderness to come out much more. Gobbi, in particular, was able to produce a real Jekyll and Hide of a Rigoletto where Wixell here plays him in a more literal way - consistent with the style of the film. It is an interesting interpretation but I prefer Gobbi.Everything else is nice. Sometimes the directing descends into cliche where we have a lot of annoying and unconvincing 'evil laughs' particularly from Pavarotti that belong more to pantomime than opera. Similarly the close ups of Monterone look a little ridiculous though i think the playing up of the psychological impact on Rigoletto of 'la maledizione' is a nice touch. It emphasizes the role that Rigoletto plays in his own downfall - so desperate to protect himself and his daughter that he is willing to tread on everyone else and their daughters beside! In trying to adapt to survive the brutality of his fellow citizens he has become so corrupted by the true 'maledizione' that is the Duke's rule, court and all in the vicinity that it has contaminated everything he loves in spite of his best efforts.This is a Rigoletto that is a more complete and sophisticated interpretation therefore than certain other staged productions, such as McVicar's at ROH - though in this case the comparative simplified thematic emphasis, on the dichotomy of inward and outward beauty/ugliness, serves to render certain of the Rigoletto-Gilda scenes more emotionally impacting and therefore perhaps it is inappropriate, given the relative complexity of the themes involved in the opera, to refer to this or any other version as definitive.However, I think this is a version that must stand up to the best of them  with the central reasons for buying this, therefore, the thematically complex versimo perspective of Rigoletto that it provides and the outstanding overall performance of Gruberova that must be the finest Gilda performance available on video.",5,Gruberova and Ponelle are key!!!!,1191542400,"10 5, 2007",2007,4372,"['are', 'two', 'main', 'reasons', 'get', 'dvd', '1', 'cinematographic', 'artistic', 'realization', 'very', 'literal', 'interpretation', 'Verdi', 'favourite', 'opera', '2', 'Gruberova.This', 'sort', 'verismo', 'version', 'Rigoletto', 'think', 'deliberate', 'filmed', 'lavish', 'Parmesan', 'location', 'characters', 'particularly', 'Rigoletto', 'are', 'played', 'fairly', 'non-stereotyped', 'way', 'perhaps', 'Pavarotti', 'more', 'fact', 'actually', 'ca', ""n't"", 'act', 'very', 'well', 'emphasis', 'providing', 'coherent', 'integrated', 'vision', 'work.This', 'probably', 'quite', 'apt', 'given', 'film', 'rather', 'staged', 'adaptation', 'work', 'lot', 'effort', 'gone', 'acting', 'making', 'characters', 'seem', 'very', 'real', 'human', 'beings.The', 'key', 'perhaps', 'Gruberova', 'have', 'always', 'found', 'Gilda', 'be', 'least', 'convincing', 'characters', 'opera', 'yet', 'nuanced', 'performance', 'not', 'mention', 'utterly', 'beautiful', 'singing', 'replete', 'superb', 'coloratura', 'cast', 'really', 'credible', 'Gilda', 'age', 'fatally', 'abused.Gruberova', 'truly', 'terrific', 'Gobbi', 'ultimate', 'Rigoletto', 'then', 'Gruberova', 'ultimate', 'Gilda', 'forget', 'Callas', 'who', 'not', 'sweet', 'sounding', 'enough', 'not', 'convincing', ""'innocent"", 'flower', 'forget', 'Sutherland', 'forget', 'modern', 'performers', 'such', 'Cortrubas', 'Schafer', 'Gruberova', 'one', 'Gruberova', 'apart', 'have', 'Pavarotti', 'peak', 'not', 'greatest', 'actors', 'not', 'terrible', 'least', 'age', 'part', 'Wixell', 'fine', 'acting', 'performance', 'whereby', 'Rigoletto', 'fairly', 'normal', 'human', 'being', 'just', 'bit', 'smaller', 'uglier', 'rest', 'compared', 'example', 'Gobbi', 'who', 'Rigoletto', 'more', 'stereotyped', 'manner', 'Wixell', 'powerful', 'not', 'beautiful', 'voice', 'consequently', 'such', 'great', 'solos', ""'deh"", 'parlar', 'final', 'death', 'scene', 'perhaps', 'transmit', 'little', 'less', 'emotional', 'meaning', 'might', 'otherwise', 'be', 'case', 'more', 'tender', 'sounding', 'Rigoletto', 'Nevertheless', 'such', 'scenes', 'are', 'still', 'imbued', 'emotion', 'such', 'Ponelle', 'cinematographic', 'work', 'particularly', 'cinematographic', 'realization', 'death', 'scene', 'where', 'father', 'daughter', 'are', 'sort', 'isolated', 'boat', 'river', 'Gilda', 'death', 'not', 'noticeable', 'anyone', 'world', 'Rigoletto', 'somewhat', 'Rigoletto', 'isolation', 'however', 'Gobbi', 'also', 'Gavanelli', 'recent', 'Covent', 'Garden/McVicar', 'production', 'have', 'far', 'superior', 'tonality', 'Rigoletto', 'hidden', 'tenderness', 'come', 'out', 'much', 'more', 'Gobbi', 'particular', 'was', 'able', 'produce', 'real', 'Jekyll', 'Hide', 'Rigoletto', 'where', 'Wixell', 'here', 'more', 'literal', 'way', 'consistent', 'style', 'film', 'interesting', 'interpretation', 'prefer', 'Gobbi.Everything', 'else', 'nice', 'Sometimes', 'directing', 'cliche', 'where', 'have', 'lot', 'annoying', 'unconvincing', ""'evil"", 'laughs', 'particularly', 'Pavarotti', 'belong', 'more', 'pantomime', 'opera', 'Similarly', 'close', 'ups', 'Monterone', 'look', 'little', 'ridiculous', 'i', 'think', 'playing', 'psychological', 'impact', 'Rigoletto', ""'la"", 'maledizione', 'nice', 'touch', 'role', 'Rigoletto', 'own', 'downfall', 'so', 'desperate', 'protect', 'daughter', 'willing', 'tread', 'everyone', 'else', 'daughters', 'beside', 'trying', 'adapt', 'survive', 'brutality', 'fellow', 'citizens', 'become', 'so', 'corrupted', 'true', ""'maledizione"", 'Duke', 'rule', 'court', 'vicinity', 'contaminated', 'everything', 'spite', 'best', 'efforts.This', 'Rigoletto', 'more', 'complete', 'sophisticated', 'interpretation', 'therefore', 'certain', 'other', 'staged', 'productions', 'such', 'McVicar', 'ROH', 'though', 'case', 'comparative', 'simplified', 'thematic', 'emphasis', 'dichotomy', 'inward', 'outward', 'beauty/ugliness', 'render', 'certain', 'Rigoletto-Gilda', 'scenes', 'more', 'emotionally', 'impacting', 'therefore', 'perhaps', 'inappropriate', 'given', 'relative', 'complexity', 'themes', 'involved', 'opera', 'refer', 'other', 'version', 'definitive.However', 'think', 'version', 'must', 'stand', 'up', 'best', 'central', 'reasons', 'buying', 'therefore', 'thematically', 'complex', 'versimo', 'perspective', 'Rigoletto', 'outstanding', 'overall', 'performance', 'Gruberova', 'must', 'be', 'finest', 'Gilda', 'performance', 'available', 'video']","Verdi - Rigoletto / Chailly, Pavarotti, Wixell, Gruberova, Vienna Philharmonic VHS"
491590,A1QMV27SG8RXTT,B0000042BZ,Soup Lover,"[1, 1]","This was great!  Pavarotti is fun (and young) the sets are nice, Rigoletto is terribly tragic and the courtiers are strong.  The maid (the old witch) was very convincing.  Any criticisms would be minor.",5,What a ball!,1204761600,"03 6, 2008",2008,202,"['was', 'great', 'Pavarotti', 'fun', 'young', 'sets', 'are', 'nice', 'Rigoletto', 'terribly', 'tragic', 'courtiers', 'are', 'strong', 'maid', 'old', 'witch', 'was', 'very', 'convincing', 'criticisms', 'would', 'be', 'minor']","Verdi - Rigoletto / Chailly, Pavarotti, Wixell, Gruberova, Vienna Philharmonic VHS"
491591,A1C2HRCR4ZFZV0,B0000042BZ,"Spinto ""thehighc""","[6, 6]","This is a dynamic and exciting show with the leads at the top of their game.Rigoletto has never been more convincingly acted than in the hands of Ingvar Wixell.  His voice is powerful and fulll of different colors to enjoy throuought the opera.  His g# at the end of the 2nd act is extremely impressive.  He radiates internal struggle and pain and earns his stars as not only a great baritone but a great actor.Gilda gets a wonderful treatment by Gruderova, who can sing a pianissimo as well as you can hear.  Her joy and pain is clearly visible throughout and she really does portray well the confused, miserable creature that Gilda becomes quite well.  unlike pavarotti, she takes very few liberties from the score and sings within it well.Pavarotti sounds great.  This is the kind of role that is made for his voice.  His duke is beautifully sounded in his mature but lyric voice. This is the kind of spinto singing that makes pavarotti one of the greatest tenors of all time. His acting, while entertaining, is unconvincing.  He has a disturbing habit of never blinking his eyes during Aria's which can bug the viewer.Overall this is a absolutley fabulous entertainment experience.  The only reason I give it 4 stars is the lip synching.  I think it takes away from the opera experience to have it recorded and dubbed into the scene.  The singers expression and the excitement of the opera is increased when it is live.  I think, however, it is a worthwhile buy for opera and non-opera fans alike. The story and presentation is wonderful and the singing doubly so.",4,Top Notch,1049500800,"04 5, 2003",2003,1568,"['dynamic', 'exciting', 'show', 'leads', 'top', 'game.Rigoletto', 'never', 'been', 'more', 'convincingly', 'acted', 'hands', 'Ingvar', 'Wixell', 'voice', 'powerful', 'fulll', 'different', 'colors', 'enjoy', 'opera', 'g', 'end', '2nd', 'act', 'extremely', 'impressive', 'internal', 'struggle', 'pain', 'stars', 'not', 'only', 'great', 'baritone', 'great', 'actor.Gilda', 'wonderful', 'treatment', 'Gruderova', 'who', 'can', 'sing', 'pianissimo', 'as', 'well', 'can', 'hear', 'joy', 'pain', 'clearly', 'visible', 'really', 'portray', 'well', 'confused', 'miserable', 'creature', 'Gilda', 'quite', 'well', 'pavarotti', 'very', 'few', 'liberties', 'score', 'sings', 'great', 'kind', 'role', 'made', 'voice', 'duke', 'beautifully', 'sounded', 'mature', 'lyric', 'voice', 'kind', 'spinto', 'singing', 'pavarotti', 'one', 'greatest', 'tenors', 'time', 'acting', 'entertaining', 'unconvincing', 'disturbing', 'habit', 'never', 'blinking', 'eyes', 'Aria', 'can', 'bug', 'viewer.Overall', 'absolutley', 'fabulous', 'entertainment', 'experience', 'only', 'reason', 'give', '4', 'stars', 'lip', 'synching', 'think', 'away', 'opera', 'experience', 'have', 'recorded', 'dubbed', 'scene', 'singers', 'expression', 'excitement', 'opera', 'increased', 'when', 'live', 'think', 'however', 'worthwhile', 'buy', 'opera', 'non-opera', 'fans', 'alike', 'story', 'presentation', 'wonderful', 'singing', 'doubly', 'so']","Verdi - Rigoletto / Chailly, Pavarotti, Wixell, Gruberova, Vienna Philharmonic VHS"
