,reviewerID,asin,reviewerName,helpful,reviewText,overall,summary,unixReviewTime,reviewTime,reviewYear,reviewLength,meaningfulWords,Title
491569,A1GDKA1SAK41GU,B0000042BZ,"club 7 ""club 7""","[2, 2]","A superbly directed production which is compelling from minute one to the end and features incredibly charismatic and thrilling vocal and acting performances by wixell and pavarotti as well as the rest of the cast.Riccardo Chailly with the vienna philharmonic are masterful in their pacing,sense of dynamics and in their musical phrasing providing the perfect eloquent musical partner to this electrifying score.This opera is not recorded on a stage but in mantua which expands and obviously adds more definition to the visual aspect.So if you're looking to be thrilled,floored, and swept away by the power of Verdi's Rigoletto then you have come to the perfect place to get your fix.Go ahead but leave the knife in the kitchen drawer.",5,The Curse that became the fate,1229904000,"12 22, 2008",2008,735,"['superbly', 'directed', 'production', 'compelling', 'minute', 'one', 'end', 'features', 'incredibly', 'charismatic', 'thrilling', 'vocal', 'acting', 'performances', 'wixell', 'pavarotti', 'as', 'well', 'rest', 'cast.Riccardo', 'Chailly', 'vienna', 'philharmonic', 'are', 'masterful', 'pacing', 'sense', 'dynamics', 'musical', 'phrasing', 'providing', 'perfect', 'eloquent', 'musical', 'partner', 'electrifying', 'score.This', 'opera', 'not', 'recorded', 'stage', 'mantua', 'obviously', 'more', 'definition', 'visual', 'aspect.So', ""'re"", 'looking', 'be', 'thrilled', 'floored', 'swept', 'away', 'power', 'Verdi', 'Rigoletto', 'then', 'have', 'come', 'perfect', 'place', 'get', 'fix.Go', 'ahead', 'leave', 'knife', 'kitchen', 'drawer']","Verdi - Rigoletto / Chailly, Pavarotti, Wixell, Gruberova, Vienna Philharmonic VHS"
491570,A1I25F9S8ZR6ET,B0000042BZ,David,"[0, 1]","Vi este DVD en Espa&ntilde;a y me dio much&iacute;simo placer.  Los cantantes son de la primera clase, y se destacan Wixell, Pavarotti y Gruberova.  Para los que no conocen bien la magia de la &oacute;pera, les recomiendo este DVD para llegar a conocerla--la historia de Rigoletto es buena e interestante, contiene mucha acci&oacute;n, y no es una obra tan larga.  Los cantantes cantan como nunca y logran dar una representaci&oacute;n que es verdaderamente inolvidable.",5,&iexcl;Bravo!,993340800,"06 24, 2001",2001,470,"['Vi', 'este', 'DVD', 'Espa', 'ntilde', 'y', 'much', 'iacute', 'simo', 'placer', 'Los', 'son', 'la', 'primera', 'clase', 'y', 'se', 'destacan', 'Wixell', 'Pavarotti', 'y', 'Gruberova', 'Para', 'los', 'que', 'conocen', 'bien', 'la', 'magia', 'de', 'la', 'oacute', 'pera', 'recomiendo', 'este', 'DVD', 'para', 'llegar', 'conocerla', 'la', 'historia', 'Rigoletto', 'es', 'buena', 'e', 'interestante', 'contiene', 'mucha', 'acci', 'oacute', 'es', 'una', 'obra', 'tan', 'larga', 'Los', 'cantan', 'como', 'nunca', 'y', 'logran', 'dar', 'una', 'representaci', 'oacute', 'que', 'es', 'verdaderamente', 'inolvidable']","Verdi - Rigoletto / Chailly, Pavarotti, Wixell, Gruberova, Vienna Philharmonic VHS"
491571,A7HEZCAYG5JML,B0000042BZ,"DC ""David Ceremuga""","[2, 6]","I don't know.  I like it, but I don't.  I'm an avid believer that if you have a nice home theater setup with a large screen, then you should expect sharp visuals and clean audio.  Being an old opera production, the video shows its age.The audio and vocal performances are quite good, and will come across nicely with your home theater.  I would enjoy this much better if produced in HD but keeping the elegant staging.Now, for those that do not care if they see ""film"" marks, or the 3:4 aspect ration, this is a 5 star production.",3,"Really good, but shows its age.",1328054400,"02 1, 2012",2012,530,"['do', ""n't"", 'know', 'do', ""n't"", ""'m"", 'avid', 'believer', 'have', 'nice', 'home', 'theater', 'setup', 'large', 'screen', 'then', 'should', 'expect', 'sharp', 'visuals', 'clean', 'audio', 'Being', 'old', 'opera', 'production', 'video', 'age.The', 'audio', 'vocal', 'performances', 'are', 'quite', 'good', 'will', 'come', 'nicely', 'home', 'theater', 'would', 'enjoy', 'much', 'better', 'produced', 'HD', 'keeping', 'elegant', 'staging.Now', 'do', 'not', 'care', 'see', 'film', 'marks', '3:4', 'aspect', 'ration', '5', 'star', 'production']","Verdi - Rigoletto / Chailly, Pavarotti, Wixell, Gruberova, Vienna Philharmonic VHS"
491572,A1TGN74Z6R5PV6,B0000042BZ,Dr. F. Mark Carter,"[6, 6]","This is a wonderful ""Rigoletto"".  It is full of drama.  The signing from the three principals beyond reproach.  The orchestral playing is dramatic and smooth as silk, although the balance favors the singers excessively.  Some film scenes are breathtaking in their beauty.I had always thought that opera created specifically for video would have many advantages over staged productions.  However the reverse seemsgenerally true to me.  I suppose it is because operas are indeed great works of the theater, and they need the ethos of the theater, including the audience interaction to shine.  Or is that the producers lack a certain artistic sensitivity and imagination?  Having said that, this is the most successful production of opera out of the theater that I have seen on video.It seems to me that the music dramas of Richard Wagner are most ripe for imaginative productions for video out of the theater.A word about the sound.  The DTS 5.1 sound track is of very inferior quality.  It is top heavy with a screeching string tone, the brass is all lip and no bell, the singers are all head and no chest voice.  The bass quality is poor and largely absent.  Happily the PCM 2 channel stereo tracks are much better.  The bass is full, the only problem being a balance of the signers over the orchestra that is less than optimal.A word about sound tracks on DVD opera.  Both Dolby digital and DTS 5.1 use lossy digital compression.  For large scale musical works such as opera, any lossy compression is going to produce inferior results and unpleasant digital artifacts, which on this recording are horrendous.The 2 channel PCM tracks are lossless digital feeds of true CD quality.  Fortunately most operas on DVD have these tracks.  The multichannel Dolby and DTS tracks are contrived from two channel stereo in any event on most opera DVD productions.  Therefore for viewers who have home theater multichannel systems they are much better off having their audio visual preamps or receivers, produce the ambient surround effect in Dolby PLx Music for five channel systems, or Dolby PLIIx Music for seven channel systems.  I do not recommend the Cinema, or settings other than Music, for opera.  The seven channel PLIIx is significantly more effective than the  five channel PLx, at conveying a realistic sense of space and ambiance.The way the system is set up is to connect the DVD player to the audio visual preamp or receiver using the digital interface using a digital cable, which on most players is optical.  On some it may be coaxial SPDIF.  Select 2 channel PCM on the DVD audio menu.  Set the input of the  preamp or receiver to the the appropriate digital connection, and select the appropriate version of Dolby PLx or PLIIx for your system.Unless your system is superb, and has very good speakers for ALL channels you will be better off listening in standard stereo.  The center speakers in particular, tend to be poor in most set ups, with very few stellar performers to choose from.  All the surround speakers need to be high quality full range speakers, of a quality comparable to the fronts.  All speakers need to be carefully balanced.  If these caveats do not pertain to your multichannel system you will almost certainly get the best results listening in stereo.A well set up surround system, can however bring a real sense of ""being there"", that can not be matched by even the best two channel systems.",4,Film versus theater,1191715200,"10 7, 2007",2007,3421,"['wonderful', 'Rigoletto', 'full', 'drama', 'signing', 'three', 'principals', 'reproach', 'orchestral', 'playing', 'dramatic', 'smooth', 'silk', 'balance', 'singers', 'excessively', 'film', 'scenes', 'are', 'breathtaking', 'beauty.I', 'had', 'always', 'thought', 'opera', 'created', 'specifically', 'video', 'would', 'have', 'many', 'advantages', 'staged', 'productions', 'However', 'reverse', 'seemsgenerally', 'true', 'suppose', 'operas', 'are', 'indeed', 'great', 'works', 'theater', 'need', 'ethos', 'theater', 'including', 'audience', 'interaction', 'shine', 'producers', 'lack', 'certain', 'artistic', 'sensitivity', 'imagination', 'Having', 'said', 'most', 'successful', 'production', 'opera', 'theater', 'have', 'seen', 'video.It', 'music', 'dramas', 'Richard', 'Wagner', 'are', 'most', 'ripe', 'imaginative', 'productions', 'video', 'theater.A', 'word', 'sound', 'DTS', '5.1', 'sound', 'track', 'very', 'inferior', 'quality', 'top', 'heavy', 'screeching', 'string', 'tone', 'brass', 'lip', 'bell', 'singers', 'are', 'head', 'chest', 'voice', 'bass', 'quality', 'poor', 'largely', 'absent', 'Happily', 'PCM', '2', 'channel', 'stereo', 'tracks', 'are', 'much', 'better', 'bass', 'full', 'only', 'problem', 'being', 'balance', 'signers', 'orchestra', 'less', 'optimal.A', 'word', 'sound', 'tracks', 'DVD', 'opera', 'Dolby', 'digital', 'DTS', '5.1', 'use', 'lossy', 'digital', 'compression', 'large', 'scale', 'musical', 'works', 'such', 'opera', 'lossy', 'compression', 'going', 'produce', 'inferior', 'results', 'unpleasant', 'digital', 'artifacts', 'recording', 'are', 'horrendous.The', '2', 'channel', 'PCM', 'tracks', 'are', 'lossless', 'digital', 'feeds', 'true', 'CD', 'quality', 'Fortunately', 'most', 'operas', 'DVD', 'have', 'tracks', 'multichannel', 'Dolby', 'DTS', 'tracks', 'are', 'contrived', 'two', 'channel', 'stereo', 'event', 'most', 'opera', 'DVD', 'productions', 'Therefore', 'viewers', 'who', 'have', 'home', 'theater', 'multichannel', 'systems', 'are', 'much', 'better', 'having', 'audio', 'visual', 'preamps', 'receivers', 'produce', 'ambient', 'surround', 'effect', 'Dolby', 'PLx', 'Music', 'five', 'channel', 'systems', 'Dolby', 'PLIIx', 'Music', 'seven', 'channel', 'systems', 'do', 'not', 'recommend', 'Cinema', 'other', 'Music', 'opera', 'seven', 'channel', 'PLIIx', 'significantly', 'more', 'effective', 'five', 'channel', 'PLx', 'conveying', 'realistic', 'sense', 'space', 'ambiance.The', 'way', 'system', 'set', 'up', 'connect', 'DVD', 'player', 'audio', 'visual', 'preamp', 'receiver', 'using', 'digital', 'interface', 'using', 'digital', 'cable', 'most', 'players', 'optical', 'may', 'be', 'coaxial', 'SPDIF', 'Select', '2', 'channel', 'PCM', 'DVD', 'audio', 'menu', 'Set', 'input', 'preamp', 'receiver', 'appropriate', 'digital', 'connection', 'select', 'appropriate', 'version', 'Dolby', 'PLx', 'PLIIx', 'system.Unless', 'system', 'superb', 'very', 'good', 'speakers', 'ALL', 'channels', 'will', 'be', 'better', 'off', 'listening', 'standard', 'stereo', 'center', 'speakers', 'particular', 'tend', 'be', 'poor', 'most', 'set', 'ups', 'very', 'few', 'stellar', 'performers', 'choose', 'surround', 'speakers', 'need', 'be', 'high', 'quality', 'full', 'range', 'speakers', 'quality', 'comparable', 'fronts', 'speakers', 'need', 'be', 'carefully', 'balanced', 'caveats', 'do', 'not', 'pertain', 'multichannel', 'system', 'will', 'almost', 'certainly', 'get', 'best', 'results', 'listening', 'stereo.A', 'well', 'set', 'up', 'surround', 'system', 'can', 'however', 'bring', 'real', 'sense', 'being', 'there', 'can', 'not', 'be', 'matched', 'even', 'best', 'two', 'channel', 'systems']","Verdi - Rigoletto / Chailly, Pavarotti, Wixell, Gruberova, Vienna Philharmonic VHS"
491573,A2PR6NXG0PA3KY,B0000042BZ,Giordano Bruno,"[28, 30]","Real opera lovers are a wee tad finicky, as the one- and two-star reviews of this DVD demonstrate. Real opera lovers seem to have a Platonic Ideal of the opera in their cavernous consciousnesses, a template of what Joe Verdi intended, from which any deviation is risky. Real opera lovers don't take well to 'film' productions of their idolized operas. Even if they are now ultra-pecunious enough to sit in the orchestra, they recall their youthful evenings in 'paradise' (the highest balcony) as the best of their lives, and they need that distant, almost inaudible timbre in the tenor's voice to sustain their enthusiasm. Real opera lovers KNOW whose performance, attested only by repute or perhaps by a tinny recording, was sans pareil for all time.Me? I'm just a guy who goes to the opera for the fun of it, and I'm ready to be pleased. I'm also a musician by trade, which leads me to cut quite a lot of slack for the professional sisters and brothers, and inclines me to care more about the sounds I hear, the music itself, than about the staging or acting. Yes yes, I know opera as an art aspires to totality, to the sublime unison of drama and music. But realistically, friends, the unison is most often imbalanced: wonderful music, dopey libretto. Can you earnestly argue otherwise? Particularly about the operas of Giuseppe Verdi?Case in point: Rigoletto! The script is a squalid and improbable melodrama. Without music, it would be snored off the stage. Rigoletto is a horrid little beast, deformed as much in mind as in body, and he's more convincingly gullible than devious. The Duke of Mantua is an odious tyrant. Everyone in the cast is besotted with evil except Gilda, Rigoletto's cloistered daughter, whose purity of being must be taken on faith. The story is grotesque, the characters are grotesque... but the music! ah, the music is celestial! Even the vile assassin is given celestial music to sing. But does any real opera lover ever complain about 'cognitive dissonance'?I can almost promise you, dear reader, that even if you think you've never seen or heard Rigoletto in your life, you will snap to attention at the Duke's first major aria, and say to yourself ""why, I know that music! So this is where it comes from!"" And you'll have such epiphanies several more times before the final curtain. It's the Duke's voice you'll remember as you leave the theater, or turn off the DVD player. It's the joyous lilt of the debauched Duke's arias that you'll find yourself singing in the shower. The most essential item in a production of Rigoletto is that the Duke's role be sung superbly, and recorded equally well. Forget any other quibbles: Luciano Pavarotti sang this music, as people said about Caruso, like a God. If you've ever wondered why Pavarotti was venerated, this DVD will answer your doubts. You can decide for yourself whether he could also 'act'. It's an insignificant question.Ingvar Wixell is almost ludicrously ugly in his make-up as the hunch-backed Rigoletto, and his posturing verges on silliness, but once again, IT'S The Music, Stupid! Wixell's tormented, interiorized vocal art makes emotional sense out of Verdi's twisted musical musings. If the visuals annoy you, opera lovers, just shade your eyes and watch the subtitles.Coloratura soprano Edita Gruberova  soars. That's her job. She doesn't look childish enough for the role, but she conveys her nun-like innocence in her voice, and she sings in tune! Not a minor accomplishment for a Verdi specialist! What's more, she has the musical wisdom to ""comp"" to Pavarotti in their duets, not to attempt to upstage him. Nobody could upstage Pavarotti in this music.Okay. I'm almost finished.Verdi outdid himself in Rigoletto. The music is iconic. Unforgettable. Rigoletto is one warhorse that deserves to be ridden as long as opera houses stand and opera lovers are willing to spend an Afghani's life wages for a single evening in a box seat.",5,Glad I'm not a real Opera Lover!,1259107200,"11 25, 2009",2009,3931,"['Real', 'opera', 'lovers', 'are', 'wee', 'tad', 'finicky', 'one-', 'two-star', 'reviews', 'DVD', 'demonstrate', 'Real', 'opera', 'lovers', 'seem', 'have', 'Platonic', 'Ideal', 'opera', 'cavernous', 'consciousnesses', 'template', 'what', 'Joe', 'Verdi', 'intended', 'deviation', 'risky', 'Real', 'opera', 'lovers', 'do', ""n't"", 'take', 'well', ""'film"", 'productions', 'idolized', 'operas', 'Even', 'are', 'now', 'ultra-pecunious', 'enough', 'sit', 'orchestra', 'recall', 'youthful', 'evenings', ""'paradise"", 'highest', 'balcony', 'best', 'lives', 'need', 'distant', 'almost', 'inaudible', 'timbre', 'tenor', 'voice', 'sustain', 'enthusiasm', 'Real', 'opera', 'lovers', 'KNOW', 'performance', 'attested', 'only', 'repute', 'perhaps', 'tinny', 'recording', 'was', 'sans', 'pareil', 'time.Me', ""'m"", 'just', 'guy', 'who', 'opera', 'fun', ""'m"", 'ready', 'be', 'pleased', ""'m"", 'also', 'musician', 'trade', 'cut', 'quite', 'lot', 'slack', 'professional', 'sisters', 'brothers', 'inclines', 'care', 'more', 'sounds', 'hear', 'music', 'staging', 'acting', 'Yes', 'yes', 'know', 'opera', 'art', 'totality', 'sublime', 'unison', 'drama', 'music', 'realistically', 'friends', 'unison', 'most', 'often', 'imbalanced', 'wonderful', 'music', 'dopey', 'libretto', 'Can', 'earnestly', 'argue', 'otherwise', 'Particularly', 'operas', 'Giuseppe', 'Verdi', 'Case', 'point', 'Rigoletto', 'script', 'squalid', 'improbable', 'melodrama', 'music', 'would', 'be', 'snored', 'off', 'stage', 'Rigoletto', 'horrid', 'little', 'beast', 'deformed', 'much', 'mind', 'body', 'more', 'convincingly', 'gullible', 'devious', 'Duke', 'Mantua', 'odious', 'tyrant', 'Everyone', 'cast', 'besotted', 'evil', 'Gilda', 'Rigoletto', 'cloistered', 'daughter', 'purity', 'being', 'must', 'be', 'taken', 'faith', 'story', 'grotesque', 'characters', 'are', 'grotesque', 'music', 'ah', 'music', 'celestial', 'Even', 'vile', 'assassin', 'given', 'celestial', 'music', 'sing', 'real', 'opera', 'lover', 'ever', 'complain', ""'cognitive"", 'dissonance', 'can', 'almost', 'promise', 'dear', 'reader', 'even', 'think', ""'ve"", 'never', 'seen', 'heard', 'Rigoletto', 'life', 'will', 'snap', 'attention', 'Duke', 'first', 'major', 'aria', 'say', 'yourself', 'why', 'know', 'music', 'where', ""'ll"", 'have', 'such', 'epiphanies', 'several', 'more', 'times', 'final', 'curtain', 'Duke', 'voice', ""'ll"", 'remember', 'leave', 'theater', 'turn', 'off', 'DVD', 'player', 'joyous', 'lilt', 'debauched', 'Duke', 'arias', ""'ll"", 'find', 'singing', 'shower', 'most', 'essential', 'item', 'production', 'Rigoletto', 'Duke', 'role', 'be', 'sung', 'superbly', 'recorded', 'equally', 'well', 'Forget', 'other', 'quibbles', 'Luciano', 'Pavarotti', 'sang', 'music', 'people', 'said', 'Caruso', 'God', ""'ve"", 'ever', 'wondered', 'why', 'Pavarotti', 'was', 'venerated', 'DVD', 'will', 'answer', 'doubts', 'can', 'decide', 'could', 'also', ""'act"", 'insignificant', 'question.Ingvar', 'Wixell', 'almost', 'ludicrously', 'ugly', 'make-up', 'hunch-backed', 'Rigoletto', 'posturing', 'verges', 'silliness', 'once', 'again', 'IT', 'Music', 'Stupid', 'Wixell', 'tormented', 'interiorized', 'vocal', 'art', 'emotional', 'sense', 'Verdi', 'twisted', 'musical', 'musings', 'visuals', 'annoy', 'opera', 'lovers', 'just', 'shade', 'eyes', 'watch', 'subtitles.Coloratura', 'soprano', 'Edita', 'Gruberova', 'soars', 'job', ""n't"", 'look', 'childish', 'enough', 'role', 'conveys', 'nun-like', 'innocence', 'voice', 'sings', 'tune', 'Not', 'minor', 'accomplishment', 'Verdi', 'specialist', 'What', 'more', 'musical', 'wisdom', 'comp', 'Pavarotti', 'duets', 'not', 'attempt', 'upstage', 'Nobody', 'could', 'upstage', 'Pavarotti', 'music.Okay', ""'m"", 'almost', 'finished.Verdi', 'outdid', 'Rigoletto', 'music', 'iconic', 'Unforgettable', 'Rigoletto', 'one', 'warhorse', 'be', 'ridden', 'as', 'long', 'opera', 'houses', 'stand', 'opera', 'lovers', 'are', 'willing', 'spend', 'Afghani', 'life', 'wages', 'single', 'evening', 'box', 'seat']","Verdi - Rigoletto / Chailly, Pavarotti, Wixell, Gruberova, Vienna Philharmonic VHS"
491574,AWAFWHLQYKUKY,B0000042BZ,"Gonzalo Tello ""GtelloZ""","[2, 5]","I bought this dvd because, when i saw it for the first time (like 10 ten years ago) was the best sung version and the cast was superb. My favorites are the direction of Chailly (i find it great, dinamic and precise), the voice of Pavarotti (ONLY the voice, the acting sucks) especially singing my favorite aria ""possente amor mi chiama"", and giving a high D that i liked much. Now, i prefer the on-stage versions, so i don't like this DVD anymore. But i consider that this could be, in some way, a referencial version about what Rigoletto is musically...",4,"Great version, but i prefer the on-stage ones",1083283200,"04 30, 2004",2004,554,"['bought', 'dvd', 'when', 'i', 'saw', 'first', 'time', '10', 'ten', 'years', 'ago', 'was', 'best', 'sung', 'version', 'cast', 'was', 'superb', 'favorites', 'are', 'direction', 'Chailly', 'i', 'find', 'great', 'dinamic', 'precise', 'voice', 'Pavarotti', 'ONLY', 'voice', 'acting', 'sucks', 'especially', 'singing', 'favorite', 'aria', 'possente', 'amor', 'mi', 'chiama', 'giving', 'high', 'D', 'i', 'liked', 'much', 'Now', 'i', 'prefer', 'on-stage', 'versions', 'i', 'do', ""n't"", 'like', 'DVD', 'anymore', 'i', 'consider', 'could', 'be', 'way', 'referencial', 'version', 'what', 'Rigoletto', 'musically']","Verdi - Rigoletto / Chailly, Pavarotti, Wixell, Gruberova, Vienna Philharmonic VHS"
491575,A260HPXUTLD8VV,B0000042BZ,"""gsibbery""","[41, 41]","This is an excellent performance of Verdi's &quot;Rigoletto&quot; based  upon Vicor Hugo's &quot;L'Roi S'Amuse (The King Amuses Himself) and is one  of his finest operas. From start of finish this is a masterpiece. All the  singers are well-polished and highly convincing. Ingvar Wixell's portrayal  of the deformed court jester Rigoletto (renamed from Hugo's  &quot;Triboletto&quot;) in the court of Mantua was the best that I have  ever seen. Pavarotti, who plays the Duke himself, is in top form as always  (although such a pudgy Don Juan may seem slightly out-of-place, his acting  is superb), and Edita Gruberova does as astounding job as Gilda,  Rigoletto's daughter. The settings look genuine, the music is excellent and  Wixell truly manages to capture the pain and humiliation of a man forced  into being a fool by his deformities and social position. The history of  the opera makes for an interesting study in censorship as well. Hugo  himself preferred this opera to his own story that it was based on! The  quartet at the end is partuclalry memorable and the murderer was so scuzzy  and grungy looking that he was almost comical, although his deep bass was  beautiful. Finely acted, visually appealing and great music. What more  could one ask for?",5,Verdi's Adaptian of Hugo's Story,960249600,"06 6, 2000",2000,1261,"['excellent', 'performance', 'Verdi', 'quot', 'Rigoletto', 'quot', 'based', 'Vicor', 'Hugo', 'quot', ""L'Roi"", ""S'Amuse"", 'King', 'Amuses', 'Himself', 'one', 'finest', 'operas', 'start', 'finish', 'masterpiece', 'singers', 'are', 'well-polished', 'highly', 'convincing', 'Ingvar', 'Wixell', 'portrayal', 'deformed', 'court', 'jester', 'Rigoletto', 'renamed', 'Hugo', 'quot', 'Triboletto', 'quot', 'court', 'Mantua', 'was', 'best', 'have', 'ever', 'seen', 'Pavarotti', 'who', 'Duke', 'top', 'form', 'always', 'pudgy', 'Don', 'Juan', 'may', 'seem', 'slightly', 'out-of-place', 'acting', 'superb', 'Edita', 'Gruberova', 'astounding', 'job', 'Gilda', 'Rigoletto', 'daughter', 'settings', 'look', 'genuine', 'music', 'excellent', 'Wixell', 'truly', 'capture', 'pain', 'humiliation', 'man', 'forced', 'being', 'fool', 'deformities', 'social', 'position', 'history', 'opera', 'interesting', 'study', 'censorship', 'well', 'Hugo', 'preferred', 'opera', 'own', 'story', 'was', 'based', 'quartet', 'end', 'partuclalry', 'memorable', 'murderer', 'was', 'so', 'scuzzy', 'grungy', 'looking', 'was', 'almost', 'comical', 'deep', 'bass', 'was', 'beautiful', 'Finely', 'acted', 'visually', 'appealing', 'great', 'music', 'What', 'more', 'could', 'one', 'ask']","Verdi - Rigoletto / Chailly, Pavarotti, Wixell, Gruberova, Vienna Philharmonic VHS"
491576,A9C8GEBNAWOUV,B0000042BZ,J. MOLDOVAN,"[4, 5]","Opera is about music. Acting, staging, costumes et cetera add to the pleasure, but when all is said and done, the music is it. I bought this album just before my wife and I went to see an Australian Opera production, (wonderful, by the way), so that we could do our homework on the piece. I didn't particularly like all of the stagy, arty-farty special effects included on the DVD or the outlandish costumes or the primary school acting. But the music! Pavarotti is, as usual, fine as the Duke (I have a couple of other recordings by him in the role). But here, the others all compete with him on equal terms. Even the bit parts are sung with world class voices and memorable artistry. And if you want to hear what Rigoletto should sound like then Wixell is the one. Buy it and weep.",5,"It's music, music and music",1093046400,"08 21, 2004",2004,783,"['Opera', 'music', 'Acting', 'staging', 'costumes', 'et', 'cetera', 'add', 'pleasure', 'when', 'said', 'done', 'music', 'bought', 'album', 'just', 'wife', 'went', 'see', 'Australian', 'Opera', 'production', 'wonderful', 'way', 'so', 'could', 'do', 'homework', 'piece', 'did', ""n't"", 'particularly', 'stagy', 'arty-farty', 'special', 'effects', 'included', 'DVD', 'outlandish', 'costumes', 'primary', 'school', 'acting', 'music', 'Pavarotti', 'usual', 'fine', 'Duke', 'have', 'couple', 'other', 'recordings', 'role', 'here', 'others', 'compete', 'equal', 'terms', 'Even', 'bit', 'parts', 'are', 'sung', 'world', 'class', 'voices', 'memorable', 'artistry', 'want', 'hear', 'what', 'Rigoletto', 'should', 'sound', 'then', 'Wixell', 'one', 'Buy', 'weep']","Verdi - Rigoletto / Chailly, Pavarotti, Wixell, Gruberova, Vienna Philharmonic VHS"
