,reviewerID,asin,reviewerName,helpful,reviewText,overall,summary,unixReviewTime,reviewTime,reviewYear,reviewLength,meaningfulWords,Title
949529,A3STFVPM8NHJ7B,B000BTENYO,A. Pierre,"[1, 2]","I got this dvd sealed and new at a store for three bucks. Its basically the Smackdowns where the WWE entertains the troops for Christmas. Some good action and alot of bonus features about the tour. If you can get it at the price I paid, then its worth it. Over ten dollars and its not.",3,3 bucks,1196294400,"11 29, 2007",2007,285,"['got', 'dvd', 'sealed', 'new', 'store', 'three', 'bucks', 'basically', 'Smackdowns', 'where', 'WWE', 'troops', 'Christmas', 'good', 'action', 'alot', 'bonus', 'features', 'tour', 'can', 'get', 'price', 'paid', 'then', 'worth', 'ten', 'dollars', 'not']",Wwe: A Tribute to the Troops
949530,A3TZV5SXQ8F6ST,B000BTENYO,Best Of All,"[0, 0]","Any pro wrestling DVD is a snapshot of a particular moment in time, with a ""main event"" storyline possibly stale before the material reaches the stores. But these events chronicled on two DVD's are much more than the typical releases...or matches.The talent may appear in character, but they toss the soap opera-styled scripts aside for these special events, while reminding fans at home of the sacrifices from the men and women in the military. The matches are from the 2003 and 2004 tours, along with bonus material that includes tour highlights from the WWE program, Confidential.The performers include Undertaker, Hardcore Holly, Kurt Angle, Eddie Guerrero, John Cena and Big Show, along with several of the WWE Divas. The set is oftentimes difficult to find, but is one of the best releases in the bulky DVD catalog of the company.",5,They Are Not Forgotten,1231286400,"01 7, 2009",2009,836,"['pro', 'wrestling', 'DVD', 'snapshot', 'particular', 'moment', 'time', 'main', 'event', 'storyline', 'possibly', 'stale', 'material', 'stores', 'events', 'chronicled', 'two', 'DVD', 'are', 'much', 'more', 'typical', 'releases', 'matches.The', 'talent', 'may', 'appear', 'character', 'toss', 'soap', 'opera-styled', 'scripts', 'aside', 'special', 'events', 'reminding', 'fans', 'home', 'sacrifices', 'men', 'women', 'military', 'matches', 'are', '2003', '2004', 'tours', 'bonus', 'material', 'tour', 'highlights', 'WWE', 'program', 'Confidential.The', 'performers', 'include', 'Undertaker', 'Hardcore', 'Holly', 'Kurt', 'Angle', 'Eddie', 'Guerrero', 'John', 'Cena', 'Big', 'Show', 'several', 'WWE', 'Divas', 'set', 'oftentimes', 'difficult', 'find', 'one', 'best', 'releases', 'bulky', 'DVD', 'catalog', 'company']",Wwe: A Tribute to the Troops
949531,AZ2YLC0GWTAH2,B000BTENYO,D.P.,"[7, 7]","This is a rare WWE DVD because it was available in limited stores.  It's basically both SmackDown in Iraq episodes from 2003 & 2004 with each episodes being on each disc.  Each show has matches & coming from Iraq along with the troops shouting out family & friends at home and footage of WWE wrestlers visiting the troops and various sites in Iraq.  Disc one is the SmackDown from Iraq in '03 with APA vs. Hass & Benjamin, Rikishi vs. Rhyno, Eddie Guerrero vs. Chris Benoit, John Cena vs. Big Show and special appearances by Mr. McMahon, Stone Cold, Sable, Dawn Marie, and Torrie Wilson.  Disc Two is the recent one they did last year with Booker T vs. Rene Dupri, Undertaker vs. Heindenrich, Hardcore Holly vs. Kenzo Suzuki, Rey Mysterio & Eddie Guerrero vs. Kurt Angle & Luther Reigns with special appearances from Mr. McMahon, Mick Foley, JBL, Big Show, Dawn Marie, Ms. Jackie, and Torrie Wilson.DVD extras include 15 Confidential pieces featuring wrestlers visiting military sites & hospitals, Kurt Angle's speech on freedom from SmackDown, and never before aired footage of Eddie Guerrero thanking the crowd after his match and Stone Cold tossing out beers to troops in the audience after the show.  Hidden extras include Ms. Jackie ""assisting"" a soldier doing his pushups and the divas doing a final strip down with Stone Cold before leaving the arena.Only get it if you liked the SmackDown in Iraq episodes.",3,Respectable Tribute To Troops,1148688000,"05 27, 2006",2006,1414,"['rare', 'WWE', 'DVD', 'was', 'available', 'limited', 'stores', 'basically', 'SmackDown', 'Iraq', 'episodes', '2003', '2004', 'episodes', 'being', 'disc', 'show', 'matches', 'coming', 'Iraq', 'troops', 'shouting', 'out', 'family', 'friends', 'home', 'footage', 'WWE', 'wrestlers', 'visiting', 'troops', 'various', 'sites', 'Iraq', 'Disc', 'one', 'SmackDown', 'Iraq', ""'03"", 'APA', 'vs.', 'Hass', 'Benjamin', 'Rikishi', 'vs.', 'Rhyno', 'Eddie', 'Guerrero', 'Chris', 'Benoit', 'John', 'Cena', 'vs.', 'Big', 'Show', 'special', 'appearances', 'Mr.', 'McMahon', 'Stone', 'Cold', 'Sable', 'Dawn', 'Marie', 'Torrie', 'Wilson', 'Disc', 'Two', 'recent', 'one', 'did', 'last', 'year', 'Booker', 'T', 'vs.', 'Rene', 'Dupri', 'Undertaker', 'vs.', 'Heindenrich', 'Hardcore', 'Holly', 'vs.', 'Kenzo', 'Suzuki', 'Rey', 'Mysterio', 'Eddie', 'Guerrero', 'vs.', 'Kurt', 'Angle', 'Luther', 'Reigns', 'special', 'appearances', 'Mr.', 'McMahon', 'Mick', 'Foley', 'JBL', 'Big', 'Show', 'Dawn', 'Marie', 'Ms.', 'Jackie', 'Torrie', 'Wilson.DVD', 'extras', 'include', '15', 'Confidential', 'pieces', 'featuring', 'wrestlers', 'visiting', 'military', 'sites', 'hospitals', 'Kurt', 'Angle', 'speech', 'freedom', 'SmackDown', 'never', 'before', 'aired', 'footage', 'Eddie', 'Guerrero', 'thanking', 'crowd', 'match', 'Stone', 'Cold', 'tossing', 'out', 'beers', 'troops', 'audience', 'show', 'Hidden', 'extras', 'include', 'Ms.', 'Jackie', 'assisting', 'soldier', 'doing', 'pushups', 'divas', 'doing', 'final', 'strip', 'down', 'Stone', 'Cold', 'leaving', 'arena.Only', 'get', 'liked', 'SmackDown', 'Iraq', 'episodes']",Wwe: A Tribute to the Troops
949532,A2ZB8B7VQONZA6,B000BTENYO,"fmwaalex ""fmwaalex""","[1, 1]","WWETRIBUTE TO THE TROOPS{I felt the need to review this and feel all patriotic because one of my friends just came back [here's to you Jose] and one just left [Mason], so to them and the rest of our Armed Forces I thank you guys}First off I must say that I could care less if you agree with me or not any thing that supports the troops is a 5 star worthy thing, so the DVD is 5 stars as is every match because this was not for us this was for them. Whether you support or hate this or the previous administration in the White House the one constant should be the unwavering support for the people who put their lives on the line daily for us. Another thing is I hate that every news channel out there has never really covered what the WWE does every year for the troops. Vince and company every year go over seas to put on these shows for them and the media never mentions a thing. Also all the wrestlers and WWE crew that go over there for these events are volunteers, so I thank all of them for doing this for them. I have fam and friends over there and one of my best friends in the service was actually at one of these shows [not on this set but one of the following ones] so I know the troops really do appreciate this. Of course it starts off with Vince thanking the troops for all that they do only to be stunned by Santa I mean Stone Cold. There is also a rap from John Cena, a Santa's little helper segment and much more but it is the segments with the troops getting to know them that is the best about this set.1.WORLD'S GREATEST TAG TEAM VS APA-really fun match right here that the troops seemed to really enjoy. I could care less what people say about JBL but that guy helped set all these tributes to the troops up so he gets crazy amounts of respect from me. The match is great as APA really destroy these two and take home the win for the troops.5/52.RIKISHI VS RHYNO-another really fun match that the troops are all about and it gets right down to business with the baby face winning and then delivering a stink face. Of course it would not be a tribute with out some of our brave women in the armed forces dancing with the Kish. Great moment and makes me smile every time I watch it.5/53.EDDIE GUERRERO VS CHRIS BENOIT-one of the best matches from the entire set as if you did not know that. These two put on one of the best matches for the troops going back and forth and hitting some high spots. Each hitting their moves they are known for trying to end the other. Eddie gets the win on this one with his classic lie/cheat/steal ways, the show continues afterwards for the troops with a nice USA chant.5/54.BIG SHOW VS JOHN CENA-as mentioned earlier when Cena was rapping for the troops he went at it with the Big Show. The contest is dominated for the most part by Show but of course Cena pulls out the win for the troops. But his celebration is short due to Stone Cold laying him flat along side The Big Show. A great match to end the show with.5/5DISC 2This is the following year's event over seas for the troops and of course it is great as well. We get Vince of course at the beginning as well as Santa again this time played by Mick Foley. There is also a lot more great moments but like the last time the best moments come from the solders them selves.1.RENE DUPREE VS BOOKER T-the first match of the evening was great as these two go at it for the crowd. Dupree is the classic villain in this one and of course looks as if he will win it. But the baby face Booker T pulls out the victory to the applause of the troops.5/52.UNDERTAKER VS HEIDENREICH-great match right here that took place during their feud at the time. The match is actually back and forth more than I thought it would be only to end in a count out. Taker starts to take it to him and he tries to escape only for the troops to keep him from leaving.5/53.HARDCORE HOLLY VS KENZO SUZUKI-another wonderful match for the troops to enjoy as these two underrated talents went at it. It is a great back and forth battle but in the end Holly pulls out the victory. I don't care what others say I have always liked Holly and he is actually one of my favorites.5/54.REY MYSTERIO, EDDIE GUERRERO VS KURT ANGLE, LUTHER REIGNS-the main event from this one is a great contest between these great athletes. The battle they put on is great and the ""good guys"" hit some great high spots for the crowd. The match is great and ends with Rey and Eddie taking the victory followed by Eddie thanking the troops.5/5This disc is full of bonus features that showcase the trips over there and every thing. I recommend buying this and adding it to your collection. I can't commend Vince and company enough for doing this every year for the men and women that represent this country. So as I am 30 minutes away from the largest military base here in the states Fort Hood in Killeen Texas I say thank you to all of the troops.",5,HOW CAN A TRIBUTE LIKE THIS BE ANYTHING BUT 5 STARS,1248912000,"07 30, 2009",2009,4891,"['WWETRIBUTE', 'TO', 'THE', 'TROOPS', 'felt', 'need', 'review', 'feel', 'patriotic', 'one', 'friends', 'just', 'came', 'back', '[', 'here', 'Jose', ']', 'one', 'just', 'left', '[', 'Mason', ']', 'so', 'rest', 'Armed', 'Forces', 'thank', 'guys', 'First', 'must', 'say', 'could', 'care', 'less', 'agree', 'not', 'thing', 'troops', '5', 'star', 'worthy', 'thing', 'DVD', '5', 'stars', 'match', 'was', 'not', 'was', 'support', 'hate', 'previous', 'administration', 'White', 'House', 'one', 'constant', 'should', 'be', 'unwavering', 'support', 'people', 'who', 'put', 'lives', 'line', 'daily', 'thing', 'hate', 'news', 'channel', 'there', 'never', 'really', 'covered', 'what', 'WWE', 'year', 'troops', 'Vince', 'company', 'year', 'go', 'seas', 'put', 'shows', 'media', 'never', 'mentions', 'thing', 'Also', 'wrestlers', 'WWE', 'crew', 'go', 'there', 'events', 'are', 'volunteers', 'thank', 'doing', 'have', 'fam', 'one', 'best', 'friends', 'service', 'was', 'actually', 'one', 'shows', '[', 'not', 'set', 'one', 'following', 'ones', ']', 'so', 'know', 'troops', 'really', 'do', 'appreciate', 'course', 'Vince', 'thanking', 'troops', 'do', 'only', 'be', 'stunned', 'Santa', 'mean', 'Stone', 'Cold', 'also', 'rap', 'John', 'Cena', 'Santa', 'little', 'helper', 'segment', 'much', 'more', 'segments', 'troops', 'getting', 'know', 'best', 'set.1.WORLD', 'GREATEST', 'TAG', 'TEAM', 'VS', 'APA-really', 'fun', 'match', 'right', 'here', 'troops', 'seemed', 'really', 'enjoy', 'could', 'care', 'less', 'what', 'people', 'say', 'JBL', 'guy', 'helped', 'set', 'tributes', 'troops', 'up', 'so', 'crazy', 'amounts', 'respect', 'match', 'great', 'APA', 'really', 'two', 'take', 'home', 'win', 'troops.5/52.RIKISHI', 'VS', 'RHYNO-another', 'really', 'match', 'troops', 'are', 'right', 'down', 'business', 'baby', 'face', 'winning', 'then', 'delivering', 'stink', 'face', 'course', 'would', 'not', 'be', 'tribute', 'out', 'brave', 'women', 'armed', 'forces', 'dancing', 'Kish', 'Great', 'moment', 'smile', 'time', 'watch', 'it.5/53.EDDIE', 'GUERRERO', 'VS', 'CHRIS', 'BENOIT-one', 'best', 'matches', 'entire', 'set', 'did', 'not', 'know', 'two', 'put', 'one', 'best', 'matches', 'troops', 'going', 'back', 'forth', 'hitting', 'high', 'spots', 'hitting', 'moves', 'are', 'known', 'trying', 'end', 'other', 'Eddie', 'win', 'one', 'classic', 'lie/cheat/steal', 'ways', 'show', 'afterwards', 'troops', 'nice', 'USA', 'chant.5/54.BIG', 'SHOW', 'VS', 'JOHN', 'CENA-as', 'mentioned', 'earlier', 'when', 'Cena', 'was', 'rapping', 'troops', 'went', 'Big', 'Show', 'contest', 'dominated', 'most', 'part', 'Show', 'course', 'Cena', 'out', 'win', 'troops', 'celebration', 'short', 'due', 'Stone', 'Cold', 'laying', 'flat', 'Big', 'Show', 'A', 'great', 'match', 'end', 'show', '2This', 'following', 'year', 'event', 'seas', 'troops', 'course', 'great', 'as', 'well', 'get', 'Vince', 'course', 'beginning', 'as', 'well', 'Santa', 'again', 'time', 'played', 'Mick', 'Foley', 'also', 'lot', 'more', 'great', 'moments', 'last', 'time', 'best', 'moments', 'come', 'solders', 'selves.1.RENE', 'DUPREE', 'VS', 'BOOKER', 'T-the', 'first', 'match', 'evening', 'was', 'great', 'two', 'go', 'crowd', 'Dupree', 'classic', 'villain', 'one', 'course', 'looks', 'will', 'win', 'baby', 'face', 'Booker', 'T', 'out', 'victory', 'applause', 'troops.5/52.UNDERTAKER', 'VS', 'HEIDENREICH-great', 'match', 'right', 'here', 'took', 'place', 'feud', 'time', 'match', 'actually', 'back', 'forth', 'more', 'thought', 'would', 'be', 'only', 'end', 'count', 'out', 'Taker', 'take', 'escape', 'only', 'troops', 'keep', 'leaving.5/53.HARDCORE', 'HOLLY', 'VS', 'KENZO', 'SUZUKI-another', 'wonderful', 'match', 'troops', 'enjoy', 'two', 'underrated', 'talents', 'went', 'great', 'back', 'forth', 'battle', 'end', 'Holly', 'out', 'victory', 'do', ""n't"", 'care', 'what', 'others', 'say', 'have', 'always', 'liked', 'Holly', 'actually', 'one', 'favorites.5/54.REY', 'MYSTERIO', 'EDDIE', 'GUERRERO', 'VS', 'KURT', 'ANGLE', 'LUTHER', 'REIGNS-the', 'main', 'event', 'one', 'great', 'contest', 'great', 'athletes', 'battle', 'put', 'great', 'good', 'guys', 'hit', 'great', 'high', 'spots', 'crowd', 'match', 'great', 'Rey', 'Eddie', 'taking', 'victory', 'followed', 'Eddie', 'thanking', 'troops.5/5This', 'disc', 'full', 'bonus', 'features', 'showcase', 'trips', 'there', 'thing', 'recommend', 'buying', 'adding', 'collection', 'ca', ""n't"", 'commend', 'Vince', 'company', 'enough', 'doing', 'year', 'men', 'women', 'represent', 'country', 'am', '30', 'minutes', 'away', 'largest', 'military', 'base', 'here', 'states', 'Fort', 'Hood', 'Killeen', 'Texas', 'say', 'thank', 'troops']",Wwe: A Tribute to the Troops
949533,APYACU81EWE0Q,B000BTENYO,gannclev,"[1, 1]",Bought this for my grandson and he was so happy to receive it. He watches it for hours. Thank you so much. Would buy from this seller again.,5,good,1318809600,"10 17, 2011",2011,140,"['Bought', 'grandson', 'was', 'so', 'happy', 'receive', 'hours', 'Thank', 'so', 'much', 'Would', 'buy', 'seller', 'again']",Wwe: A Tribute to the Troops
949534,A2JA59SICVG83V,B000BTENYO,"Mr. Big ""Mr. Big""","[0, 1]","This something that should be done by more American companys. The WWE did somthing that needed to be done for our troops in the war zone, Bob Hope was the man that made life better for our troops and I guess WWE filled that void, it's too bad this was the only war zone they went to because with 2 fronts it need to be done every month till the troops come home. If you love this country, then you will love this dvd. God bless America...",5,God Bless our Troops,1277424000,"06 25, 2010",2010,438,"['something', 'should', 'be', 'done', 'more', 'American', 'companys', 'WWE', 'did', 'somthing', 'needed', 'be', 'done', 'troops', 'war', 'zone', 'Bob', 'Hope', 'was', 'man', 'made', 'life', 'better', 'troops', 'guess', 'WWE', 'filled', 'void', 'too', 'bad', 'was', 'only', 'war', 'zone', 'went', '2', 'fronts', 'need', 'be', 'done', 'month', 'troops', 'come', 'home', 'love', 'country', 'then', 'will', 'love', 'dvd', 'God', 'bless', 'America']",Wwe: A Tribute to the Troops
