,reviewerID,asin,reviewerName,helpful,reviewText,overall,summary,unixReviewTime,reviewTime,reviewYear,reviewLength,meaningfulWords,Title
1070535,A103VMN9OENIN6,B000PFU85M,"2far@prodigy.net ""2far@prodigy.net""","[0, 0]",Excellent movie.  Great for my disaster collection,5,Disaster awesome,1404950400,"07 10, 2014",2014,50,"['Excellent', 'movie', 'Great', 'disaster', 'collection']",Earthstorm
1070536,ASM9TBTLFO7Y0,B000PFU85M,Ahmed Daoud,"[0, 0]","Honestly, I only bought this one to see how Dirk Benedict evolved after The A-Team. Altough many reviewers criticize the acting and special effects - and not without reason - this is a good movie, considering the low budget.It has everything a disastermovie should have, disaster and panic, half-thought plans and a hero without a cause. The public reaction to the moon's shifting orbit could have been brought up better, we only see scietist in labs.Forget about the factual errors, the outcoming of the plot is very good. It has a constant question whether the solutions will work. That keeps the movie exciting for the whole 90 minutes.Another remark for the theme music: absolutely great!! It is a very catchy theme. I am going to watch it again tonight.",4,Not bad if you ask me,1221782400,"09 19, 2008",2008,758,"['Honestly', 'only', 'bought', 'one', 'see', 'how', 'Dirk', 'Benedict', 'evolved', 'A-Team', 'Altough', 'many', 'reviewers', 'criticize', 'acting', 'special', 'effects', 'not', 'reason', 'good', 'movie', 'considering', 'low', 'budget.It', 'everything', 'disastermovie', 'should', 'have', 'disaster', 'panic', 'half-thought', 'plans', 'hero', 'cause', 'public', 'reaction', 'moon', 'shifting', 'orbit', 'could', 'have', 'been', 'brought', 'up', 'better', 'only', 'see', 'scietist', 'labs.Forget', 'factual', 'errors', 'outcoming', 'plot', 'very', 'good', 'constant', 'question', 'solutions', 'will', 'work', 'movie', 'exciting', 'whole', '90', 'minutes.Another', 'remark', 'theme', 'music', 'absolutely', 'great', 'very', 'catchy', 'theme', 'am', 'going', 'watch', 'again', 'tonight']",Earthstorm
1070537,A1G0VFQ9198IUF,B000PFU85M,al,"[0, 0]",this movie i like it is about there is a disaster on the moon and they use a bomb to try to form the moon back together with the moons gravity,5,atomic,1378512000,"09 7, 2013",2013,142,"['movie', 'disaster', 'moon', 'use', 'bomb', 'try', 'form', 'moon', 'back', 'together', 'moons', 'gravity']",Earthstorm
1070538,A2J9W035FJGAFW,B000PFU85M,"Amazon Customer ""Liz""","[0, 0]","I have seen this made for TV movie many times.  Although it is your very typical &#34;Earth about to be destroyed&#34; disaster movie, it is fun anyway.  Similar story to Armageddon, where a non-astronaut hero must journey in a spaceship to save the world.  Stephen Baldwin's performance adds some dimension to the film.  Not a big budget movie, but I love it anyway.",5,"Typical ""Earth about to be destroyed"" disaster movie",1385164800,"11 23, 2013",2013,367,"['have', 'seen', 'made', 'TV', 'movie', 'many', 'times', 'very', 'typical', '34', 'Earth', 'be', 'destroyed', '34', 'disaster', 'movie', 'fun', 'anyway', 'Similar', 'story', 'Armageddon', 'where', 'non-astronaut', 'hero', 'must', 'journey', 'spaceship', 'save', 'world', 'Stephen', 'Baldwin', 'performance', 'dimension', 'film', 'Not', 'big', 'budget', 'movie', 'love', 'anyway']",Earthstorm
1070539,A2RBMAMJGVOIGT,B000PFU85M,"anim8rfsk ""anim8rfsk""","[91, 97]","Disclaimer: They didn't actually call it NASA. It was the ASA or something. But we know who they meant!!EARTHSTORM is an Armageddon 'homage' starring one of the lesser Baldwins. Not Billy I don't think. That doesn't narrow it down one darn bit, does it?Giant uncharted asteroid hits the far side of the moon. Apparently just hours later debris starts whacking into us (you'd think it would be headed AWAY from us. I'd also think it would take a while to get here. I'd also think that if it did get here like a Domino's Pizza, in 30 minutes or less, the story would end right there. But go figure). NASA covers up the fact that meteors are hitting us and wiping out cities and that there's a crack in the moon and a huge halo of Giant Space Rice Krispie debris you can see from Earth but many people figure it out by hearing rumors.Demolition guy Baldwin as Bruce Willis is blowing up a building. As they're about to push the button, everybody wearing heavy clothes and helmets and flack jackets except the extremely hot female assistant who's in shorts, suddenly the 9th floor blows up. This causes the entire system of explosives to become 'unbalanced' and wackiness ensues. Since they can't stop the countdown, Bruce Baldwin runs up to the 9th floor (with a pack of DYNAMITE!), finds pillar 8A which is what blew up (and is totally unscathed), sticks a new pack of explosives on it (completely fixing the problem, except the problem is in no way fixed), finds the homeless guy who set off the explosives (and who is also completely unscathed) and races out of the building with seconds to spare. They head off to their next job in Baltimore, which is almost immediately hit by Giant Space Rice Krispie meteorite debris.Meanwhile some red headed scientist portrayed by a woman who's acting training came from doing makeovers in the local mall, and who is expending all of her 'talent' trying to hide her accent, realizes her father predicted this exactly, but was driven out of the business and to his death by evil government scientist Dirk Benedict. NASA calls her in because nobody will listen to her.I'm not really sure what happened to the moon. At various points in the story it's shifted it's orbit, the crap is coming from the asteroid, the crap is coming from the moon, there's a rift a 100 times the size of the grand canyon in the moon and the crap is spewing out of THAT, and anything that leaves the far side of the moon for whatever reason whacks us about a half an hour later.Part of this is explained when cute shorts demo girl finds a hunk of the moon (after dodging into a canvas tent to avoid a major Giant Space Rice Krispie meteorite impact about 50 feet away) just laying there in Baltimore, a big hunk clearly made out of foam that nobody handles like it weighs more than an empty coffee cup, and it turns out we were wrong about what the moon was made of all along -- it's hitting us so hard because it's composed of uranium.  In the form of Giant Space Rice Krispies.NASA decides the only way to stop the moon from bombarding us (at this point Mexico City is suddenly destroyed, but nobody mentions it again) is to fly up to the moon and set off nukes and seal the fissure. Of course, Baldwin must go with them, for only he can push the button.Red decides that since the moon is all magnetic and everything, we should use a special magnetic bomb that no one has ever built instead. Of course, Baldwin must go with them, for only he can push the button. Of a bomb he's never heard of the theory behind or seen, as it doesn't exist.Starbuck vetoes the plan. Through the entire movie he walks in whenever they're planning something; nobody at NASA *ever* closes a door.They take off in a space shuttle, which despite the nukes being the size of a couple of suitcases, only holds 3 people; cute female pilot, random astronaut, Bruce Baldwin. Random astronaut is immediately knocked out for the duration of the flight. Shuttle has gravity, and a continuous floor between the flight deck and the cargo bay, almost as though it was a left over set from a high school stage play.Shuttle lifts off, jettisons its SRBs and liquid fuel tanks together, and, with main engines still roaring, flies to the moon, dodging and weaving incoming Giant Space Rice Krispie rocks, accelerating the whole way. Granted, they have auxiliary strap on nuclear engines that no one had ever built or tried before as well.They get to the moon, fly down to the surface (while this shuttle has internal gravity, external gravity doesn't affect it at all) and sort of hover.Cute shorts demo chick shows up at NASA with the very light rock. Analysis indicates it's uranium, which means Starbuck was wrong, and they should have sent the magnetic bomb instead of the nukes. The Earth is doomed.NASA brainstorms and figures out how to take unused parts from the shuttle's communication systems to turn the nukes into a magbomb. Bruce Baldwin does this while cute pilot hovers.Starbuck realizes red haired scientist did all the math wrong, and they need 100 times more bomb. The Earth is doomed.Starbuck saves the day by realizing they happen to have auxiliary nuke engines strapped to the outside of the shuttle, that Bruce Baldwin can get to, somehow.Baldwin realizes the new charge needs to be set off in a new location. The new location? THE CENTER OF THE MOON! Yes, they need to fly the shuttle to . . . THE CORE!!!!!Luckily, the fissure goes all the way to the center of the moon. They fly down, dump the bomb, eject their engines, and, main engines still blasting away, race for the surface as the mag bomb goes off, the fissure sucks itself shut, the moon ""heals itself"" and returns to it's proper orbit, and all the incoming Giant Space Rice Krispie stuff that was about to destroy the Earth is just . . forgotten about. Cute pilot, engines STILL GOING FULL THROTTLE, despite the fact that she left the fuel tank back on Earth and the strap on engines in the moon, races back as unhurt extra astronaut comes to. BTW, all this apparently happened in about half an hour, as cute shorts girl hasn't even gone to the ladies' room to wipe the soot off her pert little nose yet.Back on Earth, everybody loves everybody, Starbuck is forgiven, Red's dad is vindicated, Red goes back to work for NASA, Red and Bruce Baldwin pair off, Red's assistant who didn't have enough of a part to matter and was in love with her scores with cute shorts girl, mostly 'cause there wasn't anybody else with enough lines to pair her with except Starbuck who stoically rode back to Washington, and the weather is all fine, and nobody cares that Mexico City is gone.The End.",2,Earth VS the Giant Space Rice Krispies!,1184025600,"07 10, 2007",2007,6645,"['Disclaimer', 'did', ""n't"", 'actually', 'call', 'NASA', 'was', 'ASA', 'something', 'know', 'who', 'meant', 'EARTHSTORM', 'Armageddon', ""'homage"", 'starring', 'one', 'lesser', 'Baldwins', 'Not', 'Billy', 'do', ""n't"", 'think', ""n't"", 'narrow', 'down', 'one', 'darn', 'bit', 'Giant', 'uncharted', 'asteroid', 'hits', 'far', 'side', 'moon', 'Apparently', 'just', 'hours', 'later', 'debris', 'starts', 'whacking', ""'d"", 'think', 'would', 'be', 'headed', 'AWAY', ""'d"", 'also', 'think', 'would', 'take', 'while', 'get', 'here', ""'d"", 'also', 'think', 'did', 'get', 'here', 'Domino', 'Pizza', '30', 'minutes', 'less', 'story', 'would', 'end', 'right', 'there', 'go', 'figure', 'up', 'fact', 'meteors', 'are', 'hitting', 'wiping', 'out', 'cities', 'crack', 'moon', 'huge', 'halo', 'Giant', 'Space', 'Rice', 'Krispie', 'can', 'see', 'Earth', 'many', 'people', 'figure', 'out', 'hearing', 'rumors.Demolition', 'guy', 'Baldwin', 'Bruce', 'Willis', 'blowing', 'up', 'building', ""'re"", 'push', 'button', 'everybody', 'wearing', 'heavy', 'clothes', 'helmets', 'flack', 'jackets', 'extremely', 'hot', 'female', 'assistant', 'who', 'shorts', 'suddenly', '9th', 'floor', 'up', 'entire', 'system', 'explosives', 'become', ""'unbalanced"", 'wackiness', 'ensues', 'ca', ""n't"", 'stop', 'countdown', 'Bruce', 'Baldwin', '9th', 'floor', 'pack', 'DYNAMITE', 'pillar', '8A', 'what', 'blew', 'up', 'totally', 'unscathed', 'new', 'pack', 'explosives', 'completely', 'fixing', 'problem', 'problem', 'way', 'fixed', 'homeless', 'guy', 'who', 'set', 'off', 'explosives', 'who', 'also', 'completely', 'unscathed', 'building', 'seconds', 'spare', 'head', 'next', 'job', 'Baltimore', 'almost', 'immediately', 'hit', 'Giant', 'Space', 'Rice', 'Krispie', 'meteorite', 'red', 'headed', 'scientist', 'portrayed', 'woman', 'who', 'acting', 'training', 'came', 'doing', 'makeovers', 'local', 'mall', 'who', 'expending', ""'talent"", 'trying', 'hide', 'accent', 'father', 'predicted', 'exactly', 'was', 'driven', 'business', 'death', 'evil', 'government', 'scientist', 'Dirk', 'Benedict', 'NASA', 'nobody', 'will', 'listen', 'her.I', ""'m"", 'not', 'really', 'sure', 'what', 'happened', 'moon', 'various', 'points', 'story', 'shifted', 'orbit', 'crap', 'coming', 'asteroid', 'crap', 'coming', 'moon', 'rift', '100', 'times', 'size', 'grand', 'canyon', 'moon', 'crap', 'spewing', 'THAT', 'anything', 'far', 'side', 'moon', 'reason', 'whacks', 'half', 'hour', 'later.Part', 'explained', 'when', 'cute', 'shorts', 'demo', 'girl', 'hunk', 'moon', 'dodging', 'canvas', 'tent', 'avoid', 'major', 'Giant', 'Space', 'Rice', 'Krispie', 'meteorite', 'impact', '50', 'feet', 'away', 'just', 'laying', 'there', 'Baltimore', 'big', 'hunk', 'clearly', 'made', 'foam', 'nobody', 'more', 'empty', 'coffee', 'cup', 'out', 'were', 'wrong', 'what', 'moon', 'was', 'made', 'along', 'hitting', 'so', 'hard', 'composed', 'uranium', 'form', 'Giant', 'Space', 'Rice', 'Krispies.NASA', 'only', 'way', 'stop', 'moon', 'bombarding', 'point', 'Mexico', 'City', 'suddenly', 'destroyed', 'nobody', 'mentions', 'again', 'fly', 'up', 'moon', 'set', 'off', 'nukes', 'seal', 'fissure', 'course', 'Baldwin', 'must', 'go', 'only', 'can', 'push', 'button.Red', 'moon', 'magnetic', 'everything', 'should', 'use', 'special', 'magnetic', 'bomb', 'one', 'ever', 'built', 'instead', 'course', 'Baldwin', 'must', 'go', 'only', 'can', 'push', 'button', 'bomb', 'never', 'heard', 'theory', 'seen', ""n't"", 'exist.Starbuck', 'vetoes', 'plan', 'entire', 'movie', 'whenever', ""'re"", 'planning', 'something', 'nobody', 'NASA', '*ever*', 'door.They', 'take', 'off', 'space', 'shuttle', 'nukes', 'being', 'size', 'couple', 'suitcases', 'only', '3', 'people', 'cute', 'female', 'pilot', 'random', 'astronaut', 'Bruce', 'Baldwin', 'Random', 'astronaut', 'immediately', 'knocked', 'out', 'duration', 'flight', 'Shuttle', 'gravity', 'continuous', 'floor', 'flight', 'deck', 'cargo', 'bay', 'almost', 'was', 'left', 'over', 'set', 'high', 'school', 'stage', 'play.Shuttle', 'lifts', 'off', 'jettisons', 'SRBs', 'liquid', 'fuel', 'tanks', 'together', 'main', 'engines', 'still', 'roaring', 'flies', 'moon', 'dodging', 'weaving', 'incoming', 'Giant', 'Space', 'Rice', 'Krispie', 'rocks', 'accelerating', 'whole', 'way', 'Granted', 'have', 'auxiliary', 'strap', 'nuclear', 'engines', 'one', 'had', 'ever', 'built', 'tried', 'well.They', 'get', 'moon', 'fly', 'down', 'surface', 'shuttle', 'internal', 'gravity', 'external', 'gravity', ""n't"", 'affect', 'sort', 'hover.Cute', 'shorts', 'demo', 'chick', 'up', 'NASA', 'very', 'light', 'rock', 'Analysis', 'uranium', 'Starbuck', 'was', 'wrong', 'should', 'have', 'sent', 'magnetic', 'bomb', 'instead', 'nukes', 'Earth', 'doomed.NASA', 'brainstorms', 'figures', 'out', 'how', 'take', 'unused', 'parts', 'shuttle', 'communication', 'systems', 'turn', 'nukes', 'magbomb', 'Bruce', 'Baldwin', 'cute', 'pilot', 'hovers.Starbuck', 'red', 'haired', 'scientist', 'did', 'math', 'wrong', 'need', '100', 'times', 'more', 'bomb', 'Earth', 'doomed.Starbuck', 'saves', 'day', 'realizing', 'happen', 'have', 'auxiliary', 'nuke', 'engines', 'strapped', 'outside', 'shuttle', 'Bruce', 'Baldwin', 'can', 'get', 'somehow.Baldwin', 'new', 'charge', 'needs', 'be', 'set', 'off', 'new', 'location', 'new', 'location', 'THE', 'CENTER', 'THE', 'MOON', 'Yes', 'need', 'fly', 'shuttle', 'CORE', 'Luckily', 'fissure', 'way', 'center', 'moon', 'fly', 'down', 'dump', 'bomb', 'eject', 'engines', 'main', 'engines', 'still', 'blasting', 'away', 'race', 'surface', 'mag', 'bomb', 'off', 'fissure', 'shut', 'moon', 'heals', 'proper', 'orbit', 'incoming', 'Giant', 'Space', 'Rice', 'Krispie', 'stuff', 'was', 'destroy', 'Earth', 'just', 'forgotten', 'Cute', 'pilot', 'engines', 'STILL', 'GOING', 'FULL', 'THROTTLE', 'fact', 'left', 'fuel', 'tank', 'back', 'Earth', 'strap', 'engines', 'moon', 'back', 'unhurt', 'extra', 'astronaut', 'BTW', 'apparently', 'happened', 'about', 'hour', 'cute', 'shorts', 'girl', ""n't"", 'even', 'gone', 'ladies', 'room', 'wipe', 'soot', 'pert', 'little', 'nose', 'yet.Back', 'Earth', 'everybody', 'everybody', 'Starbuck', 'forgiven', 'Red', 'dad', 'vindicated', 'Red', 'back', 'work', 'NASA', 'Red', 'Bruce', 'Baldwin', 'pair', 'Red', 'assistant', 'who', 'did', ""n't"", 'have', 'enough', 'part', 'matter', 'was', 'love', 'scores', 'cute', 'shorts', 'girl', 'mostly', 'was', ""n't"", 'anybody', 'else', 'enough', 'lines', 'pair', 'except', 'Starbuck', 'who', 'stoically', 'rode', 'back', 'Washington', 'weather', 'fine', 'nobody', 'cares', 'Mexico', 'City', 'gone.The', 'End']",Earthstorm
1070540,A20EEWWSFMZ1PN,B000PFU85M,"bernie ""xyzzy""","[4, 5]","This movie has all the standard characters and clich&eacute;s.Most rogue comets head straight for earth in all good disaster movies. Well surprise, this animal decided to hit something else.We have the misunderstood and of course disbelieved scientist.We have the immobile and disastrous decision-making government representative.We have the structural explosives expert who does not realize his potential until he is challenged.We have the up and coming assistant who waffles under pressure, and several other standard disaster movie characters.They all do the standard things and have the standard conversations.There is a tad of originality in the quantity and timing of overlapping miscalculations and unforeseen complications.If you have spare time and nothing better to do this presentation is at least not purposely campy.Meteor",3,Formula disaster TV movie,1206230400,"03 23, 2008",2008,835,"['movie', 'standard', 'characters', 'clich', 'eacute', 'rogue', 'comets', 'head', 'straight', 'earth', 'good', 'disaster', 'movies', 'Well', 'surprise', 'animal', 'decided', 'hit', 'something', 'else.We', 'have', 'misunderstood', 'course', 'disbelieved', 'scientist.We', 'have', 'immobile', 'disastrous', 'decision-making', 'government', 'representative.We', 'have', 'structural', 'explosives', 'expert', 'who', 'not', 'realize', 'potential', 'challenged.We', 'have', 'up', 'coming', 'assistant', 'who', 'pressure', 'several', 'other', 'standard', 'disaster', 'movie', 'characters.They', 'do', 'standard', 'things', 'have', 'standard', 'conversations.There', 'tad', 'originality', 'quantity', 'timing', 'overlapping', 'miscalculations', 'unforeseen', 'complications.If', 'have', 'spare', 'time', 'nothing', 'better', 'do', 'presentation', 'least', 'not', 'purposely', 'campy.Meteor']",Earthstorm
