,reviewerID,asin,reviewerName,helpful,reviewText,overall,summary,unixReviewTime,reviewTime,reviewYear,reviewLength,meaningfulWords,Title
491577,A3OEM08DK4ICIO,B0000042BZ,Joseph Falotico,"[6, 10]","I purchased this Rigoletto because most of the Amazon reviewers liked it. While I watched it, I was aware of the fine singing, but I was also aware that I was not getting involved. The reason was because, to me, the director, Jean-Pierre Ponnelle's, hand was obvious. All the action was noticeably staged, giving the performance an air of artificiality. Why he had Rigoletto suspended in midair while moaning the abduction of his daughter, Gilda, to close the second act was jarringly ridiculous. The 3 stars are for the excellent singing",3,Disappointing,1231804800,"01 13, 2009",2009,538,"['purchased', 'Rigoletto', 'most', 'Amazon', 'reviewers', 'liked', 'watched', 'was', 'aware', 'fine', 'singing', 'was', 'also', 'aware', 'was', 'not', 'getting', 'involved', 'reason', 'was', 'because', 'director', 'Jean-Pierre', 'Ponnelle', 'hand', 'was', 'obvious', 'action', 'was', 'noticeably', 'staged', 'giving', 'performance', 'air', 'artificiality', 'Why', 'had', 'Rigoletto', 'suspended', 'midair', 'moaning', 'abduction', 'daughter', 'Gilda', 'close', 'second', 'act', 'was', 'jarringly', 'ridiculous', '3', 'stars', 'are', 'excellent', 'singing']","Verdi - Rigoletto / Chailly, Pavarotti, Wixell, Gruberova, Vienna Philharmonic VHS"
491578,AXLN36UV9KGXD,B0000042BZ,Mr John Haueisen,"[8, 10]","I didn't want to love the opera, Rigoletto, because I found the plot implausible:How could a girl continue to love a worthless philandering man who thinks women exist only to be used?Yet, I decided to give it a fair shot--to watch it clear through to see if the plot could make sense.OK. Maybe you'll say I was just under the spell of the gorgeous music and the incomparable precision and passion of the singing of Edita Gruberova as Gilda. Or perhaps it was the exhilarating experience of hearing Pavarotti at his peak, just dominating every scene.Perhaps it was the excellent performance by Ingar Wixell as Rigoletto, or the superb supporting performances by Ferruccio Furlanetto and Victoria Vergara as Sparafucile and his sister, Maddalena--I can't imagine anyone doing those roles any better.I remember a song where the theme, and perhaps the title, was ""Just My Bill."" It was a woman singing about her Bill and his habits of running around, drinking too much, and abusing her--but she still loved him with all those faults.Offensive as that kind of love seems to me (and to Rigoletto) that was Gilda's kind of love--and she proved it.I just have to remind myself that this is opera, that the point of it all is beautiful music, beautifully sung, as it tells a story.Because of what seemed to me a plot that strained credulity, I did not want to like it, but the singing, acting, costumes, sets, and Verdi's just beautiful music made me love it.",5,You made me love you--I didn't want to do it.,1139702400,"02 12, 2006",2006,1450,"['did', ""n't"", 'want', 'love', 'opera', 'Rigoletto', 'found', 'plot', 'implausible', 'How', 'could', 'girl', 'continue', 'love', 'worthless', 'philandering', 'man', 'who', 'women', 'exist', 'only', 'be', 'used', 'decided', 'give', 'fair', 'shot', 'watch', 'clear', 'see', 'plot', 'could', 'make', 'sense.OK', 'Maybe', ""'ll"", 'say', 'was', 'just', 'spell', 'gorgeous', 'music', 'incomparable', 'precision', 'passion', 'singing', 'Edita', 'Gruberova', 'Gilda', 'perhaps', 'was', 'exhilarating', 'experience', 'hearing', 'Pavarotti', 'peak', 'just', 'dominating', 'scene.Perhaps', 'was', 'excellent', 'performance', 'Ingar', 'Wixell', 'Rigoletto', 'superb', 'supporting', 'performances', 'Ferruccio', 'Furlanetto', 'Victoria', 'Vergara', 'Sparafucile', 'sister', 'Maddalena', 'ca', ""n't"", 'imagine', 'anyone', 'doing', 'roles', 'better.I', 'remember', 'song', 'where', 'theme', 'perhaps', 'title', 'was', 'Just', 'My', 'Bill', 'was', 'woman', 'singing', 'Bill', 'habits', 'running', 'around', 'drinking', 'too', 'much', 'abusing', 'still', 'loved', 'faults.Offensive', 'kind', 'love', 'Rigoletto', 'was', 'Gilda', 'kind', 'love', 'proved', 'it.I', 'just', 'have', 'remind', 'opera', 'point', 'beautiful', 'music', 'beautifully', 'sung', 'story.Because', 'what', 'seemed', 'plot', 'strained', 'credulity', 'did', 'not', 'want', 'like', 'singing', 'acting', 'costumes', 'sets', 'Verdi', 'just', 'beautiful', 'music', 'made', 'love']","Verdi - Rigoletto / Chailly, Pavarotti, Wixell, Gruberova, Vienna Philharmonic VHS"
491579,AHE4T371JTLE9,B0000042BZ,Mrs. Sunar Tjahjono,"[8, 9]","This opera video while in fact a movie performance with shootings on natural background scenery, is performed so beautifully and magnificent,that it give more emphasize to the sinister nature and tragical story of the jester Rigoletto and his daughter. We enjoy the performance of Ingvar Wixell as Rigoletto, who sung so splendidly and moved our hearts to the tragical condition he is involved. His performance is matched in perfection by the delightful and brilliant performance of Edita Gruberova, who appeared so magnifently exposing the lovely fairylike character of Gilda. I have seen several of Gruberova's performances, but in this opera her singing is so beautiful and as such convince the world of her superiority in performing the innocent lovesick daughter of Rigoletto. Luciano Pavarotti is already so famous that nobody will deny the beauty of his singing. However, his name does not emphasize the success of this video as disappointingly his acting is not quite so convincing as his other performances that I have seen.  Nevertheless, we can still enjoy his splendid voice and watch the magnificent performances of the other singers.",4,Magnificent opera in a movie performance,997401600,"08 10, 2001",2001,1147,"['opera', 'video', 'fact', 'movie', 'performance', 'shootings', 'natural', 'background', 'scenery', 'performed', 'so', 'beautifully', 'magnificent', 'give', 'more', 'emphasize', 'sinister', 'nature', 'tragical', 'story', 'jester', 'Rigoletto', 'daughter', 'enjoy', 'performance', 'Ingvar', 'Wixell', 'Rigoletto', 'who', 'sung', 'so', 'splendidly', 'moved', 'hearts', 'tragical', 'condition', 'involved', 'performance', 'matched', 'perfection', 'delightful', 'brilliant', 'performance', 'Edita', 'Gruberova', 'who', 'appeared', 'so', 'magnifently', 'exposing', 'lovely', 'fairylike', 'character', 'Gilda', 'have', 'seen', 'several', 'Gruberova', 'performances', 'opera', 'singing', 'so', 'beautiful', 'such', 'convince', 'world', 'superiority', 'performing', 'innocent', 'lovesick', 'daughter', 'Rigoletto', 'Luciano', 'Pavarotti', 'already', 'so', 'famous', 'nobody', 'will', 'deny', 'beauty', 'singing', 'However', 'name', 'not', 'emphasize', 'success', 'video', 'disappointingly', 'acting', 'not', 'quite', 'so', 'convincing', 'other', 'performances', 'have', 'seen', 'Nevertheless', 'can', 'still', 'enjoy', 'splendid', 'voice', 'watch', 'magnificent', 'performances', 'other', 'singers']","Verdi - Rigoletto / Chailly, Pavarotti, Wixell, Gruberova, Vienna Philharmonic VHS"
491580,AV7Z25U0HUGTU,B0000042BZ,N. Gallimore,"[6, 6]","This is just about as good a production of Verdi's masterpiece as you will get.  Of course, no production is absolutely perfect as it is only one persons vision of a piece - we all have our own individual ideas of how we would like it done.I would never, for example, have allowed Rigoletto to take his young daughter out into the wilderness surrounding Mantua in the middle of the night, during a manic storm, wearing only a nightdress!  What was he thinking of by then sending her home unaccompanied (where incidentally only the night before he had run into a professional assassin) whilst he went and sat on his own in  a boat in the middle of a lake!!  Then how on earth he could mistake his daughter's body in the sack for one the size of The Duke of Mantua pales beyond belief .... but no matter, the merits of this production far outweigh the weaknesses.Although for the first time, with such brilliantly authentic surroundings and acting, I began to question the plausibilty of it all.  I think this is because as it unfolds on your TV screen in such sharp clarity of picture and sound it makes you start to analsye it more.  So that is a major plus for this disc to start with.Ingvar Wixell acts the central role with such committment and power that you never doubt for one moment that he is indeed a tortured soul with two separate lives.  His shame at being uncovered as acourt jester as his daughter realises her own shame at being raped is just one of the many poignant and powerful moments in this excellent DVD.  He is partnered wonderfully by Edita Gruberova, who I suspect has studied the great Renato Scotto's interpretation of Gilda.  Just lap it all up - these are amazing performances.Sparafucile is perfectly sung and portrayed by a very young Ferruccio Furlanetto - and Victoria Vergara is as good as any Maddalena you are ever likely to come across in the opera house.  Orchestration is superb and with a few quibbles it is directed brilliantly by Jean-Pierre Ponnelle.And Luciano Pavarotti?  This is one of his very best performances.  Committed to the action, in perfect voice, just in fact the super star that he indeed is.  Don't hesitate, just buy it and enjoy.",5,A little gem of a DVD,1003276800,"10 17, 2001",2001,2190,"['just', 'about', 'as', 'good', 'production', 'Verdi', 'masterpiece', 'will', 'get', 'course', 'production', 'absolutely', 'perfect', 'only', 'one', 'persons', 'vision', 'piece', 'have', 'own', 'individual', 'ideas', 'how', 'would', 'like', 'done.I', 'would', 'never', 'example', 'have', 'allowed', 'Rigoletto', 'take', 'young', 'daughter', 'wilderness', 'surrounding', 'Mantua', 'middle', 'night', 'manic', 'storm', 'wearing', 'only', 'nightdress', 'What', 'was', 'thinking', 'then', 'sending', 'home', 'unaccompanied', 'where', 'incidentally', 'only', 'night', 'had', 'run', 'professional', 'assassin', 'whilst', 'went', 'sat', 'own', 'boat', 'middle', 'lake', 'Then', 'how', 'earth', 'could', 'mistake', 'daughter', 'body', 'sack', 'one', 'size', 'Duke', 'Mantua', 'pales', 'belief', 'matter', 'merits', 'production', 'far', 'weaknesses.Although', 'first', 'time', 'such', 'brilliantly', 'authentic', 'surroundings', 'acting', 'began', 'question', 'plausibilty', 'think', 'because', 'TV', 'screen', 'such', 'sharp', 'clarity', 'picture', 'sound', 'start', 'analsye', 'more', 'major', 'plus', 'disc', 'start', 'with.Ingvar', 'Wixell', 'central', 'role', 'such', 'committment', 'power', 'never', 'doubt', 'one', 'moment', 'indeed', 'tortured', 'soul', 'two', 'separate', 'lives', 'shame', 'being', 'uncovered', 'acourt', 'jester', 'daughter', 'own', 'shame', 'being', 'raped', 'just', 'one', 'many', 'poignant', 'powerful', 'moments', 'excellent', 'DVD', 'partnered', 'wonderfully', 'Edita', 'Gruberova', 'who', 'suspect', 'studied', 'great', 'Renato', 'Scotto', 'interpretation', 'Gilda', 'Just', 'lap', 'up', 'are', 'amazing', 'performances.Sparafucile', 'perfectly', 'sung', 'portrayed', 'very', 'young', 'Ferruccio', 'Furlanetto', 'Victoria', 'Vergara', 'as', 'good', 'Maddalena', 'are', 'ever', 'likely', 'come', 'opera', 'house', 'Orchestration', 'superb', 'few', 'quibbles', 'directed', 'brilliantly', 'Jean-Pierre', 'Ponnelle.And', 'Luciano', 'Pavarotti', 'one', 'very', 'best', 'performances', 'Committed', 'action', 'perfect', 'voice', 'just', 'fact', 'super', 'star', 'indeed', 'Do', ""n't"", 'hesitate', 'just', 'buy', 'enjoy']","Verdi - Rigoletto / Chailly, Pavarotti, Wixell, Gruberova, Vienna Philharmonic VHS"
491581,A32U96RR2TCPA3,B0000042BZ,"operamaryc ""operamarty""","[2, 2]","This is the only version I've ever seen of a movie version of Rigoletto and certainly one for Pavarotti fans.  Since I'm a Domingo fan, I rarely appreciate Pav in an opera performance because he just stands and mugs and is incapable of acting and signing at the same time!  However, that being said, this is one of the best performances of Pav on video, the production is traditional (which I like), costumes fine and the rest of the cast is credible.  More importantly, if you want a Rigoletto, this is probably the best video version available.  I can't stand Italian opera in English! It's the only one in my collection as I haven't found a better one yet. I've seen it on stage many times, like it, and enjoy watching this version at least once a year.  I recommend buying as there are few available and this movie is certainly is worth the asking price.",4,Only movie-opera of Rigoletto available.,996192000,"07 27, 2001",2001,858,"['only', 'version', ""'ve"", 'ever', 'seen', 'movie', 'version', 'Rigoletto', 'certainly', 'one', 'Pavarotti', 'fans', ""'m"", 'Domingo', 'fan', 'rarely', 'appreciate', 'Pav', 'opera', 'performance', 'just', 'mugs', 'incapable', 'acting', 'signing', 'same', 'time', 'However', 'being', 'said', 'one', 'best', 'performances', 'Pav', 'video', 'production', 'traditional', 'like', 'fine', 'rest', 'cast', 'credible', 'More', 'importantly', 'want', 'Rigoletto', 'probably', 'best', 'video', 'version', 'available', 'ca', ""n't"", 'stand', 'Italian', 'opera', 'English', 'only', 'one', 'collection', 'have', ""n't"", 'found', 'better', 'one', 'yet', ""'ve"", 'seen', 'stage', 'many', 'times', 'enjoy', 'watching', 'version', 'least', 'once', 'year', 'recommend', 'buying', 'are', 'few', 'available', 'movie', 'certainly', 'asking', 'price']","Verdi - Rigoletto / Chailly, Pavarotti, Wixell, Gruberova, Vienna Philharmonic VHS"
491582,A5TZX3LATC9S9,B0000042BZ,"Peter Vadasz ""Prof. P. Vadasz""","[4, 4]",This is a really excellent performance of this moving opera. Not only the music performance which is really outstanding (actually perfect) but also the acting is unbelievable. This is a must have for any one who loves opera.,5,Excellent performance,1168214400,"01 8, 2007",2007,224,"['really', 'excellent', 'performance', 'moving', 'opera', 'Not', 'only', 'music', 'performance', 'really', 'outstanding', 'actually', 'perfect', 'also', 'acting', 'unbelievable', 'must', 'have', 'one', 'who', 'opera']","Verdi - Rigoletto / Chailly, Pavarotti, Wixell, Gruberova, Vienna Philharmonic VHS"
491583,AUX9KZUUB3YCE,B0000042BZ,R. Nicholson,"[16, 17]","I liked this DVD from beginning to end !This is the movie version of Verdi's tragic masterpiece Rigoletto. I must admit, that up to this point, I had not been a big fan of operas that had been made into movies: but I have to make an exception in this instance. Filmed in Italy by Jean-Pierre Ponnelle, the settings consist of real castles, streets and rivers that lend a sublime atmosphere and ambience to the opera being presented here. It would be impossible for a stage version to present such elaborate surroundings. The costumes, throughout, are nothing short of sumptuous and fit perfectly into the era they were intended to represent. The camera angles were well placed with the only negative comment being that some of the facial shots were ultra closeup.This work stars Ingvar Wixell (Rigoletto), Luciano Pavarotti (Duke of Mantova) and Edita Gruberova (Gilda).Luciano Pavarotti is in his singing prime in this production and his acting, although not great, is passable. Gruberova has a great voice and does justice to her part as Gilda. It is however Ingvar Wixell that commands the audiences' attention with his fabulous interpretation of the tragic hero, Rigoletto. His performance, in my opinion, is worthy of acting honors and his singing voice is as impressive as his stage presence throughout the entire work. He simply carries the show from beginning to end.I was much more impressed with this performance than I thought I would be and could highly recommended it without any reservations: A Rigoletto you will be happy to own.",5,A Rigoletto you will be happy to own,1040774400,"12 25, 2002",2002,1544,"['liked', 'DVD', 'beginning', 'end', 'movie', 'version', 'Verdi', 'tragic', 'masterpiece', 'Rigoletto', 'must', 'admit', 'up', 'point', 'had', 'not', 'been', 'big', 'fan', 'operas', 'had', 'been', 'made', 'movies', 'have', 'make', 'exception', 'instance', 'Filmed', 'Italy', 'Jean-Pierre', 'Ponnelle', 'settings', 'consist', 'real', 'castles', 'streets', 'rivers', 'lend', 'sublime', 'atmosphere', 'ambience', 'opera', 'being', 'presented', 'here', 'would', 'be', 'impossible', 'stage', 'version', 'present', 'such', 'elaborate', 'surroundings', 'costumes', 'are', 'nothing', 'short', 'sumptuous', 'fit', 'perfectly', 'era', 'were', 'intended', 'represent', 'camera', 'angles', 'were', 'well', 'placed', 'only', 'negative', 'comment', 'being', 'facial', 'shots', 'were', 'ultra', 'closeup.This', 'work', 'stars', 'Ingvar', 'Wixell', 'Rigoletto', 'Luciano', 'Pavarotti', 'Duke', 'Mantova', 'Edita', 'Gruberova', 'Gilda', '.Luciano', 'Pavarotti', 'singing', 'prime', 'production', 'acting', 'not', 'great', 'passable', 'Gruberova', 'great', 'voice', 'justice', 'part', 'Gilda', 'however', 'Ingvar', 'Wixell', 'audiences', 'attention', 'fabulous', 'interpretation', 'tragic', 'hero', 'Rigoletto', 'performance', 'opinion', 'worthy', 'acting', 'honors', 'singing', 'voice', 'as', 'impressive', 'stage', 'presence', 'entire', 'work', 'simply', 'show', 'beginning', 'end.I', 'was', 'much', 'more', 'impressed', 'performance', 'thought', 'would', 'be', 'could', 'highly', 'recommended', 'reservations', 'Rigoletto', 'will', 'be', 'happy', 'own']","Verdi - Rigoletto / Chailly, Pavarotti, Wixell, Gruberova, Vienna Philharmonic VHS"
491584,ASS8KYIKJA3Q1,B0000042BZ,Robert Petersen,"[3, 3]",Even a person who does not like opera will enjoy this movie version of Rigoletto. The principals are outstanding and Ponnelle's production is perfectly executed. A winner on all counts!,5,A fantastic version of Verdi's opera,1159228800,"09 26, 2006",2006,185,"['Even', 'person', 'who', 'not', 'opera', 'will', 'enjoy', 'movie', 'version', 'Rigoletto', 'principals', 'are', 'outstanding', 'Ponnelle', 'production', 'perfectly', 'executed', 'winner', 'counts']","Verdi - Rigoletto / Chailly, Pavarotti, Wixell, Gruberova, Vienna Philharmonic VHS"
491585,A33KJZ6GCAUKOV,B0000042BZ,Ronald K. Goodenow,"[1, 2]","I'm not a perfectionist or fanatic opera buff, though a lot of fine performances by Pavarotti, Sutherland, Freni, Kewana, Troyanos, and many others have flowed under my bridge.I recently purchased a relatively small 32"" high def because a big chunk of my substantial dvd collection is from jazz, classical and opera performances of many years past. Not too good for a 52"" screen.Ok, so I hauled this out this afternoon, turned on the subtitles and let it flow through a good sound system. I often wonder what opera I would choose to show to a friend or relative not familiar with the genre. Sure, Boheme (I love the Australian version), Turandot.... But as this cranked up I found myself sucked right into its production values and singing. Proper chicanery by courtiers who would sell their mothers for a dime, a look from Pavarotti that screams 'I'm a cad who can have what I want and, yeah, sing' (which he may have been) and the revelations of Wixell and Gruberova, neither of whom I have seen in person or on film.What I liked about the production is that it truly revealed what opera is as a romantic and oft corny thing. It flowed and, despite the very  unhappy ending, left me smiling and wanting to share it with someone other than my wife who popped in and out while trying to get some work done.Why oh why can't our broadcast media give us music like this????? We know the answer but films like this one remind us we can do better to educate friends, kids and family about opera , which is now too expensive for most of us to enjoy in truly high quality.",5,What fun!,1361059200,"02 17, 2013",2013,1565,"[""'m"", 'not', 'perfectionist', 'fanatic', 'opera', 'buff', 'lot', 'fine', 'performances', 'Pavarotti', 'Sutherland', 'Freni', 'Kewana', 'Troyanos', 'many', 'others', 'have', 'flowed', 'bridge.I', 'recently', 'purchased', 'relatively', 'small', '32', 'high', 'def', 'big', 'chunk', 'substantial', 'dvd', 'collection', 'jazz', 'classical', 'opera', 'performances', 'many', 'years', 'past', 'Not', 'too', 'good', '52', 'screen.Ok', 'hauled', 'out', 'afternoon', 'turned', 'subtitles', 'let', 'flow', 'good', 'sound', 'system', 'often', 'wonder', 'what', 'opera', 'would', 'choose', 'show', 'friend', 'relative', 'not', 'familiar', 'genre', 'Sure', 'Boheme', 'love', 'Australian', 'version', 'Turandot', 'cranked', 'up', 'found', 'sucked', 'right', 'production', 'values', 'singing', 'Proper', 'chicanery', 'courtiers', 'who', 'would', 'sell', 'mothers', 'dime', 'look', 'Pavarotti', 'screams', ""'m"", 'cad', 'who', 'can', 'have', 'what', 'want', 'yeah', 'sing', 'may', 'have', 'been', 'revelations', 'Wixell', 'Gruberova', 'whom', 'have', 'seen', 'person', 'liked', 'production', 'truly', 'revealed', 'what', 'opera', 'romantic', 'oft', 'corny', 'thing', 'flowed', 'very', 'unhappy', 'ending', 'left', 'smiling', 'wanting', 'share', 'someone', 'other', 'wife', 'who', 'popped', 'trying', 'get', 'work', 'done.Why', 'oh', 'why', 'ca', ""n't"", 'broadcast', 'media', 'give', 'music', 'know', 'answer', 'films', 'one', 'remind', 'can', 'do', 'better', 'educate', 'friends', 'kids', 'family', 'opera', 'now', 'too', 'expensive', 'most', 'enjoy', 'truly', 'high', 'quality']","Verdi - Rigoletto / Chailly, Pavarotti, Wixell, Gruberova, Vienna Philharmonic VHS"
