,reviewerID,asin,reviewerName,helpful,reviewText,overall,summary,unixReviewTime,reviewTime,reviewYear,reviewLength,meaningfulWords,Title
1070541,ABARNA66MT43U,B000PFU85M,Bonemonkey,"[1, 1]","This is probably the worst film that I've ever seen. I have no idea why they even made it in the first place. It's already been made (Armageddon) but this film has 99% less budget and 100% worse acting. Ten seconds into it you realize that this is going to be (at best) crap. I will try to summarize the basic plot as I remember it (which may not be strictly accurate)-Kicks off with a particularly fake looking asteroid bumping into The Moon. Then an asteroid scientist goes on live TV and tells a news reporter that she hadn't noticed the asteroid coming because - space is just too big! she can hardly be expected to notice every giant asteroid that's on a collision course with the moon can she? The news reporter accepts this without question. The scientist goes home for an evening of reading a three page science project that her dad did when he was at primary school (which happens to be about an asteroid bumping into the moon resulting in the end of the world).Somewhere near by - John is a buildings demolition expert. Although John is the very best there is, occasionally one of his bombs explodes early meaning John has to personally run into the stricken building to replace the bomb because he doesn't like the idea of one less bomb exploding at the same time as all the others. When blowing up a perfectly good 100ft building they only need a safety barrier to keep the public 10ft from the base of the building. They all live in tents at the base of the building and spend lots of time looking at a computer which likes to trick them into thinking that the whole demolition has been called off, before it suddenly tells them that the bombs will all explode in seconds (while John is on the 10th floor). This means that John has to run down the stairs quite quickly. It's all just another day in the life of John who has had a death wish since his wife died. His assistant tries to cheer him up by saying things like &#34;your wife's gone John&#34; but he only wants to run into more buildings that are about to collapse.The scientist gets a call from another scientist saying that the earth might also get hit by an asteroid. So armed with the three page science project that her dad did when he was at primary school (safely in the boot of her car as it is too important to just put on the passenger seat) she heads out into the unknown hoping to prove his theory, whatever that was.Some asteroids hit a building and John is called to look at the building while sporting a new safety helmet (despite his death wish). John realizes that a building that has been hit by asteroids may as well be demolished, so he decides to blow it up. He hopes that it doesn't collapse on the hospital next door (which the authorities decided was the safest place to put the survivors from the building in question).The scientists have a competition to see who can think up the most disastrous scenario. One of them says that The Moon itself is plummeting towards The Earth (which wins). The two of them decide that this is what is actually happening. They tell the president who immediately invites John round for tea. Face man from the A-team appears and tells them all that he's watching them. They show John a clay model of The Moon so he will realize what The Moon looks like with a crack in it. John says &#34;wow, that's some crack&#34;. They ask John if he can fill the crack and he says &#34;ohhh yeahhh&#34;John flirts with the scientist and agrees to bring her back some Moon samples (even though nobody asked him to go to The Moon yet). John calls his team and tells them to run for their lives, but not before they get a piece of the asteroid for his collection. John tries to flirt with the scientist again but the other scientist suddenly shouts &#34;I've got to get you up in the air John&#34;.They launch John. He makes it into orbit, but straight into the path of some asteroids. He manages to dodge the asteroids and approaches The Moons crack. The scientist refers to the drawing on page two of the three page science project her dad did at primary school. She tells John that he must enter The Moons crack. John tries to be serious. The tension mounts. John enters The Moons crack. The scientists realize that their plan won't work and nearly give up all hope. John tells them never to give up all hope and they promise that they will never give up all hope. They suddenly remember that there is a spare 500ml can of fuel in the glove compartment of the shuttle which can also be used to seal a 10,000 mile long crack in The Moon. They tell John how to open the glove compartment and against all the odds he manages to open it. John gives the can a shake, opens it, takes a swig, burps the national anthem, then pours the rest into The Moons crack. The Moons crack starts to close. John has to escape quickly (almost as quickly as he had to run out of the building earlier). The scientists think that John is wedged in The Moons crack, but he suddenly shouts &#34;I'm coming home&#34; over the radio. They all start cheering. He gets home and the scientist says &#34;welcome home John&#34;.The End.I have made this film sound much better than it actually is. You have been warned!",1,You have been warned...,1392854400,"02 20, 2014",2014,5201,"['probably', 'worst', 'film', ""'ve"", 'ever', 'seen', 'have', 'idea', 'why', 'even', 'made', 'first', 'place', 'already', 'been', 'made', 'Armageddon', 'film', '99', '%', 'less', 'budget', '100', '%', 'worse', 'acting', 'Ten', 'realize', 'going', 'be', 'best', 'crap', 'will', 'try', 'summarize', 'basic', 'plot', 'remember', 'may', 'not', 'be', 'strictly', 'accurate', 'off', 'particularly', 'fake', 'looking', 'asteroid', 'bumping', 'Moon', 'Then', 'asteroid', 'scientist', 'live', 'TV', 'news', 'reporter', 'had', ""n't"", 'noticed', 'asteroid', 'coming', 'space', 'just', 'too', 'big', 'can', 'hardly', 'be', 'expected', 'notice', 'giant', 'asteroid', 'collision', 'course', 'moon', 'can', 'news', 'reporter', 'accepts', 'question', 'scientist', 'home', 'evening', 'reading', 'three', 'page', 'science', 'project', 'dad', 'did', 'when', 'was', 'primary', 'school', 'be', 'asteroid', 'bumping', 'moon', 'resulting', 'end', 'world', '.Somewhere', 'John', 'buildings', 'demolition', 'expert', 'John', 'very', 'best', 'occasionally', 'one', 'bombs', 'early', 'meaning', 'John', 'personally', 'run', 'stricken', 'building', 'replace', 'bomb', ""n't"", 'like', 'idea', 'one', 'less', 'bomb', 'exploding', 'same', 'time', 'others', 'When', 'blowing', 'up', 'perfectly', 'good', '100ft', 'building', 'only', 'need', 'safety', 'barrier', 'keep', 'public', '10ft', 'base', 'building', 'live', 'tents', 'base', 'building', 'spend', 'lots', 'time', 'looking', 'computer', 'trick', 'thinking', 'whole', 'demolition', 'been', 'called', 'off', 'suddenly', 'bombs', 'will', 'explode', 'seconds', 'John', '10th', 'floor', 'John', 'run', 'down', 'stairs', 'quite', 'quickly', 'just', 'day', 'life', 'John', 'who', 'had', 'death', 'wish', 'wife', 'died', 'assistant', 'tries', 'cheer', 'up', 'saying', 'things', '34', 'wife', 'gone', 'John', '34', 'only', 'run', 'more', 'buildings', 'are', 'collapse.The', 'scientist', 'call', 'scientist', 'saying', 'earth', 'might', 'also', 'get', 'hit', 'asteroid', 'So', 'armed', 'three', 'page', 'science', 'project', 'dad', 'did', 'when', 'was', 'primary', 'school', 'safely', 'boot', 'car', 'too', 'important', 'just', 'put', 'passenger', 'seat', 'out', 'unknown', 'hoping', 'prove', 'theory', 'was.Some', 'asteroids', 'hit', 'building', 'John', 'called', 'look', 'building', 'sporting', 'new', 'safety', 'helmet', 'death', 'wish', 'John', 'building', 'been', 'hit', 'asteroids', 'may', 'as', 'well', 'be', 'demolished', 'blow', 'up', ""n't"", 'collapse', 'hospital', 'next', 'door', 'authorities', 'decided', 'was', 'safest', 'place', 'put', 'survivors', 'building', 'question', '.The', 'scientists', 'have', 'competition', 'see', 'who', 'can', 'think', 'up', 'most', 'disastrous', 'scenario', 'One', 'Moon', 'plummeting', 'Earth', 'two', 'decide', 'what', 'actually', 'happening', 'tell', 'president', 'who', 'immediately', 'John', 'round', 'tea', 'Face', 'man', 'A-team', 'watching', 'show', 'John', 'clay', 'model', 'Moon', 'will', 'realize', 'what', 'Moon', 'crack', 'John', '34', 'wow', 'crack', '34', 'ask', 'John', 'can', 'fill', 'crack', '34', 'yeahhh', '34', 'John', 'scientist', 'bring', 'back', 'Moon', 'samples', 'even', 'nobody', 'asked', 'go', 'Moon', 'yet', 'John', 'team', 'run', 'lives', 'not', 'get', 'piece', 'asteroid', 'collection', 'John', 'flirt', 'scientist', 'again', 'other', 'scientist', 'suddenly', '34', ""'ve"", 'got', 'get', 'up', 'air', 'John', '34', '.They', 'launch', 'John', 'orbit', 'straight', 'path', 'asteroids', 'dodge', 'asteroids', 'Moons', 'crack', 'scientist', 'refers', 'drawing', 'page', 'two', 'three', 'page', 'science', 'project', 'dad', 'did', 'primary', 'school', 'John', 'must', 'enter', 'Moons', 'crack', 'John', 'be', 'serious', 'tension', 'mounts', 'John', 'Moons', 'crack', 'scientists', 'realize', 'plan', 'wo', ""n't"", 'work', 'nearly', 'give', 'up', 'hope', 'John', 'never', 'give', 'up', 'hope', 'promise', 'will', 'never', 'give', 'up', 'hope', 'suddenly', 'remember', 'spare', '500ml', 'can', 'fuel', 'glove', 'compartment', 'shuttle', 'can', 'also', 'be', 'used', 'seal', '10,000', 'mile', 'long', 'crack', 'Moon', 'tell', 'John', 'how', 'open', 'glove', 'compartment', 'odds', 'open', 'John', 'can', 'shake', 'swig', 'burps', 'national', 'anthem', 'then', 'rest', 'Moons', 'crack', 'Moons', 'crack', 'close', 'John', 'escape', 'quickly', 'almost', 'as', 'quickly', 'had', 'run', 'out', 'building', 'earlier', 'scientists', 'think', 'John', 'wedged', 'Moons', 'crack', 'suddenly', '34', ""'m"", 'coming', 'home', '34', 'radio', 'start', 'cheering', 'home', 'scientist', '34', 'welcome', 'home', 'John', '34', 'End.I', 'have', 'made', 'film', 'sound', 'much', 'better', 'actually', 'have', 'been', 'warned']",Earthstorm
1070542,A1QRWYLXVKHK3P,B000PFU85M,Flickering Light Screen Play 48,"[0, 0]","So, after what happens to the moon it is up to the government to save us. And yet, another nuclear engined Shuttle. Nasa should consider building one. There's the usual back story, wronged party, heroic scientist attempting to rescue us. I bought this movie because I saw it on sci fi. Credits are a thing of the past, I do watch them as part of the movie going experience. Bottomline, I recommend it",5,The Moon Is Falling And Nuclear Engined Shuttle,1387584000,"12 21, 2013",2013,400,"['So', 'what', 'moon', 'government', 'save', 'yet', 'nuclear', 'engined', 'Shuttle', 'Nasa', 'should', 'consider', 'building', 'one', 'usual', 'back', 'story', 'wronged', 'party', 'heroic', 'scientist', 'attempting', 'rescue', 'bought', 'movie', 'saw', 'sci', 'fi', 'Credits', 'are', 'thing', 'past', 'do', 'watch', 'part', 'movie', 'going', 'experience', 'Bottomline', 'recommend']",Earthstorm
1070543,A2G0AQ3WQCD128,B000PFU85M,John R. Shaw,"[19, 25]","Forget the physics and logistics of the situation and forget that Stephen Baldwin is known for being in cheesy movies. To my surprise this is actually an excellent movie. The acting was not the best, but I was expecting that. The director was obviously very good and turned what normally would have been a bad movie into something worth watching. This is unusual in these types of movies and I want to say congratulations to Terry Cunningham for pulling it off. The real question is would I be willing to add this to my personal movie collection, and the answer is yes.As to the comments by ""rewt""; Acting: B, technical affects: A, physics and logistics: F (rewt was right there, but most people are ignorant about that). It gets 4 points from me (again to my surprise), because I want to watch it again.",4,Surpised,1186444800,"08 7, 2007",2007,804,"['Forget', 'physics', 'logistics', 'situation', 'forget', 'Stephen', 'Baldwin', 'known', 'being', 'cheesy', 'movies', 'surprise', 'actually', 'excellent', 'movie', 'acting', 'was', 'not', 'best', 'was', 'expecting', 'director', 'was', 'obviously', 'very', 'good', 'turned', 'what', 'normally', 'would', 'have', 'been', 'bad', 'movie', 'something', 'worth', 'watching', 'unusual', 'types', 'movies', 'want', 'say', 'congratulations', 'Terry', 'Cunningham', 'pulling', 'off', 'real', 'question', 'would', 'be', 'willing', 'add', 'personal', 'movie', 'collection', 'answer', 'yes.As', 'comments', 'rewt', 'Acting', 'B', 'technical', 'affects', 'physics', 'logistics', 'F', 'rewt', 'was', 'right', 'there', 'most', 'people', 'are', 'ignorant', '4', 'points', 'again', 'surprise', 'want', 'watch', 'again']",Earthstorm
1070544,AWG1LIHKVGMN4,B000PFU85M,john ward,"[0, 1]",It was excellent A meteor hits the moon sending it off course and pieces of the moon towards the earth.S they need expert in demo to save the planet.,5,earthstorm,1356307200,"12 24, 2012",2012,149,"['was', 'excellent', 'A', 'meteor', 'moon', 'sending', 'off', 'course', 'pieces', 'moon', 'earth.S', 'need', 'expert', 'demo', 'save', 'planet']",Earthstorm
1070545,A3GL1RW3IIDP8X,B000PFU85M,"jules ""spirou""","[0, 0]","I should have my head examined, I should have known better, the writing was on the wall.....Bad acting, bad story, bad everything ! Shame on them !",2,Booooring !,1398556800,"04 27, 2014",2014,147,"['should', 'have', 'head', 'examined', 'should', 'have', 'known', 'better', 'writing', 'was', 'wall', '..Bad', 'acting', 'bad', 'story', 'bad', 'everything', 'Shame']",Earthstorm
1070546,A3F7PBATA5KROT,B000PFU85M,KaysWay,"[0, 0]",Visual effects were a little cheesy but I liked the story line in this movie. I guess it was because this is a possibility.,4,Pretty Good,1388275200,"12 29, 2013",2013,123,"['Visual', 'effects', 'were', 'little', 'cheesy', 'liked', 'story', 'line', 'movie', 'guess', 'was', 'possibility']",Earthstorm
1070547,A1TO1P3NV7OAU6,B000PFU85M,"KevinB ""The Honey Badger""","[2, 3]","This movie doesn't have anything new to offer. It has a little action, drama, and suspense. Not enough of any of those things to make you care very much though. It's like a cheap lazy version of Armageddon. I'm not gonna waste time talking much about it, and I don't think you should waste your money on buying it or watch it. Unless you come across it on the Sci-fi channel don't give it a second thought.",3,Magnificently Mediocre.,1352246400,"11 7, 2012",2012,406,"['movie', ""n't"", 'have', 'anything', 'new', 'offer', 'little', 'action', 'drama', 'suspense', 'Not', 'enough', 'things', 'make', 'care', 'very', 'much', 'cheap', 'lazy', 'version', 'Armageddon', ""'m"", 'not', 'gon', 'waste', 'time', 'talking', 'much', 'do', ""n't"", 'think', 'should', 'waste', 'money', 'buying', 'watch', 'come', 'Sci-fi', 'channel', 'do', ""n't"", 'give', 'second', 'thought']",Earthstorm
1070548,A1RHP6PX9UPJ3E,B000PFU85M,"Lewis W. Cunningham ""Wayne Cunningham""","[0, 0]","You have a bunch of people wondering around say copy that  & we watchers of this video are expected to believe that you have the space ship traveling at 20,000 per hour and the pilot is expected to fly though all these very large  boulders and seal up a crack in the moon with nuke bomb all in just matter of few minutes?  Acting if you can call it that was let's say not Oscar material. The movie to it credit there was no porn, cussing  blood, guts and gore like so many of these low budget  have in them.  You could do worse in movie selections and I would like to given this movie a little better rating had not the plots being so predictable and dialog so boring.  Copy that :)",3,This movie gets a c-,1403308800,"06 21, 2014",2014,682,"['have', 'bunch', 'people', 'wondering', 'say', 'copy', 'watchers', 'video', 'are', 'expected', 'believe', 'have', 'space', 'ship', 'traveling', '20,000', 'hour', 'pilot', 'expected', 'fly', 'very', 'large', 'boulders', 'seal', 'up', 'crack', 'moon', 'nuke', 'bomb', 'just', 'matter', 'few', 'minutes', 'Acting', 'can', 'call', 'was', 'let', 'say', 'not', 'Oscar', 'material', 'movie', 'credit', 'was', 'porn', 'cussing', 'blood', 'guts', 'gore', 'so', 'many', 'low', 'budget', 'have', 'could', 'do', 'worse', 'movie', 'selections', 'would', 'like', 'given', 'movie', 'little', 'better', 'rating', 'had', 'not', 'plots', 'being', 'so', 'predictable', 'dialog', 'so', 'boring', 'Copy']",Earthstorm
1070549,A28F98S0TO6ILU,B000PFU85M,Lisa J. Music,"[0, 1]",The Earthstorm movie is one of the best I've seen around every time I watch it I'm always on the edge of my seat. The graphics of the movie is the extreme. The actors and actoresses that protrail the characters are the best stars to do that movie.,5,Super Movie,1317081600,"09 27, 2011",2011,247,"['Earthstorm', 'movie', 'one', 'best', ""'ve"", 'seen', 'time', 'watch', ""'m"", 'always', 'edge', 'seat', 'graphics', 'movie', 'extreme', 'actors', 'actoresses', 'protrail', 'characters', 'are', 'best', 'stars', 'do', 'movie']",Earthstorm
1070550,A221HN67KU3VLV,B000PFU85M,Movie Nut Deb,"[0, 0]","I bought this movie ( I like these types of movies ) except during the movie sayings kept popping up  saying not for sale or resale? . I must have missed that class, what gives?",3,Did I miss something?,1225843200,"11 5, 2008",2008,177,"['bought', 'movie', 'types', 'movies', 'movie', 'sayings', 'kept', 'popping', 'up', 'saying', 'not', 'sale', 'resale', 'must', 'have', 'missed', 'class', 'what']",Earthstorm
1070551,A2GFZT48YTZASN,B000PFU85M,Pavelow,"[1, 2]","I can't say I want my money back because I watched this one for free with a code.  This is an extremely low budget film starring Stephen Baldwin who seems to be known for C and D movies.  In fact I believe he did another one in 2007 called Dark Storm.  Well anyway, this disaster film has all the standard characters including the beautiful female scientist with the right answer (learned acting at nights while cutting hair in the day) that is ridiculed by the overbearing egotistical scientist (Dirk Benedict, aka StarBuck from the Battle Star Galactica series who never could act anyway), a demolition man (Baldwin) summoned to save the world with his demo skills - only in space, the not so confident cute with short shorts demo assistant, and of course a sue do replacement organization for NASA called ASI American Space Institute.  Enter the typical asteroid hurdling toward earth but bashes into the moon instead riffing a chasm 1000 times larger than the Grand Canyon.  All is honky dory until the earth gets spewed with moon rocks and it looks like the moon is going to break apart and end all life on our planet.  So, why not send up the confident female shuttle commander, a random shuttle astronaut who will obviously be hit in the head so our hero demo guy can push the button on a bomb that he never built and never really ever understood how it worked until our beautiful scientist red-head told him.  Ah, and throw in that the shuttle has gravity on board but seems to defy gravity as it hovers over the core of the moon.  Yes we have all the makings of a made for Saturday morning cartoon without the animation.  CGI is cheesy, acting is horrid, realism not even attempted, and OMG, Baldwin has some very small albino beady blue eyes that really bug.  Get this for your nine year old and wait for the questions - Daddy, is there sound in space?  Daddy, is there gravity in the shuttle?  And, my favorite...Daddy do we have to watch this?  I want to watch the DNC and Hillary!  A friend of mine thought it stared Barney Rubble.  I told him he was right.  If I could I'd render a ZERO in the rating column.",1,I want my rental code back!,1219795200,"08 27, 2008",2008,2122,"['ca', ""n't"", 'say', 'want', 'money', 'back', 'watched', 'one', 'free', 'code', 'extremely', 'low', 'budget', 'film', 'starring', 'Stephen', 'Baldwin', 'who', 'be', 'known', 'C', 'D', 'movies', 'fact', 'believe', 'did', 'one', '2007', 'called', 'Dark', 'Storm', 'Well', 'anyway', 'disaster', 'film', 'standard', 'characters', 'including', 'beautiful', 'female', 'scientist', 'right', 'answer', 'learned', 'acting', 'nights', 'cutting', 'hair', 'day', 'ridiculed', 'overbearing', 'egotistical', 'scientist', 'Dirk', 'Benedict', 'aka', 'StarBuck', 'Battle', 'Star', 'Galactica', 'series', 'who', 'never', 'could', 'act', 'anyway', 'demolition', 'man', 'Baldwin', 'summoned', 'save', 'world', 'demo', 'only', 'space', 'not', 'so', 'confident', 'cute', 'short', 'shorts', 'demo', 'assistant', 'course', 'sue', 'do', 'replacement', 'organization', 'NASA', 'called', 'ASI', 'American', 'Space', 'Institute', 'Enter', 'typical', 'asteroid', 'hurdling', 'earth', 'bashes', 'moon', 'instead', 'riffing', 'chasm', '1000', 'times', 'larger', 'Grand', 'Canyon', 'honky', 'dory', 'earth', 'spewed', 'moon', 'rocks', 'moon', 'going', 'break', 'apart', 'end', 'life', 'planet', 'So', 'why', 'not', 'send', 'up', 'confident', 'female', 'shuttle', 'commander', 'random', 'shuttle', 'astronaut', 'who', 'will', 'obviously', 'be', 'hit', 'head', 'so', 'hero', 'demo', 'guy', 'can', 'push', 'button', 'bomb', 'never', 'built', 'never', 'really', 'ever', 'understood', 'how', 'worked', 'beautiful', 'scientist', 'red-head', 'told', 'Ah', 'throw', 'shuttle', 'gravity', 'board', 'defy', 'gravity', 'core', 'moon', 'Yes', 'have', 'makings', 'made', 'Saturday', 'morning', 'cartoon', 'animation', 'CGI', 'cheesy', 'acting', 'horrid', 'realism', 'not', 'even', 'attempted', 'OMG', 'Baldwin', 'very', 'small', 'albino', 'beady', 'blue', 'eyes', 'really', 'bug', 'Get', 'nine', 'year', 'old', 'wait', 'questions', 'Daddy', 'there', 'sound', 'space', 'Daddy', 'gravity', 'shuttle', 'favorite', 'Daddy', 'do', 'have', 'watch', 'want', 'watch', 'DNC', 'Hillary', 'A', 'friend', 'mine', 'thought', 'stared', 'Barney', 'Rubble', 'told', 'was', 'right', 'could', ""'d"", 'render', 'ZERO', 'rating', 'column']",Earthstorm
1070552,AN9TN8MW629JS,B000PFU85M,"Ramona L. Hayes ""rlhayes""","[0, 0]",Love Stephen so I like this movie.  Love Disasters.  Came fast in good shape,5,Earthstorm,1225324800,"10 30, 2008",2008,76,"['Love', 'Stephen', 'so', 'like', 'movie', 'Love', 'Disasters', 'Came', 'fast', 'good', 'shape']",Earthstorm
1070553,A1ZCH4APVK5YRJ,B000PFU85M,SgtSu,"[0, 0]","Stephan Baldwin is his usual solid character capable of anything, but without the macho attitude put in so many sci fi movies. Excellent science--at least credible as far as we need to know to enjoy this 'what if' story. The 'must hate character' a know it all scientist (Dirk Benedict) is wonderful to despise! Lots of fun to watch.",5,Earthstorm,1340409600,"06 23, 2012",2012,333,"['Stephan', 'Baldwin', 'usual', 'solid', 'character', 'capable', 'anything', 'macho', 'attitude', 'put', 'so', 'many', 'sci', 'fi', 'movies', 'Excellent', 'science', 'least', 'credible', 'as', 'far', 'need', 'know', 'enjoy', ""'what"", 'story', ""'must"", 'hate', 'character', 'know', 'scientist', 'Dirk', 'Benedict', 'wonderful', 'despise', 'Lots', 'fun', 'watch']",Earthstorm
