,reviewerID,asin,reviewerName,helpful,reviewText,overall,summary,unixReviewTime,reviewTime,reviewYear,reviewLength,meaningfulWords,Title
857122,AD9MPLYLMHKCC,B00062IXZQ,Ghoulie Guru,"[3, 6]","Okay, I like zombie movies. I really do, and I'm willing to forgive a lot when it comes to low budget zombie movies. Especially ones that have their tongue firmly pressed into their cheek. Having said that, I think this may be one of the worst zombie movies to make its way onto the Blockbuster video shelves in a long time (and that's pretty bad, considering there's dreck like ""Corpses Are Forever"" out there).It's not worth going into the plot, because there really isn't one.It's vaguely like From Dusk Till Dawn with zombies, but without the Tarantino dialogue and Rodriguez direction. If you wind up renting this cowpie, look for the best editorial mistake ever. It's toward the middle of the movie, where the black drug dealer (stereotypes anyone?) says something like, ""With all due respect, if you can point that gun somewhere else"" then... watch for it, he actually mouths the other actor's line. Best part of the movie.",1,Bloody Awful,1100217600,"11 12, 2004",2004,930,"['Okay', 'like', 'zombie', 'movies', 'really', 'do', ""'m"", 'willing', 'forgive', 'lot', 'when', 'low', 'budget', 'zombie', 'movies', 'Especially', 'ones', 'have', 'tongue', 'firmly', 'pressed', 'cheek', 'Having', 'said', 'think', 'may', 'be', 'one', 'worst', 'zombie', 'movies', 'make', 'way', 'Blockbuster', 'video', 'shelves', 'long', 'time', 'pretty', 'bad', 'considering', 'dreck', 'Corpses', 'Are', 'Forever', 'there', '.It', 'not', 'worth', 'going', 'plot', 'really', ""n't"", 'vaguely', 'From', 'Dusk', 'Till', 'Dawn', 'zombies', 'Tarantino', 'dialogue', 'Rodriguez', 'direction', 'wind', 'up', 'renting', 'cowpie', 'look', 'best', 'editorial', 'mistake', 'ever', 'middle', 'movie', 'where', 'black', 'drug', 'dealer', 'stereotypes', 'anyone', 'something', 'due', 'respect', 'can', 'point', 'gun', 'somewhere', 'else', 'then', 'watch', 'actually', 'mouths', 'other', 'actor', 'line', 'Best', 'part', 'movie']",N/A
857123,A3R6FZDOGN1ST1,B00062IXZQ,"guestar57 ""Chris aka Guestar57""","[5, 6]","A new Horror/Western, thank God. This Halloween brings us a treat within a treat, The legend of ""Bloody Bill"" Anderson is true up until today.The first things you notice is the great soundtrack and the film ( camera angles, etc.) itself is engaging. Byron (The Killers) Werner was DP and Director, was trying to nail down has camera-style, very avante garde...MTV2 or NuSkool.The theme is like "" Brigadoon meets Rob Zombie "",or how about ""Gone With The Wind on METH !""...These are close, trust me...I'm a critic for god-sakes.The cast is very good, with few exceptions- Jeremy Bouvet, ""World Martial Arts Champion"" plays the title character BLOODY BILL as a foreboding franchise. Gregory Bastien, steals the show as `a cocaine as a steroid' anti-hero .One of the funniest names in show business, and She pronounces it in `making of...' segment is Denise Boutte ( say BOOTY) and she has ample.Comments would be, DON'T EAT during this film, seriously, You will regret it, makeup rocks ! Some racial slurs and images (Which I will NOT go into) push the envelope of good taste, and YES , I know It's a Zombie Movie, blah-blah. Some of the religious symbolism, was most welcome. Ending was suspenseful and NEW.",5,"Horror Westerns ROCK again ,Thanks TheAsylum !",1130371200,"10 27, 2005",2005,1205,"['new', 'Horror/Western', 'thank', 'God', 'Halloween', 'treat', 'treat', 'legend', 'Bloody', 'Bill', 'Anderson', 'true', 'up', 'today.The', 'first', 'things', 'notice', 'great', 'soundtrack', 'film', 'camera', 'angles', 'etc', 'engaging', 'Byron', 'Killers', 'Werner', 'was', 'DP', 'Director', 'was', 'trying', 'nail', 'down', 'camera-style', 'very', 'avante', 'garde', 'MTV2', 'NuSkool.The', 'theme', 'Brigadoon', 'meets', 'Rob', 'Zombie', 'how', 'Gone', 'Wind', 'METH', 'are', 'close', 'trust', ""'m"", 'critic', 'god-sakes.The', 'cast', 'very', 'good', 'few', 'exceptions-', 'Jeremy', 'Bouvet', 'World', 'Martial', 'Arts', 'Champion', 'title', 'character', 'BLOODY', 'BILL', 'foreboding', 'franchise', 'Gregory', 'Bastien', 'show', 'cocaine', 'steroid', 'anti-hero', '.One', 'funniest', 'names', 'show', 'business', 'making', 'segment', 'Denise', 'Boutte', 'say', 'BOOTY', 'ample.Comments', 'would', 'be', 'DO', ""N'T"", 'EAT', 'film', 'seriously', 'will', 'regret', 'makeup', 'rocks', 'racial', 'slurs', 'images', 'Which', 'will', 'NOT', 'go', 'push', 'envelope', 'good', 'taste', 'YES', 'know', 'Zombie', 'Movie', 'blah-blah', 'religious', 'symbolism', 'was', 'most', 'welcome', 'Ending', 'was', 'suspenseful', 'NEW']",N/A
857124,A2GJDY4P5ZUNRD,B00062IXZQ,Margaret M. helin,"[1, 2]",I ordered for a friend--she wanted it for her grandson.  Her grandson is very happy with it and has watched it more then once!!,5,Death Valley: The Revenge of Bloody Valley,1334534400,"04 16, 2012",2012,127,"['ordered', 'friend', 'wanted', 'grandson', 'grandson', 'very', 'happy', 'watched', 'more', 'then', 'once']",N/A
857125,AFFVUZEGP1FDQ,B00062IXZQ,"Morrigan Alexandros ""The Opinionated Me""","[1, 1]","It's not one of the worst zombie films out there. There are worse (Zombie Nation). The makeup is was ok. Plot: high school student on a road trip to a debate competition get kidnapped by a drug dealer trying to find the money his partner owes him. They enter a town, cursed by Bloody Bill and get chased by zombies. The movie is pretty slow and not that great. There are some inconsistencies, even at the end. Some things are never explained (such as why Bill's sisters is one of the character's look alike). The story further drags on because they have to wait for the one character to tell the story of the town. They keep him alive long enough for him to tell the story. In conclusion, the movie is ok, but it's sort of a waste of time. But, if you are bored, watch it. The soundtrack is not that bad though.",2,Eh...ok,1201996800,"02 3, 2008",2008,811,"['not', 'one', 'worst', 'zombie', 'films', 'out', 'there', 'are', 'worse', 'Zombie', 'Nation', 'makeup', 'was', 'ok', 'Plot', 'high', 'school', 'student', 'road', 'trip', 'debate', 'competition', 'get', 'kidnapped', 'drug', 'dealer', 'trying', 'find', 'money', 'partner', 'enter', 'town', 'cursed', 'Bloody', 'Bill', 'get', 'chased', 'zombies', 'movie', 'pretty', 'slow', 'not', 'great', 'are', 'inconsistencies', 'even', 'end', 'things', 'are', 'never', 'explained', 'such', 'why', 'Bill', 'sisters', 'one', 'character', 'look', 'alike', 'story', 'further', 'have', 'wait', 'one', 'character', 'tell', 'story', 'town', 'keep', 'alive', 'long', 'enough', 'tell', 'story', 'conclusion', 'movie', 'ok', 'sort', 'waste', 'time', 'are', 'bored', 'watch', 'soundtrack', 'not', 'bad']",N/A
857126,A3J8ABVGK7ZL6H,B00062IXZQ,SideshowBob,"[0, 1]","Don't get me wrong.I love a good horror B-movie now and then,but this is WAY past B-movie...more like a ""F-movie""!!! This film should not even exist.It's THAT bad.Terrible acting,storyline,characters,effects...just terrible all together.Don't waste your time or money with this one.It really REALLY sucks....BIG TIME!",1,What the hell is this?,1347753600,"09 16, 2012",2012,317,"['Do', ""n't"", 'get', 'wrong.I', 'love', 'good', 'horror', 'B-movie', 'now', 'then', 'WAY', 'B-movie', 'more', 'F-movie', 'film', 'should', 'not', 'even', 'exist.It', 'THAT', 'bad.Terrible', 'acting', 'storyline', 'characters', 'effects', 'just', 'terrible', 'together.Do', ""n't"", 'waste', 'time', 'money', 'one.It', 'really', 'REALLY', 'sucks', '.BIG', 'TIME']",N/A
