,reviewerID,asin,reviewerName,helpful,reviewText,overall,summary,unixReviewTime,reviewTime,reviewYear,reviewLength,meaningfulWords,Title
1526951,A10HMWOPW4YKFB,B0076YFJ3G,Benjamin Carter,"[0, 0]",This movie reminded me of the Hostel series which is definitely a good thing and it made me squirm in my chair more than a few times. Not your run of the mill horror flick.,4,The doctor is in,1361145600,"02 18, 2013",2013,172,"['movie', 'reminded', 'Hostel', 'series', 'definitely', 'good', 'thing', 'made', 'squirm', 'chair', 'more', 'few', 'times', 'Not', 'run', 'mill', 'horror', 'flick']",Bane: An Experiment In Human Suffering
1526952,A3R6FZDOGN1ST1,B0076YFJ3G,"guestar57 ""Chris aka Guestar57""","[0, 0]","BANE ,Alittle `SAW' & a tad `H P LOVECRAFT' this is a movie with some stuff to Frighten !So these ladies may have been kidnapped,That's pretty bad news.Some medical types are experimenting with/on them...Not good.Is that aCthulhu alien ???So,These factors are unsettling and then they get a `Time To Die' carved into their bodies.There is alot going on and the title BANE was never explained to our satisfaction,Were the producers playing off the release of new BATMAN film with the villian, BANE or is it the explaination of the word -a person or thing that ruins or spoils.",3,Whats your due time ???,1332460800,"03 23, 2012",2012,575,"['BANE', 'Alittle', 'SAW', 'tad', 'H', 'P', 'LOVECRAFT', 'movie', 'stuff', 'Frighten', 'ladies', 'may', 'have', 'been', 'kidnapped', 'pretty', 'bad', 'news.Some', 'medical', 'types', 'are', 'experimenting', 'Not', 'good.Is', 'aCthulhu', 'alien', 'So', 'factors', 'are', 'unsettling', 'then', 'get', 'Time', 'Die', 'carved', 'bodies.There', 'alot', 'going', 'title', 'BANE', 'was', 'never', 'explained', 'satisfaction', 'Were', 'producers', 'playing', 'off', 'release', 'new', 'BATMAN', 'film', 'villian', 'BANE', 'explaination', 'word', '-a', 'person', 'thing', 'spoils']",Bane: An Experiment In Human Suffering
1526953,A2Z2NJMJGVZZRP,B0076YFJ3G,kdeva7,"[0, 0]","Totally creepy!  The Surgeon keeps the suspense in the air, as the women try to solve their dilemma before their time arrives. Saw-style greatness here.  I found myself really into this, I'm pretty sure at one point I was staring at the screen open mouthed for at least 20 minutes straight as I waited for the Surgeon to come kill some poor girl.",4,Creepy!,1368316800,"05 12, 2013",2013,346,"['Totally', 'creepy', 'Surgeon', 'suspense', 'air', 'women', 'try', 'solve', 'dilemma', 'time', 'Saw-style', 'greatness', 'here', 'found', 'really', ""'m"", 'pretty', 'sure', 'one', 'point', 'was', 'staring', 'screen', 'open', 'mouthed', 'least', '20', 'minutes', 'straight', 'waited', 'Surgeon', 'come', 'kill', 'poor', 'girl']",Bane: An Experiment In Human Suffering
1526954,A1HO4BXJ77GEXP,B0076YFJ3G,Meredith Reynolds,"[0, 0]","Totally creepy!  The Surgeon keeps the suspense in the air, as the women try to solve their dilemma before their time arrives. Saw-style greatness here.  I found myself really into this, I'm pretty sure at one point I was staring at the screen open mouthed for at least 20 minutes straight as I waited for the Surgeon to come kill some poor girl.",4,Disturbing!,1363824000,"03 21, 2013",2013,346,"['Totally', 'creepy', 'Surgeon', 'suspense', 'air', 'women', 'try', 'solve', 'dilemma', 'time', 'Saw-style', 'greatness', 'here', 'found', 'really', ""'m"", 'pretty', 'sure', 'one', 'point', 'was', 'staring', 'screen', 'open', 'mouthed', 'least', '20', 'minutes', 'straight', 'waited', 'Surgeon', 'come', 'kill', 'poor', 'girl']",Bane: An Experiment In Human Suffering
1526955,AU0UO0YVA7XTB,B0076YFJ3G,Shane,"[0, 0]",SO creepy!  The plot just keeps unfolding and unfolding and getting more and more creepy until the end where I'll just say I'm sleeping with the light on tonight.  Don't watch this alone unless you really like scary ghost stories and being terrified.,5,shane,1383177600,"10 31, 2013",2013,250,"['SO', 'creepy', 'plot', 'just', 'unfolding', 'unfolding', 'getting', 'more', 'more', 'creepy', 'end', 'where', ""'ll"", 'just', 'say', ""'m"", 'sleeping', 'light', 'tonight', 'Do', ""n't"", 'watch', 'alone', 'really', 'scary', 'ghost', 'stories', 'being', 'terrified']",Bane: An Experiment In Human Suffering
1526956,A2FXKM19I0Y41S,B0076YFJ3G,walter ruether,"[0, 1]","Bane is a vey original Horror film, with a cool story I would recommend this to any horror fan, enough said watch this film it's awesome!",5,Very original Horror Film,1335398400,"04 26, 2012",2012,137,"['Bane', 'vey', 'original', 'Horror', 'film', 'cool', 'story', 'would', 'recommend', 'horror', 'fan', 'enough', 'said', 'watch', 'film', 'awesome']",Bane: An Experiment In Human Suffering
