,overall,asin,reviewText,unixReviewTime,vote,reviewLength,wordLength
1033922,4,6305368201,"""You've Got Mail,"" which was released in 1998, is a lovely romantic comedy/drama involving love, e-mails and running businesses. Meg Ryan plays Kathleen Kelly, the owner of ""Little Shop Around The Corner;"" a small bookstore formerly owned by her mother. The shop is devoted to its customers, kids and likewise. It is a people's bookstore, which is brimming with personality and a friendly atmosphere. One of her customers is a guy named Joe, who happens to have a devastating secret to hide from Kathleen. When Kathleen finds out who he is, they become instant enemies.  Apart from her business life, Kathleen has a steady boyfriend Frank (Greg Kinnear) and sort of a pen pal relationship on the side from someone on the Internet. Kathleen and her mystery man exchange friendly e-mails and seem to connect with one another very well. The question is, should Kathleen meet this guy?

When Joe Fox (Tom Hanks), owner of a brand new super store bookstore, ""Fox Books"" comes around, Kathleen and her ""Little Shop On The Corner"" is threatened to be pushed out of business. Unlike Kathleen's bookstore, ""Fox Books"" has a more big business look rather than the quaint personable feel. Yet, the super store has the books and the business to draw the crowds, and despite Kathleen's efforts to save her bookstore, she has to shut the little shop down. All the while, she has been keeping in contact with her mystery man through the e-mail, telling him of her deepest concerns and feelings, to which he responds with advice and support. Her boyfriend Frank seems to be the kind of workaholic, oblivious kind who doesn't really connect with her as well. So Kathleen feels she has her mystery man to fall back on.

Finally, Kathleen and her mystery e-mail man make plans to meet and that's where the fun begins. Magically, as much as Joe Fox and Kathleen Kelly are rivals, they actually come to enjoy bumping into one another on the street. The truth is, Joe Fox knows something about Kathleen's mystery man that she doesn't, and along the way, she comes to value Joe's helpful ear for her concerns about this special guy on the Internet. However, she does not know that she is completely playing into the hands of a rather humorous game that Joe has been weaving.

Meg Ryan and Tom Hanks. How can you go wrong with these two great stars? They completely turn on the magic in this film with their uncanny knack for humor, sarcasm and drama. You've got two of the best in leading roles. Together, they make this incredible story come to such real life that you are left with a lump in your throat at the end.

The music is wonderful; the sweet wistful rock song, ""Dreams"" from the Cranberries is featured, along with a rather magical version of ""Somewhere Over The Rainbow"" to end the film.

You know, this is mostly my mother's movie. She's usually into the romantic films more than I am, but I thoroughly enjoyed this film. It's not too mushy in any way. It's just a fun, romantic comedy/drama with a unique twist that keeps you watching and watching. Romance sure comes in the oddest ways sometimes. Sometimes it's the person who is in front of your face all the time, sometimes it's the next customer to walk in the store, or sometimes it's when ""you've got mail.""",1174262400,3,3254,4.68006993006993
1033923,5,6305368201,"If there's one thing that America loves besides freedom, it's seeing Tom Hanks and Meg Ryan fall in love.  And (spoiler alert) that is what they do in this film, to the nth degree!

It's totally surprising too, because when this movie starts out, Tom Hanks and Meg Ryan do not love each other.  Nay, they seem to hate each other!  When watching the movie I was like, ""oh boy, Chris.  What the ""H"" is going on?  I thought it was going to be a movie about Tom Hanks and Meg Ryan in love, and yet...""  And then I was like ""Hang on a minute, Chris.  Things are starting to get good.""  And things did get good.

So--as I previously mentioned in a previous paragraph--Tom Hanks and Meg Ryan do not like each other but then...and here's the part you're gonna never believe, but stick with me here: they start chatting with each other on-line and falling in love!  But here's the clincher: the on-line lovers have no idea that they're the same real life people that they hate!  I don't know how these writers come up with these things, but I am a hundred times glad they do!

There are many, many tense action and drama-packed scenes where Tom Hanks types things to Meg Ryan.  There are also, surprisingly, many similar scenes where Meg Ryan types things to Tom Hanks.  It becomes clear that if William Shakespeare or Dr. Zhivago had on-line technology, most of the great romances they wrote would also be about typing, because it's something we can all relate to.

Do I have any criticisms of this heavy-hearted masterpiece?  Just two.  One is there are far too many full-frontal nude scenes for my liking, much as I am a fan of Tom Hanks and Meg Ryan.  And two--my same criticism of any Tom Hanks and Meg Ryan movies: less Joe, more Volcano.",1173916800,2,1735,4.4335443037974684
1033924,5,6305368201,"This film is an updated version of ""The Little Shop Around the Corner"". Meg Ryan and Tom Hanks interact so very well in this movie as they did in Sleepless in Seattle. I really enjoyed this film and would recommend it to anyone. It's funny, romantic and easy to follow. Dabney Coleman and Maureen Stapleton also add to the flavor of the film and support its theme beautifully. A must if you believe in love....",1172880000,,410,4.48
1033925,5,6305368201,I NEVER GET SICK OF WATCHING THIS MOVIE............,1172016000,2,51,5.5
1033926,4,6305368201,"There is no doubt that this is a film which will appeal mostly to women but it is still watchable for the guys out there.

Meg Ryan plays the proprietor of a local bookstore in NYC. Her staff knows its products and are good people. Tom Hanks plays the CEO of a large chain of bookstores with all sorts of amenities like coffee, wide selection and low prices. Everyone knows that the presence of the giant will eventually drive the little guy out of business. This prompts Meg to launch a campaign against the big guy. Her struggle is doomed because, ultimately, the customers like having low prices and lots of choices.

Behind the scenes, both Ryan and Hanks have met each other anonymously in an online chat room and have started to fall in love. As long as things are anonymous, the relationship grows but it too seems doomed once they learn who each other is. Hanks is the first one to learn but he recognizes that he has feelings for Ryan. He then undertakes to clandestinely educate her into thinking that he is not quite an ogre. The end is a foregone conclusion.",1171929600,,1070,4.482051282051282
1033927,5,6305368201,"I adore this movie, is one of my favorites, even when now, for 2007 the technology in it is old. But the magic is there, the romance, the dinamic and the great performance of Tom Hanks and Meg Ryan, who have this sweet chemistry together. Plus, online relationships it is a reality and it is nice to see a story who talk about it in a fun, tender way. If you like romance, I think this DVD must go in your collection.",1170720000,,417,4.097560975609756
1033928,1,6305368201,"This film is truly stupid and insulting. Tom Hanks, stars as a manager of a franchise of a mega book chain who moves into a new part of town. At the same time, he starts a e-mail relationship with Meg Ryan, who owns a small bookstore in the same area. As it happens, Meg Ryan's bookstore is utterly destroyed by Hanks chain, and has to fold up. Yet, when at the end, she learns of his identity, she stills agrees to go out with him! Is she a masochist or something?. This pretends to be a romantic comedy but, believe me, you leave this movie with a very bad taste on your mouth. That's a problem with many American movies that try to be critical of capitalism, but they end up embracing it (case in point: Jerry Maguire). Capitalism is too much in America's DNA for a Hollywood movie to be too critical of it.",1170115200,4,810,4.232258064516129
1033929,5,6305368201,and again and again and again...,1169251200,,32,4.5
1033930,4,6305368201,This was a great movie! Crazy what we will do for love!!!!I recommend this to anyone with a heart!,1169078400,,98,4.2105263157894735
1033971,5,6305368201,"One of my all time favorites. It is a ""pick me up"". Fun to watch the characters work together and find a common ground. I wish more movies where this positive on relationships. Most movies now are showing the negative and hurtful aspects of life. I am not saying all is well in the world but we as humans DO often copy what we see.",1168732800,,331,4.107692307692307
1033972,5,6305368201,"I love this movie, Meg Ryan really shines in this performance, and Tom Hanks is his usual charming and lovable self.",1168560000,,116,4.571428571428571
1033973,5,6305368201,Everything was great.  wonderful movie.  Prompt shipping.  good price.,1168473600,,70,6.555555555555555
1033974,5,6305368201,I seriously can't get enough of this romantic movie. I love it. I even used a song from it for my wedding.,1168473600,,106,3.8636363636363638
1033975,5,6305368201,"One of my favorite chic flicks.  Right up there with ""The Princess Bride"" and ""Pirates"".  Get it, watch it, you'll love it!",1166227200,,123,4.545454545454546
1033976,5,6305368201,"This movie is so full of charm and wit, it's amazing!  Meg Ryan and Tom Hanks are awesome together (again), but the supporting cast is just as wonderful.  There's so much warmth in this movie- if you haven't seen it yet, you're missing out on some really great characters!",1162771200,,272,4.530612244897959
1033977,4,6305368201,Entertaining and fun relationship flick with the outstanding team of Meg Ryan and Tom Hanks.  These two always work great together!,1162598400,,131,5.238095238095238
1033978,5,6305368201,"The duo of Hanks and Ryan was perfect for this story. They found love over the internet.

Just hearing, ""You've got mail,"" when I open my email is exciting.

Sweet story, some romance, some conflict, sadness, the whole thing is a woman's dream. ;o)

So it's a chick flick. So what? It's a good one.

Makes me want to visit New York in the fall and visit my local independent bookstore.",1161907200,,385,4.380281690140845
1033979,5,6305368201,"This is the good side of Hollywood. Wholesome, clean, romantic, and funny. A film one can watch with the entire family without embarrassment. One that couples can watch together, and feel good about relationships. Definitely the type of story for Meg Ryan. Her best work since ""When Harry Met Sally"" without the strong language. And the perfect chemistry with her best leading man Tom Hanks.

Joe Fox and Kathleen Kelly, one of the most feel good couple-connections in screen history. Corny and mushiness aside. Brings ""The Shop Around the Corner"" into the modern computer age. May Nora Ephron continue doing what she does so well. And that soundtrack of previously heard classics, sounds as if composed originally for this film. Especially the memorable Harry Nilsson tunes.",1161907200,8,775,5.150793650793651
1033980,2,6305368201,"First, let me say that by quality film standards this is a terrible movie, in many respects. I live to walk on videos of this type with football cleats. But, this movie falls into the ""I hated this movie so much, I couldn't help but watch it whenever it was on"" category. And now I love it. I don't know what it is about this movie. I tried to put my finger on it many times. I always have and always will hate ""Sleepless in Seattle,"" which is a totally contrived load of crap. But ""You've Got Mail"" has an undefinable charm to it that forces you to look past it's simplified portrayal of a happy go lucky, skip around the neighborhoods of New York atmosphere. It makes you question why you buy into such sappy dialogue and situations. It's not just because of the Meg Ryan and Tom Hanks chemistry, because I hated the despicable ""Sleepless in Seattle"" and always thought the entire premis of ""Joe Versus the Volcanoe"" was a joke. But in this movie, contrived as it may be, that interplay between the two works. Though their acting is also hammy at best, I also love the contributions of Greg Kinnear, Parker Posey, Stephen Zahn and Jean Stapleton. This is one of my guiltiest pleasures. I'll only watch it with the remote on toggle to some type of sports programming in case my friends walk in on me while I'm watching it so I can jump inmmediately to the ""Binford Lumberjack Finals,"" or something like that. But were they to walk in at the end of this movie and find me glossy eyed with a lump in my throat, I'd never hear the end of it. I love this movie. There! I admit it.!",1161216000,6,1578,4.316498316498317
1034021,5,6305368201,I absolutely love this movie. Hanks and Ryan have so much chemistry together and the story is so adorable. I have watched this movie so many times and love it more every time!,1156032000,2,175,4.333333333333333
1034022,5,6305368201,This movie is very entertaining.  I'm not into romance movies and this is not your ordinary romance movie it also contains some comedy.  You just get into the plot and all the characters are interesting and entertaining.  I've recommened this movie to all my family and friends.,1155945600,,278,4.872340425531915
1034023,5,6305368201,"You've Got Mail starring Tom Hanks and the oh so adorable Meg Ryan is their third pairing onscreen and boy the sparks sure do fly brilliantly. In my opinion, Sleepless in Seattle is their best film together but they only have two scenes together in that film so I highly recommend You've Got Mail because their chemistry in this film is amazing. This movie is based on the classic, A Shop Around the Corner starring James Stewart. This verison has that same old-fashioned love story feel but has a modern twist to it, instead of writing letters to each other like the original, Meg and Tom communicate via e-mail and it works! Buy this cute and simple movie today, sweet as can be!",1155081600,,681,4.544715447154472
1034024,4,6305368201,"i like this movie bcoz of the wonderful cast and an interesting storyline,Tom Hanks is undoubtedly one of the finest actor of this era.the film is about our ordinary lives and extrodinary things that makes our life richer and valuable.this movie is highly recommended",1154390400,,267,5.090909090909091
1034025,5,6305368201,"The movie is wonderfully cheesy, cheery, and intellectual. The most random thing is that Dave Chapelle is in it.",1154304000,,112,4.947368421052632
1034026,5,6305368201,"Ephron! Ephron! Nora Ehpron is to film what Star Jones is to talk shows! Ephron takes this conventional, implausible, contrived, absurd, trite, cliched, hackneyed, stale screenplay and takes us on some kind of rollercoaster ride. 'Cause when I was done watching this, my head was dizzy and I felt like I might throw up on my couch.

Ephron's touch is everywhere and reminds me of my cousin's creepy husband's. I would rather cut my thumb off with a toenail clippers than have to watch this again. So, I give it a THUMBS-OFF.",1152489600,2,524,4.695652173913044
1034027,1,6305368201,"One star is too many for this moronic debasement of the great Ernst Lubitsch's exquisite comedy The Shop Around the Corner.  Tom Hanks runs a huge corporation but has endless time to mooch around Meg Ryan, who is constantly showing us how adorable she is (""Don't you think daisies are the friendliest flowers?"").  You've never seen such unconvincing acting as the actors pretending to find the limp, banal lines amusing; even the dog has to help out with a funny face.  Considering the sheepish, exhausted air of the whole thing, it's doubtful Ephron believes in her own (script as well as direction) movie.  Please buy the Lubitsch and see what a difference passion and intelligence make.",1152403200,6,689,4.913793103448276
1034028,5,6305368201,"This movie is just plain cute.  You get to was Hank be Hank and Meg be Meg.  Very funny, cute, and romantic.",1152057600,,108,3.8636363636363638
1034029,5,6305368201,I think this movie is the best romantic comedy.if you meet people on internet and you never know about her/his and then you falling in love with her/his you must watch this movie.,1150416000,,179,4.454545454545454
1034030,5,6305368201,"Meg Ryan is a fantastic performer as much as in When Harry met Sally. It's only from my point of view because I'm not a movie director or a critical.
You've got mail featured an online love affair shared through a modern era of comunications and connecting people....the e-mail.
If you are lucky on a blind date then,you'd meet a right male,otherwise you'd get harzardous worms and perhaps worst... a VIRUS for your whole lifetime!!
A brilliant romantic comedy worth watching.",1148169600,2,476,4.888888888888889
1034071,1,6305368201,"Nora Ephron should be tied to a fencepost and beaten unconscious for making this drek. Look beyond the fact that this movie is one long commercial, no other film has more product placement. The insidious message of the film is the inevitability of corporate domination. Meg Ryan, the small business owner, has her bookstore driven into the ground by Tom Hanks and his Borders type mega-store but all is forgiven in the name of love. I've never known destroying someone's livelihood to be an aphrodisiac. The rest is by the numbers romantic comedy. One star is beyond generous. Trite, shallow, saccharine, completely without merit. Everyone involved should be shot!",1143590400,9,664,5.10091743119266
1034072,5,6305368201,I can't see  this enough!!  I have watched the movie on my portable DVD player about 5 times and I watch it every time it is on the T.V.,1142899200,3,136,3.6551724137931036
1034073,5,6305368201,"I love this film, mostly because Tom Hanks and Meg Ryan are so compatable you'd think they were really in love.  They've done a few films together (Sleepless in Seatle is another great one) but their chemestry has NEVER been better than here, in You've got Mail.  As rival bookstore owners Tom and Meg loathe each other, yet you can tell there is this attraction they can't deny.  The greatest part is that neither knows that the person they are falling in love with over the internet happens to be the same person they can't stand in the real world.  It's great to see the two sides to their relationship, and even though it may have a predictable plot and be a generic comedy, the acting and connection between your two stars takes this a notch above the competition and proves that both Tom and Meg are great stars and brilliant actors.  I loved this film from start to finish and recomend it to any fan of the stars, of the genra or anyone who just wants to feel good while watching a great film.",1141689600,4,1000,4.383783783783784
1034074,5,6305368201,"I am both a fan of the original ""Shop Around the Corner"" and the updated ""You've Got Mail.""

Tom Hanks is the baby boomer's James Stewart and steps into the role originated by Stewart with ease and grace.

Meg Ryan, is, as always, spunky, sweet and has a ""best friend"" quality that comes across on the screen.

Although there is never any doubt about the outcome for the two main characters, it is still enjoyable to take the roller coaster ride to romance along with them.",1140048000,3,473,4.476744186046512
1034075,5,6305368201,"Any New Yorker will appreciate the authenticity of this film, the non-stop energy and pulse of Manhattan that comes shining through from the opening computer generated shot of the entire island and then pinpointing specifically to the neighborhood where the story takes place.  Meg and Tom paired perfectly once again, are two business people; Kathleen Kelly (Meg) owns The Shoppe Around the Corner, a quaint children's book store first owned by her late mother.  Joe F-O-X (Tom) is the mega discount book store guy who basically opens up a huge multi-level retail operation that promptly puts Kathleen out of business.  The contempt they feel for each other is genuine, yet not as brutal as it normally would be if the two were not secretly falling for each other.  Not realizing they've already met in an AOL chatroom, ""NY152"" and ""Shopgirl"" fall head over heels in love.  How they discover who the other one really is, is exactly what makes this movie so much fun to watch.  Add to it the awesome old tunes and fresh takes on classics like Somewhere Over the Rainbow, and you have the perfect pairing of romance and comedy.  There are talented co-stars like Jean Stapleton, Greg Kinnear and Dave Chappelle in the movie as well.  I loved visiting the Upper West Side area where the film was shot.  There is such a wonderful vibe in New York City, but feel-good movies like this make me adore my hometown all the more.",1138060800,5,1419,4.735772357723577
1034076,4,6305368201,"It's a credit to Tom Hanks and Meg Ryan that they can elevate this by the books romantic comedy to more than it deserves.  YOU'VE GOT MAIL reunites the two from SLEEPLESS IN SEATTLE in a remake of THE SHOP AROUND THE CORNER.  He's a corporate bigwig whose Borders-like book store has a new store opening just around the corner from Ryan's homespun Shop Around the Corner.  The focus of the story, however, is on their anonymous relationship via corresponding via e-mails.  They're both in familiar but not permanent relationships:  he with a rather snooty book editor (Parker Posey); she with a bombastic, if charming newsreporter (the delightful Greg Kinnear).  Throw in some more familiar faces: Jean Stapleton as Ryan's mentor and buddy; Dabney Coleman as Hanks's somewhat lecherous father and you have all the ingredients for Nora Ephron's romantic fable.  The ending is predictable but Hanks and Ryan do so well in getting there that you'll find yourself immersed in their inevitable pairing.  Also some fine tunes by Nilsson, including his underappreciated but lovely REMEMBER (CHRISTMAS).  You can do worse.",1130630400,5,1114,5.110497237569061
1034077,4,6305368201,"Although ""You've Got Mail"" has been around for a long time now,I got down to watching it only very recently..and really if you haven't watched it so far - do.

Its light, its funny and its so natural. Tom Hanks and Meg Ryan are chat friends on the internet, each thinks the other to be a completely adorable person.

However, when they meet in real life, its as business rivals. Its a war of the book stores - Meg Ryan's small 'Shop around the corner' which has been around for 42 years since her mother started it is a charming, cosy, place where children love to come and hear stories. Tom Hank opens a new store right across ""The shop around the corner"", the new store is huge, modern and discounted!

Sparks begin to fly between the two...but not forever...the ending is beautiful.

A smoothly flowing charming story, this movie is a must watch.",1127088000,4,849,4.4935064935064934
1034078,5,6305368201,"This is my Favorite romantic comedy. If you like chick flicks it's essential that you watch this one. Flawless acting, great story, and classic romance make this number one in my book. This is a must see!!!",1126396800,,206,4.594594594594595
1034129,5,6305368201,"My wife loves this movie.  Every time it comes on TV, she has to watch it.  So, I bought it for her as part of my wedding anniversary gift for her.  Tom Hanks is true to form in this movie.  He is funny, especially at the coffee bar when he finds out that ""she is beautiful.""  The laugh is quite similar to his laugh in ""The Money Pit"" when the tub falls through the floor.  This is the perfect date/couple movie if you ask me.  This is a must have for all you romantics out there.",1124150400,,481,3.9479166666666665
1034130,4,6305368201,"Tom Hanks and Meg Ryan are our generation's Doris Day and Rock Hudson.  Again and again they make an amazing on-screen couple.  The chemistry between the two of them is remarkable and makes the movie.

In this modern day Sleepless in Seattle, two people have been conversing through email.  They discuss things as simple as butterflies on the subway.  Over numerous emails this couple seems to be perfect for each other.  Meanwhile the people behind their online alias are Joe Fox and Kathleen Kelly.  Two people which are both in the book business and naturally Joe Fox is trying to buy out Kathleen Kelly's bookstore.

The online couple decide to meet in person where Joe Fox finds out it was Kathleen Kelly he was chatting with.  He keeps this secret to himself and continues to converse.  The ending is priceless and will cause all to cry with joy.

This modern day romance movie is a great flix to see with family and even and great date movie.  I recommend this to all ages.",1122854400,2,980,4.601156069364162
1034131,4,6305368201,"You got Mail is a cute love story, but really predictable. i did like it though, Tom and Meg go together really well. The main stiryline is two bookstore owners going head to head and they can't stand each other, but little do they know that they are chatroom friends!! Twisted and sweet. Although, I has to say that it portrayed NYC very unralistically,clean streets, sunlight everywhere. kinda odd, but still good, give it a try",1122249600,,430,4.671052631578948
