,overall,asin,reviewText,unixReviewTime,vote,reviewLength,wordLength
1031192,4,6305368201,"A Romcom classic, not without flaws.  I wrote some of this in response to a scathing review by ""M"" who thought the Kelly character infantile to the point of nausea, and faulted the movie on feminist grounds.  She lambasted Ryan (and Ephron) for Ryan's baby talk and a lot more.  This review contains spoilers.

One thing mentioned by M also annoyed me, Ryan's cringe-worthy boxing act, absurd, in her place of business no less.  But what bothered me more was the non-stop gratuitous music, so patently manipulative, a ""great"" song every two minutes- overkill, that in such large saccharine doses actually undermines the emotional punch of the movie.  And Ephron packing in every ""pearl of wisdom"" that ever occurred to her, SO painful (especially evident in the online chatting). And- isn't life something! Kids and balloons and face painting and goldfish and whiskers on kittens! And aren't these modern times, new technologies something! And WHAT about computers and email? (aren't they SOMETHING!?)  And- Starbucks- complicated coffee orders- aren't THEY something!  And New York- ain't the Big Apple something! There are too many of these excesses jammed into the movie to count or list- TOO MUCH. STOP trying to jerk my chain. How about a little subtlety, PLEASE.  I like to be snuck up on.  When contrivances like these are distractions, instead of  enhancing the plot, Houston, we've got a problem (BTW, if you want to see a MASTER of subtlety and seamlessness, watch&nbsp;<a data-hook=""product-link-linked"" class=""a-link-normal"" href=""/A-New-Leaf/dp/B007R2MJXK/ref=cm_cr_arp_d_rvw_txt?ie=UTF8"">A New Leaf</a>, written, directed by & starring the incomparable Elaine May. And note that it has NO references that date it, could have been made yesterday).

I thought M and other critics were a LITTLE rough on Meg Ryan, though.  Kathleen Kelly owns a store making more than a quarter mill a year, it's fine if she has an accountant- she'd hardly be doing the books herself (critics slammed her for not knowing sales figures off the top of her head). Her specialty is children's books- so presumably she does the buying. She loves childlike things, knows children's books inside and out, decorates the store w/ stuffed animals, dresses like a princess and reads to the kids. She's not the most assertive of women, though tries to be, with Hanks's encouragement. She misses her mother. So she's a bit child-like, that's her character, so what?  Not every woman needs to be a powerhouse, does she? She's vulnerable, a little scared, I don't have a problem with that. Nor with her affecting Hanks, bringing out his nurturing side, humanizing him (though more could have been made of it, we could have seen more of an evolution of Fox from hard-nosed, cynical businessman as he falls in love, becomes ever more enchanted, softened by his penpal).  They improve each other, that's what good relationships do.  I think the premise was good, it was the execution that was flawed. I must admit, though, I LOVE the final scene, where Hanks comes over the rise. The look on Ryan's face is priceless.  That scene alone makes it all worthwhile.

As far as the criticism of Ryan behaving like a little girl, I found the way Ryan LOOKS more irritating than the way she behaves, re: being childish. Ephron went to great lengths to make her LOOK like a 4-year old, completely non-sexual, bizarre.  And yet, regarding sexual relationships, both she and Hanks blithely dump people they've been sleeping with without a second thought (shouldn't that have been handled with a little more finesse, thought?).  At any rate, there's a rather odd juxtaposition between Ryan's seeming naivete and innocence and man of the world lover Greg Kinnear.  It doesn't quite compute.  It might have served the story better if Ryan had been single, or perhaps only casually dating Kinnear.

In a nutshell I found Ephron's heavy-handed and painfully obvious writing/directing a bit hard to take (no SILKWOOD or MICHAEL), but generally I think Ryan did a good job within the slightly stereotypical confines of her character, and Tom Hanks did the splendid job he always does- the two charismatic leads manage to rescue the movie.  On feminist grounds I'd find more fault with sexist or stereotypical aspects of other characters- Joe Fox's father and grandfather, his lascivious step-mother.  And what's up with Parker Posey's character?  She's the only high-powered, successful woman in the film, but she's an utter loon- why?

But- Hanks and Ryan, two of my favorites, are sincere and winsome, their characters appealing, the chemistry between them palpable; best of all, the movie has a GREAT ending; and despite its shortcomings (the CLOYING music most of all), I watch it again and again (THE litmus test, after all)- despite its flaws, it richly deserves Romcom classic status, recommended!",1380844800,,4862,5.11378002528445
1031193,5,6305368201,"Tom Hanks always plays a good part and in this romantic comedy Tom and Meg hit the button, very good",1380844800,,100,4.05
1031194,3,6305368201,"Good times... back in the days of dial-up internet, when technology was a balanced part of our daily life.  Maybe we should go back.",1380844800,,132,4.5
1031195,5,6305368201,"I love this film. It is funny, a good picture of modern life. It is also very human. I bought this DVD to replace an older copy that is no longer working. This is a nicer copy.",1380758400,,176,3.7837837837837838
1031196,5,6305368201,"One of my favorites!  Had it on vhs and wanted dvd.  Haven't watched this dvd yet, but is new so should be good quality.",1380672000,,120,3.9583333333333335
1031197,5,6305368201,"I love this classic movie and never tire of watching it. Tom Hanks and Med Ryan at their best and love supporting actors which include Greg Kinnear , Dave Chappelle, and others.",1380672000,,177,4.5625
1031198,5,6305368201,"I had some trouble with timing and syncing when I watched my Amazon movies on my PC, however, watching through Roku solved that problems and all films are perfect. ""you've Got Mail"" is a classic chick flick so I was relieved to solve technical problems. There is nothing better than Tom Hanks and Meg Ryan together.",1380672000,,315,4.642857142857143
1031239,5,6305368201,This is one of Meg Ryan's and Tom Hanks' best movies. Wish they'd made a part II. Hey-there's a thought.,1380672000,,104,4.25
1031240,5,6305368201,I watch it often. A text book on human relationships served with the memorable joy of finally learning what really counts in life. I think I will go watch it for another good time.,1380499200,,180,4.323529411764706
1031241,5,6305368201,One of my top 5 movies.  We need more movies like this one!  Very Clean and great conversations and music,1380499200,,105,4.2
1031242,5,6305368201,"It's not the most original nor the greatest story; however Hanks & Ryan are terrific actors and their chemistry after all their collaborations is spot on.  They portray the characters well and there's enough interest in the supporting characters to enjoy the movie from start to finish.

Romantic comedies are slowly being replaced with more raunchy options, gory, and action flicks.  This is one that in no way is perfect, but sweet story that's easy to like.",1380412800,,460,4.9480519480519485
1031243,5,6305368201,I loved this movie. Have watched it many times and enjoy each time. All the actors and actresses are great .,1380412800,,108,4.190476190476191
1031244,5,6305368201,"I've seen it several times and will again, I'm sure. I love the story and the music. The HD was great!",1380326400,,102,3.9047619047619047
1031245,5,6305368201,"and it has been a long time ago and I forgot lots of it.
love Meg Ryan.
neat story and cute.",1380240000,,92,3.4285714285714284
1031246,4,6305368201,"It's a good ""chick movie"".  I've seen it dozens of times and now I look at the scenes to see how they are laid out.  I will watch it again I'm sure.",1380240000,,148,3.59375
1031247,5,6305368201,Classic movie. Great romance. Tom Hanks andMeg Ryan are great in this movie together. This is a definitely a movie you can watch again and again!,1380153600,,145,4.615384615384615
1031248,5,6305368201,Meg Ryan is everything we'd like to be.  Tom Hanks is nice too.  This movie brings back memories... who can forget the sound of signing on to the internet by dial up.  Really good dialogue and there's a happy ending.  I rest my case.,1380067200,,233,4.2272727272727275
1031298,5,6305368201,This is the movie we watch when we want to relax and be reminded of good times we have shared over the years.,1380067200,,109,3.782608695652174
1031299,5,6305368201,This might be one of my favorite movies of all time.  If you have not seen it you must.  I can watch this almost any time.,1379980800,2,122,3.6538461538461537
1031300,5,6305368201,"I love this movie because it reminds me that there is always someone out there for everyone and not to give up on the dream of love.  cheesy, but true.  enjoy!",1379980800,2,159,4.096774193548387
1031301,5,6305368201,One of the all time greats! Tom Hanks and Meg Ryan are awesome actors! Movie is both funny and a tearjerker! Love it!,1379980800,,117,4.130434782608695
1031302,4,6305368201,Always loved this movie was a big Sleepless in Seattle fan so this was right up my alley. Great Chemistry between Meg and Tom,1379808000,,125,4.25
1031303,5,6305368201,The one the best feel good movies!  The combination of two of the best actors/actress around. A true classic worth watching multiple times.,1379808000,,139,5.043478260869565
1031304,5,6305368201,"This is my favorite romantic comedy. Of course, it helps that it was written and directed by Nora Ephron.  Tom Hanks and Meg Ryan are delicious together.  The plot is fun.  Dialogue is smart and funny.  What's not to like in this romantic comedy?  It has everything.  More than 5 stars.  I can watch it every year.",1379721600,,314,4.4035087719298245
1031305,4,6305368201,"Cute movie.  Acting was superb as one would expect from Meg and Tom.  Good clean movies are hard to find these days, so this one stands out.",1379721600,,140,4.148148148148148
1031306,4,6305368201,Good movie for a quiet night.  It's funny how you don't miss the cursing or explosions. Hollywood doesn't get that folks still like movies like this one.,1379721600,,153,4.666666666666667
1031327,5,6305368201,"In the days before e mail was on your phone, your home computer was king. Its a fun movie and very predictable love story. but its still a lot of fun.",1379635200,,150,3.870967741935484
1031328,5,6305368201,"I could watch this movie every day! Meg Ryan and Tom Hanks have so much chemistry on the screen. Even though it's a fictional story of two fictional characters, their excellent acting make you believe in love! But don't take my word for it, watch it and come to your own conclusions!",1379635200,,283,4.461538461538462
1031329,4,6305368201,How could you not enjoy Tom And Meg involved classic story.  Tom at the funniest and Meg at her vulnerable best.  Funny moments with a happy ending.  Even the dog gets involved.,1379548800,,177,4.46875
1031330,4,6305368201,I saw this movie many years ago.  Tom Hanks and Meg Ryan are 2 favorites of mine.  Guy and girl get together despite differences is a good story line,1379462400,,149,4.103448275862069
1031331,5,6305368201,"Great movie for those who enjoy the ""chick-flick"" genre ... watch it with my daughter every time. Its predictable, but that suits me just fine.",1379462400,,143,4.76
1031332,4,6305368201,"This is my first movie to watch on Amazons instant video stream and it is super easy. I've always loved Meg Ryan's films which typically characterize a humorous, sincere, yet innocent lady searching for love. It's heart warming.",1379462400,,228,5.026315789473684
1031333,5,6305368201,One of the best romantic comedies....without unneeded drama. It's a smart movie with great cast of actors. Enjoy this movie over and over again.,1379462400,,144,5.041666666666667
1031334,5,6305368201,"Love this movie!  I love the simple life of bookstore owner Kathleen Kelly and how her relationship with Joe Fox takes a sort of twist and turn to the end.  Love the holiday scenes. It's just a great ""feel good"" movie.  I watch it at least once a year!  Meg's best movie if you ask me and who doesn't love Tom Hanks?!!!",1379462400,,319,4.096774193548387
1031335,5,6305368201,"A very sweet movie of finding romance in the unusual place and with someone you thought you disliked.  The actor and actress performed very well together, they also stared in Sleepless in Seattle together.",1379376000,,205,5.029411764705882
1031336,4,6305368201,"Cute and entertaining in an old world meets new world way of thinking.  A great movie to go back to watch to show that know matter how far we come, there is always a romantic pull to the past.",1379376000,,192,3.923076923076923
1031357,4,6305368201,"I enjoyed the movie. It was a cute romantic comedy, albeit predictable plot twists at certain points, but nonetheless it was still interesting. As a side note, I loved watching the characters connect to AOL, it reminded me of the old days of dial up connections.",1379289600,,262,4.717391304347826
1031358,5,6305368201,I love it It's such a sweet movie so well written makes me laugh and cry each time I watch it no joke!,1379203200,,102,3.4782608695652173
1031359,5,6305368201,"Tom Hanks and Meg Ryan are at their very best in this movie. The two are superb as strangers e-mailing
each other Not knowing they will eventually fall in love. I've seen this movie many times.
Probably more of a chick flick, however I have gotten my husband to watch it with me.",1379203200,,279,4.283018867924528
1031360,5,6305368201,Who doesn't love a great love story.  This is just perfect.  Tom Hanks and Meg Ryan were such perfect choices for these roles.  Highly recommended.,1379203200,,147,4.8
1031361,5,6305368201,This a great movie.  I recommend it for a good date night movie at home.  A good movie to watch with the person you love!,1379116800,,121,3.8
1031362,5,6305368201,These two are just great together and this movie proves that they are a winning combination.  I never tire of watching their movies.,1379116800,,132,4.739130434782608
1031363,5,6305368201,"One of my all time favorite stories, updated with two of my favorite stars, with a great score besides that",1379116800,,107,4.4
1031364,4,6305368201,just clicked on it and didn't see it watch it.  it was a good movie when first seen. what else.,1379116800,,95,3.75
1031365,5,6305368201,I love this movie - it ranks up there with my top 5.  It's a fun romantic comedy and will put a smile on your face as you watch it.  My sister and I like to quote the elevator scene.,1379116800,,182,3.525
1031366,5,6305368201,I own it on DVD but still watched it on Amazon Prime. This is such a sweet movie. It's nice to see Meg Ryan again all cute and sweet before all the bad plastic surgery. See was such an amazing actress.,1379030400,,201,3.926829268292683
1031411,5,6305368201,"Love this version even more than the earlier film starring James Stewart called The Shop Around the Corner.  Great story, dialogue, comedy, music, and stars we love.  Watch it!  You won't be disappointed, especially the touching ending.",1379030400,,236,5.324324324324325
1031412,5,6305368201,One of my all time favorites that I usually watch yearly.  Fun movie and I really need to get around to watching the original.,1379030400,,126,4.25
1031413,5,6305368201,"Got to this just by the name of Tom Hank and Meg Ryan, but it turns out to be a very interesting movie to me",1378857600,,108,3.36
1031414,5,6305368201,"How could you ever get tired of watching these two?  Well I've watched this movie several times already and suspect I'll watch it several times more!  If you like a sweet, happy ending this is a good one for you.",1378771200,,212,4.275
1031415,2,6305368201,"This would have been a cute story, but there was too much suggestive stuff and bad language in it for me to really enjoy it. Def. don't endorse it and won't be watching it again.",1378771200,,178,4.114285714285714
1031416,5,6305368201,It is fun to watch a non-viloent movie. Good combination of actors  and a positive way to deal with relationship challenges.,1378771200,,124,4.904761904761905
1031417,5,6305368201,I could watch this movie everyday. Its one of my all time favorites. I definitely a fun movie to watch!,1378598400,,103,4.2
1031418,5,6305368201,It came in great condition and on time. It is a wonderful story that will capture your hearts every time with it's wonderful cast and love story.,1378598400,,145,4.407407407407407
1031419,5,6305368201,I'm a sucker for love stories and I love this one.  Chemistry works with Tom Hanks & Meg Ryan which is no secret,1378598400,,112,3.869565217391304
1031420,5,6305368201,"Love this movie. Played without a hitch; I had no issues when watching this movie. And if you haven't watched, it is a classic.",1378512000,,127,4.333333333333333
1031471,5,6305368201,One of my favorite movies!! Glad it made it to Prime!! Love Tom hanks and Meg Ryan they make a great team!!,1378512000,,107,3.909090909090909
1031472,5,6305368201,the silly humor shown from time to time between the characters .  how the love and respect  grows between the lead stars.,1378425600,,121,4.454545454545454
1031473,5,6305368201,"I adore this movie. It's a sweet story with a wonderful soundtrack and perfect casting. It's a must see, again and again.",1378425600,,121,4.545454545454546
1031474,5,6305368201,"Have you ever met anyone who fills your heart with joy?

 I also love the scene when Meg Ryan remembers her mother. I have watched this movie countless times and will watch it MANY more times.",1378339200,,192,4.305555555555555
1031475,5,6305368201,I love to watch this movie when I want to chill and be happy. Tom Hanks is the man you want to find.,1378339200,,100,3.391304347826087
1031476,4,6305368201,"This is an old movie, and I had never seen it. It was refreshing to see a romantic comedy without  being overwhelmed with sex scenes.",1378339200,,133,4.32
1031477,5,6305368201,"It is a new cult classic. I bought it for my sister, we enjoy it every time we watch it, excellent music as well...",1378252800,,115,3.8333333333333335
1031478,5,6305368201,"I can't remember when I ordered this any more than I can remember how many times I have watched it, but it's a movie worth watching and re-watching.",1378252800,,148,4.321428571428571
1031479,5,6305368201,I love this film just as much now as when it first came out.  I was happy to see that it was offered on Kindle when I needed to kill some time while traveling.,1378252800,,159,3.676470588235294
1031480,5,6305368201,"As a child, I would beg to rent this movie over and over. Now as an adult, this movie is one of the most watched in my collection. Although the technology showcased in the movie is obviously outdated, the story is not. The chemistry between Meg Ryan and Tom Hanks is great, and the characters they portray realistic. Overall a great romantic comedy!",1378080000,,349,4.555555555555555
1031500,5,6305368201,"These two have good ""on screen"" chemistry...The storyline is semtimental and well thought out...very enjoyable to watch these two interact...",1378080000,,141,6.1
1031501,5,6305368201,"They, as a team, are great together. I need a chic movie every once in a while. This is the one I reach for most",1377907200,,112,3.52
1031502,5,6305368201,One of my favorite romcoms. Funny how dated technology is but that brings a nostalgic aspect to it. Great performances. You really see the connection with Hanks and Ryan. The ending still gets me every time.,1377734400,,207,4.777777777777778
1031503,5,6305368201,"Of all times!  Witty, intelligent, and complex dialogue.  Fantastic acting and staging.  Could watch this again and again and find something new in it.",1377561600,,151,5.208333333333333
1031504,5,6305368201,"I grew up watching this movie whenever I was sick or sad, it just has all the right qualities to lift my day. So I had to get my own copy for when I move out. When I'm homesick this will me my go-to movie to feel better.",1377561600,,220,3.6041666666666665
1031505,5,6305368201,"I love this movie, such nice acting and a cute story, the deluxe edition is great, both my husband and I are big fans.",1377475200,,118,3.9583333333333335
1031506,5,6305368201,"This is the sort of fun romantic comedy that I really miss. Tom Hanks and Meg Ryan have energy and play well off of each other, and it's the perfect sort of 'feel good' movie that I need sometimes.",1377388800,,197,4.076923076923077
1031507,5,6305368201,"I bought this movie for for my sister. It is one of her favorites. The added bonus I got a 24 hour digital rental. The movie is directed by the late Nora Ephron, her last film was Julie and Julia, My absolute favorite.",1377388800,,218,4.093023255813954
1031508,5,6305368201,Such a cute movie! I'd watch it over and over again! Definitely one of my new favorites movies. I highly recommend it,1377216000,,117,4.363636363636363
1031509,5,6305368201,It's my favorite movie and has been since it came out in the theaters. It's a must have for your movie collection.,1376784000,,114,4.2272727272727275
1031550,5,6305368201,"THIS IS THE BEST MOVIE OF LOVE I NEVER SEE IN MY LIFE I SEEE TWICE TIME BECAUSE IS REALLY VERY AWESOME. I LOVED AND WAHTEVER PERSON SLEEP ONE DAY FIND SOMEBODY LIKE THI IS GREAT.

THANK YOU SO MUCH
GOD BLESS YOU
MAGGIE",1376784000,,218,3.9545454545454546
1031551,2,6305368201,"Several years ago, my girlfriend drug me, my best friend, and his girlfriend to see (maybe ""endure"" is perhaps a more...honest verb there) the group ""Rush.""  HORRIBLE! I mention that fact merely because after every song (mercifully) ended, Kent asked me, probably in all seriousness, ""didn't they just DO that song?""  As I said, I make mention of Kent's ""appraisal"" of the dreadful music we were enduring because:  I mean, c'mon now - wasn't this same movie called ""Sleepless In Seattle"" not all that long ago?",1376611200,,510,4.906976744186046
1031552,5,6305368201,"Very cute and funny. It is a defintie RomCom, but still good. Hanks and Ryan still have this chemistry that makes you root for them.",1376179200,,132,4.32
1031553,5,6305368201,LOVE THIS MOVIE. Hanks and Ryan are great together. Good supporting cast. Have not watched the special features as of yet,1375747200,,121,4.809523809523809
1031554,5,6305368201,I have seen this movie so many times....and it never gets old.  Love Tom Hanks and Meg Ryan in it...,1375660800,,100,4.0
1031555,5,6305368201,I have seen this movie so many times since it came out back in 1998. It has since become a favorite of mine. I absolutely love the chemistry between Tom Hanks and Meg Ryan. Truly inspiring! I highly recommended this movie as well as Sleepless in Seattle and Kate and Leopold.,1375574400,,275,4.411764705882353
1031556,5,6305368201,"What more can I say. They had great chemistry on screen, and this is by far one of my ""in the moment"" chick flicks.",1375228800,,115,3.8333333333333335
1031557,5,6305368201,"A good romantic movie. Love Tom Hanks and Meg Ryan. Have seen many times on TV, had the movie, but gave to my daughter. I missed not having it to see again. Highly recommend.",1375142400,,174,4.147058823529412
1031558,5,6305368201,Great Movie--I do have original which I have played over and over. The Blu-ray is so much clearer and brighter. I love it,1375056000,,121,4.304347826086956
1031559,5,6305368201,"I like how the relationship grew, instead of two people just hopping into bed and trying it out like so many do today.",1374883200,,118,4.173913043478261
1031598,5,6305368201,Tom Hanks & Meg Ryan is this updated modern fairy tale romance without the other knowing who they are talking (e-mailing) to and hating each other when they meet until the happy ending.  You will just have to watch for all the heartwarming details.,1374796800,,248,4.636363636363637
1031599,5,6305368201,"I'LL BE SHORT. this is a beautiful movie which I've seen numerous times so I thought why not shout yourself a blu ray copy.
I haven't viewed yet but the movie can only look better, love story with tom and meg (remember sleepless) they just played the role
so well (copy I purchased came with little shop on dvd) Christmas book shop, falling in love, and ending up in each others arms.
what more is there a. REALLY beautiful movie. if you like either star this is for you GO buy .the  cuz",1374710400,,487,4.236559139784946
1031600,5,6305368201,My all time favorite movie for when I'm alone. I love Meg Ryan and Tom Hanks. It gives me something to watch in a hotel room when the streaming tanks!,1374710400,,150,4.033333333333333
1031601,5,6305368201,"This has got to be one of the best romantic comedies of all time, if you even want to put it in that category. It is just a great movie. I am not sure why Tom Hanks and Meg Ryan are allowed to do movies separately- at least Meg Ryan shouldn't do them without Tom...Have watched it at least 5 times and I am sure I will watch it many more times. So glad it's in Prime!",1374537600,,367,3.779220779220779
1031602,3,6305368201,"I always liked Meg in her movies, every since TOP GUN. Tom is also one of my choice actors to watch.",1374364800,,100,3.8095238095238093
1031603,5,6305368201,Meg Ryan and Tom Hanks at their best. This movie is a cute and classic romantic movie. A must for every girls collection.,1374364800,,121,4.304347826086956
1031604,5,6305368201,"I can watch You've Got Mail over and over again. To me this is a new classic. Plus, it's Tom Hanks and Meg Ryan.",1374192000,,112,3.7083333333333335
1031605,5,6305368201,It was so precious and they kept you guessing?  would they ever meet?  also loved the parts where Pride and Prejudice was brought in thru out...another of my favorites :),1374105600,,170,4.633333333333334
