,overall,asin,reviewText,unixReviewTime,vote,reviewLength,wordLength
1026153,5,6305368201,One of my favorites!!  I watch it over and over!!,1454371200,,49,3.9
1026154,5,6305368201,I like this movie. Was a good one. Was a gift and the enjoyed it as well.,1454371200,,73,3.3529411764705883
1026155,5,6305368201,probably one of my all time favorites. love this movie.,1454284800,,55,4.6
1026156,5,6305368201,always such a cute movie.  =),1454284800,,29,3.8333333333333335
1026157,5,6305368201,lovable movie,1454284800,,13,6.0
1026218,5,6305368201,A great movie to watch on those nights when TV gives you the craps,1454198400,,66,3.7857142857142856
1026219,5,6305368201,A Classic!!!,1454025600,,12,5.5
1026220,5,6305368201,Always good,1453939200,,11,5.0
1026221,5,6305368201,Love this movie!!,1453939200,,17,5.0
1026222,5,6305368201,Two greats together again. Tom Hanks and Meg Ryan are joyful together!,1453852800,,70,4.916666666666667
1026223,5,6305368201,Great Movie,1453852800,,11,5.0
1026224,5,6305368201,A well written old romantic standard about email dating then versus what it has become today on the  Internet.,1453766400,,110,4.7894736842105265
1026225,5,6305368201,Sweet.,1453766400,,6,6.0
1026226,5,6305368201,Great quality and timely arrival. Very pleased with this purchase.,1453593600,,66,5.7
1026227,5,6305368201,Great,1453334400,,5,5.0
1026271,5,6305368201,Very nice,1453248000,,9,4.0
1026272,5,6305368201,Classic movie the Wife just loves,1453248000,,33,4.666666666666667
1026273,5,6305368201,Great light hearted movie. I've seen it times before but when nothing was on went to Amazon and was looking for something light and funny. I'm a fan of Tom Hanks working with Meg Ryan so it's a good movie and not a real 'chic' flick as some may think. Good humor.,1453248000,,263,4.076923076923077
1026274,5,6305368201,Awesome movie.,1452988800,,14,6.5
1026275,5,6305368201,My favorite,1452988800,,11,5.0
1026276,5,6305368201,DVD arrived in good shape and works like a DVD is supposed to work.  Also a great iconic movie.,1452816000,,95,4.0
1026277,5,6305368201,Recipient loved it.,1452643200,,19,5.666666666666667
1026278,5,6305368201,one of my favorites,1452643200,,19,4.0
1026279,5,6305368201,"This is my absolute favorite movie, so I was excited to add it to my collection. The case was a little cheap, but that's not why I bought it. The disc was in perfect working order, and I enjoy my DVD often!",1452297600,,206,3.9285714285714284
1026280,1,6305368201,"I received this movie today.  Its one of my favorites.....however, this dvd was a bootleg and not very clear.  When it was playing I noticed a big purple stamp on the back that said, Made In Mexico.  Yep, its a bootleg. It should be advertised as such.  I will not order from them again.  I also ordered the cd soundtrac, its also a bootleg and toy story cd.  Bootlegs........",1452124800,3,376,4.3768115942028984
1026351,5,6305368201,"Great movie, and I love streaming movies and being able to watch it over and over is great!",1451347200,,91,4.111111111111111
1026352,5,6305368201,"It's Tom Hanks and Meg Ryan, what's not to love? :) Great simple love story to make you feel good on a quiet night at home.",1451347200,,123,3.769230769230769
1026353,5,6305368201,"I love this movie when I am in a sappy mood. Predictable, but still a feel good movie that lifts you up and gives you hope of finding true love if you are single.",1451174400,,162,3.7941176470588234
1026354,5,6305368201,"LOVE, always good!  Wanted my daughter to see it!  :)",1451174400,,53,4.2
1026355,5,6305368201,"One of my all time favorite movies. Of course the humor and the romance - and that it is a ""remake"" of sorts of The Shop Around the Corner doesn't hurt - but it is also because I've run a small business most of my adult life. The lines in this movie about small business and life just resonate strongly with me. Nora Ephron's script and direction are wonderful.",1451088000,,361,4.246376811594203
1026356,5,6305368201,always a favorite,1451088000,,17,5.0
1026357,5,6305368201,Nice movie night,1450569600,,16,4.666666666666667
1026358,4,6305368201,This is a classic movie  and  like Sleepless in Seattle - it great to see over and over.,1450569600,,88,3.8333333333333335
1026359,5,6305368201,One of the best movies ever!,1450224000,,28,3.8333333333333335
1026360,5,6305368201,how can you not love this movie,1450137600,,31,3.5714285714285716
1026416,5,6305368201,Funny movie,1449964800,,11,5.0
1026417,5,6305368201,I love this movie everything about it is perfect. I have watched over and over again,1449100800,,84,4.3125
1026418,5,6305368201,excellent movie,1449100800,,15,7.0
1026419,5,6305368201,"You've Got Mail in my opinion is one of the greatest rom - com's ever made.  Tom Hanks and Meg Ryan have a great chemistry on screen that really draws you in and makes you believe that they are in love.  I have seen this movie countless number of times over the years, and no matter that I know how the movie is going to end, it always brings tears of happiness to my face.",1449100800,2,373,3.96
1026420,4,6305368201,"I love this movie! Great acting, funny, and cute.",1449100800,,49,4.555555555555555
1026421,5,6305368201,This is one of my favorite fall movies! I love it,1449100800,,49,3.5454545454545454
1026422,5,6305368201,CLasic,1449100800,,6,6.0
1026423,5,6305368201,Time to watch this again!,1449100800,,25,4.2
1026424,5,6305368201,Was a gift and she loved it.,1449014400,,28,3.142857142857143
1026425,5,6305368201,"Absolutely wonderful romantic comedy!  I'd recommend this DVD to anyone & it's acceptable family entertainment.  Besides, who doesn't enjoy a good love story?",1449014400,,158,5.826086956521739
1026476,5,6305368201,"I love this movie and Meg and Tom succeed once again in bringing
a wonderful story to life. :)",1448928000,,94,4.0
1026477,5,6305368201,Serious chick flick but enjoyable...,1448755200,,36,6.4
1026478,5,6305368201,Perfect for a rainy afternoon on the sofa,1448755200,,41,4.25
1026479,5,6305368201,"A Great movie.  A good story, cast well and enjoyable.",1448668800,,54,4.4
1026480,5,6305368201,Love renting movies from amazon.,1448582400,,32,5.6
1026481,5,6305368201,I absolutely love this movie!!,1448409600,,30,5.2
1026482,5,6305368201,"This is, objectively, the single greatest chick flick of all time. When Harry Met Sally takes a close second. If I had to pick one movie to watch on an endless loop for ten years straight, this would be the movie. I love you, Tom. I love you, Meg.",1448323200,,247,4.061224489795919
1026483,5,6305368201,One of the best movies ever!,1448236800,,28,3.8333333333333335
1026484,4,6305368201,One of our romantic movie favorites. I this the movie is well paced with great character development. Meg Ryan and Tom Hanks interactions in this movie are numerous and playful at times but sometime contentious resulting to great movie dynamic and a little suspense. Fun and enjoyable movie to watch.,1448150400,,300,5.02
1026485,5,6305368201,Always great!,1448064000,,13,6.0
1026537,5,6305368201,My favorite movie,1447891200,,17,5.0
1026538,5,6305368201,This is classic!  So sweet and pure entertainment.,1447891200,,50,5.25
1026539,5,6305368201,A++++,1447804800,,5,5.0
1026540,5,6305368201,great movie,1447459200,,11,5.0
1026541,5,6305368201,Wonderful Story line with Top Class Acting,1447372800,,42,5.142857142857143
1026542,5,6305368201,"THE BEST MOVIE OF ALL TIME. If you find yourself needing to feel enchanted, entertained, humored, and touched, please watch this for your own good.",1447372800,,147,4.92
1026543,5,6305368201,Nice CD.,1447372800,,8,3.5
1026544,5,6305368201,"What can I say...! Classic, funny,romantic... I never tire of this movie!",1446854400,,73,5.166666666666667
1026545,5,6305368201,Can't watch it. It's blue ray!!!,1446681600,,32,4.5
1026546,5,6305368201,good,1446681600,,4,4.0
1026577,5,6305368201,Always a great stand in when you have no other plans.  I never get tired of this movie,1446595200,,86,3.7777777777777777
1026578,4,6305368201,Really like Tom Hanks and Meg Ryan's acting. See Sleepless in Seattle.,1446422400,,70,4.916666666666667
1026579,5,6305368201,It's my favorite chick flick! I get in the mood to watch it every fall! Meg Ryan and Tom Hanks have such great chemistry.,1446422400,,121,4.083333333333333
1026580,4,6305368201,Great feel good movie for any occasion. It's always better when you let the heart win,1446336000,,85,4.375
1026581,5,6305368201,I can practically recite this whole movie. I love the children's books references and the Godfather references and bouquets of sharpened pencils.,1446336000,,145,5.636363636363637
1026582,5,6305368201,Tom and Meg are perfect!,1446336000,,24,4.0
1026583,5,6305368201,Tom and Meg. Can't miss.,1446249600,,24,4.0
1026584,5,6305368201,Saw this movie when it was released several years ago. It was nice to watch a feel good movie instead of all the violence on TV.,1446163200,,128,3.9615384615384617
1026585,5,6305368201,Still one of my favorite holiday movies!,1446163200,,40,4.857142857142857
1026586,4,6305368201,"chick flick.... :)  liked it, though",1446076800,,36,5.0
1026627,5,6305368201,All wonderful!,1445990400,,14,6.5
1026628,5,6305368201,"Wonderful romantic comedy....especially good ""chick flick""",1445904000,,58,8.833333333333334
1026629,5,6305368201,Great packaging and brand new as advertised. Glad to have this movie in my library. Thanks for the fast shipping!,1445644800,,113,4.7
1026630,1,6305368201,i was disappointed when played the movie it only showed the pre items before the movie and wouldnt show the actual movie i tried it on other players and it wouldnt show the movie would like to get a replacement if i could so i could not place a review at this time,1445644800,,264,4.0
1026631,5,6305368201,Excellent across the board,1445558400,,26,5.75
1026632,5,6305368201,Best Movie Ever!,1445385600,,16,4.666666666666667
1026633,5,6305368201,Very good.,1445299200,,10,4.5
1026634,5,6305368201,There is nothing like love with a backdrop of New York City,1445299200,,59,4.0
1026635,5,6305368201,"Excellent feel good movie, my wife used to watch this movie everyday for a month.",1445212800,,81,4.466666666666667
1026636,4,6305368201,Good movie :),1444867200,,13,3.6666666666666665
1026687,5,6305368201,thanks,1444694400,,6,6.0
1026688,4,6305368201,"Loved the movie. Had to buy a copy for my ""vault.""",1444521600,,50,3.6363636363636362
1026689,4,6305368201,I like this movie.,1444348800,,18,3.75
1026690,5,6305368201,"This movie hits all the notes. It's funny and charming without ever being too ""mushy.""",1444348800,,86,4.8
1026691,4,6305368201,Have liked the movie for a long time looked on amazon and it was there,1444262400,,70,3.7333333333333334
1026692,5,6305368201,Good for any age.,1444262400,,17,3.5
1026693,5,6305368201,Lovely,1444176000,,6,6.0
1026694,1,6305368201,Should have been Chinese dubbed..wasn't...I already had this normal dvd,1444176000,,71,6.2
1026695,1,6305368201,I was not able to view the movie because it could not be delivered.,1444176000,,67,3.857142857142857
1026696,5,6305368201,Great movie one of my favorites,1444176000,,31,4.333333333333333
1026747,5,6305368201,"The movie was good,  I just didn't like what was being said was printed out.",1444176000,,76,4.066666666666666
1026748,5,6305368201,"A delightful movie, no matter how many times I watch it.",1444176000,,56,4.181818181818182
1026749,5,6305368201,I Love this movie!,1444089600,,18,3.75
1026750,5,6305368201,Great movie.,1444003200,,12,5.5
1026751,5,6305368201,"The Blu-Ray includes some awesome special features and looks great. One of the cooler special features for me is the ""music"" option to listen through the entire movie with just the background music/score. Super glad I purchased it!",1443571200,,231,5.105263157894737
1026752,5,6305368201,Great movie,1443484800,,11,5.0
1026753,4,6305368201,Accomplished its goals,1443139200,,22,6.666666666666667
1026754,5,6305368201,"very good, exactly as shown on line",1442966400,,35,4.142857142857143
1026755,5,6305368201,this was a gift.,1442793600,,16,3.25
1026756,5,6305368201,great condition,1442620800,,15,7.0
1026802,2,6305368201,"I love the movie, but the dvd case was broken so much so that it won't hold the DVD. Happy I have the DVD now, but I need to find a new case for it. Sad day!",1442534400,,157,3.27027027027027
1026803,5,6305368201,Everything looked and worked great Thank you,1442275200,,44,5.428571428571429
1026804,5,6305368201,"Has always been my favorite. But since working in New York and living in the Upper West Side, I've been to many of the places in the movie and I especially love it now!!!",1442275200,,170,4.029411764705882
1026805,5,6305368201,great,1442275200,,5,5.0
1026806,5,6305368201,An oldie but goodie. I wanted my grandchildren to see it. They enjoyed it too.,1442102400,,78,4.266666666666667
1026807,5,6305368201,Product as described,1442016000,,20,6.0
1026808,5,6305368201,I still love this movie!,1442016000,,24,4.0
1026809,5,6305368201,A classic love story that I never get tired of watching!,1441497600,,56,4.181818181818182
1026810,5,6305368201,Is absolutely current as many small businesses would be in this situation.,1441152000,,74,5.25
1026811,5,6305368201,My wife's favorite movie...uh excuse me our favorite movie.,1440892800,,59,5.666666666666667
1026861,5,6305368201,"Great movie, great HD quality",1440892800,,29,5.0
1026862,5,6305368201,BEST MOVIE EVER.,1440892800,,16,4.666666666666667
1026863,5,6305368201,I love this movie. Jolae,1440720000,,24,4.0
1026864,5,6305368201,I have seen it five times!,1440720000,,26,3.5
1026865,5,6305368201,My favorite movie.  The Deluxe Edition is a treat to have for someone who loves the movie.,1440633600,,90,4.294117647058823
1026866,5,6305368201,One of my all time favorite love stories. Meg Ryan and Tom Hanks were just wonderful and I always seem to cry. Lol.,1440633600,,115,4.043478260869565
1026867,5,6305368201,One of my faves,1440547200,,15,3.0
1026868,5,6305368201,This movie is fantastic!,1440547200,,24,5.25
1026869,5,6305368201,One of an all time fav.,1440374400,,23,3.0
1026870,5,6305368201,Classic feel good movie.,1440374400,,24,5.25
1026911,5,6305368201,Favorite movie!!,1440374400,,16,7.5
1026912,5,6305368201,"Sometimes our paths align, but there are rocks on the trail. This movie is a great example of how humility is key to relationships!",1440374400,,131,4.5
1026913,5,6305368201,This is a classic and I love watching it. Tom Hanks and Meg Ryan make a wonderful couple in the big screen. Presents a very common issue: the competition between big chain stores and small businesses. Other themes are presented also and it makes the perfect romantic comedy/drama.,1439856000,,280,4.854166666666667
1026914,5,6305368201,Classic! I watch this movie about once a week...I love it!,1439856000,,58,4.363636363636363
1026915,5,6305368201,One of my favorite movies!!,1439856000,,27,4.6
1026916,4,6305368201,A lighthearted romance movie.,1439683200,,29,6.5
1026917,5,6305368201,Always love old sappy movies a little bit of trauma and drama but always a happy ending,1439596800,,87,4.176470588235294
1026918,5,6305368201,"One of my top 5 feel good movies of all time.  Can NEVER get sick of this.  My daughter lives in Manhattan, and we've been to most of the places filmed .  It's a movie my girls loved to watch with me when they were still teens and at home, so I have many fond memories associated with it - it just makes me happy.  Nora Ephron was such a talented director.",1439596800,,356,3.9027777777777777
1026919,5,6305368201,Good heart warming story...,1439337600,,27,6.0
1026920,5,6305368201,Such a cute movie!,1439078400,,18,3.75
1026996,5,6305368201,Love this movie - still enjoy watching after all these years,1439078400,,60,4.545454545454546
1026997,5,6305368201,A classic movie that doesn't ever get old.,1439078400,,42,4.375
1026998,5,6305368201,Good movie,1438992000,,10,4.5
1026999,5,6305368201,"I'm one of many women who just love Meg Ryan and Tom Hanks together. It's a beautiful blend of humor, sarcasm, love, and compassion. You will love it!",1438905600,,150,4.392857142857143
1027000,5,6305368201,Very cute,1438819200,,9,4.0
1027001,5,6305368201,"One of my faves,  and ordering it was a  breeze- came in the mail in 2 days!  Thanks!",1438819200,,85,3.611111111111111
1027002,5,6305368201,Just one of my favorite movies of all time. It just makes me happy in every possible way!! Everything about it is fabulous - everything!!,1438819200,,137,4.52
1027003,5,6305368201,I was back in NYC last week and decided to watch this movie again before I went. I really love  the little love story between Tom Hanks and Meg Ryan but I also love the terrific references to NYC and the Upper Weat Side!,1438819200,,220,4.0
1027004,5,6305368201,"One of my all time favorites. Great actors, great story, and had me crying with happiness. It really touched my heart. A story often redone in movies and they are all great.",1438732800,,173,4.4375
1027035,5,6305368201,Awesome movie!  One of the few movies I like watching more than once.,1437955200,,69,4.3076923076923075
1027036,5,6305368201,Great movie,1437868800,,11,5.0
1027037,5,6305368201,"A classic movie, which I liked so much, that I bought finally, years after first seeing it on the big screen.",1437782400,,109,4.238095238095238
1027038,4,6305368201,"My favorite thing about this movie is the flash backs I get when I hear the old internet modem sound and the computerized voice saying, ""you've got mail.""",1437609600,,154,4.535714285714286
1027039,5,6305368201,I just love this movie.  It is one of my go to movies when I don't know what else to watch.  I love the happy ending.  We need more feel-good movies!,1437523200,,149,3.7419354838709675
1027040,5,6305368201,"I can never get tired of this movie... It's an adorable love story and who doesn't need a happy ending once in a while!  ""Aren't daisies the friendliest flower?""",1437091200,,161,4.551724137931035
1027041,5,6305368201,Great Movie and Fast Delivery!!!,1437004800,,32,5.6
1027042,5,6305368201,It's a classic!,1436832000,,15,4.333333333333333
1027043,3,6305368201,I prefer with subtitle in spanish. Thank you.,1436572800,,45,4.75
1027044,5,6305368201,love this movie!,1436486400,,16,4.666666666666667
1027105,5,6305368201,LOVE this!,1436400000,,10,4.5
1027106,5,6305368201,Great movie,1436400000,,11,5.0
1027107,5,6305368201,Very smart dialogue and also cultural critique for the time.,1436400000,,60,5.1
1027108,5,6305368201,Good price for a good movie,1436227200,,27,3.6666666666666665
1027109,5,6305368201,"Love love love this movie! Meg Ryan and Tom Hanks are a perfect on screen leading couple! They makes cute romantic and funny movies. I adore the quant shop around the corner. I remember that "" You've Got Mail"" when I first began the world of ""cyber space"". If you want a brake from the cold hard world or a stressful day. This romantic comedy will put a smile on your face and take to someones else's quant life in NYC!",1436140800,,419,4.185185185185185
1027110,4,6305368201,This is a heart-warming love story. I really liked it.,1435968000,,54,4.5
1027111,5,6305368201,nice,1435881600,,4,4.0
1027112,5,6305368201,Very touching. Great family film,1435622400,,32,5.6
1027113,5,6305368201,You gotta love these two.,1435449600,,25,4.2
1027114,5,6305368201,Love the ending.,1435363200,,16,4.666666666666667
1027165,1,6305368201,This is one of my favorite movies and I was so excited to see it in Blu- Ray. It is truly a disappointment as the audio does not match the video when they speak.  It is very annoying to watch.,1435276800,,192,3.8
1027166,5,6305368201,Everyone should own this movie!,1435104000,,31,5.4
1027167,5,6305368201,"A great Twin pack Movies and explains the other movie with the older black and white ""shop around the corner""",1435017600,,109,4.5
1027168,5,6305368201,One of my very favorite movies,1434844800,,30,4.166666666666667
1027169,5,6305368201,Great CD's & DVD!  Prompt service.,1434844800,,34,4.666666666666667
1027170,5,6305368201,Love this romantic comedy!,1434499200,,26,5.75
1027171,5,6305368201,Great movie! Love Tom Hanks!,1434499200,,28,4.8
1027172,5,6305368201,Super!,1434499200,,6,6.0
1027173,5,6305368201,Always thought Tom Hanks & Meg Ryan had chemistry. This movie puts a smile on my face,1434412800,,85,4.0588235294117645
1027174,5,6305368201,Good Movie,1434412800,,10,4.5
1027225,5,6305368201,good movie,1434240000,,10,4.5
1027226,5,6305368201,Great product and seller.,1434067200,,25,5.5
1027227,4,6305368201,Great movie,1433894400,,11,5.0
1027228,5,6305368201,Must have seen it a dozen times & still enjoy it.,1433808000,,49,3.5454545454545454
1027229,5,6305368201,Great movie,1433721600,,11,5.0
1027230,5,6305368201,"My family and I had rented this as a VHS video years back, But I nor my family was to interested in it back then. But when I had watched it again for the first time on TV recently, I had suddenly changed my mind about it. I had recorded it on the DVR but we have somehow lost the recording, so I just had to buy it I especially love the scene when Tom Hanks gets stuck in the elevator, and I also adore his dog, Brinkley!!!!!!!!!!!! he is so adorable!!!!!!!!!!!!!!!!  I also bought the CD soundtrack because I thought that this movie had some great music in it also!!!!!!!!!! I am NOT a huge Meg Ryan fan but I really like this movie. It also has a great message. Peter Smith",1433376000,,675,4.075187969924812
1027231,5,6305368201,A classic rom com with great actors. We watch it on holidays and special occasions. It never gets old.,1432944000,,102,4.421052631578948
1027232,5,6305368201,Love this movie,1432944000,,15,4.333333333333333
1027233,4,6305368201,"This was the first movie my wife and I saw together in the theater, and we also met on the internet.  Also included is a 1940's movie called The Shop Around the Corner starring Jimmy Stewart and based on the same original stage play as You've Got Mail.  It's old and in black & white, but it's still worth a  watch.",1432857600,,315,4.131147540983607
1027234,5,6305368201,Best movie ever! The combo of meg ryan and tom hanks is dynamic,1432857600,,63,3.923076923076923
1027300,5,6305368201,Made us laugh and cry.  A very good movie for date night.,1432771200,,57,3.75
1027301,5,6305368201,Great love story.,1432598400,,17,5.0
1027302,5,6305368201,Just overall good feel movie,1432080000,,28,4.8
1027303,5,6305368201,Love this movie,1431993600,,15,4.333333333333333
1027304,5,6305368201,Love this movie!  Still watch after all these years.,1431993600,,52,4.777777777777778
1027305,5,6305368201,Fun enjoyable for the whole family.,1431993600,,35,5.0
1027306,5,6305368201,"Love, love, love this movie. Never get tired of it.",1431907200,,51,4.2
1027307,5,6305368201,"One of my favorite movies ever.  Such a feel good movie, as romantic comedies should be.",1431820800,,88,4.5
1027308,5,6305368201,Charmant :-),1431820800,,12,5.5
1027309,5,6305368201,"Another ""feel good"" movie.  Hanks and Ryan have great chemistry.",1431561600,,64,5.4
1027370,5,6305368201,A favorite.,1431388800,,11,5.0
1027371,5,6305368201,"You've Got Mail is probably my favorite movie. Whenever I get really sad or depressed, watching it just makes me happier.",1431043200,,121,4.809523809523809
1027372,5,6305368201,great,1430956800,,5,5.0
1027373,4,6305368201,Part of a Great Gift.  They Really love this one,1430611200,,48,3.8
1027374,3,6305368201,Sweet and pretty good but not great,1430438400,,35,4.142857142857143
1027375,5,6305368201,(:,1430352000,,2,2.0
1027376,4,6305368201,Adorable and so 90s. I love it.,1430265600,,31,3.5714285714285716
1027377,5,6305368201,"This delightful comedy-romance is my absolute favorite. You find yourself falling in love with the characters and wanting desperately for them to realize that they just belong together. Produced at the beginning of the computer age, it is an endearing and charming story of how two people find each other online. Sweetness !!",1430006400,,325,5.150943396226415
1027378,5,6305368201,Like this movie.,1429833600,,16,4.666666666666667
1027379,4,6305368201,One of the best movies ever,1429747200,,27,3.6666666666666665
1027440,5,6305368201,"I LOVE, LOVE, LOVE this movie!  It is like theatrical comfort food.  I can watch it over and over and never tire of it, sorta like reading ""Pride and Prejudice"" (watch the movie and you will understand this statement).  Hanks and Ryan are wonderful and you will enjoy watching them spar with each other. No sex scenes or inappropriate material, this is one you can watch with your family.  A good, old fashioned love story. Watch it, I know you will love it!",1429574400,,458,4.481927710843373
1027441,5,6305368201,love this movie,1429574400,,15,4.333333333333333
1027442,5,6305368201,"I love this movie. I watch it every year in either the fall or the spring. Great mood movie. This this team of actors makes me want to see it again, every year.",1429488000,,160,3.878787878787879
1027443,5,6305368201,classic,1429488000,,7,7.0
1027444,5,6305368201,Worth viewing again.,1429142400,,20,6.0
1027445,5,6305368201,You simply won't find a better romantic-comedy that this classic. Something here everyone!,1428969600,,90,6.0
1027446,5,6305368201,I love this movie,1428883200,,17,3.5
1027447,5,6305368201,good,1428883200,,4,4.0
1027448,5,6305368201,"One of the most entertaining movies that TOM HANKS and MEG RYAN were ever in. This movie is a favorite of mine. Check it out "" YOU'VE GOT MAIL""-- LOVE IT!!!!",1428796800,,157,4.096774193548387
1027449,3,6305368201,No spanish subtitles :( It's So Sad!!,1428624000,,37,4.428571428571429
1027508,5,6305368201,"Love this movie, it's how me and the hubby, years and years ago via the net.  And the chemistry between Tom and Meghan is always good.",1428537600,,134,4.153846153846154
1027509,5,6305368201,One of the best romance movies of all time!,1428364800,,43,3.888888888888889
1027510,4,6305368201,"Surprisingly good chick-flick, I'm a guy and actually liked it.",1427932800,,63,5.4
