,overall,asin,reviewText,unixReviewTime,vote,reviewLength,wordLength
1237326,5,B00000JQUG,"Though I am not normally a fan of musical shows, I have made two exceptions in my sixty-odd years.  The first was The Sound of Music, with Julie Andrews which I saw many years ago.  Recently I added The Great Ziegfeld to my rather short list.  Previous to watching the film (which I first rented), I knew nothing about the title character who, it turns out, is one of the greatest showmen of all time.  Though the acting is typical of the 1930s, '40s and '50s, there is nothing stereotypical about some of the great stage shows that Ziegfeld originated and produced before the great financial crash that led to the Great Depression.  His shows on Broadway were a drastic departure from everything that had come before, featuring opulent stage dressings, extremely innovative moving stage parts, and sing and dance numbers that put most modern productions to shame.  These were all a staple in most of Ziegfeld's productions, but the one that bowled me over would be considered extraordinary even by today's standards.  The center stage ""prop"" was in the shape of a multi-layered cake with a staircase beginning at the bottom and spiraling around and around to the very top.  At various stages of the ascent were completely individual companies of performers portraying a specific theme, and it was a glorious extravanganza that left me slack-jawed with amazement.  It was like nothing I have ever seen before or since, and impressed me on such a grand scale that I immediately went online and bought the DVD.  I happen to be a fan of old movies from the '30s and '40s, but only the really good ones like ""To Have and Have Not"" with Bogart and Bacall, and ""it Happened One Night"" with Clark Gable and Claudette Colbert find their way to my shelves.  Added to my personal collection is ""The Great Ziegfeld"" for the storyline itself, and the incredible visual feast for the eyes that characterized most of Ziegfeld's stage productions.  Do not let the artwork on the cover dissuade you from buying this film; rent it first if you can, then buy it to savor again and again clips of some of the greatest stage shows of all time.",1357430400,,2123,4.692722371967655
1237327,5,B00000JQUG,"A great trip down memory lane, although this lane actually began before my time.  I just love the old movies.",1356998400,,109,4.45
1237328,3,B00000JQUG,"As 1930's musicals go, this one pulls out all the stops for sets, cast and music.  On the other hand, it is still a 1930's Hollywood musical, best compared to the Busby Berkeley genre.  The story is a bit more interesting, with the early career of Flo Ziegfeld being the excuse for a musical (it's not biographical in any sense), whereas the stories in many of the Berkeley films were merely a frame from which to hang the numbers.  Like the big Berkeley musicals, the music is much more frenetic than the hottest popular music of the day, but the numbers here are best compared to wedding cakes and staircases, not the top-down, geometric patterns made from women's bodies; sets revolve, unwind, curtains spiral up,  all as seen from a high balcony.

Another, more modern comparison would be the Barbra Streisand epics ""Funny Girl"" and ""Funny Lady""  (based in part on the Ziegfeld Follies) where the musical numbers are interludes that flesh out ideas in the story, as opposed to ""Oklahoma!"" (and operas) where the music moves the plot along.  And that brings up an interesting point:  If you've got an afternoon to kill, a blizzard or something, watching ""The Great Ziegfeld"" and ""Funny Girl"" back to back would provide an interesting contrast.  Ziegfeld's most profitable years ended with WWI.  This film was made some twenty years later, and the latter, another thirty years after that.  They both deal with much of the same period, yet are aimed at audiences of very different eras, and tastes in music and clothes.

The DVD itself is of the ""Roadshow"" production, meaning the version intended for the  initial release in select cities, with but one or two showings a night, with reserved seats and higher prices;  as a result, it has a full Overture, and Intermission, and Entr'acte.

What?

In effect, you get a static screen with the image of one of the words, and a selection of tunes from the show, as if you were at one, and not at a movie, and this is in addition to the opening and closing credits...  If you wanted to make more popcorn, call Aunt Edith to tell her the house is buried in snow, or feed the cat, you could do that, within reason, to a great soundtrack, and not miss any of the show.  Otherwise, you'd better have a working remote.  I found the black and white to be sharp and clear, but not stunning.  The sound was also very well mastered, but to no special praise.  It's the quality you'd expect from a major studio release of a classic, if rather forgotten old film..

I bought the DVD, since the last time I looked for it I couldn't find any version, anywhere;  and certainly no streaming or downloadable versions to rent or buy.  Now Amazon has all three---DVD, Stream to rent, or to buy.  I'll probably watch it more than my Busby Berkeley DVDs, which means about once a year, if that.  It's good, the music is Terrific!, but it's still a fairly typical 1930's film, and even with William Powell and Myrna Loy, it just isn't something I'd watch very often, although it's much better than I'd expected, in that regard.",1350172800,,3052,4.605555555555555
1237329,3,B00000JQUG,"The Great Ziegfeld is the first of three movies that deal with Florenz Ziegfeld and his legacy, the later ones being Ziegfeld Girl and The Ziegfeld Follies. For those who don't know, Ziegfeld was a master showman who recognized that beautiful women were all that one needed to sell a show, and with poise, dazzling costumes, and opulent scenery, he showcased hundreds of women in all their glory on Broadway. Naturally he was a bit of a ladies man, and had a common law marriage with star Anna Held and later with actress Billie Burke, with a few dalliances in between.

William Powell portrays Ziegfeld here, and he is polished and precise, but I believe too reserved to bring Ziegfeld to life. This was a man who managed to steal his rivals' stars and still get financial backing from them! He is not reserved and gentlemanly; he is brash and charismatic. This biopic is quite long at three hours, but I didn't feel any more emotionally involved in these people after watching it. The storytelling is methodical and seems like points on a timeline.

The only real thing to capture the audiences' emotions are the musical numbers, which are outstanding. They're a joy to watch and hold up well, even though Ziegfeld's heyday was about a century ago. Even though I have seen clips of the revolving cake number in documentaries, I was astonished at how beautiful and intricate it is.

I also wondered why some of these people didn't play themselves, as they were still living at the time this movie was made. Fanny Brice does an excellent job of captivating with humor and pathos even though she has only a few scenes; no one could have played her better. So why do we have an impersonator for Eddie Cantor? Couldn't Billie Burke have played herself? Perhaps they would not agree to it. I will say that the actor who plays Will Rogers is astoundingly like the original.",1348531200,2,1868,4.671732522796352
1237330,5,B00000JQUG,"The Great Ziegfeld is a captivating film that chronicles the ups and downs of Florenz Ziegfeld's life and his career in show business. The cinematography and choreography are excellent and the musical score, while a bit syrupy sweet at times, generally enhances the film. The quality of the print varies at times but overall it's pretty good. The plot moves along at a good pace and I wasn't ever bored; the musical numbers are perfect!!! The story of Ziegfeld's life is rather condensed even in this roughly three hour film; but I got a good sense of his life story.

When the action starts, we quickly meet small time, relatively young show business rivals at the Chicago World's Fair of 1893; Flo Ziegfeld (William Powell) and Jack Billings (Frank Morgan). Flo has a strong man act that gets attention and customers after Ziegfeld has a brilliant idea much to Jack's consternation. Flo also has a penchant for stealing Jack's lady friends--and sometimes even Jack's star female performers.

Time goes by and Jack is in Europe to sign Anna Held (Luise Rainer), a great French star, to be in one of his shows. But before Jack can sign Anna, Flo steals her away using his charm and intellect; Anna and Flo also fall in love. They all return to America and before you know it (the film glosses over a lot) Anna and Flo have been married a year. Meanwhile, Flo puts on shows starring Anna but eventually Anna becomes quite jealous of the other ""girls"" Flo has his eye on as these women could be future stars for future shows. It's interesting to see that although they are rivals, Jack Billings knows a business opportunity when he sees one so he and his partner Erlanger (Paul Irving) often loan Ziegfeld money to put on shows. Ziegfeld also becomes famous for putting on shows called ""The Follies.""

Anna leaves Flo after a misunderstanding; she sees Flo with the talented but most unreliable Audrey Dane (Virginia Bruce). (And yes, that telephone scene in which Luise Rainer acts so well must have clinched her that Oscar; her performance there is brilliant.) Flo becomes depressed but he eventually meets Billie Burke when she attends a party one night with Jack and, predictably, woos and steals Jack's woman once again. Flo and Billie fall in love and marry.

More time passes and we see Flo putting on more shows. He has a daughter with Billie Burke; and the rest of the film reveals how Flo's personal life and career work out.

Look also for fine performances by Ray Bolger playing himself, Fanny Brice as herself and Harriet Hoctor as herself. Nat Pendleton is terrific as Sandow and Joan Holland plays little Patricia Ziegfeld. Ann Gillis plays Mary Lou as a child; Jean Chatburn plays Mary Lou as an adult; Rosina Lawrence plays Sally Manners; Marcelle Corday is Anna's maid Marie and Ernest Cossart plays Sidney.

The DVD comes with two great bonus features. We get ""Ziegfeld on Film"" and ""New York Hails The Great Ziegfeld.""

The Great Ziegfeld deserves recognition as a fine motion picture that tells the story of Florenz Ziegfeld's life. His story is an important one not simply because he knew how to make savvy business deals but because of his contributions to the arts. People who enjoy classic movie musicals will want this for their collections and fans of the actors will not be disappointed.",1344038400,,3313,4.7613240418118465
1237331,5,B00000JQUG,"Bought this 3 hours movie already in 2004/2005 (the german DVD was released a little bit later but edited down toa lousy 120 min).

The biggest surprise for me was the in 1910 german born actress Luise Rainer - she's completely unknow in the german speaking part. Very nice, the DVD contains a interview with Luise Rainer which was recorded for this DVD and I was surprised she was still living. And she still do (stand: January 2012). I sent my DVD Cover in 2005 to her and got it (lucky) signed back.

She was the first and only german actress who won a oscar. She won surprising 2 oscar - the second was for her role in the following year in ""The Good Earth"" (which is in my mind still a very good drama!!!).

This movie is a nice bio about Lorenz Ziegfeld who changed the stage play/revues on the broadway and was very successful.
The movie contains some musical/revue scenes but its not really that what I would call a musical like following movies ""the Ziegfeld Girls"", ""Ziegfeld Follies"".

The Picture Quality is pretty good. English Subtitles are available.

FAzit: a good bio with William Powell, Myrna Loy (as Billie Burke who his famous today more for her role as Glinda in Wizard of Oz than as real-wife of Flo Ziegfeld), Frank Morgan (the wizard in ""The Wizard of Oz"")  and Luise Rainer. Also Appearances of real Ziegfeld Player: Fanny Brice, Ray Bolger (Tin Man in ""The Wizard of Oz"").

But be careful: not each event in the movie was like in the real - Anna Held died before Ziegfeld did. Also Gershwins ""Rhapsody in Blue"" was written later and not used in the real Follies.

Trivia: Dennis Morgan has an uncredited part in the show/revue scene: ""A Pretty Girl Is Like a Melody"". His singing voice was dubbed by Allan Jones (""A Night at the Opera"" with the Marx Brothers and ""Everybody Sing"" with Judy Garland).",1326153600,,1826,4.52887537993921
1237332,5,B00000JQUG,I love this movie for it's amazing costume and set designs.  There are many amusing song and dance numbers for the musical lover.  The scenes of the extravagant Ziegfeld shows are beautiful.  This is a must for anyone who loves amazing design elements.  The only drawback is that the movie is just a little too long for my taste.,1324339200,,329,4.52542372881356
1237333,5,B00000JQUG,"William Powell - what an actor; what a movie.  If you haven't seen this film, it's worth viewing.  The dance numbers are wonderful; wonder what it must have been like to have seen them in person.",1318723200,,195,4.388888888888889
1237334,3,B00000JQUG,"Fairly boring big budget MGM biopic............Powell as always is great, and seeing Fanny Brice was very interesting............the musical numbers needed better direction, and the story really dragged.  Hard to believe this won best picture when so many other great films were made that year.",1307404800,,294,5.681818181818182
1237335,1,B00000JQUG,I received this item loose in the case.  The DVD was damaged beyond repair.  I have emailed Movie Mars and have not received a response.  I have submitted this issue to Amazon for resolution.,1304294400,,191,4.5588235294117645
1237336,4,B00000JQUG,"The Great Ziegfeld(released April/36)was MGMs most lavish musical picture for that time and many would argue its' most lavish ever. Based loosely on the life of Florence Ziegfeld Jr.,it traces his beginnings as a side show barker to his greatest triumphs on Broadway and to his decline and death in 1932. Of course this is Hollywood and very little is ""truth"" here,only similarities or suggestions of. Stars such as Fanny Brice,Will Rogers,Eddie Cantor,Bert Williams,Anna Held among so many more,were to pass through his productions,the Follies. Anna Held he married,and eventually another actress Billie Burke(played by Myrna Loy,a natural choice,by now VERY popular with audiences starring next to Powell in the Thin Man series),who many will recall as Glinda the good witch in the Wizard of Oz. The fact is Florence was quite the ladies man and he went into debt many times over during his illustrious career. He in fact left a giant debt for Billie which is the reason she had to return to work just to pay off Florence's substantial bills,when he died of pleurisy in 1932. The theatre he had built and named after himself was taken over by William Hearst who had originally loaned him the money to build it in the first place.
There is no denying Ziegfeld`s great influence in the show business world,even to this day,and fewer still can match a track record of 24 years of lavish stage productions;1907 to 1932. This film does manage to capture the ``spirit`` of Ziegfeld however and MGMs pick of William Powell as Ziegfeld was a great choice. Luise Rainer plays his French wife,star Anna Held,and she got an OSCAR for her outstanding performance. In fact the picture got two more OSCARS,one for best picture and one for dance director Felix Seymour. This is also the closest any studio ever got to matching the lavishness and technical brilliance of Busby Berkeley musical numbers;any one of them could have given Berkeley a good run for his money in their design and execution. The huge sets are still breathtakingly beautiful to watch.
Technically the movie is,at times,a bit scratchy and it could certainly use a good remastering. But over all it is a clear and crisp print. Extras include a featurette on the making of the film and a rare vintage newsreel from the film`s premiere. The newsreel is a real kick as for the most part it is a camera staring at an open mike and stars waltzing up to it and saying a few syllables about anticipating the films premiere. Watch for a very young Ed Sullivan waxing lyrical,looking more like a member of the mob than the entertainment columnist and radio man he was(he Walter Winchell's biggest competition at that point).This film(thankfully)is the road show version which means you are getting the top dollar $2.20-of-the-day price version as opposed to the 176 minute pared down standard version. It is a whopping 185 minutes;that`s three hours and five minutes for those in Hoboken. But those 185 minutes go by quite fast,which is a sign of a very good film.
The Great Ziegfeld is an engrossing 185 minute juggernaut which does NOT fail to entertain and impress thanks to the performances of Rainer,Powell,Loy and its`great supporting cast. It`s lavish production and dance numbers are a sight to behold and they give Busby a real run for his money. This was MGM`s highest budgeted pic for the depression and a gamble,but it paid off and was a hit. You won`t find a factual biography of Ziegfeld but Powell`s resemblance and his turn as Flo give the film the impetus it needs to chug right along in grand style to the end. Recommended.",1300579200,,3590,4.848534201954397
1237337,5,B00000JQUG,"Great cast, great movie. You'll recognize many of the actors from the Thin Man series. Powell made a lot of movies with the same group of people and this movie is one of their best. Wonderful staging, great reproductions of the Ziegfeld Follies and (dare I say it) great characterizations. A keeper.
(I had this on tape from TCM and wanted the DVD.)",1264636800,,349,4.555555555555555
1237338,4,B00000JQUG,"MGM's magnificent musical biopic THE GREAT ZIEGFELD won three Oscars, including Best Picture and Actress (Ranier). Seymour Felix also garnered a statuette for his staging of ""A Pretty Girl is Like a Melody.""

With a running time of well-over three hours (including an intermission), this movie was a unique entertainment event for Americans who had recently passed through the Great Depression's darkest days.

Ziegfeld regular Ray Bolger's dance cameo marks his first appearance in a sound film. Fanny Brice also performs, but missing are the real Will Rogers (who died in a plane crash a year earlier) and Eddie Cantor. They're portrayed by mimics, plus W.C. Fields has no representation here at all. These are however minor quibbles.

The story episodically covers Florenz Ziegfeld's life from 1893, when he was a World's Fair carnival barker, until just after his financial ruin in the October '29 stock market crash, an event that forced the closing of Ziegfeld's popular musical,&nbsp;<a data-hook=""product-link-linked"" class=""a-link-normal"" href=""/WHOOPEE/dp/B00CA4S308/ref=cm_cr_arp_d_rvw_txt?ie=UTF8"">WHOOPEE!</a>&nbsp;A troubled marriage to Anna Held (Ranier) is chronicled. In the last third of the story, Flo (Powell) marries Billie Burke (Loy), a union that proves a blessing for the aging showman when those lean years do come.

Before we reach sadder days however, we're treated to lavish and historically accurate costumes, huge production numbers, beautiful girls and especially many talented performers who recreate a sparkling facet of early 20th Century Show Biz. For fans of epic MGM musicals, this granddaddy of them all is a must see, as it is for anyone interested in all-out cinematic extravagance on a scale that perhaps only the Great Ziegfeld himself could have imagined or brought to realization.

TRIVIA: You probably won't find them, but the future Mrs. Richard Nixon (nee Pat Ryan) and Mrs. Harpo Marx (Susan Fleming) appear here as  Ziegfeld Girls. Also, Vivian Vance (of&nbsp;<a data-hook=""product-link-linked"" class=""a-link-normal"" href=""/I-LOVE-LUCY/dp/B000TGJ8B2/ref=cm_cr_arp_d_rvw_txt?ie=UTF8"">I LOVE LUCY</a>&nbsp;fame) is an audience member in one scene. Songwriter Jerome Kern cameos as himself.

Parenthetical number preceding title is a 1 to 10 IMDb viewer poll rating.

(6.9) The Great Ziegfeld (1936) - William Powell/Luise Ranier/Myrna Loy/Frank Morgan/Fannie Brice/Ray Bolger/Virginia Bruce/Reginald Owen/Nat Pendleton/Herman Bing (uncredited: Buddy Clark/Mickey Daniels/William Demarest/Sarah Edwards/Susan Fleming/Virginia Grey/Jerome Kern/Dennis Morgan/Pat Nixon/Charles Trowbridge/Vivian Vance)",1255046400,2,2646,6.2103825136612025
1237339,5,B00000JQUG,"THE GREAT ZIEGFELD (1936)

What a spectacle this film is! I had seen clips of certain scenes before when watching bios on MGM or in things like THAT'S ENTERTAINMENT, but I finally sat down and watched it tonight and it was excellent. I'm not a huge fan of ""musical"" themed films. I'm downright picky actually. But the production in this film is really something to see.

It's not just mind boggling production and great music either, even though the film has plenty of great Irving Berlin music in it. There are some great performances by Powell as Florenz Ziegfeld, Luise Rainer as Anna Held, his first wife (common law wife in real life) and Myrna Loy as second wife Billie Burke. Frank Morgan is also fun in this as the longtime friend, competitor and financial backer of Powells ""Ziegfeld"". Powell is really good and I'd have to rate this as one of his best films.

The film is a fictionalized, glamorous account of Ziegfelds life. It shows Ziegfeld as a small time carnival barker and stage manager who rises to become the master showman of the Broadway stage. There are bits of historical accuracy thrown in such as Anna Helds ""milk baths"" that Ziegfeld publicized to great effect and which makes for a funny scene in the film between Powell and Rainer. It also shows the constant ups and downs of his financial situation and how he was wiped out in the stock market crash of 1929. But the real treat in this film is the outrageous spectacle of the production number that we see at the end of the first half of the film. It's one of the most amazing technical achievements in both production and camera work that I've seen.

The film won the Best Picture Oscar as well as Best Actress (Rainer) and Best Dance Direction. The real Billie Burke was a technical advisor on the film and for her efforts was rewarded by Louie B. Mayer with a seven year contract at MGM where she would go on to do some of her better known film roles like Wizard of Oz and Topper. Other fun performances worth mentioning are Fanny Brice and Ray Bolger playing themselves. The movie runs just over the three hour mark (this includes the overture and intermission music), but it is pretty fast paced and engrossing with really great visual eye candy. And just for laughs you can try to find former first lady Pat Nixon who plays one of the many uncredited ""Ziegfeld Girls"".",1250726400,9,2353,4.555555555555555
