,overall,asin,reviewText,unixReviewTime,vote,reviewLength,wordLength
2442050,5,B000BUE5DM,"<a data-hook=""product-link-linked"" class=""a-link-normal"" href=""/The-Celtic-Tiger-Starring-Michael-Flatley/dp/B000BUE5DM/ref=cm_cr_arp_d_rvw_txt?ie=UTF8"">The Celtic Tiger Starring Michael Flatley</a>

If you like Irish Dance and Excitement this DVD is a must purchase. It is absolutely fantastic and non stop dancing, singing and a good story line of the history of the Irish struggles and the Irish making it in America. It is a sexy show for sure and a lot of beautiful people, costumes and props. Very exciting, I would say. My daughter has been an Irish dancer for many years and the dancing in this DVD is just spectacular. There is a scene where a young lady flies over from Ireland and she changes in America and it is symbolized by her doing a striptease down to a patriotic two piece bathing suit. Any red blooded man would find it very exiting. It is clear that Michael did not want to hamper what he wanted to do with the show by making it fully for kids. He aims it at an adult audience. I would let any of my kids see it however. If the one scene bothers someone a little they can fast forward it. This show is pure excitement. It is very stylish and sexy at times. If I had a teenage daughter, I would let her see it and I am sure teens see a lot more than this on MTV. Great traditional songs such as Four green fields, A Nation Once Again, Wearing of the Green (I think?)  and several others. Don't listen to any critics buy it and judge for yourself. I almost did not buy it due to some critics I read. I understood the story line her better than any of the other shows Riverdance etc. The dancing was just incredible and the grand finale was mind boggling good and the grandest of any of them.
George Cuthbert",1193443200,3,1726,4.637254901960785
2442051,1,B000BUE5DM,"Michael, Michael, Michael -- what in the hell went wrong with you when you decided to put a show like this together?. I can understand the idea of bringing in new dance forms for experimentation purposes. But the product that came out from this vision was absolutley ridiculous. For one I don't think it says much for ""lady liberty"" to do a strip tease and for two for Ireland to become the ""celtic kitten"". With 100% emphasis on sexuality -- this show is 100% horrible. I would never suggest this on anyone. And I think that Michael Flatley should hang up the shoes now and let a new handsome idiot take his place. In conclusion -- this show annoyed the hell out of me and I cannot believe that he even produced such a product.",1183680000,7,728,4.4
2442052,3,B000BUE5DM,"Nowhere as good as Riverdance!  Dancers did good, but there was no indication of the link between parts.  A commentator would have helped.",1181174400,,138,4.956521739130435
2442053,5,B000BUE5DM,"I can't agree with all the knockers rubbishing Celtic Tiger.  I purchased my DVD from Amazon in March, and sat down to watch it without any prior knowledge of what it would be like.  I thought it was brilliant - the music by Ronan Hardiman is amazing and just gets better each time, and Michael Flatley was his usual talented and charismatic self.  He was 47 years old when he did that show so that's why he didn't dance all the time.  I have since watched this DVD about four or five times and each time I enjoy it more.  I just loved the Viking music with the boats and contrary to other people's opinions, I thought the strip scene was very colourful.  I thought it was great when Michael came on with the other pilots to greet the 'stewardess'and looked over the top of his sunglasses. It was a bit of fun, showing the contrast to the old Ireland and then the new life in the USA.  The Redcoats scene was very moving, especially when it showed the poor people being cast out of their homes.  The big screen with all the images was very well done.  Nobody's mentioned the flute played by Michael during that beautiful dance scene.  People can't expect this show to be another LOTD or Feet of Flames.  I loved every one of Michael's creations and I say - well done, Michael (dancer and choreographer) and well done, Ronan (composer).",1181001600,,1335,4.408163265306122
2442054,1,B000BUE5DM,"Overly glitzy show that actually has very little to do with the history of the Irish nation.  The musical numbers start off promisingly enough, but soon become overly long, deviating from the main concept of telling a story.  There are stripteases, mediocre soloists, bikini clad women, bump and grinds, lot's of fire, smoke and glitz, glitz, glitz.  Add that to Michael Flatley's ever growing ego, (and, my, does he enjoy displaying it onstage)and you have a very superficial hour and a half of rubbish.",1180828800,11,504,4.976190476190476
2442055,2,B000BUE5DM,"Celtic Tiger is really just a modified version of Feet of Flames of years ago. There is little new material or choreography, and it does not have the spectacular effect of Michael Flatley's earlier works. Sadly, Michael can no longer dance as he once did. It is a good effort, and certainly worth seeing, but don't expect to be electrified.",1179100800,2,340,4.683333333333334
2442056,5,B000BUE5DM,IF YOU LIKED  LORD OF DANCE YOU WILL LOVE THIS ONE..I FEEL IT'S THE BEST ONE YET...AND THE AUDIO FOLKS GOT IT RIGHT THIS TIME..,1173916800,,127,4.08
2442057,1,B000BUE5DM,"Finally purchased my copy of Celtic Tiger and looking forward to watching it as I have his other shows.  I kept waiting for the magic to start like it did from the very beginning of River dance or the entrance of the hooded dancers at the start of LOTD, but it never appeared.  It's not a DVD I'll watch over and over (if ever again) and if I had seen it before buying it, I would not have purchased it at all.

There is less focus on dancing (which is what I want to see when I see a Michael Flatley production - silly me, I guess) and what the heck was the striptease about??? In an audience with lots of children??? Not impressed at all.  The solo talent didn't seem up to par with what he has brought us in the past.  And like someone else mentioned all the different camera shots made it impossible to really focus on anything. There was no real focus on the dance troup itself.  I'd be hard pressed to pick out one of the troup after watching the DVD, unlike the others when there was a face to go with those feet.  Or perhaps that was the whole idea behind Mr. Flatley's decisions on this production.

I doubt that I'll buy a fifth production if Michael Flatley doesn't go back to his roots and focus once more on the great Irish dancing and music out there. It seems he hit his peak with LOTD, which is a shame.

Definitely wouldn't recommend it to someone who enjoys the dancing and music of LOTD and looking for a repeat.",1169337600,21,1431,4.193430656934306
2442068,3,B000BUE5DM,"There are a few good sequences, but overall it is nothing like Riverdance or Lord of the Dance. The filming of the show is especially annoying. Every second or two they switch to a different shot. It's impossible to appreciate the dancing that way!",1168819200,9,248,4.659090909090909
2442069,5,B000BUE5DM,I think it is the very best DVD of Michael Flatley ever!,1168300800,,56,3.75
2442070,3,B000BUE5DM,"I enjoy Mr. Flatley, I admire his work, since he appeared with the Chieftains. He is still one of the greatest entertainers of this time. However Celtic Tiger is not t a great show. I agree 100% with JJ and John Morgan commentaries. The entire concept is a great idea, but similar shows have been done. I own a copy of ""Waves"" in which you see a family go through the famine times. It is a modest production but very enjoyable music and dancing (Tommy Makem appears in this show). It ends with the family in the USA with a great american-irish dance.
Now back to Celtic Tiger. I saw Michael live in the original Lord of the Dance, right before he left Riverdance and before LOTD separated into several troops around the world. THAT SHOW WAS AWESOME. I saw Riverdance, live, and even without Flatley or Jean Butler, I liked this show a lot. Then I bought the DVD Feet of Flames, GREAT! Later I bought the DVD Michael Flatley's GOLD, a definitely keeper.
But then I saw Celtic Tiger on DVD... I don't know if the live show had as much a cappella at the beginning as the DVD, if it did, it was too long. The Garden of Eden could have been enjoyable if it had been performed by little girls, since it didn't have the formality degree the Swan Lake has. I enjoyed ""St Patrick"". The Vikings part had a good intention. The first part of the show was good. I did love anything that had a visual representation of the famine. The Red Coats dance was very good, and the Bloody Sunday and 1916 rising were just awesome. On the second part, Celtic Kittens, were like Webber's CATS without the makeup. The international routines, including ballet, were not amateur, but not very professional either, maybe I have been watching too much ""So You Think You Can Dance"". They were not very original or authentic either. The flight attendant stripper was entirely unnecessary, unless I missed the point. The cheerleaders dance was pointless and simple. I did like the gangsters dancing, but it reminded me of the taps in ""Will Rogers Follies"".  Flatley's solos are great, but nothing new. In all, the second part felt like a 4th of July celebration. I thought: they were doing this in Budapest? The ""Yankee Doodle Dandy"" kept on going forever. The music didn't do much for me either, but good and pretty fiddlers made it better. I will not go to see this show live unless I get free tickets. That's why I am glad I saw this DVD.",1155427200,8,2409,4.475
2442071,4,B000BUE5DM,"I enjoy the DVD tremendously especially the behind the scene commentary which showed they doing rehearsals where you will see Michael and his dancers preparing themselves for the opening night.

About the music during the show, I think some of them are recorded.

This is a DVD not to be missed if you are a great fan of Michael.",1155168000,5,329,4.559322033898305
2442072,4,B000BUE5DM,"LOVE ANYTHING MICHAEL FLATLEY IS IN - HOWEVER, THE CELTIC TIGER DID NOT HAVE ENOUGH OF HIM IN IT.",1154908800,5,97,4.157894736842105
2442073,5,B000BUE5DM,"My parents took me too this and I had once seen riverdance when i was younger and was amazed, but at 16 i thought it would be dumb. Was i wrong! This was the most amazing performance I've seen in my life, looking at it on DVD still gives me and my family goosebumbs its that amazing.

The dancing goes through every type, Jazz, Hip-hop, R&B to folk-dancing and each dance an amazing and well written story to go with it.  A Must Own!",1152662400,4,433,4.142857142857143
2442074,1,B000BUE5DM,"I have just returned from seeing Celtic Tiger in Birmingham UK and I have to say that it is the most self indulgent tosh that I have ever had the misfortune to sit through.....and I paid ?40 for the privilege. The choreography is dated and poor in many instances. In one case the dance reminded me of nothing more than Pan's People and in another, a garden scene with insects etc. it looked like a Joyce Grenfell Nursery school where the children had been told to ""pretend that you are an insect"". Added to the poor choregraphy is a political statement that has no place in what is supposed to be an evening of light entertainment and an overall concept that is bewildering in its lack of cohesion. Rubbish!",1146182400,11,707,4.488372093023256
2442075,5,B000BUE5DM,"This production was by far, the best I have ever seen!  My husband is a tough critic and loved the show!!  Although we thoroughly enjoyed Lord of the Dance, Celtic Tiger is truly as extravaganza!!!  The special effects are magnifigent!!!!!! It contained a greater, more meaningful story line that gives a warm insight into Irish families who migrated to America and takes you through the time in America when they arrived.  The costumes are certainly more elaborate and diversified, and the dancing is superb--more versatile and fluid.  The music--fantastic!

I felt exuberated after watching this show, proud to be of Irish heritage and always proud of be an American.

Seriously doubt Michael Flatly and cast could EVER top this one!!!",1144540800,8,737,5.091666666666667
2442076,2,B000BUE5DM,Not as much tap dancing as the other ones. You probaly have to be Irish to understand the theme because I didn't.,1143417600,6,113,4.181818181818182
2442077,5,B000BUE5DM,"The celtic tiger was not what i throught it would be like i expected it to be more like is other shows but i was quite pleased.

It shows why michael flatley is the best dancer in the world. All way through the show ever thing was diffrent but yet it seems to trancsend you. To me i can not wait for his next masterpiece Forget the other males in the riverdance shows who came after michael there is no compare to michael flatleys skill on the boards great show.",1142726400,4,462,4.133333333333334
2442078,4,B000BUE5DM,"Hey everyone want to let you know this show is quite good-----a little slow and polotically based to begin but an amazing tribute to America ending brings the whole thing home.....definitely a must see for LOTD/Riverdance fans such as I, you will love it just don't be swayed by a slower pace than you're used to to start!!!!!",1140739200,2,326,4.637931034482759
2442079,3,B000BUE5DM,"If you are expecting to see something -not better- but at least comparable to Feet of Flames, forget about it. This is a 100% Las Vegas show, and to be honest as a Las Vegas show is very good, but forget about all the art and ellegance of the 1998 Hyde Park concert. Celtic Tiger is a bunch of cheerleaders (and at one time even a striper!) jumping and dancing ryhtms taken from a Barney's childrens show. Flatley's dancing capabilities have considerably decreased. Is still good, just don't expect to see what you saw in Feet of Flames.",1140652800,4,537,4.489795918367347
2442080,5,B000BUE5DM,"Very enjoyable.  Additional features take you through setting up of the show, rehersals & getting to meet some of the dancers. Several different types of dancing.

Had to change format to be able to watch it in the UK on pal.",1140393600,2,225,4.463414634146342
2442081,3,B000BUE5DM,"To say that Michael Flatley is the, ""genius behind riverdance"" is a slap in the face of Moya Doherty who was the real genius behind Riverdance, and the woman who put Flatley on the map when she gave him the lead dance role.. For those who haven't seen ""Riverdance, A Journey"" (1996} It is a great video account of the beginning of Riverdance.. how it started.. the interviews, the whole deal from concept to the first New York show.",1139961600,3,432,4.481012658227848
2442082,4,B000BUE5DM,"Well, I would have liked to have given this 3 1/2 stars, but since I can't, I'll go up to 4. The music and costumes are great in this DVD. It's a wonderful show in spots, and not-so-great in others. The strip-tease scene should have been left out altogether, it was tacky and unnecessary...and the scene right before it with the stewardess and the airline pilots was slow. The music was wonderful for that part, but the choreography was just boring and didn't add to the story, in my opinion. Plus, what was with the orgasmic tigresses during that wonderful violin quartet music?? Other than a few spots like those, Celtic Tiger is very entertaining. I loved the ""Yankee Doodle Dandy"" number at the end. It's always distracting to me when the crowd is screaming so loud that you can't hear the music or the taps, but that's just part of a live show that you can't help, I guess. This DVD is definitely worth the money, but it ain't Lord of the Dance.",1138924800,4,950,4.4655172413793105
2442083,3,B000BUE5DM,"Yes, there is such thing as ""too much of a good thing"".  In Michael Flatley's case, the ""good thing"" is mixing and matching different dancing styles.  He is notorious for breaking rules and pushing limits.  Yet you can take Irish dancing only so far.  Mr. Flatley's work in ""The Celtic Tiger"" is anything but Irish dancing.  In fact, it hasn't been Irish dancing for a while.  I keep thinking of that scene in the Budapest version of ""Feet of Flame"", where Cleopatra (former Morrigan) performs a delightful little strip tease to the sounds of flamenco.

Michael, keep on doing what you do best, but don't call it ""Irish dancing"".",1137974400,10,629,4.715596330275229
2442084,5,B000BUE5DM,"We saw the show in St. Louis and were spellbound. The DVD is wonderful. I love the dancing, the costumes, the music and the theme. The dancers in this show leave you breathless. There is some unbelievable footwork here. As a Michael Flatley fan, I was waiting anxiously for years for another show to add to my collection. I wanted something totally different from LOTD and FOF. This show is amazing. It is completely new yet equal to the previous two.  Michael is brilliant and he is a creative genius. I recommend this highly to any Flatley fan. All I can say is THANK YOU Michael Flatley!!!!",1137542400,5,593,4.542056074766355
2442085,1,B000BUE5DM,"I found this show to be the worst ever, Irish dancing teacher and fan of LOD & Feet of Flames, this was utter rubbish.  Tacky tacky tacky.  Theme was okay but strayed so far from irish dancing it was terrible. A stripper in it too, what the hell was the guy thinking??He's pulled far away from his famous Irish dancing to do this stuff which had I have know I wouldn't have wasted my money let alone bringing this in from overseas to view it.

Best advice, save your money and enjoy all the other shows, this DVD is better used to sit my coffee cup on to stop it staining the table.",1136332800,10,582,4.132743362831858
2442086,4,B000BUE5DM,"Overall, very good production, as Michael Flately put forth yet another thrilling light, dance, and music show few (or no?) others can rival. If this is your first exposure to Michael Flately, this DVD is bound to glue you to your seat until the show is over.

I would have given the DVD an unquestionable 5, except for several minor issues. Having viewed his incredible ""Feet of Flames"", this show falls just slightly below Feet of Flames, as that was one unsurpassable achievement by anyone, Michael Flately himself included. Also, there is just a little too much similarities between ""Feet of Flames"" and ""Celtic Tiger"" - several of the dance and compositions are nearly identical. At last, the show is a little bit too much ""Las Vegas"" than the genuine Irish dance show I was expecting... a few dance numbers stood out as ""out of place"".

Nevertheless, there is more than enough here to keep almost anyone interested. Highly recommend this!",1136073600,6,944,4.857142857142857
2442087,1,B000BUE5DM,"If I could give it zero stars I would!

Now I understand why Riverdance has changed and changed for the worse.  They are trying to compete with this kind of thing.  And they shouldn't!

The reason I even have this DVD is that my co-workers. Goddess bless' em, who all know how much I love RD, figured I'd like Celtic Tiger, but...they were wrong!

This has to be one of the tackiest things I've ever seen.  What the heck the strip number was about is quite puzzling and oh, how very much it adds to this WONDERFUL show to see her prancing around in her tacky looking bikini which resembles the trashy costumes for the Yankee Doodle Dandy number!

Can we say BAD TASTE!!!  And just like in his other show LOTD, the music is so-so.

Now, there is no denying the immense talent of Michael Flatley, but since he's left Riverdance, he has taken his ability and succumbed to the lure of the almighty dollar, thereby taking his gifts and surrounding them with a huge amount of needless hype that only detracts from his talent, just like another truly talented performer I mentioned  above, Elvis Presly.

Shame on you Michael Flatley!  You can do better!

Comments about specific parts of the show:  The start was interesting, but from the scene called Garden Of Eden, which was INCREDIBLY boring and vapid, onward the show got worse and worse!

If you like the original Riverdance, you will almost certainly be dissappointed in this showy, tacky, over-produced glitz-fest!",1135468800,16,1466,4.671875
8092803,5,B000BUE5DM,"This is a recording of one of Flatley's shows, and is very good as the cameras roam so that you can see it from different angles.  The audio and vido is sharp and clear.  I got this for my wife who really likes it, but I watched it was well.

If you like Irish dancing, or Flatley, you will like this.",1526083200,,301,3.901639344262295
8092804,5,B000BUE5DM,"How did I miss this video. I think it's my favorite Irish Dance video of all time, and I really enjoyed the other Michael Flatley videos.",1523750400,,137,4.3076923076923075
8092805,5,B000BUE5DM,great,1522540800,,5,5.0
8092806,1,B000BUE5DM,"So sad. Weird, kinda creepy, and none of the joy that Riverdance and Lord of the Dance have. If you love the first shows, skip this one!!",1521936000,,137,4.111111111111111
8092807,5,B000BUE5DM,"Beautiful show shot on location. I especially enjoyed the interviews with cast & Michael himself, & seeing how the set up goes (NOT w/o hassles,). All that makes the show itself richer for knowing the effort behind it.",1509667200,,218,4.7631578947368425
8092808,5,B000BUE5DM,The Best,1507334400,,8,3.5
8092809,5,B000BUE5DM,"If you like Michael Flatley, you'll love this dvd",1497830400,,49,4.555555555555555
8092810,5,B000BUE5DM,"I saw him live many years ago, but this performance ""takes the cake"" so to speak.  There are at least 20 separate segments, and is one of the longest musicals that I have ever seen.  The DVD tells the story of Ireland.  The dancing and music is amazing.",1492646400,,253,4.229166666666667
8092811,5,B000BUE5DM,"I had doubts about this show, but after watching recently concluded that I've been missing out for the last decade. Michael Flatley created a fun, energetic tribute to both Ireland and the USA. Plenty of patriotism, national pride and sex factor infused in this great show which features the driving tap rhythms and innovative choreography we expect from the Lord of the Dance!",1492387200,,377,5.0
8092812,1,B000BUE5DM,I love it,1487030400,,9,2.3333333333333335
