,overall,asin,reviewText,unixReviewTime,vote,reviewLength,wordLength
1237340,5,B00000JQUG,"Ziegfeld's second wife, Billie Burke, chose William Powell to play Ziegfeld.  Billie Burke, most familiar to modern audiences as Glinda, The Good Witch of the North (<a data-hook=""product-link-linked"" class=""a-link-normal"" href=""/The-Wizard-of-Oz-70th-Anniversary-Ultimate-Collector-s-Edition/dp/B001MS7HX2/ref=cm_cr_arp_d_rvw_txt?ie=UTF8"">The Wizard of Oz (70th Anniversary Ultimate Collector's Edition)</a>), is played here by Myrna Loy. As anyone who has seen Powell and Loy together in&nbsp;<a data-hook=""product-link-linked"" class=""a-link-normal"" href=""/The-Complete-Thin-Man-Collection-The-Thin-Man-After-the-Thin-Man-Another-Thin-Man-Shadow-of-the-Thin-Man-The-Thin-Man-Goes-Home-Song-of-the-Thin-Man-Alias-Nick-and-Nora/dp/B0009GX1C4/ref=cm_cr_arp_d_rvw_txt?ie=UTF8"">The Complete Thin Man Collection (The Thin Man / After the Thin Man / Another Thin Man / Shadow of the Thin Man / The Thin Man Goes Home / Song of the Thin Man / Alias Nick and Nora)</a>&nbsp;can attest, these two have terrific screen chemistry.

Luise Rainer won the Best Actress Oscar for her performance as Anna Held, Ziegfeld's common law wife and the star of his early Broadway productions.  The film is very coy in its treatment of the Ziegfeld-Held relationship.  One minute he's trying to manufacture publicity to introduce the French singer to American audiences, the next moment he's sending her massive jewels with notes referring to her as his wife.  (Which she makes her maid read aloud twice and repeats herself...""my wife."")  Audiences of 1936 probably knew the back story.  It was quite the scandal in its day.

A special mention should be given to Virginia Bruce in the supporting role of Audrey Dane.  Dane is not a historical character; she is a composite of the women with whom the philandering Ziegfeld dallied.  As such, she is marvelously juicy character who says she would sell her soul for jeweled baubles and stardom; she brings contraband champagne backstage during performances; she makes inappropriate speeches during curtain calls; and ultimately causes the break up of Ziggy's first marriage.  Bruce, who had actually been a Ziegfeld Girl on Broadway, does a fine job with the singing and dancing, and she's electric in the hard edged backstage sequences.

Ray Bolger and Fanny Brice play themselves.  Just...WOW!!

The most impressive musical number, ""A Pretty Girl is Like a Melody"" (with a generous helping of ""Rhapsody in Blue"") will knock your socks off.  The costumes range from frothy 18th century ball gowns to eerie art deco bird women.  They threw everything but the kitchen sink into this number, and somehow managed to pull it off!  It could not be recreated today without CGI.

The DVD does have some problems.  The film is about three hours long and, although cleaned up, is not in the best shape.  It's a film that cries out for a commentary, but there is none.  Perhaps in 2011 they will see fit to give us a Deluxe 75th anniversary edition with the treatment this classic deserves.  However, between musicals having fallen into general disfavor and diminished audience attention spans, don't hold your breath.

Anyone interested in classic film and/or American musicals owes it to themselves to see this.  While it gives us an extended bio of one of Broadway's most successful producers, Florenz Ziegfeld, Jr., it is an amazing piece of American cultural history in itself",1247961600,2,3395,5.8121212121212125
1237341,5,B00000JQUG,"If you like musicals, you will love watching ""The Great Ziegfeld"". This movie has everything and it is awe inspiring to watch. William Powell plays Ziegfeld and he gives the showman a great tribute. Fannie Brice has a small part but it shows her as her silly self. The music in this movie, the Overture and the Intermission and throughout the film is wonderful and exciting. Frank Morgan (the Wizard of Oz), does a fantastic supporting role. Luise Rainer has many special qualities about her as an actress, and she won an Oscar for her performance. There are many inspiring showpieces in this movie. One of the best is a spiral cake with girls dressed in long flowing gowns and men dressed in tuxedos. As the camera rises to the top of the cake there is a beautiful girl who looks like a queen with stars in the background. A fashion show with girls dressed in rich apparel with extravagant designed hats and one girl with a white cottonball-like plume taller than she is on her side. Ray Bolger sings and walks across small steps at a high level with girls all around him. Will Rogers and Eddie Cantor have bit parts. One awesome scene begins with balloons on ribbons which come out into the audience. Another fantastic scene is a row of various kinds of dogs on the stage and girls dance around them. One scene is of the inside of homes and these homes are on rolling platforms, 5 of them in a row. Girls asleep in beds wake up and make their beds and then the camera shows them dancing on these platforms as they move in and out, seperately, from one another. Fantastic! The end of the movie is sad as the Stock Market crash of 1929 has come and Ziegfeld loses all his stocks and is broke. He has 4 shows that he has ready but they have to be shut down because of a lack of money. Ziegfeld misses Louise Rainer alot, which adds to his depression. When he hears that he has lost all of his stocks and money it is the final blow. Before he dies he sees the shows that he has made as they come to his remembrance. He then looks up and says words about steps, and he says, ""I must go higher. Higher."" Then he passes away, thus ending the movie. This film shows Hollywood at it's finest. It is a film that you HAVE to buy and see it for yourself. You'll be glad you did!",1241654400,,2268,4.2890442890442895
1237342,5,B00000JQUG,"I was Nine years old when this Movie came out. My Mother took me along with her Girl Freinds to see it. I Enjoyed it then as I do each time I have seen it thru the Years. Now my Grandkids can enjoy it with me -They love gramps""Great Old Movies"",especially the Musicals - Like I do.

Thank You",1240272000,,292,3.9491525423728815
1237343,3,B00000JQUG,"""The Great Ziegfield"" was a mammoth box office hit for MGM in 1936 and it is a stupefying and interminable bore today, with the exception of a few tremendous musical numbers. It may be the very best example why so many of the films of MGM, the Tiffany of its day, have not stood the test of time. MGM spent truck loads of money and mounted the biggest show in the cinema but in doing so, they removed almost all vestiges of vitality and wit. At least the over-the-top no expense spared approach mirrored Ziegfield himself and it should be noted that the screenplay is a reasonably accurate depiction of his life and times. The art direction, costuming and sense of period, also, are lush and accurate. William Powell is good casting as Ziegfield but Myrna Loy has little to do as Billie Burke. Luise Rainer won a famous Oscar for her smiling through tears phone scene but this was the year Greta Garbo was up for ""Camille"". Are you kidding? Fanny Brice (""Funny Girl"") appears too and every moment is solid gold but it is a tragedy that her version of ""My Man"" is truncated.

The DVD print of the film is only OK which is disappointing. There is a short film about the making of the film and this is invaluable because appearances are made by Ziegfield's daughter and Luise Rainer herself. In fact the whole DVD is worth viewing just to hear Rainer tell how she walked out on Louis B. Mayer ""...to save herself and here I am an old lady and I saved myself"" delivered with a radiant smile and a look of triumph which strips away the years. The theatrical trailer is included too.",1236816000,,1577,4.437931034482759
1237344,5,B00000JQUG,"In the course of my reading I have come across a great many references to Florenz Ziegfeld and his legendary ""Ziegfeld Follies"".  But I knew precious little about them.  It seems that for three decades between 1907 and 1936 Flo Ziegfeld's lavish productions were all the rage on Broadway.  And why wouldn't they be?  The list of stars who performed in these shows reads like a ""who's who"" of show business during this period.  Recently, I came across a VHS copy of the epic three hour 1936 film ""The Great Ziegfeld"" at my local library.  It turns out that ""The Great Ziegfeld"" is not only a biography of this show business icon but the film also offers you an incredible opportunity to relax in your living room and  sample the best of the what the Follies had to offer all those years ago.  What you will discover is that these extravaganzas were postively ""stunning"".  There has never been anything else quite like the ""Follies"" before or since.

For me, what was really neat about watching ""The Great Ziegfeld"" was the opporunity to partake of actual performances by such legendary figures as Al Jolson, Will Rogers, Fanny Brice and the song and dance man Ray Bolger (later the 'Tin Man' in the ""Wizard of Oz"").  It easy to see why these folks were such crowd pleasers in their day.  But it was not just the so-called ""stars"" that made ""Ziegfeld Follies"" so special.  It was was the lavish sets and the cadre of beautiful girls who would appear in each show.  Literally hundreds of beautiful girls!  These shows truly were spectacular in every way!  And although this film was made more than 70 years ago I was glued to my TV the entire time.

As I mentioned earlier,  the film also doubles as a biography of Flo Ziegfeld....well, sort of.  The producers take liberal amounts of literary license with his life story.  We do learn that Flo will spare no expense to make sure that his shows are the most ostentatious productions on Broadway.  This penchant for lavish spending will land Flo in the poor house on more than one occasion.  ""The Great Ziegfeld"" also focuses on  Flo's personal life including his long-time common-law marriage to the Polish born performer  Anna Held (played by Luise Rainer) and his subsequent marriage to actress Billie Burke (played by Myrna Loy).  Indeed, I would be remiss if I failed to mention the outstanding music in this film by Walter Donaldson and the great Irving Berlin.

""The Great Zeigfeld"" won three Academy Awards in 1936 and was nominated for four more.  Kudos to William Powell for a splendid performance as Flo Ziegfeld. I found this to be an outstanding film on so many levels.  It is a movie that I could watch again and again.  Highly recommended!",1235433600,4,2700,4.661016949152542
1237356,4,B00000JQUG,"I almost gave up on this three-hour film around the 45-minute mark because of Luise Ranier's shrill and annoying character, plus there hadn't been much in the way of music which is what I wanted in this film in the first lace.

However, after the first hour the story picks up considerably with the music numbers and some nice-looking and interesting women. I liked Myrna Loy playing Billie Burke. In fact, I like Loy a lot more than Burke in everything! This was my first look at Fanny Price, who reminded me of Barbra Streisand with her looks and Brooklyn accent.

William Powell, playing Flo Ziegfeld, was, of course, the undisputed star of the film. He was terrific, too, start-to-finish. Powell had great screen presence and was a good choice for this role. Frank Morgan played his normal role with that stupid laugh of his, but he was good as Ziegfeld's generous friend. Another famous name of the day, Myrna Loy, gets good billing in here but not much of a role.

Some of the sets on the Ziegfeld Follies are amazing Busby Berkely-type extravaganzas that certainly mark the 1920s and '30s. The line, ""They don't make 'em like that anymore"" certainly rings true. It's also true they look corny today, but they're still fascinating to watch.

If I was older and had lived through some of this time period, I would really feel nostalgic watching this film, sad for an era now long gone.",1234915200,2,1390,4.661224489795918
1237357,5,B00000JQUG,"The Great Ziegfeld is the example of the Golden Age in Hollywood. This is a masterpiece. Oh my God! ""A Pretty Girl Is Like A Melody"" is far beyond borders... It is exquisit to see this kind of numbers.. I am really proud to have seen this marvelous, glorious film. This is pure gold!!!.. A too much deserved Oscar for Best picture of 1936. MGM proved to be ""Champion In Musical Pictures"".. But I am really amazed by this all star cast movie.. I can only say Oh My God!!",1228089600,,469,4.222222222222222
1237358,4,B00000JQUG,"THE GREAT ZIEGFELD was another big one for MGM, a biopic extravaganza in which the life of Florenz Ziegfeld was used as a sounding board for a variety of ever more spectacular musical numbers. Along the way, there are brief respites for some guest stars (Ray Bolger and Fanny Brice - her line, ""For Ziegfeld, I gotta be an urchin... even in burlesque, I was middle-class"", is priceless), and mind-numbing musical numbers (how were those supposed to be done live on stage?), tied to a story of Ziegfeld's life and loves. This was not only a box office smash, it was also a big award magnet, winning the Academy Award as Best Picture as well as the award for Best Actress for Luise Rainer's portrayal of Anna Held. Now: this is an example of the height of frivolity, because Anna Held was a great sex symbol in her day (the turn-of-the-century equivalent of Brigitte Bardot in the 1950s) and the waif-like Luise Rainer is anything but... But does it matter? Rainer gets to do a celebrated smiling-through-tears telephone act (impressive enough for her to win the New York Film Critics Circle Award for Best Actress, which paved the way for the inevitable Oscar), and Myrna Loy shows up as Billie Burke (Mrs. Ziegfeld Number Two), though this caused the real Billie Burke no end of distress (she couldn't see why she shouldn't play herself). ""A pretty girl/Is like a melody/That haunts you night and day..."" And in its way, this movie, lumbering and overblown and fabricated as it is, remains a memorable example of MGM engineering. Not that there's anything wrong with that.",1210291200,,1572,4.761904761904762
1237359,4,B00000JQUG,"I'd be a little kinder to this film if it hadn't won the Best Picture Oscar.  Adding insult to injury is that ""Dodsworth"" didn't win.  The debits here are overlength, superficial storytelling, skindeep biographical study, and generally weak production numbers.  To it's credit the film contains strong performances by William Powell, Luise Rainer, Myrna Loy, and Frank Morgan.  Good cameos by Fanny Brice and Ray Bolger.  The production does have stunning direction and costume design.  ""The Great Ziegfeld"" is not a bad picture but it barely transcends curio status.",1208044800,,567,5.314606741573034
1237360,4,B00000JQUG,"This movie is worthwhile viewing for any fan of classic cinema or William Powell, but over 70 years later it's hard to see why this film won Best Picture of 1936 and a film like ""Dodsworth"" lost. Today it does seem overly long on musical numbers that could have been cut and short on storyline. There are probably several reasons that the picture could have been better and wasn't, the primary reason being that at the time the film was made Ziegfeld had only been dead four years and was thus still fondly and recently remembered. Also, according to the little featurette that comes with the DVD, Ziegfeld's widow Billie Burke was heavily involved in the making of the film and wouldn't allow anything in it to besmirch his memory. Finally, the production code had just begun to be sternly enforced in 1934, making a true accounting of Ziegfeld's personal life pretty much impossible. As a result Ziegfeld is portrayed as just the unluckiest of fellows who is always being wrongly perceived as a ladies' man just because his business involves large numbers of chorines. In fact, Ziegfeld cheated on both wives incessantly, and Ziegfeld never even formally married Anna Held to begin with - instead they had a common law marriage according to the statutes of New York. However, none of these other factors can account for the complete lack of chemistry between Powell (Ziegfeld) and Loy (Billie Burke) in the film. Considering how the two had already been in several movies together by the time this film was made, and that they never failed to sparkle on screen together in the other movies, there must have been either a complete lack of direction or over-direction to wind up with the rather wooden performance that results whenever the two are in scenes together.

This movie would probably warrant only about three stars if it wasn't for William Powell's performance. Marvelous as always, he was at least allowed to portray Ziegfeld as the cagey trickster and gambler with tremendous class that he was, and he absolutely makes the film. I can't think of any other actor of that time period who could have done as good a job. As far as video quality, I was surprised at the scratchiness of the video portion of the transfer. There are numerous artifacts in the video that can be quite distracting at times, and at other points the video looks nearly perfect. There are only two extras features. One is a featurette lasting under ten minutes on the film and Ziegfeld's life with Luise Ranier, Ziegfeld's daughter, and others. The other feature is an unedited movietone newsreel of the grand opening of the film with short greetings from Harpo Marx, Ed Sullivan, and other celebrities.

This new DVD release of ""The Great Ziegfeld"" is just being done for the sake of repackaging. If you are satisfied with the last release and its packaging there is nothing new about this release that should cause you to double dip.",1198800000,3,2919,4.7896825396825395
1237361,4,B00000JQUG,"This movie is worthwhile viewing for any fan of classic cinema or William Powell, but over 70 years later it's hard to see why this film won Best Picture of 1936 and a film like ""Dodsworth"" lost. Today it does seem overly long on musical numbers that could have been cut and short on storyline. There are probably several reasons that the picture could have been better and wasn't, the primary reason being that at the time the film was made Ziegfeld had only been dead four years and was thus still fondly and recently remembered. Also, according to the little featurette that comes with the DVD, Ziegfeld's widow Billie Burke was heavily involved in the making of the film and wouldn't allow anything in it to besmirch his memory. Finally, the production code had just begun to be sternly enforced in 1934, making a true accounting of Ziegfeld's personal life pretty much impossible. As a result Ziegfeld is portrayed as just the unluckiest of fellows who is always being wrongly perceived as a ladies' man just because his business involves large numbers of chorines. In fact, Ziegfeld cheated on both wives incessantly, and Ziegfeld never even formally married Anna Held to begin with - instead they had a common law marriage according to the statutes of New York. However, none of these other factors can account for the complete lack of chemistry between Powell (Ziegfeld) and Loy (Billie Burke) in the film. Considering how the two had already been in several movies together by the time this film was made, and that they never failed to sparkle on screen together in the other movies, there must have been either a complete lack of direction or over-direction to wind up with the rather wooden performance that results whenever the two are in scenes together.

This movie would probably warrant only about three stars if it wasn't for William Powell's performance. Marvelous as always, he was at least allowed to portray Ziegfeld as the cagey trickster and gambler with tremendous class that he was, and he absolutely makes the film. I can't think of any other actor of that time period who could have done as good a job. As far as video quality, I was surprised at the scratchiness of the video portion of the transfer. There are numerous artifacts in the video that can be quite distracting at times, and at other points the video looks nearly perfect. There are only two extras features. One is a featurette lasting under ten minutes on the film and Ziegfeld's life with Luise Ranier, Ziegfeld's daughter, and others. The other feature is an unedited movietone newsreel of the grand opening of the film with short greetings from Harpo Marx, Ed Sullivan, and other celebrities.",1182556800,2,2687,4.816017316017316
1237362,5,B00000JQUG,"Top MGM musical recreates the glory days of the musical theatre, before movies overtook Broadway as our primary form of entertainment. The ever-charming, debonair Powell is perfect casting for Zeigfeld, and frequent co-star Myrna Loy is also on hand playing second wife Billie Burke. Winner of that year's Best Picture Oscar, Luise Rainer also won a statuette for her portrayal of ""Ziggy""'s first wife Anna Held (her culminating phone scene is justly famous). Long but dazzling, ""Ziegfeld"" combines backstage drama with on-stage spectacle-in particular, don't miss that ""Pretty Girl"" musical number.",1182384000,,599,5.593406593406593
1237363,5,B00000JQUG,"The film was in new wrapping, and packed very well for shipping.  I was happy to find this old film on DVD as it was part of a birthday gift for a friend who was born the year the film won the Academy Award.",1152835200,,207,3.7045454545454546
1237364,4,B00000JQUG,"The title just about sums up my review. The dramatic sequences of this film really don't stand the test of time; they're alternately melodramatic and boring. To modern day audiences, the 1st hour, in particular, is almost unbelievably dull.

But when the production numbers begin at about the second hour, the senses are overwhelmed. I don't think I've ever seen a more spectacular production--ever--in 30 years of viewing movies.  No superlative adequately expresses this production. More beautiful girls than you ever saw, more beautiful gowns, more beautiful music, just doesn't exist anywhere else on celluloid. I wonder who the handsome crooner was? His voice was haunting in its beauty.

The third hour is part melodrama, part musical production. The circus number is first-rate, but doesn't match the sheer genius of the 2nd hour.

You must watch this movie at least to enjoy the numbers!",1147651200,4,895,5.194444444444445
1237365,5,B00000JQUG,I just wish they'd make movies like this one today instead of all the rubbish they churn out of Hollywood.,1140652800,3,106,4.35
1237386,5,B00000JQUG,"This movie is great family entertainment. It keeps your attention the whole way through the picture. The stars include William Powell, Luise Rainer, Frank Morgan, Fannie Brice, Ray Bolger and others. The movie has comedy, drama, romance, it has it all. The production number at the end of the first half of the film is well done. It shows a large cake design that revolves slowly and on the top is seen a girl dressed as a queen with a sky of stars in the background. One stage number shows many balloons floating slowly towards the camera and behind them is one scene after another of beauty. Another number shows a line of dogs standing still while girls dance around them. Another great number shows couples living in fancy houses, but the scenery is on moving platforms, three of them, and each one moves at a different time. The couples are singing in this scene. Then is seen a large number of tapdancers dancing on these moving platforms. There is also a fashion show with girls wearing very costly gowns and large plumes on their heads. If you like MGM musicals, you should see this one. You won't be dissappointed. The movie centers around the life of Florenz Ziegfeld. When you watch this movie for the first time, you will want to watch it again and again.",1137024000,6,1267,4.58590308370044
1237387,5,B00000JQUG,"Hollywood gives a very deserved homage to the notable showman Florenz Zigfeld. William Powell and Louise Reiner are simply out of this world with such memorable performances.

A true standout movie and one of the most reminded gems of the Thirties.",1132272000,2,248,5.048780487804878
1237388,5,B00000JQUG,"What a great and wonderful film.  Lately i've been in love with ""Ziegfeld Girl"" playing ""You stepped out of a dream"" and the Lana Turner sequence at the end over and over again.  But this film ""The Great Ziegfeld"" is now my new favorite.  I use to work at Radio City Music Hall under Leon Leninoff who designed all the stage shows production numbers in the earlier days.  This film captures and reminds me so much of the old days at the ""hall.""  If you love lavish production numbers, wonderful music, beautiful costumes then this film is for you.  I can just imagine what it would have been like to be a Ziegfeld girl.  The production number ""A pretty girl is like a melody"" was all shot in one take according to the extra that is on the DVD.  Even if your not of that time (which i'm not) this movie is so great you can't help falling in love with it.  It comes complete with Overture, Intermission, Entrance and Exit music.  Unfortunetly this could never be filmed correctly today and there isn't the talent to create such a film anymore.  So sit back and enjoy this one.  You won't be sorry.",1130630400,8,1095,4.366336633663367
