,overall,asin,reviewText,unixReviewTime,vote,reviewLength,wordLength
1237199,5,B00000JQUG,"The Great Ziegfeld (1936). Running time: 3 hours, 05 minutes. Black & white.
Includes Overture (4 mins, 50 seconds). During Overture, please be seated.

Also includes Intermission, Entr'acte and Exit Music.

Directed by Robert Z. Leonard.

DVD will play movie automatically after one minute, 10 seconds if no option has been chosen.

Florenz Ziegfeld (1867-1932).

Florenz Ziegfeld (William Powell) is a barker at the 1893 World's Fair in Chicago, Illinois. In the Streets of Cairo area, he runs the Sandow, the Strongest Man in the World side attraction. His opponent, Jack Billings (Frank Morgan) barkers for The Little Egypt side attraction and always seems to draw a crowd with his harem ladies. Ziegfeld's outside audience ends up going over there as soon as Billings starts his barkering.
  Ziegfeld wants to make changes to his attraction. He wants to build the back seats higher, but Sandow (Nat Pendleton) says they had no people sitting in the back. They are not packing them in like they use to.  Ziegfeld takes Sandow to dinner. There Ziegfeld receives a message that Billings wants to merge with Ziegfeld's show. Nothing doing. Ziegfeld has better ideas for himself and Sandow. He wants to quit this circus in Chicago. So he takes Sandow with him to New York, Sacramento and San Francisco. They do well, but after having Sandow do a fake lion act, they lost money and Ziegfeld lost Sandow to a New York troupe.
Ziegfeld is on a ship to Europe where by chance he meets Jack Billings again. Following Billings, Ziegfeld finds a new venture to bring back to New York...Ann Held (Luise Rainer).

Also in the cast: Joe Yule, Joseph Cawthorn, Virginia Bruce, Reginald Owen, Ray Bolger, Ernest Cossart, Buddy Clark, Dennis Morgan, Sarah Edwards, Virginia Grey, Pat Nixon, John Larkin, Fanny Brice, Lee Phelps, William Demarest, Clay Clement, Raymond Brown, Cyril Ring, Phil Tead, Charles Trowbridge, Eric Wilton.

A.A. Trimble as ""Will Rogers"".

That is the same Pat Nixon (born Thelma Ryan) as a ""Ziegfeld Girl"" who became First Lady Pat Nixon married to Vice President (1953-61) and President Richard M. Nixon (1969-74).

Luise Rainer is the oldest lived Academy Award Actress ever at 104 years + 352 days. She passed away December 30, 2014.

Frank Morgan, Ray Bolger and the real Billie Burke would star in the movie,&nbsp;<a data-hook=""product-link-linked"" class=""a-link-normal"" href=""/The-Wizard-of-Oz-75th-Anniversary-Edition/dp/B00CNW9ZI6/ref=cm_cr_arp_d_rvw_txt?ie=UTF8"">The Wizard of Oz: 75th Anniversary Edition</a>&nbsp;(1939).

In-film advertising: Wrigley's Gum and Fleichmann's Yeast is mentioned in this film.

Filmed at the MGM Studios in Culver City, California.

English language only. Option of subtitles in English, Spanish, French.

Special Features: Ziegfeld On Film (13 mins). New York Hails The Great Ziegfeld (4 mins) See a young Ed Sullivan.

This movie won Academy Awards for Best Picture, Best Actress-Luise Rainer, Best dance Direction. Nominated for Best Art Direction, Directing, Film Editing, Original Screenplay.

Also see:

<a data-hook=""product-link-linked"" class=""a-link-normal"" href=""/Sally/dp/B0040BJGXW/ref=cm_cr_arp_d_rvw_txt?ie=UTF8"">Sally</a>&nbsp;(1929).
<a data-hook=""product-link-linked"" class=""a-link-normal"" href=""/Rio-Rita-1929/dp/B004082EEI/ref=cm_cr_arp_d_rvw_txt?ie=UTF8"">Rio Rita (1929)</a>.
<a data-hook=""product-link-linked"" class=""a-link-normal"" href=""/Whoopee/dp/B00CA4S308/ref=cm_cr_arp_d_rvw_txt?ie=UTF8"">Whoopee!</a>&nbsp;(1930).
<a data-hook=""product-link-linked"" class=""a-link-normal"" href=""/Show-Boat-1936/dp/B00J70UXEM/ref=cm_cr_arp_d_rvw_txt?ie=UTF8"">Show Boat (1936)</a>.
<a data-hook=""product-link-linked"" class=""a-link-normal"" href=""/Ziegfeld-Girl/dp/B0001DCYUK/ref=cm_cr_arp_d_rvw_txt?ie=UTF8"">Ziegfeld Girl</a>&nbsp;(1941).
<a data-hook=""product-link-linked"" class=""a-link-normal"" href=""/Ziegfeld-Follies/dp/B00MKI7BLQ/ref=cm_cr_arp_d_rvw_txt?ie=UTF8"">Ziegfeld Follies</a>&nbsp;(1946). Also with William Powell as ""Ziegfeld"".
<a data-hook=""product-link-linked"" class=""a-link-normal"" href=""/Till-the-Clouds-Roll-By-Remastered-Edition/dp/B000EBD9SA/ref=cm_cr_arp_d_rvw_txt?ie=UTF8"">Till the Clouds Roll By (Remastered Edition)</a>&nbsp;(1946).
<a data-hook=""product-link-linked"" class=""a-link-normal"" href=""/Show-Boat-1951/dp/B00004RF9K/ref=cm_cr_arp_d_rvw_txt?ie=UTF8"">Show Boat (1951)</a>&nbsp;(1951).
Ziegfeld: The Man and His Women (NBC 1978).",1426377600,,4420,7.25703564727955
1237200,5,B00000JQUG,I bought this because I love this old movie!,1425168000,,44,4.0
1237201,5,B00000JQUG,no more to say,1422144000,,14,2.75
1237202,5,B00000JQUG,"One of my favorites of all time.  Of all movies not to color...really absurd!  ""A Pretty Girl Is Like A Melody"" with Dennis Morgan scene is such a marvelous set.  Just imagine this in color.",1421971200,,190,4.371428571428571
1237203,4,B00000JQUG,"*** This review may contain spoilers ***

Once I saw ""Funny Girl"" I assumed the beauties in the Follies could never compare to the 20s/30s standard and wow was I surprised. Those girls were truly beautiful, tip to toe and talented! Typically when you see even 40's musicals, you just assumed that women's stature, legs and poise eventually evolved to todays uber standard. However, in this epic biopic every dame is a winner. I figured since they weren't wearing mini-skirts and bikinis in those days it was not as hard to compete for men's attentions.

I have been to many stage productions and could never imagine seeing moving sets with dancing girls on mattress tops. The LA Hard Rock show probably is the closet to this technique and I was over the top with just their small interpretation. But in the 20's? How truly shocking, exciting, and spectacular!

Ziegfeld was a genius to attract all that talent to produce unforgettable moments in entertainment history. I had no idea his shows visualized profound eye candy, particularly the sets.

I found the movie too long and was not prepared to see almost full shows and routines. But this is more documentary format than stage play. Ray Bolger exhibited enormous talent that only shone through slightly in the Wizard of Oz. Amazing how many characters from this film ended up together again in 1939.

I did not find the Helm character interesting and her phone scene was overly dramatic and tired. She reminded me of the woman who played Joan of Arc, the silent version, very expressive eyes. I also did not see the appeal for Fanny Brice, Streisand probably spoiled that image for me.

Powell never disappoints and is aged well into his final moments. I watched this film primarily for his performance and this role was most likely very gruelling given the length and amount of dialogue.

High recommend for appreciating Ziegelds's early musical stage shows, the bevy of leggy beauties and fabulous sets.",1421193600,2,1960,4.867867867867868
1237204,4,B00000JQUG,"The film was full of Ziegfeld production numbers that were beautifully overdone and in crisp black and white. Ray Bolger was seen at his best performing in the style called eccentric dancing the same style that George M. Cohan was famous for. If you ever have the chance to see the real Cohan in some of his rare film clips don't miss them.
The highlight of The Great Ziegfeld is the rapid performance of Luise Rainer who could only be described as a cross between Bugs Bunny (for movement) Audrey Hepburn (for cuteness and lovability) and Hedy Lamar (for accent) all combined was enough to win the Oscar for best actress which she again received the next year. Luise Rainer would have been a contender today. She recently passed away at age 104. She alone is worth the price of admission.",1420588800,,789,4.602836879432624
1237225,1,B00000JQUG,"The movie is great, but Amazon's web stream totally sucked.",1420329600,,59,5.0
1237226,5,B00000JQUG,"Excellent, wonderful show, wonderful Era.... 5 star transaction",1419206400,,63,7.0
1237227,4,B00000JQUG,"Movie was very interesting, but thought it was too long.",1417996800,,56,4.7
1237228,5,B00000JQUG,"Love this old movie.  While it's a fictionalized biography I enjoyed it.  Loved Luise Ranier (who's 104 now) and Billie Burke
in the movie,  and of course William Powell was great as usual",1417737600,,188,4.636363636363637
1237229,5,B00000JQUG,My new favorite movie of all times!!!! It's 3 hours long but I watched it twice in one weekend.,1414022400,,95,4.052631578947368
1237230,4,B00000JQUG,"Too long and overblown, but great musical numbers and very good acting make up for some not too bad flaws",1413072000,,105,4.3
1237231,5,B00000JQUG,excellent,1412640000,,9,9.0
1237232,4,B00000JQUG,"I find it almost shameful that I wasn't really aware of who Luise Rainer was until a few weeks ago.  I had heard the name, obviously, but I didn't know the face, and discovering that she was a two time Oscar winner was kind of a shock to my system.  Watching The Great Ziegfeld made it all the more shameful, since shes so incredible in the film that I feel as though I should be more familiar with who she is.

Im rectifying that the best I can.

The film itself tells the story of famed producer Florenz Ziegfeld and his captivating stage shows.  I had seen Funny Girl years ago, and so I was familiar with Ziegfelds Follies and the whole Fanny Brice chapter of his career, but I was not familiar with his early years nor his later years, and so it was nice to see how well this film handled the entirety of his career.  I do find that the last chapter of the film does feel rushed, pertaining to his marriage to Billie Burke and his death, and poor Myrna Loy is horribly underused here, but his rise to fame and marriage/relationship with Anna Held is covered tremendously well, and his hold on the industry and immense eye for talent is brought to the light beautifully.

The ensemble here works wonderfully together, with Powell anchoring the film in such a strong way, delivering a well-rounded man that we can root for despite the obvious failings.  Frank Morgan is a great supporting player here, playing the perfect shoulder for Ziegfeld to lean on.  Morgan was such a great character actor, one who I continue to be moved and surprised by.  Fanny Brice is nice in small role as herself, and Virginia Bruce is the perfect foil to a happy marriage, but this whole film belongs to Luise Rainers brilliant portrayal of Anna Held.  What a marvelously crafted performance.  Touching every corner of this womans personality, Rainer crafts a complete portrait.  We see her impatience, her ambition, her loyalty, her frailty, her heartbreak, her loveeverything.  She moves with such grace and charm and creates an unforgettable presence.  Maybe thats why she won the Lead Actress Oscar despite being a clear Supporting player in this film.

The sets are beautiful, the costumes spellbinding and the music lavish and fun.  I do wish that some trimming had been done, because even though a lot of the film moves briskly despite its three hour running length, there are moments where it feels like Im watching a stage spectacle (especially that bloated presentation of Ziegfelds Follies) and it takes me out of the intimacy created in the actual story being told here.

Overall, I was impressed and cant wait to watch more from Rainer herself!",1412640000,,2641,4.667386609071274
1237233,5,B00000JQUG,The stage scenes are fantastic as well as the story lines!,1409011200,,58,4.363636363636363
1237234,5,B00000JQUG,Excellent. I love movies movies of the 30's.,1407888000,,44,4.625
1237245,5,B00000JQUG,"A wonderful move, this is a movie, how can anyone rate someone else's taste?  I liked it and if you're gonna buy it you probably seen it before.  As far as the DVD case goes, it's the same as pretty much everything now in days, being made cheaper and cheaper.",1406851200,,259,4.16
1237246,4,B00000JQUG,"As I love old movies and wanted to hear and see Fanny Brice in the flesh as it were, I loved it. Louise Reiner was cloying sweet throughout and made it hard to watch at times. Myrna Loy made up for it.  William Powell was amazing and lovable perhaps not like the real Flo Z.

A follow up will be to see The Ziegfeld Girls with Lana and Hedy in all their glorious halcyon days.

Any fan of movies old or new should see this flic. Vunderbar!!!!

Brooklyn Barbra",1405641600,,459,4.123595505617978
1237247,3,B00000JQUG,"I like William Powell and Myrna Loy, but I did not particularly care for the film.  I thought it was somewhat slow paced.  My wife, on the other hand, would give it four stars.  Ziegfeld's life wasn't that interesting to me.",1403395200,,224,4.414634146341464
1237248,5,B00000JQUG,This was fun to watch and see the bygone staging of show girls and music. The music was all familiar and loved. Great costumes and nice story. Wish it was in color but it is an old movie and it is good to stay true.,1402876800,,215,3.8
1237249,5,B00000JQUG,This film won the Oscar for Best Picture of 1936! Another addition to my collection of every Best Picture Oscar winning film.,1397865600,,125,4.7272727272727275
1237250,3,B00000JQUG,It seems very long and takes a while to get into it.  The acting is - good for the time that it was made.  It is a nice break from the movies on now.,1393286400,,149,3.3529411764705883
1237251,5,B00000JQUG,"What a great movie!  I never realized how absolutely handsome William Powell was!  It's a classic black and white, but I kept finding myself wondering what it looked like in color (as they were shooting it).  Wonderful sets, music, dialogue and dancing.  He was such a genius, too bad he couldn't reel in his compulsive spending.

Fair warning - it's a long movie, about 3 hours.  Take advantage of the ""Intermission"" segment. :-)",1390867200,2,430,4.821917808219178
1237252,4,B00000JQUG,"I ordered this film with the intention that my Mom enjoys old classic films of the 30's; this 1936 musical is indicative of the fine films presented in that golden era. The film is, indeed, enjoyable, but the storyline is not as authentic of the life Ziegfeld as it could be. It is basically apocryphal to present the showman in a heroic manner . Fanny Brice, a sensational, electric major star of her time, has a brief and too abrupt part in the film. The same thing could be said for Will Roger' s appearance. The costumes and scenery will take your breath away! They really capture and recreate a 'typical' Ziegfeld Follies show. For the costumes, scenery, great acting  by William Powell, Myrna Loy, and Louise Rainer, this film is a winner.",1390348800,,745,4.601503759398496
1237253,5,B00000JQUG,Great seller super fast shipping .the dvd was clean n worked perfectly. Its a great movie basically the first of all 3 ziegfeld dvds or movies .its a great addition to anyone who loves the movies.the item was shipped nicely the box it came in was clean had no flaws this seller Iis highly recommended,1389916800,,300,4.472727272727273
1237254,4,B00000JQUG,"A period piece that is fun only if you're into such movies. It's corny as all get out, but it is what it is: a fictionalized biography of Flo Ziegfeld's life as a promoter and showman. I bought it primarily for the production musical numbers which are perfect examples that nothing succeeds like excess. Ziegfeld spared no expensesomething his creditors apparently hounded him about trying to get him to pay his bills. Comments on his extremes are quickly followed by in-your-face examplesblatant foreshadowing with instant payoff, if you will. Relationships are very nearly all caricatures, and the scenery must have tasted very good for all the chewing it receives. Yet I enjoyed itwell, parts of it, and will look at those extravagant musical numbers repeatedly, though I'll never watch the entire movie. I recommend it only with a strong caveat. Consider yourself warned.",1389398400,2,875,5.125874125874126
1237275,5,B00000JQUG,"If you love classic old movies, you will love this one too.  I really enjoy movies with William Powell.  Buy it, you won't be sorry.",1387065600,,132,4.24
1237276,5,B00000JQUG,Nice old movies to entertain yourself or others.  Especially on a cold winter night with a warm bowl of popcorn.,1383868800,,112,4.6
1237277,3,B00000JQUG,"As a rule, I tend to watch anything claiming to be a biopic with a great deal of suspicion (as far as reliability goes).  In this case, the claim is that this is a `fictionalized' tribute to Florenz Ziegfeld, Jr. and therefore already has the suspicion of inaccuracy built in.  Names of real people were changed to avoid lawsuits.  Billie Burke acted as the film supervisor, which did not include playing herself as Flo's last wife (the role went to Myrna Loy instead, who managed to act like everyone but Glinda the good witch).  The movie is long (on the long side of long) at 185 minutes.  Not all of it is entertaining.  But yes, ""a Pretty Girl is like a Melody"" is a fabulous number in dazzling black and white (a feat of engineering alone for the way the curtain lowers over the freakishly large wedding cake set piece).  Ray Bolger, playing himself, has a fantastic dance number.  Unfortunately, they all but obliterated most of Fanny Brice's numbers.  Frank Morgan is a hoot as Jack Billings, Flo's nemesis and friend.  Reginald Owen is great as Flo's nervous bookkeeper.  While William Powell, on the other hand, portrays Ziegfeld as a superstitious, manipulative charmer never completely satisfied with anything, bent on ruin, losing his first wife to neglect and indifference, in all, not a very nice man.  As for Luise Rainer's Oscar winning role as Anna Held, all I can say is that Carole Lombard was robbed (nominated at the same time for My Man Godfrey).",1380412800,2,1469,4.7176470588235295
1237278,4,B00000JQUG,This Had been a favorite of mine in past years. The only thing  was the oldness of it kinda got me. ME,1374537600,,102,3.6363636363636362
1237279,5,B00000JQUG,good clean fun and insight into the life of a real showman. this is about ziggys life not so much about his shows,1374192000,,113,3.9565217391304346
1237280,5,B00000JQUG,The film was great!! Powell and Loy are once again a great combination to watch.  The film was very touching.,1372809600,,109,4.45
1237281,3,B00000JQUG,"This movie does credit to Ziegfeld showing some of his productions.
Alas, it does not show William Powell as well as it should, with too much of it drawn out.",1370736000,,158,4.3
1237282,2,B00000JQUG,"Did not like this film at all Badly put together, I thought  Expected much better for a Ziegfeld picture Very disappointed",1370390400,,122,4.809523809523809
1237283,5,B00000JQUG,My husband and I watched this movie the moment it arrived.  The beginning is a little slow but the middle and the end make up for it.  It is a truly must buy video.,1370131200,,164,3.7941176470588234
1237284,5,B00000JQUG,"As a huge Powell fan it was great to see him in this role and Myrna is a real doll, as always. The costumes and stage scenes are magnificent. Whether or not it portrays Ziggy as he treally was, it is awonderful period movie.",1369612800,,224,4.113636363636363
1237295,5,B00000JQUG,I wear my mustache trimmed just like Powell.  Myrna Loy was just marvelous in this Academy Award winning Best Picture!!!!!,1366502400,,122,5.1
1237296,5,B00000JQUG,"This movie is a must see for those that love beauty, Music, &  Hollywood is NOT capable of
making beautiful movies like this in this era.  For one thing there are no more extra beautiful women
to play the parts.",1366156800,,211,4.25
1237297,5,B00000JQUG,"I love the movie, I think that William Powell is a great actor, but I love the old movies I have my picks, but I love the old movies",1366156800,,132,3.586206896551724
1237298,3,B00000JQUG,"William Powell did a great job of accurately portraying the great Ziegfeld with all of his indefatigable optimism and resourcefulness.  Luise Rainer and Myrna Loy portrayed his first and second wives, and Frank Morgan was his lifelong friend, business rival, and frequent money lender.",1365465600,,285,5.4772727272727275
1237299,4,B00000JQUG,"great remembrances of old actors and musical performers for we who are old enough to remember them. Very long, but highly enjoyable.",1365120000,,132,5.045454545454546
1237300,5,B00000JQUG,"A movie classic at the height of MGM's golden era.  The Great Ziegfeld has all the right elements of music, dancing, drama and humor.  Powell, Loy and Rainer give great performances.

A must purchase!",1363824000,,200,4.823529411764706
1237301,5,B00000JQUG,"Florenz Ziegfeld dazzled Broadway for decades with his extravagant ""Follies"" revues but never indulged in the staggering opulence MGM lavished on making this movie about his life. Hunt Stromberg paid about $2 million in 1936 for three hour filming to make this movie the most expensive for the studio.  Some of the memorable scenes worth mentioning are the musical number ""You never looked so beautiful before"" with Virginia Bruce at the top of a highly extravagant set, and ""Pretty girl is like a melody"" with its revolving set like a gigantic wedding cake bearing numerous girls, costumes and props are simply outstanding. The dance sets were created by John Hatkrider and dance director Seymour Felix have done a tremendous job in making the dance sequences memorable. Luise Rainer as Anna Held, the first wife of Ziegfeld and Myrna Loy as the Billie Burke, the second wife of the great showman has done marvelous jobs.

The story of Florenz Ziegfeld Jr. (William Powell) starts as a carnival barker at the 1893 Chicago Fair and his discovery of Sandow, the muscle man (Nat Pendleton). He competes with his best friend and rival, Jack Billings (Frank Morgan) by signing a popular French actress named Anna Held (Luise Rainer) to work for him in United States. Later they get married, but surrounded by gorgeous show girls; his relationship with his wife suffers, mainly from Audrey Dane (Virginia Bruce) who breaks his marriage to Anna Held. Ziegfeld later meets and marries Billie Burke (Myrna Loy), and she stands by him during the downfall of his show business at the height of great depression. Throughout his career he uses the skills of Ed Wynn, Fanny Brice, W.C. Fields, Will Rogers, and Bert Williams as the comic leads, combined with music of Jerome Kern, Victor Herbert, Irving Berlin, and the Gershwin. Above all his dream of ""Glorifying the American girl"" pays off in the early part of his career.

The movie won the Academy award in the best picture category and also for Louise Rainer in the best supporting actress category. Unfortunately another MGM's all time great ""San Francisco"" about 1906 earthquake surpassed Great Ziegfeld in popularity to become one of the MGM's all time winners. In the same year MGM's another success story, ""Camille"" starring Greta Garbo in the lead offers the best performance of her illustrious career only to be beaten by Luise Rainer during the 1936 Academy awards.

1.&nbsp;<a data-hook=""product-link-linked"" class=""a-link-normal"" href=""/San-Francisco/dp/B004KB8P1G/ref=cm_cr_arp_d_rvw_txt?ie=UTF8"">San Francisco</a>
2.&nbsp;<a data-hook=""product-link-linked"" class=""a-link-normal"" href=""/Camille-1937/dp/B001O4XLZC/ref=cm_cr_arp_d_rvw_txt?ie=UTF8"">Camille (1937)</a>
3.&nbsp;<a data-hook=""product-link-linked"" class=""a-link-normal"" href=""/Ziegfeld-Follies/dp/B000EBD9SK/ref=cm_cr_arp_d_rvw_txt?ie=UTF8"">Ziegfeld Follies</a>
4.&nbsp;<a data-hook=""product-link-linked"" class=""a-link-normal"" href=""/Classic-Musicals-from-the-Dream-Factory-Vol-1-Ziegfeld-Follies-Till-the-Clouds-Roll-By-Three-Little-Words-Summer-Stock-It-s-Always-Fair-Weather/dp/B000EBGE5U/ref=cm_cr_arp_d_rvw_txt?ie=UTF8"">Classic Musicals from the Dream Factory, Vol. 1 (Ziegfeld Follies / Till the Clouds Roll By / Three Little Words / Summer Stock / It's Always Fair Weather)</a>
5.&nbsp;<a data-hook=""product-link-linked"" class=""a-link-normal"" href=""/Ziegfeld-Girl/dp/B0001DCYUK/ref=cm_cr_arp_d_rvw_txt?ie=UTF8"">Ziegfeld Girl</a>",1363219200,,3450,6.5758241758241756
1237302,3,B00000JQUG,"Interesting movie, bait too melodramatic. Would have been better with more on actual shows.  Scene with multi level set was amazing.",1362268800,,132,5.285714285714286
1237303,5,B00000JQUG,"Extravagant production - the costumes are to die for.  Everyone does a wonderful job and it is a very entertaining movie, especially since I got it at such a bargain price.",1361923200,,172,4.548387096774194
1237304,5,B00000JQUG,"If you are interested in this subject, you will not be disappointed in buying this film.  Great dances in it",1360454400,,108,4.4
1237325,3,B00000JQUG,"Made shortly after Ziegfeld's death, this is a movie with spectacular musical numbers. The fact that, naturally, none of it is done with CGI just makes you appreciate it more. The story, however, is a rather flat, lackluster telling of one of the more exciting figures of the Gilded Age. However, you do get to see William Powell and Myrna Loy together, so that's always good.",1357776000,,376,4.712121212121212
