,overall,asin,reviewText,unixReviewTime,vote,reviewLength,wordLength
2268807,5,B00097DXG2,"""The Forgotten Films of Roscoe `Fatty' ARBUCKLE"" is a sad and wonderful four volume DVD boxed set.  It is a heartfelt labor of love valentine to a great silent era movie clown who bounced back even stronger after a 1922 San Francisco sex scandal that was filled with scandalous lies and downright nastiness.  Faced with a public that refused to believe the court ruling that he was innocent of all charges Arbuckle, helped by best friend Buster Keaton, became a renowned and downright brilliant writer and director in the late twenties.  He also helped direct several Keaton silent feature masterpieces without credit.

What a lovely DVD boxed set this is!  Volumes one and two, about two-and-a-half-hours each, give us the Keystone gems of 1914-1915.  Roscoe Arbuckle stars in several two-reelers for Mack Sennett with newcomer Charlie Chaplin, including THE KNOCKOUT and THE ROUNDERS.  These two volumes give generous coverage to ""Fatty and Mabel"" (Normand), often as neighbors, often married to one another.  Titles include ...WASH DAY, ...AT THE SAN DIEGO EXPOSITION, FATTY'S NEW ROLE, FATTY'S FAITHFUL FIDO, ...MARRIED LIFE, and WISHED ON MABEL.  These shorts are funny, poignant, and very nostalgic.  I've only seen one Mabel Normand feature film, from 1923; I do wish she had lived to make more.  Rumor has it that Mabel and Roscoe (no one close to him called him ""Fatty"") often directed their own films.  And that Chaplin and Arbuckle (and Keaton later) stole gags from one another.  Significantly, Arbuckle usually got there first.

ARBUCKLE disk three has FATTY'S TINTYPE TANGLE (1915); HE DID AND HE DIDN'T (1916) with full tinting, and the nostalgic CONEY ISLAND (1917).  Co-stars include Keaton, Al St. John, Normand, Louise Fazenda, and Edgar Kennedy.  But the jewel of disk three is the premiere revival of a ""lost"" film called  LOVE (1919), with Monty Banks and St. John joining Roscoe.  My only regret is the exclusion of my favorite ""Fatty and Mabel"" two-reeler, FATTY AND MABEL ADRIFT (1916).  Maybe it can star in an Arbuckle volume two collection.

The real revelations take place in disk four with LEAP YEAR (1921), never released in America.  It is presented here in a gorgeous 35mm tinted archive print found in Europe and shows us a new direction Arbuckle might have taken  if the blasted scandal had not destroyed him forever as an actor.  It is a Noel Coward-like drawing room romantic comedy.  Let's search some more European film archives for other ""lost"" Arbuckle features from around 1921.

But the real astonishment for me with this whole incomparable boxed set is the second half of volume four, Arbuckle spending the 1920's  busy as a stunningly creative writer and director named ""William Goodrich."" Rumor has it that, uncredited, Arbuckle helped best friend Buster Keaton direct several silent Keaton features.  As Goodrich, he just about floors one with uproarious laughter in a 1925 western cliffhanger serial spoof called CURSES (Al St. John), the 1925-1926 Hollywood satires THE MOVIES (Lloyd Hamilton) and MY STARS (Johnny Arthur), and a 1926 thrill comedy called FOOL'S LUCK (Lupino Lane).

Funniest and most inventive of all is a 1932 sound one-reel domestic farce with Al St. John called BRIDGE WIVES.  People, this comic masterpiece was made only one year before Arbuckle died, giving  the complete lie to the Hollywood myth that he died alone and forgotten.  He really died of a heart attack at a writer/director peak.  And he was clearly magnificently talented in both capacities as ""William Goodrich"".  We simply have to find some more ""lost"" Goodrich/Educational Pictures silent shorts if the found and restored ones here are this peerlessly funny!

Silent film comedy lovers, do yourselves a favor.  Buy or rent the fabulously funny ""The Forgotten Films of Roscoe `Fatty' ARBUCKLE"" on four disk DVD today.  Spend four very special nights with Roscoe and realize that he truly was and is one of the silver screen's four great silent clowns, now and forever.

The DVD set, incidentally, comes with a lovely 36 page color booklet with insightful scholar essays on Roscoe Arbuckle's life and films.",1170720000,11,4144,5.085925925925926
2268808,3,B00097DXG2,"For diehard fans of silent comedy, this is an important and overdue collection of Arbuckle's shorts, mostly from the teens, as well as some of his post-scandal directorial efforts. It contains much rare material, and it is very nicely restored and assembled.

And yet... compared to the best silent comedies, say the Keaton shorts or the Chaplin Mutuals, this is mostly pretty thin stuff. It's not Arbuckle's fault, exactly -- he was an incredibly dextrous physical comedian. But his screen persona -- a giant man-child ball of id -- is far less attractive than Keaton's or Chaplin's. The best silent comedies work by setting you up to expect one thing, and then giving you something else. These films, like the earliest Chaplins, work mainly on the Sennett principle: effectively delivering the gag you expect.

This is certainly the best Arbuckle collection available, and the four DVDs are reasonably priced. But if you don't already own the major box sets of Keaton, Chaplin, or Lloyd, or Harry Langdon: The Forgotten Comic, I would steer you there first.",1135987200,19,1059,5.011363636363637
2268809,5,B00097DXG2,"Fatty Arbuckle is just as important as Chaplin,Keaton,Lloyd and Laurel and Hardy in the silent era and this box set proves that!! Forget the scandal that plagued his career and watch these shorts.....BUY IT!!",1128902400,2,208,5.147058823529412
2268810,4,B00097DXG2,"You don't have to believe that Roscoe ""Fatty"" Arbuckle is the equal in genius to Chaplin, Lloyd and Keaton to appreciate this collection. The producers of this set believe he is, and they have put a great deal of love and dedication into this collection. Two aspects of Arbuckle's talents are showcased: as a silent comic actor with Keystone and later independently, and as a writer or director (later using the pseudonym ""William Goodrich"" after his notorious scandal rendered him unemployable after 1922).

To be convinced of Roscoe's talents as a comic actor, one needs first to check out  ""Fatty's Plucky Pup"", the best Keystone entry in this collection.  Often, Arbuckle's screen character is lazy, clumsy and empty-headed, prone to intentional or unintentional violence, until eventually driven by the love of a girl or some other incentive into redemptive action. The first reel of this movie is one of the best sequences in early silent comedy, as Fatty first burns his bed by falling asleep smoking, then transforms wash day into a disaster, as he first drops the laundry into the mud, then hangs it up, then tries to wash the clothes again with the hose, only resulting in getting himself, and his mother, soaked. The visual humor builds and cascades naturally, with all the actors well synchronized as in a dance or a vaudeville tumbling act. The Keystone-style chase at the end, showcasing the remarkable Luke the dog, is surprisingly refined, even suspenseful. This film matches easily, and perhaps exceeds, the creative output of Chaplin  during the same period. Other fascinating films include ""He Did and He Didn't"" with Mabel Normand, which is a surprisingly dark, serious (albeit with a surprise ending) study of jealousy and revenge; ""Coney Island"" with Buster Keaton, an early glimpse into their partnership; and a generous sampling of other Keystone partnerings with Mabel Normand.  This team produced movies that are remarkably sweet and romantic without being sugary.

As a sheer creative force, however, I was not convinced that Arbuckle belongs with Chaplin, Lloyd or Keaton. The later films in volume 4, which showcase his technical skills as writer and director, are at best a mixed bag. The movies starring Al St. John and Lupino Lane, in particular, are tired, unfunny imitations of the style of Keaton, Lloyd and the Keystone studio.

Another reason for owning this set is to gain a new appreciation of the output of the Keystone studio itself. The restorations in this set are superb, with good resolution and an apparent reduction in the speed of the film, so one gets a chance to observe the comic detail. The result is a realization that Keystone films were not all punches, kicks, cop chases and exaggerated pantomime.

As a final side note, someone seriously should do a box set on Mabel Normand. Her grace, breeziness and natural style of acting make her entirely convincing to the modern viewer -- she is closer to modern comic actresses like Meg Ryan than to the ""silent clowns"" she appeared with. Her humor often arises from a contrast between her innocent, petite, feminine exterior and a flirtatious, even lascivious behavior, and she can take or give a punch, or a comic fall, as good as the guys.  Focus on her, rather than Fatty, in ""Fatty and Mabel at the San Diego Exposition"", or in ""He Did and He didn't"" -- you might be dazzled.",1127347200,25,3378,4.933098591549296
2268811,2,B00097DXG2,"If there is going to be a rehabilitation of Fatty Arbuckle that makes it plain that he was treated unfairly by the press and that his career was unjustly ruined by an infamous rape trial, count me in. If there is going to be an attempt to reappraise him and recategorize him from being a crude slapstick comic to being on the same level of such greats as Keaton, Chaplin, and Langdon, count me out. Arbuckle was a crudely physical film comic. Loonies such as the commentators on the audio tracks on this collection have watched far too many silent films and have lost all perspective if they think Arbuckle was great. He was okay for his time but his films have aged poorly. Keaton's films (both shorts and features) keep getting better and better with age and are full of inventiveness and brilliant filmmaking. Chaplin's later features (not his msierable shorts) are among the greatest films ever made. Langdon had a few good moments and Lloyd made a handful of very good features. Arbuckle shouldn't be forgotten; he shouldn't be elevated to the first tier of film comics, either. This is crude, dated stuff. Perhaps we have released all the silent films on dvd worth releasing.",1122681600,19,1181,4.7101449275362315
2268812,5,B00097DXG2,"I don't know what to say that hasn't been said here. I absolutely love these DVDs, the quality is fantastic, the music is great, no annoying sound effects here, and the booklet that comes with the set is gold. Arbuckle may well be the most tragic figure in Hollywood history. He has been repeatedly trashed and lied about through the decades, starting with contemporary newspapers, women's groups, rubbish on tabloid-TV  shows, Anger's obscene books, and the recent ""I, Fatty"" whose author fictionalized the man's life and passed it off as truth. A drunken woman of very ill repute died after possibly having a back-alley abortion at one of Arbuckle's parties. Thanks to a lying friend of the victim and a crooked DA (Hollywood couldn't even write this), as well as a public eager for gossip on newly created movie stars and phony pictures in the papers, Arbuckle is still known by the lesser educated at the ""fat guy who killed a woman with a bottle."" Thank goodness Paul Gierucki and his Laughsmith company have come along with these films and a documentary. The man died over 70 years ago, still slandered.
These films looks so good you wouldn't think they were made as long ago as 1913. Some you can watch with commentary, and I prefer the latter. I wish they all had commentary! It feels like Laughsmith Ent is in the room watching with you, and educating you as well, pointing out many bits of delicious trivia. Arbuckle is hysterical, so much so that it's not as apparent that you're watching something so old. Some films of the early teens are barely watchable, they look so dated. Arbuckle's antics make them enjoyable, and I know kids would enjoy these films. Buster Keaton (Arbuckle's buddy by the way) is popular with children. Silent comic fans: Buy this!! If you have to get a used copy, get one with the booklet.",1121558400,10,1827,4.709375
2268813,5,B00097DXG2,"If you're even considering whether to buy this or not, the answer should be YES.  This is a long overdue tribute to one of the greatest and most influential movie comedians ever.  There are several other customer reviews here that go into detail, so I won't.  Take a look at what they say and add my vote in with their rave reviews.",1118534400,8,332,4.32258064516129
2268814,5,B00097DXG2,"This is a superb 4-disc set that has been long overdue, but well worth the wait.  Obviously a great deal of careful thought and effort has gone into this set, both in film restoration and overall presentation so that silent comedy experts and novices alike are sure to get a lot out of it.  For a start, a 36-page booklet with excellent photos (some in color) contains essays and various information on Arbuckle, his work and films, as well as the manslaughter charge in 1921 - of which he was acquitted - that drastically changed the course of his career.  Due to those unfortunate events many Arbuckle films have been sorely neglected, and most people might only be familiar with him through his 1917-1919 films with his famous prot&eacute;g&eacute;, Buster Keaton.  The films presented here range from his start in the classic Keystone comedies in 1913 to a sound comedy (the only sound film in this set) from 1932 directed by Arbuckle, but most of them are Keystone comedies from 1915.  They are the classic slapstick comedies most of us are familiar with, yet this selection is enhanced by other great comedy talents like the charming and delightful Mabel Normand who interacted with Arbuckle so well that this team was immensely popular with audiences; the often overlooked talents of lanky Al St John, who often plays Arbuckle's love rival and is an amusing contrast to Arbuckle's rotundness; and let's not forget Luke, the amazing super dog who adds spice to every scene in which he appears.  Other highlights for me personally are, of course, Arbuckle's trademark flips and flicks with flapjacks and huge kitchen knives which he does expertly without even looking, and his very convincing transformation in women's apparel:  really, if you didn't know it was Roscoe, you'd swear it was a funny, chubby girl!

Most of my favourites are on the fourth disc which features films of the 1920s, starting with a great 1-hour feature film ""Leap Year"", which was never released in the US.  There is an entertaining segment featuring  brief (ie a few seconds) appearances of other big stars: Keaton, Valentino, Fairbanks, Harold Lloyd and Jackie Coogan, and then five more comedies, each one quite different and all directed by Roscoe Arbuckle (some written by him as well) under the name of William Goodrich, and each one features other comedians.  Particularly impressive is ""My Stars"" with Johnny Arthur, who does a great job of impersonating and making fun of stars like Harold Lloyd and Douglas Fairbanks - the latter dressed as Robin Hood, making flying leaps, bounds and gestures in an attempt to put Fairbanks to shame.  I also got a kick out of the clever short sound comedy, ""Bridge Wives"", but with such variety on this disc and overall in the whole set, I'm sure there'll be something to satisfy everyone.  Furthermore, careful attention to musical accompaniment means variety in performances and instruments (though most are piano scores) and there are also a few commentary tracks which add more insight into Arbuckle, his films and his many talented co-stars.  Definitely a must for all silent comedy and slapstick fans!",1118361600,32,3134,4.956106870229007
2268815,5,B00097DXG2,"This 4-DVD set has been a long time in coming and should go a long way in helping to restore Roscoe Arbuckle to his rightful place in the history of film comedy. One of its most rewarding aspects is the tracing of Arbuckle's development as a comic genius and having the opportunity to see the antics of some of the lesser known people he surrounded himself with. The collaborations with Mabel Normand and Al St John have been around for years but you almost never get to see Minta Durfee (Arbuckle's first wife and lifelong friend) or Edgar Kennedy (when he had hair) before his Hal Roach days. It's great to have the early Keystone comedies in decent prints (paper prints from the Library Of Congress) although the formula does wear thin after awhile.

Of special interest are discs 3 and 4 devoted to Arbuckle after Keystone and to his directing efforts after the 1921 scandal which wrongly resulted in his being banned from the screen as a performer. This material is very rare and features comics Lloyd Hamilton and Lupino Lane as well as a special treat from Douglas Fairbanks called CHARACTER STUDIES which features Carter DeHaven and a surprise postscandal appearance by Arbuckle. There is also an over the top sound film with Al St John (before he became a B Western sidekick) called BRIDGE WIVES which must be seen to be believed.

This brings me to the three minor issues I have with this otherwise sterling set. It would have nice to have one of the late Arbuckle sound shorts included so that we could hear Roscoe talk as well as see one of his last onscreen appearances. Why are there two versions of HE DID AND HE DIDN'T (only the tinting differs) when there could have been one more comedy added? It would also have been nice to have more commentary to give background on these films as they unfold. Out of 30 films only 7 have this feature.

But these are minor complaints with one of the best packaged silent sets in recent memory. The film presentations are fine, the musical accompaniment ideal, the commentary good, and the choice of material is great  (Fatty's only surviving feature film LEAP YEAR is especially valuable to have and see). This release also comes with a comprehensive 35 page booklet on Arbuckle and the restoration work that needed to be done. Anyone who has any interest in silent film comedy should acquire this collection as soon as possible to be put up on the shelf with their Chaplin and Keaton sets. At long last Roscoe Arbuckle is finally getting his due and it's about time.",1116892800,43,2522,4.635346756152125
2268816,5,B00097DXG2,"A series of rare Roscoe Arbuckle films lovingly restored. In particular the release of the very rare ""Love,"" and the feature ""Leap Year."" Also several examples of Arbuckle's later direction shows Arbuckle's keen understanding of film comedy. Arbuckle was a comedy genius unjustly neglected, and this DVD gives him his due. The films on this series are GREAT!",1116288000,5,358,5.189655172413793
2268817,1,B00097DXG2,"While the content is excellent and highly recommended (5 Star rating), the quality of disc material these programs are burned on is not (0 star rating). I just bought this product this year. Only opened the case twice and has been stored in a DVD cabinet.

All four discs have the lamination material 'dissolving' or falling off it. While Disc 1 and 2 are playing, with some pauses and skips, Disc 2 and 3 are totally unplayable and unreadable, so I can't even see the content.

Don't know how wide spread this issue is with these, but I would recommend people to try and get this collection through a library to actually see it and avoid buying.

If buying though, make sure the seller will replace any defective discs.

This is a high quality program, but burned on defective material.",1406160000,3,787,4.6
2268818,5,B00097DXG2,GREAT.....so be more,1405209600,,20,6.0
2268819,5,B00097DXG2,"I had little interest in silent films until I happened upon a showing of ""Love"" starring Roscoe ""Fatty"" Arbuckle on Turner Classic Movies in March 2013. I couldn't stop watching and I became hooked. Plenty of others here given verbiage to the genius of this man, despite the scandal that clouded the latter part of his life. All I can say is that I'm glad I bought this DVD set. Arbuckle was ahead of his time. If you like comedy styles like those of John Belushi, Chris Farley, John Candy, Benny Hill and Curly Howard then this is the Godfather of those ""Big Men"" of the film comedy genre. Especially if you're a Benny Hill fan, you can tell easily that Hill was influenced heavily by Arbuckle. The facial gestures, the misogynistic treatment of women (for comedy's sake) and other gags are very similar between the two.

Anyway, because of a chance night of watching TCM, I'm now a Roscoe Arbuckle fan. ""He Did And He Didn't"", ""The Rounders"" (with Charlie Chaplin), ""That Little Band of Gold"", ""The Waiter's Ball"" and ""Coney Island"" are among my favorites. His comedic works still stand the test of time, with scenarios that relate in 2014 just as they did in 1914. Mabel Normand and Al St. John are just priceless additions and add to the wonderful chemistry. Thanks to Roscoe, now I'm after collections of Keaton, Chaplin and other early heroes of cinema. That's how much this collection meant to me. Thanks to Laughsmith Entertainment for putting in the work, because the love is clearly evident.

Just buy this set. Don't hesitate. Get it before it goes out of print.  You'll thank yourself later.",1394323200,,1603,4.697508896797153
2268820,3,B00097DXG2,"The Films are brilliant and Arbuckle is an absolute physical comedy genius.  I saw many gags invented by Arbuckle that were used by later comedians in later films. I loved discs 1,2, and 4, however, disc three was completely blank.",1392768000,,231,4.775
2268821,5,B00097DXG2,"It's ironic that at one time Roscoe ""Fatty"" Arbuckle's popularity as a silent screen comedian rivaled that of Charlie Chaplin, Buster Keaton, and Harold Lloyd, until the scandalous rape/murder trial of 1921 that sealed his fate. Although judged innocent of the charge, Arbuckle was blacklisted and his films were banned across the nation. He made a brief comeback in the early '30's in shorts made by the Vitaphone Co. until his untimely death in 1933.

Arbuckle's comedies relied heavily on slapstick, which was the main ingredient at Mack Sennett's Keystone studio where Arbuckle got his start in 1913. His films also contain clever gags and are often more technically innovative than those of his contemporaries. Some even reach a sublime level, such as the charming HE DID AND HE DIDN'T (Triangle, 1916). Being as rotund as he was, Arbuckle was extremely agile, and could take pratfalls with the grace of a dancer. Not only did he influence Chaplin and Keaton at the beginning of their careers, but others like Stan Laurel, Oliver Hardy and The Three Stooges borrowed and expanded many of Arbuckle's ideas.

Mackinac Media's 4 DVD collection of 32 shorts preserves the legacy of Fatty Arbuckle for the 21st century in fully restored prints, some containing previously lost footage. Several of Arbuckle's co-stars included here besides Chaplin and Keaton are Mabel Normand, Harold Lloyd, Al St. John, Ford Sterling and Edgar Kennedy. The quality, considering the age of the films, is excellent. New scores were composed by Philip Carli, David Drazin, Ben Model, The Mont Alto Orchestra, The Paragon Ragtime Orchestra, Rodney Sauer and Donald Sosin. Bonus features include alternate commentary tracks, a handsomely illustrated 36 page booklet that includes essays and a chronological list of the movies in this volume. There's also a new music video, ""The Arbuckle Shuffle"", made up of film clips.

I cannot praise this collection highly enough. Every lover of silent comedy should grab this up and experience the genius of ""Fatty"" Arbuckle from a fresh perspective. It's a long overdue tribute to a totally original performer, one of the first great clowns of the cinema.

Highly recommended.",1376438400,,2195,5.174647887323943
2268822,4,B00097DXG2,"This collection was clearly a labor of love for the producers. The quality of the restoration and the rarity of many of the films makes this an ideal introduction to Roscoe Arbuckle, a comic actor many people rank just below Chaplin, Keaton and Lloyd. If your only familiarity with Arbuckle is the Virginia Rappe scandal (of which he was found NOT GUILTY), I recommend you take a look at these films to discover what a marvelous talent the world lost when the media figuratively railroaded him out of Hollywood. Several examples of his work as a director under the pseudonym William Goodrich are also included. By the way, he was never known as Will B. Good; that's a long-standing Hollywood myth.",1374451200,,697,4.768595041322314
2268823,5,B00097DXG2,Good quality silents...every now and then I'll watch a few late at night when I'm in the mood...still enjoyable in a simple kind of way.,1366934400,,136,4.48
2268824,5,B00097DXG2,"This four disc set is a great tribute to one of the greats of silent comedy, Roscoe ""Fatty"" Arbuckle. These four discs are PACKED with hilarious content. Included are 24 wonderful shorts (many of which will have you roaring with laughter), Fatty's full length feature film (""Leap Year""), and both silent and sound films directed by Fatty.

The musical accompaniment is always appropriate to both the time and the scene. The transfers are beautiful (keeping in mind that some of these films are almost 100 years old!), and the packaging is superb. Mackinac Media even includes a 36 page booklet, giving info on the films, Fatty's career, the trial that ended his acting career, and the restoration process (which was extensive).

Bottom line is, if you can find a copy of this out-of-print DVD set....SNATCH IT UP AS SOON AS POSSIBLE!",1364083200,,833,4.900709219858156
