,overall,asin,reviewText,unixReviewTime,vote,reviewLength,wordLength
2155774,5,B00031V23K,"Ever wonder where all the ninja movies of the 1980s came from?

They all came about as a result of The Octagon. It was the first ninja movie made in the U.S. It was a huge hit and it single-handedly created the ninja-mania of the '80s.

I am a huge Chuck Norris fan and I rank The Octagon as the VEYR BEST movie he has made to date. Not only did the movie make a ton of money at the box office (his most profitable film to date) but it demonstrates Chuck's best karate skills.

Watching this movie, you can really see Chuck's skilled martial arts technique and see what he is capable of doing. YOU SEE WHY THIS GUY WAS UNDEFEATED WORLD KARATE CHAMPION SIX TIMES IN A ROW. This movie doesn't require a bunch of cheesy MTV jump-cut edits to deliver good martial arts action like today's cheesy martial arts movies.

Here's an FYI: the more camera edits you have during kicks and punches, the less skilled the actor is at doing them. The Octagon shows that Norris doesn't need camera edits to execute triple spinning-back-kicks. He does them one right after another, all right in front of your eyes, from one camera angle (!!!)

This movie also features the great Richard Norton in a hidden role as the main masked ninja heavy that Chuck takes on in the final scene.

I am so glad to see that this movie is now out on DVD and with some excellent behind the scenes back-features. Two well-produced over 30-minute long documentaries on The Octagon and American Cinema, as well as trailers and 5.1 and surround sound (!!!)

After The Octagon, Chuck went on to make An Eye for an Eye, another great Chuck flick. But, to me, The Octagon will always be No. 1. If you want to see what Chuck Norris is capagle of doing in peak form. What him kick some serious ninja butt in this one - the ORIGINAL NINJA MOVIE!",1101513600,31,1799,4.368263473053892
2155775,5,B00031V23K,"This movie is my favorite one of all his movies he's done. Loved the  action, excellent choreography, and very well acted. The plot is very well written.",1419033600,,153,4.666666666666667
2155776,5,B00031V23K,One of Chuck's best,1417651200,,19,4.0
2155777,5,B00031V23K,"great movie to watch and you learn some thing and have some fun to watch, etc",1404432000,,77,3.875
2155778,5,B00031V23K,"Some folks apparently have a problem with Norris's lack of personality or capabilities as an action screen persona, but it's too ridiculous to overthink a film like ""The Octagon""--it's one of the most exciting action/martial arts films ever made and, despite the fact that many don't care for films based around this specialty, ""The Octagon"" goes forward with telling a story, and makes the action more than stand up to the narrative thread. It's simple, sure, but the action is complex, inventive, and tough in the extreme. A TV favorite of the late 80s/early 90s, ""The Octagon"" is the kind of action movie that we simply won't see anymore--low in budget, simple in execution, and extreme in action and choreographed effects. In short, it's a real movie, and that goes a long way for me. I also want to add that Norris seems to work well with the electronic voice over effect here. His internal thoughts and concerns are better conveyed through this device rather than having him try to talk through the whole thing; like Eastwood, he is better at staring than speaking, but it works here better than it has elsewhere. A childhood favorite of mine (mainly for that climactic invasion of the fortress) and still a film that remains enjoyable. It's pure pulp--and won't appeal to those who think that ""Titanic"" and ""Gone with the Wind"" are perfect movies--but it works every time, and this DVD transfer is quite good for a print that is this old and underfunded to begin with.
One of the best things about the DVD is the documentary footage about the creators of American Cinema. These folks were doing independent cinema before it was officially invented, making films that would really only appeal to special interest groups at the time of their release, but nonetheless managed to gather some mainstream appeal as time went on (and now, for us amateur and even professional archivists, become important cultural documents of note). The documentaries cover the aspects of most of this film, but also of others too. It was interesting to hear about the origins of one of my childhood favorites.
""The Octagon"" may remain a special appeal type of movie (there's not as much straight action as there is in most mainstream genre films, but the climactic battle is super exciting), but to those of us who get it (and appreciate the unusual movie marketing aesthetic from whence its kind stems) it will remain a terrific movie experience.",1404259200,5,2432,4.862650602409639
2155779,5,B00031V23K,"Old martial arts movie. Very good, fun to watch. I love Chuck Norris movies. Would recommend to ma movie lovers",1369180800,,111,4.6
2155780,5,B00031V23K,I saw this movie at the drive-in in my home town and I have always been a big of Chuck Norris,1366243200,,93,3.4761904761904763
2155781,3,B00031V23K,"I think it was ok but it isn't as good as some of his other movies
I loved the fights in it and i would recommend it to friends.",1363564800,,128,3.4482758620689653
2155782,5,B00031V23K,one of my all time fav chuck movies. yamashita was great as sukura.. chucks bro was great as ninja enforcer with sai's . great dvd a must for chuck fans.,1362268800,,153,4.133333333333334
2155783,5,B00031V23K,The movies was great.  I really enjoyed the content as well as the speed that i recieved the merchandise thanks,1361836800,,111,4.55
2155784,5,B00031V23K,"The movie was great , it's a classic ,a martial artist must have! Arrived quickly and well edited .Thanks awesome",1360886400,,113,4.7
2155785,5,B00031V23K,What a great movie. It's been years since I've seen it. One of Chuck Norris's best fighting movies! It's everything the seller said it was.,1334707200,,139,4.6
2155786,5,B00031V23K,"another movie by the great Chuck Norris, I highly recomend this one to Chuck's many fans. It is an interesting premis & his brother Aaron is in the movie, who has been in some of his movies & has also produced & directed some. And has been a great force behind his brother's sucess!",1334016000,,282,4.2407407407407405
2155787,3,B00031V23K,"""The Octagon"" is a peculiar martial arts movie from Chuck Norris' early career. Despite the praises heaped on it in the documentary features that are included, it has a cheesy early 1980s feel that makes it both fun and fun to laugh along with. Don't get me wrong, I think Chuck Norris is a great guy, and he does a good job with the role, but some of the film is more amusing than it is scary (especially the frequently incomprehensible internal mental monologue fed through an echoplex.) The good news is that Chuck does get to use his amazing fighting skills in a truly stunning climax, but the bad news is that it takes a long time to get even the remotest clue what on earth is going on: pacing early in the film is a bit tortuous at times.

Chuck plays Scott James, a former exhibition fighter trained in martial arts from a young age. He is haunted by the accidental death of a competitor, and despite being the best there is adamantly refuses to use force, even when offered exorbitant prices for his services. The film opens with very annoying voiceover work explaining the opaque backstory and scenes of a budget terrorist training camp where stabbing cantaloupes is high on the curriculum. Chuck promptly gets involved with Nancy Bell (Kim Lankford,) a dancer who used to be a courier for terrorists, which is somehow connected to the assassination of a French diplomat. Nancy is quickly dispatched by terrorists, and it's a good thing for the plot too, because Chuck quickly moves on to another woman with even more problems. This introduces one of the chief problems with the film: there are absolutely tons of characters and subplots that go nowhere or are alternately connected only by the most amazingly tenuous and unbelievable coincidences imaginable. Some movies are intellectually challenging and make you think. That's a good thing. ""The Octagon"" on the other hand frequently just annoys with pointless characters and obscure plotpoints that don't further the story or make the movie more interesting.

Bearing in mind the opening murders of the French diplomat and the dancer, and grasping this is a movie pitting Norris against ninja terrorists, he naturally has to turn to his old chum McCarn (Lee Van Cleef, who is simply stunning in his threatening ascot.) McCarn is the leader of an elite group of bodyguards, though this takes a while to sort out. Soon, both James and McCarn are involved with a beautiful blonde media heiress, Justine (Karen Carlson,) who feeds them the most cockamamie story ever about how her father the publisher was killed, and how she was being threatened by terrorists for her editorial policy. As if this wasn't a ludicrous enough premise it does not help that Carlson is one of the worst actresses in movie history. She turns in a simply appalling over-the-top scenery-chewing performance that is both annoying and amusing (in a B-movie guilty pleasure sort of way.)

It turns out that Seikura (Tadashi Yamashita) is a ninja terrorist leader who has targeted Justine, and who now heads a training camp for the least disciplined ninjas ever (please enjoy the utterly pointless lunch line fight.) Eventually James agrees to infiltrate the terrorist training camp, but this being ""The Octagon"" there is more to the story. It turns out that Seikura is James' adoptive brother, and both trained together as children until a petulant teenage ninja training incident made them sworn enemies for life. Meanwhile A. J. (Art Hindle,) yet another of James' old chums gets involved after much wistful romantic smarminess. James interviews for a job as a mercenary in a very uncomfortable scene after a brief square dance class (featuring noted square dance caller Fenton Jones) but quickly falls out with this group, which is headed by the repulsive Doggo (Kurt Grayson...just what we needed...more characters.) Doggo's purpose is to supply recruits to Seikura, who runs the advanced terrorist training camp. Not everyone makes it through the curriculum, and Doggo falls out of favor quickly. Mercifully Justine is killed with a blowgun dart to the neck, and the average quality of the acting in the film rises exponentially from that point on. Before he can invade Seikura's compound, the Octagon (a very impressive set,) James must first entangle himself with amoral furrier Tibor (Larry Mann) who introduces an unseemly subplot about fur trading. Before it's over there's an unexpected ninja pillow fight, McCarn appears out of nowhere and slinks back in to the woodwork just as surreptitiously, and finally kitchen utensils are brandished as the junior ninjas mutiny in a ninja versus mercenary brawl that is a bit difficult to comprehend.

After much pandemonium the two brothers have the good versus evil fight you knew was coming. It's an amazing fight scene: James brought his sword; Seikura brought his hooks. While all this is going on, the third female lead in the movie, a repentant former terrorist (yes another new character,) Aura (Carol Bagdasarian, a much better actress than the two earlier leading ladies) torches the Octagon in a fiery conclusion. The action in the last twenty minutes of the movie is the payoff for the plodding pace of the first hour or so of the film. Norris fans will definitely not be disappointed.

The film is impenetrable for the first half: new characters come and go and keeping up with it, especially given that many subplots lead nowhere, is a frequently unpleasant chore. I am still unclear on why the characters of A. J. and McCarn were even needed in the film, though their disjointed stories do pad the running time immensely. The acting in the film is inconsistent: Norris is good as is Yamashita, but none of the three female leads is great, though Bagdasarian acquits herself adequately. For me without question the worst element of the film was the use of the echoplex to distort James' inner monologues. The sound quality of the film isn't great to begin with, and this induced distortion is not only annoying, but frequently makes the words indecipherable. In the ""Making of 'The Octagon'"" director Eric Karson claims the effect ""works well."" On that issue I must strongly disagree. Among many praiseworthy elements of the production, though, Dann Cahn's editing is top notch, and the cinematography and color are beautiful.

Speaking of extras, there are a surprising number of them. There are the standard trailer and television clips, cast and crew biographies, a very nicely done 40 minute long ""Making of"" documentary, and a 28 minute film called ""How American Cinema Changed Hollywood Forever,"" which was more interesting that I expected. I was especially interested in the interview segments with Karson, who is a fascinating guy. His explanations of Norris' character and the general discussion of Norris as the ""reluctant American"" are excellent. Also noteworthy are the interview clips with actor and brilliant martial artist Richard Norton (who appears as both Seikura's Enforcer and Long Legs in Doggo's camp.) His recollections are very interesting, and his discussion of the amazing and incredibly lengthy fight scene he did with Norris in the Octagon is astonishing.

""The Octagon"" did well at the box office, and Chuck Norris did well in his role. Though the film has numerous unfortunate distractions, it's an interesting action film that makes you think (though not always in a good way.) I particularly recommend it for Norris fans.",1319155200,,7452,5.004838709677419
2155788,5,B00031V23K,"Like many in my generation I watched all the Chuck Norris movies when they came out, but never thought he was as good as the promise he showed in Return of the Dragon.

Then came The Octagon and I was sure that he was at the tip of a new page of excellence in his career. Unfortunately The Octagon turned out to be the high mark in my estimation, and although I'm sure many will disagree with my take on Chuck's movies, it's hard to argue that he seemed far crisper and at a much higher level when it came to movement and believability of execution during his fight scenes. His ground movements during the initial penetration of the fortress are among my favorites.

For me, someone who has a high degree of respect for Chuck Norris and his accomplishments, this is the one movie to own.",1315785600,,787,4.346938775510204
2155789,4,B00031V23K,"It's bad cess whenever the girl dies on you on the first date. Chuck Norris plays Scott James, once a world-renowned martial arts champion and currently on a date with a beautiful dancer. Scott is invited inside her home, at which point ninjas just erupt out of the woodwork. And just like that, Scott James is dragged back into the world of deadly martial arts and eventually into direct conflict with his sinister adopted brother.

1980's THE OCTAGON came pretty early in Chuck Norris' acting career, but even at this stage he'd already made inroads in establishing himself as a cinematic action star. He'd already laid down that man of few words persona. From jump Norris came across as regular folks, and that, I think, is what made audiences flock to the theater to check out his films. Didn't hurt, too, that he was a legitimate martial arts champion, having won multiple titles in karate before he retired. 183 wins to 10 losses ain't no joke.

I prefer early Chuck Norris to veteran actor Chuck Norris. His films from the late '70s to the early '80s just came with more energy, and I think he hit his peak with CODE OF SILENCE in '85. THE OCTAGON is regarded more as a cult classic. The film's reigning cool factor is, of course, all the ninjas onscreen plying their sly trade of ninjutsu, only to get whacked upside the head by Chuck. I'll admit to this film's being hampered by a sluggish pace and dull flashback sequences (even if there's cool trivia in that Chuck's son, Mike Norris, plays his character at eighteen years old). I'll say that one of the characters, A.J., is borderline intolerable. I'll even agree that the echoplex voice-over plot device - utilized to register Chuck's inner monologue - gets pretty damn silly. I guess the echoplex comes in handy in that it fleshes out Scott James that much more. Chuck Norris really doesn't have a lot of lines in his movies.

Characters keep trying to manipulate Scott, keep trying to pull him back into his old world. He's persistently harried by a beautiful heiress (Karen Carlson) and by a right wing anti-terrorist vigilante (Lee Van Cleef, looking shifty as ever). Later, he's approached by sultry Carol Bagdasarian's character who also wants him to take on the ninjas. Running parallel to Scott's dilemma is a story arc which takes place in a secret ninja training camp, the goal of which is to impart ninja tactics to mercenaries from around the globe. This camp is headed up by Scott's adopted brother, Seikura (Tadashi Yamashita). But keep your eye on the more imposing figure of his enforcer Kyo (played by another martial artist Richard Norton).

The story's shoddy execution in pace is salvaged by the action-packed final twenty minutes, that's when Scott James at last fully commits to taking out the Octagon organization and he sets out to infiltrate the ninja compound. Chuck Norris, in motion, is a whirling dervish. He takes out hapless ninja goons with whiplash combination of strikes and kicks, and when he gets his mitts on ninja weaponry, he uses them to lay waste to even more sucker ninjas. Watch for one scene in which Chuck navigates a series of wooden platforms thru a water hazard area. Chuck performs an impressive forward flip and catapults a ninja in the water, and he keeps that ninja trapped underwater with a leg until he drowns. Except that the stuntman in the ninja costume couldn't draw a breath thru his wet mask and the guy almost really did drown.

The film's absolute highlight is the dynamically choreographed showdown between Chuck and Richard Norton near the end. This is a tasty fighty fight with both cats getting their licks in. It showcases Norris at his best. It makes me rate the film 3.5 stars out of 5, instead of only 3 stars. Never underestimate the influence of an impeccably delivered roundhouse kick.

The film is shown in full screen format, which renders me all kinds of incensed. The DVD's bonus features: The in-depth ""Making of THE OCTAGON"" documentary (00:39:27 minutes long); ""How American Cinema Changed Hollywood Forever"" - a featurette chronicling the rise and collapse of the American Cinema Group, an independent film company that revamped how movies were marketed and a company that also produced and distributed a series of box office hits, including several Chuck Norris pictures: A FORCE OF ONE, THE OCTAGON (00:27:57 minutes); Cast & Crew biographies; and THE OCTAGON theatrical trailer and TV promo spot.",1301702400,,4443,4.839473684210526
2155790,4,B00031V23K,This is a pretty good movie for its time. I always enjoy the good vs bad student conflicts. Anyone who likes chuck norris will enjoy this movie.,1299110400,,144,4.37037037037037
2155791,2,B00031V23K,"Apparently, there are those who have little experience in martial arts cinema. How this would ever rate 5 stars is beyond me. Granted, it is better than most of the Cannon Ninja films of the 80's, but this is honestly one of two films that, in my lifetime, actually gave me a migraine headache. The other was the over long, barely watchable CONTACT with Jodie Foster. I had high hopes for this when it was released, but suffered through it at a local drive in. I liked the sets, the costumes, the whole ninja mystique, but seriously: the last fight scene is a total let down for what the first three acts were building us up for. Norris defeats the head ninja with one bold move? Come on now! Give us a fight to talk about! Nope. Just a silhouette against a sunrise with Norris stabbing the bad guy. THE END. Uh, nope. Unsatisfactory for the two hours of my life I invested in this. Maybe hard core Norris fans will enjoy this, but to those who have a background in real ninja cinema from Asia, this film is far from exemplary.",1289865600,2,1027,4.354166666666667
2155792,5,B00031V23K,Hears a whisper : The Octagon is a good movie.shh... I am afraid if I don't give the movie 5 stars. Chuck Norris will come and get me(worst than the boogeyman). and What about Lee Van Cleef?? two Legends in this Ninja Killing movie. How can you go wrong? Did I mention Chuck Norris?,1274659200,,282,4.2407407407407405
2155793,5,B00031V23K,"Another one Of Chuck Norris Martial Arts Movies. If you enjoy martial arts, then you will like this one.",1246838400,,104,4.526315789473684
2155794,4,B00031V23K,"The Octagon is a classic with one of Australia's finest Martale arts.

In my ways it show the world how The Ninja were trained and how one man can make a differense in this world if he wished to.",1229385600,,195,4.0
2155795,3,B00031V23K,The Octagon is one of Chuck's best movie highlighting his karate skills.  This is a good one to have in your colloction.,1220832000,,120,4.454545454545454
2155796,2,B00031V23K,"I am conflicted and truly felt cognitive dissonance when I reviewed this movie.  Anyone who knows me is aware that I am huge Chuck Norris fan. However, this movie is so totally ludicrous and for the most part moot.  So this review was hard for me to write.  Nevertheless, I still love Chuck Norris and this movie is entertaining but perhaps for all the wrong reasons.

This movie released in 1980 (more than likely shot in 1979) has this total retro feel to it,  which as far as I am concerned is a good thing.  However, this movie had so many loop holes in it the Millennium Falcon would have no problem flying through them in order to jump into hyper-drive.

I would try to explain the story of this film, yet I didn't understand it myself. What I will say is that Chuck Norris is tormented by flashbacks of his childhood and of ninjas (evil).  He discovers that his adopted brother (can we say Lego hair) is the leader of an underground ninja crime movement.  These ninjas are training in an octagon, hence the title of the movie.  The former is really the best description of the movie I can provide.  The movie should have been dubbed in French it might have made more sense to me despite the fact I cannot speak French.  As for the fighting, it wasn't bad, usually Chuck Norris fair.

Another strange thing in this movie was Chuck Norris' intern-monologue; it has this whispering echo thing going on. For the most part, I didn't understand any of Chuck's thoughts.  Then there was the character of A.J.: was he Chuck's friend, business partner, brother, an X-File, I don't know.  Then there was this older man played by Lee Van Cleef.  He was always accompanied by two other men and they always were able to aid Chuck.  Again, I don't know who he was, why he was there and how he knew Chuck.  All I knew is that he hated ninjas. I have never met a ninja so I can't share this aversion.  Oh you will also see a very young Ernie Hudson in this movie.

Chuck also has three different ""encounters"" or ""relationships"" with women in this movie.  The first woman is sort of ditzy and is accosted by ninjas.  The second woman Chuck calls a whore.  Finally, the third looks like a girl I use to date.  I am not sure if any of this information means anything.

In retrospect I look at ""The Octagon"" in two perspectives. The first perspective is a movie that is so bad it makes one wonder why it was made and what events in one's life resulted in viewing this film.  The second perspective is a movie that is just random scenes and the only continuity being the characters and location. Under the assumption the viewer surrenders to the latter, they might really enjoy this movie.  Sadly this movie seems very thrown together and didn't know what it wanted to do with itself.

The only reason I gave this movie two stars is because after about forty minutes I just started laughing.  Once this transpired, I started to lose the oxygen going to my brain and began enjoying the nonsense that is ""The Octagon"".  This behavior continued up forty-eight hours after the movie ended.  I will never look at a ""stop sign"" the same way again.",1217808000,7,3127,4.452464788732394
2155797,4,B00031V23K,"An excellent movie overall.  Norris is smooth and professional,  his female suitors came across as immature and lost with his guidance.  The movie dates itself to the late 70s early 80s on this count.  If you're a Norris fan like myself it was a excellent movie to watch especially the last 30 minutes.",1217721600,,302,4.6415094339622645
2155798,4,B00031V23K,"...at least as far as the fighting is concerned.  If you want a Chuck Norris movie with a good story/plot I'd go for Missing in Action I or II.  Or maybe Forced Vengence.  But as far as fight scenes, I have to give this one the edge.  He displays a much better range of techniques in this movie as well as use of weapons than in any other movie I can remember.

  The acting is so-so.  Better than usual I would say.  the plot really isn't that compicated.  And watching him fight opposite Tadeshi Yamashida is one of those rare moments of capturing two martial arts legends on film.  Admittedly the movie has a slow build up, but overall it's a good movie if you like martial arts movies of that genre and era.",1203033600,,711,4.231343283582089
2155799,4,B00031V23K,"I sent the item to a friend, he received and I assume he watched it.",1181347200,,68,3.6
