,overall,asin,reviewText,unixReviewTime,vote,reviewLength,wordLength
2441920,5,B000BUE5DM,"This is the Best Show I have ever seen.

Professional choreography, operator work, music just great!

Beautifully!

M.Flatley shows th world that he can do the greatest show in the world.

In the beginnig there was a little boringly, but a 5 minutes after - he capture you thru the end.

I more like the issue with flowers, very beautifull picture on big screen on the scene & interesting costume (not only in this number), and most of all - the final number, where dancers stay on line and begin to tap on accomponied rock gitar. Super!",1135468800,3,537,4.494845360824742
2441921,4,B000BUE5DM,"Obviously this show and Michael Flatley is worth 5 stars. The significant defect in this DVD is that the cameras are not focus on Michael Flatley when he is performing. Unlike Feet of Flames and Lord of the Dance----Camera always shown the true genius of Flatley by focusing on him when he is performing.

The often times of showing bankup dancers' feet when Flatley is dancing is most annoying. Otherwise, this show is worth watching over and over.",1135036800,6,449,4.756410256410256
2441922,5,B000BUE5DM,"I have been lucky enough to see Michael perform in person in LOTD as well as Feet of Flames.  I recently saw Celtic Tiger for the second time, at the Palace in Auburn Hills MI.  I had seen it about a month earlier in London Ont.  I felt that the Detroit area show was much improved over the London version. He is obviously polishing the production as the tour proceeds. I'll be interested to see what the DVD version contains compared to the two versions that I have seen on stage.

Celtic Tiger is very different from his previous shows but every bit as good.  Anyone who liked the earlier shows will will love Celtic Tiger.

I might also mention that I have seen Lord of the Dance performed by one of the touring companies.  It was very well done and I enjoyed it, however compared to the same show danced by Michael it paled.  Michael Flatley lights up a stage.  He has incredible talent as well as amazing stage presence.  If you have the opportunity,  see him before he retires for good.",1134086400,10,992,4.366120218579235
2441923,5,B000BUE5DM,"I saw ""Celtic Tiger"" on November 8th at the Target Center in Minneapolis, MN and I was blown away by the talent of these men and women that Michael finds for his shows. Michael was at his best; he did a fire dance that was hairy to watch, especially when you see his shoes smoking when he jumped off the little stage that he did his special tap dance on.

I was also happy to see my other violinist, Cora Smyth, who appeared with Mairead Nesbitt in ""Lord of the Dance"" and ""Feet of Flames"" She's with her sister, Breda, in ""Celtic Tiger"" and they were a wonder to watch.

The only drawback that I could find was the strip tease. I could not find any reason for it being part of the show. I also missed the Irish music. There wasn't enough of it!! But then that is what Mr. Flatley warned us about in his interviews; that this show would be different from his other shows.

Mr. Flatley did not appear onstage as much as I would of liked; but then that is what he does. He gets the show well known throughout the world, then he bows out and starts another project.

All in all, the show was sensational. Michael Flatley didn't disappoint!",1133222400,8,1136,4.24537037037037
2441924,3,B000BUE5DM,"First, I own the Flatley DVDs and have enjoyed all of them. Even more with repeated viewings. (Why isn't Riverdance with Michael on DVD yet?)

Second, I have seen several live Irish dancing productions and partook in some and played for some and and ______ and...(Commitments reference there - fill in the blank)

Third, I really looked forward to the show at the Garden in NYC.

The music is not there.  Riverdance holds your attention with the music. Hardiman's ""Lord of the Dance"" (LOTD) music is just as good, if not better, at holding your attention. ""Celtic Tiger"" (CT) had one, maybe two, numbers that pulled at my ear.

The dancing does include several different styles and is used for good effect. However, mulling over the show as I was leaving the Garden, I thought that ""LOTD"" would have made more sense as a place for various styles where ""CT"" being an Irish story should have featured a little more Irish dancing.

And it might be me but the final dance line with the machine-gun line stomp is getting old.  It appeared in Riverdance. It was featured more in ""LOTD"" and ""Feet of Flames"". It really feels like a ""been there-done that"" moment.

Then there is the stripper scene.  Very hard to watch with my mother-in-law sitting next to me.  Even my children were left wondering what that was all about.

You may enjoy this and there are moments of brilliance such as when ""Captain"" Flatley walks onstage but it left me feeling like this was a Work In Progress that needed about another 3 or 4 weeks to work out the rough spots.",1132704000,35,1540,4.583941605839416
2441925,5,B000BUE5DM,"We just had the privledge of seeing the performance of Celtic Tiger starring Michael Flatley in Phoenix, AZ.  It was absolutely terrific--the best show anyone could ever hope to see! Michael's dancing was superb, as usual, and his troupe was magnificent.  Music, choreography, solos, cinematics, and special effects were top of the line--absolutely brilliant.  Sell your horse, your teeth, your hair--whatever you have to do to attend this show! You won't be sorry!",1131235200,11,465,5.342465753424658
2441926,5,B000BUE5DM,"I was very lucky to see this show twice: first I won a ticket to watch the recording of the DVD in Birmingham and, next thing I knew, I was on a plane to see the Madison Square Garden performance. It's absolutely brilliant and Michael is dancing even better, if that is at all possible. If you happen to know a little about Irish history, it'll help you understand. If you don't, it's pure, first class entertainment.",1130630400,13,417,4.428571428571429
2441927,5,B000BUE5DM,"I saw this show live at the Anaheim Pond, and it was spectacular! I had already seen Riverdance at the Orange County Performing Arts Center, and I saw Feet Of Flames in Las Vegas. I think this show was as good as the other two. The primary difference was Michael Flatley did less dancing in this show (when he did dance he was superb). It surprised me when Michael picked up a flute and played a beautiful solo. He did a very good job I might add.

This show was not the same as the previously mentioned shows in that this show did not focus primarily on the Irish dancing. There were other styles of dancing (modern, tap, and ballet) in Celtic Tiger that weaved a story about the history of Ireland and the Irish people who came to America. I will agree with the other reviewer that there were some patriotic moments (regarding Ireland and America) that were really good. The finale spotlighted the song ""I'm a Yankee Doodle Dandy,"" that was written by George M. Cohan, who was a famous Irish American. What a wonderful way to end a wonderful show.

I cannot wait to get my DVD. I loved the show and I am sure that I will love the DVD. I was surprised that they were not selling the DVD at the show.

But no worries... as usual Amazon has the goods!",1130544000,55,1250,4.288135593220339
2441928,5,B000BUE5DM,"Our local TV station, WQED just showed this performance because Flatley is coming to PITTSBURGH in November!!  He's STILL got it, folks!  The same energy, the same passion, the same surprises.  I was concerned because it's been a while since we've heard from him.  Time has NOT taken any talent from the man!  If nothing else, he's MORE creative, and MORE energetic than ever.  He's added some ROCK, some PATRIOTIC stuff, and that's all I'm saying so it won't be ruined.  Michael Flatley fans will LOVE THIS!  Can't wait for the release of the DVD.",1130198400,11,548,4.6947368421052635
2441949,5,B000BUE5DM,Loved it,1485993600,,8,3.5
2441950,5,B000BUE5DM,"Another great show performed by Michael Flatley and his very talented cast of dancers, singers, and musicians, not to forget the lighting, sound and visual effects.  This show is about a history of all dance styles performed during many eras.",1485475200,,242,5.05
2441951,5,B000BUE5DM,Very good indeed!,1483660800,,17,5.0
2441952,5,B000BUE5DM,Ok product.,1477180800,,11,5.0
2441953,5,B000BUE5DM,"Absolutely amazing along with ""Feet of Flames"" Always gets the soul stirred and the feet tapping and brightens the mood. Thank you Michael!!!!",1472169600,,142,5.217391304347826
2441954,2,B000BUE5DM,Two parts of the performance were lost because the DVD skipped.  Poor quality.,1461974400,,78,5.0
2441955,4,B000BUE5DM,Great dancing and awesome backing,1458172800,,33,5.8
2441956,5,B000BUE5DM,"LOVE HIM,CAN'T WATCH HIS VIDEOS ENOUGH.WISH HE WOULD COME TO OKC SO I COULD SEE IT IN PERSON.",1455926400,,93,4.222222222222222
2441957,5,B000BUE5DM,Great entertainment.,1455926400,,20,9.5
2441958,5,B000BUE5DM,Excellent for a birthday present. Excellent condition.,1453161600,,54,6.857142857142857
2441969,5,B000BUE5DM,"absolutely loved it!!!!
anything done by Michael Flatley is AWESOME!!!!",1448064000,,71,6.2
2441970,5,B000BUE5DM,Have 3 dvds with Flatley.  Fell in love with him in Riverdance. He's great!,1446854400,,75,4.357142857142857
2441971,5,B000BUE5DM,wonderful.,1439769600,,10,10.0
2441972,5,B000BUE5DM,Beautiful Dancing,1436918400,,17,8.0
2441973,5,B000BUE5DM,Really liked all 3 shows. Highly recommended,1431907200,,44,5.428571428571429
2441974,5,B000BUE5DM,"I went to see this show when it was in Pittsburgh, PA.  Always better live, where you can watch the part of the stage that you want to watch, but still a very good recording.  It is basically the story of Ireland, from the druids and the Saint Patrick story to the eventual immigration to America of many Irish citizens.  This dvd also includes a few extras, such as rehearsal footage and interviews with the cast, which is always fun to me.  Michael Flatley never disappoints, and I love that he always acknowledges the whole cast.  As I recall, in the live show there was a video roll call of influential Irish - Americans that I did miss, but all in all, a great dvd!",1429574400,,670,4.328
2441975,5,B000BUE5DM,love it,1428969600,,7,3.0
2441976,5,B000BUE5DM,"Michael is the ultimate ""Celtic Tiger""",1428883200,,38,5.5
2441977,5,B000BUE5DM,If you love Ireland and The USA this is for you.,1428451200,,48,3.4545454545454546
2441978,5,B000BUE5DM,I bought this as a gift for a family member. They love it and was so happy to get it. They sat down and watched it right after they opened it. Just like a kid at Christmas time.,1428278400,,177,3.6842105263157894
2441989,5,B000BUE5DM,Giving as a gift.,1417996800,,17,3.5
2441990,5,B000BUE5DM,"Michael Flatley is a Great Dancer and this show, definetly was his best. It spans all decades and when he does tap dancing to electric guitars, its the greatest.",1417996800,,161,4.586206896551724
2441991,5,B000BUE5DM,One of his best productions.  Hope there are more to come.,1416873600,,58,4.2727272727272725
2441992,5,B000BUE5DM,good,1414368000,,4,4.0
2441993,5,B000BUE5DM,Great,1414108800,,5,5.0
2441994,1,B000BUE5DM,NO SO GOOD,1409616000,,10,2.6666666666666665
2441995,3,B000BUE5DM,it's okay,1409529600,,9,4.0
2441996,4,B000BUE5DM,Great.,1405468800,,6,6.0
2441997,5,B000BUE5DM,"My children just love this dvd. They Irish tap dance and this really gets them fired up and inspired to dance more. It's a great dvd, and we like it just as well as Lord of the Dance. It's got one scene in it however that I have to skip for my sons and that's the part where the lady strips down to her bikini. But other than that, it's a great show of very skilled dancers and great music. Michael Flatley playing the flute was a real treat too.",1394150400,,446,3.966666666666667
2441998,5,B000BUE5DM,"First loved Michael Flatley when I watched him in Riverdance. Ever since then, I have searched high and low for other productions he is either in or produced. Was happy when I found Celtic Tiger, and another one called Feet of Flames. Anyhoo, in Celtic Tiger, Michael Flatley performs and is the Director/Producer. First off, I love watching the Irish dances, how in sync they are, very impressive. In person, the tickets are outrageously priced. On DVD, I can watch repeatedly, for one low price! That is entertainment to me, and my frugal budget. This production, he takes us on a journey from early Ireland times, Vikings, Irish vs British soldiers, and on to America. His performances always includes at least 2 encores from the audience. It's a very thought out story, that has high energy dance choreography To try it out, check out You Tube, I am sure there are bits of performances on there to give you a taste of what to expect. For me, personally, the price was well worth it. I have watched it dozens of times, and when nothing else is on to watch, I will pull out one of his shows, and though I know the storyline, I never get tired of watching him and his fellow dancers do their thing!",1392768000,,1199,4.529953917050691
2442009,5,B000BUE5DM,"He's the best.  Love all the DVD's.  First saw ""Lord of the Dance"" on PBS special and I was hooked.",1391990400,,99,3.9
2442010,5,B000BUE5DM,A must have for you Michael Flatley fans out there. Great Music and Fantastic Dancing. This is better than any other show he has done. 5 Huge Stars.,1390176000,,148,4.321428571428571
2442011,1,B000BUE5DM,"I just HATE to do this as I just LOVE Michael Flatley - ego and all.  He's brought me so much joy over the years and I was really hoping this would be a new thing to love.

It is just AWFUL on all levels: choreography, music, costumes.  Horrible.  I've always wished he had more than one show in him, but, bless him, he doesn't.  This is just a minor re-working of LOTD and FOF.

If you don't believe me, please rent it first, or watch some of it on youtube.  Embarrassingly and sadly awful.  In order to save someone else from buying, I threw it away.

Then I watched LOTD again to clear away the drivel and remind myself why he's one of my hero's!",1386028800,,649,4.087301587301587
2442012,3,B000BUE5DM,"I know this is a different show, and while still awesome, wasn't as good as LOTD in my opinion. Still a worthy purchase",1369958400,,119,4.217391304347826
2442013,5,B000BUE5DM,im a huge Micheal Flatley fan and heard many good things about this i had to have it for my collection,1365638400,,102,3.9047619047619047
2442014,5,B000BUE5DM,Telling the history of Ireland and Irish culture in the world from beginning to present day through interpretive dance and Irish dance is quite the concept. Flatley and company in this show do just that and succeed!,1364860800,,215,4.837837837837838
2442015,5,B000BUE5DM,"Yes this is a lot different than LOTD was and it was SUPPOSED TO BE!!! I would have been livid if I had paid 20 bucks for something very similar to LOTD. I was expecting something different and that is what I got. Michael uses different types of dance to tell this story of the history of the Irish. It can be hard to follow at some points if you don't know anything about Irish History (luckily I do) but in my opinion the dancing is wonderful. Yes, the striptease bit was a little unique to say the least but to each their own. Is this as good as LOTD? No. Is it a great show that deserves praise? Absolutely. If you're looking for something along the lines of LOTD, this is not for you. If you are looking for a different Michael Flatley show, by all means buy this and enjoy.",1355097600,,779,4.131578947368421
2442016,3,B000BUE5DM,"Flatley is a superb dancer and talented choreographer with a fine sense of rhythmic timing. At 54 years of age he still dances at dazzling speed and clearly has retained his star power.  The first part of the show was lovely and in keeping with the spirit of his previous shows. Also, I really enjoyed hearing Michael play the flute again.  However, it all went to potty beginning with the bit of the Irish immigration to America ~ so totally off base as to be laughable.  Uh, they didn't come in JETS geesh!  Was the gangster sequence a nod to the Irish gangs of NYC?  If so, why the Capone look? I don't need to ask what was on his mind with the foolish stripper sequence or with her prancing about miming playing a piccalo for Yankee Doodle Dandy but really, how dumb was that? Luckily the show got back to more of the troup dancing toward the end.  I will give high-fives to all the youngsters and their tremendous hard work!  Just watching them is energizing.",1353110400,,964,4.4124293785310735
2442017,2,B000BUE5DM,"I LOVE Riverdance. I grew up with it. I listen to the music. I'd give it 5 stars easily. But this...This is not Riverdance. I liked most of Lord of the Dance. Feet of Flames was ok. But this was terrible. I literally cringed at the USA themed dance. Where those cheerleader outfits?

What the what was with the stewardess dancing in high heels? Was that supposed to be taken seriously? Where do I even begin with the striptease??? Good Lord it was tacky. There were several moments where I just burst out laughing.

Also, the entire show had an enormous background screen that involved terrible things like jets, sports, blindingly bright flowers blooming, and snakes. People dressed up as animals, flowers, and butterflies and did boring dances that would be appropriate for a 2nd grade talent show. I think much of the audience must have been drunk to have cheered as much as they did.

Much of the music was not recognizably different than Flatley's past shows. The only redeeming points of this that I truly enjoyed were the first dance, which was gladiator themed, seeing men dressed in British military dress with white wigs ""Riverdancing,"" and the jazzy gangster scene. Those moments were enjoyable and up to par with the past shows. Everything else was laughable, cheesy, and highly unlike the original and far superior Riverdance. I couldn't take this show seriously. Don't pay money to watch this.

P.S. He's too old to go on stage without a shirt.......",1346371200,,1464,4.820717131474104
2442018,5,B000BUE5DM,"I became hooked on Michael Flatley and Irish Dancing after seeing a performance of Riverdance on TV.  Next I purchased the DVD&nbsp;<a data-hook=""product-link-linked"" class=""a-link-normal"" href=""/The-Michael-Flatley-Collection-Lord-of-the-Dance-Feet-of-Flames-Michael-Flatley-Gold/dp/B0001FVDQO/ref=cm_cr_arp_d_rvw_txt?ie=UTF8"">The Michael Flatley Collection (Lord of the Dance/Feet of Flames/Michael Flatley Gold)</a>&nbsp;and enjoyed each performance more than the last.  At the time there were no DVD's of Celtic Tiger available but I learned the show was coming to Reno, NV, where I lived at the time.

Seeing the live performance of Celtic Tiger from the center of the 12th row left myself and my guests nearly speachless.  The dancing and the storyline were flawlessly inter-woven.  The feet of the dancers were nearly a blur as they tapped their way through the story.  Each time Michael appeared on stage his energy and fabulous performance electrified the audience bringing us to a higher level of excitement.  The abslute highlight was the finale and 2 encores of Yankee Doodle Dandy which brought tears to my eyes as the feeling of patriotism flowed through the audience.

The dvd of Celtic Tiger was released several months after the live performance that I was priveledged to view.  Watching the DVD allows me to re-live one of the high points of my life; the live performance of Celtic Tiger.  While the filmography is excellent nothing can compare to actually being there although the DVD does come close.  Highly Recommended!

I've read other reviewers comments that they do not believe Celtic Tiger is Michael's best work.  I disagree.  Celtic Tiger was an evolution bringing together the best of dance, showmanship, and choreography into a breathtaking performance.  Change is inevitable and without it comes stagnation.  However everone has a right to their own opinion.  To me, Celtic Tiger will always remain the highlight of Michael's danceing career.",1322956800,,1973,5.7020547945205475
2442028,5,B000BUE5DM,"Michael Flatley is without a doubt the worlds best dancer!  I fell in love with all his ""movies"" since I first saw Riverdance.",1294185600,,126,4.478260869565218
2442029,3,B000BUE5DM,I think this show was a little too sexy for me. And I think the costumes were a little too bulky in many of the segments; it took away from the movements of the dancers bodies.,1268006400,,176,3.9166666666666665
2442030,5,B000BUE5DM,It never gets old watching Michael Flatley and he always delivers. This newest addition to his legacy is delightful must have for Michael Flatley fans.,1255478400,,151,5.08
2442031,5,B000BUE5DM,"Celtic tiger, (Michael Flatley)

At first I thought it was real depressing. But when I watched it a few times. I thought it was quite a master piece. It tell's the story of the history of the Irish. The dancers were incredible and so was Michael Flatley. Filmed in Budepest, Hungry. I thought it was incredible. It was so fun to watch Michael do ""Yankee Doodle Dandy"" That was a highlight of it for me. That made it succesful. I don't think alot of people would go for this. Unless you are Irish, but for me, I really learned to appreciate what it was about. Very Interesting!",1235952000,,576,4.383177570093458
2442032,5,B000BUE5DM,"Well ladies and gentlemen,
Michael Flately has done it again.

 This movie was a treat for both the eyes and ears. The music was awesome and the dancing superb. It tells the story of Michael's own life through dance. Starting with the vikings and working to the present. The first side of the dvd shows Ireland and it's history to the present including The british invasion and Black Sunday. Side two is more americanized with the arrival of Michael's family to the United States!

In my opinion this DVD is a must have for any Michael Flately fan : )",1234569600,,551,4.49
2442033,5,B000BUE5DM,Great Price and with buying this thru Amazon.com I saved more money then I would have by purchasing it thru WalMart. A penny saved is a dime of savings thru Amazon.com,1231632000,,167,4.419354838709677
2442034,5,B000BUE5DM,"It's Michael Flatley so it has to be good. I truely enjoyed it, but then again I enjoy everything about Michael Flatley. I will recommend it to all my Michael friends.",1230336000,,167,4.419354838709677
2442035,5,B000BUE5DM,I have seen Riverdance and Celtic Tiger is superior by far!  Michael Flately has out done himself with this one!  If you are only going to buy one IRISH dance DVD than this is the one to get.  You will not be disappointed.,1227916800,,222,4.116279069767442
2442036,2,B000BUE5DM,"I have studied Michael Flatley's other dance videos, and this one is simply not as uplifting as Feet of Flames. All of Flatley's dance videos have video switching on speed dial, some worse than others. For someone in complete awe of Irish music and dance, I want to study what the dancers are doing for more than 3/4 second. This is not the worst of the bunch; that prize goes to the original Lord of the Dance video; a sore sight for the eyes.
I have to admit to a fascination with Irish culture, especially the music. Feet of Flames was uplifting like no other video I have ever seen, bar none (but not because of the video treatment). By contrast, the opening sequence of The Celtic Tiger frustrated me. Why can't we see the dancers? All we can see are strobe lights.
But where The Celtic Tiger really fails is that the nationalistic tone is simply not as uplifting as Flatley's earlier work. I believe the purer the Irish music and dance, the better. The hymn to Irish independence might have caused the powers that be to shut down The Celtic Tiger, if the show had not failed on its own merits. (Imagine if someone had produced an American musical with the theme ""the South will rise again."") The pilots dancing number was cute until it became a striptease sequence. Ouch! The burning of Irish homes may have been factually accurate, but was still not uplifting; it was painful to watch.
Michael, please honor the tradition of Irish music and dance. Produce a video that lavishes attention on the dancers and musicians. Make a video that is Irish music and dance performance first, and a video event second. You may have to fight some video directors to get a product that is top quality, but you've shown the focus that's needed in a wide variety of performance disciplines. Rise above nationalism and stick to uplifting Irish music and dance.",1209945600,,1849,4.606060606060606
2442037,1,B000BUE5DM,"I have been a fan of Irish Dance for many years and enjoyed many parts of Flatley's other productions.  I rented this DVD expecting to gleen some positives out of it as well.  I was disappointed.  The ""story"" was hard to follow, the women's costumes quite bare, and Michael oblivious to how silly the whole thing was.  Other than a few short instances of Michael's amazing dancing, my Irish dancing daughter and I actually laughed ourselves to tears at times as we watched this.",1205798400,5,478,4.654761904761905
2442048,5,B000BUE5DM,"This is an excellent show, especially if you like a lot of live dancing.  These dancers are really putting their sole into this.  Would recommend it highly to anyone.  My husband and I will enjoy for months to come.  We also enjoy his other works. Hope to see more.

Jean Leclair",1199750400,,279,4.392156862745098
2442049,5,B000BUE5DM,"Michael Flatley has done it again.  With the flavor of ""River Dance"" and Lord of the Dance"" he goes on to show the history, struggles, and success of Ireland in music.  If you know a bit of Irish history you will see the story unfold in an enjoyable and foot tapping way, that makes you think at the same time.",1198281600,,310,4.15
