,overall,asin,reviewText,unixReviewTime,vote,reviewLength,wordLength
2155800,3,B00031V23K,"A typical Chuck Norris vehicle that relies on its karate scenes to salvage it.  Norris in an early role demonstrates his limited acting range, but makes up for it with some effective fight scenes.  While the plot is convoluted and never makes total sense, it takes the back seat to Norris' attempts to get revenge on his ""brother"" who has gone bad.  The supporting cast goes from mediocre (Art Hindle, Lee van Cleef, Carol Bagdasarian) to worse (Karen Carlson, Larry D. Mann, Kurt Grayson).  There are annoying narrative voice overs of Norris' conscience that are more annoying with the use of some kind of reverberatory effect.  THE OCTAGON is not the best of the Norris library, but you could do worse.",1126828800,2,704,4.785123966942149
2155801,5,B00031V23K,THIS MOVIE IS FUN TO WATCH BECAUSE THE FIGHT SCENES LOOK REAL. SOME PEOPLE WILL NOT LIKE THE VOICE OVER BUT I DID. THIS IS ONE OF ME FAVORTIVE MOVIES OF ALL TIME. FINALLY ON DVD TO BAD THERE IS NO DELETED SCENES. OVER WISE A GREAT MOVIE.,1112400000,3,237,3.9583333333333335
2155802,3,B00031V23K,"The actual title for this film is `The' Octagon (1980)...Amazon seems to have left off the `The' part, and it's a minor distinction, but that's how I've always known this film, as The Octagon, rather than just Octagon (the DVD case has it correctly)...for some reason it annoyed me, but I've since gotten over it...it's just that I can't help get the feeling that in terms of Chuck Norris and these DVD releases of his earlier films, there seems to be something of a lack of respect...mislabeled titles on seller sites, and often, the DVDs themselves are rarely presented in the original aspect ratio...perhaps there is a conspiracy...anyway, The Octagon was co-written by Leigh Chapman, who was not only responsible for the atrocious Octaman (1971)...(is there an `Octa' theme here?), but also wrote the classic exploitation film Dirty Mary Crazy Larry (1974), which I've been patiently waiting for release to DVD.  Directing the film is Eric Karson, whose credits also include Dirt (1979) and Opposing Force (1986) and starring is Chuck Norris (A Force of One) in a role we would become accustom to seeing him in as the reluctant hero (I won't fight unless I have to!).  Also appearing is Karen Carlson (The Candidate), Art Hindle (Black Christmas, Porky's), Richard Norton (The Blood of Heroes), Jack Carter (Alligator), Ernie Hudson (The Crow), Tracey Walter (Repo Man, Conan the Destroyer), and Lee Van Cleef (Escape from New York).

Norris plays Scott James, an ex-martial artist who gets drawn into the world of international terrorism after the death of his would be girlfriend and her family at the hands of a ninja death squad, trained by someone who James has familial ties with...sounds pretty simple, doesn't it?  Well, that's the short and skinny of it...the plot is actually much more involved and convoluted (i.e. confusing) as the story is swimming with all kinds of extraneous characters and plot threads including, but not limited to, a publishing heiress threatened by the same death squad, opposing mercenary groups, one lead by Van Cleef (his acts more in the capacity of bodyguards/anti-terrorists, while the other is involved in terrorism), a ninja training camp, and a girl who was once a trainee in the aforementioned camp, but now wants out.  Sounds kinda messy, doesn't it?  Well it is...

Okay, first of all, let me start with the story...it is too long and drawn out, featuring way too many characters and subplots (and let's not forget the numerous flashbacks).  All these unnecessary complications only served to drag the pace of the film down, and this is highlighted by the fact there's only one fight scene in the first 50 minutes of the film.  Sometimes I gripe about the lack of character development in a film, but here, there was way too much as the writer tries to tie so many characters together with often the loosest of circumstances.  When I see a Chuck Norris film, I wanna see some action, and there is some here, but not until much later.  Had they cut the number of characters by half (and subsequently the useless plot threads), they could have shaved about 20 to 30 minutes off the bloated run time of 103 minutes, and had a much better film.  What was the point of Van Cleef's character?  His group was presented as an elite team of bodyguards, but they seemed hardly worth their price, as their clientele would usually end up dead.  Hardly good for business, I must say... Something else that annoyed me about this film was Norris' character would regularly have this creepy, whispery, echoic, inner monologue that was often hard to discern, and offered nothing of use, only the fact that he liked to continually state the obvious to himself in his own mind.  And the concept of a ninja training camp is cool, but it lost a bit of credibility once I saw the trainees as many of them were hardly what I would deem `ninja' quality, many being overweight, out of shape, and lacking the necessary discipline to even be admitted...I guess secret terrorist organizations have to take what they can get.  The real action begins about 15 or 20 minutes before the film ends, as Norris infiltrates the ninja training camp, which is supposedly located somewhere in South America.  Chuck takes on a whole load of enemies, using hand to hand combat as well as various weapons.  The fight scenes here are excellent, and almost make up for the rest of the film.  As far as the acting goes, I think a few did alright, but they were obviously hampered by a lame script, and were probably as confused as I was about what the hell was going on in the film.  As I stated before, had they excised about half the characters, gotten rid of a lot of the `touchy feely' junk, spread some more action around, and removed any number of pointless plot threads, I think this could have been an outstanding action flick, rather than a overly long drudge with nearly all the action stacked at the end.  To be fair, I'm pretty sure this film did very well when it came out, and a lot of people enjoyed it, but I would hardly call this Chuck's best film.

The film is presented in full screen format on this DVD, which is what I was expecting after seeing Trinity Home Entertainment's release of A Force of One (1979), which is also only in full screen format.  Why they didn't have access to an original wide screen print I'll never known.  I will say the print on this DVD does look very good, and the audio comes through clear available in 5.1 Dolby Digital along with English and Spanish 2.0.  There are some extras including The Making of the Octagon (39 minutes). How American Cinema Changed Hollywood Forever (28 minutes), trailers for the film, and an extensive cast and crew biography section.

Cookieman108",1112054400,8,5735,4.744466800804829
2155803,4,B00031V23K,"Classic Martial Arts Movie.
Chcuk Norris is the man, the fight scenes are excellent in this movie. The ending battle scene is the best ever.
This is a great 80's Ninja flick, and Chcuk Norris kicks [...].",1110758400,,204,4.54054054054054
2155804,4,B00031V23K,"People scoff these days because Chuck Norris had a ridiculous 70's mustache.  But keep in mind The Octagon was the film that introduced the Ninja to the American public.  This was before James Clavelle's Shogun, this was before all the American Ninja movies, Franco Nero (who?) and all that.  If it wasn't for this movie, little kids' ninja dolls would have come a little or a lot later.

When I first saw this movie when I was a kid, the Ninja-thing took me by storm.  Now that I've recently purchased the re-release DVD, the film still holds up not only as an action flick, but also as a document to a very exciting time in martial arts movies.

Also keep in mind that American Cinema was at the time a cutting-edge independent movie company that set the standard for releasing and marketing niche movies.  But you can see all that in the ""How American Cinema Changed Hollywood"" documentary in the special features.",1106265600,3,917,4.6234567901234565
8035880,5,B00031V23K,"This is my personal favorite of Chuck Norris. The acting is bad, the plot is decent. All of the martial arts are excellent. A martial arts winner for sure.",1525046400,,155,4.379310344827586
8035881,5,B00031V23K,Great!,1500076800,,6,6.0
8035882,5,B00031V23K,dvd arrived in perfect condition,1481500800,,32,5.6
8035883,2,B00031V23K,Good guys wear black is much better.,1476576000,,36,4.285714285714286
8035884,4,B00031V23K,"old school kung fu, it is great.",1475193600,,32,3.7142857142857144
8035885,4,B00031V23K,a good karate movie,1461369600,,19,4.0
8035886,1,B00031V23K,Krap. Hard to believ I used to think this wuz a good movie wen I wuz younger.,1457654400,,77,3.588235294117647
8035887,5,B00031V23K,"This is probably the best Chuck Norris martial arts/Ninja movie ever made. Norris finds out that his long lost brother has been training people to become Ninjas to kill. I especially love this film because you can hear Norris's thoughts whispering in the background throughout the movie. Norris has to go through a lot to find out the location of his brother's secret Ninja camp. An attractive woman who successfully escapes from the camp, helps Norris. As a guy, I especially like the scene when you get to see a nice side angle of this woman's breasts when she ends up sleeping with Norris on their journey.",1439942400,,609,4.700934579439252
8035888,5,B00031V23K,It's Chuck Norris folks...,1433980800,,26,5.75
8035889,4,B00031V23K,okay movie,1426723200,,10,4.5
