,overall,asin,reviewText,unixReviewTime,vote,reviewLength,wordLength
1350609,5,B00004TJSE,"This video is the most awseome one ever. Trunks is very cool, his sword is awsome. Even the uncut version has no cursing but a little blood and loads of action. A MUST HAVE for any true dragonballz fan. But the whole saga put  together is totally cool.",960076800,4,252,4.25
1350610,5,B00004TJSE,Hi i have both of the trunks videos and trunks in cool! he destroys ...... with no problem. u should defenantly get these vidioes.,959990400,,130,4.458333333333333
1350611,5,B00004TJSE,"If you a fan of DBZ you will love this new edition in the series, watch Trunks lay the smackdown on Frezia and his sorry daddy King cold,also watch as the great Gouko come back home",959990400,2,181,4.055555555555555
7922656,3,B00004TJSE,Was damaged but I was able to fix it otherwise was satisfied,1522368000,,60,4.083333333333333
7922657,4,B00004TJSE,very enjoy able movie worth owning and very enjoyable,1447372800,,53,5.0
7922658,5,B00004TJSE,Excellent.,1407888000,,10,10.0
7922659,5,B00004TJSE,It's great.,1407110400,,11,5.0
7922660,2,B00004TJSE,The DVD itself was find and the arrive time was excellent.  The only complain I have about it was that I received the 3 episode version not the 5 episode.,1397606400,,154,4.133333333333334
7922661,1,B00004TJSE,"I ordered the DVD from crescent-marketing, and I am very, VERY sad to report that this did NOT contain the 5 episodes, as some people have been saying, only just the 3. If anyone knows where to get the 5 episode DVD, I would be greatly in your debt.",1323648000,,249,4.1020408163265305
7922662,4,B00004TJSE,"This dvd is a must for dbz fans. It even has 5 episodes instead of 3 and that is awesome. I would buy this trunks dvd because in my opinion it is one of the best sagas on dbz.

My only problem with the dvd is that the picture seems kinda grainy. It seems like the picture could be clearer and fine tuned but this also beats the 3 episode VHS version by far. So if you want the trunks saga, be sure to buy them on dvd.",1132012800,2,417,3.7386363636363638
7922663,1,B00004TJSE,"Episode 106 - Welcome Back Goku

After handily beating Frieza and his evil father, King Cold, the mysterious stranger announces the exact time and place of Goku's arrival on Earth. But can this young Super-Saiyan predict the future?! Gohan and the others are determined to find out!

Episode 107 - Mystery Revealed

After testing Goku in combat, the mysterious stranger reveals his true identity! But what does his timely arrival portend?! In a startling conversation with Goku, this powerful emissary from the future tells all!

Episode 108 - Goku's Special Technique

The future has been written -- or has it? That's what Goku and the rest of the Z Fighters must decide as they learn of Trunks' ominous warning. The Androids are coming! And they just might be bringing the end of the world along with them!",1095897600,3,808,4.868613138686132
7922664,5,B00004TJSE,"This DVD comes with 5 spectacular episodes, making it an excellent edition to your Dragon Ball Z Collection. The first episode concludes Trunks's fight with King Kold. (Well, it technically shows the final death of Frieza, but that is also shown in the previous DVD along with the rest of the fight.) Anyway, the first episode on this DVD has the fight with King Kold and then the part where Trunks takes everyone to meet Goku. In the second episode, Trunks and Goku talk and he reveals some pretty astounding secrets. Make sure to watch the third episode in Japanese, if you decide to watch any of them in Japanese. The English one actually says completely incorrect information. (Yeah right, it won't take them three years to collect the Dragon Balls.)
Anyway, that's the first three episodes. The other two are filler but still very fun to watch. (Actually, they are some of the best, specifically the second.) The fourth episode on this DVD details how everyone prepares for the upcoming battle, including Vegeta's training in 400G. It's pretty exciting to watch all that happens. The last episode has Goku and Picollo learning to drive, which is really funny and exciting too. As for the DVD itself, it has no bonus features, but most Dragon Ball Z fans should be used to this. It is a great DVD to buy, so make sure you do!",1074729600,4,1329,4.659574468085107
7922665,5,B00004TJSE,"I bought this DVD expecting to receive the later version with all 5 episodes like other customers who wrote reviews did. However, about a week before christmas I received it and it only had 3 episodes on it. I was very disappointed and sent it back and purchased it somewhere else that had the copy with all 5 episodes. Amazon was fair regarding the return and is suppose to reimburse me - even for the return shipping. Just make sure you call or verify somehow that the copy you are purchasing has all 5 episodes if that's what you are looking for.
The Trunks saga is by far some of mine and my sons favorite episodes. Definetly a must have for any DBZ fan.",1073174400,6,658,4.314516129032258
