,overall,asin,reviewText,unixReviewTime,vote,reviewLength,wordLength
2268825,5,B00097DXG2,"This man should be immortalized in the top echelon of the 3 or 4 greatest comedians of all time, right up there with Keaton (his protege), Chaplin (part of the Keystone family) and Lloyd!  So inventive, so athletic, and by all accounts was a very nice man as well.  I hope this wonderful collection will help get his star shining so brightly as he deserves; the horrible travesties dealt him need to be dimmed in the light of the joy and genius he brought to the world.  :-)",1356480000,,474,4.363636363636363
2268826,5,B00097DXG2,"What a wonderful collection,I read about the restoration of these films in the book,included with this dvd,hats off to the wonderful work in preservation of these films, now we can watch and enjoy. Arbuckle is among the other greats, Keaton, Chaplin,Lloydd,Langdon,Mary Pickford..Thanks for putting this collection together, I believe Arbuckle would be greatfull that some of his art is still around, a comic genius. Worth the purchase.",1334188800,,436,5.522388059701493
2268827,5,B00097DXG2,"I was invited over to a friends house for an Arbuckle film fest.  She had just gotten this set.
The quality was fantastic!  Much better than the VHS copies I have, and the films were ""new"" to me!  LOL.
Fatty was such a good comedian.  Extremely agile for his weight.  He was cute too!  I loved his films with Mabel, they were a cute couple.
Enough gushing, this is a great set of hard to find Arbuckle films.  The quality is good and the price is right, at least to me.
This is gonna be my birthday present to myself.",1331337600,2,517,4.11
2268828,5,B00097DXG2,"What can you say about Rosco Arbuckle? Genius,Funny,Kind,Light on his feet for his size. He rates right up front with Chaplin,
Keaton,Lloyd. They would say that today if they where hear to see. This comic deserves to be recognize as one of the greats of the silent era. These films that have been tirelessly put together tell everything about that and the man. If you are a silent film comic buff then this is the first set you should buy. They did and outstanding job on restoration of his work!!!
A 5 STARS*****",1329004800,,513,4.526881720430108
2268829,4,B00097DXG2,"This 4 DVD set of films by Roscoe Arbuckle is a must for fans of silent and/or slapstick comedy.  The reason that Arbuckle's films are 'forgotten' is because of a scandal in 1921 that destroyed his career - he was accused of killing actress Virginia Rappe at a party in the St. Francis Hotel in San Francisco.  There was supposedly a lot of alcohol and this was the early days of Prohibition - that was a scandal in and of itself.  At the time Arbuckle rivaled Charlie Chaplin for the top movie comic and had moved from making short films to feature-length films.  Despite being found innocent, his career was pretty much ruined.

The first 2 DVDs are shorts from Arbuckle's career at Keystone Studios and several of the shorts are with Mabel Normand, who also had a tragic life and early death.  For Keystone films, some of these are shorts were probably their best artistically.  Many Keystone films tend to just end because they either ran out of film or ideas - Arbuckle's tend to have a better thought out plot, a rarity for many Keystone films - at least the ones that I have seen.

The 3rd DVD has shorts from the period where Arbuckle left Keystone and moved to Paramount.  This DVD includes ""Coney Island"" with Buster Keaton and Arbuckle's real life nephew Al St. John (he's in most of the films).  Keaton displays his physical abilities by doing a standing back flip for no apparent reason that he can do it and most likely, the viewer couldn't.  The last film on the 3rd DVD is the rediscovered film ""Love"", where Roscoe is in love with a farmer's daughter and poses as Lucretia Borgia, a cook recommended by one Elizabeth Borden.

The last DVD has the feature ""Leap Year"" (1921) which wasn't released in the US because of the scandal.  The remaining films are ones (including one sound film) that Arbuckle directed as ""William Goodrich"", but don't have Arbuckle in front of the camera.  These include shorts by Al St. John in the hilarious ""Curses!"", Lloyd Hamilton, Johnny Arthur in the great ""My Stars"" where he impersonates Douglas Fairbanks, Sr. and Harold Lloyd, and the acrobatic Lupino Lane (relative of Ida Lupino).",1323648000,2,2135,4.658666666666667
2268830,5,B00097DXG2,"I'm not an Arbuckle fanatic by any means but I couldn't help like this collection when I watched it with my wife. Arbuckle's films are clearly an excellent collection of the early cinematic art, at least when it came to comedy shorts. If you like silent slapstick you'll love these DVDs!",1309824000,,287,4.647058823529412
2268831,5,B00097DXG2,"A wonderful collection of&nbsp;<a data-hook=""product-link-linked"" class=""a-link-normal"" href=""/The-Forgotten-Films-of-Roscoe-Fatty-Arbuckle/dp/B00097DXG2/ref=cm_cr_arp_d_rvw_txt?ie=UTF8"">The Forgotten Films of Roscoe ""Fatty"" Arbuckle</a>. Very nice restoration of the films, the restoration of the short 'Love' is particularly impressive. An excellent introduction to Arbuckle's talents as an actor and filmmaker.",1305763200,,413,9.615384615384615
2268832,5,B00097DXG2,"Hidden deep in the recesses of early cinema lies a rarely seen, obscure gem that might be described as something resembling a Max Beckman Moving Picture.

Roscoe Arbuckle's 1916 He Did and He Didn't is a humorous, expressionistic nightmare which not only calls to mind the texture and atmosphere of Max Beckman expressionist paintings, but also, in heroine Mabel Normand, evokes Edvard Munch as well.

Arbuckle had been shifting away from the frantic style of the Mack Sennett factory towards more character driven comedy, and had taken over writing and directing his own films and making features long before Chaplin, Keaton and Lloyd followed suit.

He Did and He Didn't uniquely stands out even among the later Arbuckle films, which is saying quite a bit as Arbuckle was innovative both as a performer and director.  His perfectionism was well known and he might very well have earned the crown for king of multiple takes, although the gracefulness he displayed on both sides of the camera never even remotely hints at such perfectionist standards.

Arbuckle has been widely credited for influencing such artists as Charlie Chaplin,  Buster Keaton, Oliver Hardy and Curly Howard.  His distinct on-screen persona was normally that of a country bumpkin and ladies man.

Naturally, every great screen personality needs an equally distinct nemesis.  Chaplin had Eric Campbell, Langdon had Vernon Dent, Arbuckle had his Al St. John.  The two appeared together in numerous films and, later, Arbuckle directed St. John in Curses (1925) and Bridge Wives (1932).  Lanky, bad teeth, bad hair and bad clothes, St. John was Arbuckle's perfect country bumpkin foil in The Waiter's Ball (1916), Coney Island (1917) and the recently restored Love (1919), in which Arbuckle donned drag, as he frequently did (Good Night Nurse, an imaginative nightmare fantasy with Keaton, St. John and Arbuckle as a nurse, remains his most memorable drag performance ).  Love seems like a charmed, distant cousin to an imagined early Tex Avery cartoon starring John Water's late star, Divine.

Mabel Normand was Arbuckle's frequent leading lady and possessed an inimitable personality of the pixie girl from the wrong side of the tracks.  She was never better than when directed by Arbuckle.  She and St. John are on hand for He Did and He Didn't, but compared to their other Arbuckle projects, this film has a different quality altogether.

Arbuckle, dressed in evening tux, is an upper class doctor and Mabel his much put upon wife.  The two are preparing for evening dinner. Arbuckle looks the image of the suave, sinister, cigarette in hand, Beckmanesque figure, ready for a party.  Mabel, his pale, thin, dark haired, bug-eyed wife appears to have just stepped out of an angst-ridden Munch canvas.  There's a bit of business about Arbuckle attempting to fasten his bow tie.  Mabel offers sympathy, but Arbuckle only makes faces in his mockery of her.  She jumps up, asks him to fasten her dress, and sneaks in a kiss as her arms fling around his neck.  Disgusted, Arbuckle wipes off the kiss and punches her in the ribs... dress fastened!  We are told this is their usual evening and the interplay between two recalls and pre-dates similar domestic strife shows like The Honeymooners.

Mabel leaves to fetch the butler so he can assist Arbuckle.  Arbuckle smashes his fingers in a drawer.  Rube Miller's saturnine butler arrives to find his master on his knees, rubbing his sore fingers together.  Miller assumes Arbuckle is praying and drops to his knees to pray with him.  Arbuckle angrily grabs his employee and gives him a swift kick for his error, fairly sacrilegious for 1916.

These are ugly, grotesque characters and Arbuckle daringly does not ask, nor does he receive, much in way of audience sympathy.

Mabel's childhood schoolmate, William Jefferson, has come for a reunion and soon jealousy soon rears it's ugly head.  Arbuckle welcomes his wife's childhood sweetheart to dinner, but then rips up Mabel's childhood picture.  A  lobster dinner is served and Mabel exclaims, ""we won't sleep a wink""; prophetic words indeed.

Arbuckle is called off to a fake emergency so burglar Al St. John can make his way into the home.  This leaves Mabel and Jefferson alone with temptation.  Of course, fate will have the upper hand and soon St. John is discovered, leading to predictable frantic mayhem with Arbuckle arriving just in time to find Jefferson putting his wife to bed.  In a rage, Arbuckle throws Jefferson out of the house and strangles his wife, but not before she fires off a shot from a revolver, bringing the giant crashing down the stairwell. Arbuckle knows how to utilize sets and does so here splendidly.  The scenes in which Arbuckle strangles his wife and then goes tumbling after being shot by her are nightmarish and disturbingly funny, much more so than the standard Keystone fair.  Sexual foreplay, murder, deceit, attempted murder, and dreams are all afoot, making this a standout film for the period.  It all turns out to be a bad, shared dream of Arbuckle and Jefferson which they realize as dreamy images of lobsters are superimposed over them. They go to check up on Mabel, who sleeps innocently, having remained true to her Roscoe.  Arbuckle smiles knowingly at the camera and bids a suave, devilish adieu as he slowly shuts the door to his wife's bedchamber, to imagined private delights.

He Did and He Didn't, in it's characters, atmosphere and tinting feels like a fevered lullaby from the heart of all that is expressionism.

Arbuckle and Normand were enormously popular during the period and, even though their characters here are not necessarily sympathetic, it's easy to relate to 1916 tastes since they possess an undeniable, infectious charm.

This film is available on the indispensable The Forgotten Films of Roscoe Arbuckle collection from Mackinac Media. Further recommended viewing: The Arbuckle/Keaton collections from Image and Kino, The Cook from Image, and Normand's films, Suzanna, What Happened to Rosa, The Extra Girl, and Mickey all from Unknown Video.

* MY REVIEW WAS ORIGINALLY PUBLISHED AT 366 WEIRD MOVIES",1285200000,3,6141,5.048611111111111
2268833,5,B00097DXG2,"I bought this DVD set for my friend who was writing a paper about Fatty Arbuckle in her college class.  I watched several of the short films with her and they were awesome.  He was a true pioneer in physical comedy and his direction and humor rivaled that of Buster Keaton, Harold Lloyd and Charlie Chaplin.  The shorts are beautifully restored and look great.

Highly recommend",1233360000,,378,4.681818181818182
2268834,5,B00097DXG2,"It's such a treat and joy to have so many Roscoe Arbuckle films gathered together in one place, and with such a respectful and top-notch treatment, after so many years of unavailability.  This set proves that he was indeed the true fourth genius of silent comedy, a title which I personally think he deserves far more than the overrated Harry Langdon.  Most of my favorites on this set are on the third and fourth discs, among them 'The Waiters' Ball' (1916), 'Love' (1919), 'Coney Island' (1917), co-starring a frequently smiling Buster Keaton, 'He Did and He Didn't' (1916), and the four 1920s shorts he wrote and directed with various second-tier silent comedians.  (The final short, 'Bridge Wives' [1932], stars his nephew Al St. John, who appears in almost all of the other shorts; it was so nice to finally hear his voice, after so long of only seeing him in silents!)  Viewing the shorts in order really gives a sense of how much he was developing as a performer and a comedian, going from the rather crude and simplistic earliest Keystones (which, to be honest, haven't really aged that well) to more complex, polished, and sophisticated shorts like 'He Did and He Didn't' and 'Love,' culminating in his long-unreleased feature 'Leap Year' (1921), a truly well-crafted and sophisticated character comedy.

Though for many people, Keystone comedies are an acquired taste, one can't really be a fan of Roscoe unless one appreciates and respects these early film roots of his.  Though the earliest Keystones haven't aged so well, they were hugely successful and made him a huge star, so much so that the other comedians of the era, particularly Chaplin and Keaton, often copied from him and considered him a very important teacher.  And even within the confines of Mack Sennett's style, one can see Roscoe adapting his own character and slowly breaking out of that Keystone mold, becoming more independent.  There's a huge difference, for example, between films like 'Fatty Joins the Force' (1913) and 'A Flirt's Mistake' (1914), and mid-range films like 'Fatty's Plucky Pup' (1915) and 'Wished on Mabel' (1915), where there's more of a plot and greater character development.  One also must consider the audience for whom these early films were made.  At this time, the movies were still by and large the entertainment of the masses, many of them immigrants who couldn't speak English, not refined high-society folks.  These shorts may appear cookie-cutter, crude, and badly-aged today, but in their time they did the job they were supposed to for their target audience.

Once Roscoe did get away from the Keystone mold and gained more control over his films, he just got better and better, more and more professional, funnier and funnier, with a more and more endearing character.  It's such a pity that the unfortunate scandal and his subsequent undeserved blacklisting happened when they did, since he'd been at the peak of his career, the top of his game, in some places voted the number-one comedian, above even Chaplin.  He was even the very first of the big-name comedians to make a feature film, though it was unreleased in America for decades.  There's no telling how his career would have continued to unfold had events gone otherwise.  One can only guess how well he might have transitioned into features, the later part of the silent era (since the late Teens and very early Twenties were kind of a transitional period for film), or even the early sound era.  Given the strength of the included shorts he wrote and directed, though, it seems as though he would have continued to soar as a star in his own right.  It's too bad that the producers of this set didn't include one of his own sound shorts from the early Thirties, just to complete the view of the development of his career.  It's too bad that this wonderful set is already out of print, but perhaps someday there might be another volume issued of more of his surviving films, esp. as more of them are turning up in recent years.",1208995200,6,4007,4.848973607038123
2268835,5,B00097DXG2,"Laughsmith worked on this collection for so long that those of us waiting to see its completion began to despair of its ever seeing the light of day.  Once it appeared, however, boy was it worth the wait.  So many films either starring or directed by Arbuckle show a talent bursting with energy and enthusiasm.  Buster Keaton often said he owed everything to Arbuckle, and finally you get to see why.  Restored to just-released quality by the crack team at Laughsmith, and accompanied by beautiful scores and interesting extras, this is a collection that belongs on every movie buff's shelf.",1189900800,4,591,4.88
2268836,4,B00097DXG2,"This disc was produced with love. It even includes a meticulously restored print of the lost film LOVE that was cobbled together from fragmentary prints in two countries, and A RECKLESS ROMEO, the first live action film based on a story from an animated film (THE REVENGE OF THE MOVIE CAMERAMAN). The compilers used the best available prints. There are some eye-openers like SEEING STARS, a tribute film made for Charlie Chaplin in 1925; and the rare feature LEAP YEAR, never released in the USA due to the scandal that ruined his career.

I want desperately to like Roscoe Arbuckle. He had such a rotten deal in life.  Arbuckle was a talented performer who trained Keaton and supported Chaplin and Mabel Normand. But curiously enough he often does not try to be funny. Arbuckle sometimes plays completely serious roles in ostensible comedies; a 'first' for one of his unconventional appearance.

The films have dated and the laughs in LEAP YEAR are few and far between although Arbuckle is amazingly agile and interesting to watch. It's good that we are able to see these films again, but they do not compare favorably to the work of Chaplin, Keaton, Lloyd, or Laurel and Hardy. But I'm glad that they made it and I will keep it.",1174694400,,1230,4.738317757009346
8057770,5,B00097DXG2,Awesome! The best Arbuckle collection!,1502755200,,38,6.8
8057771,1,B00097DXG2,"What a disaster! By the time I unsealed this, a long time after I bought it, three of the four discs had delaminated and were unwatchable. Other reviewers have experienced the same, and it's clearly a manufacturing fault - a bad one. I'm hugely disappointed, all the more so because I paid a three-figure sum to get this box set and Amazon won't give me a cent of it back. I have to advise others to stay away from this otherwise attractive release, because the discs are disastrously defective. A huge, huge shame - I've never been more badly stung with a DVD than by this release.",1453766400,3,582,4.4485981308411215
8057772,3,B00097DXG2,Beware of buying this collection. Two of the DVDs have a surface that begins to break down. Wait for a second edition which hopefully will be manufactured better.,1441238400,,162,4.821428571428571
8057773,5,B00097DXG2,"For being 100 years old, They are in great shape.",1419465600,,49,4.0
8057774,5,B00097DXG2,excellent,1417219200,,9,9.0
8057775,5,B00097DXG2,AWSOME,1416009600,,6,6.0
8057776,5,B00097DXG2,exellent dvd!,1411516800,,13,6.0
8057777,5,B00097DXG2,"I have the original issue so i am not familiar with any possible label/silk screening issues on the reissued pressings. What I do know is these silent film comedy shorts are FUN TO WATCH. Plain and simple, they brim with life and energy unlike (sadly) many of the the Chaplin DVD set.

Fatty deserves more respect and this set gives it to him. Of course there are some weaker shorts, but many of these films are at Chaplin level and possible a few even exceed that lofty standard.

Read the transcripts of the Fatty ""scandal"" and you will see what a joke it was.....The poor mans career was ruined for no reason other than stupidity that existed at the time.

Whether you are a fan of Silent Film Comedy  or want to see was the fuss was about this set is a must have. Those involved in the making of this set are to be commended for their efforts!",1410048000,3,847,4.3081761006289305
8057778,3,B00097DXG2,Not the greatest film around,1409875200,,28,4.8
8057779,1,B00097DXG2,"As reviewed by another, high quality material and booklet, but disks 2 and 3 useless. A simple look at the disks, you can see the laminate falling off. Apparently zero quality control at Mackinac Media. Am returning to Amazon.",1406332800,,226,4.82051282051282
