,overall,asin,reviewText,unixReviewTime,vote,reviewLength,wordLength
1814090,5,B00007JMD5,Grandchildren love it.,1468627200,,22,6.666666666666667
1814091,5,B00007JMD5,"My baby brother is suffering from heavy Thomas and Friends withdrawals, this is his daily fix.
Thank you Michael Angelis.",1465516800,,121,5.1
1814092,5,B00007JMD5,Great,1465430400,,5,5.0
1814093,5,B00007JMD5,MY GREAT GRANDSON HAS WATCHED IT 3 TIMES IN THE LAST 2 DAYS.  hE WILL PROBABLY ASK FOR IT AGAIN THE NEXT TIME HE IS AT MY HOUSE.,1464048000,,128,3.5714285714285716
1814094,5,B00007JMD5,came in as described.,1463011200,,21,4.5
1814095,5,B00007JMD5,It's a must see every time our 2-year-old grandson visits.,1457568000,,58,4.9
1814096,5,B00007JMD5,Our grandson watches this over and over. Loves it!,1457308800,,50,4.666666666666667
1814097,5,B00007JMD5,Percy's chocolate crunch is always a favorite,1456963200,,45,5.571428571428571
1814098,5,B00007JMD5,My son is an avid Thomas fan and this DVD is one of his favorites.,1453420800,,66,3.466666666666667
1814099,5,B00007JMD5,Excellent clean fun for kids.,1448409600,,29,5.0
1814176,5,B00007JMD5,My sons current favorite,1448323200,,24,5.25
1814177,5,B00007JMD5,Grandkids love!!,1444176000,,16,7.5
1814178,5,B00007JMD5,My son loves this show and requests it often!,1443139200,,45,4.111111111111111
1814179,5,B00007JMD5,Great,1440633600,,5,5.0
1814180,5,B00007JMD5,Our son loves this show,1440201600,,23,3.8
1814181,5,B00007JMD5,It was a cute movie. My son loved it!,1439769600,,37,3.2222222222222223
1814182,5,B00007JMD5,"Of all the Thomas episodes, this is by far my son's favorite.  He would give it 100 stars if he could.",1438214400,,102,3.857142857142857
1814183,5,B00007JMD5,Thomas and friends are the best!,1434412800,,32,4.5
1814184,5,B00007JMD5,My grandson loved it,1434412800,,20,4.25
1814185,5,B00007JMD5,"We love this dvd, my son's favorite is the episode with the mouse,  he can't get enough!  Who can also resist the ooey, gooey chocolate episode too! Endless fun! The books of episodes help young learners too (books not included). They can identify what is being read with what they watched. Very highly recommended.",1430265600,,315,4.814814814814815
1814286,5,B00007JMD5,GRANDSON THOUGHT IT WAS FUNNY,1428969600,,29,5.0
1814287,5,B00007JMD5,My 4yo son likes this episode a lot!!,1428883200,,37,3.75
1814288,5,B00007JMD5,I'll rate this for my son. He is an avid Thomas and Friends fan and begs to watch this at night.,1428192000,,96,3.619047619047619
1814289,4,B00007JMD5,Granddaughter loves this whole series!,1428019200,,38,6.8
1814290,5,B00007JMD5,My grandson loves everything Thomas and Friends.,1428019200,,48,6.0
1814291,5,B00007JMD5,"This is the older show, but still great.  My grandson just loves Thomas and his friends!",1427414400,,88,4.5
1814292,4,B00007JMD5,My grandson just loves Thomas and this is a wonderful example of the  series.,1426809600,,77,4.5
1814293,3,B00007JMD5,"My toddler loves Thomas.  I don't quite understand why because its so dreadfully boring: Trains going in circles, uninteresting storyline, monotone narration.  5 stars because my toddler loves it, -2 stars cause I want to kill myself when I hear Thomas in the background.",1425600000,,271,5.136363636363637
1814294,5,B00007JMD5,kids love it.,1424390400,,13,3.6666666666666665
1814295,5,B00007JMD5,Love it!!- my grandson really enjoys this DVD,1420588800,,45,4.75
1814396,5,B00007JMD5,My 2-year old son loves this episode.  Love that Alex Baldwin narrates!,1420588800,,71,4.916666666666667
1814397,4,B00007JMD5,Granddaughter loves it!,1419465600,,23,7.0
1814398,5,B00007JMD5,My son loves Thomas and he loved this movie!,1418688000,,44,4.0
1814399,5,B00007JMD5,My son can't get enough Percy,1417996800,,29,4.0
1814400,5,B00007JMD5,My granddaughter loves trains. This video really entertains her.,1417824000,,64,6.222222222222222
1814401,4,B00007JMD5,My son was entertained.,1417564800,,23,5.0
1814402,4,B00007JMD5,An ok story,1416700800,,11,3.0
1814403,5,B00007JMD5,Classic Thomas and Friends.... Before all of the computer generated animation.... My son actually prefers these!,1416355200,,112,6.0625
1814404,5,B00007JMD5,Wonderful!  My grandson loved it!,1416268800,,33,5.6
1814405,5,B00007JMD5,My Son Love's it. <3,1414713600,,20,3.2
1814476,4,B00007JMD5,Son loved it,1411430400,,12,3.3333333333333335
1814477,5,B00007JMD5,Great!,1411430400,,6,6.0
1814478,5,B00007JMD5,Very good,1411084800,,9,4.0
1814479,4,B00007JMD5,"Very cute little ""live action"" (old-style) Thomas movie.  My 3-year old loves it and watches it again and again.  I personally think Alec Baldwin is a terrible narrator, but she doesn't seem to mind.",1410480000,,199,4.823529411764706
1814480,5,B00007JMD5,Another excellent Thomas the Train adventure.  These are all good morality tales and my 31 month old enjoyed very much and asked to see it again.,1406678400,,145,4.576923076923077
1814481,5,B00007JMD5,Good story for kids.,1405209600,,20,4.25
1814482,5,B00007JMD5,My 3 year old can navigate the Roku himself and always seeks this episode.,1404864000,,74,4.357142857142857
1814483,1,B00007JMD5,"Horrible cartoon. Static drawings, almost no animation. Unpleasant characters. Poor quality video.",1404172800,,98,7.25
1814484,4,B00007JMD5,Son loves Percy and this is one of his favorites. Especially to see Percy take on the action. Well done.,1404086400,,104,4.25
1814485,4,B00007JMD5,"Purchased this dvd for my grandson, but I've enjoyed watching it with him. Very cute story! Great way to spend a few quiet moments with children.",1398297600,,145,4.615384615384615
1814516,5,B00007JMD5,"Which isn't saying a lot. Look, we all know we let our kids watch Thomas so we can get some work done or calm them down before bed. On the sliding scale of OH GOD WHAT HAVE I DONE! to swinging from the ceiling fan, this ones scores a solid stubbed toe water on my hand. Not something you wanna do, but no lasting damage either.",1397952000,,327,3.9696969696969697
1814517,5,B00007JMD5,"Every time my son said he want to watch this one, maybe because of the ""chocolate"" but he don't like eat chocolate at all.",1395273600,,122,4.125
1814518,5,B00007JMD5,My son loves the Thomas and Friends shows that are on Amazon. His favorite one is Percy so kept watching it over and over.,1395014400,,122,4.125
1814519,5,B00007JMD5,Kept my 2 year old grandson entertained. He loves Percy!  This series is a good teaching tool for kids. I highly recommend it.,1394496000,,126,4.478260869565218
1814520,4,B00007JMD5,My kids really enjoyed watching this! They ask to rent it all the time! They never tire of watching it!,1394064000,,103,4.2
1814521,4,B00007JMD5,Very easy to watch on line. Picture quality was good and no lag in audio/video interface. Great family movie. Good experience with Amazon Prime. This was an older Thomas show but was still fun for my son. I would recommend this.,1393804800,,228,4.585365853658536
1814522,4,B00007JMD5,My son absolutely loved this movie. He even wants me to make him a Percy's Chocolate Crunch themed cake for his birthday,1392422400,,120,4.5
1814523,5,B00007JMD5,Wonderful DVD my grandson and the daycare children love it. Thomas is a real big hit in my house with the kids.,1391731200,,111,4.090909090909091
1814524,4,B00007JMD5,Good for train loving children and Thomas and Friends fans.  Percy is always a sympathetic train to follow.  Enjoy with your children and grandchildren.,1390867200,,152,5.291666666666667
1814525,5,B00007JMD5,"My three-year-old LOVES this episode. It's cute, features the miniatures (rather than CGI), and the voice work by Alec Baldwin is fun.",1390435200,,134,5.136363636363637
1814622,5,B00007JMD5,"If your kids love Thomas and his friends from the island of Sodor as much as my grandson, these being on the Prime streaming make it more than worth the yearly cost.
There are a few episodes...not necessarily around a common theme or anything...with some live-action scenes in between.

Highly recommended.",1390176000,,306,5.0
1814623,3,B00007JMD5,Kids lost interest because it's the olde version but it was cute and a good story line just like always.,1389657600,,104,4.25
1814624,3,B00007JMD5,"There's a part with an opera singer and a mouse. The opera singer gets spooked by the mouse and she screams. Her pitch is high (being an opera singer) and shatters glass, or something. This part really upset my toddler. I tried it again (forgot about the ""scary"" part) a few months later and had the same reaction. Just FYI! I don't think there has ever been any other moment in any Thomas movies (thus far) that had that effect.",1388448000,2,429,4.375
1814625,5,B00007JMD5,Very easy to download and stream for viewing.  Thomas videos are a big favorite.  Always get excitement when Thomas comes on.,1387670400,,125,4.904761904761905
1814626,5,B00007JMD5,"I have twin 18-month-olds and this video is their absolute favorite!!! I like that it has the original theme song at the beginning. I don't like the new song, it's just not as fun. Their is also a sing-a-long at the end called ""Little Engines"" that my twins love to dance to. I also like that the Thomas videos introduce vocabulary that isn't common here in the U.S. This video is lots of fun for the little ones.",1380758400,2,413,4.3076923076923075
1814627,3,B00007JMD5,"It seemed like everyone was always disgruntled and mad at each other.  The characters were not that nice to each other either.  It may have had happy enough endings, but I just didn't like it very much.",1379376000,2,202,4.4324324324324325
1814628,5,B00007JMD5,We love Thomas and Friends! They are our favorite. Glad this is available to watch at our convenience. Thank you.,1378339200,,113,4.7
1814629,5,B00007JMD5,This disappeared off of Netfilx and our son kept asking for us to purchase this movie. We were pleasantly surprised when we found it on Amazon Instant Video. Now he can watch one of his favorite Thomas episodes.,1370908800,,211,4.578947368421052
1814630,5,B00007JMD5,They always want to watch the Thomas the Train videos and I know they will always learn a lesson at the same time.,1369008000,,114,4.0
1814671,4,B00007JMD5,My grandchildren love Thomas The Tank Engine.  It is currently their favorite.  Nice for a wind down close to bedtime.,1369008000,,118,4.85
1814672,5,B00007JMD5,"He watches this episode of Thomas daily, sometimes back to back to back, even though there are many other Thomas episodes to choose from.",1368576000,,137,4.75
1814673,5,B00007JMD5,"Good stories, and keeps my son happy. We watch it a lot but I haven't gotten tired of it yet!",1367280000,2,93,3.7
1814674,5,B00007JMD5,"Engaging stories for children and adults, this is one you can watch with the kids.  Some of the narratives in the Thomas series are narrated by folks like Eric Baldwin and George Carlin, among others - good story tellers.",1365811200,,221,4.666666666666667
1814675,3,B00007JMD5,"This is ok. When we first opened it to watch it, it didn't seem like the picture quality was too great. It was like something that was recorded from the tv onto a vcr tape. I don't know how long it will last because when my  3yr. old grandson is over we play it over and over.",1365552000,,276,3.8421052631578947
1814676,5,B00007JMD5,My two grandsons have been Thomas fans for several years.  The videos are so entertaining for children to watch and I'm happy to not worry about the content that they are seeing.,1365465600,,178,4.5625
1814677,4,B00007JMD5,"My Grandson enjoyed this video when it worked.  Had trouble with the video stopping multiple times while viewing, that was upsetting.",1364428800,,133,5.333333333333333
1814678,4,B00007JMD5,"For some reason my daughter really loves trains. She likes to watch this with her dad and they have a good time doing it. It teaches good moral lessons, with cute little train fables.",1362355200,,183,4.411764705882353
1814679,5,B00007JMD5,My sons love Thomas.  Thanks for having such a great selection of children's shows available.  Keep up the good work!,1360627200,,117,4.8
1814680,5,B00007JMD5,percy is our fav thomas character..adorable dvd about percy getting into more mischeif!! arrived fast  GREAT DEAL..A MUST HAVE FOR YOUR THOMAS COLLECTION,1358294400,,153,5.6521739130434785
1814741,5,B00007JMD5,"This is one of my 4yr olds favorites, he loved it since he was 2 so I purchased it for his kindle fire!!......no regrets :)",1357516800,,123,3.96
1814742,5,B00007JMD5,"I ordered this for my 4 year old grandson.
This movie is very clean and also helps small children learn how to get along socially.
My grandson will watch it over and over.",1356912000,,171,4.212121212121212
1814743,3,B00007JMD5,"Christmas gift to our grandson
other than I cannot rate the toy.  I I I I I I i I I I",1356480000,,85,2.8636363636363638
1814744,5,B00007JMD5,My little guy loves Percy covered in chocolate and the woman being scared by the mouse.  A great video.,1260316800,,103,4.421052631578948
1814745,4,B00007JMD5,My nephew loves this one and we had been looking for it for a while. Was in good condition. Wish it would've shipped sooner but overall I am satisfied.,1242000000,,151,4.241379310344827
1814746,5,B00007JMD5,"I really like all of the Thomas the Tank Engine stories and DVDs and this one didn't disappoint! Though there is one story on here: ""The Middle Engine"" that irriated me a bit (didn't really have a clear ending and Sir Hatt was a bit meaner than usual...). There is a wonderful song on here called ""Small Engines"" that I find myself singing along too now! My little one (he's 3) loves it and sat and watched the whole thing through the first time! I would recomend this to anyone with a child that likes trains and/or Thomas!",1225584000,,524,4.357142857142857
1814747,5,B00007JMD5,This video was a great bargain.  My children love the DVD and it arrived more quickly than expected.  Shipping was minimal and overall I paid less than I would have at a store.,1220918400,,176,4.303030303030303
1814748,4,B00007JMD5,"Video was as expected.  If your kiddo likes Thomas' stories, Percy's Chocolate Crunch is a must-have.  Long story short, Percy is upset because Sir Topham Hatt has like, banned unnecessary washdowns.  So, in an attempt to stay clean, Percy decides to take the sugar cars to the chocolate factory because that's cleaner than say, shunting coal.  He skids on the rails and smashes into the factory and chocolate-coated Percy ensues. I'm not really sure there is a lesson to learn from that one, but my kiddo likes chocolate, and he likes Percy... thus making the Percy's chocolate crunch a winning combo.
Don't buy this if you're thinking you'll get the Bulgy bus, cause you won't.  You'll get a toy with it for sure, but it's a crap shoot as to which.",1210204800,,750,4.694656488549619
1814749,4,B00007JMD5,"Percy's Chocolate Crunch is an excellent video! I would have given it a 4.5 but Amazon does not have that. It is a great buy and almost every part of it is excellent. I am very pleased to see a gordon episode. He has been neglected as a main character this season.

Percy's Chocolate Crunch: 4.5/5

Percy complains all day about having to do the dirty work on the island. Trucks start calling him ""dirty percy"" which is a good name because children cannot repeat it and call themselves dirty percys. Then Percy refuses to do dirty work so he takes sugar cars to the chocolate factory but slippery rails cause percy to crash into the chocolate factory and get covered in chocolate!

Thomas, Percy, and the Squeak: 3.5/5

Thomas is to take a famous singer to her concert so when he has to get clean at the washdown he cuts in front of percy and calls him dirty percy. When the famous singer boards the coaches she sees a mouse and refuses to go on Thomas's train. Then percy comes in still dirty because he did not have time to get a washdown. The famous singer rides in percy to the concert. Later Thomas and percy make up and thomas lets percy get a washdown first. A good story of friendship, however it is tied for the worst.

Gordon Takes a Tumble: 5/5

This is the best story of the set, Gordon thinks hes better than everyone else and is too important to pull trucks. Until TFC forces Gordon to pull them. While speeding along with a train of trucks, Gordon ignores the ""go slow"" signs and crashes. The crash is a bit over dramatic but it is still my favorite story.

Buffer Bother: 4/4

A good bill and ben story, Ben gets new buffers but bill doesnt that makes bill extremely jealous and causes him to have an acident and damage his buffers. Jealousy is an area not covered too often in Thomas and Friends but it is an esential lesson to teach children with siblings.

Middle Engine: 4/5

Percy goes to the smelter and Arry and Bert play tricks on him to put coal cars in front and back of percy so he has to go slowly. Percy accidentally goes onto the tipper for the coal which is quite a funny sight. Then he gets in trouble with TFC. James is sent to the smelter the next day and Arry and bert put james in the middle of a long line of trucks. When James refuses to move Percy is sent to fetch him. This is a good percy episode, it lost half a point because it is just not as good as percy's chocolate crunch.

Faulty Wistles: 3.5/5

Tied for the worst with Thomas, Percy, and the squeak. Not really a bad thing though, this story brings back some of the classic narrow gauge engines who have not been seen for some time. Peter-Sam loses his whistle and Duncan makes fun of him for it. When Duncan over uses his whistle to show off it pops off! Cute story, just not good enough for a video like this.",1176076800,,2810,4.261278195488722
1814750,3,B00007JMD5,"I ordered this DVD because (1) my son loves Percy, and (2) he really wanted a Bulgy the Bus, which is pictured as the bonus vehicle that comes with the DVD.  Our DVD arrived with Skarloey instead of Bulgy.  If you're looking for Bulgy (he's hard to find), be wary that this might happen to you, too.  The DVD otherwise is great.",1168300800,,328,4.258064516129032
1814801,4,B00007JMD5,"We got this DVD after our 3 year old saw the cover and became fixated on learning the story.  I was glad to be getting another disc narrated by Alec Baldwin, since our first two were Make Someone Happy and Races, Rescues and Runaways, and as a result the voicings by George Carlin, Ringo Starr, and whoever it is doing the current series on PBS just don't sound right.  So strong is our association of the Baldwin voices with the Thomas characters that when I thought I saw Baldwin at the theater last week, I wanted to go up and tell him how much I appreciated his work on Thomas - the engines are all very distinctive and characterful.

Imagine my shock, then, when Gordon first speaks - and he has an average voice, not the unmistakeable deep bass of our earlier DVDs.  My whole problem with Carlin is that he doesn't realize that Gordon has a deep voice, and now it seems like Baldwin doesn't either.  Worse still, instead of his (obviously correct) clipped air-traffic-controller voice, Harold now speaks like some weird British eccentric - ridiculous!

I can only guess these are some of the first episodes Baldwin recorded, before he figured out the engines' *true* voices.  So, be warned - if you want to know what the engines really sound like, go for Races, Rescues and Runaways!

-- Nathandaddy.",1113609600,3,1306,4.623376623376624
1814802,4,B00007JMD5,"Great Thomas Video. I liked all of the stories very much(They include: Percy's Chocolate Crunch, Thomas, Percy & the Squeak, Gordon Takes A Tumble, Buffer Bother, Middle Engine, Faulty Whistle) I'd say Gordon Takes A Tumble is one of the funniest stories of all time. The first time I saw this story, I was in tears(laughing, not crying) when Gordon fell of the rails and crashed into a pile of tires, a shed, and a giant mound of dirt and stops right in front of a scare crow. Now this is a story you'll want to see over and over again. Very good, 9 out of 10.",1095465600,3,561,4.252336448598131
1814803,5,B00007JMD5,"This was a tape for Percy mainly but he lacked a good episode for awhile. In Percy's Chocolate Crunch Percy learns that usefullness does come before cleanliness. In Thomas, Percy, and the Sqeak Percy gets to take singer Alicia Botti to a concert. In Gordon takes a Tumble Gordon triesto show Salty that he can pull freight cars. In Buffer Bother Bill is jealous of Ben's new buffers. In Middle Engine Percy tries to stop getting tricked by Arry and Bert. In Faulty Whistle Duncan has to deliver freight cars by using an organ as a whistle. Then there is the music video Little Engines. This tape is good and I recommend it.",1066435200,,623,4.522123893805309
1814804,5,B00007JMD5,"i have been really critical of alec baldwin's vocalizations in the past (particularly in ""make someone happy""), but i have to say that this is by far the best of the 7 thomas tapes we own.  the messages in the episodes are good, the vocalizations are interesting, and mr. baldwin has totally changed the way he plays james for the better.  i also loved hearing him as the foreman at the coal plant saying, in his best brooklynese: ""joo have cawsed confyusion and deeelay.""  this video is such a tremendous improvement from some of mr. baldwin's previous efforts--please keep it up!  i highly recommend this video for anyone interested in thomas or interested in starting a thomas video collection.",1053907200,,697,4.831932773109243
1814805,4,B00007JMD5,"Our son is a big Thomas fan, and he really loves this new DVD from the Thomas and Friends series.  This one introduces a new character, Elizabeth, who is Sir Tophamm Hatt's first truck.
In the first story, Percy's Chocolate Crunch, there is a water shortage.  Since Percy has been doing a lot of dirty work, he complains that isn't always clean like he wants to be.  His driver suggests that they take some cars loaded with sugar to the chocolate factory, but chaos ensues.
In Thomas, Percy and the Squeak, Thomas is chosen to take the famous singer Alicia Botti to her concert.  She refuses to go with Thomas when she sees a mouse in one of his coaches.  Percy then comes to her rescue.
In Gordon Takes a Tumble, Gordon shows Salty that he's ""too big for his buffers"" and disobeys a few signs telling him to go slow when he is accidentally switched onto a branch line.  An accident then occurs.
In Buffer Bother, Ben needs new buffers.  Bill, his twin, is jealous because he wants them too.
In Middle Engine, Percy falls for Iron 'Arry and Iron Bert's devious tricks.
In Faulty Whistle, Duncan tries to show off by tooting his whistle too much.  It then comes loose and flies off when he tries to give Terence the Tractor ""the loudest whistle yet"".  A man who plays the organ then comes to Duncan's rescue (he has been riding with Duncan and offers to play his organ because it's too dangerous to travel without a whistle to alert the stations).
I definitely recommend this DVD in addition to the rest of the Thomas series.  It also has a cute little song called Little Engines.  Also, the bonus features are worth trying out as well.",1050451200,3,1635,4.4713804713804715
1814806,5,B00007JMD5,"When you just thought the new stories were already launched, I knew there were going to be some more new episodes set out. Join Percy in a unexpected visit to the chocolate factory, help the engines get Alicia Botti to the island concert in time & listen to the sound of Duncan's new whistle. At first I thought the song was stupid, but soon the tune got better! New stories, new characters & new DVD extras, this is where the fun begins!",1049155200,5,438,4.353658536585366
1814857,5,B00007JMD5,"Great video for kids, my son loves anything Thomas and this one comes with a toy!",1048118400,,81,4.125
1814858,5,B00007JMD5,"Percy's Chocolate Crunch: Percy does the dirtiest work outy of all the engines. Sir Topham Hatt says every engine will only have one washdown per day. Percy ties not to get dirty but it won't work.
Thomas, Percy, and the Squeak: The famous singer, Allicia Botti, is going to have a concert on the Island of Sodor. Thomas is the one who gets her to the concert. He hears a wierd squeak coming from Annie.
Gorden Takes a Tumble: Gorden is the proudest engine on the island. One day, Salty comes up and teases him. That night it is really busy in the harbor. Gorden has to take some of the freight. He wants to prove to Salty he can take a freight train better than him. Well, I think you know the rest by the title.
Buffer Bother: Ben gets his buffers bended. He has to get new ones. Then Bill gets jeluice.
Middle Engine: Every engine is proud of their work. But no engine likes being a middle enginje becuase it is no fun being stuck in the middle of a freight train.
Faulty Whistle: Duncan is taking an organ and the headmaster somewhere. Along the way he whistles at Elizibeth, some sheep, and Terence. Then his whistle flies off like a rocket!
To find out the ends to these stories watch it yourself.",1045872000,3,1203,4.327433628318584
1814859,4,B00007JMD5,"Percy, the stout green engine, gets dirty in a few stories.  He wants to get clean.
This is a nice collection of new stories.  The new characters seem to be more subtly introduced, but the stories don't feel as lively as those presented on ""Salty's Secret.""
One note: narrator Alec Baldwin retains Salty's ""sea dog"" voice from the ""Salty's Secret"" collection; however, he has forgotten the voices he had established for other characters (even Elizabeth, the steam truck).  I guess most kids won't notice, but why jazz up the narration if there isn't going to be continuity?  Ringo and George didn't need the fancy voices.",1045612800,6,621,4.885714285714286
