,overall,asin,reviewText,unixReviewTime,vote,reviewLength,wordLength
3381970,4,B0015UWYOO,"The film is from the point of view of a man remembering when he was a boy who isn't very athletic, but whose mother and father are.  As a boy, he imagines he has a brother Simon who is as athletic as he himself is not.  In his early teens, the neighbor (played by Julie Depardieu, Gerarad's daughter) tells him the truth where he learns his mother is not his father's first wife and his father had a son Simon by his first wife who was very athletic.  It might sound like I'm giving the plot away, but this is not the ""secret"" of the title.  The secret of the title is what happened to the family and friends during World War II.  It's a very good movie and I recommend it.  It's not a comedy, but a drama with a serious plot.",1382140800,5,726,4.041958041958042
3381971,5,B0015UWYOO,Engrossing well acted ww 2 drama believable and understated acting  about a family with secrets and a bewildered son highly recommended,1375488000,,135,5.428571428571429
3381972,2,B0015UWYOO,We felt it was a waste of our time to even complete our viewing as the story line was one we were not interested in.,1374364800,,116,3.68
3381973,5,B0015UWYOO,"This is not a holocaust movie or a movie about victims, though it takes place during the worst times.
It is a sensitive movie about relationship. About friendship. and about making the best of what we are given.
I strongly recommend it. Claude Miller has made a wonderful spectacle. Soli",1367452800,,287,4.76
3381974,5,B0015UWYOO,Good quality and good thriller!! Fench with subtitles.,1363910400,,54,5.875
3381975,1,B0015UWYOO,"Went too sleep.watching the first ten minutesof this movie. The information looked interesting, but may have just been my mood for the day and time.",1362614400,,148,4.96
3381976,2,B0015UWYOO,"I didn't like the plot, the acting. I couldn't wait for the movie to be over.
I found this movie to be extremely boring.",1362268800,,120,4.041666666666667
3381977,4,B0015UWYOO,"I heard this is a good movie, but this was a defective CD.  The seller totally stood behind the product and refunded my account without the hassle of returning.  I would definitely buy from this seller.  I am assuming the CD's can be scratched at times and it would not be known until you watch it.  Thank you for the amazing service.  One day I will try to watch the movie on a working CD and let you know for sure after, if it's a good movie or not.",1360368000,,451,4.022471910112359
3381978,5,B0015UWYOO,"This is a must see movie!!! Great plot, great acting, great direction, and all characters are well developed. Everything in this film is just fabulous.

The movie opens on the everyday life of a Parisian couple with a kid (a boy) after World War II. The boy is narrating the story as we move slowly in the plot. He is not that good in sports while both of his parents are really athletic. This is a significant detail. We feel that something is happening or happened in the past because during the first half hour, the whole plot is slow and puts the spectator in such a ""malaise"" that you are tempted to fast forward in order to understand what's going on. Don't do that!! Let the characters develop. You will be rewarded!

I was anxious to see what the role is for Ludivine Sagnier. I personally think that she is one of the best actrice worldwide. Period. Finally she appears half way through the movie and her presence is just overwhelming. She takes over the movie and SHE IS the movie all the way to the end.

Watch the movie carefully and you will understand my title. I cannot say more without giving the plot away.

Five stars all the way. One of the best movies ever!!!",1360281600,,1179,4.394495412844036
3381979,1,B0015UWYOO,"My wife and I tried to watch this movie. We consider ourselves to be open-minded when it comes to watching movies. We stopped it about mid-way through after being bored to the point of stupification with its glacially slow plotline. I know that the French have made better movies than this, because I have watched them. However, if this is an example of where their movie industry is headed, they would be better sticking with wine.",1358553600,,432,4.697368421052632
3381980,5,B0015UWYOO,"This movie will mark you profoundly. Beautifully filmed with soft gentle music this film delivers a powerful message. Holocaust was told implicitly with subtlety, without shocking images of violence, but with such power that the story becomes unforgettable.",1351555200,,257,5.7894736842105265
3381981,4,B0015UWYOO,"Un Secret is not just a ""holocaust"" film. It is a profound journey into a man's search for his identity. In some senses it is reminiscent of the the Oedipus story. Learning who one is sometimes has a high price. In this case, it is the loss of an entire personal history (and the discovery of another).",1315526400,,302,4.315789473684211
3381982,5,B0015UWYOO,"'Un Secret' is a multi-layered movie that deals with myriad themes. The central character is Francois Grimbert who has always had a rather distant relationship with his father Maxime [Patrick Bruel]. As a young boy, Francois is not keen on sports and appears rather frail [he was a four lb baby] and very unlike his athletic father and swim champion mother Tania [Cecile de france]. His young mind conjures a phantom brother that is very athletic and strong, driving his parents to distraction. When Francois discovers a toy in the family attic, secrets long hidden begin to unravel, thanks mostly to a long-time family friend, Louise [Julie Depardieu] who reveals all that she knows.

Told via a series of flashbacks, the story unfolds. Ironically, the flashbacks to the past are portrayed in color, and the present [where the now mature Francois goes to meet his old dad] is in black and white. This is ideal as in this story, the past is of the most significance. As the 15-year-old Francois learns, his 'imaginary' brother of childhood was very much real, and was called Simon, much beloved by his father Maxime, and his mother Hannah [Maxime's first wife]. As the story progresses, we learn of a complex love triangle, involving Maxime, Hannah, and Tania. Maxime first sets eyes on the gorgeous, blonde Tania at his wedding to Hannah. At the time, Tania is married to Hannah's brother, but when the Nazis begin expanding their power across Europe, Tania's husband becomes a prisoner of war and this brings Tania closer to Maxime and his family, which now includes the young Simon. As the Nazis occupy France, Maxime refuses to wear the yellow star, turning his back on his Jewish identity, much to the chagrin of Hannah, who is proud of her heritage. Hannah also slowly realizes to her horror that Maxime desires Tania, and this realization later plays a tragic role in shaping the ultimate destiny of Hannah and Simon.

The plot here may come across as incredibly convoluted, yet despite the many layerings to the story, conveyed by the frequent flashbacks, the plot flows well, almost seamless, and I could easily follow the stories of the main characters.

This is a riveting human drama that not only portrays the complexities of love and relationships, but also shows how the French Jews, as portrayed by Maxime, his family and close friends were affected by the Nazi occupation of France, and how the French government basically turned its back on its Jewish citizens. Final verdict: a well-made Holocaust-themed human drama.",1295308800,,2536,4.934426229508197
8260007,2,B0015UWYOO,"Decent story, and acting",1517097600,,24,5.25
8260008,4,B0015UWYOO,Good film although it could show more realism given the horrific situation,1511827200,,74,5.25
8260009,5,B0015UWYOO,"I saw this movie for the first time on Netflix and kept it on my Netflix list but it disappeared. I'm glad I was able to purchase it on Amazon. I will watch my personal favourites several times over and in my view it is comparable to the English Patient,  albeit minus the  breathless landscapes and romantic aerial plane rides. The actors of
A Secret have only themselves against the despair of a holocaust backdrop to entice you and this they do brilliantly.",1499731200,,460,4.530120481927711
8260010,5,B0015UWYOO,Great movie!,1483401600,,12,5.5
8260011,5,B0015UWYOO,C'est excellent!,1448150400,,16,7.5
8260012,5,B0015UWYOO,Thank You,1440633600,,9,4.0
8260013,1,B0015UWYOO,"I cant stand movies on the war and on childhood, watched it only because i like Mathieu Almaric, depressing movie about a child how is gracile and his parents were gymnasts...big deal",1440633600,,183,4.75
8260014,5,B0015UWYOO,"Great movie, highly recommend it to all, who care about Holocoust.",1425513600,,66,5.090909090909091
8260015,5,B0015UWYOO,This is a beautifully rendered movie version of the book.,1416873600,,57,4.8
8260016,5,B0015UWYOO,"This was a very sad story, thought about it for days after I watched it that is why I gave it a 5 star",1394064000,,102,3.2916666666666665
