,overall,asin,reviewText,unixReviewTime,vote,reviewLength,wordLength
4834955,5,B005MQ58LS,"Standing by their word that all 6 seasons of the beloved 1960's sitcom ""The Lucy Show"" would become available in its entirety, CBS/Paramount has just announced ""The Lucy Show-Season 5"" comes to DVD December 6, 2011 just in time for Christmas in a 4 disc set! This leaves just one more full season left before the entire library of ""Lucy Show"" episodes will be made available for posterity for legions of Lucille Ball fans to enjoy.

 Season 5 (1966-1967) finally gave Lucille Ball an Emmy win as Best Actress in a Comedy after three nominations. This would be followed yet by another win in ""The Lucy Show's"" final year.

 22 episodes were made and have been restored in pristine condition and are in beautiful color.  The rarely seen ""jack-in-the-box"" opening of this season is shown during the first 10 episodes. During the summer of 1966 Lucille Ball ordered that there be a new opening. When the series premiered, without seeing the opening beforehand, she was mortified and demanded the opening be dropped. It was. When ""The Lucy Show"" reaired the series' opener on CBS the regular, more popular opening was used. In subsequent reairings of the show in syndication the ""jack-in-the-box"" opening was never seen again. I have seen that opening and it is tacky, stupid, and simply tasteless.

 The bonuses so far that have been announced for Season 5 include the great ""Lucy in London"" special that aired on October 24th, 1966 featuring Anthony Newley and the Dave Clark Five, a new documentary on the series, and outtakes.

 Like ""I Love Lucy"", ""The Lucy Show"" never left the Nielsen Top 10 rated shows, and the fifth season came in at a very impressive #4!

 Guest-stars this season include George Burns, John Wayne, Carol Burnet, and the wonderful Vivian Vance makes an appearance.

 The following are the complete 22 episodes of ""The Lucy Show"" along with their original CBS airdates:

1. ""Lucy with George Burns"", Sept. 12, 1966
2. ""Lucy and the Submarine"", Spt. 19, 1966
3. ""Lucy the Bean Queen"", Sept. 26, 1966
4. ""Lucy and Paul Winchell"", Oct. 3, 1966
5. ""Lucy and the Ring-A-Ding Ring, Oct. 10, 1966
6. ""Lucy Flies To London"", Oct. 17, 1966 (This episode would serve as the starting off point for Lucy going to London and taping her TV special that aired the following week in ""The Lucy Show's"" timeslot).
7. ""Lucy Gets a Roomate"", Oct. 31, 1966
8. ""Lucy and Carol in Palm Springs, Nov. 7, 1966
9. ""Lucy Gets Caught Up in the Draft"", Nov. 14, 1966
10.""Lucy and John Wayne"", Nov. 21, 1966
11.""Lucy and Pat Collins"", Nov. 28, 1966
12.""Lucy and the Monkey"", Dec. 5, 1966
13.""Lucy and the Effiency Expert"", Dec. 12, 1966
14.""Lucy's Substitute Secretary"", Jan. 2, 1967
15.""Viv Visits Lucy"", Jan. 9, 1967
16.""Lucy the Babysitter"", Jan. 16, 1967
17.""Main Street U.S.A."", Jan. 23, 1967
18.""Lucy Puts Main Street on the Map"", Jan. 30, 1967
19.""Lucy Meets the Law"", Feb. 13, 1967
20.""Lucy the Fight Manager"", Feb. 20, 1967
21.""Lucy and Tennessee Ernie Ford"", Feb. 27, 1967
22.""Lucy Meets Sheldon Leonard"", March 6, 1967

 One more important note: many Lucile Ball fans already own many of these episodes that have been cheaply packaged over the years and the prints were down-right terrible. Trust me: buy this set and discard your old copies of these episodes because the one's that have been on the ""public domain"" and released time and time again were taken from cheap negatives, not the series' original prints like these have.",1315958400,26,3432,4.8013582342954155
4834956,4,B005MQ58LS,"I won't make this one of those lengthy reviews that include a full episode guide for the season, or detailed background information. I will say that the best thing about Season Five of ""The Lucy Show"" arriving on DVD is that it FINALLY renders all those terrible public domain releases obsolete!

If you already own all of those inferior releases and are asking why you should dump them and spring for this set here's the scoop. Every official CBS/Paramount release of ""The Lucy Show"" so far has featured eye-popping, beautifully restored prints and a bounty of bonus features and this one is no exception. (NOTE: See the screen grabs in the Images section of this product). The fact that the 1966 ""Lucy In London"" special will be included is reason enough. Even the infamous rare ""jack-in-the-box"" intro is here and it was aired only once and then replaced because Lucy hated it so much. My favorite of the bonus features is short and sweet: Lucy's 1967 Emmy win where she actually gets teary-eyed and thanks the voters by saying ""I love my work. Thank you for giving me this for it"". It's a great moment that speaks volumes about Lucy. Also short but hilarious is the blooper reel, worth watching to see Mary Wickes get accosted by a randy elephant!

I have to admit the script quality was still deteriorating at this point, but there are still a few keepers this season. Carol Burnett makes her first of many appearances on a Lucy series in a two-parter; there's a charming and memorable musical number in ""Main Street USA""; and best of all Vivian Vance returns in my favorite episode of the season. ""Viv Visits Lucy"" has the two donning psychadelic costumes and hitting Sunset Strip to rescue a wayward teenager. It's a hilarious script with many memorable lines and the two veterans knock every one of them out the park.

The rest of the season is hit-and-miss but CBS' fantastic presentation has always managed to allow these episodes to provide me with much more viewing pleasure than I thought they would.

Useless trivia: This is the season that Lucy won an Emmy Award for Outstanding Lead Actress in a comedy series beating out Marlo Thomas, Elizabeth Montgomery and Agnes Moorehead.",1315958400,8,2193,4.7631578947368425
4834957,5,B005MQ58LS,"Season five of ""The Lucy Show"" is one of the best seasons.  ""The Lucy Show"" finished in fourth place in the Nielsen Ratings for the 1966-67 season with a 26.2 rating and 40% share of the audience.  It killed its' competition - ""The Roger Miller Show,"" ""Captain Nice"" and ""The Rat Patrol"".  It also marked Lucy's third Emmy nomination for ""The Lucy Show"" and a win for Best Actress In A Leading Role In A Comedy Series (1966-67).  The Emmy was long overdue.  Season five also reunites Vivian Vance and Lucy and takes them to the Sunset Strip posing as hippies. The episode is a classic.  Most of the 22 episodes for season five are excellent except for maybe two or three.  My favorites include:  Lucy's Substitute Secretary w/Rutha Lee trying to take over Lucy's job with Lucy doing an hysterical impersonation as a mod interior decorator; Lucy teaming up with George Burns, Carol Burnett (in a two-part episode), the now classic John Wayne episode, Main Street USA (two Parts), Lucy Bags A Bargain, Lucy Goes To London (episode) that leads into the ""Lucy In London"" special, Lucy w/Paul Winchell, Lucy And The Ring A Ding Ring, Lucy and Phil Silvers and Lucy Gets Drafted w/ a cameo by Jim Nabors.  All these episodes are so well written and done with such love it's no wonder that everyone loves Lucy.  In addition, ""Lucy In London"" TV special with Dave Clark Five and Anthony Newley will be one of the extras.  The special was very innovative for its' time and probably gave us one of the first and very best music videos with Lucy posing in all the mod costumes of that time.  It's a really enjoyable special and is probably Lucy's best TV Special ever.  Again, thank you CBS/Paramount Home Entertainment for putting such love in ""The Lucy Show"" DVDs.  Can't wait for the sixth and final season.",1315958400,11,1799,4.616352201257862
4834958,5,B005MQ58LS,"The lucy show is great.  Of course lucille ball is wonderful.  The special features and cast bios on the I love Lucy DVDs are better, more detailed, but I enjoyed the behind-the-scenes offered on this set.",1428624000,2,205,4.666666666666667
4834959,5,B005MQ58LS,"I'm a women of the 50's I forgot how great she was. Love, love, love",1428192000,,68,3.6
4834960,5,B005MQ58LS,none,1427328000,,4,4.0
4834961,5,B005MQ58LS,it was very funny & johyn wanyne & csarol & burnett George burns made this seanson very funny so get yours today injoy today,1423094400,,124,4.208333333333333
4834962,5,B005MQ58LS,Great to have if your a Lucy fan.,1422576000,,33,3.25
4834963,5,B005MQ58LS,great,1420070400,,5,5.0
4834964,2,B005MQ58LS,"I wanted a CD with Lucy and Desi together! , Desi Arness iss not in the CD I  this CD did not meet my needs..",1408233600,,109,3.36
4834965,5,B005MQ58LS,"Always enjoy my Lucy Show dvd's what can I say she the best, love you Lucy!...",1405641600,,78,3.9375
4834966,5,B005MQ58LS,Great set of restored episodes with great bonus features!!!! Replace the old public domain DVDs and get this set.,1405296000,,113,5.0
4834967,5,B005MQ58LS,"great Lucy never fails to be her natural great self...great woman,  & actress- always will love Lucy! Cannot wait to buy season 6",1390089600,,129,4.608695652173913
4834968,5,B005MQ58LS,We see it atleast 3X a year in order to laugh A LOT! Esp. the Submarine one. It is the really best!,1387497600,,99,3.5454545454545454
4834969,4,B005MQ58LS,"The fifth of six seasons of the top ten, Emmy-winning ""Lucy Show"" is more familiar to modern audiences than others, in part because of a copyright goof, most of these episodes have been available on cheaply-made DVDs over a period of years when the rest of the series was unavailable.  Fans of the show who have seen the same 30 episodes packaged and repacked over and over with shoddy video quality will be pleased to see these professionally restored episodes.

Many of the episodes are inventively written: ""Lucy and the Bean Queen"" has Lucy taking advantage of a ""double your money back"" offer, but in the end she gives up her hard-schemed fortune in order to be honest.  Lucy horns her way into a John Wayne movie; gets hypnotized as part of a nightclub act; and loses Paul Winchell's dummies.  A two-part episode, ""Main Street U.S.A.""/""Lucy Puts Main Street on the Map"" features a memorable original song.

Even if you already have some of the cheap DVDs with these episodes, it is worth it to get the real thing.

I highly recommend&nbsp;<a data-hook=""product-link-linked"" class=""a-link-normal"" href=""/The-Lucy-Book-A-Complete-Guide-to-Her-Five-Decades-on-Television/dp/1580630510/ref=cm_cr_arp_d_rvw_txt?ie=UTF8"">The Lucy Book: A Complete Guide to Her Five Decades on Television</a>&nbsp;by Geoffrey Mark Fidelman as a viewing companion to anything with Lucille Ball.",1386979200,,1375,5.586538461538462
4834970,5,B005MQ58LS,"I got this to complete my collection the Lucy Show.  This is just good, clean, fun television from the 60's .",1377734400,,109,4.190476190476191
4834971,5,B005MQ58LS,What an amazing job they did on the restoration of this classic show. Season 5 even includes the rarely seen Jack in the Box Intro. Every episode is fully restored with great picture and sound quality. Finally these shows that have only been available as poor public domain releases get the full treatment. Season 5 is one of my favorites. There are guest stars galore and we have worked through the awkward transition of losing her children from the first two years and Vivian Vance retiring. In the previous season they were still working out the new format. Everything is in place and the laughs are galore in this season. If you love the Lucy Show you will love this restored version of the Fifth season.,1360627200,,708,4.626984126984127
4834972,5,B005MQ58LS,"I used to watch ""The Lucy Show"" with my mother as a child, so this show brings back fond memories. The episode I remembered the most was ""Lucy In London."" I admit I bought Season 5 for the chance to watch ""Lucy In London"" again. And it did not disappoint! Seen in beautiful, restored color was such as treat, especially since when I watched it as a child, we only had black and white TVs. So I had never seen ""Lucy in London"" or ""The Lucy Show"" in color until now. I got a kick out of seeing all the ""Mod"" fashions and Twiggy has a cameo in the episode. (If you're a Baby Boomer like me, you know who that was!)
It was my understanding that ""Lucy in London"" was only broadcast once on 10/24/66, and I often wondered why it never found its way to Nick At Nite, TVLand or Antenna TV. So I'm delighted it was included in the Season 5 set. That alone makes this set well worth the price, and my son loves Lucy as much as I do. An interesting tidbit: Phil Spector wrote and SANG the ""Lucy in London"" theme song. What was disappointing is Lucy planned on making two more specials like ""Lucy in London"", but due to poor reception of this episode, she decided against it.",1357776000,,1163,4.173333333333333
4834973,5,B005MQ58LS,"After four successful years, Lucille Ball entered another season of ""The Lucy Show."" The ditzy redhead gets in all kinds of trouble this season by misplacing Paul Winchell's dummy, destroying a factory, dressing up as a sailor, getting caught in the draft, missing her flight to London, getting a ring stuck on her finger, and there are many more funny situations.",1350432000,2,364,4.983606557377049
4834974,5,B005MQ58LS,"Growing up, I always loved watching older shows, being that I was raised by my grandparents, I was a Baby Boomer at heart, and was raised to respect my elders, and never had a desire to watch the trash on TV nowadays!

  I loved The Lucy Show from the very beginning! So much that not only did I purchase One copy of Season 5, but 3 additional copies from BestBuy just to make sure that I never have to be without Lucy. There is no if, ands, or buts if you love Lucy. Either you do or you don't. If you don't, you have poor taste in Comedy. Buy this set along with Season 1-4. You won't be disappointed ! I personally guarantee you will be very entertained.",1340755200,4,657,4.1171875
4834975,5,B005MQ58LS,"The Lucy Show-The Fifth Season(66/67),is Paramount's official release of,I think,the best season of the series since its first season. The show started to wane with Vivian Vance on it,she departed,which left a hole that the writers couldn't successfully fill until this season. Everything seems to be swinging in high gear. This season finds the likes of John Wayne,Don Rickles,Carol Burnett and George Burns dropping by to heighten the proceedings. Of course John Wayne's appearance harkened directly back to the I Love Lucy series,when Wayne appeared in two classic eps with Lucy and Vivian ""messing up"" his footprints in cement. Even Vivian Vance was a welcome sight this season in her return for an ep.
The unexpected highlight of this set however is the Lucy in London hour special. I had not seen it since its original airing and was gobsmacked to see it added into the set. I recall it as kind of an odd duck,so far as Lucy was concerned. It was as if she was trying to appeal to the younger crowd and show them how ""hip"" she could be,which she needn't have had to do. It also smacked a little of a psychedelic film with Lucy suddenly bursting into a dance routine in the park or on some steps,with fast edits and cuts for emphasize. To add to the `hipper`Lucy image,Lucy was dressed to the nines in the appropriate Mod outfits direct from Carnaby Street. Phil Spector wrote the theme music and the Dave Clark Five appeared,to add some street cred to the proceedings. There is a featurette on the making of this ep and you will see the makers talking of their ""wise"" decision to use the ""talented"" Anthony Newley as the basis around which everything else was shot. Unfortunately their choice of Newley as their centerpiece was a mistake to a certain degree. As creative and talented as Newley was,the hottest act,selling millions of records and the hottest ticket around,The DC5,were underutilized;not one song did they perform. Well technically speaking,they did help Lucy and Anthony sing London Bridge while performing a dance routine with them,but that was as good as it got. Otherwise they were in and out,only involved in these weird dance montages. They even let Newley do a little routine and sing a few of his signature numbers on a stage,which made it obvious then,and it remains so today,that as ""hip""as the producers wanted to make it all seem,they were still old school. Why didn't they get the DC5 to play just one number;and as this was a ""feel good"" kind of thing,the DC5 could have played one of their big hits Because,right to Lucy,as she sat watching it. It would have been hip and sentimental at the same time showing even England loved Lucy! Well the special is what it is,and at the time got razzy reviews from TV critics(who could really understand it),but it is still really nice to have it out there once again for all to see.
Paramount,again,has done a fantastic job of remastering these eps which are crisp and clear. And as always the extras are to die for,as they include:""Lucy In London"",""Lucy In London Revisited"" (Documentary),clip From 1967 Emmy Awards,clip From 1966 Affiliates Presentation,clip From ""Victor Borge Comedy Theatre"",""25 Years of Savings Bonds"",bloopers,rare promos,vintage openings & closings,guest cast bios,production notes and photo galleries.
This series was not I Love Lucy by any stretch,but it still shows pro Lucille Ball doing what she did best,and that was making people laugh. She was ably supported in this season by Mary Jane Croft as her neighbour,and the ever brilliant Gale Gordon as Mr. Mooney. The writing and skits seemed to flow the best in many a season and Lucy finally got an Emmy for this years work;which she deserved. Highly recommended.",1329523200,5,3719,4.89540412044374
4834976,4,B005MQ58LS,"Why do I love Lucy? The shows are comedy, nothing less, no sadness just funny. Hits my funny bone and does not make me cry before they make me laugh just try and find that these days. I rated this a 4 star because it's has my least favorite of the shows(Main Street)too sappy for me. But love the new Lucy in London that I have never seen before. Can't wait for the next season!!!",1327536000,5,380,4.08
4834977,5,B005MQ58LS,"For those of us who grew up watching Lucy in reruns, it's a real treat to gather these collections of ""The Lucy Show"" - the first time we were able to see Lucy's red hair in color! EIther you love Lucy or you don't - there's no middle ground - and if you don't, shame on you! But for those of us who do, what more is there to say? We will never see the likes of her again - no celebrity before or since has been able to match her brilliance for comedy while maintaining class and dignity. Lucille Ball was and is an American treasure... and many thanks to all those responsible for the production of these classic collections - the quality is amazing....",1326067200,7,654,4.198412698412699
4834978,5,B005MQ58LS,"This season 5 release of ""The Lucy Show"" does contain the long-lost original ""Jack in the Box"" opening on the first handful of episodes. I have never seen this because the syndicated prints omitted it and inserted the kalidescope opening instead. It's really corny and I can see why Lucy hated it.  On a better note, the ""extras"" are fantastic, the prints are pristine. I couldn't believe these episodes are 40 years old!! Seeing Carol Burnett, Vivan Vance, John Wayne, George Burns amongst other legendary actors are great. A true must for any Lucy fan out there.",1324944000,7,564,4.814432989690721
4834979,5,B005MQ58LS,"Okay, I admit.  I'm a Lucy nerd.  I have all the seasons of all the shows.  Before the first ""I Love Lucy"" release, I had all the episodes of all the shows on home-recorded VHS!  So, I was a little skeptical at first about this set.  (In my opinion, ""The Lucy Show"" season 5 is probably the nadir of her television career, but in Nielsen's opinion, it was the #4 show, pulling an impressive 26.19 rating that year.)  I guess one could say season 5 is when Lucy got her ""groove back.""  Unlike season 4, season 5 has a stable cast and a stable back story.  Every episode is not a trial balloon for the future of the show.

However, I felt the episodes started to get stale.  The episodes were written by a troupe of writers not regular to ""Lucy,"" and the plots seemed far-fetched, even for the zany redhead.  Who would cash in 3,000 cans of beans?!?  Anyway, this aside, the episodes are beautifully restored to optimum quality!  Throw your old recorded season 5 from the 1990's reruns (Oh, that was only me?  My bad.) away, and buy this!  Now, I'm going to feel pretty silly if someone else has already bought this for me and has it wrapped and ready to give -- but I just couldn't wait.

Anyway, final verdict:

Quality: 6 stars!
Plots: 3 stars
Acting: 3 1/2 stars (a little over-the-top at times)
Bonus features: 5 stars
Physical stunts: 4 1/2 stars
One-liners: 4 stars

Get this for the Lucy nerd!",1324684800,4,1399,4.377431906614786
4834980,5,B005MQ58LS,"Lucy Show Season 5 is here and the shows look fantastic! Of all the seasons we have waited for the shows in this volume I think I have seen the most, but only in cheap DVD & VHS distribution companies that make their masters from old worn out 16mm prints that have been in public domain for years! This is the first time we can see these shows in all their glory with restored openings like they have never been seen. My favorite part is being able to finally see the ""Lucy In London' special with Anthony Newley. This is one of the best parts of this season and was truly a treat to watch. The 'Lucy In London - Revisited' documentary is also extraordinary,and very informative.

CBS along with Lucie Arnaz & Desi Arnaz Jr. really add so many wonderful extras to all the DVD sets that they have a hand in and this one is no exception!

Go Buy it..NOW! I really mean it!",1324252800,7,870,4.234939759036145
4834981,5,B005MQ58LS,"I haven't watched these ""Lucy Show"" episodes since being a kid way back in the late 70's when it aired in syndication so watching seasons 1-4 has been like taking a trip back in time to when life was simple...and sitcoms weren't crass, but funny.
There's good reason Ms. Lucille Ball is, was, and always will be crowned the ""Queen of Comedy"".
She did it first, she did it right....and most of all....she did it FUNNY, and without being crass.
I concur with other reviewers that i'll continue to add remaining seasons to my DVD collection of both ""The Lucy Show"" & ""Here's Lucy""...and HOPE the release of ""Life with Lucy"" will see the light of day on DVD as it deserves just as much recognition and respect as all of Ms. Ball's work prior.",1323302400,5,738,4.474074074074074
4834982,5,B005MQ58LS,"I have been waiting for this since April which is when we got season 4, which is about 8 months! But thankfully we finally have season five, now I remember some of the episodes from when I watched them as a kid back in the early to mid 1990's on Nick at Nite, but it's been so long since I have seen them of course since it really hasn't been on the air since, so I can't comment on the quality of the episodes yet, but anything with Lucy is excellent to me, and of course Gale Gordon and the numerous guest stars that will be in this season, John Wayne, Carol Burnett, Claude Akins, Phil Silvers, and so on, so yes, great guest stars, and a special mention to Vivian Vance who appears in 'Lucy and Viv' they were a great pair.

Now I know most of these episodes were previously released on those cheap public domain copies, I had two of them, and the episodes were unwatchable, well this morning I threw those away once I got this, and the episodes look fantastic as usual, all digitally remastered, and the audio is perfect, and packaged the same way as first four seasons, which I really like, and you get a ton of fun extras with this set, including 'Lucy in London' and the documentary that goes with it which is about a half hour in length, nice!, 'Smile Pretty' is a nice little extra that captured Lucille's gorgeous face posing, plus a couple of original promos, photo's, production notes, all that fun stuff, and her receiving an Emmy in 1967, so great extras.

I am looking forward to reliving my childhood once again with watching these episodes, many of which I haven't seen for about 15-16 years, I am really excited, and one more season to go people, so keep reviewing and it will be on DVD before you know it, and also 'Here's Lucy' Season 5 will be released on February 28th next year, so I say by the end of the year next year, we will have ALL of Lucy, except maybe 'Life with Lucy' but who knows!",1323129600,4,1916,4.290055248618785
