,overall,asin,reviewText,unixReviewTime,vote,reviewLength,wordLength
5821964,4,B00DJYKDHE,"God bless this film crew because they really do try their best. They faced a true mission impossible: make a live action adaptation of Richard Bach's Jonathan Livingston Seagull. Could it be done in 1973? Not really, but they were going to try any way. I'm going to attempt summarizing what the film does best and let you decide whether or not you want to see this forgotten movie adaptation. The film failed to set the box office afire in 1973 but it did successfully launch a Grammy winning soundtrack by Neil Diamond and received two Oscar nominations (Editing and Cinematography).

If you're interest in seeing this movie odds are you're a fan of Richard Bach's classic novel, and are solely seeking this film out as a curiosity piece, but for those of you haven't read it I'll summarize the plot.  Jonathan Livingston Seagull is a seagull who lives for flight.  He separates himself from his flock who refuse to accept his obsession with becoming the fastest seagull who ever lived.  In his desire for self-perfection Jonathan reaches a higher state of spiritual being before ultimately returning to impart his wisdom on other members of his flock.

Where this film adaptation really soars is its cinematography.  The visuals are some of the best imaginable for the time the film was made. Even if we get a modern film that uses today's technology to more accurately translate Richard Bach's novel this film does set a standard for cinematography.

Let me outline one of the film's early scenes: In the distance a speck. The aerial shot begins to descend and soon the dot is revealed as a fishing boat and around it circles a flock of seagulls. Cut to the boat's dock. The seagulls hang over head as the crew men begin releasing fish into the water. Close-ups and tracking shots follow the gulls as they descend into the water and begin fighting over the food. At the end of the scene the boat and gulls are seen as silhouettes in the sunset. This is immediately followed by a series of sweeping aerial footage of a gull flying high above the clouds. We follow this one gull over multiple landscapes to the sound of Neil Diamond's Be. It is simply breathtaking! Sequences like this are magnificently composed and executed and justify the film's Academy nominations for cinematography and editing. Watching moments like this make you yearn for a digitally remastered, hi-definition release.

The live action seagull footage --for the most part-- really works for Part 1 of the story. Where it becomes shaky is when dialogue scenes between Jonathan and the other seagulls occur, but that doesn't take away from the moments in Part 1 where the film gets it right.  When Jonathan is giving up his dreams after a crash the footage of hurt seagull emerging from the water, beaten and battered, struggling to climb aboard a portion of driftwood it's hard not to get emotional. It's probably because we the audience hate seeing a hurt animal, but for the purpose of the film moments like this do capture the spirit of the book.  Niel Diamond's soundtrack is optimistic and does capture the right tone for Richard Bach's novel.  When the movie plays as a seagull centered music video the movie does extraordinarily well.

When Jonathan is shown with voice over narration there is something, and for those moments I can suspend my disbelief and believe that this is Jonathan Livingston Seagull but then another dialogue scene will come to ruin it because at the end of the day dialogue between the characters is essential to Richard Bach's tale. Perhaps the filmmakers could have been REALLY ambitious and attempted to tell the story without any dialogue at all, but the animal footage would have to be nothing less than perfect for that to have worked.

Where the live action seagull footage begins to fall apart is Part 2, after Jonathan has ascended into a higher state of being.  This is where live action nature footage just can't begin to capture the spirit of the book.  They try, but Parts 2 and 3 call for something supernatural which cannot be captured in real-life animal footage.  The cinematography remains gorgeous as a nature documentary, but cannot begin to capture the spiritual bliss of the novel.  It is at this point that the film falters and ultimately fails but it is not for a lack of trying.

Jonathan Livingston Seagull may not reach the heights of the novel, but one has to give credit to the filmmakers because like the titular gull they never gave up.  They did their best with what they had available and I don't believe they have anything to be ashamed of.  I would love to see another crack taken at Jonathan Livingston Seagull using today's digital animation, for that will likely be the only way of truly capturing the essence of Bach novel, but I do tip my hat to the determination of these filmmakers who set out to do the impossible.

I am thankful that the Warner Archive Collection has added Jonathan Livingston Seagull to their offerings so that others like myself are granted easy access to this film adaptation of the book we love. It has its flaws, and doesn't reach the same heights, but it is commendable and worth seeing for fans.  Maybe one day we'll get a digitally remastered release.  If for nothing else the cinematography deserves to be seen in hi-definition.",1377993600,29,5305,4.761177753544166
5822015,5,B00DJYKDHE,As promised,1484784000,,11,5.0
5822016,5,B00DJYKDHE,Great all the way around!,1480896000,,25,4.2
5822017,5,B00DJYKDHE,What is not to love? Music track from Neil Diamond to boot.,1480723200,,59,4.0
5822018,5,B00DJYKDHE,Love it.,1478304000,,8,3.5
5822019,1,B00DJYKDHE,"Seagulls were almost certainly purposely injured and killed in order to make this fictional movie. I have therefore returned this movie to Amazon, as I will not financially support harming animals for entertainment. I know it is supposed to be a feel good movie, Im sure the book was. They should remake this with CGI.",1478131200,,318,4.8
5822020,5,B00DJYKDHE,"I have read the book so many times, and saw the original movie when it first came out (a long, long time ago!). But the message still resonates. I wanted my daughter to see this and she really enjoys it. Inspirational, motivational, beautiful, thought provoking. The music is wonderful.",1475884800,,286,4.857142857142857
5822021,5,B00DJYKDHE,"This movie is a great world classic.

Austin",1472601600,,44,4.5
5822022,5,B00DJYKDHE,"Read it - Watched the Movie - Listen to the Author in Our Creative Writing Class in High School when the Book had just come Out!  The Audio version is Great, too!",1471910400,,162,4.0625
5822023,5,B00DJYKDHE,"It was wonderful to be able to get this on DVD as I only had it on VHS and I had thrown it away when I moved some years back.  Now I can watch it at any time, and I have the sound track so I can hear it at any time.  Wonderful.",1471132800,,227,3.2641509433962264
5822024,2,B00DJYKDHE,Love the sound track and the book--fell asleep at the movie,1470528000,,59,4.454545454545454
5822045,5,B00DJYKDHE,DVD Was fine even thro it was packaged in the same envelopeas as the .CD .,1468022400,,74,3.6875
5822046,4,B00DJYKDHE,Music by Neil Diamond and great photography makes this movie a timeless classic.,1461024000,,80,5.230769230769231
5822047,5,B00DJYKDHE,I really loved this movie and glad it was on DVD. I first saw this move many years ago on a vhs.,1458864000,,96,3.409090909090909
5822048,5,B00DJYKDHE,A great classic. Very timely since Richard Bach published the missing third section of his short story recently. Beautiful Pacific Coast scenery and flying shots.,1456790400,,162,5.52
5822049,4,B00DJYKDHE,"Always wanted to see this film.  it was pretty good.  Very arty, Like Nat. Geo footage put to music.",1456272000,,100,4.2105263157894735
5822050,5,B00DJYKDHE,such a joyful wonderful read one of the very best ever written,1456012800,,62,4.25
5822051,4,B00DJYKDHE,"It is so nice to see this movie being produced again and sold for reasonable price, get this while you can. It is a good story with a good message with good visuals and of course good music.",1455667200,,190,4.026315789473684
5822052,5,B00DJYKDHE,Classic,1454889600,,7,7.0
5822053,4,B00DJYKDHE,I bought this DVD for an ex-husband. We dated and mated to Neil Diamond so though that he might enjoy this as we have reconnected after 40 years!,1453334400,,145,4.214285714285714
5822054,5,B00DJYKDHE,"You will never look at a seagull (or, hopefully, any bird), without compassion after seeing this film!!",1451692800,,103,5.117647058823529
5822055,5,B00DJYKDHE,"This movie is a masterpiece of music and photography, and an inspiring story about striving to be the best that you can be. It is a timeless beautiful fable about being yourself. Thank goodness it was made before fancy technology could ruin it. Some of Neil Diamond's greatest writing. Treasure it.",1450915200,5,298,4.862745098039215
5822056,5,B00DJYKDHE,"This is one of the most beautiful movies I've ever watched. The music, the scenery, the story line are all magnificent. What kind of story line can a Seagull have? Watch it and you will be amazed. Something that all children should watch and discuss afterwards with their parents. Educational!! If you think 'Animal Farm"" is great for the kids, this is better.",1449446400,3,360,4.73015873015873
5822057,5,B00DJYKDHE,"Love it!  Love the images, the voice, the message.",1443916800,2,50,4.555555555555555
5822058,5,B00DJYKDHE,"I was inspired by the book at 10 yrs old,  nurtured by the Neil Diamond Soundtrack for decades, and finally at 53 yrs old, I have seen the film.  At the time of the film's release, no one in my flock had any interest in seeing the film, and I was too young to drive myself to the theatre.  The movie theatre engagement seemed brief . . . so JLS was gone (no VHS, DVD, or Blu-ray back in the day).  I assume if you are here,  you are already familiar with JLS.  The film was released in 1973 on the crest of the books phenomenal popular wave in pop culture.  I ennoble cinematic adaptations that where filmed in the era of their popularity, such as ""Godspell"" and ""Jesus Christ Superstar"" which immortalized Yvonne Ellimen's embodiment of Mary Magdalene. Unlike ""Hair"" which was produced some years later, after it's palpable cultural relevance began to transcend into nostalgic iconic status - I offer not as criticism (I enjoy the film version of ""Hair""), but as a differentiation.

For Jonathan Livingstone Seagull, I offer an appreciation and acknowledgment of a culturally significant cinematic effort that capsulizes the consciousness of an era.

I loved the film.

The Odyssey of Jonathan Livingston Seagull is navigated by James Franciscus impelling magnanimous vocal performance accompanied by Neil Diamond's inspired score, and actuated by breath-taking visuals and contemporary special effects presented artistically, ingeniously, and efficiently.
If made today, although technologically capable of being proficiently anthropomorphically superior, it would lose the comportment of 1973. Although a praiseworthy first viewing of the film, I nostalgically yearned to be only revisiting the cinematic experience.
If you loved JLS then, you'll treasure JLS now.",1443398400,11,1767,5.212014134275618
5822059,5,B00DJYKDHE,"A classic film. If you like paranormal psychology put into a simple eloquent story, and you like Neil Diamond, this movie is a must see.",1442275200,3,136,4.48
5822060,5,B00DJYKDHE,Always enjoyed that story.,1442188800,,26,5.75
5822061,5,B00DJYKDHE,AWESOME,1436227200,,7,7.0
5822062,5,B00DJYKDHE,"A tremendous movie.

Watch it more than once or you'll probably miss the message.",1435104000,,81,4.785714285714286
5822063,5,B00DJYKDHE,"This has always been a favorite movie of mine - and being a Neil Diamond fan, I have always loved the music. Finally got around to buying my own copy.",1434153600,,150,4.033333333333333
5822064,5,B00DJYKDHE,The movie is breathtakingly beautiful,1433030400,,37,6.6
5822085,5,B00DJYKDHE,Soft and pure art! Neil Diamond soundtrack from 1973. One of his best!,1432512000,,70,4.461538461538462
5822086,5,B00DJYKDHE,"Stunning video and  the music is inspiring, but the movie lacks the detail in the book.  The book is a philosophical tretis about flying written by a pilot that expands to a story of life.  The book narration by Richard Harris is free on youtube and a worthy listen before watching the movie:  It gives much more meaning to the silent but beautiful segments of bird gliding by sea and thru sky.",1432339200,6,394,4.430555555555555
5822087,5,B00DJYKDHE,This dvd was better than I expected.,1430956800,,36,4.285714285714286
5822088,4,B00DJYKDHE,An old favorite of mine.  Had to get it for my library.,1430956800,,55,3.5833333333333335
5822089,5,B00DJYKDHE,"This is a really old movie, it is about personal development, have some good points but I think with all the information now a days, I just feel that is a kinder-garden personal developmental movie.  Amazing music.  Love it.  The movie was not really clear, kind of dark, maybe because of the age of the movie, its sad because it have beautiful shooting landscapes.",1427328000,2,365,4.671875
5822090,5,B00DJYKDHE,Great movie and book!,1426982400,,21,4.5
5822091,5,B00DJYKDHE,This is a great movie.,1426032000,,22,3.6
5822092,5,B00DJYKDHE,I just loved my best birthday present ever. This is a great piece of artwork. Inviting me to be aware that nobody can hold me back unless i allow them to steal my dreams,1425859200,4,169,4.0
5822093,5,B00DJYKDHE,Making my grandson read the book before he can see the movie.,1424995200,5,61,4.166666666666667
5822094,4,B00DJYKDHE,Mesmerizing.  Excellent.,1424995200,,24,11.0
5822115,5,B00DJYKDHE,Best movie ever. The music is great.,1424736000,3,36,4.285714285714286
5822116,5,B00DJYKDHE,"The music, scenery and story is beautiful. Movie has the aspects of not settling for the ordinary, determination, destination and inspiration. Only Neil Diamond  could do this soundtrack to bring it all together.",1424476800,10,212,5.424242424242424
5822117,2,B00DJYKDHE,"To dated and slow.... The book is inspiring through imagination and this literal movie is blunted with the exception of the music, even if you're not a Neil Dimond fan it's ok.
Don't watch if you haven't 1st read the book. You'll need your inner spirit to see the movie more positively. After all it is over 40 years old!",1423353600,,321,4.366666666666666
5822118,5,B00DJYKDHE,"Love this movie and the message it portrays, not to mention the beautiful music from Neil Diamond. A joy to watch.",1422748800,,114,4.476190476190476
5822119,5,B00DJYKDHE,ONE of my favorite all time movies!  Got here pretty quick!,1422403200,,59,4.363636363636363
5822120,4,B00DJYKDHE,"A great book. And a story more relevant now than when it was first popular. In an age of religious literalism, vying for dominance in our culture with materialism, this wonderful tale needs to be retold visually. Employing all the technology, audio and video, available to current film making.

What could not be achieved in 1973 via film technology, could now be brought to bear on this epic story. A whole new audience awaits this stirring fable. And an anxious audience of baby-boomers, who remember the original, deeply inspirational story.

We need Jonathan again. Brought to life on screen. More than ever.",1420502400,9,612,4.990196078431373
5822121,5,B00DJYKDHE,Always a favorite and the scenery will take your breathe away.  Neil Diamond wrote the score and it is beautiful.,1420070400,7,113,4.65
5822122,4,B00DJYKDHE,Good story. Great music enjoyed it very much,1419033600,,44,4.625
5822123,5,B00DJYKDHE,This was so uplifting and enjoyable!,1413417600,,36,5.166666666666667
5822124,3,B00DJYKDHE,Great music and cinamatography. Love Neal Diamond.,1413158400,,50,6.285714285714286
5822155,5,B00DJYKDHE,"Neil Diamond is better than awesome...I have the original vinyl but no longer have a turntable...the album is great and the movie should be a classic, if not already!!! (the book is also great)",1411862400,2,193,4.705882352941177
5822156,5,B00DJYKDHE,"Great movie, Great service, This was an excellent buy.",1411430400,,54,5.111111111111111
5822157,4,B00DJYKDHE,"The movie is a classic created from the book.  Although dated due to huge advances in video technology, it is still well worth seeing, and thinking about.  It is nice to see that it has finally made it from VHS to DVD.",1409616000,2,218,4.166666666666667
5822158,5,B00DJYKDHE,all good,1409443200,,8,3.5
5822159,5,B00DJYKDHE,"Bought this for my autistic son.  Surprisingly, he specifically asked for it.  I read it in high school as required reading.  Hated it.  He, on the other hand, loved it...",1407801600,4,171,4.6
5822160,5,B00DJYKDHE,I have not watched this yet but I watched it in 1973 at the movie house. I loved it then and I still love Neil Diamonds music.,1405641600,,126,3.7037037037037037
5822161,1,B00DJYKDHE,"this movie was made years ago with poor photography, endless flying in circels of the seagull and very little happening.
Professional reviewers gave it 11% the lowest score of a movie I've ever seen.",1404518400,,199,4.882352941176471
5822162,5,B00DJYKDHE,A very relaxing movie to watch. The cinematography is very well done and I love the music. Most enjoyable indeed.,1393718400,,113,4.7
5822163,5,B00DJYKDHE,"Actually this was the 2nd time I ordered this DVD. The first one, Order #116-8450429-2756257, was sent to my old address because I had not changed my delivery address in Amazon. The billing address was changed but I failed to change the delivery address. We had listed a forwarding address with USPS, but USPS did not forward the DVD. USPS returned it to Vsource on Jan 29th, according to the tracking information from USPS. We are waiting for a credit from Vsource. This can be verified by entering the tracking # with USPS. Tracking # 9274890109818638275898",1391731200,,559,4.833333333333333
5822164,1,B00DJYKDHE,"It won't allow me to play it in my dvd player or my blue ray player, what a waist of money this was",1388275200,2,99,3.347826086956522
8594037,5,B00DJYKDHE,What can I say?  Classic with fantastic music by Neil Diamond.  A favorite!,1529971200,,75,4.6923076923076925
8594038,5,B00DJYKDHE,share with your children,1525910400,,24,5.25
8594039,5,B00DJYKDHE,"An oldie but goodie. Beautiful scenes, music and lesson about life...",1518134400,,69,5.363636363636363
8594040,5,B00DJYKDHE,Music and story are unforgetable. Saw it in1973 the first time and never forgot it. Saw the movie again tonight and loved it.,1508889600,,125,4.478260869565218
8594041,5,B00DJYKDHE,was as promised,1508803200,,15,4.333333333333333
8594042,4,B00DJYKDHE,Loved the book that I read in the 70's by Richard Bach.  The book was much better but my husband hadn't seen the movie so we bought it.  Quite well done but I did not enjoy/appreciate showing birds fighting until they bled - been informed that the fighting wasn't real.,1502841600,,269,4.36
8594043,5,B00DJYKDHE,Love it !,1501372800,,9,2.3333333333333335
8594044,5,B00DJYKDHE,"COULD NOT FIND THIS BEAUTIFUL MOTION PICTURE ANYWHERE. COULD NOT BELIEVE WHEN I FOUND IT HERE ON AMAZON. THE QUALITY OF THIS MOTION IS OUTSTANDING, THIS IS A CLASSIC MOTION PICTURE, AND I THANK YOU AGAIN.",1497225600,2,204,4.694444444444445
8594045,5,B00DJYKDHE,"There will never be another movie like this, enjoy Neil Diamond doing the music.",1485475200,,80,4.785714285714286
