,overall,asin,reviewText,unixReviewTime,vote,reviewLength,wordLength
2769285,5,B000NIWI9K,"This production of Cosi fan tutte was recorded at Glyndebourne in 2006 which was the first year of this production's staging there. The production by Nicholas Hytner is totally traditional in feel and this will come as a great relief to those who despair of the tendency of modern opera producers to feel the need to focus on their own inspiration rather than that of the plot and music. At no discernible point is either the plot or Mozart's inspiration compromised here. The period established in the production is completely reasonable as are the sets and costumes even though it is probably a little later than originally conceived. The conclusion of the opera brings an interesting twist which may warn us that playing with emotions may lead to unforeseen consequences.

The period feel of the production is underpinned by the use of the aptly named Orchestra of the Age of Enlightenment with their leader being appropriately named as Margaret Faultless. This choice of `authentic period' orchestra leads to much improved orchestral balance and timbres and, in the hands of conductor Ivan Fischer, a bitingly exciting delivery of the music, both instrumental and vocal. Although there will be those who will maintain that there is no actual way of being sure that this is what Mozart would have heard, in my opinion, the proof is in the listening and in this case the case for such an orchestra is made clearly enough.

The cast is, without doubt, uniformly excellent and rise wonderfully well to the challenges of live performance in the context of the likely `authentic' sounds produced by the orchestra. The tempi are challengingly fast at times but never breathless and there is always time made for sensitivity, proper phrasing and moments of doubt and reflection.

The two girls are perfectly cast with Miah Persson and Anke Vondung being a suitably lively and attractive pair of young women. Both obviously relish their respective roles as Fiordiligi and Dorabella and also each other's stage company and there is a good deal of naturally spontaneous-sounding humour provided for the audience to enjoy. This same free-wheeling behaviour is both encouraged and shared as directed in the plot by the excellent Despina performed by Ainhoa Garmendia. All three women are fully on top of the technical and musical demands of their roles and this enables them to `play' together.

The three men are well up to this standard too with Ferrando and Guglielmo delivering multi-nuanced performances as appropriate along with their `friend' Don Alfonso. These roles are delivered with great flair by Topi Lehtipuu, Luca Pisaroni and Nicholas Rivenq respectively. As a group of six they seem to make a perfect combination and are certainly the best I have ever had the privilege to watch.

There are short bonus items in the form of an illustrated synopsis and interviews with the conductor and producer as well as with some of the cast. There is also an animated cast gallery.

The recording is particularly clear visually and gives great clarity and detail while still delivering on colour definition. The sound is equally fine with clearly defined detail both on stage and in the orchestra and with good balance. It is presented in both DTS 5.1 and stereo options.

This is an exhilarating production and performance likely to give enormous pleasure upon repeat viewing. In my opinion this is one of the best Mozart discs I have yet to see or own and I have enjoyed it as such every time I have seen it in the years since I bought it. I am sure most future purchasers will have much the same responses and therefore a 5 star assessment seems completely appropriate.

In summary therefore, I would suggest that this disc should warrant serious consideration from any potential purchaser.",1343520000,3,3788,4.9637223974763405
2769286,5,B000NIWI9K,"Since I didn't know some of the singers, I wondered how good this would be despite all the good reviews.  Well, it's superb.  (I bought the Blu-Ray.)  There's not a weak link in the cast, and it's good to see young singers playing young roles.  Ivan Fisher does a good job with the orchestra.  The staging is just as it should be:  fluid, detailed, coherent, and engaging.  (I don't often find myself saying that!)  My only complaint is that occasionally the English subtitles are too generic, gliding over nuances in the libretto.  Overall, a real winner!",1341446400,2,556,4.708333333333333
2769287,4,B000NIWI9K,"1st, this is a good Opera.  Fun to watch.  2 things strike me as missing.  The set is very modern and at times, only a blue screen background.  Aweful.  The worst part was the audio production/orchestration.  If you have a nice sound system and like to ""crank up"" your classical and Opera's.  This will shock you.  It sounds like the orchestra was surrounded by sound absorbing material with no ambiance or tone.  I was shocked at how bad it sounded.  It was played correctly, but lacked any sense of being in a concert hall.  FLAT.

The singers and acting were great.  The English Subs were ok, but at times they went too long without any subs, leaving a viewer wondering what they are singing about.

Since this is the only recent production, I purchased it, but it has no replay value, because of the Orchestra and Production Set.  It's a big turn off.

BTW, the Overture is bad (don't you think?).  It doesn't sound like anything Mozart would have composed.  In fact, it is the most unappealing composition in the opera.

PRODUCE MORE OPERAS IN ENGLISH (SINCERELY THE USA).  :)",1325721600,2,1081,4.589473684210526
2769288,5,B000NIWI9K,"Singers are young and not famous.
But well lessoned , expressions are super.
The story is well-known and like comic.
But Mozart gives very beautiful music like God.
Mozart's  eyes are gentle.
Such a situation
We all  do it(Cosi fan tutte),fall in love.",1320537600,3,252,4.837209302325581
2769289,5,B000NIWI9K,"In order to enjoy it, one has to forget about the story: it is stupid and male chauvanist. But the music is divine, the singers -every one of them- excellent and, less usual, also very good actors: passed are the days where you had to close your eyes in order to imagine that the beautiful voice singing the beautiful airia belonged to a human being and not to a robot! Very enjoyable.",1319932800,,385,4.361111111111111
2769290,5,B000NIWI9K,"The main attraction of this performance of Cosi fan tutte is not so much the vocal performance as the theatrical performance.  The interpretation of the music is fairly conventional and likely to please most people, but I would have preferred singers with a bit more vocal heft to really make the music shine.  However, the singers pull off very emotionally-convincing portrayals of their characters, and so the overall experience is very satisfactory.  Though this is not perhaps my ideal Cosi staging, this DVD is definitely worth buying.  If you are not yet familiar with this opera, this is probably one of the best productions to view, as the staging is never pretentious, nor does it interfere with the emotional impact of the music, and the sound quality is quite good, making it probably the most approachable interpretation of this work available on DVD so far.",1310256000,3,870,4.979310344827586
2769291,5,B000NIWI9K,"The traditional stage types can now stop compaining, they have a opera that may suit their tastes. No more whinging about modern productions, which pushes them out of their comfort zone. I like both types of staging myself. This opera has 18th Century costumes and decor,along with the authentic instrument, Orchestra of the Age of Enlightenment.  Naturally, this event takes place at Glyndebourne opera house, founded I believe by the Christies. The wife sang opera, Mozart was  her favourite. The singers Miah Persson,Fiordilgi. Dorabella, Anke Vondung. Don Alfonso, Nicolas Rivenq, and the rest of the cast sing extremely well. Beautiful opera. Certainly, should be in your collection. But if you wish to see something completely different, I recommend, the New Valencia opera's, Les Troyens. The opera will put hairs on your chest.",1309910400,,835,5.318181818181818
2769292,5,B000NIWI9K,"What has been stated below is for the DVD of this work that I bought before I upgraded and bought a Blu ray...
Here goes:
I have been familiar with Cosi ever since I can remember. From an aria or two on my dad's 78RPM records to the beautiful Otto Klemperer recording on vinyl and later on to many VHS tapes and then the Gardiner version, although good, started appearing a little jaded thanks to average acting and dramatization.
So when I felt I should have a fresh new production, (sans Eurotrash), I thought I would look up the views of the reviewing proletariat - and thought I would risk buying this one.
THANKS GUYS.... Whatever you have stated in all the previous 10 reviews (for the DVD) to this is almost absolutely correct. This is the nearest thing that is akin to an un-putdownable book that I have seen. So fresh, vibrant in acting and absolutely precise sublime singing and interpretation. I think I will measure any other Cosi by the standard of this one.
Not just period costumes, but sets that are minimal, but bright and not jungle-jims or abstract pillars and stuff that do not distract, but bring out the essence of the interpretation. I am also overjoyed that it has been performed by artistes thus far not known to me... maybe they are doing well these days, must look that up now.
Just that I do not agree with one reviewer (for the DVD) who stated that the third set of Despina and the Don are not up to the mark.. Yes. Despina here is no Lucia Popp but is quite adequate for the role, and if Don had been more powerful, may have killed the character. I think he is just right for the role too...
I would unhesitatingly recommend this Blu Ray or DVD  to anyone irrespective of whether it is the first ever video of Cosi or even if one has all the other recordings of it.",1302739200,2,1795,4.374251497005988
2769293,5,B000NIWI9K,"My God was this a fun comedy. The music of Mozart is so brilliant and lyrical and the story and libretto fantastic. The two key couples have top notch voices.....and you will not believe how well they act; and very sensuous I might add. I won't say too many words other than ""Now this was a night at the opera"". I will watch this gem many times.",1301270400,4,345,4.164179104477612
2769294,5,B000NIWI9K,"If one were to see only one opera, many would argue that the opera should be Mozart's Cosi Fan Tutte (All Women Behave Like This).  In Cosi, both Mozart's music and the libretto by Lorenzo da Ponte are unsurpassed. Collaborating on Cosi both men in 1790 were at the height of their professional careers. The opera was the last of three opera buffa (comic operas) that the two men completed during a three year period. Considered salacious, Cosi became an immediate hit.

Going beyond the technical brilliance, the opera has a moral. In fact, the conductor of the orchestra, Ivan Fischer, in the Glyndebourne production, talking about the opera, mentions that seeing the opera saved his parents' marriage. The excellent Glydebourne production was put on in 2006 in Sussex England with imported Italian singers.

The story begins in a bar where two young noblemen are bragging one-to-another about their fiancs and how their women love only them. A man with greying hair, Don Alfonso, unable to stand any more of their talk, interrupts them to say that they are young and naive. Initially, the two young men challenge Don Alfonso to fight, but Alfonso dismisses their challenge as foolish bravado. Over drinks Don Alfonso explains that it is likely their fiancs would forget them in as little as 24 hours, and bed other men. The two young men are incredulous, demanding that Alfonso back up his statement by making a sizable bet. As one would expect, Don Alfonso wins the bet.

In the seduction scene, Fiordiligi's handsome suitor sings to her a gorgeous aria. The female cast sympathizes with the young woman saying: ""Who wouldn't be seduced by such beautiful music?""",1294099200,,1666,4.918149466192171
2769295,5,B000NIWI9K,"... probably the best opera blu-ray I own. Great cast, great production - and an orchestra to match. Ivan Fischer is an exciting Mozart conductor.  From the first bars of the overture, you know you are in for a treat.  The music is played with energy and enthusiasm.  The two finales truly shake the house.  Fischer and Hytner also have a few interesting things to say about the opera in the bonus interviews.  The ending is ambiguous - as Hytner claims, every audience has to decide itself whether all's well or not by the end.

Not much more to add. It's a treasure.",1287964800,,568,4.466019417475728
2769296,5,B000NIWI9K,"I have been familiar with Cosi ever since I can remember. From an aria or two on my dad's 78RPM records to the beautiful Otto Klemperer recording on vinyl and later on to many VHS tapes and then the Gardiner version, although good, started appearing a little jaded thanks to average acting and dramatization.
So when I felt I should have a fresh new DVD (sans Eurotrash), I thought I would look up the views of the reviewing proletariat - and thought I would risk buying this one.

THANKS GUYS.... Whatever you have stated in all the previous 15 reviews to this is almost absolutely correct. This is the nearest thing that is akin to an un-putdownable book that I have seen. I did not even leave my seat for a snack or a leak... So fresh, and so vibrant in acting and absolutely precise sublime singing and interpretation. I think I will measure any other Cosi by the standard set by this one.

Not just period costumes, but sets that are minimal, but bright (and not jungle-jims or abstract pillars and stuff that do not distract,) and bring out the essence of the interpretation. I am also overjoyed that it has been performed by artistes thus far not known to me... maybe they are doing well these days, must look that up now.

I would unhesitatingly recommend this DVD to anyone irrespective of whether it is the first ever DVD of Cosi or even if one has all the other recordings of it.",1283644800,8,1390,4.464566929133858
2769297,5,B000NIWI9K,"In my humble opinion this is the ""Cosi"" to buy and own. Singing and acting by all the principals are simply engaging and enjoyable. Nice little discussion of the opera by the conductor,director and members of the cast included in the special features.
Dan Rincon",1278720000,,262,4.844444444444444
2769298,5,B000NIWI9K,"Esta montagem da opera de Mozart e libreto de da Ponte  absolutamente sensacional. Moderna, vibrante, com cantores jovens, apresenta toda a energia da partitura de WAM. A orquestra est tima. Aparentemente com instrumentos ""de poca"". O audio  excelente, bem como a qualidade do vdeo. Cenrio e figurino impecveis. O trs casais esto em tima performance, e o resultado final  empolgante. Para assistir vrias vezes.",1274400000,2,410,5.375
2769299,5,B000NIWI9K,"Another outstanding Blu Ray Mozart opera production. Thankfully traditional costuming and sets, but acted and sung with skill and relish to the delight of the audience and this viewer. The three leading ladies are particularly good and their comic acting is very amusing. One wonders just what the young Mozart observed about the behaviour of the aristocracy in his travels because his operas reflect obvious disrespect for them, something which caused considerable uproar when they were first produced. In this opera he credits the maid, Despina, deliciously sung and acted by Ainhoa Garmendia, with more intelligence and astuteness to see through the disguises of the men, than the ladies who are supposed to love them!!

As with most operas the storyline is thin and unbelievable but the artists in this Glynedebourne effort imbue the production with such delightful singing and acting one soon forgets the total improbability of what is happening and become completely immersed in it. This is the BD Mozart opera I have enjoyed the most out of a generally good lot.

The audio and video are up to the usual high Blu Ray standards. We are fortunate to have been given so many top notch Mozart operas in this format. Unreservedly recommended.",1273190400,7,1244,5.0634146341463415
2769300,5,B000NIWI9K,"What an amazing production. Hytner's direction, Fischer's conducting, and the work of the principal singers -- every last one of them -- and the orchestra are almost beyond reproach. We have been watching this just a half hour at a time, in order to savor it and make it last.

I am a singer, conductor, and musicologist, and I have been involved with workshop and professional productions of Cosi since I was an undergraduate. I think I could probably sing it in my sleep. But I have never seen or heard such a beautiful, fully realized production as this one. Indeed, in these days of Regietheater etc. I hardly thought it possible. It is so obvious that the people involved, besides being highly skilled, take Mozart and Da Ponte seriously, even (especially) in what is sometimes considered their silliest comic opera.

The television direction and the Blu-Ray encoding, both picture and sound, are astonishing as well. (Sorry, I realize that if I keep up this gushing, I'll lose credibility. Just can't help it.)

Get this if you love Mozart. You really will not, not, not be sorry.",1272067200,55,1086,4.7967914438502675
2769301,3,B000NIWI9K,"On the plus side beautifully sung and acted throughout by the four lovers especially the superlative Miah Persson, and fine orchestral work at least after a very blatant overpowering heavy-handed Act One overture, yet so much on the minus side too:  a non-starter as Don Alfonso (this wasn't a philosopher but a petulant angry man with no explanation as to why) and despite her attractive demeanor a weak Despina who made nothing of her extra roles either as the Doctor or the Notary;  inadequate staging with so much action stuck behind furniture and a totally bland handling of the chorus (no sense of who, what, or why with lumpen characterless mass entrances and exits);  poor costume choices for Don Alfonso, Despina and Dorabella, and why does Despina as a maid have almost exactly the same hairstyle as her two mistresses?;  however my biggest quarrel is with the dreadful camerawork, most unusual for a production from Glyndebourne - it seems that the director had no idea of what was coming next, often missing a singer's key vocal line by focussing on the wrong person at the wrong time and regularly failing to include all the singers when a quartet or sextet was being sung

for the four lovers alone it is worth watching once but it won't find a place in my collection - for my money the Ponnelle/Harnoncourt film or the Peter Sellars ""diner"" production offer so much more visually and as a whole:  a great shame, the handsome talented lovers deserved so much more",1263513600,22,1477,4.772549019607843
2769302,5,B000NIWI9K,"I am familiar with the excellent orchestra but none of the performers are known to me. As it turned out, all the performers are ideal for their roles. I don't have any comments for improvement. I liked the simple furnature that let's you concentrate on the actors and the singing. The picture is very clear and vivid, the sound is first class and the acting is usually good if not perfect (as is always in operas).
To summarize, it doesn't get better than that",1261612800,7,460,4.488095238095238
2769303,5,B000NIWI9K,"I've begun collecting opera on bluray the last several months, with mixed results. As for Mozart, I bought the Don Giovanni directed by Francesca Zambello, which is terrific, and The Marriage Of Figaro directed by Claus Guth, which is a travesty. This production of Cosi, directed by the theatre director Nicholas Hytner is better than them all, and is one of the best opera dvds I've ever seen. As the previous reviewer said, merely by being traditional, this Cosi is more meaningful and subversive than any ""reinterpreted"" version could be. Highly recommended!",1259193600,19,562,5.119565217391305
2769304,5,B000NIWI9K,"What a pleasure it is to watch this opera performance from Glyndeborne. Firstly the Nicholas Haynter production is is a joy to behold; unfussy, well lit, fresh and sensible. Secondly the cast is admirable in its ensemble performance, vivid acting and satisfying singing. The only member of the cast that is well known is Miah Persson. She is the star of the show; she is beautiful to behold, acts superbly and is a terrific singer. What a package! The rest of the cast are all top notch, particularly the  Despina sung by Ainho Garmedia

The orchestral playing (on period instrument) under the direction of Ivan Fisher is lively, sparkling and true to the spirit of Mozart. Added to this is the good sound and filming. All in all this version of Cosi van Tutti must take its place as the best version on DVD to date.",1253059200,5,816,4.582191780821918
2769305,5,B000NIWI9K,"Last of the three Mozart-Da Ponte operas, Cosi Fan Tutte (They all do it) premiered in January 1790. Mozart was in despondent spirits during the two dark years of 1789-90. His own health was poor, his wife Constanze was also frequently ill, and money was scarce as a result of a war induced economic depression in Austria. It was during this period - in which his frequent begging letters to fellow Mason Michael Puchberg reveal his increasing desperation - that Mozart was least productive in an otherwise uncanny lifetime of stunning productivity. Mozart's operas were only moderately successful in Vienna. The Viennese audiences were notoriously conservative and found his music too difficult for their ears (""too many notes"" as Emperor Joseph said of The Abduction from the Seraglio). Mozart had spectacular success in Prague, however, as the composition of Don Giovanni to be premiered in that city in 1787 proves. Despite the difficulties Mozart faced in its composition, Cosi is perhaps his most perfect opera. It contains some of the most ravishingly beautiful music he ever composed in what is essentially a chamber opera for six voices.

This production is an ostentatiously traditional one. It seems to ""flip-the-bird"" at all new-fangled updatings and it proudly proclaims its stubborn adherence to 18th Century performance values. As a result it is hypermodern and ultimately subversive. The message of this Cosi is clear: see how wonderfully effective a traditional Mozart performance truly is. Why waste your time on modernizations? From the sets and stage design to costumes and performances everything suggests the period in which the opera was written. This Glyndebourne production directed by Nicholas Hytner is as much a feast for the eyes as the musical performances are a sumptuous repast for the ears. All of the vocal performers are superb (and superb looking) and the Orchestra of the Age of Enlightenment conducted by Ivan Fischer performs this music on authentic instruments in an historically informed performance that is exemplary.

Filmed in high-definition, this single BD50 Opus Arte Blu-Ray disc produces a  deeply colorful 16:9 1080i image and pristine audio in both Dolby TrueHD 2.0 and 5.0 soundtracks. Because of the extreme visual and audio clarity provided by the Blu-Ray format the experience is utterly immersive. One feels as if the stage is in the room producing a palpable sense of a live performance. The running time of the disc is 210 minutes.

This is an experience not to be missed. If your equipment is capable of reproducing the full high-definition output of a Blu-Ray disc then this performance of Cosi Fan Tutte belongs in your collection. Superbly performed and presented it is most assuredly a special release.

Mike Birman",1251936000,46,2778,5.191964285714286
2769306,5,B000NIWI9K,"This DVD is my favorite  ""Cos"" from now on, and my old Harnoncourt-Bartoli-Baltsa-Zurich set has become my ""other"" one. Why is this? Are the singers, or the orchestra, or the conductor much better in the new version? No, I can't say that. Though she's a wonderful singer, beautiful Miah Persson can't deliver the demoniac ""Come scoglio"" as Cecilia Bartoli masterly does (who can?). And Topi Lehtipuu is not vocally superior to the ardent, italian lyric tenor of Roberto Sacca, and conductor Ivan Fisher does not a clearly better job than Maestro Harnoncourt, and so on, but...

But perfect music rendering is not everything in an opera DVD, and this Glyndebourne ""Cosi"" has an evident advantage over the Zurich set: visual offering. And I don't mean just the static scenery, but the dramatic flow also. Sets, costumes and lighting tell us that young ladies Fiordiligi and Dorabella live under the blue skies of Ferrara, in a nice house with a nice garden, and plenty of flowers. By some strange reason, these were forbidden issues at the Zurich stage (?). And, perhaps the main strenght of this Glyndenbourne DVD (over many others, not only the Zurich's) is Stage Director Nicholas Hytner, who does a magnificent job with his young singing-artists, driving the plot much closer to the standard of a good stage play than that of an opera.

So I'm joining most other reviewers and  I strongly recommend this DVD, as one of the best filmed and well balanced (music and drama) opera productions on the market.",1247184000,11,1505,4.890196078431373
