,overall,asin,reviewText,unixReviewTime,vote,reviewLength,wordLength
2127564,5,B0002VKZRU,"If you are drawn to End Time prophecies, this movie provides an interesting approach to the usual scenario.
Beginning with terrorists acts on American soil, the fast moving plot explores the enforcement of a national identity using a microchip inserted in the hand, thus creating a Police State. College campuses across the country proves to be a fertile environment to corrupt young minds in this case and when young Christians rally fearing the rise of the Anti Christ, they are immediately labeled objectors and hunted down.
That in a nutshell is Rumors of War, a Dove Foundation approved movie depicting a chilly world, ours in fact if we do not awake to the disastrous consequences of today's actions.

A surprisingly good movie, better than most of this genre in fact, I give it 5 stars as the entertainment and the acting will provide some interesting discussions among Church and none church groups alike.

Disclaimer: I received a copy of the DVD courtesy of EDIFY MEDIA Inc. as part of the series promotion. I am disclosing this in accordance with the FTC 16 CFR, Part 255 'Guides concerning the use of endorsements and testimonials in advertising. I was not asked to write a positive review and all opinions expressed are entirely my own.",1416960000,7,1249,4.886792452830188
2127565,1,B0002VKZRU,"This is a religious movie, made by the religious Reich...I'm sorry I even watched it",1416960000,7,84,4.666666666666667
2127566,2,B0002VKZRU,Very disappointed in the quality of this video. Wish I could get my money back.,1416787200,,79,4.333333333333333
2127567,2,B0002VKZRU,This was nothing more than Christian propaganda. The acting was cut rate and the story-line predictable.,1416528000,8,104,5.5625
2127568,4,B0002VKZRU,"Rumors of Wars is a really interesting, suspenseful drama. I like how they show two different stories. One shows a college student and how she keeps a diary of the events happening in her life and how she tries to escape from the people forcing a chip into her hand. She studies about the end times and writes everything down.
  The second story is happens years later. It tells of all of the mayhem and trouble with the end times. How Christians are captured and killed. How no one wants the Christians around. They blame all of the troubles of the modern age on the Christians. One solider finds her diary and reads it. Its amazing what a few words can do to a person.
  Quite a good movie that will start you thinking and make you want to change for the better. Very good end times story. I recommend this for all groups.

Disclosure of Material Connection: I received one of the products  mentioned above for free in the hope that I would mention it on my blog. Regardless, I only recommend products or services I use personally and believe will be good for my readers. I am disclosing this in accordance with the Federal Trade Commissions 16 CFR, Part 255: Guides Concerning the Use of Endorsements and Testimonials in Advertising.",1416528000,12,1236,4.545045045045045
2127569,5,B0002VKZRU,"""In the end, we all worship something.""

Imagine a world where the technology will revolutionize the way we buy and sell and even maintain our health and fitness. As technology advances, RFID chips will be the wave of the future. Fear of identity theft now removed; maintaining your health information without the hassle of doctors keeping paper records will be a thing of the past. Taking food stamps, welfare and government benefits and incorporating them into a small embedded chip is now here. You can even get discounts instantly on the places you shop the most without the inconvenience of carrying paper coupons or even leaving them at home. Maintain your stress levels and BMI's effortlessly and even counting calories now a thing of the past. Get yours today at a local Zurn center today!

Sound like something from a science fiction movie or merely a chilling look at what might be our future staring right at us. Think of the ability to prevent terrorist attacks because we can instantly locate anyone who has received the RFID chip and even track who is purchasing items that might be used in a terrorist threat. No more missing persons, because they can instantly be located like a Find Phone app!

In the DVD release of Rumors of Wars, Word Films takes a chilling look at the future where the government is in the process of rounding up citizens who haven't received the RFID chip to ensure the end of the terrorist attacks that are happening all over the US. Religious zealots are to blame for their division against the government control. The National Defense Authorization Act has been approved and now allows the Alliance, a military police force, to ensure that all comply or be killed. Martial law is unleashed to help find the religious rebels and their leaders to bring their war to an end.

But is it all one big cover up to some sick plan to control the population? The housing and financial economic collapse along with terrorist plots part of something bigger going on to do whatever it takes to plant fear into the minds of the American people? Society's end is just the beginning. Just another conspiracy theory? You decide!

I received Rumors of Wars compliments of Word Films and Edify Media Inc for my honest review. Except for the free copy of the DVD,  I did not receive any monetary compensation for a favorable review and the opinions expressed here are strictly my own. This is such a great movie that takes Bible Prophecy and showcases a possible ""what if"" scenario. Starring Eric Roberts (Heroes) and Ben Davies (Courageous) this movie takes a look at the possible way the Mark of the Beast of Revelation might be played out in the present day. It truly shows you how simple technology would make the implementation of such a system possible. The movie runs 89 minutes and is Dove Family Approved. There are some great special features like interviews, an indepth look at the diary Roxy carries, character profiles and much much more. I easily rate this one a 4.5 out of 5 stars.",1416182400,28,3018,4.728136882129277
2127570,4,B0002VKZRU,"""Rumors of War"" is not a bad post-apocalyptic or dystopic movie.  It does have a religious and Christians flavor to it and follows a rough dispensational interpretation of end times.  But it is not really preachy and is far better than the ""Revelation Road"" series.

Positives:
Surprisingly good acting from actors and actresses I have not seen before.
Most of the clothing and uniforms were appropriate to the setting and did not seem clownish.
Architecture for the post apocalyptic places was pretty gritty and interesting.
Not preachy, yet did present spiritual elements as a part of human existence.
Had a female church leader in a positive role.
Racially diverse cast.

Negatives:
A bit heavy handed by showing the news from CBN, rather than making up a news channel or showing some recognized news outlet.  I do not think of Christian Broadcasting Network as a primarily news channel.
Plot was told in two segments.  One was the future where a soldier finds a journal along with ""prohibited materials"" and questions his own allegiance to the powers in charge.  The other story line was about the college student who wrote the journal.  The film flips back and forth in time between those two plot lines.
The ""mark of the beast"" was an implanted RF chip.  If you have watched any of these kinds of end times thrillers, then you may remember that movies of these sort have identified the ""mark of the beast"" as bar codes, credit cards, and various other things like that.  This RF chip is just the latest technology to be called the ""mark of the beast.""  In this film the characters can just chop out the chip as they desire.
The nurse uniforms were ridiculous and looked like a throw back to the 1950s.  Totally ruined the flavor of those scenes.  Nurses in most places would be wearing scrubs and that would have added to a more realistic feel, and still set the nurses apart.
There did seem to be an undercurrent of men in dominant positions of power, as opposed to women being leaders.  The female church leader was the exception.
No female soldiers or troopers in the ranks of the ""bad guys.""

Overall I give ""Rumors of War"" a B-.",1415836800,12,2139,4.681818181818182
2127571,4,B0002VKZRU,"Great faith-based movie! It is a fun, action packed, science-fiction movie, with a moral theme.",1415750400,9,95,5.4
2127572,4,B0002VKZRU,"Although I liked this DVD very much, it suffers from the same problem as a previous item I reviewed, Galaxy Fraulien Yuna: Being based on a video game series, it assumes the audience is already thoroughly familliar with the basic plot/premise of the story.  It mainly serves to ""flesh out"" the characters already established by SEGA in their popular series of Japanese games.  If you have also seen the 25-episode TV version, the considerable differences in characterazation may also seem confusing.

This OVA is the first of several, and deals with the establishment of the Imperial Flower Troupe/Division of supernaturally-endowed maidens who oppose the Forces of Darkness in their ill-defined attacks on Imperial Tokyo.  The six principal characters are introduced and given barely enough screen time to tell them apart in the 4 different episodes that make up this DVD.  The Forces of Darkness are virtually ignored and their motive is murky at best.  The original episodes were released separately in Japan, and the loose story line and connection between the segments was somehow not thought to be a shortcoming, supplementing as it does the storyline of the games.

Although the characters are rather sketchy in the OVA, some manage to stand out; I particularly liked the main character, Sakura, voiced by Chisa Yokoyama, probably best known as Sasami in the various incarnations of the Tenchi Muyo! world.  She is the ""new girl"" in the combat/theatrical troupe, and has to go through the familliar routines of trying to fit in, after mastering a difficult sword technique which reminded me very much of that used by Motoko in Love Hina.  As I mentioned, the characterizations here differ considerably from the longer TV series; I find that I actually prefer these: they're not as tragic, dark, conflicted, and neurotic, allowing more room for natural humor and interactions between the girls.

As usual for an OVA, the animation is far superior to that in the regular TV series, which has been harshly criticized.  The music is also very good.  The main claim for this particular reissue is the 5.0 sound on the english dubbed track.  I find this first version of Sakura Wars ( Sakura Taisen in Japanese ) to be an enjoyable expansion and alternative view of the characters established in the games and popularized by the TV series.",1188864000,4,2340,5.015503875968992
2127613,1,B0002VKZRU,couldnt stream.....so this movie sucks or maybe its just prime,1517529600,,62,5.3
2127614,4,B0002VKZRU,"This is a good B movie. Some people will be turned off by the evangelical Christian theme--I was suspicious of it. But I recommend watching the film to the end regardless--it's a good story and good drama, and there's even some action. They don't beat you over the head with Biblical stuff or threaten non-Christians with hellfire. The film treats Christianity like any other rebel movement in a typical dystopian sci-fi flick...and this is as good as most.",1517356800,,457,4.871794871794871
2127615,5,B0002VKZRU,A realistic vision of a dystopian future foretold in the bible. The beginning of Christian persecution has already started. The movie was actually pretty good.,1517011200,,159,5.4
2127616,1,B0002VKZRU,"LOL - an attempt to take away from the great damage different religions have done to the human race to focus on a non-existent possibility of what atheists can do. I won't get that chip - I look at my own calorie intake and my weight every day myself and my cholesterol, lipids, sugar , blood pressure and kidney and liver function every year but that does not mean that the kuran, Mahabharata, Ramayana, bible, or mountain or rain god or fertility goddess or anything else is REAL .  Looooooolllll. 1 star for trying",1517011200,,517,4.5
2127617,4,B0002VKZRU,"Normally I really don't like rapture movies and just turn them off as soon as it gets goofy, but I watched this on a whim.  Its not a rapture movie per se.  Its a dystopian fantasy movie that uses a popular modern Christian theories about the ""end days.""  Anyone who enjoys dystopian fantasy might appreciate this entry into the genre.  The characters are likable and compelling for what it is.  It also incorporates generic conspiracy theories, dated/worn sci-fi technology, and histocial precedents such as false flag events (e.g. burning of the Reichstag) to move the plot along.

Even though I disagree with pre-tribulation dispensational theology I generally enjoyed this movie.  The acting gets a B-.  The story gets a B-.  The cinematography and production polish gets a A-.  The music is a C, I didn't notice it at all in fact, for good or bad.  People who ""hate"" this movie are probably the types that would get a snappy little uniform working for Zurn if given the chance.",1516752000,4,982,4.785714285714286
2127618,1,B0002VKZRU,"The soldier characters are identified by numbers. 408, 327, etc... But they are all hand painted and poorly. The crooked lettering and cheesy costume design kept distracting me from the bad acting, bad story, and the fact that its a lackluster combination of the worst of the persecuted Christian complex along with big brother neoliberal conspiracies. Unfortunately, it didn't have enough cheese to keep me watching past the 20 minute mark.

Also, many of the 5 star reviews here are pretty golden.",1516147200,2,499,5.085365853658536
2127619,2,B0002VKZRU,This movie is one long straw man argument in favor of conspiracy theories and christianity,1515974400,,90,5.066666666666666
2127620,1,B0002VKZRU,"Hoo-Humm,...there will Always be a resistance!!",1515369600,,47,7.0
2127621,2,B0002VKZRU,"Pretty awful. On par with the ""Left Behind"" series.",1515283200,,51,4.777777777777778
2127622,2,B0002VKZRU,"The Federal Government uses the Zurn Corporation and Alliance soldiers to implant RIFID chips in all citizens, under penalty of death. Roxy is a dissident college student attempting to undermine the governmental authority. She keeps a diary of random Biblical passages as well as current events. Then we go well into the future where her journal has become a revered object. Just as a squad of soldiers surrounds a group of Christians, more Christians open fire from the woods and kill them, saving the captives. Two Stars.",1515024000,,523,5.022988505747127
2127633,5,B0002VKZRU,"i don't really get into very many movies but i watched it twice now, and i absolutely LOVE it!",1514937600,,94,4.0
2127634,4,B0002VKZRU,"Usually Christian films really bad--bad acting, low budget, preachy. This is more realistic than most. My only gripe is that they set it outside Chicago and bombed a military installation nearby. One of the characters lost her fiance in the bombing, and he was in the USAF. There is no USAF base near Chicago, only a navy training base 30ish miles north. Apart from a research error, I thought the acting was good, not stilted and overdone like you see in most Christian films. They didn't shy away from violence, the bad guys used light profanity (which is in keeping with the characters), and it was interesting to see the perspective of both sides. The villains really thought they were saving the world. I'd advise parents to watch it first before showing it to little kids because some of the characters get beaten, and there is blood, but if your kids play video games with shooting they'll have seen worse than this has. I hope the director can get funding to do more like this. We need faith-based movies that aren't horrible.",1514937600,,1034,4.686813186813187
2127635,1,B0002VKZRU,Religious junk of a movie,1514592000,,25,4.2
2127636,2,B0002VKZRU,"Good idea but poorly executed. This was a Christian version of Equilibrium, but done with a low budget and terrible actors. Most of the acting is terrible, even the main characters were horrible actors. The villain and the professor were the only decent actors. The plot was OK, but it took way to long to get to the turning point, although no explanation of what was going on was needed because everything is so painfully obvious. I'm not hating on it being a religious movie as I am a Christian myself, but I can see how a non-Christian would be turned off because everything is so blatant and obvious. They could have at least made the viewer figure out what the message is like secular films, which is more effective in my opinion. Overall the movie was better than I expected but I went into it with pretty low expectations.",1514592000,,829,4.533333333333333
2127637,3,B0002VKZRU,"I was really enjoying the film and would have rated it highly if it ended.  I can't stand movies that don't have an ending.  To be continued.......When?  It's been three years.....  Appreciate the effort but I need resolution.  Oh well, I read The Book, so I know what will happen in ""the end"" but I kind of wanted to know how this story played out.",1514505600,,349,4.3076923076923075
2127638,1,B0002VKZRU,Thinly disguised religious message,1514246400,,34,7.75
2127639,5,B0002VKZRU,I predict ID chips will be mandatory in less than 10 years from now.,1514246400,,68,3.9285714285714284
2127640,5,B0002VKZRU,"I am shocked that Amazon, or any large media outlet, would carry this eerily accurate cautionary pseudo-tale of prophecy, unfolding in seemingly parallel fashion with real world events. Loved the film,very well done. Bravo to Amazon for carrying it & for promoting it as a Recommended movie.",1514160000,,291,5.212765957446808
2127641,5,B0002VKZRU,"This is a great movie about how the future might really happen; however, it loses focus of a few things;  Jesus Christ was never Religious, and this is what started the Religious people hating Him in the beginning of His time in Jerusalem, and Jesus Christ never preached for He was never a preacher because He was really a teacher; therefore, when Jesus Christ began His teachings He was always around the common people and not in the Holy places of the Religious people, and this greatly angered the Religious people who believed Him to be a false prophet; therefore, the Religious people started calling Jesus Christ an Alcoholic Winebibber Glutton always celebrating with the sinners, and people that were not Religious were called sinners by the Religious people; thus, the Religious people called Jesus Christ a false prophet because the Religious people thought of Him as a sinner, and this greatly angered Jesus Christ until one day Jesus Christ went in their Holy place and tore it up knocking over tables, and kicking over chairs, and hitting people with the bird cages screaming, ""You Hypocrites!""  The bird cages just happened to be some of the things Jesus Christ was throwing at the Religious people, and the reason the bird cages were there was you would buy a bird, and cast your sins upon the bird, and set the bird free, and you were allowed to now believe that you were free from your sins; it is a practice still used today in Religions, but it is not birds in the modern World; it usually is some sort of other practice; for example, saying so many Hail Marys, and then you are allowed to believe that you are now free from your sins.  Therefore, when Jesus Christ tore up the Holy place of the Religious people they screamed for His death, and The Roman Empire murdered Jesus Christ naked on a Roman crucifixion cross.  Anyway, the warning is that Christians; as well as, many other Religions do not pay attention to the words Anti-Chirst Revived Roman Empire, and the Roman Empire is a Western Culture that organized a Religion in 325 A.D by Emperor Constantine, and the Religion was called Christianity, and that is why the portrait called Jesus Christ has the hair color auburn like that of Emperor Constantine being that Jesus Christ had the hair color of jet black like the secular Jews do, and Emperor Constantine's organized Religion called Christianity became a belief system that Jesus Christ approves of the Roman Empire's behavior, and that Jesus Christ plays favorites to the Christians; thus, comes the Anti-Christ part of what makes an Anti-Christ, and this is a practice seen even in the 21st Century; therefore, it sets up a danger in the 21st Century to see an Empire placing its military bases all over the World saying that Jesus Christ favors the Empire's behavior, and that Jesus Christ favors Christians doing it in the name of peace, and it is this that becomes the Anti-Christ Revived Roman Empire with a personality of arrogance, and with words of lies as a peace keeper it leads the World into an Armageddon which would be called in modern times a Global Nuclear War, and the Anti-Christ Revived Roman Empire that came back alive from a fatal head wound will be identified as a little horn because its time on Earth will be short; thus, little horn like an animal that is growing a big horn but dies before it can grow big; thus, little horn; therefore, since the first Roman Empire lasted approximately 1500 years, the Anti-Christ Revived Roman Empire of a personality of arrogance that is the little horn will not even come close to a 1500 years reign because Armageddon will greatly destroy the entire World which the Anti-Christ Revived Roman Empire begins in its conquest of the World, and the World will have no choice but to either be placed under the control of the Anti-Christ Revived Roman Empire, or fight back, and that is the energy that brings forth Armageddon. EYE 5",1513900800,2,3929,4.731386861313869
2127642,1,B0002VKZRU,Horrible drama with poor acting.,1513728000,,32,5.6
2127653,5,B0002VKZRU,"The movie was not what I expected... This is Christian themed centered around the beginning of Revelation. I thoroughly enjoyed this movie as it jumped back in forth in time explaining what had happened and what was happening. If you're looking for an action packed, special effects trill ride, you won't find it here; this is a rather slow paced movie. I'm glad to see movies like this being made.",1513728000,,398,4.7
2127654,5,B0002VKZRU,"Great movie.  Showed the gradual overtaking of peoples lives.  It reminds me of the old saying of the lobster in the pot.  You turn the heat up slowly, and the lobster does not know it is cooking!  That is what can happen if we are not aware of what is going on around us. A cautionary tale of good and evil.",1513382400,,308,4.0
2127655,1,B0002VKZRU,Horrible christian babble. Ridiculous garbage. I give this move the finger.,1513382400,4,75,5.909090909090909
2127656,3,B0002VKZRU,"seemed like it was going to be an interesting movie at first but turned into weird christian propaganda. basically like ""oh we are so persecuted and its the non-religious who start wars"" like... have you been to reality, ever? also says non religious hate god and want to kill him? thats not how it works.",1513209600,,305,4.5636363636363635
2127657,1,B0002VKZRU,Boring boring boring!!!  Shut it down after 10 minutes.,1513036800,,55,5.111111111111111
2127658,4,B0002VKZRU,"Great movie for a low budget film, the only negative ratings seem to be from non-Christians freaking out. One person mentioned it being hard to tell if it was in a flashback or not... really? The pseudointellectual atheist can't tell which timeline it is in when the world is either a normal functioning society, or a post-apocalyptic wasteland... Good job Donna.  Another review mentioned it being too hard to follow with all of the different stories... Yeah, I can see how two intertwined stories could overload one's brain cells after your nonstop autistic screeching at a movie for an hour and a half.",1512777600,2,605,4.87378640776699
2127659,1,B0002VKZRU,"acting was subpar to say the least, very formulaic christains under attack by big gov. propaganda",1512777600,,97,5.125
2127660,1,B0002VKZRU,"How does this forced, badly acted, amateur drivel ever get 4 stars?  I have no idea, unless you really enjoy getting riled up by religious propaganda that's based entirely on ""christianity's"" biggest fear...  that They're out to get you.",1512691200,,237,5.051282051282051
2127661,1,B0002VKZRU,Watched this not bad not great come to the ending and part 2 ??? and you have to pay W.T.F.?????,1512604800,,96,3.85
2127662,1,B0002VKZRU,"Utter trash, I want the hour and a half back that it took from my life.",1512518400,,71,3.5
2127673,1,B0002VKZRU,What is this...Christian broadcast propaganda? ...oh yea and a horrible movie,1512432000,3,77,6.090909090909091
2127674,5,B0002VKZRU,I really enjoyed this movie. Entertaining and interesting plot. Makes you think outside of the box.,1512345600,,99,5.25
