,overall,asin,reviewText,unixReviewTime,vote,reviewLength,wordLength
1631390,5,B00005NB93,"Do you recall the most famous Raindeer of all? In 1964 Author Rankin Jr., and Jules Bass created a ""Claymation"" production that involved, puppets, magic, music and great storytelling.
Based on the classic Johnny Marks (Ballad of Yogi Bear) song the story tells the tale of the young Reindeer who grew up a little different from everyone else. And in the process makes some great new friends who are all different and have their own special abilities.
Together they learn, friendship, teamwork and love and the real importnace of Christmas and the Christmas spirit. Amazingly charming and fun for the adults and the kids will laugh and cry and feel good about themselves knowing that being diffrent is often better then being like everyone else.
Burl Ives (The Ewok Adventure, Roots, Day in An Outlaw) does the incredible narration and even sings the second signature song in this classic ""Silver and GOld"". A wonderful ballad. Billie Mae Richards (Care Bears, Spiderman) is the voice of Rudolf herself. Stan Francis (Spiderman) is the voice of Santa and Larry D. Mann (Columbo, Oliver Twist)is the voice of Yukon Cornelious.
The DVD Extra's include behind the scenes storyboards, pencil tests and pictures of the original creators. There is also a deleted song that was not included in the original broadcast but added later in some versions. Rudolph trivia game.
This is a great DVD for the whole family and fun to watch EVERY Holiday season. You can't help humming the song even after the show is over. (12-11-03)",1071100800,,1515,4.9450980392156865
1631391,5,B00005NB93,"I can remember the days when I was a child and looked forward to watching the musical fantasy ""Rudolph the Red-Nosed Reindeer"" on television, with its adorable, stop-motion, puppet-like characters and the enchanting songs sung by Burl Ives.  Written by Robert L. May and directed by Kizo Nagashima and Larry Roemer, ""Rudolph the Red-Nosed Reindeer"" is just as engaging and entertaining for children today as it was when it was first released in 1964.  The story is about a young reindeer named Rudolph (voice by Billie Mae Richards) who is teased and jaunted by other reindeer because he has a glowing red nose instead of a little black nose like every other reindeer.  Seeing himself as a misfit, he decides to run away and is joined by an elf named Hermey (voice by Paul Soles).  Hermey also considers himself a misfit because he wants to be dentist instead of a toy-maker like the other elves.  They meet a prospector named Yukon Cornelius (voice by Larry D. Mann), unwanted toys on the Island of Misfit Toys, it's lion king named King Moonracer (voice by Stan Francis) and the scary abominable snowman.  Other characters include the young reindeer Clarice (voice by Janet Orenstein), her father (voice by Paul Kligman), Comet the coach (voice by Paul Kligman), Santa Claus (voice by Stan Francis), the Head Elf (voice by Alfie Scopp), Charlie-in-the-Box (voice by Carl Banas) and a spotted elephant (voice by Carl Banas).  The story is also narrated by Sam the Snowman, whose voice was done by Burl Ives (1909-1995).
Songs in this adorable children's fantasy include:
* ""A Holly Jolly Christmas"" (5+ stars, performed by Sam the Snowman: Burl Ives.)
* ""Jingle Jingle Jingle"" (5 stars, performed by Santa Claus).
* ""We Are Santa's Elves"" (5 stars, performed by Santa's elves.)
* ""There's Always Tomorrow"" (5+ stars, performed by Clarice.)
* ""We're A Couple of Misfits"" (5 stars, performed by Rudolph and Hermey.)
* ""Fame and Fortune"" (4.5 stars, performed by Rudolf and Hermey.)
* ""Silver and Gold"" (5+ stars, performed by Sam the Snowman: Burl Ives.)
* ""The Most Wonderful Day of the Year"" (4.5 stars, performed by the misfit toys.)
* ""Rudolph the Red-Nosed Reindeer"" (5+ stars, performed by Sam the Snowman: Burl Ives.)
Overall, I rate ""Rudolph the Red-Nosed Reindeer"" with 5 out of 5 stars.  It's a wonderful musical fantasy that is sure to please and excite any child that watches it.",1071014400,,2390,4.898514851485149
1631392,5,B00005NB93,"This is one amazing show that everybody loves. The unforgettable characters and memorable music make ""Rudolph"" one of the videos my family never fails to watch each winter. See, I'm 16 years old and didn't grow up with all these stop-motion, ""Animagic"" Rankin/Bass holiday special shows, but I do love them. For the longest time I watched ""Rudolph"" every Christmas and ""Peter Cottontail"" every Easter, but didn't know the wealth of other wonderfully great shows awaiting me. Luckily just today I finished watching the Rankin/Bass marathon on TV, and was introduced to some other incredible classics that I must buy: ""Pinnochio's Christmas,"" ""Jack Frost,"" ""The First Christmas,"" ""The Little Drummer Boy,"" ""Nestor the Long-Eared Christmas Donkey,"" ""The Year without a Santa Claus"" (the best one), ""Rudolph's Shiny New Year,"" and more. I know most of the voice acting because I enjoy watching older TV sitcoms and game shows, in which all these 70's actors and actresses starred. ""Rudolph"" will always remain a favorite part of my holiday traditions. The characters of Yukon Cornelius, the Bumble, Clarice (Rudolph's girlfriend), and Hermey, along with the songs like ""Silver and Gold"" and ""Santa's Elves""--oh, and let's forget the BEST part of all, those poor little Misfit Toys!--make this one video you can't afford to miss.",1070668800,,1324,5.25
1631393,3,B00005NB93,"Where the heck is the Rankin/Bass production credit jingle at the end of the show????
You know..the white & blue Rankin/Bass logo with that catchy and memorable 60's Rankin/Bass sound clip that is at the end of the cartoon!!
Sony Wonder......You goofed BIG TIME here!!
Otherwise....Rudolph's great as ever, every Christmas!",1070323200,,323,5.352941176470588
1631394,5,B00005NB93,"In just telling the story in the song ""Rudolph the Red-Nosed Reindeer"" would make for a decent enough animated holiday television show.  But where the 1964 production from Jules Bass and Arthur Rankin Jr. achieved greatness was in the creativeness it showed with the supporting cast.  The story is narrated by Sam the Snowman, voiced by Burl Ives (who sang the second most popular version of the song after Gene Autry's orignal), and Rudolph (Billie Mae Richards) becomes friends with both Hermey (Paul Soles), the elf who marches to his own drummer, and Yukon Cornelius (Larry D. Mann), the prospector.  However, the most unforgettable characters in this story are the toys from the Island of Misfit Toys: Charlie-in-the-Box, the Spotted Elephant, and the others, along with their leader, King Moonracer.
The result is a much deeper version of the story than was even hinted at in the lyrics of Johnny Marks' classic Christmas song.  We all now how the story is going to end on that foggy Christmas eve, so it is everything leading up to that fateful night that is where this story gets its deserved reputation as Rudolph is not the only one who ends up having their life take a turn for the better, as even the Abominable Snowman finds he can put the finishing touches on a perfect Christmas.  Besides, how often does a dentist get to be the hero in a Christmas story?
Bass-Rankin took at similar approach in 1970 with ""Santa Claus is Comin' to Town,"" and while that animated holiday show is pretty good and worth watching each Christmas season, this one is better.  If you have been in a store and seen the looks of pure delight on people's faces when they see the line of toy figures associated with ""Rudolph the Red-Nosed Reindeer,"" then you already know this.  Hard to believe this particular ""Rudolph"" will enjoy its fortieth anniversary next year.",1070323200,,1855,4.778125
1631395,5,B00005NB93,The first Rudolph animated movie is pale in comparison to this one. OK it may be sugary sweet but your kids (under 9) will love it. Why people pour scorn on this version is beyond me. Maybe they should have left it to their kids to review it!,1070236800,,242,4.0625
1631396,1,B00005NB93,"While I must admit at the outset that my children like this movie, I am somewhat appalled by it.  And I don't think it's necessary to compare it to the Rudolph I grew up with in order to rank it poorly--nostalgia tends to color our opinions.
What is obvious immediately is that this is, oddly enough, a vehicle for celebrities to lament their fame.  Rudolph, once hating his unique glowing nose because it made him a misfit, gained acceptance because he saved Christmas with that oddity (really, a questionable moral for the first flick--you're only accepted if you can prove yourself worthy--compare with Thomas the Tank Engine's highest sought-after praise being that he's useful).  Now Rudolph is famous and can't go anywhere without be asked to shine his attribute.  It's all the other residents of the north pole care about.  Poor Rudolph, if only he was just plain normal.  (Hermie, at least, has discovered his bliss as a dentist--a rather plain profession where no one stalks you and asks you to show them your skills at root canal.)
Anyway, the rest of the movie plays on this theme throughout.  The low-light of the movie, and surely, after some distance, of this actress's career, is when Jamie Lee Curtis, playing a hippo Queen who is a plastic surgeon, sings about her ability to make everyone beautiful through her artistic abilities with the scalpel.  She sure can give Rudolph the nose he wants!  Now that Miss Curtis has come out against just this kind of thing and advocates aging without anxiety and without surgery--and wants to encourage young women to believe in their inner beauty (older women too!) rather than needing to ""fix"" what the society that is fashion magazines and Hollywood see as ""flaws"", she must want this one to get lost in a dust bin.
It's where I'd like to put our copy.",1069977600,,1811,4.76038338658147
1631397,5,B00005NB93,"This is one of my favorite Christmas movies of all time.  This is just one of those movies you watch every year because it just makes it Christmas, like the cookies Grandama or Mom makes, or the little kids crawling under the tree to get the presents in the back.
""His beak blinks like a blinking beaker.""",1069977600,,305,4.350877192982456
1631398,3,B00005NB93,"You would think they would have cleaned up the video before releasing it on DVD.  Unfortunately though, all the original lines, dirt and lint are flying throughout the show.  And no color correction either. Too bad.  Otherwise I would've given the video 5 stars.  It's a classic, but the DVD looks like a poor transfer VHS.",1069891200,,323,4.714285714285714
1631399,1,B00005NB93,"If you're armed and also fond of the Rudolph cartoon and the classic ""Christmas Comes But Once a Year"" from other editions, don't watch this DVD. You're going to shoot your television.
""Rudolph"" begins, preposterously, with a rendition of ""Jingle Bells. Yes, I said ""Jingle Bells,"" and not the namesake song.
Then the narration begins in mid-sentence (""...and all through the hills...""), clipping the first line. It does the same thing at the end: ""Merry Christmas to all, and --."" And WHAT? The visual and sound quality is also poor--my VHS copy, an older one we've watch hundreds (and hundreds, and...) of times, remains far superior in clarity.
But this edition saves its true savagery for ""Christmas Comes...."" Anyone who has seen the original knows this early Max Fleischer cartoon is a genuine classic for its sometimes dazzling animation, its inventiveness, and its score. Sadly, this edition obscures almost all of these qualities, and the result is barely watchable.
On top of being visually fuzzy, this edition of ""Christmas Comes"" has a botched soundtrack. The different tracks are out of sync, twisting the originally well-done score into pure cacophony. Even my two-year-old noticed. And my four-year old went ballistic.
The other cartoons on this edition are cute enough, but again they're dark visually--and only the first two are Christmas-themed.
In case I've been unclear: Don't buy this DVD. It's garbage.",1066867200,,1424,5.195652173913044
1631400,5,B00005NB93,this is a Special that I always watched&was always sad at the end.but it truly struck a nerve with me that is timeless&I'll never forget it.it's one of those Holiday Specials you will talk about for years to come.,1065225600,,213,4.487179487179487
1631401,2,B00005NB93,"It is very strange to hear what sound like the original voices in this CGI presentation.  We watched with a group of older Rudolph fans (so we had to imagine what it would be like if we had not seen the original).  Someone commented at one point that they thought we had drifted into a 60s psychedelic trip of some kind.  I agree.  It is a strange movie to say the least.  I can't say that we hated it, but we definitely didn't like it.  It's sort of like an accident where you want to turn away but just can't.  We don't recommend it.",1064275200,,535,4.086538461538462
1631402,5,B00005NB93,You've all seen it a hundred times.  Buy the extra quality of the DVD for your grandchildren.  It's a timeless classic.,1058140800,,119,4.619047619047619
1631403,5,B00005NB93,"Burl Ives is fantastic in this film. I love the song Silver And Gold by Burl Ives. I got the soundtrack on CD. I love the song about being Misfits. This is a very sweet and hart warming Christmas show. I feel sorry for poor Rudolph because he can't join in on the games, because of his red nose.",1050364800,,295,4.016949152542373
1631404,5,B00005NB93,"If you love Christmas classics, this is a must. Buy it now.",1043193600,,59,4.0
1631405,5,B00005NB93,"I love this movie,it cheered me right up after the awful week I had. My younger brother and sister liked it to. I was pretty nervous that this movie wasn't going to be good,but I realy enjoyed it, I've always loved the 1964 classic Rudolph the Red Nose Reindeer. At some points the animation makes it look like a video game,and some of the character designs look weird. I loved the songs they sang though.
My little sister Sarah hates Hermey she calls him H instead. My oldest sister Randy thinks that Hermey is cute though. Me and my oldest sister noticed something about Hermey,his ears aren't pointy so that means he's not an elf,so how come everybody calls him an elf,I wonder if anybody ells has ever noticed that before,I think he was a kid that ranaway from home.
I loved the Toy Taker,and Queen Camilla,they were my favorite characters. Queen Camilla reminded me of my mom,because she's a parametic,and I loved her song to. I thought the Toy Taker was cool I loved the song he sang,I felt realy sorry for him though poor guy:(.He deserves to ruin christmas,just like how Washu( Tenshi Muyo)deserves to destroy the univurse. I think it would be realy cute if the Toy Taker decided to get a job to babysit little kids I think that would be realy sweet of him.
Favorite characters:
1. The Toy Taker
2. Queen Camilla
3. Hermey
Least favorite characters:
1. Rudolph
2. Yukon Cornelios
3. Bumble
Favorite songs:
1. The Toy Taker
2. Beautiful just like me
3. The Island of Misfit Toys
Least favorite songs:
1. Beyond the stars
2. Mr. Cuddles
3. Best christmas ever
This is a great movie I don't see why everybody hates it so much. Its was way better than the last Rudolph in 1998 that one was just horrible,this one was great it had all the old characters back Hermey,Clarice,Yukon Cornelious,the Bumle,etc. So stop wyning and enjoy its own merits. I just love this movie I keep watching it nonstop.^-^",1043020800,,1903,4.583577712609971
1631406,5,B00005NB93,"Rudolph is a cute movie. Theres a lot more to it than the song!
watch out for the Bominables in this one. And Santa is a little skinny at the beginning! But happy fun all the way. Good for kids who feel left out or different. Good characters, like Hermie the elf dentist, Clarice, Rudolf's doe, and of course,
Yukon Cornelius, the prospector!(Not at all like the Toy Story
2 one.)Nice family movie.",1041638400,,398,4.465753424657534
1631407,1,B00005NB93,"On the surface, I rather like the idea of a new computer animated feature using characters from a classic stop-motion picture. The two art forms have quite a bit in common and it seems like a natural marriage. However, if the execution is as bad as it is in this DVD, I'd rather the potential be left unexplored.
The animation in this movie is terrible. Maybe it would have been impressive ten years ago, but since then we've been spoiled by the likes of ""Toy Story,"" ""Shrek"" and ""Monsters, Inc."" This movie can't possibly measure up. The motions are jerky, the backgrounds don't blend, any character with hair or loose fur looks terrible... if you've got the ""Monsters Inc."" or ""Shrek"" DVDs, you've seen the test animation they did on those two far superior films. This entire movie looks like that kind of animation.
And the story is.. okay, it's a kid's movie, but it's a REALLY predictable kid's movie. While I have to confess there were a few clever ideas -- the kite that's afraid of heights, for instance -- the music and story just are nowhere near as good as the original. Granted, that's a high bar to hurdle -- however, if you're going to fall this short, you'd be better off trying something else. Heck, the titular ""Island of Misfit Toys"" barely plays into the story at all.
If this movie had been made in the early 90s,  it might have been interesting. For a 2001 release, it just doesn't cut it. Save your money and get the classic Rankin-Bass ""Rudolph"" instead.",1039996800,,1477,4.573584905660377
1631408,5,B00005NB93,"""Rudolph the Red-Nosed Reindeer"" is a televised Christmas program I have been watchig since 4 whenever it aired. The producers of this program did an outstanding job with the charcaters. They are all cute and memorable. I never get tired of watching this year after year around Christmas! Rudolph the Red-Nosed Reindeer HAS gone down in history!!",1039824000,,346,5.087719298245614
1631409,5,B00005NB93,"Not to mention a half- hour cartoon that's on TV every year?
Please.  This disc should cost no more than $10.00.  At that price, it's as good as one can hope for.",1039132800,,162,4.03125
1631410,5,B00005NB93,"I remember this as a Christmas classic, of course. We rented it last year for my 2-year-old and she was transifixed. So I bought it on DVD this year, and she's still hooked. Still, I would be very happy if they bundled other classic Rankin and Bass moveis on the same DVD (e.g., Rudolph AND Frosty)!",1038528000,,299,4.357142857142857
1631411,5,B00005NB93,"If you like Christmas movies besides ""The Nightmare before Christmas"", you should add this one to your collection. If you don't like Christmas movies then buy ""The Grinch"" or ""The Christmas Carol"" and see what you act like Grinch/Scrooge. In my humble opinion this is the best telling of Rudolph's story in a musical. Many added side stories with Hermey the dentist, Yukon Cornelius, Abominible Snowman, and the Island of Misfit Toys adds to make a great story. The animated figures are excellent and smooth motioned. Excellent narration by Burl Ives. The music is first rate and will have the family singing along.",1036368000,,615,4.980582524271845
1631412,5,B00005NB93,"""Rudolph the Red-Nosed Reindeer"" is THE classic Rankin/Bass Animagic Christmas special.  I could not imagine a holiday season going by without watching this at least once.  Now, with this DVD, I can put away my ""taped from television"" copy and enjoy the complete, fully-restored splendor of Rudolph.
For the first time since 1964, the complete, unedited version can be seen on this DVD.  Throughout the years, the special has been trimmed to allow for more commercial time, including the removal of a longer version of ""We Are Santa's Elves"", a duet reprise of ""We're A Couple Of Misfits.""  The edits where made as long ago as 1965, so getting the complete version is a real treat.  It even restores Rudolph's Elf friend's proper name, ""Hermey"" as opposed to the edited ""Herbie.""
Burl Ives has perhaps his most classic role as Sam the Snowman, singing many now-classic songs that were written for this program, such as ""Holly-jolly Christmas"" and ""Silver and Gold.""  (Of course, he also sings Johnny Marks wonderful ""Rudolph the Red-Nosed Reindeer!"")
The Animagic puppets are never more welcome than at Christmas.  This is a really nice DVD, and includes extras such as an introduction by Arthur Rankin and the complete ""Fame and Fortune"" song that replaced the reprise of ""We're A Couple Of Misfits"" in 1965.  What a wonderful DVD!",1036108800,,1332,4.968468468468468
1631413,4,B00005NB93,"There are three types of reviews worth ignoring for this video:
(1) Anyone who thought they were buying the 1964 classic.  Why would you trust the review of anyone that dumb?
(2) Anyone who says ""Rudolph is sacred.""  Rankin Bass et al. have already done two Rudolph sequels.  This isn't virgin territory.
(3) Anyone who says my kids loved it, but I hated it.  Just who are animated Christmas specials produced for, anyway?
Truth is that this could have been awful like Goodtimes Rudolph movie from a few years back.  This time the writers went out of their way to be faithful to the spirit of the original.  Nearly every moment pays homage to some element of the original Rankin & Bass production, from the opening credits to the concluding musical number.
Rankin & Bass's Rudolph sequels, great as they are, abandon all the other characters but Rudolph (even Santa was replaced by the Frosty Santa or the Year w/o Santa Claus Santa).  The writers of this try to pick up where the 1964 special left off, with Hermie and Clarice and Yukon et al. (no Fireball, unfortunately)
The songs are, with some exceptions, a definite attempt to draw on Rankin & Bass type orchestrations.  They aren't all as great as the Johnny Marks songs, but ""Best Christmas Ever"" is a worthy contender.
I was pleasantly surprised at how the writers were able to build on Romeo Muller's world from 1964 without wrecking it.  It's a fun, warm holiday special.  Real Rudolph fans ought to give it a chance.
My chief complaints are that the computer animation falls apart with Yukon and the Bumble and Yukon's voice is off.  These are really pretty minor complaints, however.
Yes, my kids love it.",1032220800,,1668,4.697594501718213
1631414,1,B00005NB93,"This was a DISTURBING video, to say the least! The Toy Taker (dressed in a dark trenchcoat) steals toys by lying to them and telling them that he will love them -- that their owners/children don't take care of them like he will.  He consoles a sad doll by giving her flowers and a handkerchief. She decides to go off with him. This scenario could easily translate to a child snatcher! Later, the Toy Taker turns out to be a rejected teddy bear who returns the toys and everything turns out happy at the end -- thus, justifying the bear's snatching.  HOW DO WE TEACH OUR CHILDREN NOT TO GO OFF WITH ""NICE"" STRANGERS, IF THEY SEE JUNK LIKE THIS?  I'm going to contact everyone I can to complain about this creepy video!",1024185600,,717,4.37593984962406
1631415,3,B00005NB93,"I can't say I have fallen in love with this movie, but my 3-year-old twins LOVE it. They also love the music! I will say that I'm very impressed with how much the character voices sound like the original. I'd give it 3.5 stars if they let you go halfs...",1011225600,,254,4.1
1631416,5,B00005NB93,"This Christmas Special will always be one of my fondest memories as well as a great life lesson.  It teaches compassion when showing isolation and lonliness of the Misfit Toys. It teaches that sometimes a bark might be worse than a bite when referring to Bumble.  It teaches that sometimes you just gotta follow your heart in the case of Hermie wanting to be a dentist rather than an elf.  It is also rather blunt when it shows how parents sometimes have certain expectations and it kind of parallels todays problems with parents on the sidelines of kid's sporting events.  Not to mention the fact that Rudolph's father was embarrased about Rudolph's ""disability"".  It is rather complex for a ""childrens"" tv show when compared to todays dumbed down standards.  I'm thrilled to own it on DVD and I will never be the same when I see toys that no one seems to want.",1010448000,,862,4.601307189542483
1631417,5,B00005NB93,This is the claymation classic that's been around forever.  A must buy.,1010102400,,71,4.916666666666667
1631418,1,B00005NB93,"We bought this video expecting it to be the one we watched as children. As our two year old watched it, we cringed!!! Where was Burl Ives????? We felt cheated until we realized that this was a different edition. Aside from the trickery of playing off our nostalgia, we hated the DVD because it was creepy-sing-songy and NOT what we wanted for our little girl. PLEASE PLEASE PLEASE!!! LOOK FOR BURL IVES IF THAT IS WHAT YOU WANT TO BUY!!",1009670400,,436,4.4625
1631419,5,B00005NB93,"I need not type much about this title because everyone has seen it and has an opinion. All I can say is that the transfer to DVD was very well done. A little more ""behind the scenes"" would have been nice, but I'm just happy to see this on DVD.",1008892800,,243,3.88
