,overall,asin,reviewText,unixReviewTime,vote,reviewLength,wordLength
2127675,2,B0002VKZRU,"FYI: this is a religious propaganda movie. Its a bit of a head twister, because the people in our own society that are trying to force everyone to follow their beliefs are the religious people, but once you realize they just flipped the roles around, its pretty clear whats going on. Simplistic, with surprisingly weak direction. I am sure the actors gave it their brainwashed best.

This narrative seeps into the minds of weak-willed people with little education so easily because it has kernels of reality thrown in. In this movie, for example, the idea that some corporate/government organization would enforce martial law is not terribly far-fetched. Trump himself has called for it, and if you go to Fox News, or Brietbart, or the Daily Caller and look at the comments, you'll see that the right-wing christian conservatives are calling for civil war and the murder of all liberals and democrats. Similarly, the KKK wants to seize the moment they have with a sympathetic president and congress to disenfranchise people of color and women; ISIS, Al Quaeda, Boko Haram, the Neo-Nazi movement, the government of Israel, all deeply right-wing, and rooted in one dark and twisted religious tradition or another, are all trying to impose their will on the world through violent means.  But the trick of this movie, and so many other religious propaganda movies, is to play up this idea of a world-dominating violence as if it is perpetrated ON religious people, instead of BY religious people.

The trick works because of the fundamental basis of all religions: religious people, and conservative religious people in particular, want to be victims. They want to feel like they are the persecuted ones. It is a thread that winds through all of the major religious texts. The one unifying principle in all of the major religions: that the oppressed are the blessed. So if you tell someone that they are being oppressed, they will instantly convert that to a belief that they are therefore blessed, righteous, and on the side of goodness and kittens. its particularly successful with conservative whites in the USA and Europe, because these are people who just one or two generations ago were in the position of being able to oppress and lord it over people of color with impunity, and 3 or 4 generations ago they could even own, rape, torture and murder people of color at will. They reaped the rewards of other people's labor and passed it on to their children. They maintained control of the power structures and created laws that kept it that way. But the last 2 generations of people of color have benefited from Affirmative Action, the Civil Rights Movement, and the globalization of information.

Affirmative action has created a cohort of people of color who grew up with parents who had an education and good jobs, not as exceptions to the rule, but on a wide-spread basis. That has changed the attitude and expectations of people of color dramatically. The Civil rights movement produced thousands of speakers and books clearly articulating the factual history of oppression and racism in the USA and elsewhere, allowing children to grow up in a world where the facts are easily accessible, and those educated parents can explain those facts to their children. The globalization of information has allowed this new-found abundance of factual history to reach all over the world.

As a result, white people, like me, simply don't have as much privilege as our parents had. Now, for me, and for most progressives, its not that big of a deal. I grew up dirt poor and had to work for everything I have. many progressives who didn't grow up poor still understood from a young age that the wealth their parents had was at least partly due to the unbalanced system of race-based privileges, and so they know its not going to last.  But for conservatives, especially religious conservatives, they grew up expecting the abundance and privilege of their parents, and at the same time, they are primed to assume the mantel of the oppressed - paradoxically.

That is what this movie seeks to exploit. Just remember that the only people trying to use violence to force everyoe to do things tyheir way are the religious right-wing jerks that gave us Trump, ISIS, Nazis, the KKK, Al Quaeda and the rest. There are no violent left-wing groups out there trying to subjugate anyone, or trying to force everyone to follow their religion. Just because Hitler's Nazis called themselves ""socialists"", don't be fooled. I can call myself cabbage, but you cant make sauerkraut out of me. The Nazis then and now are right-wing religious fundamentalists. They, like Al Quaeda and other religious groups, twist a religious belief into a xenophobic ideal for the purpose of dividing and conquering others.",1512259200,4,4782,4.925558312655087
2127676,2,B0002VKZRU,"Acting was so-so.  Movie flashed back & forth from ""present"" to ""past"" in a jumbled way that left out too much information.  As such, a viewer would need to be relatively well versed on the paranoid conspiracies of end-times Christianity to understand what was happening.  Some of the symbolism was contrived to the point of being laughable, perhaps due to the low-budget as other reviewers have mentioned.  I cannot recommend this movie.",1512172800,,438,5.041666666666667
2127677,1,B0002VKZRU,"Generic, low budget, film school production. Actors struggling with poorly written script. Amazon Video is weighted down with too much of this poor quality crap.",1512172800,,161,5.48
2127678,4,B0002VKZRU,This is illary and ill's obamanation of America !!,1512086400,,50,4.666666666666667
2127679,5,B0002VKZRU,"Only someone who is Christian would know what Rumors of War is. It refers to a biblical prophecy of the end times. It is strange that people would see everything that has gone on in the world since Sept. 11, the massive amount of natural disasters and the terrorism and not think something is going on. Yes, Christians are a persecuted minority in many places around the world and will increasingly become one according to Biblical prophecy, just look at the reviews. One reviewer called it ""Christian propaganda"". Another called it a ""right-wing conspiracy"". Yet, they are actually living Biblical prophecy and most people don't even know it. The amount of one star reviews just shows it.

It is a bit strange, since the movie is based on a 2,000 year old prediction. The movie does a great job of depicting what it would be like to live out this prophecy. It is a WARNING. I was on the edge of my seat the entire time. I had to pick up my Bible and read it, because this is almost to a T how it will be. This prophecy predicts that people will not be able to buy or sell without receiving a mark in their hands or forehead. The IOT (Internet of Things) will change a lot for humans in the next decade. You will be able to open your car, home and office with just an implanted microchip under your skin. You will also be able to pay for things with the same microchip. No more keys, no more wallets, no more stolen identities, etc. Seems ideal, but Bible prophecy warns believers away from such a reality because of the inherent dangers of abuse in such a system. This movie does a great job of displaying what the future will hold for many. You can clearly see this unfolding when you shop today, everyone is talking about the chip in the card. Well that chip will soon be in your ARM or forehead!!!!!

Not only that we are moving into a world where more and more people are calling for transhumanism, such as Elon Musk and others. Man will be merging with machine very soon. Lets hope that it all works out, but I think we know what will happen. The Bible says that there will come a time when people will wish for death and not find it or in other words be immortal. We are living in a new and scary age. It is best to be prepared for what is coming.

Two things the movie gets wrong:
1. This new system won't be anti-religion. The prophecy predicts that there will be a religion. There will be ONE religion for everyone. No freedom.
2. If you get the mark, you will not be able to get into Heaven if you ever get it. I believe it will be able to alter genes and utterly transform he carrier.",1511913600,5,2596,4.283095723014257
2127680,3,B0002VKZRU,"Not too bad for a low budget movie. Granted some of the acting is forced, but I have seen worse. The story line is interesting which is why I watched it.",1511827200,,153,3.967741935483871
2127681,1,B0002VKZRU,"An insipid, Libertarian-Evangelical, dystopian fantasy. Poorly written and dull. If you believe Christians are a persecuted minority, constantly endangered by government and big business plots, this is the movie for you. Absolute garbage.",1511827200,2,238,6.242424242424242
2127682,2,B0002VKZRU,"Not a good movie.  It is poorly directed, obviously low budget, and not great acting.  The description sounds great, but it doesn't even flesh out how the woman came about writing her diary.  It doesn't flesh out how the one guy who was on the bad side, comes to be on the good side.  It just kind of happens.  It really should have been a lot better.  It is weak on the New World Order, and it is weak on Christianity.",1511740800,3,419,4.111111111111111
2127693,4,B0002VKZRU,"Believers do not be deceived. Read the first 4 chapters of Revelation. They are to the churches on Earth, then and now. After chapter 4 no believer is on Earth anymore. Even John, who this prophecy was given was taken to heaven in the twinkling of an eye. A time so short it cannot be measured. We will be gathered as the Bride (the believers) to the Groom, Jesus the Christ. We know that even now there are corporations who rule the government. We will not see the tribulation. The 70th week of Daniel will not happen until believers are gathered from this world. ""Be of good cheer, I am with you always."" Jesus the Savior",1511740800,,623,4.379310344827586
2127694,5,B0002VKZRU,A low budget movie that did really good.  The government is tracking everything you do and its not for your own benefit but to control you like cattle to used or to be slaughtered.  Follow the characters as some find out what is going on and some always new but what can they do?,1511740800,,279,4.148148148148148
2127695,1,B0002VKZRU,Not good.,1511740800,,9,4.0
2127696,1,B0002VKZRU,"I can't recommend this movie. Not just because I don't do religion, but because it barely flows properly nor does the ending make any sort of sense.",1511654400,,148,4.518518518518518
2127697,4,B0002VKZRU,After reading the negative reviews I was hesitant to watch this movie but decided to give it a shot.  I'm glad I did for it far exceeded my expectations.  I particularly found it interesting how subjects were seduced into getting the chip implanted.  Those that enjoy end time scenarios should find this move enjoyable.,1511568000,,319,4.87037037037037
2127698,2,B0002VKZRU,"Put on your tin foil hat before watching.  It's basically a conspiracy movie about the mark of the beast and the New World Order.  The movie is in the same vein as the ""Left Behind"" series but not nearly as fun. If you are a hardcore Christian and believe the book of revelations is upon us, it might be a little easier to watch but it's still not that great of a movie. Gave it two stars mostly for the curiosity factor.",1511568000,,421,4.121951219512195
2127699,1,B0002VKZRU,"thought is was part two, but it charged us to for the one we had just watched as prime.  got messed over on this one",1511481600,,116,3.64
2127700,1,B0002VKZRU,"Poor acting, poor story, Poor persecuted me religious propaganda, this is just straight up garbage.",1511308800,2,99,5.666666666666667
2127701,1,B0002VKZRU,"Right wing christian conspiracy propaganda.  The forces threatening humanity don't preach atheism and seek to destroy the church; it's already been shown that this communist style bleaching of culture doesn't make it in the long haul (USSR, Chinese communism long gone.)  Those trying to take power now bed the church with money nice words and token political and social concessions.  The church spreads further fear of the other and is good at producing human beings who lack critical thinking skills.  Make up your mind folks: is it the liberal atheists, the muslims, the jew bankers, or the homosexuals that are trying to destroy the Christian faith?  They can't all be in on it together.",1511222400,8,691,5.026315789473684
2127702,4,B0002VKZRU,Not bad. A little slow but it is interesting.,1510272000,,45,4.111111111111111
2127713,4,B0002VKZRU,"Those who despise Jesus and scorn God's Word will hate this movie.  Those who are undecided may receive a real blessing from it.  And Christians can watch it with their older children without fear of traumatic visuals, although some violence is definitely implied by cutaways.  The scenario depicted here could very well happen and indeed, we are surrounded by false flag events, fake news, rampant corruption and increasingly blatant evil.  It's nice to see a movie where Jesus isn't used as a curse word and where the bulk of the action isn't CGI and action-hero stunt work.  Good performances are turned in by all the actors and the editing between future and past is, despite reviewers' remarks to the contrary, easy to follow.  I look forward to the sequel.",1507334400,2,762,4.868217054263566
2127714,1,B0002VKZRU,"Would have liked to know before purchasing that this is a Christian movie.  That being said, it wasn't very good.  Appears to be a low budget movie.  Acting is fair, story line OK, but the going back and forth of present and past was at first, confusing and then just annoying.  Almost turned it off more than once, as the plot was slow to get started.  Became a little more interesting towards the end.  Glad it was on Prime and I didn't have to pay for it.  Eric Roberts had a very small part, but advertised like he was the lead character.",1498867200,3,542,4.254901960784314
2127715,4,B0002VKZRU,Sometimes it was confusing because it would jump between the past and the future but it was a good movie,1498262400,2,104,4.25
2127716,5,B0002VKZRU,Great end times Christian movie....may end up being pretty close to what this movie portrays.,1495670400,,93,5.266666666666667
2127717,3,B0002VKZRU,Not as good as I thought it would be.  Nice message but did not like the ending - vague.,1478563200,,88,3.6315789473684212
2127718,5,B0002VKZRU,Great flick,1477526400,,11,5.0
2127719,3,B0002VKZRU,It was OK,1474848000,,9,2.3333333333333335
2127720,2,B0002VKZRU,It had to many stories you had to follow. I honestly wouldn't recommend anyone to watch it.,1473206400,,91,4.411764705882353
2127721,5,B0002VKZRU,This could be our future and some of the things mentioned could be happening now.  A good movie to watch.,1472860800,,105,4.25
2127722,5,B0002VKZRU,Good movie,1472860800,,10,4.5
2127733,1,B0002VKZRU,Movie was not good and the condition of the case was terrible. Very disappointed!,1468627200,,81,4.857142857142857
2127734,5,B0002VKZRU,GOOD MOVIE,1466467200,,10,4.5
2127735,5,B0002VKZRU,good movie,1465776000,,10,4.5
2127736,4,B0002VKZRU,"Interesting picture of the future. The Bible does predict some similar scenes, it is scary but I know the Lord so I don't worry.",1464134400,,128,4.375
2127737,3,B0002VKZRU,"not quite what I expected, but it was ok.",1463788800,,41,3.6666666666666665
2127738,5,B0002VKZRU,Good,1462147200,,4,4.0
2127739,4,B0002VKZRU,Not too bad...I liked it. Switching between now & then was a nice twist so see how things get to where they are. As far as chips go...look into Verichip - they were one of the first we have been watching.,1459987200,2,204,4.0
2127740,3,B0002VKZRU,Was and ok movie on the Religious side but enjoyed the movie.,1459209600,,61,4.166666666666667
2127741,5,B0002VKZRU,Great movie! I loved the storyline and cast! The movie arrived as promised on time and new condition.,1456704000,,101,4.666666666666667
2127742,5,B0002VKZRU,Excellent movie of what the world will be like if you are left behind in the rapture of the church,1454457600,,98,3.95
2127753,3,B0002VKZRU,dgssd,1452816000,,5,5.0
2127754,2,B0002VKZRU,not really impressed..,1447804800,,22,6.666666666666667
2127755,5,B0002VKZRU,"Great movie. Well acted. Highly suspenseful, and very educational in preparation for the end times.",1440720000,,99,5.666666666666667
2127756,4,B0002VKZRU,Very interesting end of time movie.  Christianity  based with.,1440460800,,62,5.777777777777778
2127757,4,B0002VKZRU,"This movie was well acted although a little predictable.  I did enjoy it and the message is very clear.  You will want to buy the sequel ""I Am Paul"" after seeing this.",1439942400,2,167,4.1875
2127758,3,B0002VKZRU,"Could be an interesting movie, if not for really bad acting and flow. It feels like a very cheaply made film with poor acting. I think three stars is more than it should get, but I want people to watch it, because this can be our own future to some degree. These chips are becoming ever more present in our daily lives..",1438819200,5,320,4.17741935483871
2127759,5,B0002VKZRU,Michael Joiner from The Grace Card and My Name is Paul is the best actor I have seen in Christian Movies. He plays another intense bad guy here. Loved him and Jason from October Baby.,1438300800,,183,4.257142857142857
2127760,5,B0002VKZRU,"I caught this on Netflix, not being aware that it is a Christian prophecy movie.  The production was low budget so if you are looking for transforming cars and big explosions, look elsewhere.  The great acting and surprisingly compelling story more than made up for the lack of special effects. I will not go into the storyline so as to avoid spoilers.  Suffice to say I enjoyed Rumors of Wars more than the last Transformers movie.  :)",1438041600,,436,4.623376623376624
2127761,5,B0002VKZRU,Thumbs up great movie,1437350400,,21,4.5
2127762,5,B0002VKZRU,Another great end time prophecy film just great.,1435536000,,48,5.125
2127773,3,B0002VKZRU,"Rumors of Wars T.C. Stallings  - Rumors of Wars is an ok production.  It is not always to the letter accurate with Revelation and end times, but if you allow for the literary license, you can see how this might play out.  The important thing that is does is to remind us to be aware and ready, prayerful and alert, not compromising our faith, but mindful of the dangers such commitment can bring.  Always keep in mind that eternity is at stake.",1434412800,3,444,4.378048780487805
2127774,3,B0002VKZRU,I liked it but my teens said it was boring.,1431734400,,43,3.4
2127775,5,B0002VKZRU,"I really liked this movie,,plot was reasonable,,Acting was okay,,made for a decent movie to watch without foul language could possibly be a learning tool..to those who don't believe some things could happen in America .",1431043200,,219,5.285714285714286
2127776,3,B0002VKZRU,ehhhh not so great to watch at a church fellowship event nor is it anything my non-christian friends would watch. So...,1430265600,,119,4.714285714285714
2127777,4,B0002VKZRU,"Faith-based movies come in two forms: those that are overly preachy about the End of Days and those that place Apocalyptic imagery in the background.  In RUMORS OF WAR, director Paul Tomborello presents a stark vision of the future that falls in the second category. There are two plot lines that criss-cross every few scenes. In the first, there is a present day America that has fallen prey to an insidious billionaire Zurn (Eric Roberts) who has usurped the constitution and relies upon a police force called the Alliance to keep everyone in line. To accomplish this, he as the supreme ruler (no mention is made how he has done this or what has happened to the three branches of government) who mandates that a computer chip be implanted in the right hand of all Americans. This chip ensures that the Alliance knows your whereabouts at all times. A young woman rebels against Zurn and writes a diary that endures over the years even after some vaguely defined war has shattered society. In the second, an Alliance member Shaw (Ben Davies) reads this forbidden book and gradually accepts the Truth, that all he has ever heard or has been taught is a lie. Shaw joins the resistance and there is hope for the future.

Much of the action takes place in the context of biblical prophesy and Old and New Testament imagery. The implanted chip is the mark of the devil.  The war is the one predicted in the Book of Revelation. The Prince of Peace will be born as the Redeemer. Now all of this is not as stifling as it sounds.  The plot, acting, dialogue, and directing are sufficiently creative to maintain viewer interest.  Much of the plot is borrowed from the book burning of FAHRENHEIT 451 and the soul searching of a police agent from EQUILIBRIUM. The rumors of the title are themselves allusions to biblical prophecies of future wars. The movie's theme seems to be that the United States could be transformed into a dictatorship that is wanted by Americans.  This is a most disturbing thought.  The carnage of our lives did not arise from the megalomania of one man but from the loss of faith that enabled this one man to reduce America to totalitarianism.",1430006400,,2157,4.660526315789474
2127778,5,B0002VKZRU,Trying to untangling the Revelation of St. John the Divine...Oh well,1430006400,,68,5.2727272727272725
2127779,4,B0002VKZRU,"I must admit that one of my guilty pleasures is to watch faith based end time films and this picture certainly fit the bill.  While the story isn't based on any one particular end time prophecy or scripture, there are familiar themes that most audiences of this genre will recognize.  Those themes include GPS enabled tracking chips being implanted into people, a charismatic leader who begins to convince people to blindly follow him, and a domestic military force that begins to clamp down and hunt for Christians.  The plot jumps back and forth from the future to the present and connects the storyline through the use of two protagonists.  The future protagonist is connected to our current protagonist by the leaving behind of a journal.  Essentially, this journal becomes a guide for our future protagonist and as he reads the journal we are taken back to the story of our current protagonist.
I like to commend the director of photography for this film because this film while clearly not on a big Hollywood budget, the shots of this film were nicely done.  The talent of the production and design team also clearly shine through on this film.  Many of the future dystopian scenes looked rather realistic, the suits of the future domestic army don't look cheap, and many of the camera shots added genuine suspense to the film.  I know that in many Christian films, while the story may be well, production and design sometimes come across as amateurish but not true in this film.  I do think the film could have used a tighter script and some better acting but overall if you are looking for a suspenseful, thought provoking film and possibly a glimpse into the future you will definitely want to watch this film!",1429833600,3,1719,4.760942760942761
2127780,4,B0002VKZRU,"great film, thought provoking  and eye opening. we need to wake up. time is running out.",1428796800,,88,4.5
2127781,5,B0002VKZRU,"Very good movie I loved it and a lot of truth that a lot of people need to know and see, its a must watch movie!! There definitely could be a number 2 or more it could continue.. I hope it does. Please watch this whether you are a follower or not.",1427155200,,247,3.769230769230769
2127782,5,B0002VKZRU,"Just remember RFID chip....coming soon to your location. I recently saw a video on YouTube of people in European countries already getting chipped in the side of their hands swiping into work. They made it look so hip, fashionable the 'in thing' now happening......I kid you not....who will die....and who will survive depends on your faith.....and those who will be 'marked.'",1427068800,5,376,5.180327868852459
2127793,5,B0002VKZRU,"loved it, can't wait for the second one and hopefully a series to come with this",1426032000,,80,4.0625
2127794,1,B0002VKZRU,Not good. Mac is in one scene and that is it.,1425081600,,45,3.1818181818181817
2127795,4,B0002VKZRU,"Great job for a low budget production. Tackles issues that one can only suspect Gray State was going to address before the director/producer's ""suicide.""",1424390400,2,153,5.416666666666667
2127796,3,B0002VKZRU,"Entertaining movie. I would recommend this movie to anyone. No worry about sexual scenes, or language.",1424390400,,102,5.4375
2127797,1,B0002VKZRU,"Poor acting, poorly copied script from any of 100 other rapture type movies.  Don't waste the money.  Should have been a $2 movie, not $20.",1423958400,5,139,4.52
2127798,5,B0002VKZRU,"Was a great Movie ... shows what the Future Could be, IF we let happen!",1423180800,,71,3.8
2127799,4,B0002VKZRU,Good,1422835200,,4,4.0
2127800,4,B0002VKZRU,"It was action-packed. I liked everything about it except the parts where people could remove the chip if they wanted to.  That is not Biblical. The Bible says people will either chose the mark of the Beast of they will chose God.  Once they make that choice, it's final, There's no removing the mark of the Beast.",1422662400,2,313,4.473684210526316
2127801,3,B0002VKZRU,The disk was fine but the movie was not what I expected.  It was good enough I watched it twice to make sure I wanted to keep it.  For a low budget film it was interesting.  The actors are all really good actors so I think it was either the budget or the director that made it less than terrific.,1422662400,3,296,3.9
2127802,5,B0002VKZRU,Excellent story line!,1422403200,,21,6.333333333333333
