,overall,asin,reviewText,unixReviewTime,vote,reviewLength,wordLength
1630851,1,B00005NB93,"2014 is a noteworthy year for this, the reigning king of Christmas specials - not only is it the 50th Anniversary for Rudolph but also the unfortunate passing of its creator, Arthur Rankin. As such, one would think this golden year would produce a no-holds-barred loving tribute to commemorate both events. But those awful terrible cheapskates at Dreamworks have gone the same penny-pinching route as their predecessors, Classic Media. Unless you find the lure of this new cover too irresistible to withstand, there really is NO reason to pick up this wasted opportunity. So many mouth watering possibilities were at their disposal - the original end credits IN COLOR, various cuts of the film, excised songs, an introduction by Arthur Rankin himself, original TV promos, original GE bumper commercials featuring the Animagic characters hoisting GE products and so much more  - but guess how many of these made it to this ""Golden Anniversary Bluray""? None!!!! .... Instead, we get a few awful cheap extras that appeal to absolutely no one AND the same remaster that was out on the last Bluray release, complete with a skip in ""Silver and Gold"" - one that was fixed for the DVD release over a decade ago! Completely unforgivable!",1416441600,,1228,4.990243902439024
1630852,5,B00005NB93,Awesome DVD.,1416268800,,12,5.5
1630853,5,B00005NB93,Love it!,1416009600,,8,3.5
1630854,5,B00005NB93,Lovely Movie,1415923200,,12,5.5
1630855,5,B00005NB93,Love this movie,1415577600,,15,4.333333333333333
1630856,1,B00005NB93,"I'm forced to agree with many of the reviews. This is worse than a double dip. It pretends to be an 50th Anniversary Edition (Blu-ray) with extra features. The extra features are a joke. It is the same poor transfer we have had in the past. No improvement and certainly no extra footage.  Let CRITERION have a crack at this title. I'll bet they could dig up some worthwhile goodies to honor this TV classic. At least the older DVD version of Rudolph had The ""Fame & Fortune"" song, TV Promo spot and a feature with Arthur Rankin.",1415404800,,528,4.387755102040816
1630857,1,B00005NB93,"Ugh! I'd blame The Grinch for making this 50th Anniversary Edition of Rudolph, but that would be an insult to him. Because surely a heart much smaller than the Grinch's was responsible for this huge disappointment. And I'm not convinced the beancounters at Dreamworks have any heart at all.

Could there be any show more deserving of a full-out, no expense spared box set with all the goodies for its 50th anniversary than this beloved holiday classic? I think not. And there are countless millions of fans--50 years worth of them!--who'd happily pay a premium price for that kind of special edition if it had been done right.

What we've gotten instead is this cynical money-grab in which the absolute minimum effort was expended to slap a ""50th Anniversary Collector's Edition"" label on the box. (Which begs the question: Collector of WHAT?) So here goes...

NO NEW REMASTER: This is the same blu-ray remaster from 2008, complete with the dust, scratches, wavering colors and other artifacts that they failed to remove back then, along with the ""Sliver and Gold"" audio glitch. Really Dreamworks? You couldn't expend the effort to finally restore Rudolph to its original, pristine condition?

AWFUL EXTRAS: They're mostly SO bad, they're an embarrassment--better to have not included them at all. You get:

* The Rudolph Pop-Up Book: A Sam the Snowman impersonator narrates a heavily abbreviated version of the Rudolph story, accompanied by super low budget animation of a pop-up book with the characters.

* Sam the Snowman's Sing-Alongs: The two scenes from the show featuring the songs Holly Jolly Christmas and Rudolph the Red-Nosed Reindeer are simply replayed here, except the lyrics are superimposed on them. But it gets better: since there are two songs, this is actually listed as two separate ""extras."" Wow, how generous!

* Learn to Draw: Some Dreamworks animation artist teaches you how to draw three of the characters from the show. 'Cause you were really hoping for that as an extra, right?

* Rudolph Unwrapped: It looks like Dreamworks spent about a dollar to make this, but at least it's entertaining: this extra simply reveals a series of fun and little known facts about the show. Ex: do you know the five different breeds of dogs that pull Yukon Cornelius's sled? I didn't. Or that the time never changes on Sam the Snowman's watch throughout the show--it's always 2 o'clock.

THAT. IS. IT. Unfortunately, you don't have much choice if you want a blu-ray of Rudolph. The first blu-ray, which uses the same remaster, contained no extras at all and sells for more than this 50th Anniversary edition. The best version I've seen for extras is the 2002 Sony Wonder DVD, which has about 45 minutes worth of them. That's also a very good quality remaster, which looks pretty darned good when uprezzed via your blu-ray player or television to high def.

So Happy 50th Birthday, Rudolph! This is no way to treat an elderly reindeer!

Thanks for taking the time to read my review, and I hope you find it helpful in making a purchase decision.",1415318400,,3053,4.897286821705427
1630858,5,B00005NB93,"Great release of an old television classic. It's absolutely absurd and idiotic that one reviewer found this film too scary, but judging by her other reviews she's definitely got more than one screw loose anyway. As for other reviewers that have given over exaggerated negative reviews for such silly crap as extras, get a clue this show was produced in the 60's when nobody was concerned about keeping track of stuff like commercials.",1415145600,,434,4.958904109589041
1630859,1,B00005NB93,"I expected a lot more for a ""50th Anniversary Release"". While not completely bare bones like the original Blu Ray release, there's not a lot worth while in the extras here. The remastering looks nice, although not any different from the last Blu Ray release. Where is the alternate song of ""Fame And Fortune""? This was included in a previous DVD version. Where are the original broadcast elements for the GE Fantasy Hour? Where are the original GE commercials featuring the characters? The soundtrack is in stereo as is presented on CD? Why not add alternate listening options? Why not give us the original 1964 cut, the 1965 cut and then the current cut? Original promos? Promos through the years? This special has such a history and I think Classic Media really blew it on this milestone edition.",1415059200,,798,4.7898550724637685
1630860,1,B00005NB93,This movie is not for children 2 and under. Scary monster... Don't recommend it.,1415059200,,80,4.785714285714286
1630861,5,B00005NB93,Thanks!,1415059200,,7,7.0
1630862,5,B00005NB93,"I'm so glad they came out with a 50th Anniversary Edition that is fully digitally remastered! It also has new features including:

  -Rudolph Unwrapped - 50 charming gifts about the beloved holiday special
  -Rudolph Video Pop Up Book - A modern twist on the holiday pop-up book
  -Sam the Snowman's Sing-Along Spectacular - Brand new sing-alongs of the most famous Rudolph songs
  -Learn to Draw - Step-by-step tutorials on how to draw your favorite characters
  -DreamWorks' Penguins of Madagascar Movie Cash Offer (up to $7.50 value)

Even if you already have it on Blu-ray, I feel that this remastered edition is worth purchasing just for the movie offer for Penguins of Madagascar alone! Basically, in the end, you're spending just over a few dollars for the Blu-ray!",1414972800,,772,4.9921259842519685
1630863,1,B00005NB93,"The new 50th anniversary Blu-ray release is a big disappointment. Four years ago they released this on Blu-ray and there was a skip in the song ""Silver and Gold"" which is one of my favorites in this show. Past DVD releases did not include the skip. I read it came from a glitch in the mastering of the Blu-ray. So, here we are four years later with a chance for Classic Media/DreamWorks to correct the mistake and give us a quality 50th anniversary release and they released the same thing, with a tiny add-on or two for ""bonus"" features. No classic TV commercials from the original airing, or anything worthwhile like that. No re-mastering of the show to fix the song issue. So do we have to wait another four years for you to re-master it again and get it right? You guys are sloppy and I am sorry you own the rights to this classic TV special.",1414972800,,846,4.360759493670886
1630864,5,B00005NB93,customer was very pleased,1414972800,,25,5.5
1630865,5,B00005NB93,"A CLASSIC I couldn't do without,",1414886400,,32,4.5
1630866,4,B00005NB93,Great classic,1414108800,,13,6.0
1630867,1,B00005NB93,Did not work when received.,1413676800,,27,4.6
1630868,4,B00005NB93,I loved this movie when I was a kid and was super happy to find it so that I could share it with my children.,1413676800,,109,3.4
1630869,5,B00005NB93,Awesome!!! Classic and must own for the holidays!,1413504000,,49,5.25
1630870,5,B00005NB93,Wonderful movie.,1413504000,,16,7.5
1630871,5,B00005NB93,May be old but I loved this as a kid and wanted my own.,1412899200,,55,3.0
1630872,5,B00005NB93,dvd arrived on time and as advertised,1412640000,,37,4.428571428571429
1630873,4,B00005NB93,50years of holiday joy!,1412294400,,23,5.0
1630874,5,B00005NB93,"What can you say about this movie other than, it's a classic! I love this movie and now I don't have to wait for it play on tv to watch it.",1411689600,,139,3.5161290322580645
1630875,5,B00005NB93,Great all time favorite,1411689600,,23,5.0
1630876,4,B00005NB93,"One of my niece's favorite movie, we watch it all year long.",1411344000,,60,4.083333333333333
1630877,3,B00005NB93,"Blu ray is only marginally clearer than the DVDS it replaced. Colors are better than DVD but not by much. Spent too much for what I hoped to be a restored, color-adjusted disc.",1411084800,,176,4.363636363636363
1630878,5,B00005NB93,Had a problem with the DVD when used in my original DVD unit. It wouldn't play. I made arraignments to return this item. However I received a new HD DVD unit and decided to give the DVD another try in the new player. To my surprise it worked perfectly! I will be keeping the DVD and using it during the holidays for my grandchildren. It is wonderful to see it restored and in perfect colors. Amazon is a great company to deal with and their return/review policy is second to none.,1410998400,,480,4.285714285714286
1630879,5,B00005NB93,"great service, no issues",1410480000,,24,5.25
1630880,5,B00005NB93,Great!,1410307200,,6,6.0
1630881,5,B00005NB93,A classic. We watch it every year - now we own it. Good quality.,1410134400,,64,3.642857142857143
1630882,5,B00005NB93,One of the great Christmas traditions for me.,1410048000,,45,4.75
1630883,5,B00005NB93,Great DVD copy of a classic holiday movie.,1409961600,,42,4.375
1630884,5,B00005NB93,Great item for the kids,1409356800,,23,3.8
1630885,5,B00005NB93,brought back soooo many memories that i can now share with my kids,1409097600,,66,4.153846153846154
1630886,5,B00005NB93,One of my favorites from the early 60s.,1408233600,,39,4.0
1630887,5,B00005NB93,Childhood movie classic  My kids love this,1408060800,,42,5.0
1630888,5,B00005NB93,It was time to replace the VHS for a DVD it would freeze and skip most of the time,1408060800,,82,3.3684210526315788
1630889,5,B00005NB93,"Good quality , arrived in good condition,Thank you!",1408060800,,51,5.5
1630890,5,B00005NB93,"Great product, great condition!!",1407801600,,32,7.25
1630891,5,B00005NB93,we really liked this dvd,1407542400,,24,4.0
1630892,5,B00005NB93,I received it in the time that was promised.  Very satisfied!,1405987200,,61,4.545454545454546
1630893,5,B00005NB93,loved it,1405296000,,8,3.5
1630894,5,B00005NB93,My fav christmas movie!,1404691200,,23,5.0
1630895,5,B00005NB93,seen it many many times and I just absolutely love it...one to be added to any collection and cherished for years to come,1402531200,,121,4.304347826086956
1630896,5,B00005NB93,This is one of my all time favorite Christmas movies. Make sure you buy the original claymation version. Someone digitized it and it's terrible. Don't make the mistake of buying anything but the original!,1401235200,,204,5.029411764705882
1630897,5,B00005NB93,"we were very satisfied with this product and the seller.
the product arrived a day early and was well packed in the box to keep it
from becoming damaged it arrived to us in its original packaging including shrink wrap. it plays great and my daughter loves it!",1399507200,,259,4.416666666666667
1630898,3,B00005NB93,"You get a Blu-ray and a dvd. The Blu-ray is is a cleaned-up image while the dvd showed film scratches, dust hits etc. Other than that difference I couldn't see more detail on the Blu-ray, even though I have a large-screen projector. Good image, but don't expect high-def.",1399334400,,271,4.666666666666667
1630899,5,B00005NB93,"This is an excellent DVD edition of this classic. I researched many reviews on many sites and am so happy that I settled on this one. The color and detail are great while still being true to the charm of the original production. I am a hard-core ""Rudolph"" fan and don't say this lightly. So many DVD editions of the 1960's Christmas classics like ""Rudolph,"" ""Little Drummer Boy,"" and ""Grinch"" are mangled travesties of the originals with sickening color or speeded-up soundtracks that spoil the charm of the story, but this edition of ""Rudolph"" is one to truly enjoy!",1399075200,,567,4.737373737373737
1630900,5,B00005NB93,I grew up watching Rudolph the Red-Nosed Reindeer before Christmas each year on TV.  It has become a family tradition that has now been passed to my grandchildren.  Great story about treating others fairly!,1397433600,,206,5.029411764705882
1630901,5,B00005NB93,It's nice to have a classic Christmas show to watch during the holiday season.  Rudolph is one of our favorites to watch.,1397433600,,121,4.5
1630902,5,B00005NB93,I got this for my granddaughter as she loved it at Christmas time and it became her favorite right away.  We watch it almost every time she's over here!,1395964800,,152,4.241379310344827
1630903,5,B00005NB93,This is a Christmas cartoon classic. Adds much of interest to the Rudolph The Red-Nosed Reindeer Christmas tradition. Has some parts that tend to be edited out when watched on television. A must have DVD.,1394755200,,204,4.857142857142857
1630904,5,B00005NB93,"i remember this movie growing up when i was a kid and
one of the best kid movies ever there is and a favorite
to everyone",1394064000,,121,3.6923076923076925
1630905,5,B00005NB93,One of my son's favorites as a boy!  Now his sons are enjoying this movie.  Was shipped rapidly and condition excellent upon arrival.  Very favorable feedback from my son!,1393804800,,171,4.827586206896552
1630906,5,B00005NB93,IT WAS A GOOD CHRISTMAS MOVIE.  I ENJOYED IT VERY MUCH.  I WILL WATCH IT NEXT CHRISTMAS AND NEW YEAR.,1392336000,,101,4.0
1630907,5,B00005NB93,"How can anyone start the Christmas season without these timeless classics? Its harder and harder now-a-days to wait the CBS, NBC, or ABC to air these traditional Christmas traditions.",1392163200,,183,5.344827586206897
1630908,5,B00005NB93,This was a good purchase it keeps the family occupied while I do things around the house. The kids love watching it with their grandparents,1391904000,,139,4.6
1630909,5,B00005NB93,"great short movie that both kids and adults will enjoy.  Speedy delivery, good price.  A special movie with a moral that teaches kids to be decent",1391817600,,146,4.576923076923077
1630910,3,B00005NB93,"I've read other reviews about this movie, and I understand the negativity towards it. No, it is not the classic Rankin & Bass original from the 1960s, but I think it tries to remain true to the spirit of the orginal. I bought this for my three year old niece and she loves it. Some of the choices for celebrity voices are questionable (you can barely make out Rick Moranis as the Toy Taker and Richard Dryfess as the snowman), but really, it's a movie for kids. Not the greatest, but as long as they like it, how can it be so bad?",1391644800,,530,4.155339805825243
1630911,5,B00005NB93,It was fun to watch this classic with my very young granddaughters. It was refreshing to me and brand new to them. A keeper !,1391385600,,125,4.04
1630912,5,B00005NB93,"Childhood memory favorite, really enjoyed seeing it again and having it bring back many fun and happy memories of my youth!",1391212800,,123,4.904761904761905
1630913,5,B00005NB93,my grandaughter loves it as much as i did as a child. (still love it!) it will make for some great memories for her too!,1391126400,,120,3.84
1630914,5,B00005NB93,This is a great Christmas movie and has been for years. Classic movie of all time. No complaints here! Daughter loves it just as I did when I was a kid.,1391040000,,152,3.935483870967742
1630915,5,B00005NB93,"Very cute movie,  my grand-daughter watches it over & over. This is her new favorite Christmas movie, I recommend it",1390780800,,116,4.8
1630916,5,B00005NB93,Great Christmas show to set down and watch as a family or just to entertain the little ones. This is the original show we watched as children in the 60's.,1390780800,,154,4.166666666666667
1630917,3,B00005NB93,I bought this for my grandson who is living a distance from me.  Thought he would enjoy it during the holiday season.  Right age.,1390694400,,129,4.333333333333333
1630918,5,B00005NB93,"I really enjoy being able to see these shows, from my childhood, not only on a much bigger TV screen, but also on Blu-ray! I was not disappointed.  Mrs. Ann Z.",1390262400,,159,4.129032258064516
1630919,5,B00005NB93,This came looking great and brought me right back to being a kid. I can't wait to watch it again and again.,1389571200,,107,3.909090909090909
1630920,5,B00005NB93,"This is one of the BEST old-time classics!  I have loved  this all my life, and I am 52, and I still love to watch it.",1389571200,,118,3.5
1630921,5,B00005NB93,Great original Rudolph Movie.  This is the one I remember as a child.  I bought it for my pre-school grandchildren.  They love it!  No Beyonce on this one!,1389225600,,155,4.428571428571429
1630922,4,B00005NB93,Used but plays like new. Thank you This is why I don't fill these out. Too much typing for me,1389139200,,93,3.7
1630923,5,B00005NB93,"A continuation of a Christmas classic.  We were only able to catch this show once during the time they would show it on TV and my daughter really enjoyed it.  She kept saying ""I wish I could watch it again.""  Decided to add it to our video library.  It came packaged up very well and in Excellent condition.  We also received it in the mail within 3 days of ordering and I didn't expect it to come that quickly.  It was a pleasant surprise to receive it before the Holidays were over.",1389139200,,484,4.206521739130435
1630924,1,B00005NB93,"Ordered and item did not play, so requested a replacement. Replaced item also did not play.  Returned for refund.  I am guessing it does on play on USA DVD players and that it's a foreign DVD. AMAZON should state this so people know !!!!!!",1389052800,,239,4.409090909090909
1630925,4,B00005NB93,Just like I remember as a child.  This will be used for many year to come as part of our family holiday traditions.,1389052800,,115,4.0
1630926,5,B00005NB93,"It is a classic that all grandparents need to own.  I had the misfit toys already, so needed the video.  Nuf said!",1388793600,,114,4.136363636363637
1630927,5,B00005NB93,Love this movie and missed seeing it on TV when we moved so was happy to be able to play it whenever I wanted. Christmas was just not Christmas without it.,1388620800,,155,4.032258064516129
1630928,5,B00005NB93,"Gotta love the classics! We all gathered around the tv 3 days before Christmas to watch this as a family. Three generations! It was wonderful! Nostalgic for my mother, husband and I while my youngest saw it for the first time.",1388448000,,226,4.536585365853658
1630929,5,B00005NB93,"I  love this classic Christmas movie that explores the themes of friendship, loyalty, self respecf. and bullying.  I am so glad I got the DVD  version.",1388448000,,151,4.730769230769231
1630930,5,B00005NB93,"everyone's favorite reindeer returns to help save Christmas by solving the mystery behind the identity of his new enemy a thief going by the alias ""The Toy Taker""",1388275200,,162,4.821428571428571
1630931,5,B00005NB93,"Good blu-ray and nice quality. I got to watch it on Christmas this year, and it brought back a lot of childhood christmas memories!",1388188800,,131,4.5
1630932,5,B00005NB93,"I had to get a copy for my sons to view--it's hardly on TV anymore.  This DVD version appears in good quality, and is great fun for the holidays.",1388102400,,145,4.0
1630933,1,B00005NB93,My son really wanted this for Christmas time. It was a gift from our elf on the shelf and it was cracked when we received it so it did not work. Very disappointed.,1387929600,,163,3.9696969696969697
1630934,5,B00005NB93,"This is another timeless classic, and legend like Burl Ives version of the story is awesome as well heart warming.",1387843200,,114,4.75
1630935,5,B00005NB93,"I got tired of watching Rudolph on tv with all the pop-ups and commercial interruptions, so I bought the DVD.  The blurb on Amazon says there are no special features, but there are.  There are some animated songs, a Rudolph quiz, and the movie in both a Spanish and a French version (which were extremely interesting to watch).

This is the best Christmas special and it is not CGI.  It is a heartwarming movie and always signals the beginning of the holidays.  Baby Rudolph will always be one of my favorite characters - his voice is adorable.  A great treat for children of all ages!",1387843200,,585,4.523809523809524
1630936,1,B00005NB93,"What's all this complaining about Destiny's Child taking their rightful place in this classic Christmas feature??!! Don't you realize that they wrote, produced, and performed all of the voices??!! You know, Jay-Z wrote the famous tune by the same name; in fact, Burl Ives is really just Jay-Z in white-face. How do you expect minorities to take their deserved place in the building of American culture if we don't let foreign interests like Sony help them rewrite themselves into it?--sort of like the wild west getting tamed by a black cowboy named Django. I really hope nobody buys any of this crap, and that Sony goes broke and has to sell its entertainment interests to someone who can maintain the integrity of American history and classic American entertainment features.

By the way, if you can get the unedited, non-Sony version without Destiny's Child, this is, of course, a five. However, I'll bet those clearly-superior, less-sickening versions without the hip-hop will be more-and-more difficult to find, so I would suggest searching for your own copy now.",1387497600,,1068,5.102857142857143
1630937,5,B00005NB93,This movie is an excellent holiday film for any kids and their parents to watch. Just give it a chance.,1387497600,,103,4.2
1630938,5,B00005NB93,"This reminds me of my childhood, minus all of the commercials.  If you like the TV specials but would rather watch it on your own terms, get this!",1387324800,,146,4.214285714285714
1630939,5,B00005NB93,"The special features on this newest digitally remastered dvd are not listed on Amazon or the box. For those interested you get the Fame and Fortune song as an extra, but not part of the film. There is also the Destiny's Child music video, Regis Philbin music video, a Rudolph trivia game, original tv promo, plus spanish/french language options and subtitles. Don't watch this on TV as they cut parts out for more commercials. Watch it fully uncut on dvd as it was meant to be seen! It's worth the purchase.",1387065600,,507,4.582417582417582
1630940,5,B00005NB93,Will always be a classsic!,1387065600,,26,4.4
1630941,5,B00005NB93,"Great classic movie for children and adults to share during the holiday season.
I got it for 1.99 I believe during Cyber Monday lightening deals making it a no brainer purchase.",1386892800,,177,4.741935483870968
1630942,5,B00005NB93,"Although I bought this and wrapped it for my grand niece, I can highly recommend this great holiday film.  I actually saw this wonderful holiday classic when it first aired on TV decades ago and have grown up with seeing it on TV ever since at  Christmastime.  It is a sweet holiday classic taken from the children's storybook of the same name.  The stop motion is well done and the actors who voice the parts of the characters did an excellent job!  I also love the Snowman narrator, played by Burl Ives, who also sings beautifully in the film.  I know my grand niece will love it as I know her parents will, too. They also grew up with this holiday classic.",1386633600,,659,4.360655737704918
1630943,5,B00005NB93,Great buy for this old movie that I grew up on and now my kids and grandchild watches it. Now we don't have to wait all year to watch it on television. We can watch it whenever we want too.,1386547200,,189,3.75
1630944,3,B00005NB93,I'm rating this dvd as ok because it's not the original 1964 edition. Does anyone know if the original is available on dvd?,1386460800,,123,4.391304347826087
