,overall,asin,reviewText,unixReviewTime,vote,reviewLength,wordLength
2769250,5,B000NIWI9K,"This Glyndebourne production is the best I have seen. The singers and the staging and of course the direction are as good as one could wish. The orchestra has a few weaknesses, especially at the beginning, butis  still quite good.",1220745600,5,230,4.75
2769251,4,B000NIWI9K,"I hate to be the sole dissenter, but I don't think this is a five-star production. It has much to recommend it, mostly the splendid performance by Miah Persson as Fiordiligi. She navigates with great beauty and expression the two wickedly difficult arias that Mozart gave his soprano. The acting is also exceptionally strong in this production. Finally, the filming with an HD camera makes it the best looking opera I own on DVD.

But, other than Persson, I found the singing to be just average. One example. In performing the heavenly tenor aria, ""Un' aura amorosa,"" Topi Lehtipuu hits all the notes, but he doesn't put his heart and soul into this most moving of love songs. (Compare his performance to that of Shawn Mathey on the 2005 Aix-en-Province ""Cosi"" on DVD; Mathey's ""Un' aura amorosa,"" can bring tears to your eyes.)

It was a odd characteristic of the performances in this Glyndebourne production: with the exception of Miah Persson, the acting was more engaged and expressive than the singing. But If you liked Persson as Susanna in the recently released Covent Garden DVD of ""Marriage of Figaro,"" you are in for a real treat here. She truly shines as Fiordiligi (and is given so much more to sing than Susanna!).",1216598400,9,1227,4.783018867924528
2769252,5,B000NIWI9K,"Despite going to the opera for the first time when I was 7, it's taken me more than 20 years to really appreciate the artform and I've recently begun collecting DVDs. This production was the first Cos I ever heard or saw and - having seen a few more since then - will likely be the last. If I lost my mind and decided to watch it with the sound muted, I'd still be thoroughly entertained - the comic and dramatic talents of the players here is unsurpassable! I'm particularly fond of Anke Vondung's ditzy Dorabella, but everyone is amazing. I must say that the setting and costumes (no turbans, thank God!) adds to the already potent mixture. The clear and crisp sound of Fischer's well-conducted period instruments is pure joy. The four principal singers all do marvellous jobs and over the last few times I've watched the DVD, I've taken to counting the number of times you see any of them looking at the conductor... It may 'just' be fantastic video-editing (which is the case, no matter what), but the few and very discrete times I've caught them looking at Fischer can be counted on one hand - alltogether. Aside from indicating that the production is thoroughly rehearsed, it does wonders for keeping up the 4th wall between performers and audience. Allround brilliant DVD!",1208822400,26,1279,4.688888888888889
2769253,5,B000NIWI9K,"Excellent production and singing.
But this production uses the short version of the Act I finale so buyers beware - if that matters to you. (I prefer the long version.)",1206057600,10,168,4.633333333333334
2769254,5,B000NIWI9K,"Refined edition of an opera+sublime dvd like most from ""Opus Arte"" where pictures are taken through HD cameras. True, not anyone can do dvd better.",1199750400,3,147,4.92
2769255,5,B000NIWI9K,"I picked up this dvd several months ago and it quickly became my favourite dvd of my favourite opera.  There is so much that has to be considered for the wonderful balance that Mozart created here.  From the all important ensembles down to the solo numbers everthing here works beautifully, sung by and appropriately youthfull cast and staged by Glyndebourne with a refreshing faithfullness to Mozart and DaPonte.",1198454400,28,413,5.0588235294117645
2769256,5,B000NIWI9K,"This is altogether a most satisfactory production. The music is very well played and sung, and the acting, together with very clear and understandable subtitles, makes the action easy to follow for a non-speaker of Italian.",1186790400,10,223,5.222222222222222
2769257,5,B000NIWI9K,"You won't regret purchasing this DVD of Cosi Fan Tutte. It ranks with the very best Cosi on DVD, the Gardiner with Amanda Roocroft, Rosa Mannion, Rodney Gilfry, Rainer Trost, Eirian James from Deutsche Grammophon.  I didn't think that one could be matched but this one does it. Indeed, the acting is even slightly better.",1183680000,34,321,4.836363636363636
2769258,5,B000NIWI9K,"For my taste, Glyndebourne 2006 new production of Cosi fan tutte is the best DVD version for this opera. Ivan Fisher is an excellent Mozartian, and the young and good-looking cast sings and acts with a lot of enthusiasm. The best singers are the wonderful Swedish Miah Persson as Fiordiligi, and the Italian baritone Luca Pisaroni as Guglielmo. Highly recommended!!",1181433600,40,365,5.1
2769259,5,B000NIWI9K,The recording of the DVD ruins this otherwise excellent production of this buffo.,1469145600,,81,5.3076923076923075
2769260,5,B000NIWI9K,"I enjoyed the Cosi greatly. I thought Cosi is the best opera ever written. The Fiodelgia was amazeing, with her two great areas, like-rock and great area. Luka Pisaloni was also wonderful. The performance seemed to be comparable to Cosi by Dr, Karl Bohm and his great singers (Krista, Erizabeth,  Fisher-Diskau, etc). I like this opera.",1459814400,,336,5.0
2769261,5,B000NIWI9K,"First, the look.  The staging and costumes are crisp, and natural.  Unobtrusive modern staging techniques present an elegant 18th century setting that draws your focus to the characters.  Perfection.

Second, the cast.  The stage presence, incredible vocals, and chemistry of Nicolas Rivenq, Miah Persson, Anke Vondung, Luca Pisaroni, and Topi Lehtipuu work effortlessly.

Third, the direction of Nicholas Hytner was beautiful and did justice to what is certainly one of Mozart's best operas.

Fourth, the DVD.  I love the sound quality, the image quality and the editing.  It is incredibly difficult to transfer stage work to the screen.  I wouldn't trade this for a live show, but this comes about as close as I've seen for a DVD.  Blu ray is the only choice here...",1459382400,,768,5.064
2769262,5,B000NIWI9K,LOVE IT!!,1455840000,,9,4.0
2769263,5,B000NIWI9K,Brilliant!,1448323200,,10,10.0
2769264,5,B000NIWI9K,If you like a lighter opera without some of the heavy music I would recommend this Cosi fan tutte.,1446940800,,98,4.2105263157894735
2769265,5,B000NIWI9K,"Perfect opera, amazing rendition.",1443312000,,33,7.5
2769266,5,B000NIWI9K,"I would have to agree with the previous reviews that this is a masterpiece in every sense. Mozart was not simply a composer. He was a dramatist in his own right and a very good one. Though the premise of the opera is silly, it remains vital as opera. The performances linger with perfection and respect for the composition. Each of the solos and arias literally stand in their own and can be isolated for appreciation. I personally feel this is Mozart's best opera musically speaking. But one should discover this for himself.",1439942400,,526,4.666666666666667
2769267,5,B000NIWI9K,You have to be into opera to truly enjoy this delightful offering. Well done.,1436140800,,77,4.571428571428571
2769268,5,B000NIWI9K,"I agree with the other five star reviewers and cannot add anything meaningful to what has already been said.  So, I will simply say:  brilliant picture, sound, acting, singing and playing.  A splendid performance.  Highly recommended.",1428537600,,234,5.416666666666667
2769269,5,B000NIWI9K,"Excellent production, Blu Ray puts you right there in the comfort of your home.",1427241600,,79,4.714285714285714
2769270,4,B000NIWI9K,"Nice performance, nice traditional production.  I am no opera buff, but we will be attending a couple of performances of Cosi fan tutte this spring and this disc will add to that experience.",1421539200,,190,4.757575757575758
2769271,5,B000NIWI9K,"Da Ponte has written an original libretto with characters both invented and adapted from literature. Although the superficial plot has some comic scenes, Mozart wrote the most beautiful music for the serious parts. The Second Act in particular is where the 4 main protagonists sing arias pouring out their young souls and confusions in matters of love with exquisite music as only Mozart could create.
The six singers are not very well known in the US. They do an excellent job; their singing is exactly what is needed in this opera, beautifully rendered. Their acting is jovial, fresh, sometimes even athletic, making their young characters very believable.
The sets and costumes are so clean and traditional that you immediately relate to the scenes. The sets were designed with filming in mind, and it shows. The images on this Blu-Ray are just perfect - clear backgrounds, colorful and very attractive but without too many details that could distract from the singers and the music.
In summary, Mozart would be very proud of this production.  This Blu-Ray will be watched and listened to many times.",1421366400,,1103,5.027322404371585
2769272,4,B000NIWI9K,"If you enjoy opera and can't get to the Met, this is an enjoyable DVD.",1420675200,,70,3.7333333333333334
2769273,5,B000NIWI9K,Probably the best Cosi now on the market.  Unqualified recommendation.,1417651200,,70,6.0
2769274,5,B000NIWI9K,"Very richly portrayed and the music, of course, is superb.",1416009600,,58,4.9
2769275,5,B000NIWI9K,wife and I enjoyed the proformace great evening at home.,1406851200,,56,4.7
2769276,3,B000NIWI9K,The cast was excellent. I liked the lighting and the sound. Of course Mozart's music was the real star. The only reason I didn't go four stars was that it's not really my type but still it is a good production.,1404777600,,210,4.146341463414634
2769277,5,B000NIWI9K,"What a marvel this is!  Mozart and Da Ponte's third and final opera together often gets overshadowed by their previous two, but this version on DVD is so good, it proves that this opera is at least the equal of Le Nozze di Figaro and Don Giovanni.

For those who don't know the story: Ferrando and Guglielmo are arguing with their friend, Don Alfonso, who declares that all women are unfaithful.  They protest that their fiancees, sisters Fiordiligi and Dorabella, respectively, would never be unfaithful to them.  To prove it, they make a bet with him, in which he agrees to prove to them (in 24 hours) that their fiancees are just like every other woman.  His plan is to pretend that they have been called up to fight in a war. In their absence, his Albanian friends come to visit (who are really Ferrando and Guglielmo in disguise), both of whom are madly in love with Fiordiligi and Dorabella.  He gains the help of the sisters' maid, Despina, in convincing the women to have fun with these men while their fiances are away.  Dorabella is easily seduced by Guglielmo, while Fiordiligi needs strong convincing by Ferrando before she, too, gives in to his advances.  At a wedding between the women and their new lovers, the truth is revealed, and Don Alfonso asks Ferrando and Guglielmo to forgive their fiancees, for all women do that.

Great opera productions need five things: beautiful sets, great directing, excellent acting, wonderful singing, and inspired conducting.  In Cosi, one also needs an orchestra with a strong woodwind section.  While I am usually averse to period instrument performances, the Orchestra of the Age of Enlightenment, conducting by Ivan Fischer, often sounds like a modern orchestra in its phrasing.  It differs in that there is more transparency in the strings (so that you can really hear those woodwinds) and harder timpani thwacks (thanks to hard mallets, instead of soft ones).  Unfortunately, there are some occasional thin high notes in the violins and some not-quite-rounded notes in the brass, but the only time I really wished for modern instruments was during the three timpani hits that start the overture (followed by the same three timpani hits after the short theme in the woodwinds), which almost made Toscanini's recordings in Studio 8H sound resonant.  To compensate, the sublime passages (such as the sound of the breeze in ""Soave sia il vento"") and the dramatic passages (the ensemble pieces at the end of each act) are played brilliantly, with tempos well-judged.  The harpsichord also does enough to support the recitatives without calling attention to itself.

The singers are all young (except for the singer playing Don Alfonso) and are in excellent voice.  Plus, they know how to act and react, which is critical when watching an opera live or on DVD.  In fact, the camera is often as interested in their reactions as it is in capturing the person singing, and in ensembles, it will focus on one or two singers at a time, then go to a wide shot of the entire stage.  I think this adds to the experience, especially since this opera includes a lot of spying from behind the partition which cuts the stage in half and which can be opened or closed.  In front of the partition is used for the women's quarters, while the back is used for the garden, and the whole is used for larger outdoor scenes.  Simple, yet beautiful and effective, while the costumes place this opera squarely in Mozart's time, rather than trying to update it in a modern setting.

As Ferrando, Topi Lehtipuu has a beautiful tenor voice, and in his first duet with Luca Pisaroni's Guglielmo as an ""Albanian,"" he makes his mouth open and close as if he were kissing the sisters through his notes.  His reaction when he's heard that Dorabella has betrayed him is excellent, though I feel that Pisaroni is even better as a seducer and actor.  He is genuinely grieved when Dorabella falls so easily for him, and is beside himself when Ferrando finally seduces Fiordiligi (with an aria that would seduce anyone).  Both are excellent in the trio ""E voi redete,"" in which their laughter is incorporated into the music (and in such a way that it sounds as if it is oozing out at first, despite efforts to hold it back -- like a sneeze).  Nicolas Rivenq rounds out the men as Don Alfonso, who combines excellent Italian diction with a rich baritone voice and excellent acting (check out the stammer as he tries to tell the sisters that their fiances are going off to war in ""Mi par, che stamattina volentieri farei la pazzarella"").  He very much plays the part as a philosopher amused with his own cleverness, but also willing to patch things up as best he can at the end.

For the women, I will start with Despina (Ainhoa Garmendia), who doesn't overdo her impersonations of the doctor and the notary (hardly changing her voice for the former), but is full of earthy lustiness, which she portrays convincingly when telling her mistresses to have a little fun, especially in her aria ""In uomini, in soldati,"" where he ""La la la laaas"" transform into sexual come-ons, and whose advice certainly lowers Dorabella's resistance to the idea of sleeping around.  Anke Vondung makes an excellent Dorabella, particularly in her facial expressions, which show the joy she feels in having some fun with another man, and then the horrible regret she feels when her fiance returns, praising her fidelity.  As with all the other cast members, the music gives her no problems.

And now we come to Fiordiligi.  Miah Persson sings impeccably, acts impeccably, acts while singing impeccably, and makes the most of her role, in which we feel every tortured step she feels from her belief in complete faithfulness (she is able to make the runs on ""Come scoglio"" sound like shouts at the Albanians to get out of her house) to accepting that she loves another man besides her Gulglielmo.

But Cosi fan tutte is an ensemble opera, and so in the ensembles, too, the voices, characterizations, and music all blend together to not only make pretty harmonies but to serve the drama.  And this is where the directing comes in. Nicholas Hytner takes this opera seriously, his singers/actors take the opera seriously, the orchestra takes the opera seriously, and yet, this production manages to bring out all the pent-up sexual urges of its characters while simultaneously revealing the comedy and pathos.  Even better, the end of the opera is made more poignant by the fact that we know that both couples cannot completely forgive themselves for what they have done to each other.

And yet, Mozart and Da Ponte are not being pessimists about human nature.  For them, corruptibility is something innate in all humans, not just women.  To have it proven to us is horrible, which is why we should accept this fact without asking for proof and forgive others for being as imperfect as us. ""Lucky [are] those who see the good in everything and in every event are guided by reason,"" as the ensemble sings at the end of the opera.  In this Glyndebourne production, that message comes through, and shows us that one of Mozart's most troubled operas is actually one of his deepest.

P.S. I can only imagine what the Blu-ray sounds like, as the DVD sound quality is excellent, and gives the option for stereo or DTS surround sound.  There are also multiple subtitle options (English, French, Italian, German, Spanish, or none) and a few extras on the first DVD with the conductor, director, and cast talking about the opera and about this particular production.",1394150400,7,7543,4.798299845440495
2769278,5,B000NIWI9K,"This is a masterpiece!

The story is both hilarious and clever. The music by Mozart is among the greatest ever written and so perfectly matches the acting.

This production on Blu-ray is a masterpiece and the standard by which other opera DVDs should be judged.

If you are new to opera, definitely watch this. It will shatter any bad myths you have about opera. It is so entertaining for anyone.

Refer to the other reviews for the specifics as to why it is so great. My only criticism is that Anke Vondung seems to frown in her eyes too often but sings wonderfully and great overall.

Fantastic singing and acting by Miah Persson, Luca Pisaroni, Topi Lehtipuu, Anke Vondung, Nicolas Rivenq and Ainhoa Garmendia. Persson is young and gorgeous. Terrific performance by the Orchestra of the Age of Enlightenment (on period instruments and one of my all-time favorite orchestras worldwide) and hilarious story.

By the way, this opera should only be performed with YOUNG actors for the four main parts, especially the two women and especially Dorabella (looking like an older teenager ideally) or the story does not make sense. The title should be translated as ""Girls Are Like That."" Da Ponte poked fun at men characters in his other two masterpiece Mozart operas, and now he pokes fun at young women.",1386374400,3,1300,4.833333333333333
2769279,4,B000NIWI9K,"I think this 2006 performance is slightly overrated by two reasons -
1.  Lovely setting, beautiful staging;
2.  Terrific direction and acting;
3.  Ultra-lovely protagonists.
However, there is a big however, the
SINGING level is a bit mediocre if compared to the two Muti sets (1982, 1994) with protagonists Murray/Marshall/Araiza/Morris/Bruscantini/Battle and Schade/Skovhus/Kichschlager/Frittoli/Corbeli/Bacelli.
Of the six protagonists, Pisaroni is a visually delux (tall, young, handsome, charismatic) and vocally adequate Gugliemo.  Nicolas Rivenq is a veteran Mozartian and delivers the most stylish singing, but his acting is merely adequate.  Topi Lehtipuu is an almost great Ferrando - beautiful voice, good acting, marvellous singing, only slightly not as stylish as a Mozartian as the likes of Schreier, Araiza, Schade. Very satisfying Ferrando. Miah Persson is a beautiful Fiordiligi, vocally still in her prime, the voice hasn't hardened in 2006 here. Ainhoa Garmendia is an effective Despina, but no rival with Kathleen Battle for Muti in 1982, really. The main draw here is Anke Vondung's Dorabella, for though visually superb, is vocally clearly sub par with the rest of the cast. Indeed, has severe pitch problem coupling with inadequate projection in Dorabella's solo aria.  Her acting however is wonderful and works well in ensembles.
Very enjoyable modern Cosi, especially for the guys'roles.",1376179200,3,1411,5.759615384615385
2769280,5,B000NIWI9K,"A great example of why Glyndebourne has such an outstanding reputation - the orchestra, voices, staging, and of course Mozart's music are all wonderful. Excellent film/audio quality.",1370476800,2,182,5.777777777777778
2769281,5,B000NIWI9K,"The  quality  of the  recording  is  superb, both  in  sound  and image.  I  had  another version  but  this one  is better.",1366675200,,124,4.285714285714286
2769282,5,B000NIWI9K,"This is only my third Mozart opera on blu-ray. I was impressed by the production, which looked great. The performance by the entire cast was flawless. You can't go wrong with this Cosi.",1365897600,2,185,4.636363636363637
2769283,5,B000NIWI9K,"I have at least 6 DVD's of Cosi & this is
the best and only one I will watch from now on. Great teamwork and sophisticated expression of Mozart Pathos which is what makes him the Genius he is. The singers are all most attractive and really know how to sing & act. And the blu-ray is terrific. Wundebar! Damiron.",1350518400,4,311,4.2
2769284,5,B000NIWI9K,"It should be mentioned that although this is a conventional (and visually beautiful) production, it isn't so
conventional as an interpretation of the opera.  The opera supports many interpretations, but this one is a little different.

Strangely enough this is Cosi Fan Tutte as a love story--Fiordiligi finds her Albanian suitor as the true love of her life.

Sex and love are obviously central to the opera, but what is different in this production is the focus on the sexual awakening of the women as a central theme.  While the first act demonstrates that the four principals have much to lose with Don Alphonso's trials, the second act treats the seduction as a kind of triumph of the women's sexual development--regardless of what provoked it.  Fiordiligi's final seduction scene is a climactic love scene, and at the end of the opera she is reluctant to give up her chosen partner.

With such emphasis on the sexual nature of the relationships, no reconciliation is imaginable at the end.  (In this production the locket is the least of it.)  So the final scene is grim--the men can't see where to go, and the women are nowhere and in love with something that doesn't exist.

It has to be said that the music does work for this interpretation--which is wonderfully sung and acted--but it sure makes
for heady stuff.

For the sake of argument it is worth saying a few words about the composer's intent in this opera, because that much is actually pretty clear.

- Most fundamentally this is a ""patient Griselda"" story turned upside down.  While it is in the format of old stories about wives undergoing abuse to test their faithfulness, in this case the women fail the test but the test itself is an act of treachery so complete as to eclipse what they have done. The whole affair seems strangely modern in the casualness of the evil.

- Whether it is problematical in this opera or not, reconciliation is a primary theme of Mozart operas, so it has to be taken seriously.  That means the intent of the action is to push to the boundary of what is forgivable but not over, and the characters are left shaken but at least willing to go on with the rest of their lives.  From a musical point of view, the beautiful ensemble that precedes the final chorus (abbreviated here) is certainly to be taken seriously.

- Finally the opera is about sex and love without being either amoral or prudish in its conclusion.  The women are overwhelmed by what hits them and are so unprepared for it that they can only call for the maid when it starts.  They have been through a kind of parallel universe that they have to reconcile with reality.  Musically the key changes mark how far they have gone and come back.",1345939200,20,2705,4.633123689727463
