,overall,asin,reviewText,unixReviewTime,vote,reviewLength,wordLength
1630323,5,B00005NB93,Great Holiday Classic!,1520553600,,22,6.666666666666667
1630324,5,B00005NB93,What can you say this is such a great family movie - I remember watching with with my parents back in the 1960s and 1970s,1519948800,,121,3.88
1630325,5,B00005NB93,Merry Christmas,1519776000,,15,7.0
1630326,5,B00005NB93,The classic for those who can't watch the annual broadcast. I've watched this every year since 1964,1519344000,,99,4.882352941176471
1630327,5,B00005NB93,keeping the classics alive,1518825600,,26,5.75
1630328,5,B00005NB93,My kid watches this everyday from November to Christmas. It's a good holiday classic and everyone loves Rudolph!,1518566400,,112,5.277777777777778
1630329,5,B00005NB93,Does this even need a review?  I'm happy to bring this to my kids so they can watch the movies that were classics when I was a child.,1518566400,,133,3.75
1630330,5,B00005NB93,everybody loves Rudolph,1518307200,,23,7.0
1630331,5,B00005NB93,Another old time favorite and my husbands classic. It also joins our home library.,1518307200,,82,4.928571428571429
1630332,5,B00005NB93,classic - hello!,1518134400,,16,4.666666666666667
1630333,5,B00005NB93,Fun Christmas movie from my childhood that I am so happy to share with my children.,1518134400,,83,4.25
1630334,2,B00005NB93,I wanted the original cartoon.  This is some modern remake.  Disappointed.,1517788800,,74,5.636363636363637
1630335,5,B00005NB93,A classic!,1517616000,,10,4.5
1630336,5,B00005NB93,Kids enjoyed immensely,1517443200,,22,6.666666666666667
1630337,2,B00005NB93,"I love Rudolph, of course, but this one is not for young children.",1517356800,,66,4.153846153846154
1630338,5,B00005NB93,My husband and I always watch this as our tradition to celebrate the season. Loved it.,1517270400,,86,4.4375
1630339,5,B00005NB93,Who doesn't love Rudolph?  Very happy with this purchase.,1517270400,,57,5.333333333333333
1630340,5,B00005NB93,made christmas feel as it did when I was a kid,1517097600,,46,3.272727272727273
1630341,5,B00005NB93,Oldie but still a goodie my daughter really enjoyed the movie.,1517097600,,62,4.7272727272727275
1630342,5,B00005NB93,Great value on this classic.,1517097600,,28,4.8
1630343,5,B00005NB93,very surprised by parts we have never seen before neither on t.v. nor on vhs we bought. Excellent viewing via Amazon Video,1517097600,,122,4.590909090909091
1630344,5,B00005NB93,"This is the Rudolph classic movie, loved it!",1516838400,,44,4.625
1630345,2,B00005NB93,The quality of the video is good but it wouldnt play in a standard CD/DVD player. I had to hook up my computer to the TV to play it.,1516838400,,132,3.586206896551724
1630346,1,B00005NB93,Received this for Christmas and it did NOT have any BONUS features!,1516665600,,67,4.666666666666667
1630347,4,B00005NB93,Good quality recording,1516492800,,22,6.666666666666667
1630348,5,B00005NB93,Always been a great show,1516320000,,24,4.0
1630349,5,B00005NB93,This is a fun movie to watch at the holidays.,1516320000,,45,3.6
1630350,5,B00005NB93,This is a classic and a must have.,1516147200,,34,3.375
1630351,5,B00005NB93,Kids love it.,1516147200,,13,3.6666666666666665
1630352,5,B00005NB93,Still love watching the classics,1515974400,,32,5.6
1630353,1,B00005NB93,"I don't hate Rudolph, but the disc was  defective and would not play. I've tossed it in the trash, but it was very unfortunate to find on Christmas Day!",1515888000,,152,4.241379310344827
1630354,5,B00005NB93,"A classic from back in the day that now my little ones enjoy.  Well into January, and it's still a Saturday morning favorite!  Love Rudolph claymation.",1515801600,,151,4.769230769230769
1630355,5,B00005NB93,Who doesn't love Rudolph?,1515456000,,25,5.5
1630356,5,B00005NB93,Given as a gift.,1515456000,,16,3.25
1630357,5,B00005NB93,=),1515456000,,2,2.0
1630358,1,B00005NB93,"I have loved the story of Rudolph ever since I was a little boy.  I even have a mini collection of sorts.  Well, this summer I found that my classic Rudolph dvd had been stolen.  So I decided to pick up the blu ray after Christmas.  Not only was I surprised that the 50th anniversary edition had skimpy extras.... THE EXTRAS WEREN'T THERE.  The menu on the disc didn't even say it's the anniversary edition.  I wonder if the company just took old blurays from a bare bones release and put a new label on the disc. SO DISAPPOINTED.... I'M GONNA FIND OUT WHAT I CAN DO.",1515369600,,567,4.252336448598131
1630359,2,B00005NB93,Disc had bunch of scratches on it and Im sure this is not new condition.,1515369600,,72,3.8666666666666667
1630360,5,B00005NB93,Very happy with the dvd and very happy how fast it was delivered,1515283200,,64,4.0
1630361,5,B00005NB93,The DVD is of the highest quality and arrived on time without any problems. The bonus feature with Arthur Rankin was a very pleasant surprise.,1514937600,,142,4.72
1630362,5,B00005NB93,Great timeless classic remastered in HD. A little freaky being able to see all the figures in great detail as compared to the blurry original.,1514937600,,142,4.72
1630363,5,B00005NB93,Pure classic with a great message of accepting those who are different,1514764800,,70,4.916666666666667
1630364,2,B00005NB93,"The movie itself was wonderful and my package arrived quickly!  This is a 50th Anniversary edition and was supposed to have bonus features.  There are no bonus features.  Disappointed.  The dvd has the 50th picture, so maybe there are not any bonus features?  On the package it talks about a snowman sing along plus two other pieces.  Not there :(",1514764800,,347,4.7
1630365,1,B00005NB93,"Worse video quality than a flea market bootleg. Just like when I was a kid, Ill DEFINITELY wait an entire year to watch again! Crappy.",1514592000,,134,4.4
1630366,5,B00005NB93,Classic!,1514419200,,8,8.0
1630367,5,B00005NB93,Were love the classic movies!,1514419200,,29,5.0
1630368,5,B00005NB93,"My 4yo daughter watched this every day for two weeks this past Christmas. I was annoyed that it wasn't included with Amazon Prime, but it was definitely worth the purchase price. This is a timeless classic!",1514332800,,206,4.75
1630369,5,B00005NB93,a classic,1514246400,,9,4.0
1630370,1,B00005NB93,"Packaging for one disc set advertises bonus features, but this disc included none.  Basic Blue-ray with menu choices of play all, chapters and set-up.  Set up included 2 types of Dolby audio and French and Spanish - no mention of closed captioning.",1514246400,,248,4.880952380952381
1630371,5,B00005NB93,"My husband and I have fun with Rudolph ""trivia,"" that is, saying the lines of the characters as they happen and then quizzing each other later..like, who said, ""no doe of mine is going to be seen with a red-nosed reindeer!""",1514160000,,223,4.463414634146342
1630372,5,B00005NB93,"Childhood!  Only lacked shag carpet, Uncle Mike talking too loudly, and the lingering whiff of stale cigarette smoke.",1514160000,,117,5.5
1630373,5,B00005NB93,The original movie... nice to have it on digital.,1514073600,,49,4.555555555555555
1630374,1,B00005NB93,"Wow.  This needs to be retired to the history books!  No female reindeers.  The only female elves are in short frilly pink skirts (and have no lines!).  The only females with lines are Mrs. Claus, Rudolph's mom, and the eye-batting girl reindeer that helps Rudolph navigate adversity.  Dad Donner even says to his wife ""This is man's work!""  Definitely not a show for my boys and girls.  This is dinosaur material.",1513987200,,414,4.746478873239437
1630375,1,B00005NB93,Went to watch this with my mom who is hearing impaired... there is no subtitle option in the setup and the closed captioning option is greyed out on the tv menu. The box says CC right on it.  Total false advertising.,1513987200,,216,4.2682926829268295
1630376,5,B00005NB93,Always a favorite of mine,1513814400,,25,4.2
1630377,5,B00005NB93,Excellent Product! Thank you!,1513728000,,29,6.5
1630378,5,B00005NB93,"Classic for everyone, these shows are timeless",1513555200,,46,5.714285714285714
1630379,5,B00005NB93,"This is a beautiful classic narrated by the charming Burl Ives.  I watched this as a young girl back in the 60's and loved it.  The story is lovely in its message that everyone, regardless of being different in some way, should be cherished and valued.  The music and dance sequences are joyously playful and I loved each character's delicate features and movements.  Everyone that worked on this film deserves a standing ovation.  It brought happy tears to my eyes.  One of my all time favorites.",1513555200,,497,4.72093023255814
1630380,1,B00005NB93,"I honestly loved this movie as a kid, but even though on the box it clearly says it has subtitles for the hearing impaired and deaf, that turned out to not be the case. I can't enjoy this movie with my grandmother now as there is no way for her to see the subtitles, so there is blatant lies on the outer box.",1513555200,,309,3.9206349206349205
1630381,5,B00005NB93,"This is on behalf of my 4 year old son. It was a classic for me, but he wanted to make sure to tell everyone he liked it ""a whole, whole bunch. Especially the abominable snow monster"".",1513555200,,184,4.0
1630382,5,B00005NB93,Classic,1513468800,,7,7.0
1630383,2,B00005NB93,Kids like it ! Reminds me of YouTube video animation. I would rather the old clay version of the story better. Wish I could return it !,1513468800,,135,4.037037037037037
1630384,5,B00005NB93,"The movie is wonderful and it never gets old. However, I purchased it not two weeks ago and now it is unavailable. I think that stinks. If you were going to remove it, there should have been some sort of disclaimer that it would be removed from viewing on a certain date - I would not have wasted the money!",1513209600,,307,4.133333333333334
1630385,5,B00005NB93,I purchased the version that streams on Amazon for my video library. It played perfectly with no audio problems at all and the video was exactly as I remembered it as a child. The Closed Caption worked fine. I'm glad I ignored the bad reviews and purchased this classic. Takes you back to the 60s!,1513209600,,297,4.418181818181818
1630386,5,B00005NB93,"I ordered this despite the reviewers saying they got a used copy or the wrong movie. It was fine. Brand new copy, plastic wrapped at the manufacturer. It was the right movie. The old beloved stop-motion classic I loved as a kid.",1513036800,,228,4.4523809523809526
1630387,5,B00005NB93,Just like I remembered. Such a fun movie.,1512950400,,41,4.25
1630388,5,B00005NB93,My kids watch this every stinkin day. It's a classic Christmas show and I was glad to see it on Amazon and it is in fairly nice quality (consider when it was made),1512950400,,163,3.9696969696969697
1630389,2,B00005NB93,The color is really awful!!  Not worth the price!  Very disappointed ,1512777600,,69,5.090909090909091
1630390,1,B00005NB93,My two daughter was missing subtitles English SDH.,1512518400,,50,5.375
1630391,1,B00005NB93,The dvd case was broken and the disc is scratched and appears to be used. Very disappointed.,1512259200,,92,4.470588235294118
1630392,1,B00005NB93,Item didn't work.,1512259200,,17,5.0
1630393,1,B00005NB93,not remasterd,1512000000,,13,6.0
1630394,5,B00005NB93,"Just watched it with no distortion at all. Sam the snowman has always been oval. You can see it when he stands next to a perfectly round ornament during ""Siler and Gold.""",1511740800,,170,4.34375
1630395,1,B00005NB93,Did not play in any DVD player.  Appears to be a defective disc or some sort of foreign version passed off as legitimate.,1511654400,,121,4.260869565217392
1630396,5,B00005NB93,Classic... 110% classic.,1511654400,,24,7.333333333333333
1630397,5,B00005NB93,"The old classic is finally digitally available, and I jumped at the chance to buy it. This is the one you have been looking for if you want the classic stop motion Rudolph. It is currently on Prime, but I purchased it anyway so I would always have it. Brings back many memories and will be viewed for years.",1511395200,,307,4.220338983050848
1630398,5,B00005NB93,Awsome price for a Christmas classic,1511308800,,36,5.166666666666667
1630399,5,B00005NB93,Thanks for the great memories Who cares if Millennials get it or not!  Great Job Amazon for showing this classic.,1511136000,,113,4.65
1630400,5,B00005NB93,Must have classic that my family loves.  We seem to miss it every year because we didn't own it but now we will watch it at our leisure.,1511136000,,136,3.857142857142857
1630401,5,B00005NB93,great movie,1510790400,,11,5.0
1630402,5,B00005NB93,Great Movie!! package came in good packaging most of all I could share my childhood memories with my 7yr old who continually watches this over and over!,1510790400,,152,4.666666666666667
1630403,5,B00005NB93,A true classic.,1510444800,,15,4.333333333333333
1630404,4,B00005NB93,"I was a child when this TV special first came out. I loved it then and still do. It was  not created with computer animation but with stop motion animation using detailed figures. It was just watch Christmas TV every year after its debut. Just like ""The Charlie Brown Christmas"" special and ""The Grinch who Stole Christmas"" special using Seuss' drawing style. Memorable songs and memorable stories.

My first complaint with this is  the previously mentioned stretching of the screen. It should have been done with black side borders instead to retain the proper dimensions. This was apparently someone's conscious decision to do it this way.

My second complaint is that the colors are not as vivid as they are when this is shown by a TV station.  It is apparent in the very first scene with the snowman (voiced by Burl Ives). The colors are off. Why can TV stations run a version with vivid colors but this digital version is not as vivid? I thought computers could do everything. What's up the faced colors????

Lovely heart warming story about a reindeer who is different and suffers some bullying for being different. In some way, all of us are square pegs in round holes. Being accepted for or despite our uniqueness and oddities is what creating a loving world is all about.

The monster in this story was never as scary as the wicked witch and her flying monkeys in the classic movie, ""The Wizard of Oz"" (with a young Judy Garland) which was aired on TV every Halloween season.

Dear some computer genius, please fix this TV classic to be as technically outstanding as it was in TV over fifty years ago. Sharpen those colors and get right of the horizontal picture distortion.

One star removed due to technical complaints.",1510272000,,1730,4.701986754966887
1630405,5,B00005NB93,Younger kids will get it.  Afraid millennials may not.  The program came out when I was a kid and fosters old time values and strong nostalgia for when life was more simple.  A great Christmas Special  and warming to the heart.  Thank you for having it Amazon!!!,1510099200,,262,4.48936170212766
1630406,5,B00005NB93,"Yes it is stretch to fit, but its a dollar. Get over it. Excellent picture quality and sound. Great movie.",1509753600,,106,4.35
1630407,1,B00005NB93,"As the other reviewer has said, this version has been altered from the original by stretching the square 60s TV picture to fill the current rectangular TV frame.  This is always a stupid idea.  Everything looks short and wider than normal.  The giveaway is anything that would be a circle is an oval.  When the narrator is a snowman who's head should be round, and it ends with a shot of an oval moon, the distortion is perfectly obvious.  The picture could have been carefully cropped to our current width as other some older TV programs have recently been, which would require some expert care being taken and probably cost more money, but the result would be far better than this.  We've been watching this yearly on TV for over 50 years, and on video for over 30 years, we know how it's supposed to look.  This cheap video was a cheap effort by someone who thought people wouldn't be smart enough to tell the difference.  Don't reward people who think you're stupid.  Don't buy this version.  Why would you buy this inferior version with mediocre picture quality when there is a much better version that's NOT distorted?",1509753600,,1124,4.6313131313131315
1630408,5,B00005NB93,Duh. Best holiday movie ever.,1509753600,,29,5.0
1630409,5,B00005NB93,Gets you in the Christmas mood!,1509667200,,31,4.333333333333333
1630410,3,B00005NB93,"Yes, this is the original, but it is set to ""Stretch to fit"" meaning everything that should be a circle is a squished oval.",1509235200,,123,4.166666666666667
1630411,5,B00005NB93,"There is nothing to compare it with. The best, ever.",1507939200,,52,4.3
1630412,5,B00005NB93,This is my favorite Christmas movie so we were happy to add it to our digital library.,1507161600,,86,4.117647058823529
1630413,4,B00005NB93,A little dirty but it works,1506643200,,27,3.6666666666666665
1630414,5,B00005NB93,My Grandson was amazed.  Thank you!,1506556800,,35,4.833333333333333
1630415,5,B00005NB93,"I finally broke down and purchased our own copy...price was great and it's a holiday classic. Well loved, and watched, in our home during the holiday.",1504483200,,150,4.8076923076923075
1630416,5,B00005NB93,Classic. Reasons it's been around so long,1501891200,,41,5.0
1630417,5,B00005NB93,A great Chistmas classic for the whole family and fast service.  Thank's,1501804800,,72,5.0
1630418,5,B00005NB93,Excellent transaction and I love the movie!!,1495929600,,44,5.428571428571429
1630419,4,B00005NB93,love it but Frosty was damaged,1495756800,,30,4.166666666666667
1630420,5,B00005NB93,Love this cartoon,1494979200,,17,5.0
1630421,2,B00005NB93,"it is a a keepsake, but not very clear.",1493424000,,39,3.4444444444444446
1630422,5,B00005NB93,"We watch this every Christmas even though there isn't a small child in the house. I use the word ""small"" because we are still children in our house but we are all grown up tall. Love this show.",1493078400,,193,4.105263157894737
1630429,5,B00005NB93,A Classic !!!!!,1492560000,,15,4.333333333333333
1630430,5,B00005NB93,Great product,1492387200,,13,6.0
1630431,5,B00005NB93,"Love these, they are the originals",1491350400,,34,4.833333333333333
1630432,5,B00005NB93,Classic Christmas Show,1490745600,,22,6.666666666666667
1630433,4,B00005NB93,"I already knew I would like this movie, but could not get it to play in my DVD player hooked up to my TV.  Could only get it to play on my laptop with a small screen.",1489449600,,166,3.4864864864864864
1630434,5,B00005NB93,As described,1488844800,,12,5.5
1630435,5,B00005NB93,my favorite childhood Christmas movie!,1488844800,,38,6.8
1630436,5,B00005NB93,great classic movie,1488758400,,19,5.666666666666667
1630437,5,B00005NB93,No doubt a classic! Great movie to watch with the kids during the holidays!,1488499200,,75,4.428571428571429
1630438,5,B00005NB93,CLASSIC,1487808000,,7,7.0
1630449,5,B00005NB93,All time classic. Enjoy watching with grand children. Lots of fond memories. This is what I children should be watching,1487721600,,119,5.0
1630450,5,B00005NB93,I love it I'm 67 but my heart is like a child,1487635200,,45,2.8333333333333335
1630451,5,B00005NB93,Great family movie,1487548800,,18,5.333333333333333
1630452,5,B00005NB93,I have been watching Rudolf for many years .  I just love it.,1486944000,,61,3.6923076923076925
1630453,5,B00005NB93,Had to have a Christmas classic in DVD.,1486771200,,39,4.0
1630454,5,B00005NB93,loved it,1486598400,,8,3.5
1630455,3,B00005NB93,It really didn't hold up for me from when I was a kid.  I was SHOCKED.  And it freaked my 8 year old out.,1486598400,,105,3.3333333333333335
1630456,5,B00005NB93,Our grandson loved it.,1486425600,,22,4.75
1630457,5,B00005NB93,Got this for my grandchildren. They love it. Thank you.,1485993600,,55,4.6
1630458,5,B00005NB93,One of my Christmas time childhood favorites,1485820800,,44,5.428571428571429
1630469,5,B00005NB93,Excellent item,1485648000,,14,6.5
1630470,5,B00005NB93,"yeah, i'm 56 yrs old...no, no children live here

don't judge me

between this one, ""the little drummer boy""- with jose' ferrer & greer garson, no less!-and a couple of different scrooge movies, i'm set!",1485388800,,203,4.771428571428571
1630471,5,B00005NB93,"This is the original Rankin/Bass production, a real Christmas classic. Although if you really watch it and listen to the dialogue, you can certainly tell that it was made in a different time. Frankly, the elves are really jerks, especially the supervisor who would be reported to HR for harassment of Henry in a heartbeat if he worked in a modern work environment. And Rudolph's dad is not particularly nice, playing the role of the stern, heartless father in typical 50's stereotypical fashion. It was definitely written in the era before everything become whitewashed in political correctness... which of course, makes me want to show it to my 3 year old every day all year long. She loves it. And I crack up laughing every time Yukon Cornelius licks his ice pick. Don't ask me why that's funny, it just is.",1485216000,,809,4.74468085106383
1630472,5,B00005NB93,Always loved this since seeing it as a child,1485129600,,44,4.0
1630473,5,B00005NB93,Love  it! Reminds me of being a little boy ,1485043200,,43,3.6666666666666665
1630474,4,B00005NB93,"Bought this on Christmas day because you can't rent it and because it's tradition!

A very costly tradition!

It's your throwback film.... complete with it NOT being widescreen or remastered so keep that in mind.

I still enjoyed watching it... and the noise kinda made me feel like I was back home during the 90's. Can't beat that.... right?!",1484956800,,343,4.779661016949152
1630475,5,B00005NB93,Brings back childhood memories,1484870400,,30,6.75
1630476,5,B00005NB93,The original with no commercials.,1484870400,,33,5.8
1630477,2,B00005NB93,"The movie is awesome. However, the DVD would not work",1484611200,,53,4.4
1630478,1,B00005NB93,"Ordered a DVD and it wouldn't play.  Requested a new DVD, got one, also wouldn't play. It looked like a blue ray, which I did notify the company twice. Disappointed",1484611200,,164,4.466666666666667
1630489,1,B00005NB93,Sad I thought it was the original,1484524800,,33,3.857142857142857
1630490,5,B00005NB93,Seller was amazing and so is movie,1484438400,,34,4.0
1630491,5,B00005NB93,Grandkids love this movie.,1484265600,,26,5.75
1630492,4,B00005NB93,"First, it's an animated show.  Was the sound out of sync?  I couldn't tell as it's an animated show where the animation doesn't have real lips to really be able to tell.  If you just want to watch it once every christmas this is fine.",1484092800,,234,4.155555555555556
1630493,5,B00005NB93,Nephew loved it,1483920000,,15,4.333333333333333
1630494,5,B00005NB93,"We already had this movie in our collection, so I purchased as additional Christmas gifts for my nieces and nephews.  I hope they love it as much as our family does - no Christmas movie collection is complete without it!",1483920000,,220,4.5
1630495,5,B00005NB93,Timeless Clasic,1483747200,,15,7.0
1630496,5,B00005NB93,Great classic!!,1483574400,,15,7.0
1630497,4,B00005NB93,Looks good!,1483574400,,11,5.0
1630498,5,B00005NB93,ok,1483228800,,2,2.0
1630519,4,B00005NB93,"I was skeptical, I wasn't sure the animation would hold up to the claymation of the previous stories with Rudolph and the gang. I bought a used copy because the price was right. It was better than expected. Returning characters were familiar and well voiced, new characters were interesting and helped the story along. I held back the last star because the animation was just short of finished. There were animation details that could have been added that would have made the overall feel of it so much better. (like the edge of water interacting with land, should have had some attention to create a more reasonable interface.) Alas many of those details were not attempted and their absence was palpable, leaving this looking like the intermediate steps for some special effects footage. Overall though it was good, Animation was on a par with children's shows like ""Word World.""",1483142400,,881,4.919463087248322
1630520,5,B00005NB93,Just like i remember.,1483142400,,21,4.5
1630521,5,B00005NB93,Classic,1483056000,,7,7.0
1630522,1,B00005NB93,I was rather disappointed in this one. It's an computer-animated musical film and nothing like the classic holiday Rankin/Bass specials.,1482883200,,136,5.85
1630523,5,B00005NB93,a classic for the family.,1482883200,,25,4.2
1630524,5,B00005NB93,Child hood being transferd to the Next Generation,1482796800,,49,5.25
1630525,5,B00005NB93,"Great movie, fun to watch",1482796800,,25,4.2
1630526,1,B00005NB93,"I ordered this movie because it is a Christmas Classic and I was excited to watch it again. Unfortunatley it was clear upon its arrival that it was a bootleg version of the DVD and was highly lacking in quality. The cover was a printer quality printout that had words cutoff and missing. The start screen was a generic start screen designed for kids (had elephants, giraffes, etc. on it). None of the special features were included. Overall a major disappointment. I thought I was getting a high quality product from a reputable dealer, but sadly I was mistaken.",1482796800,,562,4.686868686868687
1630527,5,B00005NB93,Classic,1482710400,,7,7.0
1630528,5,B00005NB93,DVD was as advertised.  It is in good condition and we played it immediately upon receiving and have played it a couple of times since.,1482710400,,135,4.4
1630529,5,B00005NB93,"It's a classic what more can I say, my mom loves it.",1482624000,,52,3.4166666666666665
1630530,3,B00005NB93,"The movie itself is fine, however the packaging claims that the movie comes with SDH, or subtitles for the deaf and hard of hearing. However there is no option for this . This is sad and unfortunate.",1482624000,,199,4.405405405405405
1630531,5,B00005NB93,Always a classic.,1482364800,,17,5.0
