,overall,asin,reviewText,unixReviewTime,vote,reviewLength,wordLength
1631181,5,B00005NB93,"Rudolph, the Red-Nosed Reindeer is indeed the most marvelous Christmas film ever!  It is one of many splendid animated films written by a great man named Romeo Muller.  Rudolph is doubtless his best-loved work.  I remember watching the film as a child, delighted and enraptured by the story that it told.  Do you remember?  Sam the Snowman as narrator (voiced and sung in the performance of a lifetime by Burl Ives); Rudolph the misfit and rejected reindeer; Rudolph's friend, Hermie the Elf, also a misfit because he doesn't like to make toys but wants to be a dentist; Yukon Cornelius, the prospector who befriends them both; the Abominable Snowmonster of the North (whom Yukon, in prospector slang, invariably calls a ""bumble""); the Island of Misfit Toys, and its winged lion king; and many other characters and story threads.  The presentation, interweaving, and resolution of all of these elements is positively Shakespearean in deftness, wit, poetic beauty and brevity of expression, depth, pathos, joy, moral instruction, and the sense that all ends as indeed it should.  Grounded in a deep and sparkling love of all creation, these qualities characterize all of Romeo Muller's films.  Merry Christmas!",1291852800,,1209,5.164102564102564
1631182,3,B00005NB93,"I just bought this DVD at the U.S. Post Office, expecting to see a clean digitally re-mastered Rudolph... to my surprise, the DVD I have has lines and spots, as if copied from an old film strip.  I'm very dismayed and confused.  Doesn't sound like others are having this complaint, so did the Post Office purchase pirated DVDs for resell?  Strange...",1291766400,,350,4.704918032786885
1631183,5,B00005NB93,I was very happy to see I could get this dvd movie. Loved it the first time I saw it. Dvd in great condition and vendor ships very quickly. Highly recommend both.,1291334400,,162,4.09375
1631184,4,B00005NB93,"""Rudolph the Red-Nosed Reindeer"" has been a Christmas classic since its first presentation on television in 1964, and has nicely survived the transitions to VHS, DVD, and now HD formats.

""Rudolph"" is the story of a young reindeer growing up in Christmastown, who is shunned and bullied by other reindeer for his shiny nose.  Rudolph leaves Christmastown with another misfit, an elf named Hermy, who wants to be a dentist rather than make toys.  The pair team up with Yukon Cornelius, a wacky but savy prospector, to explore the Great North.  The trio will dodge the Abomidable Snowman and find the Island of Misfit Toys.  It will take a family crisis to bring them back to Christmastown, just in time for a big blizzard and a chance to save Christmas...

""Rudolph the Red-Nosed Reindeer"" has lost none of its charm and wisdom through an annual retelling.  The songs are still fun, the characters are charming, and the moral of accepting others is as relevant as ever was.  Highly recommended to children of all ages.",1291161600,,1017,4.804597701149425
1631185,5,B00005NB93,Rudolph is a must see in our house during the Christmas season. My husband & I have been watching it since we were kids & our kids are watching it now.,1290038400,,151,3.903225806451613
1631186,1,B00005NB93,"This was used so I know it was not going to be perfect (case, clarity of tape, etc.) But, this would not work and never did getting it working even cleaning video head, different and newer VHS players, etc.  Would not buy used again though I am sure the seller had to have known it wouldn't work and sent it to me anyways.  Hard to say for sure, huh? Buyer beware.",1287705600,,364,4.112676056338028
1631187,5,B00005NB93,"So many reviews, just wanted to add my rating to the overall score for my favorite christmas movie.",1287619200,,99,4.555555555555555
1631188,4,B00005NB93,"This DVD was watched many times by small children in the family.
When it became scratched and couldn't be viewed any more, there were so many tears that I said I would try to get another one. Amazon had only one left and we were very pleased to be able to get this last one. It was supposed to be new but arrived without the usual DVD wrappings. However, they could view it and that is all that matters. I haven't watched it, but, since it is so popular with the children, I give it 4 stars.",1286928000,,491,4.072164948453608
1631189,4,B00005NB93,"There is a lot to like with this blu-ray which I just viewed today. The details are awesome and the colors are vivid and bright. I noticed materials in Santa's clothes when he visits the Donners cave in the beginning, details I had not noticed before. And the sound is great as it is in dolby digital. Now, the negative. When Sam the Snowman sings ""Silver and Gold"" which is my absolute favorite song in this classic TV special, one word is lost as apparently there was a skip in the old film elements when this was transferred. Instead of singing,""Everyone wishes FOR silver and gold..."" it says, ""Everyone wishes...silver and gold."" That is really the only defect I found but it was a bummer. Was there no way to simply take the song from a CD (it has been released on CD) or somehow restore it a bit better? Also, there are no extras whatsoever. I found that to be a bit cheap, a bare bones release. But for the picture quality, if you love this classic Christmas special as I do, it is still very nice to own in High Definition. Four out of five stars from me.",1286755200,,1064,4.325
1631190,4,B00005NB93,"Founded in 1960 by Arthur Rankin, Jr. and Jules Bass, Rankin/Bass followed in the footsteps of such stop-motion animators as Ray Harryhousen--but with less budget.  Although the company made quite a few feature films over the years, with the 1967 THE MAD MONSTER PARTY probably the best known, they were most famous for their seasonal television specials.  These included the 1964 RUDOLPH THE RED NOSED REINDEER, which has been televised on network television every year at Christmas since its debut.

Obviously inspired by the song by the 1939 song, the story veers in several creative directions.  Not only does Rudolph have a glowing red nose, his father attempts to conceal it, and even Santa rejects Rudolph because of it.  This story line is combined with the tale of elf Hermey, who dislikes making toys and wants to be a dentist.  Rejected for who they are, Rudolph and Hermey flee the north pole--and eventually stumble upon the Island of Misfit Toys, where unwanted toys are gathered and will remain until some little girl or boy actually wants one of them.  Still later, the pair encounter Yukon Cornelius, who helps them defeat the ""Bumble,"" a version of the abominable snowman.  Rudolph and Hermey return home, where both now find acceptance; Yukon Cornelius joins them, leading the Bumble, who he has converted into a helpful beast.  When a violent snow storm threatens to postpone Christmas, Rudolph uses his nose to light Santa's way, and after a quick stop to pick up the misfit toys for a happily-ever-after Christmas delivery, Santa is on his way.

The stop-motion is hardly on the same level as that of KING KONG or EARTH VS. THE FLYING SAUCERS, but it has a certain innocent charm, and the puppets are truly smile inducing.  The show also includes a number of truly enjoyable Christmas songs, two of which are performed by Burl Ives as the narrating snowman and which went on to a broader popularity: ""Holly Jolly Christmas"" and ""Sliver and Gold.""  The DVD release is not pristine, but it is extremely good, and children of all ages will enjoy the show.  The same can't be said for the Beyonce video, which really has no place here and should be skipped.

GFT, Amazon Reviewer
In Memory of friend Jerry Williams",1286236800,,2232,4.839473684210526
1631201,5,B00005NB93,"Rick Goldschmidt was absolutely right the blu ray is just a copy of the last dvd version now placed on blu ray but its still a classic. Rick above anyone else is the ultimate Rankin Bass
information bank,and has done nothing but good things for these people and there productions. This reminds me of a few years back a classic collection of the figures came out and was fantastic but then were taken over by a different company who just mutilated the image of these characters,same thing with this cover on the blu ray,this is not the classic cover everyone remembers which was on the one dvd version years ago,dont these people putting these issues out care about what there doing,why don't they go to someone like Rick or myself and ask what would the public want when we release this blu nray. Well the first thing is commentaries even if from the Rankin bass survivors.rchive video of the original voice performers,andthing that we have not seen. Its a shame Sony could have did great things with this blou ray of this classic but just thyrew it out there just to sell another copy. Hi Rick I still need a few more of your cd collections to make my collection complete. Thanks for everything you have done for these classics. To Billy Mae Richards you might not be recognized by your picture but will always be recognized by your voice. Thankyou for giving me a childhood full of memories that still remain with me today even at my age now. God Bless you forever,your up there with Burl and the other voices now to create magic in heaven.",1284422400,,1542,4.5503597122302155
1631202,4,B00005NB93,"Bought this for my parrot as he loves animated movies and cartoons. He likes this one at Christmas time, and it is a childhood classic for us!",1278028800,,142,4.296296296296297
1631203,4,B00005NB93,"Came promptly, saving this one for Christmas so we have not viewed it but I do not expect a problem",1277424000,,99,4.0
1631204,5,B00005NB93,"Daughter ruined her first dvd, she watches it all the time!  I ordered and received dvd from the shipper extremely fast!",1269388800,,120,4.714285714285714
1631205,5,B00005NB93,"My grandchildren were thrilled that I had ordered this so they can watch it all year long!  They love the ""bomdable"" snowman.",1265846400,,125,4.681818181818182
1631206,5,B00005NB93,"Nothing beats this classic! How could anyone not love it? I watched this as a kid, my kids watched it and now my grandchildren watch it!
I don't think Christmas would be the same without seeing this during the holidays...  Love it!",1265328000,,231,4.5
1631207,4,B00005NB93,"I have always enjoyed ""Rudolph the red nosed reindeer"" and ordered the DVD. It's very good and as I remember the original many years ago. I'm sure I'll enjoy this for years to come.",1264377600,,181,4.352941176470588
1631208,5,B00005NB93,"It wouldn't be Christmas time without ""Rudolph"" and ""Santa Claus is Coming to Town"".  There's a certain charm and holiday spirit in these older shows that's been lost with modern animation.",1262822400,,189,5.096774193548387
1631209,1,B00005NB93,"This new Rudolph uses digital animation instead of the wonderful stop-motion action of the original, and it's a poorly-scripted, miserably-executed mess. It's an unfortunate appendage to one of my favorite childhood specials, and I hope someone takes a magnet to it. No matter, though -- my kids have already forgotten it.  Don't even consider buying ""Island of Misfit Toys"" unless you've exhausted the wonderfully-creative originals.  They are decades better than this quickly-conceived piece of shlock.",1261094400,,504,5.706666666666667
1631210,1,B00005NB93,"I was amazed by how horrible the CGI graphics were.  If you are going to try to revive a classic please do it right.  Instead, the visuals look like someone has a 'make your own animated film' software on a PC at home and whipped them up in one night.  Wow, what a horrendous thing this film is- poor story, poor visuals, poor writing- there are 200 Christmas movies on Amazon someone should consider before this.  Please do yourself a favor and don't subject your family to this.",1260835200,,480,4.420454545454546
1631221,5,B00005NB93,"For me, this is one of a few seasonal classics that must be seen during the Christmas season - nostalgia as well as holiday sentiment and just plain well-done entertainment.  This DVD was just what I expected, for a very good price, and delivered as expected.  I'm very satisfied all the way around!",1260835200,,299,4.622641509433962
1631222,5,B00005NB93,"As his stop animation alter ego, Sam the Snowman, the legendary Burl Ives narrates this sweet and cutesy 1964 classic about how a red-nosed reindeer(voiced by Billie Mae Richard), a toy-making elf who wants to be a dentist(Paul Soles), and a group of misfit toys(voiced by Carl Banas and Corinne Conley) who must all discover their own niches in a world to which they don't easily conform.
 Watching this cute production is an annual ritual in which I, like many, have indulged since childhood. It doesn't seem like Christmas without it. It's rather amusing that in recent years, stores have carried dolls of the beloved figures, which should further promote the film's charming legacy.
 We follow Rudolph from his birth as the son of Santa's(Stan Francis) sleigh team member, Donner( Paul Kligman), and his mate(Peg Dixon), through formative years where the long-hidden secret of his neon nose is revealed, the prejudice he faces, the consolation he receives from the Reindeer Coach's daughter, Clarice(Janet Orenstein), and the delightful friends he finds on his way to self-discovery, such as Yukon Cornelius (Larry D. Mann), and King Moonracer. Even the Aboninable Snowman finds his purpose in the course of this tale, which has captured the hearts, minds, and imaginations of children for 45 years, and whose magic, brightness and delight will continue to do so for many more years to come!",1260489600,,1395,5.114035087719298
1631223,5,B00005NB93,The graphics and coloration of this movie are great.  The story is charming.  It's a winner.,1260489600,,92,4.6875
1631224,5,B00005NB93,"This is such a wonderful movie that your family will love to watch every Christmas. Even as an adult, I love watching this movie.",1259798400,,129,4.416666666666667
1631225,5,B00005NB93,"I admit I might have something of a critical blind-spot with regard to this production, but as I approach my dotage, I find myself stomping my foot and insisting repeatedly that this was the best Christmas-themed show that ever appeared on TV.

The plot concerns the adventures of an unlikely pair:  a disgruntled elf who would rather be a dentist, and Rudolph, who is ostracized from the reindeer community on account of his luminous nose.

What makes it particularly excellent is the theme:  ultimately it's not about the danger that ""Christmas might be canceled!"" but instead about inclusion and the feeling of home, which is what Christmas oughta be about, dagnabit!  The warmth and purpose of the holiday extends to those who consider themselves unloved and outcast misfits.

While the show might seem like a random series of nonsequitur adventures, they are all woven together by this overarching theme.  The entire show is rightly regarded as a classic, and not just because it was made so many years ago.  Musically, visually, thematically:  it all hangs together.

I'm telling you, it's never been outclassed.",1259452800,,1118,5.060109289617486
1631226,5,B00005NB93,My in-laws purchased this title along with several others in a collection. One of my personal favorites that I look forward to sharing with our future children.,1258588800,,160,4.962962962962963
1631227,5,B00005NB93,This is one of the most charming and entertaining movies I have ever seen. I remember it as a boy and it has retained its magic and charm after all of these years. Wonderful family entertainment that I recommend highly.,1258329600,,219,4.5
1631228,5,B00005NB93,"I made a mistake on my order by ordering 3 of the same product when I only meant to order 1; I contacted the seller by e-mail, they didn't respond but I knew they got my message because I was only charged for 1.  I thought it would have been the last of 6 other items to arrive because of the mistake, but it was actually the first.  Thank You...",1257120000,,346,3.9285714285714284
1631229,5,B00005NB93,Too bad computer animation was so new when they did this b/c it's terrible.  The story is pretty good but the should have kept it in line with all the other Rankin Bass and done the stop-motion puppets ... come to thing of it ... they should totally take this exact movie and do just that b/c the animation is that bad.,1252627200,,319,4.145161290322581
1631230,1,B00005NB93,"This is an abomination to the entire film industry and a disgrace and insult to the original 1964 classic. The animation looks like some amateur bought a 'CGI For Dummies' book and made it on their home computer. Like other users remarked there is no texture to the images, the graphics look like something out of a cheap children's video game, in which the paper thin plot would have been more suitable for. Gosh, the 30 second AFLAC commercial that spoofed Rudolph had more production value than this 90 minutes of gutter trash! This had so much potential to be a decent sequel but greed, as always in modern movie making, killed it with a slapped together rush job all for the sake of capitalizing off the Rudolph franchise and the integrity of the original!",1247356800,,761,4.644444444444445
1631241,5,B00005NB93,The service was fast and great and the DVD was in excellent condition. The price was unbelievable! I will order from this Buyer again without hesitation.  Thank you,1244678400,,164,4.857142857142857
1631242,1,B00005NB93,"Nowhere is noted this is Spanish.  The vendor replied they asked Amazon to put the word Spanish in the title but Amazon wouldn't put it in.  So the response I got back is basically tough luck, you should have enlarged the case cover when you were looking at the ad and been able to tell by the words on the case cover shown on the ad picture!  But enlarging it so it is the only ad on your screen still isn't large enough to be able to read the print.  Beware.  The name of the movie is in English in the ad, but the small print on the case is in Spanish, and Spanish is what you get.",1238457600,,584,3.9152542372881354
1631243,1,B00005NB93,"In this ""CBS"" version, they pull out all the snow monsters teeth to tame him. Not because he has a tooth ache. Then Yukon makes fun of the fact that the Snow Monster can't do anything mean any more. That is not the way I, or anyone else I have talked to, remember it. Becareful which version you get because there seems to be a bunch of them.",1236643200,,342,4.044117647058823
1631244,5,B00005NB93,"Our kids love this cartoon and seeing it once every Christmas on television is not enough. I had an old vhs copy that was grainy (getting old and flickering). It was time to just get the DVD to have on hand. Now our 5-year-old wants to see it anytime of year, but both she and our 8-year-old will enjoy it every Christmas, certainly more than once. It's a part of our Christmas movie collection.",1235260800,,395,4.351351351351352
1631245,5,B00005NB93,"This is the version we all remember from growing up in the 60's & beyond. It has all the original music, not the unfortunate ""pop"" replacements I read about in another version of the DVD.",1234310400,,187,4.371428571428571
1631246,1,B00005NB93,We were gifted this movie 2 years ago. It is dreadful. Don't waste your time or money.,1232928000,,86,4.117647058823529
1631247,5,B00005NB93,To me the digital enhancement did nothing to improve the story and made all characters look less soft and kid friendly.,1232496000,,119,4.714285714285714
1631248,5,B00005NB93,"My grandsons, 3 & 4 years old, loved this movie. Burl Ives has this wonderful gravelly talking voice and a sonorous singing voice that made the movie interesting. The animation is old-fashioned for today but the kids didn't mind and the abominable snowman was not too scary.",1232323200,,274,4.851063829787234
1631249,5,B00005NB93,This is the same Rudolph that I used to watch as a kid back in the 80s. My kids love it too.,1231891200,,92,3.227272727272727
1631250,5,B00005NB93,This is the same video that used to be shown on TV around xmas. I watched it over and over when it arrived. A timeless classic!,1231200000,,127,3.923076923076923
1631261,5,B00005NB93,We all grew up watching these wonderful claymations every year. Infact they bring back great childhood memories for most of us. The recordings on DVD are excellent and it is nice to watch these without COMMERCIAL breaks! Now we own them and our future children will watch them if they should disappear from television someday.,1230422400,,326,4.945454545454545
1631262,3,B00005NB93,"They don't make Christmas films like this anymore, and there's probably a good reason for that. ""Rudolph the Red-Nosed Reindeer"" was made in 1964 and I'm sure everything in it seemed perfectly acceptable back then, but by current standards, there are so many politically-incorrect aspects to this film that it is laughable. For example, all of the reindeers on Santa's sleigh are male and the sole purpose of the female reindeer is to stand around and look pretty; or my favourite part, at two points in the film, Mrs Claus tells Santa to eat more because children don't want a skinny Santa.

Having said all of that, I do like ""Rudolph the Red-Nosed Reindeer"" very much. I saw this film many times as a child and loved it then (and no, I didn't end up becoming overweight nor did I end up believing that females are incapable of doing anything useful in life), and as a 27 year old, I still think that ""Rudolph"" is one of the cutest Christmas films there is. Songs abound throughout this film, and as a result, it may seem a bit slow-moving for this generation's children, but there are many far-worse Christmas shows out there. Overall, if you have kids, you should give this film a chance. ""Rudolph"" is a Christmas classic and deserves to live-on for generations to come.",1230163200,,1274,4.6371681415929205
1631263,3,B00005NB93,"They don't make Christmas films like this anymore, and there's probably a good reason for that. ""Rudolph the Red-Nosed Reindeer"" was made in 1964 and I'm sure everything in it seemed perfectly acceptable back then, but by current standards, there are so many politically-incorrect aspects to this film that it is laughable. For example, all of the reindeers on Santa's sleigh are male and the sole purpose of the female reindeer is to stand around and look pretty; or my favourite part, at two points in the film, Mrs Claus tells Santa to eat more because children don't want a skinny Santa.

Having said all of that, I do like ""Rudolph the Red-Nosed Reindeer"" very much. I saw this film many times as a child and loved it then (and no, I didn't end up becoming overweight nor did I end up believing that females are incapable of doing anything useful in life), and as a 27 year old, I still think that ""Rudolph"" is one of the cutest Christmas films there is. Songs abound throughout this film, and as a result, it may seem a bit slow-moving for this generation's children, but there are many far-worse Christmas shows out there. Overall, if you have kids, you should give this film a chance. ""Rudolph"" is a Christmas classic and deserves to live-on for generations to come.",1230163200,,1274,4.6371681415929205
1631264,1,B00005NB93,"I came across this on tv the other day and I was appalled!  The only reason I kept watching it was because I wanted to see who the Toy Taker was.  I cannot believe they tried to continue it in an animated fashion rather than the claymation/stop motion style of the original.  It looked like someone decided one day to write a quick script, and throw things together in time for the holidays.  The quality is just not there.  And they made it an hour an a half long!  I was definitely disappointed.",1229299200,,497,4.290322580645161
1631265,5,B00005NB93,"This stop animation special ultimately is a compelling allegory about the need to deinstutionalize children with disabilities, for the benefit of them--and society.

A reindeer named Rudolph has a physical difference from his peers. Barred from attending reindeer school because of this difference, he ultimately discovers an island where 'misfit toys' with various deformities (a choo-choo with square wheels..etc) have been involuntarily isolated.

Technically they are among their own kind so they should be happy, but they are instead gloomy. Unable to fulfil the role of what a toy SHOULD be doing, they instead feel lonely and punnished--wanting to escape the island and travel with Santa. They know that if they were like 'normal' toys, children would play with them.

Joined by an elf-dentist named Hermey and a prospector named Yukon Cornelius (who does not add much to the story), Rudolph himself saves the day. And he maintains the love of a doe named Clarice who had always loved him for who he was, even when his own family was publically ashamed of his difference.

Finally, it's important to note that Fireball and the other reindeer who teased him as 'children' could not even make Santa's prestigious team. In the end, Rudolph himself enables Santa to continue bringing toys to children around the world.",1229126400,,1321,5.158878504672897
1631266,3,B00005NB93,"This product was listed as New which it clearly was not.  There was no seal and the item was loosely shrink wrapped. The paper dust cover was ripped.  However, this was for my family and not a gift so we kept it.  The dvd played in fine condition and did arrive in a timely manner.  I would caution anyone ordering this item as a gift. Rudolph is still a classic and we all enjoyed it very much",1229040000,,394,4.077922077922078
