,overall,asin,reviewText,unixReviewTime,vote,reviewLength,wordLength
2127813,4,B0002VKZRU,"This an accurate movie of what may take place according to Biblical doctrine. Contrary to films such as Left Behind, Christians are not going to be spared from this by the Rapture. The Rapture takes place after the Great Tribulation according to the Holy Scriptures.",1422144000,,266,4.933333333333334
2127814,1,B0002VKZRU,"Out of consideration for their customers if nothing else, Amazon should point out somewhere--in the blurb would be nice--that this is Christian propaganda. Had they done so, I would not have dropped $3.99 on this POS. But I guess conning people is the only way the godly can get converts.",1422057600,9,288,4.78
2127815,5,B0002VKZRU,Very good and would recommend it to others.,1421884800,,43,4.5
2127816,5,B0002VKZRU,"I really enjoyed this movie. Though it didn't go into a lot of detail it touched on the basic, most important signs of a one world, marshall law government. It gave you just enough to make you want to dig for more and go deeper. I would highly recommend this movie to any Christian, especially in this day and age when the world is getting closer and closer to what this movie was like. I was also very happy to see a lot of the actors from my favorite Christian movies have parts in this one. Mainly The Grace Card, Courageous, and October Baby. They did an amazing job! And T.C. Stallings nailed that evil character like always! All in all a good, short, but thought provoking movie.",1421884800,4,685,4.359375
2127817,4,B0002VKZRU,could be possible any time,1421193600,,26,4.4
2127818,4,B0002VKZRU,"Not a bad move, enjoyed it.",1421193600,,27,3.6666666666666665
2127819,4,B0002VKZRU,"I think that the story of this movie needs to continue being told. The concept is common in many stories both classic and new...that there really are mindsets in our world (across cultures) that seek to control others to the greatest degree possible.
While I feel that the acting and story line of this film was lacking some finer qualities, the story is much like, and just as pertinent as the following stories:
1984
Fahrenheit 451
Six - The Mark Unleashed

What is happening in our world today (especially in our technologically advanced society) is that more and more people are willing to accept the levels of monitoring that enable the control of mass populations. While it may be that no institution nor individual will ever want to assume this sort of control, the fact that we have technologically enabled such a prospect should be troubling to anyone with a will to have free choices. Couple this with our tendency to fear that which we cannot control, it is a recipe for disaster in the hands of institutions or individuals that seek to use those fears to assume more control of society at large.",1420848000,5,1107,4.706185567010309
2127820,5,B0002VKZRU,A very thought provoking movie!,1420588800,,31,5.4
2127821,3,B0002VKZRU,"The substance or message was good, but it was a very low budget movie and terrible acting.  This movie is not even close to the Left Behind movie, but I did like the message, and their thought of how the times would be after the rapture.  Just don't have high expectations.",1420588800,3,273,4.333333333333333
2127822,2,B0002VKZRU,"The plot concept is good, but so poorly executed.  Beyond the lack of character depth, and clumsy scripts, the constant back and forth between the past and ""present"" leave one confused.  There is no reasonable explanation as to why events progressed as they do, nor situations where one can empathize with the characters.  With a well developed plot and character depth this could have been a really good movie.  As it is, it is barely mediocre.",1419811200,5,445,4.815789473684211
2127833,4,B0002VKZRU,Good movie was some thing I could watch with my son.,1419292800,,52,3.8181818181818183
2127834,4,B0002VKZRU,There are some quotable lines about our post 9/11 culture that tie into this end times apocalyptic Christian persecution movie. I don't think I would have ever heard about except for the fact my daughter was an extra in it. I'm glad I saw it and would recommend it.,1419206400,2,265,4.428571428571429
2127835,1,B0002VKZRU,Either the acting is terrible or the characters are poorly written. I can't tell the difference with this movie.,1418860800,4,112,4.947368421052632
2127836,1,B0002VKZRU,No review of movie--  it wouldn't ever play more than a few seconds. Never could get a good signal.,1418774400,,99,4.2105263157894735
2127837,5,B0002VKZRU,A frightening look at the future after the Rapture takes place.,1418601600,,63,4.818181818181818
2127838,5,B0002VKZRU,"If you're sick of the Left Behind movie series or cheesy Christian movies that are inaccurate Biblically or the annoying pre-tribulation vs post-trib rapture grand debate, then WATCH THIS MOVIE PLEASE! This is by FAR the MOST accurate for biblical prophecy and REALISTIC portrayal of the effects of war and future technology.

I like that this movie ignores and skips the whole pre-tribulation rapture perspective that is repeated OVER and OVER in most Christian movies unfortunately. The entire movie does refer to prophecy scriptures that become evident and fulfilled as the movie unfolds. The direction of the plot was clever and had an intelligent sequence twist. Very well done! I won't spoil it. The main lead actors were convincing. I liked Ben Davies, Jennifer Cooper, Michael Ulmer, Lee Garrett and a few others. Unfortunately Eric Roberts is NOT a believable antichrist villain in this movie to be honest.

This movie shows very realistic situations. For example, the government can track people within minutes and in times of government resistance there will always be groups of ""rebels"" with weapons when they see their rights are stripped and forced away by the government. Regardless of your spiritual background, you can imagine this would really happen when watching this movie. Please consider watching this movie even if you don't consider yourself a Christian or a believer of anything.",1417910400,,1405,5.24
2127839,5,B0002VKZRU,Fascinating film starring Ben Davies and Eric Roberts.,1417392000,2,54,5.875
2127840,1,B0002VKZRU,"I had no problem with this being a Christian movie. Christian mythology is as good a source as any for an interesting story. And even though it was clearly low budget it still had some decent performances and non-distracting (i.e., good) camera work and directing.

But I draw the line at 9/11 Truther propaganda, which is what this movie is ultimately about. People who believe that nonsense are pathetic and deserve a certain amount of pity. But they don't deserve your money.",1417305600,6,478,4.829268292682927
2127841,5,B0002VKZRU,"Great movie, didn't want it to end the way it did. Michael Joiner and Benjamin Davies were great, as well as the rest of the cast!",1417219200,4,130,4.038461538461538
2127842,5,B0002VKZRU,"I liked the movie the first time I watched it, but really liked it the second time.  It is relevant, entertaining, twisting, suspenseful all the way through.  I am giving this movie as gifts to people which will hopefully lead to good conversations.  I loved it and my middle school son loved it, too.  Watching it with him allowed us to talk about what is going on in the world today and what might happen in the future!",1416960000,9,421,4.358974358974359
8033378,4,B0002VKZRU,Okay... it's a meaningful storyline,1524700800,,35,6.2
8033379,1,B0002VKZRU,"Bad dialogue, bad acting and weak plot. Another Bible based End Days apocalypse movie that could be entertaining if well done. This movie was neither entertaining nor was it able to convey any sense of believability.",1523836800,,216,5.027777777777778
8033380,4,B0002VKZRU,"Good movie.  This movie is not about special effects.  This movie is about the Future.  What the Bible says in Revelation. Not everything in the movie is accurate regarding Revelation, but it sure gives you an idea of how it will be before Judgment Day. See the big picture:  Sin is our disease.  If you refuse to take the number and follow Christ Jesus = you will be His child and be spared from going to Hell.  The One World Government will not allow you to buy, sell, live in your home, give you food unless you voluntarily take the number.  Do you want to see your family starve?  No!  Food will be one of the greatest hooks to Christians and non-Christians is seeing your loved ones suffer.  All people will have to make a choice.  Would you voluntarily take the number?",1523664000,4,775,4.387323943661972
8033381,2,B0002VKZRU,"Did not like anything about the film and the ending is nonexistent. The film just stops after wasting so much time on nonsense. The acting ranges from passable to awful. Revelations is one of my favorite books in the Bible so I love watching end-time movies, so I was doubly disappointed with this movie.",1523577600,,304,4.648148148148148
8033382,4,B0002VKZRU,"Seems like now,Debit Cards... Just saying, movie was great production or actors wasn't the point the point was the storyline.",1523491200,,125,5.3
8033383,1,B0002VKZRU,"If I could have given it a minus 5, that would not have been low enough. The use of the words ""filthy Christian"" was unvirtuous and filthy writing. Many members of the cast are related to Washington DC political figures  (the Halliburtons to name just one) or insiders and many Americans and abroad know who their gods are and how much they worship them behind closed doors.",1523404800,,374,4.582089552238806
8033384,5,B0002VKZRU,"Beyond the Abrahamic bias, mediocre acting, and poor rendering of actual lust for violence and power, this movis has an EXCELLENT script. The plot, story line and character development are pidgeon-holed into an artificially, unnecessarily forced into a flat understanding of true judeo-christian mythos (think ""zurn enterprise logo"").
The historian kepr saying ""this is bigger than the chip"", yes it is. But it's also bigger than the western ""christian"" perspective. The axial prophets (jesus, socrates, buddha and Lao tzu) are more legends than myths. But they shared one thing in common.  Love each other, forgive each other, be kind to one another and the world will know peace. Salvation comes through: the grace of God,  oneness with the tao, wisdom, or complete detachment. These indicate their different metaphysical underpinnings, but the ethical prescription is the same.

If you can imagine more broadly then what modern Christian religious propaganda presents, then this isn't excellent movie to see. It is probably one of those that I could watch it again and again and again.",1521849600,,1088,5.313953488372093
8033385,1,B0002VKZRU,No point to this movie really.,1520985600,,30,4.166666666666667
8033386,2,B0002VKZRU,"this movie is really just kind of boring, and a lot of the scenes make me roll my eyes. definitely B-rate.",1519430400,,106,4.095238095238095
8033387,4,B0002VKZRU,"While not a Hollywood block buster presentation of the material, it's still a very good effort.. Not perfect, but very good. Will definitely be encouraging others to watch this film. I hope it will itself encourage others to seek the truth in and from God's word, the Holy Bible. Look around you... The things that this movie, and ultimately the Word of God warn us about are already happening. The cornerstone of the, as George H. W. Bush called it, the New World Order, has already been fitted, and the foundations are being are being lain. The Prince of this world and his minions, the Powers that Be, are closer than ever to achieving their goal of a One World Government! Want to know history? Read the Holy Bible (KJV)!!! Want to understand the present? Read the Holy Bible (KJV)!!! Want to know the future? Read the Holy Bible (KJV)!!! I personally suggest starting with Revelations.",1518912000,,890,4.711538461538462
