,overall,asin,reviewText,unixReviewTime,vote,reviewLength,wordLength
2525320,4,B000EOOVMA,Worth the price for Ernest Goes to Africa and Army.  The other stuff is rather pointless.  I didn't think even the movies were as good as some of his others.,1316908800,,157,4.2
2525321,4,B000EOOVMA,The Ernest collection is great as we love watching them. They are a very good family movies that all can watch. They are very funny and I can't keep from laughing all thro the whole thing.,1315872000,,188,4.25
2525322,3,B000EOOVMA,"crazy, zany, weird and anything else you can think of to describe Jim Varney's Ernest. I know he is not to everyone's taste, but he is so damned funny with so many of his Ernest-isms that you can't help but laugh. very good entertainment",1315440000,,237,4.409090909090909
2525323,4,B000EOOVMA,"This is a must have for serious Ernest fans as it contains all his early commercial work where  you get to see Jim Varney actually develop the Earnest character.  And the ""behind the scenes"" portions only prove that Jim Varney is / was a very talented actor and comic that never got the real credit he deserved.",1289433600,,311,4.43859649122807
2525324,4,B000EOOVMA,"This might be the better deal of the Ernest collections.  I had forgotten how much fun the character is, and through these DVD's they revisit his old commercials, tv programming and a couple movies.  Definately worth the modest amount of cash.
There are a few extras on here that are good behind the scenes stuff.  A wise purchase for those that remember this classic character!",1266710400,,378,4.7846153846153845
2525325,1,B000EOOVMA,"I purchased the Ernest collection recently, and was very disapointed. One of the DVDs was very damaged (scratched), so much so that it would not play, the other worked for a short while, but froze and skipped a lot, enough to make it to difficult to enjoy.",1240790400,4,256,4.468085106382978
2525326,5,B000EOOVMA,"Bought for my kids, 10 and 8 years old. They both love any Ernset movie so this was perfect for them.",1240272000,,101,3.857142857142857
2525327,5,B000EOOVMA,Item was shipped in time for Christmas in tip top shape! Great price and relation with seller.  Thank you very much! Very pleased and will do business with you again any time!,1231891200,,175,4.46875
2525328,5,B000EOOVMA,"This is the ultimate collection of Jim Varney's work. It is hard to believe he is no longer with us, he was a funny man, very entertaining. To think he started out making commercials in Nashville, Tn. YEP, his commercial clips are on the disc too including the bloopers and cutouts!
Nice DVD with a nice layout of the contents.",1230422400,,327,4.466666666666667
8111958,5,B000EOOVMA,"A unique style of humor that appeals to all age groups.  While the entire DVD was well worth watching, my favorite part was the collection of commercials.",1511827200,,154,4.703703703703703
8111959,5,B000EOOVMA,"Love Ernest, fast delivery. excellent gift.",1486080000,,43,6.333333333333333
8111960,4,B000EOOVMA,Funny that's all I can say those dvds,1485907200,,37,3.75
8111961,5,B000EOOVMA,Fun movies at a nice price...,1485734400,,29,4.0
8111962,5,B000EOOVMA,Satisfied.,1469836800,,10,10.0
8111963,5,B000EOOVMA,"Memories! I watched all of these movies as a kid. The DVDs are good quality video. Includes some of Jim Varney's best commercials, movies and even his family album. An addition I had never seen before was his commentary on ""the world as I see it"" which we now make our friends sit through and watch because it classic Jim Varney silly humor!! Highly recommend for your family, clean fun a new generation shouldn't miss out on.",1455753600,,426,4.545454545454546
8111964,5,B000EOOVMA,Loved the collection.. Have always been a big fan of Jim Varney..,1454371200,,65,4.5
8111965,5,B000EOOVMA,I call this Ernest goes to the bank !,1453075200,,37,3.2222222222222223
8111966,5,B000EOOVMA,"Turns out we already owned it, Lol, but it will make a great for someone!",1450828800,,73,3.933333333333333
8111967,5,B000EOOVMA,Fast shipping and no problems. Thank you so much!,1448928000,,49,4.555555555555555
