,overall,asin,reviewText,unixReviewTime,vote,reviewLength,wordLength
3575773,2,B001FB55JO,couldn't finish it-kept dropping off,1426550400,,36,6.4
3575854,4,B001FB55JO,"Great movie, shows what a leader is, in times of turmoil, the sacrifices people have made to survive and the best of it, survived. If only I could muster some dignity and not be a lazy butt.",1426550400,,190,4.162162162162162
3575855,5,B001FB55JO,Good,1426464000,,4,4.0
3575856,5,B001FB55JO,Great movie. Great story,1426464000,,24,5.25
3575857,4,B001FB55JO,"Interesting story and well acted parts by all.  As with any ""true"" story done by Hollywood, there were some improbable sequences, but the basic story is powerful and worth watching.",1426464000,,181,5.033333333333333
3575858,5,B001FB55JO,"Good movie, true story. Amazing history",1426464000,,39,5.666666666666667
3575859,3,B001FB55JO,"To just watch the movie for entertainment it was okay, plenty of action.  Basically a feel-good movie showing that some Jews actually did take up arms and did fight back; but lacking in historical accuracy.  The Bielski's were actually Polish Jews, living in pre-war Poland as farmers and millers; I don't think that was disclosed as such.  The war started when Germany invaded into western and northern Poland, and Russia, seeing an opportunity to expand, attacked into eastern Poland.  The Polish civilians, caught in the middle wether Jew or Catholic, were victimized.  The Russians were friends of the Germans until Hitler had other ideas.
The Bielski partisans did help to save about 1,200 people (not all Jews), but in the effort to survive were believed to have killed perhaps over 100 Polish civilians.  If you are curious, research it for yourself.  The post-war follow-up on the lives of the Bielski brothers chose to leave some details out also.  This movie was based on the book, which probably goes into greater detail.",1426377600,,1032,4.994152046783626
3575860,5,B001FB55JO,Nice movie but not deep details about daily stuff,1426291200,,49,4.555555555555555
3575861,4,B001FB55JO,"Was a great movie, just had problems with download and HQ quality.",1426291200,,66,4.583333333333333
3575862,5,B001FB55JO,"I'll keep it simple. I loved the movie and actually wouldn't mind adding this to my personal library. If you want a WW2 themed movie about the struggles of survival and the drama of the world turning its back on you then you can't go wrong with this choice. If you have Amazon Prime then you are in luck because it should be ""free"" to watch. But even then its a steal and this will be a classic in the years to come. Hope this review helped you!",1426204800,,445,4.068181818181818
3575863,5,B001FB55JO,"Best movie I have ever seen. True story, research the brothers after watching.",1426204800,,78,5.076923076923077
3575954,5,B001FB55JO,Great movie.,1426204800,,12,5.5
3575955,4,B001FB55JO,I hadn't heard of these brothers before this movie. I researched them after. Impressive! Well worth watching.,1426204800,,109,5.470588235294118
3575956,5,B001FB55JO,Great movie,1426204800,,11,5.0
3575957,4,B001FB55JO,Intense,1426204800,,7,7.0
3575958,5,B001FB55JO,Excellent. A fine film that should be seen by all....!,1426118400,,54,4.5
3575959,4,B001FB55JO,"Daniel Craig is intense and a solid actor in so many roles.
Simply a great performance in a great story",1426118400,,103,4.2
3575960,1,B001FB55JO,It cut out 3/4 of the way. Could not finish watching it.,1426032000,,56,3.75
3575961,4,B001FB55JO,Always good to remember our past. Acting was terrific.,1426032000,,54,5.111111111111111
3575962,5,B001FB55JO,My wife and I enjoyed the story and the acting was superb!!,1426032000,,59,4.0
3575963,5,B001FB55JO,"inspired movie. We can see how cruel was the men at that time and so the world hasn't changed, people is still killing other people for their skin colour or ethnicity. But violence will never change the days of anyone.",1426032000,,218,4.475
3576043,5,B001FB55JO,it was an absolutely wonderful movie.,1426032000,,37,5.333333333333333
3576044,4,B001FB55JO,Great story,1426032000,,11,5.0
3576045,5,B001FB55JO,Excellent Movie!,1426032000,,16,7.5
3576046,5,B001FB55JO,"Would have preferred a bit more history on the brothers in the beginning, but thought the movie was very well done.",1426032000,,115,4.523809523809524
3576047,5,B001FB55JO,"Interesting , Part of history I wasn't aware of. Well acted.",1425945600,,60,4.545454545454546
3576048,4,B001FB55JO,Very Good movie.,1425945600,,16,4.666666666666667
3576049,4,B001FB55JO,"Based on a true story, it was nice to learn about a historical event that I was unaware of.  The lead actor (and many others) did a great job. I recommend this movie.",1425945600,,166,4.03030303030303
3576050,5,B001FB55JO,Watched it three times!!,1425945600,,24,5.25
3576051,5,B001FB55JO,A really well done movie.,1425945600,,25,4.2
3576052,5,B001FB55JO,A particularly good war movie.  Tells a history few know about.,1425945600,,63,4.7272727272727275
3576073,5,B001FB55JO,"Sobering true story about what happens when freedom is lost. History shows the suffering and sacrifices of those that refuse to submit, & the hard choices, Good lesson to America as we watch our liberties slowly(?) eroding. Great acting, realism, thought provoking. Highly recommended.",1425945600,,285,5.5
3576074,5,B001FB55JO,"I watched this movie with my sister, came home and ordered it.  It is based on a true story and it is a survival tale from beginning to end.  It does not focus on the Nazi's, it focuses on those who survived in spite of the Nazi's. Well acted and worth the watch.",1425945600,,263,3.943396226415094
3576075,5,B001FB55JO,Great movie,1425945600,,11,5.0
3576076,4,B001FB55JO,Inspiring,1425945600,,9,9.0
3576077,5,B001FB55JO,Great show,1425945600,,10,4.5
3576078,4,B001FB55JO,Very well done story especially since it's based on fact.,1425945600,,57,4.8
3576079,4,B001FB55JO,"Excellent, good story line.",1425945600,,27,6.0
3576080,5,B001FB55JO,This is a really good movie,1425945600,,27,3.6666666666666665
3576081,3,B001FB55JO,"It wasn't the worst movie, but nothing really all that memorable.",1425945600,,65,5.0
3576082,5,B001FB55JO,"I have watched this movie several times and always find myself getting drawn into the desperation of the refugees as they try to survive during the dark days of WWII in Eastern Europe.  The fact that this based on a true story makes it even more compelling.  We view the plight of these people from the perspective of knowing the outcome of the war, and it is difficult to imagine how they maintained their positive attitude while anticipating that the war would probably turn out negative for their people.  I guess it just shows us that we must live every day with a positive outlook even in the face of trials and disappointment.",1425945600,,632,4.575221238938053
3576163,4,B001FB55JO,I found this movie very factual and interesting in learning what happened during World Ward II.  I have been wanting to learn from these times to understand our times now!!!,1425945600,,173,4.766666666666667
3576164,5,B001FB55JO,This movie turned out better than I thought it would.  Good prime actors all around.,1425945600,,84,4.6
3576165,5,B001FB55JO,"This is a true story and the movie is great.  An intelligent movie, great acting and dialogue.",1425772800,,94,4.529411764705882
3576166,2,B001FB55JO,Enjoy watching WW2 enactments..,1425772800,,31,7.0
3576167,1,B001FB55JO,recycled same phrases.,1425772800,,22,6.666666666666667
3576168,5,B001FB55JO,Very good movie.,1425686400,,16,4.666666666666667
3576169,5,B001FB55JO,The movie was very good and I don't normally say that too much about movies these days.  It shows us how much the human spirit can endure.  I almost felt guilty watching the movie in my warm hotel room on the cold snowy night.,1425686400,,226,4.113636363636363
3576170,5,B001FB55JO,Love it,1425686400,,7,3.0
3576171,5,B001FB55JO,Great Movie !,1425686400,,13,3.6666666666666665
3576172,4,B001FB55JO,Kept you in suspense throughout the movie.,1425686400,,42,5.142857142857143
3576273,5,B001FB55JO,just amazing,1425686400,,12,5.5
3576274,5,B001FB55JO,Always exciting.,1425686400,,16,7.5
3576275,5,B001FB55JO,"Kept my interest from beginning to end, I think I like any movie with Daniel Craig.",1425686400,,83,4.25
3576276,5,B001FB55JO,Excellent movie.,1425600000,,16,7.5
3576277,5,B001FB55JO,"What a great movie! Tells a story of the era never heard of, who would have know all this occurred in the forest!!",1425513600,,114,4.0
3576278,5,B001FB55JO,Awesome movie,1425513600,,13,6.0
3576279,4,B001FB55JO,interesting and informative.,1425513600,,28,8.666666666666666
3576280,4,B001FB55JO,Really good!,1425513600,,12,5.5
3576281,5,B001FB55JO,Incredible story..well acted.,1425513600,,29,9.0
3576282,4,B001FB55JO,Good movie.  Good acting.,1425427200,,25,5.25
3576363,5,B001FB55JO,Good flick,1425427200,,10,4.5
3576364,4,B001FB55JO,Really liked the movie and really loved the brothers who with determination and bravery saved so many Jewish lives during WW II.,1425427200,,128,4.863636363636363
3576365,4,B001FB55JO,Kept my interest going & building!,1425427200,,34,4.833333333333333
3576366,5,B001FB55JO,Super,1425427200,,5,5.0
3576367,5,B001FB55JO,Excellent historical movie. I liked that it is appropriate for pre-teens with no offensive language or sex scenes.,1425340800,,114,5.388888888888889
3576368,5,B001FB55JO,Excellent movie,1425340800,,15,7.0
3576369,5,B001FB55JO,Very good movie I realy loved it.,1425340800,,33,3.857142857142857
3576370,5,B001FB55JO,Great movie- certainly held your interest,1425340800,,41,6.0
3576371,4,B001FB55JO,Little known piece of history.,1425340800,,30,5.2
3576372,4,B001FB55JO,Good movie,1425340800,,10,4.5
3576462,5,B001FB55JO,Good movie,1425340800,,10,4.5
3576463,5,B001FB55JO,Good movie. Very interesting,1425340800,,28,6.25
3576464,5,B001FB55JO,Enjoyed very much!,1425340800,,18,5.333333333333333
3576465,4,B001FB55JO,Decent action film with plausible plot.,1425340800,,39,5.666666666666667
3576466,4,B001FB55JO,Good movie. Interesting look back in history.,1425254400,,45,5.571428571428571
3576467,5,B001FB55JO,Loved it.,1425254400,,9,4.0
3576468,3,B001FB55JO,good movie,1425254400,,10,4.5
3576469,5,B001FB55JO,"Defiance starring Daniel Craig and Liev Schreiber was very interesting from a historical perspective, as it both explained a perspective and told a gut-wrenching story from WW2 that were completely new to me. The action was simply believable and not overly dramaticized, making it very stark and gripping. Daniel Craig was excellent; he is probably better suited to this role than he is to that of James Bond. Liev Schreiber was quite good, as were several of the other cast members. I have frequently found myself thinking back over this story since watching it several days ago. Something about true stories, and especially true stories of heroism and valor, is so moving in a way that a regular action film can never be.",1425254400,,723,4.8861788617886175
3576470,5,B001FB55JO,Excellent movie.,1425254400,,16,7.5
3576471,3,B001FB55JO,Good movie,1425254400,,10,4.5
3576552,4,B001FB55JO,Worth seeing,1425254400,,12,5.5
3576553,5,B001FB55JO,Great story and we'll done. It has all the action and drama to keep you interested.,1425168000,,83,4.25
3576554,5,B001FB55JO,Part of our history that all people should never forget!,1425168000,,56,4.7
3576555,5,B001FB55JO,A sad time in humanity made only bearable how a persecuted people survived under the worst of conditions.,1425168000,,105,4.888888888888889
3576556,5,B001FB55JO,What to say... it's a good movie acting and story are good. I really liked this movie..,1425168000,,87,4.176470588235294
3576557,4,B001FB55JO,"Historic, the ability of people to survive!",1425168000,,43,5.285714285714286
3576558,5,B001FB55JO,They did a great job capturing how difficult it would have been going through the event.,1425168000,,88,4.5625
3576559,5,B001FB55JO,"I was blown away!! Amazing movie!!!
I was not expecting this movie to be so good!",1425168000,,81,4.125
3576560,5,B001FB55JO,Both my husband and I appreciated the portrayal of this part of history. Very much.,1425081600,,83,4.6
3576561,5,B001FB55JO,Heart renching and powerful!,1425081600,,28,6.25
3576631,5,B001FB55JO,very good movie,1425081600,,15,4.333333333333333
3576632,5,B001FB55JO,Great realistic film about a little known part of World War Two. Feels like you're really out living in the woods and fighting the German Army.,1425081600,,143,4.538461538461538
3576633,4,B001FB55JO,Good action movie. Fast paced. Leadership take many shapes.,1425081600,,59,5.666666666666667
3576634,5,B001FB55JO,Excellent display of sheer will power of a persecuted clan in Europe during the second world war.,1425081600,,97,4.764705882352941
3576635,4,B001FB55JO,I liked and recommend it,1425081600,,24,4.0
3576636,5,B001FB55JO,"Great movie, I never heard of this in studying WWII history,",1425081600,,60,4.545454545454546
3576637,3,B001FB55JO,Good story well presented.  Was not awareof historical basis.,1425081600,,61,5.777777777777778
3576638,4,B001FB55JO,Good movie.,1425081600,,11,5.0
3576639,5,B001FB55JO,well done,1425081600,,9,4.0
3576640,5,B001FB55JO,Great movie.,1425081600,,12,5.5
3576711,5,B001FB55JO,"Zwick does great historical movies Glory,Last Samari,Blood Diamond",1425081600,,66,7.375
3576712,5,B001FB55JO,Fantastic.,1425081600,,10,10.0
3576713,5,B001FB55JO,Who know about this fact of the second world war?  Life affirming.  Visit the Holocaust Museum in Washington; buy a 'Remember stone'.  And see this film.,1425081600,,153,4.8076923076923075
3576714,5,B001FB55JO,A story of courage! Anyone that cherishes freedom and liberty needs to see a film like this to remind us that a price was paid to defeat a dictator.,1425081600,,148,4.137931034482759
3576715,4,B001FB55JO,Great story.,1425081600,,12,5.5
3576716,4,B001FB55JO,Excellent movie for war and history buffs.,1425081600,,42,5.142857142857143
3576717,5,B001FB55JO,You owe it to yourself to watch this movie. You will be glad you did. A true testament of the human spirit.,1425081600,,107,3.909090909090909
3576718,4,B001FB55JO,"Defiance. It's certainly one of those movies that really make you take a look back at history and wonder how they managed to survive the trials and tribulations of life. This movie is one of those profound and moving looks into those pasts. Daniel Craig always does a good job and have yet to see a movie I did not like that he starred in.

The acting in this movie was on par and it was well-directed and choreographed. The camera work was also very good and it really tried to show how difficult things were back then. When I was in college I remember hearing all about Jewish history in my religions class. it's one of those stories that takes a long time to go over and it deserves that much, too. The Jewish history, while very depressing and horrific is one of those histories that people really need to take the time and remember.",1425081600,,837,4.365384615384615
3576719,3,B001FB55JO,good,1424908800,,4,4.0
3576720,4,B001FB55JO,Keeps your interest,1424908800,,19,5.666666666666667
3576771,5,B001FB55JO,We watch the movie every now and then.  Love all the actors and a great message with a historical background.,1424822400,,109,4.45
3576772,5,B001FB55JO,good story,1424822400,,10,4.5
3576773,5,B001FB55JO,This move will never get old the actors play there role well .,1424822400,,62,3.8461538461538463
3576774,5,B001FB55JO,Awesome show and very touching.,1424822400,,31,5.4
3576775,5,B001FB55JO,good,1424822400,,4,4.0
3576776,4,B001FB55JO,It was a good movie that kept me engaged the whole time.  It is also based on a true story.,1424736000,,91,3.55
3576777,5,B001FB55JO,I selected the movie because of Daniel Craig. Very good historical account of the lives of the three Jewish brothers and how they survived and helped save 1200 other Jews.,1424736000,,171,4.733333333333333
3576778,4,B001FB55JO,good movie sad story,1424736000,,20,4.25
3576779,4,B001FB55JO,Very good movie!!!,1424736000,,18,5.333333333333333
3576780,5,B001FB55JO,students loved it,1424736000,,17,5.0
3576850,3,B001FB55JO,Good movie!,1424736000,,11,5.0
3576851,5,B001FB55JO,Really enjoyed the movie,1424736000,,24,5.25
3576852,5,B001FB55JO,Great movie! My whole family loved it.,1424736000,,38,4.571428571428571
3576853,5,B001FB55JO,Amazing movie.. Daniel craig performs very well.,1424736000,,48,6.0
3576854,5,B001FB55JO,Very good movie. These brother are hero's they took care of people through hard times and gave them hope.,1424736000,,105,4.578947368421052
3576855,3,B001FB55JO,"Would probably have rated 3.5 stars. I liked the movie, but didn't think it was great or a must see. I wouldn't watch it again, but kept my interest.",1424649600,,149,4.172413793103448
3576856,5,B001FB55JO,Another Great movie.  Shows what people went through during WWII.,1424649600,,65,5.5
3576857,5,B001FB55JO,Daniel Craig at his best.,1424649600,,25,4.2
3576858,5,B001FB55JO,"Everyone in my family thought it was a great movie. They didn't use the (F) word
every other sentence. That was nice too.",1424563200,,121,4.304347826086956
3576859,4,B001FB55JO,Ok,1424563200,,2,2.0
3576880,5,B001FB55JO,Excellent  movie really heart warming,1424563200,,37,6.4
3576881,4,B001FB55JO,Not much like the actual book....but still a very good story & a true story! One rarely told of how some Jews managed to fight back. Worth watching!,1424563200,,148,4.321428571428571
3576882,3,B001FB55JO,"Decent movie, while I felt at times the movie was a little over the top during some of the action sequences.  Some of the dialogue was predictable too.  But as an Amazon Prime movie it was worth the cost of admission.",1424476800,,217,4.2682926829268295
3576883,5,B001FB55JO,Great deal!,1424476800,,11,5.0
3576884,5,B001FB55JO,Excellent movie. A true story that is nothing short of a miracle.,1424476800,,65,4.5
3576885,5,B001FB55JO,Everyone should see this movie.  Hitler killed almost all jews.  This told how a remnant survived.,1424476800,,98,5.0625
3576886,5,B001FB55JO,Great Movie!,1424476800,,12,5.5
3576887,5,B001FB55JO,Fantastic,1424476800,,9,9.0
3576888,4,B001FB55JO,these people were very tough!,1424390400,,29,5.0
3576889,4,B001FB55JO,Good movie!,1424390400,,11,5.0
3576960,4,B001FB55JO,It is the reality,1424390400,,17,3.5
3576961,5,B001FB55JO,Excellent historical account with superb acting.,1424390400,,48,7.166666666666667
3576962,5,B001FB55JO,Great story-Excellent movie.,1424390400,,28,8.666666666666666
3576963,5,B001FB55JO,This was a really good movie!,1424390400,,29,4.0
3576964,4,B001FB55JO,So enjoyed this movie. Based on a true story it really had a great impact. Something you probably never knew before about WWII.,1424390400,,127,4.565217391304348
3576965,2,B001FB55JO,Just okay,1424390400,,9,4.0
3576966,5,B001FB55JO,Great movie.  More meaningful as it is based on a true story.,1424390400,,61,4.083333333333333
3576967,5,B001FB55JO,What a remarkable true story of survival.  Really makes me appreciate the character of the Jewish people.,1424390400,,105,5.176470588235294
3576968,4,B001FB55JO,Great guy movie!,1424390400,,16,4.666666666666667
3576969,5,B001FB55JO,I enjoyed the first episode.  Looking forward to seeing more.,1424390400,,61,5.1
3577010,4,B001FB55JO,good history,1424390400,,12,5.5
3577011,3,B001FB55JO,"Tough subject matter.  No epic battles or anything. Simply two brothers who set out to help others hide from the Germans with a corresponding narrow story line. The Russians tolerate them and find them useful but seem to prefer to keep them at a distance.  Hiding in the forests in winter is difficult when even the smoke from a cooking fire can give you away.  Weapons and ammo must be sourced from those you defeat. Decent movie, but simply not one I would watch again.",1424390400,,471,4.517647058823529
3577012,4,B001FB55JO,"Based on a true story from WWII.  Since I really enjoy history and would rather see a story based on a real event, I truly enjoyed this movie.  It is hard to beat the truth even though Hollywood normally jazzes things up a bit.  Good acting, too.",1424390400,,246,4.191489361702128
3577013,5,B001FB55JO,Very good story.,1424390400,,16,4.666666666666667
3577014,5,B001FB55JO,"Great movie, especially since its a true story.",1424390400,,47,5.0
3577015,5,B001FB55JO,Good story.  Inspiring.  Daniel Craig's best acting job.,1424390400,,56,5.875
3577016,4,B001FB55JO,"Gritty, engaging story that is made more powerful because it is fact based.",1424390400,,75,4.846153846153846
3577017,5,B001FB55JO,Very well done!!!  Recommended it to friends!,1424390400,,45,5.428571428571429
3577018,5,B001FB55JO,"good movie, it's a topics that we should not forget about.",1424390400,,58,4.363636363636363
3577019,4,B001FB55JO,great movie,1424390400,,11,5.0
3577070,5,B001FB55JO,Daniel Craig delivers a believable and complex portrayal of a forgotten hero of World War II.,1424390400,,93,4.875
3577071,4,B001FB55JO,Nice movie.  Very intense,1424390400,,25,5.25
3577072,4,B001FB55JO,VERY INTERESTING AS TO HOW DETERMINED PEOPLE CAN SURVIVE WHEN ALL ODDS ARE AGAINST THEM.,1424390400,,88,4.933333333333334
3577073,5,B001FB55JO,This was an awesome story and great acting!,1424390400,,43,4.5
3577074,5,B001FB55JO,Well done,1424390400,,9,4.0
3577075,4,B001FB55JO,"Good acting, great movie. True story",1424390400,,36,5.166666666666667
3577076,4,B001FB55JO,Good movi,1424390400,,9,4.0
3577077,1,B001FB55JO,Drags,1424390400,,5,5.0
3577078,5,B001FB55JO,Incredible true story about World War II.  Accurate representation of the Jewish people and their fight against the Germans.  Also showed how Russia was fighting Germans.  Daniel Craig is amazing!,1424390400,,196,5.466666666666667
3577079,3,B001FB55JO,Kinda drags but still ok on a rainy day.,1424390400,,40,3.5555555555555554
3577160,5,B001FB55JO,Excellent movie.  Different perspective of the 2nd world war.,1424390400,,61,5.777777777777778
3577161,4,B001FB55JO,Lot's of emotional  issues get played out.,1424390400,,42,5.0
3577162,3,B001FB55JO,"A bit slow, but not bad",1424390400,,23,3.0
3577163,5,B001FB55JO,I came across this movie by accident and highly recommend for everyone to watch,1424390400,,79,4.714285714285714
3577164,4,B001FB55JO,"Good movie. Excellent cast and good plot.
Being based on a true story makes it that much better.",1424390400,,96,4.388888888888889
3577165,4,B001FB55JO,"Great story, a little slow at times, but overall very enjoyable.",1424390400,,64,4.909090909090909
3577166,4,B001FB55JO,Very intense movie. Made me feel the passion each of the Jewish people may have had to survive the Holocaust.,1424390400,,109,4.5
3577167,5,B001FB55JO,"I watched it when it first came out and it blew me away.  I just got the Amazon Fire TV and added it to my watch list.  Trust me on this folks.  If you like this genre, you will love this movie.  Yes, Craig gave a performance of a lifetime.",1424304000,,240,3.74
3577168,5,B001FB55JO,FANTASTIC STORY.  I sent it to 2 other states to family members who appreciated that particular time in life.  I was lucky enough to get it sent back to me after lots of viewing.  Well received by ALL who viewed this.  Waiting for a long time to see this on a Made for TV Movie.  Worth the watch.,1424044800,,296,4.0344827586206895
3577169,4,B001FB55JO,"A terrific story of bravery and strength. Great acting by lead Daniel Craig, a.k.a. 007 James Bond. A true story that even my history buff husband hadn't heard about before. It held our interest from beginning to end. You won't be disappointed.",1423958400,,244,4.833333333333333
3577210,5,B001FB55JO,Wonderful true story of survival during World War Two. While watching this one you don't even think of Craig as James Bond. WW2 and The Holocaust is fading from today's younger generation. In fact so many of today's young adults don't even believe that the holocaust ever happened. It should be mandatory watching for all high school and college age twerps.,1423872000,,357,4.868852459016393
3577211,5,B001FB55JO,worth watching... enjoyed it very much.,1423785600,,39,5.666666666666667
3577212,5,B001FB55JO,"A movie of strength, determination, and a sheer will to live under extraordinary circumstances. I agree with one of the other reviews: the story should have been told a long time ago. I thought it was well done and kept my interest from beginning to end.",1423699200,,254,4.543478260869565
3577213,4,B001FB55JO,A little predictable but a good story.,1423699200,,38,4.571428571428571
3577214,5,B001FB55JO,This movie was one of the best movies I have seen in a long time really awesome story about survival and the human spirit of mankind. Brilliantly acted too. My daddy fought in this war and he loved it before his death.,1423699200,,218,4.214285714285714
3577215,5,B001FB55JO,"Great movie, great acting. An essential WWII story.",1423612800,,51,5.5
3577216,5,B001FB55JO,Excellent movie.  True story made it better.,1423526400,,44,5.285714285714286
3577217,5,B001FB55JO,"I almost passed over this movie because at first glance the ""cover"" photo looked like it might be just another mindless action movie that offer little beyond lots of noise and violence.  But after reading the description, I decided that might not be the case.
I was very pleasantly surprised how good it turned out to be.  It was a good (and worthy) story with good acting; absorbing, enjoyable and thought provoking.  Afterward I wanted to find out more about the real life people and events that inspired it.  (You can't help but feel admiration for them and sadness for what they endured.)
Beyond the main story, the personalities of the characters and their interactions were also entertaining.  As appalling as the situation was, there was also humor.  ""You annoy me, therefore I exist"".
Definitely one of the better movies I've watched recently.",1423267200,,851,4.916083916083916
3577218,5,B001FB55JO,Very Good,1423094400,,9,4.0
