,overall,asin,reviewText,unixReviewTime,vote,reviewLength,wordLength
3580400,5,B001FB55JO,This a true story of ordinary people doing unbelievable good deeds. It also show people who defied the Germans and helped Jews survive. May G-d bless their descendants.  I attended a meeting with the children and grandchildren of these men. They described their father and uncle  as ordinary people without any unusual talents or intelligence. G-d helped them accomplish this amazing task.,1412467200,,389,5.258064516129032
3580401,5,B001FB55JO,Love it!,1412467200,,8,3.5
3580402,4,B001FB55JO,great actors great story,1412467200,,24,5.25
3580403,5,B001FB55JO,One of the best.  I do not ever want to forget what happens when evil has its way.  The fact that this was based on true event brings it even more home. Moving.,1412467200,,160,3.8181818181818183
3580404,4,B001FB55JO,Good,1412467200,,4,4.0
3580405,2,B001FB55JO,Too slow for me,1412380800,,15,3.0
3580406,4,B001FB55JO,I think this movie was very well acted and presented. I felt I was right there participating in the struggle to survive against all odds!,1412380800,,137,4.52
3580407,4,B001FB55JO,I liked it.  Some slow spots but good overall.,1412380800,,46,4.111111111111111
3580408,5,B001FB55JO,It was very nice and emotional movie. I really like it.,1412380800,,55,4.090909090909091
3580409,4,B001FB55JO,"The best stories are the true stories!  Good story of Jews escaping the killing of them by the Germans, by fleeing into the forests, building a community among the trees for cover .",1412380800,,181,4.484848484848484
3580410,5,B001FB55JO,Saw this many years ago... still think it's one of the best films regarding the despicable era of Hitler.,1412380800,,105,4.578947368421052
3580411,5,B001FB55JO,Awesome,1412380800,,7,7.0
3580412,5,B001FB55JO,Loved this movie. Captivating story.,1412380800,,36,6.4
3580413,5,B001FB55JO,Great movie!  don't miss it!,1412380800,,28,4.6
3580414,5,B001FB55JO,good movie,1412380800,,10,4.5
3580425,5,B001FB55JO,A movie that was both entertaining and touching about the struggle of an oppressed people that survive despite insurmountable odds.  Daniel Craig is truly a gifted actor in this period piece.,1412380800,,191,5.161290322580645
3580426,5,B001FB55JO,My great uncles escaped the nazis and fought them in the forest.  I felt the movie told their story well.,1412380800,,105,4.25
3580427,5,B001FB55JO,Great movie,1412380800,,11,5.0
3580428,5,B001FB55JO,"great movie, everyone should see it",1412380800,,35,5.0
3580429,4,B001FB55JO,This movie provided a new view of history. I teach history and I learned from this very good movie about struggles for survival that were largely forgotten.,1412380800,,156,4.814814814814815
3580430,5,B001FB55JO,Unknown history,1412380800,,15,7.0
3580431,4,B001FB55JO,"A great movie that covers a horrible time in history and shares the true story of four brothers and the 1,200 people they helped survive with them.

Don't be turned off by the R rating.  In my opinion this film could have been rated PG-13.

Don't be thwarted either by the book's cover; it's not as much of an action movie as it is a drama.  The story line is based more around the characters than it is around the war, the battles, etc.  Daniel Craig, Liev Schreiber, and Jamie Bell give excellent and convincing performances.",1412380800,,527,4.447916666666667
3580432,5,B001FB55JO,:),1412380800,,2,2.0
3580433,5,B001FB55JO,Love it worth of watching,1412294400,,25,4.2
3580434,1,B001FB55JO,Not that great movie,1412294400,,20,4.25
3580435,5,B001FB55JO,Being based on a true story it was entertaining and worth watching.,1412294400,,67,4.666666666666667
3580436,5,B001FB55JO,So many unknown heroes.,1412294400,,23,5.0
3580437,4,B001FB55JO,Better than I thought it would be. Recommended!,1412294400,,47,5.0
3580438,4,B001FB55JO,Great period movie,1412294400,,18,5.333333333333333
3580439,3,B001FB55JO,Of historical interest and reasonably entertaining.,1412294400,,51,7.666666666666667
3580440,4,B001FB55JO,"Great telling of a true story from WW2. I believe Liev Schreiber is an under appreciated actor. The subplot between Tuvia and Zus is a good one.
All the supporting actors, although most of them not very well known, played their parts well, making me believe they were either innocent non-combatants or hardened partisans.
If you're a fan of WW2 movies, you need to watch this.",1412294400,,376,4.712121212121212
3580441,5,B001FB55JO,Very realistic - portrayed the hardship these people went through.,1412294400,,66,5.7
3580442,4,B001FB55JO,Starts out a little slow becomes a wonderful however sad story.,1412294400,,63,4.818181818181818
3580443,5,B001FB55JO,Very enlightening and inspiring and based on a true story.,1412294400,,58,4.9
3580444,5,B001FB55JO,"I loved this movie!  Very interesting characters and plot. The acting was fantastic! The story moved well and keeps your attention the whole time.  To think that this was a true story too really pulls at the heart.  It has action, suspense and emotion.  I would highly recommend!",1412294400,,279,4.75
3580455,4,B001FB55JO,"Great film, great drama, great story!",1412294400,,37,5.333333333333333
3580456,5,B001FB55JO,Very good WWII movie about events that you most likely never heard about. Very important facts revealed.,1412294400,,104,5.176470588235294
3580457,4,B001FB55JO,"Daniel is a fantastic actor, the story was capturing.",1412294400,,53,5.0
3580458,4,B001FB55JO,Sad reality of our world and it's a reminder of how nasty humans can be.,1412294400,,72,3.8666666666666667
3580459,4,B001FB55JO,This movie tells the true story of courage and defiance- very sad at times but such a good movie.,1412294400,,97,4.157894736842105
3580460,5,B001FB55JO,Excellent movie. It is definitely a triumph of the human spirit and will to survive. I have seen numerous holocaust movies and this ranks right up there with the best.,1412294400,,167,4.6
3580461,5,B001FB55JO,One of the best movies ever made.,1412294400,,33,3.857142857142857
3580462,5,B001FB55JO,"It was well worth the time.

What else could you ask for?",1412208000,,57,3.75
3580463,4,B001FB55JO,well done,1412208000,,9,4.0
3580464,5,B001FB55JO,Great Movie!,1412208000,,12,5.5
3580465,1,B001FB55JO,Don't you have any latest movie to be shown?,1412208000,,44,4.0
3580466,5,B001FB55JO,Outstanding movie.,1412208000,,18,8.5
3580467,2,B001FB55JO,not a good movie for Daniel craig,1412208000,,33,3.857142857142857
3580468,5,B001FB55JO,"Excellent performances, great historical story, good script, fine photography and special effects.  What's not to like???",1412208000,,121,6.5625
3580469,5,B001FB55JO,Great movie! Well done.,1412208000,,23,5.0
3580470,3,B001FB55JO,Good story and entertaining,1412208000,,27,6.0
3580471,4,B001FB55JO,Very good movie.,1412208000,,16,4.666666666666667
3580472,2,B001FB55JO,too grity,1412208000,,9,4.0
3580473,5,B001FB55JO,Defiance provides information and insight into little known facts rarely identified in movies and literature - the activities of Jewish partisans to combat German war activities.  It is entertaining and also gives credit to two Jewish brothers (played by Daniel Craig and Liev Schreiber) who join the Russian resistance forces to protect themselves and other Jewish non-combatants.  Eventually the brothers emigrate to NY but their story is finally shared with the public through this film.,1412208000,,490,5.52
3580474,5,B001FB55JO,Very good suspenseful movie. It would be a very good movie to have on DVD.,1412208000,,74,4.0
3580485,5,B001FB55JO,Great movie! Loved the cinematography!!,1412208000,,39,7.0
3580486,4,B001FB55JO,Great movie!,1412208000,,12,5.5
3580487,4,B001FB55JO,"Good exposition, progression, gripping story. Daniel Craig really does do a great job.",1412208000,,86,5.6923076923076925
3580488,4,B001FB55JO,"I'm a big fan of Daniel Craig and this film didn't disappoint.  The topical matter, being Holocaust-based, is of course depressing and sad but the acting across the board is fantastic and the cinematography is very nice for this forest-set film.  It's not a feel good movie, but a solid drama.",1412208000,,293,4.7254901960784315
3580489,5,B001FB55JO,It's worth it!,1412208000,,14,4.0
3580490,3,B001FB55JO,"Plodding and fraught with bad accents, Defiance makes an amazing story incredibly tedious to watch.",1412208000,,99,5.666666666666667
3580491,3,B001FB55JO,"""Defiance"" is the definition of real courage.",1412208000,,45,5.571428571428571
3580492,4,B001FB55JO,Amazon prime needs to include a greater volume and variety of new and more popular movies  to improve the options we have. I use my Roku to access amazon prime.,1412208000,,160,4.333333333333333
3580493,5,B001FB55JO,Good movie!,1412208000,,11,5.0
3580494,5,B001FB55JO,Great true story ! I really enjoy and learn so much.,1412208000,,52,3.8181818181818183
3580495,5,B001FB55JO,Very compelling.,1412208000,,16,7.5
3580496,5,B001FB55JO,I thought the movie was good.  I enjoyed it and did not find myself bored at any point in the movie.,1412208000,,100,3.761904761904762
3580497,4,B001FB55JO,Great movie and acting.,1412208000,,23,5.0
3580498,5,B001FB55JO,Great movie,1412208000,,11,5.0
3580499,5,B001FB55JO,Awesome,1412208000,,7,7.0
3580500,4,B001FB55JO,Good,1412208000,,4,4.0
3580501,5,B001FB55JO,Such a great movie! wonder why I didn't know it before. Recommend!,1412208000,,66,4.583333333333333
3580502,4,B001FB55JO,Interesting historical point of view!,1412121600,,37,6.6
3580503,5,B001FB55JO,This movie truly captured the horrible reality of the Holocaust! The story was heart felt and showed bravery to its utmost! It's a must watch!,1412121600,,142,4.72
3580504,5,B001FB55JO,great film.  was looking for something to kill some time.. got 0 work done and very much enjoyed,1412121600,,96,4.333333333333333
3580515,4,B001FB55JO,Gripping...emotional and well acted.,1412121600,,36,8.25
3580516,5,B001FB55JO,Great Movie,1412121600,,11,5.0
3580517,4,B001FB55JO,I'd recommend it. Decent movie and the story line is pretty good,1412121600,,64,4.416666666666667
3580518,4,B001FB55JO,Very good movie. Very informative told a lot of the time in history where not many people knew about with great actors.,1412121600,,119,4.454545454545454
3580519,4,B001FB55JO,Not Craig's best. But good,1412121600,,26,4.4
3580520,5,B001FB55JO,Awesome,1412121600,,7,7.0
3580521,4,B001FB55JO,It a good movie and Daniel Craig was excellent.  Movie is recommended.,1412121600,,70,4.833333333333333
3580522,5,B001FB55JO,Great movie. Shows you what these 2 brothers did and what these incredeble people went through during WW2.,1412121600,,106,4.944444444444445
3580523,5,B001FB55JO,awesome informational movie about that horrible war and the persecution on the jews,1412121600,,83,5.461538461538462
3580524,1,B001FB55JO,It takes a little while to get into it but overall a good movie,1412121600,,63,3.5714285714285716
3580525,4,B001FB55JO,"An Epic Story a true lesson for everyone , an importnant message to all countries of what not to do...
Daniel Craig acting is amazing !",1412121600,,135,4.230769230769231
3580526,5,B001FB55JO,good flick,1412121600,,10,4.5
3580527,2,B001FB55JO,drags in several places.,1412121600,,24,5.25
3580528,3,B001FB55JO,"Not bad, worth watching",1412121600,,23,5.0
3580529,5,B001FB55JO,Good & moving.,1412121600,,14,4.0
3580530,3,B001FB55JO,Good if you like war movies,1412121600,,27,3.6666666666666665
3580531,5,B001FB55JO,Fascinating!,1412121600,,12,12.0
3580532,5,B001FB55JO,"Very cool story concerning bad times.  Well done over all, really gave you a true sense of a sad moment in history.",1412121600,,115,4.2272727272727275
3580533,4,B001FB55JO,Informative and liked it was based on true story.  Just a little violent for me but good,1412121600,,88,4.176470588235294
3580534,5,B001FB55JO,Nice movie,1412121600,,10,4.5
3580545,5,B001FB55JO,"Great Movie, love Daniel Craig.",1412121600,,31,5.4
3580546,4,B001FB55JO,History that should never be forgotten,1412121600,,38,5.5
3580547,4,B001FB55JO,History that I did not know of but am glad that I learned of their bravery.,1412121600,,75,3.75
3580548,5,B001FB55JO,"Very we'll done! Actors/actresses understood the roles they were playing and played them perfectly.  We need movies like this to keep the holocaust in front of people, especially those saying ""it never happened"".",1412121600,,212,5.424242424242424
3580549,4,B001FB55JO,"Well written and acted; lots of tension.  Not exactly a ""fun"" movie but based on something that really happened it was kind of uplifting.",1412121600,,137,4.708333333333333
3580550,4,B001FB55JO,Excellent movie,1412121600,,15,7.0
3580551,4,B001FB55JO,"Powerful message. Excellent acting by the whole cast.  A little more information at the beginning of the film on the ""history"" leading up to this time would've been helpful.",1412121600,,173,4.9655172413793105
3580552,5,B001FB55JO,"Interesting show fighting Jews surprise.!!  They have to fight the Natzies and the Local Fascist
Partisans of their own country.
These are the same
Fascist partisans that supported the Germans in Western Ukraine during WW2 ,the same Ukraine Government (Fascist Nationalist!! In Kiev now!! that we are supporting against The East and Russia!!
Watchdog groups are just now finding their atrocities  on the Eastern Ukrainians.

Maybe Obama should, should skip a game of golf and watch this movie and see the people he supports in Kiev!!",1412121600,,533,5.174418604651163
3580553,5,B001FB55JO,"Great acting, high adventure.",1412121600,,29,6.5
3580554,4,B001FB55JO,Good movie,1412121600,,10,4.5
3580555,5,B001FB55JO,Good movie,1412121600,,10,4.5
3580556,5,B001FB55JO,"This is one of those powerful movies.  It is not an easy one to watch, but it is a good one...

I'm not good at movie reviews, but I will say that it's a war movie that shows people.  When you show the interaction with others, it makes it so much more powerful.",1412121600,,261,3.8867924528301887
3580557,5,B001FB55JO,Great movie plus it was based on a real event,1412121600,,45,3.6
3580558,5,B001FB55JO,Excellent!,1412121600,,10,10.0
3580559,5,B001FB55JO,Craig was amazing.  Very close to what I've read of the real event.,1412121600,,67,4.153846153846154
3580560,5,B001FB55JO,"Amazing Story, Amazing Acting. I have a new respect for both Daniel Craig and Liev Schreiber.",1412121600,,93,4.875
3580561,5,B001FB55JO,outstanding,1412121600,,11,11.0
3580562,4,B001FB55JO,"Good film and Daniel Craig is excellent. It somehow did not evoke the feeling of ""being in the film"" but still much better than the average drama.",1412121600,,146,4.444444444444445
3580563,5,B001FB55JO,"Good movie. Moving, lots of action. Eye opening. Loved it.",1412121600,,58,4.9
3580564,5,B001FB55JO,"Excellent movie, a great history... I recommend!!!",1412121600,,50,6.285714285714286
3580575,5,B001FB55JO,Well crafted movie where you come closer to the human story of survival during the Nazi invasion of Europe.,1412121600,,107,4.684210526315789
3580576,4,B001FB55JO,Good movie,1412121600,,10,4.5
3580577,4,B001FB55JO,Good story,1412121600,,10,4.5
3580578,4,B001FB55JO,Good movie,1412121600,,10,4.5
3580579,5,B001FB55JO,"This is a great movie, with a lot of historic facts. Once you start watching it will keep you glued to the TV screen. It's a movies of tragedy, Sadness and the pursuit of freedom and happiness. Based on events of German vs Jews. I would recommend this movie to any teen to adult. Some material maybe too intense for small children due to some violent scenes.",1412121600,,358,4.358208955223881
3580580,4,B001FB55JO,"An amazing story of perseverance, set during the period leading up to ww ii as the nazis began the enslavement and extermination of the Jewish people's of the area... Really very inspiring and underlines the dangers of socialist behaviors in society and what can happen when citizens have no means of defense from the actions of  their government leaders... Sad, as history has begun to repeat itself with the current disarmament of us citizens today, just like the nazis did... Makes you wonder who the governments target is now...",1412121600,,532,4.977528089887641
3580581,5,B001FB55JO,"A good, engaging, story.",1412121600,,24,5.25
3580582,5,B001FB55JO,Good movie.,1412121600,,11,5.0
3580583,4,B001FB55JO,Nice movie.,1412121600,,11,5.0
3580584,5,B001FB55JO,Great movie,1412121600,,11,5.0
3580595,3,B001FB55JO,Average at best,1412121600,,15,4.333333333333333
3580596,4,B001FB55JO,"Perhaps one of Daniel Craigs' most memorable works.  Oh, I know he has done more spectacular work, but to lend his skill, his effort, and his intensity to a film recalling the indomitable spirit of man in such a time as the Holocaust, I believe, will long be remembered.  See this film....",1412121600,,289,4.538461538461538
3580597,5,B001FB55JO,A+,1412121600,,2,2.0
3580598,5,B001FB55JO,Great movie!,1412121600,,12,5.5
3580599,3,B001FB55JO,Ok movie. But why the fake accents? We get it they are not really supposed to be speaking English. No need forvthe accents in my opinion.,1412121600,,137,4.3076923076923075
3580600,5,B001FB55JO,Touching true story,1412121600,,19,5.666666666666667
3580601,5,B001FB55JO,great movie,1412121600,,11,5.0
3580602,5,B001FB55JO,Loved it...,1412121600,,11,5.0
3580603,5,B001FB55JO,great movie,1412121600,,11,5.0
3580604,5,B001FB55JO,Great story.,1412121600,,12,5.5
3580605,4,B001FB55JO,"Good movie
Lot's of action but interesting plot
Not what I expected",1412121600,,67,4.666666666666667
3580606,4,B001FB55JO,I was brought to tears,1412121600,,22,3.6
3580607,5,B001FB55JO,Very good,1412121600,,9,4.0
3580608,4,B001FB55JO,Good movie. Made you think of how tough it was during the war.,1412121600,,62,3.8461538461538463
3580609,4,B001FB55JO,True story - well told,1412121600,,22,3.6
3580610,5,B001FB55JO,This was a story I'd never heard. Daniel Craig and the entire staff do an amazing job portraying the struggles and terrors faced by Jews fleeing the advances of the German army. Based on a true story.,1412121600,,200,4.4324324324324325
3580611,5,B001FB55JO,Everyone should see this movie and how it relates to the current events in the middle east.,1412121600,,91,4.411764705882353
3580612,4,B001FB55JO,Good story,1412121600,,10,4.5
3580613,5,B001FB55JO,Excellent story about a historical event I knew nothing about. Amazing movie.,1412121600,,77,5.5
3580614,5,B001FB55JO,Decent acting with an inspiring story based on events during WWII,1412121600,,65,5.0
3580625,5,B001FB55JO,Excellent!,1412121600,,10,10.0
3580626,5,B001FB55JO,"compelling drama, real heroism",1412121600,,30,6.75
3580627,2,B001FB55JO,I don't like it.,1412121600,,16,3.25
3580628,5,B001FB55JO,Good movie,1412121600,,10,4.5
3580629,4,B001FB55JO,Good story,1412121600,,10,4.5
3580630,4,B001FB55JO,"Good action, story line and quality.  Not sure how accurate, but supposed to be based on a true story.  Interesting perspective from a horrific time.  Enjoyed the movie and felt it was worth watching.",1412121600,,200,4.823529411764706
3580631,5,B001FB55JO,Outstanding!,1412121600,,12,12.0
3580632,4,B001FB55JO,I love true stories and this one really showed me another side of the story,1412121600,,75,4.066666666666666
3580633,5,B001FB55JO,"Based on actual events, was great to watch.",1412121600,,43,4.5
3580634,5,B001FB55JO,Excellent movie. Every war has it own heroes. Three bothers that figth and save 1200 lives.,1412035200,,91,4.75
3580635,5,B001FB55JO,important part of history,1412035200,,25,5.5
3580636,4,B001FB55JO,The story stays with you for a while,1411948800,,36,3.625
3580637,5,B001FB55JO,"You can read other reviews, as this is a great movie!",1411948800,,53,3.909090909090909
3580638,5,B001FB55JO,Great movie,1411948800,,11,5.0
3580639,4,B001FB55JO,"The movie was well made. I will not give war 5 stars though the movie deserves it. Great cast, sound effects were a bit off but what can you expect from people in the movie industry that have never been in combat. The movie was hard to watch in places for me being retired military, the carnage is pretty close to what you would see, something you never want to see, even if you think you are curious. Protect your own, finish the mission.",1411862400,,439,4.238095238095238
3580640,5,B001FB55JO,"Amazing. I was reading some of the negative reviews and was anticipating to see a standard ""holy wood"" production of good Vs. evil. leaving out all of the sticky dirty elements of war. After watching the film I did not find this to be the case. Quite the opposite. War is a nasty, dirty, filthy, human sickness. Humans do what it takes to survive and this movie portrays it very honestly. Calling the heroes of this movie thugs because they played by the same rules that everyone else did, just shows an underline bias.
Watch the movie and decide for yourselves the critics are wrong!",1411862400,,584,4.571428571428571
3580641,5,B001FB55JO,"I saw this film before on another website!  It is thrilling, disturbing, enthralling, inspiring and just plain earthy with strong performances by so many actors and actresses that it would take a very long list to name them all!  Plus the pyrotechnics and armorers, technical military advisors were spot on regarding German Infantry tactics as well as Panzers were given full measure for their training and proficiency.  Partisans played a major role in the conflict long before D-Day!  We must never forget their guts and sacrifice in the face of almost certain death.  This story needed to be told and I am glad to learn about it, which sheds a whole new perspective on Jewish Resistance to Nazism!",1411862400,,700,4.898305084745763
3580642,5,B001FB55JO,"Very long movie, but you to watch it. It starts off very strong, gets pretty slow and then ends like a symphony!",1411862400,,112,4.136363636363637
3580643,4,B001FB55JO,Good movie. Praise God for saving the Remnant! All the future generations have been Blessed because these people took a stand&fought for their lives&the lives of their fellow human beings no matter the cost or the odds. They held on to their Hope&Faith and Overcame adversity in order to Live&Rise Above the atrocities being perpetuated during that time in history.,1411862400,,365,5.1
3580644,1,B001FB55JO,"POORLY ACTED, WRITTEN, AND PRODUCED.  ''B'' MOVIE LEVEL.",1411776000,,56,6.0
3580655,5,B001FB55JO,Very good movie.heart wrenching and dramatic. Loved it!,1411776000,,55,6.0
3580656,5,B001FB55JO,"Amazing screenplay, scenery, and storyline. Loved it!",1411689600,,53,6.714285714285714
3580657,4,B001FB55JO,"a good movie. a real story, good act, good storyline, it moves every one whoever watch it.",1411689600,,90,4.352941176470588
3580658,4,B001FB55JO,It is sad but still I agree Daniel Craig was good in this movie,1411689600,,63,3.5714285714285716
3580659,5,B001FB55JO,Well done!!!!,1411689600,,13,6.0
3580660,4,B001FB55JO,Great movie!,1411689600,,12,5.5
3580661,3,B001FB55JO,"A story worth telling, but too often the scenes seemed so screened, so typical, so is there a crowd of prototypes out there? Daniel Craig seemed almost wooden in this movie. No one took ownership of this film. Seemed like just a job.",1411689600,,233,4.441860465116279
3580662,5,B001FB55JO,"Based on a true story of Jewish brothers in Belorussia that secreted fellow Jews, about to be exterminated by the conquering Nazis, into the forest, where they established a viable community for years. The characters are powerfully portrayed, running the gamut of emotions - fear, love, lust, revenge, - with mesmerizing cinematic depiction of their times and conditions. The virtues and faults of a communal society are an underlayment that  winds throughout. Viewer discretion is advised for the graphic depictions of the atrocities of war and personal combat.",1411689600,,562,5.386363636363637
3580663,3,B001FB55JO,"Not terrible, but not good. One of those war movies you watch to kill time on a sick day.  First movie I've seen showing Jewish people fighting back against the Germans, so that was interesting.",1411689600,,194,4.542857142857143
3580664,5,B001FB55JO,"My only criticism would be that the passage of time was not portrayed well . The original  people in the forest suffered horrific hardships due to the living conditions, I don't know how any of them survived the holocaust .
I would watch it again and hope my Grandchildren  will too.",1411689600,,283,4.529411764705882
3580665,4,B001FB55JO,Hard to believe that this was the reality for people not too long ago. Amazing triumph threw tragedy. God bless American...,1411689600,,123,4.904761904761905
3580666,2,B001FB55JO,The story looked like it would be very good but it started out with crude and  vulgar language which I object to so I stopped immediately. I will watch it later when I can filter out the objectionable parts.,1411689600,,207,4.3076923076923075
3580667,5,B001FB55JO,"Daniel Craig and company are great!  Parts are hard to watch, but should be seen.  We need increased sensitivity to the plight of of people today in similar situations.  The world cannot sleep while atrocities occur.",1411689600,,216,4.944444444444445
3580668,5,B001FB55JO,Great movie and true story too.,1411689600,,31,4.333333333333333
3580669,1,B001FB55JO,Awful,1411689600,,5,5.0
3580670,5,B001FB55JO,Awesome movie,1411689600,,13,6.0
3580671,4,B001FB55JO,Very interesting story of a piece of WWII history that I had never heard about. Well presented by a great cast and production team.,1411689600,,131,4.5
3580672,5,B001FB55JO,excellent thought provoking movie especially for people who lived during that period.,1411689600,,85,6.166666666666667
3580673,3,B001FB55JO,It's a decent movie,1411689600,,19,4.0
3580674,5,B001FB55JO,This movie was really great. Can't believe this story wasn't told sooner. Highly recommend.,1411689600,,91,5.571428571428571
3580685,5,B001FB55JO,One of the best WW II movies I have watched! Daniel Craig and Liev Schreiber stole the show with their brilliant acting. The powerful emotions between the brothers and the will to survive..,1411603200,,189,4.757575757575758
