,overall,asin,reviewText,unixReviewTime,vote,reviewLength,wordLength
3567109,5,B001FB55JO,"Belorussia in 1941. Germans and local collaborators hunt Jews. The Bielski brothers, in civilian times apparently not really choir boys, escape into the forests and attract followers, other refugees, who are desperate for help. A camp in the forest, an unsteady symbiosis with Russian troops nearby. Raids for food can't avoid getting noticed by the German army, whose attacks follow; the camp has to run. The refugees find another location for a camp. Apparently based on true events.

The film is about big subjects: strategy, leadership, discipline, solidarity. No surprises,just basic constellations and human conflicts. Wonderful cinematography. Solid work by Mr. Zwick (who apparently has a personal relation to the real Bielskis; family?). Good show by Mr. James Bond as Tuvia Bielski; the other actors do well too (but I don't know them).",1230940800,35,846,5.360902255639098
3567110,3,B001FB55JO,"Director Edward Zwick likes his epic war films full of tragedy and thick accents. With Defiance he's chosen a seldom explored true story of Jewish rebels fighting back against their Nazi aggressors in the Belarusian forest; but even with the stage set for heart-wrenching drama and tragic wartime attrition, the film can't quite manage enough emotionally engaging pathos for its band of oddly anti-heroic protagonists.

After escaping Nazi-occupied Poland during the onset of World War II, three Jewish brothers, Tuvia (Daniel Craig), Zus (Liev Schreiber), and Asael Bielski (Jamie Bell) flee to the Belarusian forest where they encounter several other refugees. After numerous casualties from hasty attacks on German soldiers, Tuvia decides that revenge be substituted for survival and begins constructing a village in the forest to shelter his comrades and the growing influx of Jews fleeing Poland. Zus, opposed to Tuvia's more peaceful tactics, opts to join Russian partisans operating nearby, but fate and a common enemy will find their paths crossing once again.

Defiance certainly feels like an Edward Zwick film, full of heavy dramatic action, sweeping epic conflicts and historical significance. But like his other political and war driven films (Blood Diamond and The Last Samurai) Defiance falls short of being something truly special due to a lack of investment with the characters. The settings, costumes, cinematography and acting are all first rate, but the development of lead roles and even supporting characters leaves something to be desired, especially when the end of the film abruptly rolls around and great revelations or emotional moments are curiously absent.

Defiance is a lesser known chapter from the melting pot of World War II movies and gains points for bringing to our attentions the horrors and triumphs of a band of survivors who achieved the impossible. But like the middle part of a trilogy, the film is paced and concludes anticlimactically like a piece of a much larger plot - one that must struggle to get to the action, and then loses steam as it heads toward the inevitable afterward events summaries. Without tearjerker moments and characters that don't push enough emotional buttons, Defiance is a film that is likely to remain as obscure as its subject matter - a historically powerful chapter that could have been better represented.

- The Massie Twins",1230768000,5,2400,5.258485639686684
3567111,4,B001FB55JO,"True to its advertising claims, ""Defiance"" tells a story I've never heard before: That of the Bielski Partisans, a Jewish rebellion from Poland that rallied against Nazi occupiers at the height of World War II. Originally founded by the remaining sons of the Bielski family, it soon ballooned into an organization consisting of thousands of people, all freed from local Jewish ghettos. They struggled to survive in the Belarussian forests, facing starvation, disease, and exposure to the elements. Their story was documented in the book ""Defiance: The Bielski Partisans"" by Nechama Tec, and this is the basis for the Edward Zwick's film. I give him credit for directing and co-writing a compelling story in which core human emotions are at odds with basic survival skills; in any such scenario, one must decide whether forgiveness, fairness, and tolerance is more important than staying alive.

In spite of its subject matter, ""Defiance"" is far from a perfect film. A lot of it felt like an adaptation, which is to say that it relies too heavily on war movie clich&eacute;s like melodramatic dialogue and overt symbolism. I was especially wary of a death scene late in the film; with his last breath, he turns to Daniel Craig's character and says, ""I had almost lost my faith. But you were sent by God to save us."" Does this not seem contrived? It's second only to obvious visual statements for hope and redemption, as when sunshine bathes the partisans after weeks of harsh winter conditions, or when they all trudge across a swamp in the same way Moses and his chosen people trudged across the parted Red Sea. The creativity and technical merits of such moments are overshadowed by the sense that they don't belong.

Still, the drama is persuasive, and the performances are decent given the material they had to work with. Craig, Liev Schreiber, Jamie Bell, and George MacKay portray Tuvia, Zus, Asael, and Aron Bielski, four brothers from West Belarus who lost their parents soon after the Germans invaded. Aron is virtually ignored in the film, and whenever he is featured, he mostly remains quiet and unassuming. The other three, however, are given very distinct personalities, all of which add to the drama and make the story much more personal. Tuvia, for example, is initially angry over the deaths of his parents, and he personally tracks down and kills the Germans responsible. But it isn't long before he realizes how wrong his actions were, and he spends the rest of the film trying to convince himself that the best revenge is mere survival. He also believes that everyone in hiding deserves equal portions of food and must do their fair share of work; this puts him at odds with certain survivors, who feel that those working harder deserve better treatment.

Zus, on the other hand, remains angry throughout the entire film. He doesn't agree with Tuvia's more forgiving philosophy--he wants revenge, plain and simple. Because he doesn't get along with his brother, he decides to join a militant group of Soviet partisans also at odds with the Nazis. And as for Asael, the film focuses more on his romance with a young girl named Chaya (Mia Wasikowska), who in real life held the rare distinction of being a high school graduate.

Having now done a little research on the subject, I'm surprised at just how much Zwick left out of the screenplay. One of the biggest controversies surrounding the film is the omission of the 1943 Naliboki Massacre, which resulted in the deaths of 128 people. The Bielski partisans were accused of taking part in this alongside Soviet partisans. The fact that many historians deny their involvement should be of no consequence; an event so monumentally tragic should at least be acknowledged as having happened. I'm well aware that a film can only hold so much material before it gets unbearably long, but the way I see it, the Naliboki Massacre is too important to have overlooked.

There are also a few logistical issues that seemed to have slipped under the radar, such as the fact that so many of the partisans are never in short supply of alcohol. Where are they getting this alcohol from, and why is it easier to get than food? This doesn't seem very plausible.

Despite these problems, ""Defiance"" is still worth recommending, mostly because the performances are believable. It has its other good points: the cinematography is top notch, revealing the squalor the partisans had to live in; James Newton Howard's score is both solemn and exciting, a combination of violin dirges and piano solos; the struggle between survival and vengeance is convincing, especially during a scene in which a Nazi is captured and made to face the wrath of the partisans. I see this film as an introduction of sorts, a way to let the public know that it's based on actual events. Now that we know, I think it would be wise for another filmmaker to tell a more accurate story, one that doesn't have to rely on traditional war movie clich&eacute;s to send the audience a message.",1230681600,5,5009,4.859484777517564
3567162,1,B001FB55JO,Did not order,1514764800,,13,3.6666666666666665
3567163,5,B001FB55JO,Great movie! Daniel Graigs best acting. Live Shreiber was also very good.,1512259200,,73,5.166666666666667
3567164,5,B001FB55JO,excellent,1510704000,,9,9.0
3567165,4,B001FB55JO,nice,1509753600,,4,4.0
3567166,4,B001FB55JO,good,1509408000,,4,4.0
3567167,5,B001FB55JO,Thanks,1508716800,,6,6.0
3567168,5,B001FB55JO,Great movie loved the story behind it as well.,1508630400,,46,4.222222222222222
3567169,5,B001FB55JO,"Excellent product, quick delivery",1506297600,,33,7.5
3567170,5,B001FB55JO,Wonderfull movie,1505692800,,16,7.5
3567171,5,B001FB55JO,Fantastic story.,1504224000,,16,7.5
3567212,5,B001FB55JO,Great Movie,1502668800,,11,5.0
3567213,1,B001FB55JO,received item. tried it on 3 blue ray players. all said disc is empty. Would lave loved to seen the movie. Not worth paying to send back. Me lost.,1502582400,,146,4.068965517241379
3567214,4,B001FB55JO,Good story based on true events,1501372800,,31,4.333333333333333
3567215,5,B001FB55JO,I'm a fun of Daniel Craig and this is one of the best movies he plays a hero.,1501027200,,77,3.3333333333333335
3567216,5,B001FB55JO,Great movie,1500940800,,11,5.0
3567217,5,B001FB55JO,Excellent story.  Could not wait to show it to my grandchildren.  Very close to reality without looking like a documentary.,1499212800,,123,5.1
3567218,5,B001FB55JO,"A very engaging movie, I watched it with 2 friends, one who had seen it before and the other from Belarus. They both had lots of comments and it opened my eyes to a history that I knew nothing about.",1497830400,,199,4.0
3567219,1,B001FB55JO,Dvd didn't play. Had to return it. I was not happy.,1497312000,,51,3.727272727272727
3567220,1,B001FB55JO,very nice,1496793600,,9,4.0
3567221,5,B001FB55JO,A great movie.,1495584000,,14,4.0
3567252,5,B001FB55JO,"I liked the true movie very much that I watched it twice. I was online with in a date service with someone in Denver & she told me about the movie. I gave her a tip on a true war movie, ""Escape from Sobibor.""  I just missed the movie when it came out, but it was very good!!!",1494720000,,275,3.7413793103448274
3567253,5,B001FB55JO,Awesome movie! Highly recommend!,1493769600,,32,7.25
3567254,4,B001FB55JO,Great Movie!,1493683200,,12,5.5
3567255,3,B001FB55JO,no one of his best. but ok.,1493424000,,27,3.0
3567256,5,B001FB55JO,Wonderful heartbreaking story well told with fabulous acting.,1492646400,,61,6.75
3567257,5,B001FB55JO,Thanks,1492560000,,6,6.0
3567258,1,B001FB55JO,DVD won't play. They sold me one that is not formatted for US DVD players.,1492473600,,74,4.0
3567259,1,B001FB55JO,Bought the wrong region.  Here's my sign.,1492214400,,41,4.857142857142857
3567260,5,B001FB55JO,"Saw this on Netflix. Incredible movie, and incredible true story. The movie is about the Jewish brothers that sacrificed their own safety to help save other Jews. The movie feels very real. From the emotions, to the gun battles. You are definitely feeling this was well made. Daniel Craig does a very good job with a Eastern European accent, and acting.",1492041600,,353,4.80327868852459
3567261,5,B001FB55JO,My mother was with Belski .  I cannot be objective here.,1490486400,,56,4.090909090909091
3567282,5,B001FB55JO,"Daniel Craig as James Bond-an adequate and acceptable 007. Daniel Craig as Tuvia- a tour de force and brilliant portrayal. This is a movie that needs to be seen by all. YES, there were Jews that fought like their biblical brethren. God bless them.",1490400000,,247,4.636363636363637
3567283,4,B001FB55JO,Great product at good price.  Fast shipping.,1489881600,,44,5.285714285714286
3567284,5,B001FB55JO,Excellent Product!  Excellent service!  Thank you!,1489190400,,50,7.166666666666667
3567285,4,B001FB55JO,Good movie. I like true stories.,1488585600,,32,4.5
3567286,5,B001FB55JO,Great movie from WW2 time period.,1488240000,,33,4.666666666666667
3567287,5,B001FB55JO,really nice,1487635200,,11,5.0
3567288,5,B001FB55JO,A real good action movie,1487635200,,24,4.0
3567289,5,B001FB55JO,Great Movie,1486598400,,11,5.0
3567290,5,B001FB55JO,007 & Ray Donovan did a great job in this movie!,1486339200,,48,3.4545454545454546
3567291,4,B001FB55JO,Really?  Who doesn't like Daniel Craig??,1485388800,,40,5.666666666666667
3567352,5,B001FB55JO,Great war movie. Exceeded my expectations. I had not heard much about this movie but enjoyed the characters and a bit of history that I didn't know about.,1485388800,,154,4.535714285714286
3567353,5,B001FB55JO,"Great action movie, i appreciate true story movies like this.  Daniel craig is awesome.",1485216000,,87,5.214285714285714
3567354,5,B001FB55JO,Great film.,1484092800,,11,5.0
3567355,5,B001FB55JO,a good movie.,1483833600,,13,3.6666666666666665
3567356,3,B001FB55JO,Ok,1483833600,,2,2.0
3567357,4,B001FB55JO,"A little known historical fact brought to life by this movie. You can make a nice prophetic connection with the Exodus of the children of Israel from Egypt, their passing of the Red Sea (which is correctly translated as Yam Suph or the Sea of Reeds) and their plight in the wilderness. If you want to better understand this prophetical connection, I highly recommend the book Yam Suph- Israel's Final Exodus by Steven DeNoon.",1483747200,,425,4.756756756756757
3567358,5,B001FB55JO,Love this film.,1483401600,,15,4.333333333333333
3567359,5,B001FB55JO,Great story.,1483401600,,12,5.5
3567360,5,B001FB55JO,Great Movie!  Proud of the Jewish resistance.  More stories need to be told of Jewish bravery in World War II,1483315200,,109,4.4
3567361,5,B001FB55JO,I read the book about the Bielsky brothers and I have to say that this movies is pretty close to the book.  I enjoyed watching this movie.,1483142400,,138,4.111111111111111
3567382,5,B001FB55JO,Just like my family.,1482192000,,20,4.25
3567383,1,B001FB55JO,Okay,1480204800,,4,4.0
3567384,4,B001FB55JO,"Great movie
Truly a touching story based on a true story.",1479427200,,57,4.2727272727272725
3567385,5,B001FB55JO,Great movie,1478995200,,11,5.0
3567386,5,B001FB55JO,Exactly as described and shipped promptly,1478649600,,41,6.0
3567387,5,B001FB55JO,great movie,1478563200,,11,5.0
3567388,5,B001FB55JO,Great movie and how the brave Jews survived.,1478044800,,44,4.625
3567389,5,B001FB55JO,The iten arrived on time and as described.,1476921600,,42,4.375
3567390,5,B001FB55JO,Very moving.,1476921600,,12,5.5
3567391,5,B001FB55JO,Great movie with historical relevance.,1476748800,,38,6.8
3567462,5,B001FB55JO,Came early and is a great movie.,1476662400,,32,3.7142857142857144
3567463,4,B001FB55JO,Good movie,1476316800,,10,4.5
3567464,5,B001FB55JO,It is an amazing story . The movie is very close to the real story.,1475798400,,67,3.533333333333333
3567465,1,B001FB55JO,"Human's have tremendous potential to create 'heaven on earth', but you wouldn't know it by studying human history. There's always a very tiny fraction demonstrating human potential to the rest but the rest seldom rise to their own potential because essentially they do not challenge their limited concepts and beliefs and instead, follow the ways of their traditions based on animal instinct - 'survival of the fittest or the more clever'. Making themselves pathetic
in the process. This movie only proves these reflective assertions. I so wish it were otherwise and one day, it shall be, once humanity tires of its own pathetic behavior.

Here you see a group of people surrounded by a forest of wild, eatable plants, believing there is nothing to eat! I ask you, how pathetic is that?!
We are here to learn how to love unconditionally and as a species, we are failing miserably. Time for divine intervention. Are you ready to open your heart in the fullness of love? If so, you are part of the solution and I thank you for your service. If not, you are part of the ongoing problem and the greatest thing you could do at this time is simply to be quite, get out of the way and learn from the more courageous and I thank you for your service in that way.",1474934400,,1254,4.573333333333333
3567466,5,B001FB55JO,Great movie,1474848000,,11,5.0
3567467,5,B001FB55JO,"This is one of those movies that you can only watch every so often, but when you do it reminds you of the very first time that you saw it. While is not a completely accurate representation of the events that took place in the Russian forest, it gives the viewer some insight into the harsh and nasty conditions that this group of Jewish citizens had to endure for their freedom. The Beilski brothers went to great lengths to keep themselves, their neighbors and total strangers out of the hands of the Nazi party, and the Russian people who supported the Nazi efforts. It is a compelling story of love, strength, compassion, and basic human nature to protect one's self, and those around you that are suffering the same fate. While the movie does not depict the actual number of Jewish citizens that the Bielski brothers saved, it was roughly 1,200 people, it shows how they all learned to work together, and to provide the basic human needs. This group of people came together for the greater good of themselves, and eachother. It is a compelling story, with great actors and actresses telling a very little known story of the Holocaust through the eyes of the Russian Jews. The viewer gets to see some of the realities that faced the Jewish nation outside of Germany and the surrounding areas during WWII. It is a great watch, and I would recommend this to anyone wanting to see another side of WWII.",1473724800,16,1402,4.612
3567468,5,B001FB55JO,"Amazing story, and told with such realistic scenes",1473552000,,50,5.375
3567469,5,B001FB55JO,Nice addition,1473465600,,13,6.0
3567470,4,B001FB55JO,It did pretty good job to portray how the people in that country suffered during the WWII era in Eastern Europe.,1472860800,,112,4.380952380952381
3567471,5,B001FB55JO,Great price quick delivery,1472774400,,26,5.75
3567497,5,B001FB55JO,It puts a face on a piece of history,1472342400,,36,3.111111111111111
3567498,5,B001FB55JO,Well written and directed movie. Broke my heart to again be reminded of the Holocaust.,1472342400,,86,4.8
3567499,5,B001FB55JO,Well expressed movie with the right actors.,1471737600,,43,5.285714285714286
3567500,4,B001FB55JO,I am a Daniel Craig fan and I thought this was a very good movie.,1470873600,,65,3.4
3567501,5,B001FB55JO,Great movie,1470700800,,11,5.0
3567502,5,B001FB55JO,"Great story, great acting all around.",1470009600,,37,5.333333333333333
3567503,5,B001FB55JO,A great movie performance by Daniel Craig!,1469059200,,42,5.142857142857143
3567504,5,B001FB55JO,this is such a great movie!!,1468454400,,28,3.8333333333333335
3567505,4,B001FB55JO,Entertaining.  Didn't know about this group of resistance in WW2.,1468022400,,65,5.5
3567506,4,B001FB55JO,Entertaining!,1467417600,,13,13.0
3567547,5,B001FB55JO,Daniel Craig is awesome!,1467331200,,24,5.25
3567548,5,B001FB55JO,Good Buy--great film,1467158400,,20,6.0
3567549,5,B001FB55JO,Nothing,1466985600,,7,7.0
3567550,5,B001FB55JO,"This is one of my favorite movies about WW2.  It is technically excellent, a compelling true story and always pushes me to live a braver life.  I love what Tuvia Bielski said, speaking to the gathered Jews who wanted to suicidally engage the Germans for revenge:  ""Our revenge is to live!""",1466812800,,289,4.627450980392157
3567551,5,B001FB55JO,"It is my first Daniel Craig movie and I regret that I have not seen his past movies. He is hilarious! As for the movie itself it is also powerful and hilarious. It might be ""loosely"" based on a true story, however; the fact that the Bielski brothers led more than 1200 people and survived is enough for the credibility of this movie.",1465603200,,333,4.301587301587301
3567552,4,B001FB55JO,Compelling story told well about an incredible journey for people fleeing Nazi Germany.,1465603200,,87,5.769230769230769
3567553,5,B001FB55JO,"well done story, very moving",1464912000,,28,4.8
3567554,4,B001FB55JO,A tense film...good acting... strong dialogue.,1464566400,,46,6.833333333333333
3567555,5,B001FB55JO,Totally met expectations,1463788800,,24,7.333333333333333
3567634,5,B001FB55JO,Good movie. Learn about the Jewish resistance,1463356800,,45,5.571428571428571
3567635,5,B001FB55JO,This was an absolutely excellent film.,1462579200,,38,5.5
3567636,5,B001FB55JO,What a great story and movie.  It shows just how bad it was and the will to survive.  War is always so ugly and inhuman.,1462579200,,120,3.76
3567637,2,B001FB55JO,Not what I was expected. Disappointed,1462406400,,37,5.333333333333333
3567638,2,B001FB55JO,Poor acting and a-historic.,1462406400,,27,6.0
3567639,5,B001FB55JO,"Great mouie! I thoroughly enjoyed this film. Although films about the Holocaust can be mouing to the point of depressing, there are creation's which can tell conuey the darker aspect's of the story , and still manage to incorporate the positiue, uplifting, and thought prouoking twist's which help make a film of a fiue star quality, as this fact based mouie clearly exemplifies. Well done!",1462320000,,390,5.015384615384615
3567640,5,B001FB55JO,Moving and realistic. An amazing story.,1462233600,,39,5.666666666666667
3567641,5,B001FB55JO,"Amazing movie, the story is very inspiring.",1461888000,,43,5.285714285714286
3567642,5,B001FB55JO,The film was outstanding.  It was unbelieve how 1200 Jewish people existed in the forest for several years during World War II despite the terrible hardships.,1461542400,,158,5.076923076923077
3567643,5,B001FB55JO,Great film,1461456000,,10,4.5
3567674,5,B001FB55JO,Very satisfied,1461110400,,14,6.5
3567675,5,B001FB55JO,Terrific Daniel Craig movie!,1461024000,,28,6.25
3567676,5,B001FB55JO,This is good,1461024000,,12,3.3333333333333335
3567677,5,B001FB55JO,Really enjoyed it.  Loved that it was a true story.  Great acting.,1460764800,,66,4.416666666666667
3567678,5,B001FB55JO,You just can't get any better than this.  The fact that it's a true story just makes it all the more spellbinding.  Great acting all around.,1460678400,,140,4.346153846153846
3567679,5,B001FB55JO,A+,1459209600,,2,2.0
3567680,5,B001FB55JO,Great movie!,1459209600,,12,5.5
3567681,5,B001FB55JO,Great movie.,1458950400,,12,5.5
3567682,4,B001FB55JO,"Don't remember it that well since so long ago, but I don't remember it being bad. Always good to learn a little history too.",1458691200,,124,4.208333333333333
3567683,4,B001FB55JO,Liked it,1458000000,,8,3.5
3567724,5,B001FB55JO,Excellent movie. You never lose interest.,1458000000,,41,6.0
3567725,4,B001FB55JO,Really good,1457740800,,11,5.0
3567726,4,B001FB55JO,It was an interesting movie about WWII starring Daniel Craig.  Very historical and based on a true story.,1457568000,,105,4.833333333333333
3567727,5,B001FB55JO,Loved this movie!! One of the better (early) films of Craig's!,1457222400,,62,4.7272727272727275
3567728,5,B001FB55JO,Great entertainment / education.,1457136000,,32,7.25
3567729,5,B001FB55JO,"Great movie, very moving!",1457136000,,25,5.5
3567730,5,B001FB55JO,Great movie!,1456963200,,12,5.5
3567731,5,B001FB55JO,Great movie.  Even more compelling in that it is a true story and largely unknown before they came out with this movie.,1456876800,,119,4.409090909090909
3567732,5,B001FB55JO,Movie was really good. Price was even better.,1456790400,,45,4.75
3567733,5,B001FB55JO,Great story.,1456531200,,12,5.5
3567825,4,B001FB55JO,"was a good movie, worth watching",1456099200,,32,4.5
3567826,5,B001FB55JO,Great story line action packed from beginning to end..Very powerful film,1456012800,,72,5.636363636363637
3567827,5,B001FB55JO,"I loved that it was a true story. Acting was amazing, So happy that I watched it. I totally recommend it.",1455580800,,105,4.0476190476190474
3567828,5,B001FB55JO,perfect sound,1455321600,,13,6.0
3567829,2,B001FB55JO,Just simply boring,1454630400,,18,5.333333333333333
3567830,4,B001FB55JO,Highly recommend viewing,1454630400,,24,7.333333333333333
3567831,5,B001FB55JO,Excellent rendition of little known history of bravery. truly remarkable and true.,1454630400,,82,5.916666666666667
3567832,4,B001FB55JO,A great story of bravery in the face of unbelievable evil.,1454544000,,58,4.363636363636363
3567833,5,B001FB55JO,It Was Good,1454544000,,11,3.0
3567834,4,B001FB55JO,A great part of history!,1454544000,,24,4.0
3567902,5,B001FB55JO,Wow! What an amazing story of loss and hope! Fantastic film.,1454544000,,60,4.545454545454546
3567903,4,B001FB55JO,"Good acting, but the actual story is the real deal!",1453680000,,51,4.2
3567904,5,B001FB55JO,Great!,1453507200,,6,6.0
3567905,4,B001FB55JO,Excellent movie and very historical accurate,1453507200,,44,6.5
3567906,5,B001FB55JO,Powerful Movie !!! Loved it along with the family,1453161600,,49,4.555555555555555
3567907,2,B001FB55JO,"Just didn't hit the mark for me personally. OK story, and I am very sympathetic with the Jewish experience in WWII Germany and Adolf Hitler's despicable acts of cruelty and out and out murder of thousands and thousands of wonderful human beings but this particular story just didn't hit a high mark for me as stories of this type go. If you are considering this, I highly recommend the movie Schindler's List by Steven Spielberg over the Defiance movie.",1452988800,,453,4.746835443037975
3567908,5,B001FB55JO,One of my favorite movies,1452470400,,25,4.2
