,overall,asin,reviewText,unixReviewTime,vote,reviewLength,wordLength
3581350,4,B001FB55JO,"I was completely unaware of this chapter of WWII history.

Having recently watched this movie with my 14-year old son, I found it quite moving. My son is in a 'guns-are-awesome' period, and I think this movie (thankfully) put a slight damper on his ardor. For me, I haven't been this haunted by a movie since I saw ""Platoon"" in college in the late '80's. (Not a bad thing to be haunted by a movie, methinks.)

While I'm sure this movie is far from accurate (the final scene with the tank was a bit over-the-top), the gift this movie gives is bringing the story of these Polish survivors to the world.  The acting was first rate ... I very much enjoyed watching the brothers interact with each other. Hollywood machismo was (happily!) tossed aside here. These brothers struggle, cry, disagree, reunite, fight, embrace and kiss.

How wonderful to see movie stars act like real men for a change. Daniel Craig, for instance, was so much more three dimensional in this movie than in any of his Bond films (films which are fun to watch when you're in the mood for such things. They are just more 2 dimensional).

I think this would be an excellent film for college and groups for discussion of community and honor and right choices ... and so much more. My son and I watched this movie on DVD. There were several places where we stopped the movie and had interesting, ""Ok, you are Tuvia. What would you do right now?"" conversations. (My son puts up with a lot from me. ;-D)

I certainly intend on reading the book to learn more about these brave people who lived in the woods for over 2 years to escape the horrors of the Holocaust.

Highly recommended.",1264377600,8,1647,4.506711409395973
3581351,5,B001FB55JO,"They did an excellent job with this movie, the acting, production, directing. The DVD was interesting because it showed in the special features the ancestors that are the product of their will to survive.",1263945600,,204,5.029411764705882
3581352,5,B001FB55JO,"This movie was amazing!  Such a great history lesson.  Why weren't we taught about this in school?  Watching this type of movie reminds me how fortunate I am to have the petty problems I have!

If you want to watch something worth your time and like to be educated, this movie won't disappoint.",1263168000,,294,4.490566037735849
3581353,4,B001FB55JO,"Hidden amongst the multiple film histories that litter the movies, occasionally you'll find a gem of a story that surprises the hell out of you. And DEFIANCE is definitely one of those. Based on the real-life story of the Bielski brothers who helped hide and save over 1,000 Jews from the Nazi death camps, this story is told in an unflinching narrative with brutal acts alongside those of extreme courage.

We often hear that reality can be stranger (and grander) than fiction, and here this holds doubly true. For not only did the Bielski brothers do this amazing ordeal, they also didn't ask for any recognition, reward, or medals. They married and immigrated after WW II ended and decided to live out quiet lives in their little corners of the world (with the exception of one brother who was conscripted into the Soviet army and died in battle).

But fate has a strange way of finding heroes, and this time was no exception. A documentary in 2006 entitled The Bielski Brothers: Jerusalem in the Woods was aired on the History Channel, and two books about them can easily be found, too. As word of what they'd done passed down through generations of survivors (now numbering in the tens of thousands), Hollywood took notice and sought out their history. Not having to embellish much (if at all) this incredible story, a screenplay was rapidly approved, director Ed Zwick (BLOOD DIAMOND) attached, and the rest is ...well ...history.

Daniel Craig (<a data-hook=""product-link-linked"" class=""a-link-normal"" href=""/Quantum-of-Solace/dp/B001PPLIFU/ref=cm_cr_arp_d_rvw_txt?ie=UTF8"">Quantum of Solace</a>) takes the lead role as brother Tuvia, a man with a military past and Jewish roots. When his parents and friends are killed by Nazi hunters and sympathizers, Tuvia and brothers Zus (Liev Schreiber,&nbsp;<a data-hook=""product-link-linked"" class=""a-link-normal"" href=""/The-Painted-Veil/dp/B000NOIX48/ref=cm_cr_arp_d_rvw_txt?ie=UTF8"">The Painted Veil</a>), Asael (Jamie Bell,&nbsp;<a data-hook=""product-link-linked"" class=""a-link-normal"" href=""/King-Kong-2005/dp/B001KZVQJI/ref=cm_cr_arp_d_rvw_txt?ie=UTF8"">King Kong, 2005</a>), and young Aron (George MacKay) head into the woods for safety. But vengeance versus fear drives what will come next. Tuvia kills his parents' murderers and then ducks deeper into the forests around Belarus. And with him comes other Jews fleeing the Nazi slaughters. Playing a game of hide-and-seek with their tormentors, The Bielski brothers and their followers didn't just cower in fear, but stood up and launched occasional attacks against the German troops. But their greatest victory was surviving and thriving in their forest hideouts. By wars end, they had not only survived, but multiplied and thrived.

Fascinating.

To this day, I often wonder if Hitler is turning over in his grave over this. I think he is. And what a wonderful form of revenge that is. Not because it took some violence on the Jews part to achieve it, but because violence wasn't their primary goal. It was survival. Surviving ""The Final Solution"" was the one thing Hitler most certainly wouldn't have wanted. And not only did the Bielski brothers and their followers achieve it, they added to their numbers. Sweet revenge!

Daniel Craig does a superb job as Tuvia, including a very believable accent. As does Liev Schreiber as his embittered brother Zus. In fact, I can't think of a single actor/actress that didn't live up to their part in this film. It was a gem to find amongst the forest of other movies out there.",1262908800,4,3526,5.520370370370371
3581354,5,B001FB55JO,"Daniel Craig does not disappoint!!! This movie is action packed and full of great characters.
I highly recommend this movie to anyone who loves fact based World War 2 movies.",1262304000,,174,4.833333333333333
3581355,5,B001FB55JO,"This is the story that every free person must see. Even more so, it is a movie every Jew must see, to learn about the other story of Jews--the ones that fought and lived. It is a moving and well made film, telling the story of truly great men. In the face of oppression and unbelievable odds, these men made a difference!",1262044800,,321,4.193548387096774
3581356,4,B001FB55JO,"This is a tough movie to watch--mainly because of its realism in detail of this very true incident of WW-2.  I recommend this work to any who enjoy visualizing of history as I think it does give understanding to DEFIANCE.

Like Schindler's List, this movie should be watched once a year to remind us where the possiblities are for humanity inflicting horror on humanity.",1262044800,,370,4.765625
3581357,4,B001FB55JO,"The too rarely told story of defying Nazis. Liev Schreiber and Daniel Craig are first rate, the action sequences strong, and the plot credible. This is not a ""Holocaust"" movie about Jews dying at the hands of the Nazis, it is about the heroism of average people who are forced to take up arms to fight against oppression.",1262044800,,321,4.551724137931035
3581358,5,B001FB55JO,"What a fantastic story, and one I never even imagined had happened during those awful times.  Liev Schreiber blew my socks off in his role.  My typical genre is horror, and he is best known to me as Cotton Mather from the Scream trilogy.  That was a fun, trite role, but he rocked as Zus, and was believable in the hardness that would take over many of us put into his shoes.

I thank the movie company for showing us a courageous story that shows people at their best, and others at their worst when faced with such adversity.  This makes me appreciate what I have even more.  It was a pleasure to learn of the Bielski's story.",1261353600,,628,4.279661016949152
3581359,5,B001FB55JO,"It is 1941.  Nazi Germany has invaded Soviet Russia, straight through the Soviet Republic of Belorussia.  Three Jewish brothers, Tuvia, Zus, and Asael Bielski (Daniel Craig, Liev Schreiber, and Jamie Bell), take refuge in the nearby forests. They are joined, more or less by accident, by other members of their Jewish community.  It falls to the three brothers to take charge and defy the odds to save the lives of their fellow refugees.

Such is the premise of 2009's ""Defiance"", which shines a light on a obscure corner of World War Two's Eastern Front.  Trapped behind the German lines, the Bielski group must battle lack of food and shelter, a harsh winter, and the vicious tactics of the German Army.  They get little help from the local Soviet partisan group, which regards them with suspicion.

The narrative proceeds on parallel tracks.  The otherwise ordinary Bielski brothers must grow, painfully, into leaders, while their fellow refugees struggle to maintain their sense of community under the most difficult of conditions.  The interactions between the brothers ring true, thanks to some solid acting.  Some of the best moments of the movie are the efforts of the people of the forest to fashion a new, if precarious, life for themselves in the midst of war.

""Defiance"" narrates some painful events that may be difficult to watch.  The partisan battle may be unknown to the average viewer, who is encouraged to explore the extra features explaining the history behind the movie.  ""Defiance"" is very highly recommended to fans of the World War Two movie genre as something new and special.",1261180800,,1602,5.0
3581360,4,B001FB55JO,"True story of a couple brothers that saved hundreds... Truly one of the scariest times to go through.. To face war at its worst... just being alive is the problem whether you were a threat or not.. in fact during this time the fact that you didn't fight back made it real easy to exterminate people by the masses.. well this groups fight was to not go easily into the night but to fight for their right to stay alive... hmm almost sounded like "" Independence Day "" there for a second..Loved it.. check it out!",1260921600,,509,4.3125
3581361,3,B001FB55JO,"Defiance, 2006 film

In 1941 Germany occupied Belorussia. SS death squads and local police arrested Jews. Fifty thousand were murdered. Families were rounded up. A few escaped into the woods for safety. They shared scarce food. One man gets his revenge [but doesn't acquire arms or food]. More bad news arrives. The Bielski's become active in the resistance and learn from experience. They must survive and build shelters in the woods. More arrive. There is dissension, some will join another group of partisans. Tuvias asks people to flee into the woods. A watchmaker becomes a gunsmith. Women will learn to shoot. The group lives deep in the forest, snow is falling. Tuvia gets more food.

A young lady meets a wolf while carrying food. They requisition medicines from a police station. Tuvia develops a cough, but he is still in charge. A German officer is captured [believable?] and suffers his fate. There is a threat of a German attack, they will leave for a new location. An enemy airplane drops bombs. Some remain as a rearguard until they are overwhelmed. They pass across the swamp to safety [recalling the Red Sea]. ""Keep moving!"" An enemy tank and soldiers show up. It looks bad until help shows up. They continue to retreat into the forest. They built a new camp and were joined by new people over the next two years. The last scenes tell of their future. They never sought recognition for those they saved.

This motion picture is based in part upon actual events and people. Certain actions and characters were dramatized, some are entirely fictitious. The purpose is to tell a story about one part of history. These events happened in Belarus (White Russia) but the scenes were filmed on location in Lithuania. [Many names in the credits are Lithuanian.] The Bielski brothers lived in the country and had the skills and knowledge to survive in the woods, unlike city dwellers.",1260316800,3,1892,4.851393188854489
3581362,5,B001FB55JO,"Very quick service & well packed, only problem is I have not been able to watch it as it is coming up wrong area on my television. Can the people that sold it to me please explain why!!!I have rated this dvd 5 stars because it is the type of movie I would be interested in.",1260230400,,273,3.892857142857143
3581363,5,B001FB55JO,I had read the book. The movie sticks closely to it and is very moving. A great action film.,1260144000,,92,3.8947368421052633
3581364,5,B001FB55JO,Among my favorite movies.  What the Bielski brothers accomplished is almost incomprehensible.  Christians in particular ought to watch such movies to acquire both knowledge of history and moral courage.,1259971200,,202,5.931034482758621
3581365,5,B001FB55JO,"This brilliant movie tells the true story of the Bielski partisans -- a band of Jewish survivors who hid in the forests of Belorussia during World War II and fought the Nazis.

It comes with all the bells and whistles of a classic war movie but it's so much more that that -- this is a movie with many important moral messages to impart about survival, commmunity, human dignity and resistance.

Daniel Craig gives a powerful performance as Tuvia Bielski, the group's leader -- all the more powerful for its understatement. Liev Schreiber is just as good as his brother Zus, who wants only to fight and kill to avenge the awful personal losses the family has endured.

If this were only a movie about men fighting a vastly superior force, it would be incredible enough. But Tuvia Bielski opened his camp to all survivors -- the old, the young, the sick, women, children. No-one was turned away. It's amazing to contemplate how they survived two bitter Russian winters with little or no food. Yet by the time of the liberation, they were running a school in the middle of the forest.

Incredibly, the brothers managed to save the lives of 1,200 people. Today, some 19,000 people are alive who would not have been were it not for their heroism.

There are many exciting battle scenes and tender love scenes and interesting secondary characters -- but the central metaphor comes when the band of refugees is forced to flee German armor and air power and find themselves wading through a massive swamp, holding on to each other's belts. It's an image that looks back to the exodus from Egypt -- although one of the brothers states that God will not save them this time and will not part the waters. Only by employing their own strength, determination and persistence will they survive.

In another painful scene, a German soldier is captured and then bludgeoned to death. Tuvia Bielski does not try to intervene. He understands that although he aspires to a higher moral standard, the cry for revenge among people who have been reduced by their enemies to animals, have been mistreated, humiliated and degraded and have seen their loved ones massacred cannot be appeased without blood. It is also an acknowledgment that to fight a monstrous force like Nazi Germany, a certain brutal ruthlessness is sometimes required.

The extra features on this DVD include interviews with family members of the Bielskis, who went on to build lives in the United States and some haunting photographs of survivors by director Edward Zwick.

See this movie. It's an amazing story that will change your perceptions of the Holocaust.",1259539200,15,2610,4.823266219239374
3581366,5,B001FB55JO,this story of true trials during the second world war and how individuals of all ages and beliefs shared and endured is entrancing and riveting.  I have seen the movie once before but the repeat was even more enthralling.,1259539200,,221,4.666666666666667
3581367,4,B001FB55JO,Delivered as promised and in the described condition.  Didn't get a chance to see this movie in the theaters but it's a good choice if you enjoy movies based on true events with a historical military feel.  It was a good saturday night selection.,1259366400,,246,4.568181818181818
3581368,5,B001FB55JO,"If you are tired of seeing wimpy, sub-serviant Jews being ripped out of their homes and herded into boxcars destined to deposit them at the doors of the ""showers"" at distant Consentration Camps, this is the film for you!

Daniel Craig's portrayal of the home-grown leader of over a thousand Jews was perfection.  The strength he showed was magnificent. As a Jew myself, I was proud of this real-life Hero in this true story.  Actually, the casting was perfection all across the board.  The sets underlined the hardships suffered by the resistance group.

This definately wasn't ""Fiddler...""",1258848000,2,590,5.041237113402062
3581369,5,B001FB55JO,"Ever since I saw the advertisements for this video I was waiting for it to come to my theatre.  If it ever did, I missed it.  Tried to purchase it at my local Walmart but it never arrived.  Finally purchased it here and the wait was worth it.  It is a very good movie.  In fact it is the kind of movie that you can watch multiple times and see something that you mised.  I highly recommend this video to anyone.  It was fantastic.",1257552000,,430,4.0476190476190474
3581370,4,B001FB55JO,"Defiance is a movie about a little known effort of Jewish brothers to not only protect about 1000 Jews from the Nazis, but to form them into a self-defending community. It's not a special effects movie although there are battle sequences and the characters are well developed and believable.

Starring Daniel Craig and Liev Schreiber it also includes a substantial supporting cast from several countries, each reknown in their own right.

Highly recommended.",1257379200,,458,5.260273972602739
3581371,4,B001FB55JO,"The Bottom Line:

Unfairly derided as middlebrow, this intelligent World War II film by Edward Zwick wisely eschews action for a more nuanced exploration of the rigors of leadership, the endemic nature of antisemitism in Russian cultures, and the difficulty (and importance) of survival; one of the more underrated films of 2008, Defiance is a movie worth seeing.

3.5/4",1256428800,,370,5.254237288135593
3581372,4,B001FB55JO,"""Defiance"" captures the gritty and often ugly facts of guerrilla warfare in WWII's Eastern Front.  The fact that it was filmed in Lithuania doesn't matter, as only a few kilometers and an artificial barrier in a trackless forest separated similar partisan bands fighting the same enemy.  There is, I see, a tendency to do some backward projecting: that is, these Jewish refugees are acting too much like modern Israelis, rather than Diaspora Jews.  While it's true that some of the toughest Jewish commandos of the Israeli War of Independence cut their teeth in the forest wars of Europe, the film makes too direct a connection.  It's easy to forget that the majority of people in these communities were not ""tough Jews"" and did NOT fight back.  It was not in their history or culture to do so.  Resistance was offered by an exceptional few - like the Bielskis - young men with their bridges burned and nothing left to lose, including memories; while the majority around them clung to tradition to carry them through one more round of trouble.  But the film at least is honest enough to show why this majority, as portrayed by the ghetto elder, refused to ""act"" with doom staring them in the face.

Still one of the better examples of the Holocaust genre.",1255910400,,1255,4.724770642201835
3581373,4,B001FB55JO,"DEFIANCE is a war movie but it is also a movie of conscience.  From the time that the Germans overran Poland to start the Second World War, Hollywood tended to tell the big picture.  The hero was often a stern figure in the John Wayne mold or an eager kid like Audie Murphy.  Director Edward Zwick took a different route.  He read about the real life exploits of the Bielski brothers who led more than one thousand Poles and Belorussians out of the ghetto to hide in the forest and become partisans against the Germans.  What makes the tale especially telling is his presentation of Tuvia Bielski (Daniel Craig), the leader of the partisans, as one who became leader only by default.  There was no one else to step up.  Tuvia's brother Zus (Liev Schrieber) fights Tuvia almost as often as he does the Germans.  Wartime forces men to show who they are and what they stand for, and when it comes time to killing the enemy, questions about the morality of doing so are quickly raised but almost as quickly postponed for a time when luxury permits hindsight.  Zus wants revenge for his slaughtered family.  Tuvia counters that revenge is mutually exclusive with survival.  Zus adds that only revenge will give them the moral strength to go on.  And so the dialogue goes.  This emphasis on morality is needed in films that so often lack it.  When the debating of morality dies down, the action part of the movie provides a non-verbal context that implies that both brothers are right, and rightness is a function that varies from man to man.

DEFIANCE presents the Bielskis as multi-dimensional figures who are faced with the impossible task of saving hundreds of Jews when doing so imperils their own lives.  This question of what is and is not possible arises again and  again.  When the Germans force the Bielski partisans to muck their way through a deadly swamp, one of the group cries out that to do so is impossible.  One of the Bielskis shouts that their very survival to that moment has been impossible.  Courage and hope are commodities that are often in short supply during the best of peaceful times.  DEFIANCE suggests that they may be found even in the hearts and minds of force fed heroes who doubt who they are but their followers insist that like Moses such leaders are chosen by God for a good reason.",1255824000,,2314,4.60880195599022
3581374,4,B001FB55JO,"The Jews in Russia had Russian on the backs and German's hunting them down.
The forest became like Robin hood's Sherwood forest: a refuge
in both cold and hunger from the killing storm of the war.
The three brothers become a leadership of tough love
for a Jewish few who escape they're persecutors.
The movie has a lot of action and too much blood a death,
but is well acted and realistically set.",1255046400,,397,4.4520547945205475
3581385,5,B001FB55JO,"This movie is based on a true story of history and is so well done that I felt its
time and reality. It was desperate and hopeful, it offers belief in mankind and
that we can survive the worse imagined, it has already been done and it is our
history to encourage us to stand up to what is right with a deep value of each
other.",1254787200,,327,3.8955223880597014
3581386,1,B001FB55JO,"I had to laugh everytime Daniel Craig, playing an Eastern European Jewish rebel leader during World War II, opened his mouth to demonstrate his inconsistent accent. I was looking forward to watching this movie after seeing the preview, but found myself begging for it to end. Instead, it's more than a two-hour procession of every cliche you can imagine from other World War II movies. It has occasional action scenes to maintain viewer interest, but mostly the movie has nearly endless boring dialog and cartoonish portrayals of the freedom fighters who beg for audience sympathy, which is an important message for today's youth.",1253750400,9,630,5.12621359223301
3581387,3,B001FB55JO,This is a good movie the first time around but not much more than that.,1253145600,2,71,3.8
3581388,5,B001FB55JO,Amazing based on fact movie.  True bravery and courage.  Great cinematography.  Really well done.  Makes you want to learn more about these heroes.,1253059200,,147,5.260869565217392
3581389,5,B001FB55JO,This is an excellent movie. The story was incredible. The cinematography was excellent. Zwick knows how to do a war scene. Awesome !,1252886400,,132,4.782608695652174
3581390,5,B001FB55JO,"What a tribute to the human spirit. A group of Jews during WWII who survived hiding in the forest, with little but their hearts and spirits to sustain them while they are hunted by the Nazis and their minions.  True stories are so much better than fiction. I highly recommend this movie to anyone who thinks the human situation is negative.  This will inspire all to remember the indominatable will of people to not only survive but to rise above the horrors surrounding them.",1252800000,,476,4.654761904761905
3581391,5,B001FB55JO,"Great movie, not just a tear jerker, but something that shows the truly heroic story of a group of Belorussian Jews defying the nazis as well as anti-semitic countrymen and each other on occasion to survive during WWII. I don't know how close to the real story this is, but it definitely has an authentic/true feel as you are watching. It shows the story from different viewpoints, showing that the human character isn't all black and white but some very disturbing shades of grey. It depicts people trying to stay human in very inhuman circumstances. Showing how old prejudices must be pushed aside in order for a group of people, connected mainly by only a common religion, to survive. Some very good acting all around with effective use of action and violence to make points and drive the story forward rather than the fairly gratuitive violence in Inglourious Basterds.",1252800000,,873,4.865771812080537
3581392,4,B001FB55JO,I thoroughly enjoyed this movie and am really pleased i bought it as i can see myself watching it repeatedly. The whole storyline is very believable and scenery of the forests and hills is authentic and. I would recommend it to anyone to purchase as in my opinion you would not be disappointed.,1251936000,,294,4.566037735849057
