,overall,asin,reviewText,unixReviewTime,vote,reviewLength,wordLength
8410568,2,B003ZKLDPI,"I was intrigued by the cover photo, but this has been a rather huge disappointment for me.  The singing and the orchestra under the direction of Mehta are good although I found Mehta's tempo generally slow.  Some singers are clearly not typical Wagnerian singers as they have more lyrical vocal tones.  I feel bad for those singers who were intentionally put into the most awkward positions while they sing in this production.

What I don't understand and like is the whole regietheater production.  I am not sure if the director actually know too much about the whole story or just focused too much on symbolism instead of presenting the drama.  While all the aerial acrobatics and use of computer generated graphics are visually stunning, they add no artistic value to the production.  There is general dissonance between what is presented musically and what is presented visually.  The whole production is just a visual spectacle with sound track provided by Wagner.",1421020800,4,969,5.0125
8410569,5,B003ZKLDPI,Great production !!!,1419465600,,20,6.0
8410570,5,B003ZKLDPI,"Very modern, without jettisoning Wagner's timelessness. Truly imaginative staging. This is the real deal; even if you already have a favorite give one of the cycle's operas a look.",1391126400,,180,5.241379310344827
8410571,5,B003ZKLDPI,"Read the comments others have made about this particular edition of the Ring.  I loved the presentation, the singing was flawless, and there are certain scenes which are simply magnificently staged with the use of the screen projections and the modern sets.  The integration of the acrobatic troupe with the story adds some interesting complexity to the simple task of just visually following along with the story.",1374019200,,414,5.164179104477612
8410572,5,B003ZKLDPI,"This production, directed by Carlus Padrissa, is being hailed as a ""Ring for the 21st century,"" and if it's a bit too early to make claims about the zeitgeist of the century, it's not too early to suggest that this Valencia Ring--like those by Chreau, Schenk, and Kupfer--is a statement to be reckoned with, a production against which others will be judged. Most immediately obvious is the sheer spectacle, topped off by (but not limited to) the often acrobatic participation of the Catalan theater group La Fura dels Baus and by Franc Aleu's video projections, rightly described as ""stunning"" by Andrew Quint in his review of these two operas in the last issue (Fanfare 33:5). Quint has already mentioned a number of the highpoints. I'll just echo his enthusiasm, adding that while some might find the production a touch hyperactive, at least there's not a moment in the hours and hours of viewing here that's less than visually compelling--something rarely said about even the best productions of The Ring.

Granted, it didn't take Anna Russell to point out the streak of inanity that underlies these operas; as Tolstoy's skewering of The Ring in What Is Art reminds us, the Ring's inherent silliness has been a target for critics and comedians since the days when this was New Music par excellence. And this production has its Monty Pythonesque moments, too, especially (as Quint pointed out) in the costumes. But the moments of sheer wonder--the grimy industrial backdrop of Niebelheim, the airborne acrobats who create Valhalla, the kaleidoscopic tree in the first act of Walkre--more than compensate, at least on Blu-ray, where they emerge with astonishing clarity.

For all the razzle-dazzle, though, this is a profoundly human Ring, and the production is even more gripping for its dramatic interpretation than for its spectacle. I use the word ""interpretation""--rather than ""reconception"" or ""vision""--advisedly. Many critics (including me) have registered their distress over the current wave of productions that are driven by the idiosyncratic visions of the stage directors at the expense of the details of the scores. (For a few examples of my own protests, see my reviews of Calixto Bieito's Wozzeck [31:6] or Robert Lepage's Rake's Progress [33:4]). In fact, many of us have complained with such consistency and vehemence that it might seem that we're opposed to creative imagination altogether. We're not (at least, I'm not); respect does not at all require repetition of old tropes, just as freshness doesn't require grinding the composer's intentions under your heel. It's possible to be radical and respectful at the same time, and the Valencia Ring proves it. Archeological rather than disruptive, these discs deepen our understanding of Wagner rather than overturn it.

Two examples can stand for many. First, the treatment of Fricka. Fricka is usually cast as an aging frump. As a consequence, her defense of marriage seems more pragmatic than principled; she seems to be insisting on marital fidelity because, sexually speaking, marriage is all that she can now depend on. Anna Larsson, looking a lot more like Catherine Zeta-Jones in Chicago than Christa Ludwig in the Schenk/Levine/Met Ring, is a very different kind of Fricka. She's smart and sexy, with a voice that can stand up to her husband's and with just a hint of the dominatrix--her principles obviously don't stem from sexual weakness. Her relationship with Wotan thus becomes deeper, her position harder to brush off--and act II of Walkre becomes even more heartbreaking than usual.

Second, the treatment of Sieglinde. Many productions portray Sieglinde as a generous and gracious hostess--even a regal one, as Jessye Norman is in the Met version. Hunding may not be the best of husbands, but at least, it seems, he's given her middle-class comforts. In Chreau's version, in fact, he's given her something even classier than that. But is that really what's in the score and the libretto? Let's remember that Sieglinde was brutally kidnapped and--not to put too fine a point on it--turned into Hunding's sex slave. That history of sexual violence is never occluded in this tough-minded probing of Walkre's first act. When we first see her, she's outdoors, tied up like the dog she's been reduced to, scuttling among the bones outside the dwelling. Her initial scoping out of Siegmund involves not only sight (this production is especially sensitive to the psychology of the look, especially when characters are silent) but smell, too, as she sniffs him to come to terms with what's happening. And we see the growing love between the twins not simply in the growing erotic charge, but--even more touchingly--in the way Sieglinde (and Siegmund too, although to a lesser extent) becomes humanized in the course of the act. It's not just the big gestures; the small gestures, too, reinforce this strange tenderness of the previously uncivilized. Note, for instance, how she gives the prostrate Siegmund water by dipping her hair in a bowl and then transferring it to his lips.

It doesn't hurt that Peter Seiffert and Petra Maria Schnitzer as Siegmund and Sieglinde are both in exceptional voice. Especially powerful, to my ears, is Schnitzer's mad scene in act II, where her sense of grief threatens to undo all her progress and return her to an animal existence. But then again, nearly everyone sings and acts well in this production. As Quint suggested, Juha Uusitalo is as poignant a Wotan as any around today--and Jennifer Wilson manages to convey Brnnhilde's growing wisdom with remarkable sensitivity. Matti Salminen is such a sympathetic Fasolt that it's something of a shock to see how raw his Hunding is.

Zubin Mehta's conducting is slightly on the broad side, rarely pushing the tempos, and concentrating on the long lines. He occasionally slights details (I'd like more bite on the trip down to Niebelheim), but he never loses his grip on the larger architecture. The youthful orchestra plays with tremendous heft and panache, clearly enjoying every minute (something you can't always say for Boulez's Bayreuth crew). As far as audio goes, the 7.1 DTS-HD Master Audio is suitably overwhelming and enveloping. Enthusiastically endorsed. Peter J. Rabinowitz",1370822400,10,6250,5.152709359605911
