,overall,asin,reviewText,unixReviewTime,vote,reviewLength,wordLength
4234872,5,B003ZKLDPI,"The greatest masterpiece in Western art has found a continuously fascinating set of producers.  I say ""set"" because, apart from the hypnotic music, so many good things are contributed by so many imaginative individual singers and groups of singers/performers/set designers/ conceivers, down to the lowliest stagehand.  Maybe you think the RING is something that should look like how Wagner wanted it to look.  But that's ridiculous and pedestrian.  In 1876, the technology was insufficient to encompass the visionary aspect of this music drama.  Heck, Wagner had to build a whole new kind of House for it to be performed in.  In this production (as in any) there are points  that might have been more richly realized for my expectations, but if I had it in me to create a perfect RING, I would.  And, as a theatrical experience, this RING has now become my favorite.  (The Met's new production is brilliant too, but it's not yet available for home viewing).

Look, this is hard music to sing.  I don't give a damn that Brynhide's a little on the heavy side.  She's got a big voice, and the production (visuals, costumes, ingenious pyrotechnics), justifies her.  She's admittedly not a great singing actress, but she IS a PRESENCE.  All the singers perform so admirably that, as I think Wagner intended, you are not left with an opera to judge whether you like or not; you are left with a complete and fully formed vision of the western world's greatest work of art.  I want to capitalize ""art"" here, but I also want you to believe me.  It is, after all, ARTificial.  As it must be.  I don't know what word to use beyond music-drama even to come close to describing the phenomenon of the RING.  Wagner, despicable and unpleasant as he appears to have been, had this in him.  No one artist has ever come close to creating such an all encompassing and visionary work.  I don't even think Wagner realized the full potential of this music.  Especially since the grandsons began their task of ""de-nazifying"" it.  I don't know where Wagner found it in the infinite world of imagination.  It is truly a ""gesamptkunstwerk"" because every generation, or even every 10 or so years, something entirely new emerges from the score.  If you believe that the RING should be ""traditional""; that is, according to the way Wagner might have imagined it, you will be disappointed.  Even a theatrical/musical genius such as he was still bound by his time in history.  If you understand that some works of art are ENDLESSLY capable of being re-imagined, this production will give you something to treasure.  Blu-ray was created for visual and musical art like this.  Not that there is any other.  On a personal note, I've been very ill lately, and depressed.  This set gave me 16-17 hours of pure joy.  And BTW, to the reviewer who completely overstated Brynhilde's size:  get over it.  This is opera, after all, and sometimes it takes a big instrument to sing such an enormous role.  Compare her to Stephanie Blythe or any of a number of Wagnerian sopranos over the last century.  Nowhere does Wagner indicate that she is supposed to be slender.  She's supposed to be POWERFUL.  And that is exactly what she is in 3 of the 4 operas in this enormous work of art.  The best surprise was Zubin Metha, who is not my favorite conductor.  He got it DOWN this time though.  At $116 and change, this is a bargain.  (The Metropolitan Opera Store - in NYC- was charging $40 per opera.)  If you are open to the infinite versatility of this ""total-artwork"" you've got to see this.  If you can do it other than by buying it, either complete, or one at a time, I highly recommend the experience.  Amazon's price is worth every penny.",1335830400,9,3696,4.679626749611198
4234873,4,B003ZKLDPI,"I received this as a gift from my wife. This is a weird Ring. The stage is original and very dynamic, but the voices could be MUCH better. Zubin Mehta is great and it is amazing he's not going as fast as expected from him...The conductor is quite good, the singers are just right...Brunhilde should follow a diet (LOL). Siegfried is weak, Wotan is quite good. The stage is a kind of Star Wars mixed with a nightmare. On Blu Ray this is rather impressive. I enjoyed very much watching it! I had already 2 other versions: James Levine (very traditional) and Daniel Barenboim (less traditional and a master's baton), singers are awesome in both cases...By the way, Siegfried Jerusalem is Siegfired in both versions. Mehta maybe didn't have enough budget to hire good singers, he spent a lot of money paying a wonderful stage. Up to you.
In all cases, Richard Wagner would be proud of all of it. My wife describes herself as a book worm...I describe myself as a MUSIC worm...

Martin Pitchon",1333670400,,987,4.607954545454546
4234874,3,B003ZKLDPI,"I purchased this for my wife for Christmas. The description and the cover made it seem really appealing and even one of the customer reviews terms it a Ring made for Blu-Ray. I would love to actually see the stage production. It seems like there are really interesting things going on with the set and the acrobats. We will never know besides glimpses because the director/editor of the video shoot are apparently afraid of wide shots. Instead we are treated to close up after close up of an acrobats butt or crotch as they try to manuever into position for the next set piece. I don't want to leave out all of the close ups of Siefried's elbow or the back of Wotan's head or Siefried's belly. My wife, who has worked as a director, editor and producer, is convinced that the video director must have had a fight with the stage director and that is why he chose to destroy the visuals for the Blu-Ray release. All in all we enjoyed the performances it is just that thanks to the camera work, editing and direction we are way too intimate with most of the performers.",1330905600,14,1066,4.4438775510204085
4234875,2,B003ZKLDPI,"The sound & picture quality is very good. But the main female singer playing Brnnhilde, who dominates the scene for about half of this opera, is hopelessly obese.... (well, so is the tenor playing Siegfried)

Her singing is great, no doubt. I think if this was a CD audio, I would give 5 stars for her performance. But this being blu-ray, with elaborate visual spectacles with segway, human pendulum, etc, I believe the soprano who is playing a beautiful Valkyrie needs to be also visually convincing.",1327968000,5,501,4.825581395348837
4234876,5,B003ZKLDPI,"I live in Sagunto, Valencia, and attended the first Ring Cycle ever there, in summer 2010. Siegfried and Gtterdmmerung were premiered at that moment. My impressions, hence, come from the theater itself, where they are stronger.

The first thing to say here is modernity. That is the reason why opinions are so different on this page: all the way from 1 through 5 stars. My advice: if you are looking for a traditional staging of Wagner's operas (a tree must be a tree, a mountain must be a mountain, etc) Valencia's Ring is not made for you, choose another one. Staging of the four operas is ultramodern, and it may disgusting to traditional viewers. Once said, if you are a Wagner fan looking for something else or just an open minded person, go for it. It'll provide hours of enjoyment.

What is new on this Ring? Honestly, everything. I am an opera goer and a Wagner fanatic, and I was so impressed when I saw the Rheingold that I could barely sleep that night. Needless to say that on the remaining three nights I was absolutely stucked to the chair. The use of up-to-date techologies along with the human sculptures is simply amazing; lighting is impeccable; actors' movements on the stage are perfectly studied; 3D projections are awesome... And Wagner's instructions are however respected, though with a XXI century perspective. It should be said that some of the artifacts used on the production were inspired on those used during the first Ring Cycle at Bayreuth, in 1876, with Wagner alive, i.e., the ""charts"" the valkyries used in Walkre. At the end, the production is much more respectful that one could think at first. There is no contradiction at all between sung words and events on scene. I think Wagner would have approved this staging; at the end he was an artist, and a team of artists have created this impressive show.

What about orchestra, conductor and soloists? Well, the orchestra, as another reviewer has said, has been picked up by Maazel and taylor made to fit his taste. It may seem exaggerated, but I find that only the Wiener Staatsoper Orchestra provides such a luxury when playing. Sorry about that, but I have attended operas in New York (last time only a few days ago), Berlin, Madrid, etc, and I can't find the same sound. They are from another galaxy. Mehta is a very well known conductor, with ups and downs. Luckily he gave an extraordinary reading of the scores, slow, pure, furtwaengler-styled, with light textures, crystal sound and a wide range of dynamics... Extraordinary.

Singers are all very good and some excellent. No need to go to the details, but all the main roles are very well served (Brnnhilde, Siegfried, Wotan, Siegmund, Sieglinde, Fricka, Hunding, Alberich, the giants, Hagen, Gnther, Gutrune...) as are the secondary. No flaws whatsoever.

All in all, a Ring to be enjoyed, modern in the best sense of the word. To me it looks like the production my grandsons could have attended in 2085, almost a century before... The future of opera in your hands, right now.",1325894400,6,3022,4.781609195402299
4234877,1,B003ZKLDPI,"I bought this Ring set with extremely high expectations.  The orchestral playing and singing are wonderful.  However, as mentioned by R. Kreutzer in another review, the sound recording and disc authoring has been botched.  Channels were reversed, and singers' positions on stage did not correspond to the location of the sound coming from the speakers.  I wrote C-Major Entertainment (the distributors of the set) and described the problems.  I received a reply that they acknowledged the error in the discs, but I got no offer of a replacement when a corrected set was reprinted.  The communication from them bordered on being rude.  If C-Major wanted to develop a loyal customer base, they would have taken my name (and those of other dissatisfied buyers) and sent a corrected set as soon as possible.  I returned the set to the Amazon seller and received a refund in a prompt and courteous manner.  Regardless of the quality of this performance, I will hesitate to buy any more products from C-Major in the future because of their lack of interest in customer satisfaction.  I'm sad and surprised that a newer company to Blu-ray would be so callous to their customer.

I will add that all my dealings with Amazon and their seller were handled professionally and promptly.  I'm truly sorry to enter such a poor review of this set, considering the wonderful playing and singing contained within.",1311897600,22,1396,4.944206008583691
4234878,5,B003ZKLDPI,"Well, modern opera scenarios and costumes are not my cup of tea, i'm a old fashioned guy and i prefer my good old  Ring the way it meant to be, traditional like Levine did but, guys, this new production in Blu-ray is amazing ! The singers, the orchestra, the conductor, everything is terrific ! I'm very glad with my purchase !",1311379200,4,327,4.360655737704918
4234879,1,B003ZKLDPI,What stupidity. What extreme excess. What has any of this nonsense got to do with Wagner's vision? A very mediocre performance with an enormous budget. A very dismal sign of the times.,1307923200,15,184,4.78125
8410564,4,B003ZKLDPI,"To begin, some personnel information about the individual entries:

DAS RHEINGOLD
Juha Uusitalo (Wotan), Franz-Josef Kapellmann (Alberich), John Daszak (Loge), Gerhard Siegel (Mime), Matti Salminen (Fasolt), Stephen Milling (Fafner) Sabina von Walter (Freia), Anna Larsson (Fricka), Christa Mayer (Erda), German Villar (Froh), Ilya Bannik (Donner)

DIE WALKRE
Peter Seiffert (Siegmund), Petra Maria Schnitzer (Sieglinde), Matti Salminen (Hunding), Jennifer Wilson (Brnnhilde), Juha Uusitalo (Wotan), Anna Larsson (Fricka)

SIEGFRIED
Lance Ryan (Siegfried), Jennifer Wilson (Brnnhilde), Gerhard Siegel (Mime), Juha Uusitalo (Der Wanderer), Franz-Josef Kapellmann (Alberich), Stephen Milling (Fafner), Catherine Wyn-Rogers (Erda), Marina Zyatkova (Waldvogel)

GTTERDMMERUNG
Lance Ryan (Siegfried), Jennifer Wilson (Brnnhilde), Matti Salminen (Hagen), Ralf Lukas (Gunther), Franz-Josef Kapellmann (Alberich), Elisabete Matos (Gutrune), Catherine Wyn-Rogers (Waltraute)

Cor de la Generalitat Valenciana/Orquestra de la Comunitat Valenciana
Conductor: Zubin Mehta; Production: La Fura dels Baus, stage director Carlus Padrissa
2007-2009

Each of the four operas gets an extra feature on its DVD. We mostly hear from members of the production team, but also from the conductor, some of the singers, and intendant Helga Schmidt in the happy days before her legal difficulties. These extras yield little surprising information and are repetitious, with a lot of the same interview footage reused. I heard twice, for example, Zubin Mehta's story of the first time he heard the RING performed, and how he had been working toward conducting it ever since. The most interesting fact I got out of a cumulative two hours of extras was from the stage director: this was the first integral RING to be performed in Spain. The fledgling Valencia organization, with its striking Calatrava-designed theater, did within its first five years of existence what its older siblings, the Teatro Real and the Gran Liceu Barcelona, never had done. This RING was initially staged between 2007 and 2009, and Valencia's first opera production had been only one year earlier, a 2006 FIDELIO (also with Mehta, also on DVD).

The hard work that Zubin Mehta and this (figuratively and literally) young orchestra put into the preparation is evident in the sound they make together. That is the highest tribute that can be paid Mehta here -- it is very impressive music-making just at the level of the sound, for a group that hadn't been playing anything together for very long and was undertaking its first complete RING. Mehta is an unusual conductor in that he prefers a placement of the basses in the center of the orchestra pit rather than to one side. Even with the mediation of microphones for a recording, this placement affects the balances and gives an audible result of greater weightiness and depth, with more clarity at the bottom but also at the top (as the basses' usual neighbors are not sharing space with them). So, it all *sounds* wonderful. Such reservations as I have on the orchestral level are about the way it moves, or doesn't.

The elements of this cycle, musical and theatrical, only come into proper balance at the halfway point. RHEINGOLD is by far the weakest link. Mehta throughout the cycle is even pokier than James Levine on the Met's 1989-90 video cycle. He's a little slower than Levine in every opera except the last, where they are almost identical. This very deliberate approach hurts the continuity of RHEINGOLD most of all, and scenes droop terribly there. Minutes ticked by and I found myself thinking, ""We're still on this?"" SIEGFRIED and GTTERDMMERUNG are more accommodating of the monumentalized, ""grand"" approach Mehta wants to take to the whole thing. I have a good idea of what Mehta's influences are in this music, and I expect they're the same as Levine's. But I don't think either Levine or Mehta has the gift for keeping Wagner's music buoyant over very slow expanses. Knappertsbusch had that gift, and others of his generation did.

MVP of La Fura dels Baus's production team is Franc Aleu, whose video productions would merit a thousand words all by themselves. They are innovative and beautiful, in richly saturated colors, and they range from extremely realistic (snow-covered mountains as Wotan seeks out Erda) to abstract and suggestive. But they always draw the eye. Several times, I was struck by the realization that for all the visual stimulation going on, I was really looking at a nearly empty stage, which could be cleared with economy. There are few props. What isn't handled by the projections is handled by the acrobatic troupe, who are called on to embody everything from Valhalla's gate, to the stacks of gold, to grass by a river, to Brnnhilde's bed cover (I'm not kidding).

The eye is especially grateful for the work of Aleu and the acrobatic troupe, as Chu Uroz's parodic costumes flatter no member of this cast. Hunding and the Wlsungs (both the parents and their child, before the Gibichungs give Siegfried a makeover) get the worst of it. They sport the dreadlocks, tribal tattoos, and ratty animal skins that were all over opera stagings in the aughts as shorthand for either ""primitive"" or ""post-apocalyptic."" But almost everyone is wearing something exaggerated and ugly, even the gods.

Like the conducting, the stage direction improves halfway through the cycle -- which is to say there is more evidence that some was happening. The gods in the earlier installments are strapped into wheeled cages on cranes, so the singers are several meters above the stage and standing on narrow platforms. This restricts the blocking to a sort of ""balance and deliver,"" and singers cannot get very close to each other. The giants in RHEINGOLD are encased in huge metal exoskeletons and look like Transformers, and Milling can barely graze Salminen with his metal arm in order to administer what we have to accept as the ""death blow."" Once the gods are, for the most part, out of the picture, the direction gets more dynamic, and I like a lot of the choices in the final two installments.

Carlus Padrissa's ideas about Wagner's work seem closest to Harry Kupfer's, of the others I have seen. Like the humans in the Kupfer cycle, the ones here go from primitive to more civilized, and the surroundings change with them. As mentioned above, the Gibichungs give Siegfried a makeover, putting him in a modern suit and giving him a haircut, as if taming Tarzan, and we have the sense that our hero is getting further away from himself and his roots. This fits with the overall concept throughout the RING of nature being violated.

I won't get into everything I found well directed, but I liked that the Gunther/Siegfried bond is taken very seriously here. When Siegfried's memory returns to him, he seems truly sorrowful and he runs to Gunther for comfort and, perhaps, forgiveness. Gunther frantically motions to Hagen as if trying to call off the spear in the back, but of course it's too late. The Wotan/Erda scene one opera earlier is interestingly done too (Erda really *reacts* this time to what she hears, rather than seeming glazed over), and so is the always-ugly scene with the disguised Siegfried's conquest of Brnnhilde. She remains feisty and resentful to the last.

The cast members range from very good to acceptable. If you saw this RING live in 2007-09, at the Met or Bayreuth or anywhere, you'd go away happy. Wilson's Brnnhilde is one of the most powerfully sung on DVD; hers is a kind of voice you just don't hear much anymore. Everyone with whom she shares significant stage time sounds to be giving away vocal size to her. Some viewers have claimed Wilson is stolid and apathetic on stage, but I think they're letting her size (and her very unflattering and limiting costumes) influence them. I see real joy in performing from her, and even a hint of sexiness when Brnnhilde and Siegfried approach each other to do the deed during the playout of SIEGFRIED's final duet.

Ryan's Siegfried is promising. He has a fresh and young sound and he's appealing to hear and watch, but he sounds worryingly light and monochromatic to me, and his interpretation is still in early days. Uusitalo's Wotan is handsomely sung, not the most profound or mercurial. The Wlsungs, a real husband-and-wife pair, give deeply felt performances that make up for some vocal wear and tear.

Larsson is just about perfect as Fricka; she doesn't yield much to any of the more famous ones I've heard. Kapellmann gets by as Alberich more on knowhow than on his now-frayed voice, but his ""brother,"" Siegel, is again a first-class Mime. Both giants, Milling and Salminen, are excellent, and the latter's old-pro triple act (extending to his familiar roles of Hunding and Hagen) comes off much better than I was expecting. He's a real asset here. It is a shame Mayer's RHEINGOLD Erda was not retained. Wyn-Rogers acts the longer version in SIEGFRIED sensitively but sounds vocally out of her comfort zone. Matos, a dramatic soprano who shortly thereafter would wow Met audiences as Minnie, is amusingly ""underparted"" as Gutrune. She sounds more capable of throwing down with this Brnnhilde than anyone else in the cycle, and her attempts to scale down a big sound for Gutrune's wispier lines are uneasy.

This does not challenge the classic Kupfer/Barenboim and Chreau/Boulez Bayreuth video cycles among my favorites, but it gets better as it goes along, it's very impressive to look at, and it has things I will be glad to revisit. I would recommend it if someone wants a razzle-dazzle visual-splendor RING (on that level, it obliterates the Met's 2010-12 creaking cash sink) and is interested in the singers of its major roles.",1453939200,,9747,5.081875
8410565,5,B003ZKLDPI,"This is a wonderful version of one of great works of Western art.  It's not for the faint of heart and certainly should not be one's only recorded version of Wagner's masterpiece, but I loved this and would recommend it to virtually all fans of The Ring.  The singing and the orchestral playing are both first rate, and the high tech staging is spectacular.  I realize that some purists will  prefer a great singer from the past, say a Flagstad or a Melchior, in one or another role, but that is potentially true of all opera performances.  I also realize that some lovers of The Ring will object to the staging. I respect those holding such views and warn them that this is probably not for them. However, for those who love Wagner and for those who want to see what is possible with avant-garde stage production, this set is highly recommended.",1449792000,,846,4.5394736842105265
8410566,3,B003ZKLDPI,"I can't agree with reviewers who are impressed with the visuals and staging of this Ring.  First, they are badly executed.  Loge riding on a Segway while singing.  Albrech suspended by eight thick wires two feet above the stage while film is played on a back screen to give the appearance of flying. Second, the conception of the visuals looks like a 12 year old boy reading too many Marvel comics.
I'm not expecting Lord of the Rings CGI effects, but this is about 1972 Doctor Who, well, not even that good.  I think a sci-fi staging is possible.  It should have been done with solid stationary backdrops and fixed pedestals, IMO.  Put the money into quality art work instead of the gimmicks.
The effects are a distraction from the singing, and in Das Rheingold, the voices often do not project well, whether that is the singing or mic-ing.  Hopefully, there is better ahead.  Still, even a cheesy, not fantastically sung Ring is still worth watching.  Did I mention the orchestral playing is excellent.",1435190400,,1004,4.724137931034483
8410567,4,B003ZKLDPI,"I'm glad I got to see this Ring live in Valencia back in 2009. Despite Metha's indifferent pacing, Carlus Padrissa's staging, both modern and very much in the spirit of Wagner's immense vision and the excitement of the ""discovery"" of a young Canadian tenor who could deliver a musically and visually credible Siegfried made for a very enjoyable vacation. Days of basking in the warm Mediterranean, hearty paellas at noon and going to the Ring in a theater that looked like the Space Station. A Wagnerian paradise.

2014. Bayreuth. Lance Ryan, Valencia's young Siegfried reprises the role he's been repeating over and over for the last six years. The vibrant, steely timbre is gone, replaced by a strange, unpleasant croaking for two painful 5-hour spans, cloaked in the embarrassing ""production"" by Frank Castorf. A study in hatred for Wagner, the audience and elementary decency. Back to Valencia: the exotic white tiles that gave the Reina Sofa opera house its gleaming, streamlined look have been falling off the building's concrete faade, turning it into a sad ruin, looking much like the rotting remains of a beached whale. A bankrupt city has left the damage stand as is. Another poorly conceived vanity project by the then ""hot"" architect Santiago Calatrava and spending-crazed public authorities with little regard of quality control and practical sense. Vocal and architectural decline mirroring each other... Outrageous!

Get this blu-ray as a souvenir of something that time has not spared. Jennifer Wilson's Brnnhilde's is a worthy match to Ryan's Siegfried and Uusitalo's Wotan. La Fura's fantastic acrobatics, always at the service of the drama, provide stunning visual commentary and the breathtaking video backgrounds are vividly captured in HD.

At least the production lives on: After the complete Padrissa/Fura cycle had been reprised in Italy, Rheingold premiered in Houston this year, with the complete cycle promised for 2020. Worth catching as well.",1432771200,,1972,5.293929712460064
