,reviewerID,asin,reviewerName,helpful,reviewText,overall,summary,unixReviewTime,reviewTime,reviewYear,reviewLength,meaningfulWords,Title
274650,A2GVUL363ATVAO,6301962788,Amazon Customer,"[0, 0]",I love Jim Belushi. He is very good in this film that has a great cast that includes Renee Russo and Linda Hamilton with a young Courtney Cox in a small role,5,Great story,1381190400,"10 8, 2013",2013,157,"['love', 'Jim', 'Belushi', 'very', 'good', 'film', 'great', 'cast', 'Renee', 'Russo', 'Linda', 'Hamilton', 'young', 'Courtney', 'Cox', 'small', 'role']",N/A
274651,A6D2M4JLBHDJ4,6301962788,"Andi T. ""Andi""","[0, 0]","This wouldbe a good family movie.  It is abouta man who wishes for more in his life, only to find that what he has is really what he wants. Funny funny",5,Mr. Destiny,1364947200,"04 3, 2013",2013,151,"['good', 'family', 'movie', 'abouta', 'man', 'who', 'more', 'life', 'only', 'find', 'what', 'really', 'what', 'Funny', 'funny']",N/A
274652,A1IKOYZVFHO1XP,6301962788,andy8047,"[2, 8]","Larry Burrows(James Belushi) is an office worker who has a disasterous 35th birthday. He didn't have his Wheaties for breakfast. He had no coffee at work(the supply of water and coffee grounds were both exhausted). What really haunts him is a mistake he made when he was 15. He missed hitting a baseball,the most important of all,at a little league game. So Larry walks into a bar run by a guardian angel(Michael Caine). The guardian angel turns Larry's life around. In the dream sequence,Larry sees his now-ex-wife with a new husband and children of their own. He meets his newly divorced father with his(the father's) new girlfriend. Also he tries to get into his house to find out it's now owned by a mean-spirited fella. One of Larry's co-workers(Jon Lovitz) has been Larry's pal since childhood. They reminisce about seeing ""Bonnie & Clyde"" in the movie theaters eight times. Another one of Larry's co-workers is a scam artist who later confessed to his wrongdoing and was terminated. Best of all,Larry has a 35th birthday party at his home. Out of the dream sequence,Larry and his wife Ellen(Rene Russo) are still married. In an earlier scene,when the Burrowses were kids,Ellen hands Larry a handkerchief with her embroidered initials on it. They read EJR which stands for Ellen Jane Ripley. Larry,in his baseball uniform,shed a few tears after his failure to hit that important baseball. Great film!",4,Belushi's destiny,1095465600,"09 18, 2004",2004,1406,"['Larry', 'Burrows', 'James', 'Belushi', 'office', 'worker', 'who', 'disasterous', '35th', 'birthday', 'did', ""n't"", 'have', 'Wheaties', 'breakfast', 'had', 'coffee', 'work', 'supply', 'water', 'coffee', 'grounds', 'were', 'exhausted', 'What', 'really', 'mistake', 'made', 'when', 'was', '15', 'missed', 'hitting', 'baseball', 'most', 'important', 'little', 'league', 'game', 'So', 'Larry', 'walks', 'bar', 'run', 'guardian', 'angel', 'Michael', 'Caine', 'guardian', 'angel', 'Larry', 'life', 'around', 'dream', 'sequence', 'Larry', 'now-ex-wife', 'new', 'husband', 'children', 'own', 'newly', 'divorced', 'father', 'father', 'new', 'girlfriend', 'Also', 'get', 'house', 'find', 'out', 'now', 'owned', 'mean-spirited', 'fella', 'One', 'Larry', 'co-workers', 'Jon', 'Lovitz', 'been', 'Larry', 'pal', 'childhood', 'reminisce', 'seeing', 'Bonnie', 'Clyde', 'movie', 'theaters', 'eight', 'times', 'one', 'Larry', 'co-workers', 'scam', 'artist', 'who', 'later', 'confessed', 'wrongdoing', 'was', 'terminated', 'Best', 'Larry', '35th', 'birthday', 'party', 'home', 'dream', 'sequence', 'Larry', 'wife', 'Ellen', 'Rene', 'Russo', 'are', 'still', 'married', 'earlier', 'scene', 'when', 'Burrowses', 'were', 'kids', 'Ellen', 'Larry', 'handkerchief', 'embroidered', 'initials', 'read', 'EJR', 'Ellen', 'Jane', 'Ripley', 'Larry', 'baseball', 'uniform', 'shed', 'few', 'tears', 'failure', 'hit', 'important', 'baseball', 'Great', 'film']",N/A
274653,A20EEWWSFMZ1PN,6301962788,"bernie ""xyzzy""","[0, 0]","Only James Belushi can take a formula story and turn it into a fun to watch script.  Even when you know how it will turn out in the end, the details and how they evolve is fun to watch over and over.  And there is a great supporting cast.  You could tell where this movie was going when Jewel Jagger (Courteney Cox) threatens to fork Larry Burrows (James Belushi) to death.Larry Burrows is unhappy with his life and pins most of it on the fact that he swung too late and misses t the ball in a game and in life.  Michael Caine as Mr. Destiny gives Larry a new chance be the person he wanted to be.  But will he like his new life?The soundtrack is still available Mr. Destiny (1990 Film)",5,"""Swung too late!""",1072137600,"12 23, 2003",2003,686,"['Only', 'James', 'Belushi', 'can', 'take', 'formula', 'story', 'turn', 'fun', 'watch', 'script', 'Even', 'when', 'know', 'how', 'will', 'turn', 'out', 'end', 'details', 'how', 'evolve', 'fun', 'watch', 'great', 'supporting', 'cast', 'could', 'tell', 'where', 'movie', 'was', 'going', 'when', 'Jewel', 'Jagger', 'Courteney', 'Cox', 'fork', 'Larry', 'Burrows', 'James', 'Belushi', 'death.Larry', 'Burrows', 'unhappy', 'life', 'most', 'fact', 'swung', 'too', 'late', 't', 'ball', 'game', 'life', 'Michael', 'Caine', 'Mr.', 'Destiny', 'Larry', 'new', 'chance', 'be', 'person', 'wanted', 'be', 'will', 'like', 'new', 'life', 'soundtrack', 'still', 'available', 'Mr.', 'Destiny', '1990', 'Film']",N/A
274654,A2SOOLQ1YRNPC0,6301962788,Beth Bailey-Kingdon,"[0, 0]","Larry Burrows had a good and fairly ordinary American childhood - until he struck out in his team's last chance to win the title.  Anyone who's ever blown it in a small town game knows that it's a lifelong stigma very hard to overcome.  Now grown up, married and a low-level executive at his dad's company, Larry is morosely driving home to his birthday celebration when his beater car breaks down outside a quaint bar on the dingy side of town.  Waiting for his tow, he stops in the bar for a drink and his life - and his perception of it - change forever.  Excellent writing, acting and direction with a good cast and beautiful production.  I watch it every year or so because it makes me happy.",5,A man walks into a bar...,1399593600,"05 9, 2014",2014,697,"['Larry', 'Burrows', 'had', 'good', 'fairly', 'ordinary', 'American', 'childhood', 'struck', 'out', 'team', 'last', 'chance', 'win', 'title', 'Anyone', 'who', 'ever', 'blown', 'small', 'town', 'game', 'lifelong', 'stigma', 'very', 'hard', 'overcome', 'Now', 'up', 'married', 'low-level', 'executive', 'dad', 'company', 'Larry', 'morosely', 'driving', 'home', 'birthday', 'celebration', 'when', 'beater', 'car', 'breaks', 'down', 'quaint', 'bar', 'dingy', 'side', 'town', 'Waiting', 'tow', 'bar', 'drink', 'life', 'perception', 'change', 'forever', 'Excellent', 'writing', 'acting', 'direction', 'good', 'cast', 'beautiful', 'production', 'watch', 'year', 'so', 'happy']",N/A
274655,A2620OKD8G71CL,6301962788,Bob,"[3, 4]","I ABSOLUTELY LOVED THIS MOVIE!! It was really good. It makes you really think about how one thing in your life effects everything else, and how if one of those things changes, everything else after that changes too. Once again, I loved this movie. If you haven't already, GO SEE IT!!",5,Absolutely Great!,1141603200,"03 6, 2006",2006,283,"['ABSOLUTELY', 'LOVED', 'THIS', 'MOVIE', 'was', 'really', 'good', 'really', 'think', 'how', 'one', 'thing', 'life', 'effects', 'everything', 'else', 'how', 'one', 'things', 'changes', 'everything', 'else', 'too', 'Once', 'again', 'loved', 'movie', 'have', ""n't"", 'already', 'GO', 'SEE', 'IT']",N/A
274656,A39SP2208RMP2R,6301962788,Brian Dubicki,"[0, 0]","This is one of those feel good, don't know what you have until it's gone kind of movies.  The main character meets Mr. Destiny who shows him what his life would be like if it had taken a different path.  I really enjoyed it plus I like most movies that James Belushi has been in.",4,Good movie,1365638400,"04 11, 2013",2013,279,"['one', 'feel', 'good', 'do', ""n't"", 'know', 'what', 'have', 'gone', 'kind', 'movies', 'main', 'character', 'meets', 'Mr.', 'Destiny', 'who', 'what', 'life', 'would', 'be', 'had', 'taken', 'different', 'path', 'really', 'enjoyed', 'like', 'most', 'movies', 'James', 'Belushi', 'been']",N/A
274657,A2KUAIJOAC3GO3,6301962788,Dance your pounds away,"[0, 0]",Love James Belushi and he was great in this movie!  Very funny and had it's romantic moments too. Great movie,5,Romantic,1367884800,"05 7, 2013",2013,109,"['Love', 'James', 'Belushi', 'was', 'great', 'movie', 'Very', 'funny', 'had', 'romantic', 'moments', 'too', 'Great', 'movie']",N/A
274658,A3VJORBT1BXJ7D,6301962788,D. R. Cottingham,"[0, 0]",Althoough an older version of James Belushi and LInda Hamilton they played their parts with passion and excellent verve for a low budget film.,4,An older version of James Belushi and LInda Hamilton,1393804800,"03 3, 2014",2014,142,"['older', 'version', 'James', 'Belushi', 'LInda', 'Hamilton', 'played', 'parts', 'passion', 'excellent', 'verve', 'low', 'budget', 'film']",N/A
274659,A3M1PLEYNDEYO8,6301962788,"G. Thomas ""Tom""","[0, 0]","Yeap.. this a modern day knock off of ""What a Wonder Life"".  In general, it was layed out well, the acting came off natural and the dialog was realistic.  If you like this movie... check out ""Groundhog Day.""",4,Light and enjoyable,1220227200,"09 1, 2008",2008,207,"['Yeap..', 'modern', 'day', 'knock', 'What', 'Wonder', 'Life', 'general', 'was', 'layed', 'out', 'well', 'acting', 'came', 'natural', 'dialog', 'was', 'realistic', 'like', 'movie', 'check', 'Groundhog', 'Day']",N/A
274660,A3CGHACA377KS,6301962788,G. Williams,"[0, 0]",Great story line and good acting. Maybe it is a 4 star. Of course I like James Belushi so that taints my review a touch. The idea of making decisions and how it affects our lives is interesting and in a comedy is just good and fun. Mr. Destiny had a nice touch in that both of his wives were nice and added to the movie a little romance. His new kids would make any audience think oh oh go back to where you started.,4,I liked it but only a 3 and a half star,1393977600,"03 5, 2014",2014,416,"['Great', 'story', 'line', 'good', 'acting', 'Maybe', '4', 'star', 'course', 'like', 'James', 'Belushi', 'taints', 'review', 'touch', 'idea', 'making', 'decisions', 'how', 'lives', 'interesting', 'comedy', 'just', 'good', 'fun', 'Mr.', 'Destiny', 'had', 'nice', 'touch', 'wives', 'were', 'nice', 'added', 'movie', 'little', 'romance', 'new', 'kids', 'would', 'make', 'audience', 'think', 'oh', 'go', 'back', 'where', 'started']",N/A
274661,A3L3ORBU5IXTMX,6301962788,Jacquelin L. Morris,"[0, 0]",My daughter wanted to get this to give as a gift. When it came she was happy to be able to give this as agift and it works great.,5,Mr. Destiny,1380844800,"10 4, 2013",2013,129,"['daughter', 'wanted', 'get', 'give', 'gift', 'When', 'came', 'was', 'happy', 'be', 'able', 'give', 'agift', 'great']",N/A
274662,A22UDJ0HTIZEUG,6301962788,"John Falone ""Only the Truth...always.""","[2, 3]","This is a classic tale of wanting what you don't have when you should be happy for what you already have.Jim is as funny as he usually is, and the story is very good.",4,Classic,1168905600,"01 16, 2007",2007,166,"['classic', 'tale', 'wanting', 'what', 'do', ""n't"", 'have', 'when', 'should', 'be', 'happy', 'what', 'already', 'have.Jim', 'as', 'funny', 'usually', 'story', 'very', 'good']",N/A
274663,A1H4WEPAO3QEOK,6301962788,John K.,"[0, 0]","OK, a modern-day remake of ""It's a Wonderful Life"". Sure, it's been done before - several times. But remember that it was Jimmy Stewart, not the story, that shot the original flick into the stratosphere. Likewise, it was Belushi who gave this one legs. Hamilton and Lovitz weren't too shabby, either. And Michael Caine - forget about it!Still, the story is great in and of itself. I guess the message here is that it's not the bad breaks in life that determine your happiness, rather it's the choices you make afterwards. I thought the concept of ""destiny"" whispering in your ear was over the top, but otherwise a very enjoyable movie.Thankfully the writers restrained from heaping on schmaltz or morality lessons. Belushi got a [virtual] second chance - something we all wish for. What he did afterwards was up to him, and so the story ends. OK, so the fairy-tale promotion and sudden wealth was unecessary to the story. I'll give that a pass, though. It's Hollywood.",5,"""But Larry, You've Been Right Here All Along""",1399939200,"05 13, 2014",2014,968,"['OK', 'modern-day', 'remake', 'Wonderful', 'Life', 'Sure', 'been', 'done', 'several', 'times', 'remember', 'was', 'Jimmy', 'Stewart', 'not', 'story', 'shot', 'original', 'flick', 'stratosphere', 'Likewise', 'was', 'Belushi', 'who', 'gave', 'one', 'legs', 'Hamilton', 'Lovitz', 'were', ""n't"", 'too', 'shabby', 'either', 'Michael', 'Caine', 'forget', 'Still', 'story', 'great', 'guess', 'message', 'here', 'not', 'bad', 'breaks', 'life', 'determine', 'happiness', 'rather', 'choices', 'make', 'afterwards', 'thought', 'concept', 'destiny', 'whispering', 'ear', 'was', 'top', 'otherwise', 'very', 'enjoyable', 'movie.Thankfully', 'writers', 'restrained', 'heaping', 'schmaltz', 'morality', 'lessons', 'Belushi', 'got', '[', 'virtual', ']', 'second', 'chance', 'something', 'wish', 'What', 'did', 'afterwards', 'was', 'up', 'so', 'story', 'OK', 'fairy-tale', 'promotion', 'sudden', 'wealth', 'was', 'unecessary', 'story', ""'ll"", 'give', 'pass', 'though', 'Hollywood']",N/A
274664,AP600TYFKLDRX,6301962788,kpc001,"[1, 1]","This is an underrated movie from the early 1990's.  It reminds you of &#34;It's a Wonderful Life&#34; and considers how your life would change if one thing in your childhood ended up differently. Don't get me wrong...this isn't Capra and Stewart, but in its way this movie holds its own.  Jim Belushi gives a solid performance as the lead in this movie, and frankly I think this is probably his best performance as a leading man in movies.  He makes the role his own, and brings compassion to the role...you root for him to get back to the life he wants.  The supporting cast is great:  Jon Lovitz, Renee Russo, Linda Hamilton...all staples of the '90's.  You won't be disappointed in spending some time with this film.",4,A Very Good Movie...and Very Underrated,1384128000,"11 11, 2013",2013,719,"['underrated', 'movie', 'early', '1990', '34', 'Wonderful', 'Life', '34', 'considers', 'how', 'life', 'would', 'change', 'one', 'thing', 'childhood', 'ended', 'up', 'differently', 'Do', ""n't"", 'get', 'wrong', ""n't"", 'Capra', 'Stewart', 'way', 'movie', 'own', 'Jim', 'Belushi', 'solid', 'performance', 'lead', 'movie', 'frankly', 'think', 'probably', 'best', 'performance', 'leading', 'man', 'movies', 'role', 'own', 'compassion', 'role', 'root', 'get', 'back', 'life', 'supporting', 'cast', 'great', 'Jon', 'Lovitz', 'Renee', 'Russo', 'Linda', 'Hamilton', 'staples', ""'90"", 'wo', ""n't"", 'be', 'disappointed', 'spending', 'time', 'film']",N/A
274665,ADM7GX12MWKFB,6301962788,"Kyra fan ""movie buff""","[0, 0]","Not my favorite James Belushi movie, but still enjoyable.  LIked The Return of Max Dugan and K-9 better!  Love James Belushi though!!",3,"Mr. Destiny, Belushi",1315008000,"09 3, 2011",2011,133,"['Not', 'favorite', 'James', 'Belushi', 'movie', 'still', 'enjoyable', 'LIked', 'Return', 'Max', 'Dugan', 'K-9', 'better', 'Love', 'James', 'Belushi']",N/A
274666,A1TTBKAI9Y0N7E,6301962788,Lady Angel,"[0, 0]",This old movie are childhood favorites of mine.  It is a joy to view it in the comfort of your own home.,5,My Husband's favorite,1355184000,"12 11, 2012",2012,104,"['old', 'movie', 'are', 'childhood', 'favorites', 'mine', 'joy', 'view', 'comfort', 'own', 'home']",N/A
274667,A398G2FNCM44X5,6301962788,me777,"[0, 0]",I love movies that really have a meaning.  Plus this was filmed in NC  - this was a fantastic movie,5,I loved this movie,1384992000,"11 21, 2013",2013,99,"['love', 'movies', 'really', 'have', 'meaning', 'was', 'filmed', 'NC', 'was', 'fantastic', 'movie']",N/A
274668,A2JGCTZF6PTO0O,6301962788,Milo,"[0, 0]","This movie his funny, packed with great actors story line and it even tickles the funny bone allot. It's great for a weekend movie night....",5,DVD's,1385769600,"11 30, 2013",2013,140,"['movie', 'funny', 'packed', 'great', 'actors', 'story', 'line', 'even', 'funny', 'bone', 'allot', 'great', 'weekend', 'movie', 'night']",N/A
274669,AER15RIMV8E6D,6301962788,Pumpkin Man,"[0, 0]","My dad and I watched this at 5:00 in the morning today, and I thought it was really good! It has a great storyline, great message, and great actors! On Larry Burrow's 35th birthday, he is really depressed and fired from his job because he found out that one of his co-workers will cripple the company that he works for. He goes to a bar and talks to the  bartender named Mike. Larry blames all of his problems on a baseball game he lost 20 years ago. When Larry drinks a special mix of drinks, he is transferred  to an alternate reality where he is rich, the boss of the company, and he has another wife. He likes it at first, but then he realizes that he wants his old life back. I highly recommend MR. DESTINY!!!",5,An Awesome Film!!!,1244332800,"06 7, 2009",2009,714,"['dad', 'watched', '5:00', 'morning', 'today', 'thought', 'was', 'really', 'good', 'great', 'storyline', 'great', 'message', 'great', 'actors', 'Larry', 'Burrow', '35th', 'birthday', 'really', 'depressed', 'fired', 'job', 'found', 'out', 'one', 'co-workers', 'will', 'cripple', 'company', 'bar', 'talks', 'bartender', 'named', 'Mike', 'Larry', 'problems', 'baseball', 'game', 'lost', '20', 'years', 'ago', 'When', 'Larry', 'special', 'mix', 'drinks', 'transferred', 'alternate', 'reality', 'where', 'rich', 'boss', 'company', 'wife', 'first', 'then', 'old', 'life', 'back', 'highly', 'recommend', 'MR', 'DESTINY']",N/A
274670,A1XOHF5R15QVAD,6301962788,Regina Clarke,"[0, 0]","James Belushi and Linda Hamilton, Michael Caine and Renee Russo, and a wonderful plot--how can it go wrong? Watch it every Christmas and it never fails to enchant.",5,Super fine Christmas movie,1392422400,"02 15, 2014",2014,163,"['James', 'Belushi', 'Linda', 'Hamilton', 'Michael', 'Caine', 'Renee', 'Russo', 'wonderful', 'plot', 'how', 'can', 'go', 'wrong', 'Watch', 'Christmas', 'never', 'enchant']",N/A
274671,A2I6BQD0G7RYKH,6301962788,Rokeno,"[0, 0]",I recall this being a nice movie and bought it for my DVD library but I think my memory is not what it used to be.  It's uplifting be a little dull.,3,So So.,1361750400,"02 25, 2013",2013,148,"['recall', 'being', 'nice', 'movie', 'bought', 'DVD', 'library', 'think', 'memory', 'not', 'what', 'used', 'be', 'uplifting', 'be', 'little', 'dull']",N/A
274672,A141G76IBJ7I7T,6301962788,"S. Brand ""sandra807""","[14, 16]","Mr. Destiny is not only fun entertainment, it deals with the question every person asks at some time in their life:  How would my life be different now if only I had....?  James Belushi charmingly plays the man who lost his job, and finds himself wishing he could change his past and start over.  He finds his chance to do just that after a little magical intervention by Mr. Destiny (Michael Caine).  With just one change in his past...from losing the big baseball game, to winning it, Belushi's life takes a different path.  Suddenly plopped into his new life, with a different wife and a different job, he encounters many troublesome adventures...humorous for the viewer, but disastrous for Belushi.  Just at the point of hopelessness, Mr. Destiny intervenes again, but I won't give away anymore  of the plot here.  I loved Belushi's character... in spite of his troubles, he confronts all situations with grace and humor.  The movie is sweet, funny, and even carries an encouraging message:  Don't regret the past, but go forward and make the best of what you've got!",4,Go forward with your life!,1042329600,"01 12, 2003",2003,1071,"['Mr.', 'Destiny', 'not', 'only', 'fun', 'entertainment', 'question', 'person', 'time', 'life', 'How', 'would', 'life', 'be', 'different', 'now', 'only', 'had', 'James', 'Belushi', 'charmingly', 'man', 'who', 'lost', 'job', 'wishing', 'could', 'change', 'past', 'start', 'chance', 'do', 'just', 'little', 'magical', 'intervention', 'Mr.', 'Destiny', 'Michael', 'Caine', 'just', 'one', 'change', 'past', 'losing', 'big', 'baseball', 'game', 'winning', 'Belushi', 'life', 'different', 'path', 'Suddenly', 'plopped', 'new', 'life', 'different', 'wife', 'different', 'job', 'many', 'troublesome', 'adventures', 'humorous', 'viewer', 'disastrous', 'Belushi', 'Just', 'point', 'hopelessness', 'Mr.', 'Destiny', 'again', 'wo', ""n't"", 'give', 'away', 'anymore', 'plot', 'here', 'loved', 'Belushi', 'character', 'spite', 'troubles', 'situations', 'grace', 'humor', 'movie', 'sweet', 'funny', 'even', 'encouraging', 'message', 'Do', ""n't"", 'regret', 'past', 'go', 'forward', 'make', 'best', 'what', ""'ve"", 'got']",N/A
274673,A377RN8AAYN3UL,6301962788,StonewallBrigade,"[0, 0]","A very underrated movie in my opinion, one that not many people know about. It is very funny with a lot of great and memorable lines in it. This is one of my all-time favorite movies and I usually watch it once every summer. I highly recommend checking it out.",5,One of my all-time faves!,1375142400,"07 30, 2013",2013,260,"['very', 'underrated', 'movie', 'opinion', 'one', 'not', 'many', 'people', 'know', 'very', 'funny', 'lot', 'great', 'memorable', 'lines', 'one', 'all-time', 'favorite', 'movies', 'usually', 'watch', 'once', 'summer', 'highly', 'recommend', 'checking', 'out']",N/A
274674,A2FF6HVK48D1C0,6301962788,Tim Williams,"[0, 0]","""Mr. Destiny"" has a worthy theme, an excellent cast and a smooth progression, but I struggle to remember any character or scene that moved me deeply. It is like a soap bubble--amusing, attractive but ephemeral. It isn't bad. With Jim Belushi's easy-going charm and an outstanding group of supporting actors, how could it be? My favorite scene involves one of those supporting actors (Maury Chaykin) and Belushi in a hilarious negotiation over paving the driveway. ""There's a mud guy?"" And the movie can make us think about how we wistfully look back at the choices and events of our lives, but I think other stories (""It's a Wonderful Life"", ""Back to the Future"", ""Frequency"") or poems (""The Road Not Taken"") do a much better job of that. The movie is rated PG-13 for profanity, some thematic elements and a lingerie-clad love scene.",2,Two Roads Diverged at Renaissance Field,1326326400,"01 12, 2012",2012,833,"['Mr.', 'Destiny', 'worthy', 'theme', 'excellent', 'cast', 'smooth', 'progression', 'struggle', 'remember', 'character', 'scene', 'moved', 'deeply', 'soap', 'bubble', 'amusing', 'attractive', 'ephemeral', ""n't"", 'bad', 'Jim', 'Belushi', 'easy-going', 'charm', 'outstanding', 'group', 'supporting', 'actors', 'how', 'could', 'be', 'My', 'favorite', 'scene', 'one', 'supporting', 'actors', 'Maury', 'Chaykin', 'Belushi', 'hilarious', 'negotiation', 'paving', 'driveway', 'mud', 'guy', 'movie', 'can', 'make', 'think', 'how', 'wistfully', 'look', 'back', 'choices', 'events', 'lives', 'think', 'other', 'stories', 'Wonderful', 'Life', 'Back', 'Future', 'Frequency', 'Road', 'Not', 'Taken', 'do', 'much', 'better', 'job', 'movie', 'rated', 'PG-13', 'profanity', 'thematic', 'elements', 'lingerie-clad', 'love', 'scene']",N/A
274675,A2R9WPHRH7L5JA,6301962788,Tony Martin,"[0, 0]",James Belushi is a great actor and the cast also makes the movie. Just a good movie with a good feeling all around. Glad to have it.,5,This is a good movie and am glad I bought it.,1392163200,"02 12, 2014",2014,132,"['James', 'Belushi', 'great', 'actor', 'cast', 'also', 'movie', 'Just', 'good', 'movie', 'good', 'feeling', 'around', 'Glad', 'have']",N/A
274676,A3HIGD9OJH4NV0,6301962788,twetter,"[0, 0]",too bad we all are not all able to go back in time and correct the events that happened in our lives to have a different out come and come out better for it.,5,great movie,1396396800,"04 2, 2014",2014,157,"['too', 'bad', 'are', 'not', 'able', 'go', 'back', 'time', 'correct', 'events', 'happened', 'lives', 'have', 'different', 'come', 'come', 'out', 'better']",N/A
274677,AL6JIT43D8D4Z,6301962788,"unraveler ""unraveler""","[4, 10]","Is this movie trying to implying that it's bad to be a greedy, maniacal corporate leader without conscience or empathy? C'mon, get outta here. They could not possibly think THAT up in Hollywood, could they? Well, Mr. Destiny, played by Michael Caine, offers James Belushi a chance to be a wealthy corporate hot shot instead of a regular James. As you can imagine, it does not work our well for James. You know, self-loathing, John Lovitz (a friend) almost commits suicide--the usual stuff. The movie has funny moments, and the pace is pretty good. The ending is somewhat predictable, James is happy to be a regular James (again). It's not all about the money. I don't blame him, I wouldn't wanna be a Kenneth Lay either.",4,Don't Fight Your Destiny,1064361600,"09 24, 2003",2003,720,"['movie', 'trying', 'implying', 'bad', 'be', 'greedy', 'maniacal', 'corporate', 'leader', 'conscience', 'empathy', ""C'mon"", 'get', 'outta', 'here', 'could', 'not', 'possibly', 'think', 'THAT', 'up', 'Hollywood', 'could', 'Well', 'Mr.', 'Destiny', 'played', 'Michael', 'Caine', 'James', 'Belushi', 'chance', 'be', 'wealthy', 'corporate', 'hot', 'shot', 'instead', 'regular', 'James', 'can', 'imagine', 'not', 'work', 'well', 'James', 'know', 'self-loathing', 'John', 'Lovitz', 'friend', 'almost', 'commits', 'suicide', 'usual', 'stuff', 'movie', 'funny', 'moments', 'pace', 'pretty', 'good', 'ending', 'somewhat', 'predictable', 'James', 'happy', 'be', 'regular', 'James', 'again', 'not', 'money', 'do', ""n't"", 'blame', 'would', ""n't"", 'wan', 'na', 'be', 'Kenneth', 'Lay', 'either']",N/A
