,reviewerID,asin,reviewerName,helpful,reviewText,overall,summary,unixReviewTime,reviewTime,reviewYear,reviewLength,meaningfulWords,Title
929306,A19RAJY6R7USN0,B000AO9BSS,"Lee Neville ""emotionboy""","[3, 4]","AND NOW THE CONCLUSION...As promised, here is my review for Season 2.And what a step up it is. It gets off to a great start with the Season Premiere that provides momentum for the remaining episodes. Having Jack challenge Tru at every turn brings up so many more possibilities. And having Jack have a mole is a nice touch. There's even a step up when it comes to the emotional stakes.It is now that I would start recommending it to people. Of course we know it got cancelled (probably prematurely). Shame.",4,Tru Calling Seasons 1 & 2 DVD(s) Review (Part 2),1124582400,"08 21, 2005",2005,505,"['NOW', 'THE', 'CONCLUSION', 'promised', 'here', 'review', 'Season', '2.And', 'what', 'step', 'off', 'great', 'start', 'Season', 'Premiere', 'momentum', 'remaining', 'episodes', 'Having', 'Jack', 'challenge', 'Tru', 'turn', 'up', 'so', 'many', 'more', 'possibilities', 'having', 'Jack', 'have', 'mole', 'nice', 'touch', 'even', 'step', 'up', 'when', 'emotional', 'stakes.It', 'now', 'would', 'start', 'recommending', 'people', 'course', 'know', 'got', 'cancelled', 'probably', 'prematurely', 'Shame']",N/A
929307,AZ2PHKO571Y0S,B000AO9BSS,"L. Leach ""L.Wildy""","[1, 1]","I bought this after only seeing one episode, which at the time i didn't know it was the last one.  I loved this show. I bought the first and second season.  It was even more exciting when Jason priestly cam on the cast as her evil opposite.  we later find out that him and the father of tru davies, eliza, are in this together, where the father use to do what he does, when he was younger and the mother was like Tru.  The interesting spin on this is that while jason is trying to make sure the people that dies the day before the day rewound die again the next toime they relive the day,  Tru is trying to find out what went wrong so that she can save them the second time around.  I think the writers were very creative.  Also because of Jack, (Jason), and Tru, (Eliza's), points of view it makes it hard to think of anyone as the bad guy.  Jack feels that by reliving the day and making sure that the person who dies the day before dies again when the day repeats, he is helping the universe.  Tru feels that because she has the gift to relive days that she has been given the gift to help other people, and where it went wrong the first time it won't go wrong the second time if she can help it.",5,why did they have to take this off the air?,1184284800,"07 13, 2007",2007,1199,"['bought', 'only', 'seeing', 'one', 'episode', 'time', 'i', 'did', ""n't"", 'know', 'was', 'last', 'one', 'loved', 'show', 'bought', 'first', 'second', 'season', 'was', 'even', 'more', 'exciting', 'when', 'Jason', 'priestly', 'cast', 'evil', 'opposite', 'later', 'find', 'out', 'father', 'tru', 'davies', 'eliza', 'are', 'together', 'where', 'father', 'use', 'do', 'what', 'when', 'was', 'younger', 'mother', 'was', 'Tru', 'interesting', 'spin', 'jason', 'trying', 'make', 'sure', 'people', 'day', 'day', 'rewound', 'die', 'again', 'next', 'toime', 'relive', 'day', 'Tru', 'trying', 'find', 'out', 'what', 'went', 'wrong', 'so', 'can', 'save', 'second', 'time', 'think', 'writers', 'were', 'very', 'creative', 'Also', 'Jack', 'Jason', 'Tru', 'Eliza', 'points', 'view', 'hard', 'think', 'anyone', 'bad', 'guy', 'Jack', 'reliving', 'day', 'making', 'sure', 'person', 'who', 'day', 'dies', 'again', 'when', 'day', 'helping', 'universe', 'Tru', 'feels', 'gift', 'relive', 'days', 'been', 'given', 'gift', 'help', 'other', 'people', 'where', 'went', 'first', 'time', 'wo', ""n't"", 'go', 'wrong', 'second', 'time', 'can', 'help']",N/A
929308,A24WJ5JC76X7D3,B000AO9BSS,Lori Kaminsky,"[5, 9]","Tru Calling is one of my favorite shows.  I had thought the show as back when the second season began.  But, it only had a few episodes.  Only six were made for this season and only five were aired.  This set is the only way to see that last episode.  Also, this set has a making of featurette.To join a site that has information on this dvd and more, follow this link:[...]",5,Tru Calling Season Two,1130803200,"11 1, 2005",2005,374,"['Tru', 'Calling', 'one', 'favorite', 'shows', 'had', 'thought', 'show', 'back', 'when', 'second', 'season', 'began', 'only', 'had', 'few', 'episodes', 'Only', 'six', 'were', 'made', 'season', 'only', 'five', 'were', 'aired', 'set', 'only', 'way', 'see', 'last', 'episode', 'Also', 'set', 'making', 'featurette.To', 'join', 'site', 'information', 'dvd', 'more', 'follow', 'link', '[', ']']",N/A
929309,A1F0BR7I1M1MH5,B000AO9BSS,"Louis Pintar ""long time film buff""","[4, 7]",".Tru Calling consistently did better with each succeeding episode, and the much abbreviated season 2 continued to do so.  Why the show was canceled is a mystery to me.  Maybe it dared too much to be different, but certainly it belongs in the same pantheon as Buffy,  Angel and Alias.",4,Not the same old stuff,1126224000,"09 9, 2005",2005,283,"['.Tru', 'Calling', 'consistently', 'did', 'better', 'succeeding', 'episode', 'much', 'abbreviated', 'season', '2', 'continued', 'do', 'so', 'Why', 'show', 'was', 'canceled', 'mystery', 'Maybe', 'dared', 'too', 'much', 'be', 'different', 'certainly', 'same', 'pantheon', 'Buffy', 'Angel', 'Alias']",N/A
929310,A2UGD5G469LD36,B000AO9BSS,"M. Harbach ""Floorfiller""","[11, 13]","Why is it that whenever a show breaks away from the precedents of molding the crime scene or ghost interacting moldings, they are quick to be cancelled? It was worse enough that CBS has decided to pull the plug on one of their best non-criminal based shows Joan of Arcadia after it took a dark turn with the series finale dealing with foreshadowing of Joan in the middle of good and evil, now they decide to cancel Tru Calling.Yes, Tru Davies did talk to dead people. However, it wasn't in the Jennifer Love Hewitt/ Patricia Arquette formula where her purpose is to make them feel complete by solving their ""unfinished business."" No, Tru was meant to prevent their deaths, which is the twist that primetime TV needed.The first season of Tru Calling seemed a little desperate to grab viewer's attentions, especially with the recurring role of Jack Harper (Jason Priestly) as her complete opposite. But the bickering between Jack and Tru, the race to either save a life or prevent it from being saved, is really what brought in those 4 million audiences. If there was a major complaint in the first season it is that Tru never seemed to reach a limit with Jack. Maybe it was because she is known as the fierce ass-kicking Faith in Buffy, but in the episode ""Two Weddings and A Funeral,"" her encounter with Jack at the funeral lead me to thinking that she would ressurect her old Faith ways on Jack, but instead it was just verbal resentment - something I loathe when I know she can do some damange.The second season showed much promise, as the stories got deeper as well as the character development. Harrison was on the verge of cleaning up his gambling life while stumbling across daddy's plans to prevent Tru from saving lives. We also saw Jack and Tru in an uncanny predicament where they both switch roles and Jack learns how it feels to lose a life. There was also more action like the first episode ""The Perfect Storm"" where we are actually shouting to the TV, ""Save them, Tru."" These ingredients would have really blossomed this show into the hit it was supposed to be.Now that FOX has cancelled Tru Calling for show like Point Pleasant who fell off the map faster than a Jessica Simpson single, fans are now saying, ""Save it, FOX!"" Why not ressurect this witty and creative idea rather than following the same patterns that CBS has now been accustomed to. Rather than making the male equivalent to ""Ghost Whisperer"" (will James Marsters from Buffy be playing the lead role?) Let's stick to something original. But now that I mentioned it, giving James Marsters his own show isn't a bad idea. Can we say, ""Spike"" spinoff?",5,Daring to be Different = Cancelled,1128124800,"10 1, 2005",2005,2627,"['Why', 'show', 'away', 'precedents', 'molding', 'crime', 'scene', 'ghost', 'interacting', 'moldings', 'are', 'quick', 'be', 'cancelled', 'was', 'worse', 'enough', 'CBS', 'decided', 'pull', 'plug', 'one', 'best', 'non-criminal', 'based', 'shows', 'Joan', 'Arcadia', 'took', 'dark', 'turn', 'series', 'finale', 'dealing', 'foreshadowing', 'Joan', 'middle', 'good', 'evil', 'now', 'decide', 'cancel', 'Tru', 'Calling.Yes', 'Tru', 'Davies', 'did', 'talk', 'dead', 'people', 'However', 'was', ""n't"", 'Jennifer', 'Love', 'Hewitt/', 'Patricia', 'Arquette', 'formula', 'where', 'purpose', 'make', 'feel', 'complete', 'solving', 'unfinished', 'business', 'No', 'Tru', 'was', 'meant', 'prevent', 'deaths', 'twist', 'primetime', 'TV', 'needed.The', 'first', 'season', 'Tru', 'Calling', 'seemed', 'little', 'desperate', 'grab', 'viewer', 'attentions', 'especially', 'recurring', 'role', 'Jack', 'Harper', 'Jason', 'Priestly', 'complete', 'opposite', 'bickering', 'Jack', 'Tru', 'race', 'save', 'life', 'prevent', 'being', 'saved', 'really', 'what', 'brought', '4', 'million', 'audiences', 'was', 'major', 'complaint', 'first', 'season', 'Tru', 'never', 'seemed', 'reach', 'limit', 'Jack', 'Maybe', 'was', 'known', 'fierce', 'ass-kicking', 'Faith', 'Buffy', 'episode', 'Two', 'Weddings', 'A', 'Funeral', 'encounter', 'Jack', 'funeral', 'lead', 'thinking', 'would', 'ressurect', 'old', 'Faith', 'ways', 'Jack', 'instead', 'was', 'just', 'verbal', 'resentment', 'something', 'loathe', 'when', 'know', 'can', 'do', 'damange.The', 'second', 'season', 'showed', 'much', 'promise', 'stories', 'got', 'deeper', 'as', 'well', 'character', 'development', 'Harrison', 'was', 'verge', 'cleaning', 'up', 'gambling', 'life', 'stumbling', 'daddy', 'plans', 'prevent', 'Tru', 'saving', 'lives', 'also', 'saw', 'Jack', 'Tru', 'uncanny', 'predicament', 'where', 'switch', 'roles', 'Jack', 'how', 'lose', 'life', 'was', 'also', 'more', 'action', 'first', 'episode', 'Perfect', 'Storm', 'where', 'are', 'actually', 'shouting', 'TV', 'Save', 'Tru', 'ingredients', 'would', 'have', 'really', 'blossomed', 'show', 'hit', 'was', 'supposed', 'be.Now', 'FOX', 'cancelled', 'Tru', 'Calling', 'show', 'Point', 'Pleasant', 'who', 'fell', 'off', 'map', 'faster', 'Jessica', 'Simpson', 'single', 'fans', 'are', 'now', 'saying', 'Save', 'FOX', 'Why', 'not', 'ressurect', 'witty', 'creative', 'idea', 'rather', 'following', 'same', 'patterns', 'CBS', 'now', 'been', 'accustomed', 'Rather', 'making', 'male', 'equivalent', 'Ghost', 'Whisperer', 'will', 'James', 'Marsters', 'Buffy', 'be', 'playing', 'lead', 'role', 'Let', 'stick', 'something', 'original', 'now', 'mentioned', 'giving', 'James', 'Marsters', 'own', 'show', ""n't"", 'bad', 'idea', 'Can', 'say', 'Spike', 'spinoff']",N/A
929311,ASX8DPB8MZCPI,B000AO9BSS,N,"[2, 5]","This show was getting really good in the 2nd season and once again we have FOX to thank for yanking yet another great show. They didn't want to just cancel it, they figured they show us the 2nd season and then never air the fianle. Good one FOX! I'm hoping that Reunion doesn't get the boot because its from the same creators of Tru Calling so all of you out there better watch!!! I think if they had a Tru Calling/Point Pleasant night and OC/ Reunion Night things would have been perfect!!! Loved Tru Caliing, and getting the DVD and you better too =)",5,Great Show! Gone too soon!,1125964800,"09 6, 2005",2005,552,"['show', 'was', 'getting', 'really', 'good', '2nd', 'season', 'once', 'again', 'have', 'FOX', 'thank', 'yanking', 'yet', 'great', 'show', 'did', ""n't"", 'want', 'just', 'cancel', 'figured', 'show', '2nd', 'season', 'then', 'never', 'air', 'fianle', 'Good', 'one', 'FOX', ""'m"", 'hoping', 'Reunion', ""n't"", 'get', 'boot', 'same', 'creators', 'Tru', 'Calling', 'there', 'better', 'watch', 'think', 'had', 'Tru', 'Calling/Point', 'Pleasant', 'night', 'OC/', 'Reunion', 'Night', 'things', 'would', 'have', 'been', 'perfect', 'Loved', 'Tru', 'Caliing', 'getting', 'DVD', 'better', 'too', '=']",N/A
929312,A25NV7VSWVFGR1,B000AO9BSS,"Richard Todd ""Richard Todd""","[0, 0]","Sometimes very good shows are mis-handled and are gone the next day.Though I can say for one thing that this show was a delight in many ways, the cameos from other actors always make me smile as well.In season 1 there is Joe (SGA) Nicholas Lee (X-files)In Season 2 there is another actor from the Star Gate film and SG1 series.And the list goes on.I can say for sure this is number 10 on my list.It's too bad that it was cancelled, I would have watched countless seasons of it.",5,A Tru Calling,1347494400,"09 13, 2012",2012,477,"['Sometimes', 'very', 'good', 'shows', 'are', 'mis-handled', 'are', 'gone', 'next', 'day.Though', 'can', 'say', 'one', 'thing', 'show', 'was', 'delight', 'many', 'ways', 'cameos', 'other', 'actors', 'always', 'make', 'smile', 'well.In', 'season', '1', 'Joe', 'SGA', 'Nicholas', 'Lee', 'X-files', 'Season', '2', 'actor', 'Star', 'Gate', 'film', 'SG1', 'series.And', 'list', 'on.I', 'can', 'say', 'sure', 'number', '10', 'list.It', 'too', 'bad', 'was', 'cancelled', 'would', 'have', 'watched', 'countless', 'seasons']",N/A
929313,A2Q4CZVCN5APDL,B000AO9BSS,Rick,"[2, 60]","It's a bad show.  Badly conceived, bad writing, bad acting.  It never should have gotten past a full first season, much less a second, even one this short.  How could Fox cancel the vastly superior Point Pleasant and replace it with this crap??!!Don't buy the first season and don't buy this second season or else you will be regretting the wasted money.",1,How did it get this far??!!,1132358400,"11 19, 2005",2005,354,"['bad', 'show', 'Badly', 'conceived', 'bad', 'writing', 'bad', 'acting', 'never', 'should', 'have', 'gotten', 'full', 'first', 'season', 'much', 'less', 'second', 'even', 'one', 'short', 'How', 'could', 'Fox', 'cancel', 'vastly', 'superior', 'Point', 'Pleasant', 'replace', 'crap', 'Do', ""n't"", 'buy', 'first', 'season', 'do', ""n't"", 'buy', 'second', 'season', 'else', 'will', 'be', 'regretting', 'wasted', 'money']",N/A
929314,A16QODENBJVUI1,B000AO9BSS,Robert Moore,"[2, 2]","Season One of TRU CALLING was so poorly watched that just about everyone was astonished when it was renewed for a second season.  Then everyone was even more baffled when production on the show was ended before a single episode of Season Two was broadcast.  FOX has done some very strange and inexplicable things over the years, but the whole now-it's-renewed/now-it's-cancelled dance with TRU CALLING has to rank at the top.In my review of Season One I mentioned that it simply wasn't the case that Eliza Dushku had taken on TRU CALLING rather than a Faith spin off to BUFFY THE VAMPIRE SLAYER.  The latter existed only to the extent that there was talk about its possibility.  But absolutely none of the trappings of a TV show were in place.  In other words, Eliza chose an actual show that was going into production over the mere possibility that Joss Whedon and Co. might pitch a Faith spin off to some network.  But as the first season of TRU CALLING was winding down, there was some talk once again of a Faith spin off.  Again, not an actual series, but the idea came alive again.  But with the renewal of TRU CALLING, that died once again.It is hard to figure out what was going on inside FOX.  The six completed episodes of Season Two show a lot of promise.  They do not show a truly (no pun intended) great show -- at its best TRU CALLING was merely good and promising -- but they show a dedicated production staff and cast trying hard to make the show exceed the limitations of its premise.  The episodes were definitely as good as Season One at its best.  It simply isn't clear what happened between renewal and cancellation that made FOX give up on the series.So, for the most part, watching these episodes is a sad experience.  They gesture toward what might have been, toward what the show was trying to become when it was unceremoniously shut down.  The writers were doing a more than decent job of pushing at the limitations of the series -- Tru being asked by a dead individual for help of some kind, and the day restarting with her having a chance to bring about a change of some kind, if only she can overcome the efforts of Jack (Jason Priestly) to bring about the same outcome as before -- and were developing what appeared to be a more complex overall story when everything came to a dead stop.Do I recommend this?  I guess it depends.  If you are looking for a great story and challenging character development, no.  To engage in personification, this is a series that was cut off at the knees.  It ends suddenly, in the middle of its story, with utterly no resolution of any kind.  Some might prefer just sticking with the end of Season One, which brings slightly more closure.  But if the all-too-sudden ending doesn't put you off, the six episodes that make up the very brief Season Two are all at least very decent and they do give many hints at the direction the show was heading.  In particular I enjoyed the episode where Jack instead of Tru is asked for help by a dead person.  It was not merely a good episode, but showed how the writers were doing all they could to bring about innovations to the standard plot progression.  So, these set functions more as a hint of what might have been than anything.  What there is, is pretty good.  The shame is that there simply isn't very much.",4,A series with a degree of promise comes to a jagged and sudden end,1208476800,"04 18, 2008",2008,3316,"['Season', 'One', 'TRU', 'CALLING', 'was', 'so', 'poorly', 'watched', 'just', 'everyone', 'was', 'astonished', 'when', 'was', 'renewed', 'second', 'season', 'Then', 'everyone', 'was', 'even', 'more', 'baffled', 'when', 'production', 'show', 'was', 'ended', 'single', 'episode', 'Season', 'Two', 'was', 'broadcast', 'FOX', 'done', 'very', 'strange', 'inexplicable', 'things', 'years', 'whole', ""now-it's-renewed/now-it's-cancelled"", 'dance', 'TRU', 'CALLING', 'rank', 'top.In', 'review', 'Season', 'One', 'mentioned', 'simply', 'was', ""n't"", 'case', 'Eliza', 'Dushku', 'had', 'taken', 'TRU', 'CALLING', 'rather', 'Faith', 'spin', 'BUFFY', 'THE', 'VAMPIRE', 'SLAYER', 'latter', 'existed', 'only', 'extent', 'was', 'talk', 'possibility', 'absolutely', 'none', 'trappings', 'TV', 'show', 'were', 'place', 'other', 'words', 'Eliza', 'chose', 'actual', 'show', 'was', 'going', 'production', 'mere', 'possibility', 'Joss', 'Whedon', 'Co.', 'might', 'pitch', 'Faith', 'spin', 'off', 'network', 'first', 'season', 'TRU', 'CALLING', 'was', 'winding', 'down', 'was', 'talk', 'once', 'again', 'Faith', 'spin', 'off', 'Again', 'not', 'actual', 'series', 'idea', 'came', 'alive', 'again', 'renewal', 'TRU', 'CALLING', 'died', 'once', 'again.It', 'hard', 'figure', 'out', 'what', 'was', 'going', 'FOX', 'six', 'completed', 'episodes', 'Season', 'Two', 'show', 'lot', 'promise', 'do', 'not', 'show', 'truly', 'pun', 'intended', 'great', 'show', 'best', 'TRU', 'CALLING', 'was', 'merely', 'good', 'promising', 'show', 'dedicated', 'production', 'staff', 'cast', 'trying', 'hard', 'make', 'show', 'exceed', 'limitations', 'premise', 'episodes', 'were', 'definitely', 'as', 'good', 'Season', 'One', 'best', 'simply', ""n't"", 'clear', 'what', 'happened', 'renewal', 'cancellation', 'made', 'FOX', 'give', 'up', 'series.So', 'most', 'part', 'watching', 'episodes', 'sad', 'experience', 'gesture', 'what', 'might', 'have', 'been', 'what', 'show', 'was', 'trying', 'become', 'when', 'was', 'unceremoniously', 'shut', 'down', 'writers', 'were', 'doing', 'more', 'decent', 'job', 'pushing', 'limitations', 'series', 'Tru', 'being', 'asked', 'dead', 'individual', 'help', 'kind', 'day', 'restarting', 'having', 'chance', 'bring', 'about', 'change', 'kind', 'only', 'can', 'overcome', 'efforts', 'Jack', 'Jason', 'Priestly', 'bring', 'about', 'same', 'outcome', 'before', 'were', 'developing', 'what', 'appeared', 'be', 'more', 'complex', 'overall', 'story', 'when', 'everything', 'came', 'dead', 'stop.Do', 'recommend', 'guess', 'are', 'looking', 'great', 'story', 'challenging', 'character', 'development', 'engage', 'personification', 'series', 'was', 'cut', 'off', 'knees', 'suddenly', 'middle', 'story', 'utterly', 'resolution', 'kind', 'might', 'prefer', 'just', 'sticking', 'end', 'Season', 'One', 'slightly', 'more', 'closure', 'all-too-sudden', 'ending', ""n't"", 'put', 'off', 'six', 'episodes', 'make', 'up', 'very', 'brief', 'Season', 'Two', 'are', 'least', 'very', 'decent', 'do', 'give', 'many', 'hints', 'direction', 'show', 'was', 'heading', 'particular', 'enjoyed', 'episode', 'where', 'Jack', 'instead', 'Tru', 'asked', 'help', 'dead', 'person', 'was', 'not', 'merely', 'good', 'episode', 'showed', 'how', 'writers', 'were', 'doing', 'could', 'bring', 'about', 'innovations', 'standard', 'plot', 'progression', 'So', 'set', 'functions', 'more', 'hint', 'what', 'might', 'have', 'been', 'anything', 'What', 'pretty', 'good', 'shame', 'simply', ""n't"", 'very', 'much']",N/A
929315,ARIH1E57954V1,B000AO9BSS,Sandy N.,"[2, 4]","As a fan of Eliza Dushku (from Buffy the Vampire Slayer fame) I anxiously anticipated this show. And I was not disappointed. A fantastic premise drives this show, with excellent supporting characters. Although you do feel badly for Tru through much of it. Another good show that bit the Fox dust.I wish this show had been picked up by the Wb. I believe it would have survived on that station.",5,Another good show that bit the Fox dust.,1156464000,"08 25, 2006",2006,392,"['fan', 'Eliza', 'Dushku', 'Buffy', 'Vampire', 'Slayer', 'fame', 'anxiously', 'anticipated', 'show', 'was', 'not', 'disappointed', 'fantastic', 'premise', 'show', 'excellent', 'supporting', 'characters', 'do', 'feel', 'badly', 'Tru', 'much', 'good', 'show', 'Fox', 'dust.I', 'wish', 'show', 'had', 'been', 'picked', 'up', 'Wb', 'believe', 'would', 'have', 'survived', 'station']",N/A
929316,AO7E0YTFBUNXO,B000AO9BSS,shannon,"[0, 0]",This is a great show. I was a true buffy fan so I love eliza. This show is different and cool. It had a lot of twist and turns. The only thing not good I may say about it is that it ended rather abruptly and a little unsolved. other than that it was a great show. I wish there were more seasons of it.,5,great show!,1382918400,"10 28, 2013",2013,301,"['great', 'show', 'was', 'true', 'buffy', 'fan', 'love', 'eliza', 'show', 'different', 'cool', 'had', 'lot', 'twist', 'only', 'thing', 'not', 'good', 'may', 'say', 'ended', 'rather', 'abruptly', 'little', 'unsolved', 'other', 'was', 'great', 'show', 'wish', 'were', 'more', 'seasons']",N/A
929317,A7OVAB9PEZXP,B000AO9BSS,SPIKE JAMES,"[7, 10]","This season started off like it had !HUGE! plans for the series.I HATE the cliffhanger ending so much! This series just isnt complete, but then again how many series on FOX do get a proper ending? Not many.So much more info was going to be revealed.The best season by far.",5,This season was going to be the turning point of the series..........,1142121600,"03 12, 2006",2006,272,"['season', 'started', 'off', 'had', 'HUGE', 'plans', 'series.I', 'HATE', 'cliffhanger', 'ending', 'so', 'much', 'series', 'just', 'isnt', 'complete', 'then', 'again', 'how', 'many', 'series', 'FOX', 'do', 'get', 'proper', 'ending', 'Not', 'many.So', 'much', 'more', 'info', 'was', 'going', 'be', 'revealed.The', 'best', 'season', 'far']",N/A
