,reviewerID,asin,reviewerName,helpful,reviewText,overall,summary,unixReviewTime,reviewTime,reviewYear,reviewLength,meaningfulWords,Title
972176,A3E5FHWKP8TVKN,B000EGDAFC,"N. Sanchez ""neoprophet""","[17, 28]","The reason this cartoon was discontinued from ""barftoon network"" is because it actually promotes higher morals and ideals, unlike 99% of the toilet humor oriented cartoons playing now.  Think for a moment, corporate heads and the establishment don't want a cartoon that might mold future americans with morals and mental stability, that wouldn't sell rap records and drugs a few years from now, would it? Of course not, of course this is just a drop in the bucket but if most people knew the future plan for this country's future socio-economic destiny, well......a cartoon is the least of our worries. But it is one of the greatest animated series EVER!!!",5,Deeper than WHAT MOST IMAGINE.,1144281600,"04 6, 2006",2006,656,"['reason', 'cartoon', 'was', 'discontinued', 'barftoon', 'network', 'actually', 'higher', 'morals', 'ideals', '99', '%', 'toilet', 'humor', 'oriented', 'cartoons', 'playing', 'now', 'Think', 'moment', 'corporate', 'heads', 'establishment', 'do', ""n't"", 'want', 'cartoon', 'might', 'mold', 'future', 'americans', 'morals', 'mental', 'stability', 'would', ""n't"", 'sell', 'rap', 'records', 'drugs', 'few', 'years', 'now', 'would', 'course', 'not', 'course', 'just', 'drop', 'bucket', 'most', 'people', 'knew', 'future', 'plan', 'country', 'future', 'socio-economic', 'destiny', 'well', 'cartoon', 'least', 'worries', 'one', 'greatest', 'animated', 'series', 'EVER']",Samurai Jack Season 3
972177,A49XVWVH8GKM9,B000EGDAFC,Pat,"[0, 0]",It was very good and helps complete my collection with some favorite episodes from the Samurai Jack animated tv series,4,Samurai Jack season 3,1373846400,"07 15, 2013",2013,118,"['was', 'very', 'good', 'complete', 'collection', 'favorite', 'episodes', 'Samurai', 'Jack', 'animated', 'tv', 'series']",Samurai Jack Season 3
972178,A3TISHGXRLMTTV,B000EGDAFC,Patrick Correa,"[0, 0]","While not as good as the season before or after it, this is still a good buy.  Here's synopsizes of the episodes from the box, along with my review of each.27.  Chicken Jack:  Jack is turned into a chicken by a cranky wizard, then gets caught by a ""handler"" & becomes a prize-winning creature combat fighter.  The worst episode of the series.  I admit the beginning is good, but when Jack gets captured, it takes a turn for the worse.  The fights are good, but not what I wanted to see.  You know what I would have done?  After he gets turned into a chicken, he wonders the land searching for a cure & kicking butt along the way.  Just before he found the cure, he would have saved someone from Aku.  Aku getting beat by a chicken, now THAT would be hilarious!  D28.  Jack & the Rave:  When a man's daughter is kidnapped by Aku's children, Jack must infiltrate a rave to stop the musical brainwashing.  Great story, great action & great music.  Qhat more could you ask for?  A+29.  The Good, the Bad & the Beautiful:  Jack boards a train to his next destination only to be attacked by a couple of arguing bounty hunters.  One of the best, with a special guest appearance by Quickdraw McGraw, my favorite of the ""old"" Hanna-Barbera characters.  A+30.  Jack & the Zombies:  Aku leads Jack to a graveyard where the dead begin to rise.  An evil spirit takes over Jack's sword, & Jack fears he's met his end.  An excellent, atmospheric episode.  The silence in this show has never been more deafening.  A+31.  Jack in Egypt:  Jack must assemble a sacred scarab to call upon Ra for help in fighting evil ancient Egyptian shadow warriors.  A great episode.  A32.  Jack & the Traveling Creatures:  Jack & his traveling companions - creatures of the air, land & sea - attempt to find a portal for Jack to get home, but discover an undefeatable warrior instead.  One of the best episodes, simply for the ending.  A+33.  Jack & the Annoying Creature:  An overly-friendly creature begins following Jack, messing up Jack's every move along his quest.  Not the best of the comedic episodes, but it was still pretty funny.  B+34.  Jack & the Swamp Wizard:  Jack & a swamp wizard travel to the four corners of the earth, collecting pieces that are meant to get Jack back home.  While it had a twist you could see coming, it turned out to be a pretty good episode.  B+35.  Jack & the Haunted House:  Locked in a spooky, old mansion, Jack discovers he's not alone, and that his new roommates are plotting evil against him.  One of the scariest episodes.  A+36.  Jack, the Monks and the Ancient Master's Son:  Jack falls into a hidden temple sanctuary to find monks trained like him in the style of the Ancient Master.  Not the best episode, but not the worst either.  B37-38.  Birth of Evil:  The origin story of Aku, & how Jack's father got the sword that can destroy him.  My family & I are probably the only ones who think so, but I have to say that this is overrated.  We heard about the hype; it won an Emmy, Genndy said he thought it was absolutely perfect but we found it lacking.  I mean, there was never any question as to how it would end, so what was the point?  The beginning was interesting, & the end fight was good, but in between there were too many questions.  How does an attempt to cleanse this evil give it shape & form?  How come the beings who were hunting Aku in the first place don't come down to Earth to finish him off?  And if Jack's father saw all this, then how come he didn't keep the sword on him at all times in case Aku comes back?!  This really should have been just 1 part.  C39.  Jack & the Labyrinth:  Jack is carefully making his way through a labyrinth to reach a mysterious box.  The problem is, so is another thief.  This is an excellent episode to end the season on.  A+Like I said, it's still worth getting for the great episodes.  And if you're one of the people who love Birth of Evil, good for you.  I'm just not one of them.",5,Jack's quest continues.,1368576000,"05 15, 2013",2013,3953,"['not', 'as', 'good', 'season', 'still', 'good', 'buy', 'Here', 'synopsizes', 'episodes', 'box', 'review', 'each.27', 'Chicken', 'Jack', 'Jack', 'turned', 'chicken', 'cranky', 'wizard', 'then', 'caught', 'handler', 'prize-winning', 'creature', 'combat', 'fighter', 'worst', 'episode', 'series', 'admit', 'beginning', 'good', 'when', 'Jack', 'captured', 'turn', 'worse', 'fights', 'are', 'good', 'not', 'what', 'wanted', 'see', 'know', 'what', 'would', 'have', 'done', 'turned', 'chicken', 'land', 'searching', 'cure', 'kicking', 'butt', 'way', 'Just', 'found', 'cure', 'would', 'have', 'saved', 'someone', 'Aku', 'Aku', 'getting', 'beat', 'chicken', 'now', 'THAT', 'would', 'be', 'hilarious', 'D28', 'Jack', 'Rave', 'When', 'man', 'daughter', 'kidnapped', 'Aku', 'children', 'Jack', 'must', 'infiltrate', 'rave', 'stop', 'musical', 'brainwashing', 'Great', 'story', 'great', 'action', 'great', 'music', 'Qhat', 'more', 'could', 'ask', 'A+29', 'Good', 'Bad', 'Beautiful', 'Jack', 'train', 'next', 'destination', 'only', 'be', 'attacked', 'couple', 'arguing', 'bounty', 'hunters', 'One', 'best', 'special', 'guest', 'appearance', 'Quickdraw', 'McGraw', 'favorite', 'old', 'Hanna-Barbera', 'characters', 'A+30', 'Jack', 'Zombies', 'Aku', 'Jack', 'graveyard', 'where', 'dead', 'begin', 'rise', 'evil', 'spirit', 'over', 'Jack', 'sword', 'Jack', 'met', 'end', 'excellent', 'atmospheric', 'episode', 'silence', 'show', 'never', 'been', 'more', 'deafening', 'A+31', 'Jack', 'Egypt', 'Jack', 'must', 'assemble', 'sacred', 'scarab', 'call', 'Ra', 'help', 'fighting', 'evil', 'ancient', 'Egyptian', 'shadow', 'warriors', 'great', 'episode', 'A32', 'Jack', 'Traveling', 'Creatures', 'Jack', 'traveling', 'companions', 'creatures', 'air', 'land', 'sea', 'attempt', 'find', 'portal', 'Jack', 'get', 'home', 'discover', 'undefeatable', 'warrior', 'instead', 'One', 'best', 'episodes', 'simply', 'ending', 'A+33', 'Jack', 'Annoying', 'Creature', 'overly-friendly', 'creature', 'following', 'Jack', 'messing', 'up', 'Jack', 'move', 'quest', 'Not', 'best', 'comedic', 'episodes', 'was', 'still', 'pretty', 'funny', 'B+34', 'Jack', 'Swamp', 'Wizard', 'Jack', 'swamp', 'wizard', 'travel', 'four', 'corners', 'earth', 'collecting', 'pieces', 'are', 'meant', 'get', 'Jack', 'back', 'home', 'had', 'twist', 'could', 'see', 'coming', 'turned', 'out', 'be', 'pretty', 'good', 'episode', 'B+35', 'Jack', 'Haunted', 'House', 'Locked', 'spooky', 'old', 'mansion', 'Jack', 'not', 'alone', 'new', 'roommates', 'are', 'plotting', 'evil', 'One', 'scariest', 'episodes', 'A+36', 'Jack', 'Monks', 'Ancient', 'Master', 'Son', 'Jack', 'hidden', 'temple', 'sanctuary', 'find', 'monks', 'trained', 'style', 'Ancient', 'Master', 'Not', 'best', 'episode', 'not', 'worst', 'B37-38', 'Birth', 'Evil', 'origin', 'story', 'Aku', 'how', 'Jack', 'father', 'got', 'sword', 'can', 'destroy', 'My', 'family', 'are', 'probably', 'only', 'ones', 'who', 'think', 'so', 'have', 'say', 'overrated', 'heard', 'hype', 'won', 'Emmy', 'Genndy', 'said', 'thought', 'was', 'absolutely', 'perfect', 'found', 'lacking', 'mean', 'was', 'never', 'question', 'how', 'would', 'end', 'what', 'was', 'point', 'beginning', 'was', 'interesting', 'end', 'fight', 'was', 'good', 'were', 'too', 'many', 'questions', 'How', 'attempt', 'cleanse', 'evil', 'give', 'shape', 'form', 'How', 'come', 'beings', 'who', 'were', 'hunting', 'Aku', 'first', 'place', 'do', ""n't"", 'come', 'down', 'Earth', 'finish', 'off', 'Jack', 'father', 'saw', 'then', 'how', 'come', 'did', ""n't"", 'keep', 'sword', 'times', 'case', 'Aku', 'back', 'really', 'should', 'have', 'been', 'just', '1', 'part', 'C39', 'Jack', 'Labyrinth', 'Jack', 'carefully', 'making', 'way', 'labyrinth', 'reach', 'mysterious', 'box', 'problem', 'so', 'thief', 'excellent', 'episode', 'end', 'season', 'A+Like', 'said', 'still', 'worth', 'getting', 'great', 'episodes', ""'re"", 'one', 'people', 'who', 'love', 'Birth', 'Evil', 'good', ""'m"", 'just', 'not', 'one']",Samurai Jack Season 3
972179,A1M7K0R5N7CRK9,B000EGDAFC,PoopaPapaPalpatine,"[0, 0]","Probably best season. By this time, really honed style and cinematic look. Best episodes, in my opinion are in here. My favorite being Jack VS The Zombies. (When the movie comes out, fight between Jack and Aku is going to have a hard time surpassing that) Birth of Evil, no-brainer goodie. Like all Jack seasons, it has its A, B, C episodes. Still very fun to watch this season, probably my favorite. This and all the other DVDs are essential. Pick em' up.",5,Another minimalistic review (in vein of the series),1288483200,"10 31, 2010",2010,456,"['Probably', 'best', 'season', 'time', 'really', 'honed', 'style', 'cinematic', 'look', 'Best', 'episodes', 'opinion', 'are', 'here', 'favorite', 'being', 'Jack', 'VS', 'Zombies', 'When', 'movie', 'out', 'fight', 'Jack', 'Aku', 'going', 'have', 'hard', 'time', 'surpassing', 'Birth', 'Evil', 'no-brainer', 'goodie', 'Jack', 'seasons', 'A', 'B', 'C', 'Still', 'very', 'fun', 'watch', 'season', 'probably', 'favorite', 'other', 'DVDs', 'are', 'essential', 'Pick', 'em', 'up']",Samurai Jack Season 3
972180,A260X99UW6HA9Z,B000EGDAFC,Prauge Traveler,"[3, 3]","In the third season of Samurai Jack, you will find a great set of cartoons that appeal to both adults and younger children.  For those who are unfamiliar, Samurai Jack is an ancient warrior flung into the future where his arch nemesis, Aku, has achieved dominion on Earth.  Jack must find a way to return to the past and defeat Aku- all this you'll quickly learn in the opening scenes of each episode.The cartoon typical deals in some type of new adventure in a new and artfully created environment.  The best episodes always involve a great deal of sword fighting where Jack dispatches the robotic minions of Aku.  There are also more than a few episodes that illustrate a moral value, and some that are made to be funny.  So you won't get bored watching more than one in a row.  The animation style has a retro look to it, and it is probably the best cartoon artwork I can think of.Season Three contains some of the best episodes in the series- my favorites are: when Jack must fight his way out of a haunted graveyard; and when Jack meets warrior monks.  Also noteworthy in this collection is the two part episode that details Aku's creation, and the story of Jack's father.  This one was awarded an Emmy that is well deserved.Now, I purchase a good deal of TV series DVDs because I am stationed overseas right now- and if I was in the States I'd just watch TV and not get the DVDs.  But Samurai Jack is one of the exceptions.  This is just a great show, and one that you'll enjoy watching again on a Saturday morning.",5,Samurai Jack Season 3 is the best yet!,1149379200,"06 4, 2006",2006,1521,"['third', 'season', 'Samurai', 'Jack', 'will', 'find', 'great', 'set', 'cartoons', 'appeal', 'adults', 'younger', 'children', 'who', 'are', 'unfamiliar', 'Samurai', 'Jack', 'ancient', 'warrior', 'flung', 'future', 'where', 'arch', 'nemesis', 'Aku', 'achieved', 'dominion', 'Earth', 'Jack', 'must', 'find', 'way', 'return', 'past', 'defeat', 'Aku-', ""'ll"", 'quickly', 'learn', 'opening', 'scenes', 'episode.The', 'cartoon', 'typical', 'deals', 'type', 'new', 'adventure', 'new', 'artfully', 'created', 'environment', 'best', 'episodes', 'always', 'involve', 'great', 'deal', 'sword', 'fighting', 'where', 'Jack', 'robotic', 'minions', 'Aku', 'are', 'also', 'more', 'few', 'episodes', 'illustrate', 'moral', 'value', 'are', 'made', 'be', 'funny', 'wo', ""n't"", 'get', 'bored', 'watching', 'more', 'one', 'row', 'animation', 'style', 'retro', 'look', 'probably', 'best', 'cartoon', 'artwork', 'can', 'think', 'of.Season', 'Three', 'best', 'episodes', 'series-', 'favorites', 'are', 'when', 'Jack', 'must', 'fight', 'way', 'haunted', 'graveyard', 'when', 'Jack', 'warrior', 'monks', 'Also', 'noteworthy', 'collection', 'two', 'part', 'episode', 'details', 'Aku', 'creation', 'story', 'Jack', 'father', 'one', 'was', 'awarded', 'Emmy', 'well', 'deserved.Now', 'purchase', 'good', 'deal', 'TV', 'series', 'DVDs', 'am', 'stationed', 'overseas', 'right', 'now-', 'was', 'States', ""'d"", 'just', 'watch', 'TV', 'not', 'get', 'DVDs', 'Samurai', 'Jack', 'one', 'exceptions', 'just', 'great', 'show', 'one', ""'ll"", 'enjoy', 'watching', 'again', 'Saturday', 'morning']",Samurai Jack Season 3
972181,AB7CDMW753PKU,B000EGDAFC,retrokid289,"[0, 0]",This season it has some good and funny episodes in this packets but it's good to have in a collection.,5,Samurai Jack - Season 3,1354752000,"12 6, 2012",2012,102,"['season', 'good', 'funny', 'episodes', 'packets', 'good', 'have', 'collection']",Samurai Jack Season 3
972182,A1Y7JKCYPRXPNW,B000EGDAFC,"R. Whitelaw ""Rebel Broker""","[3, 3]","I am not a devotee of animation by any stretch of the animation. Nothing is going to win me over simply because it is animation. Samurai Jack does not win me over because it is animation - because it is so much more than that.You cannot really go wrong with any season of Samurai Jack. You can easily get away with jumping into the series at any point. So don't feel like you have to start with season 1 and work your way up from there.I grew up with the old Warner Brothers cartoons that could entertain kids and adults alike. There were jokes that could appeal to various ages with the kids not quite getting the jokes aimed at the adults.I now have three sons of my own all under the age of 8 and I enjoy watching Samurai Jack with them. It amazes me what they absorb from the series. Of course, there is the high testosterone appeal of the sword fighting. But would you be surprised to hear that Samurai Jack has helped my boys understand the concepts of determination, oppression, empathy,working hard to achieve goals and honor? Just to name a few.My boys get that good old Jack is good at what he does because he works hard at it. They see Jack try to talk his way out of problems when he can. They see him being sympathetic to others who are hurt or in trouble. They see him standing up against things that are unfair, cruel or just plain nasty.The conversations I have with my boys during and after an episode of Samurai Jack are amazing. So, while you might just be looking for something to entertain the overgrown kid in your home, don't overlook the kids that are still acting their age.",5,A treat for kids and grown-ups,1172534400,"02 27, 2007",2007,1599,"['am', 'not', 'devotee', 'animation', 'stretch', 'animation', 'Nothing', 'going', 'win', 'over', 'simply', 'animation', 'Samurai', 'Jack', 'not', 'win', 'animation', 'so', 'much', 'more', 'that.You', 'can', 'not', 'really', 'go', 'wrong', 'season', 'Samurai', 'Jack', 'can', 'easily', 'get', 'away', 'jumping', 'series', 'point', 'So', 'do', ""n't"", 'feel', 'have', 'start', 'season', '1', 'work', 'way', 'there.I', 'grew', 'up', 'old', 'Warner', 'Brothers', 'cartoons', 'could', 'entertain', 'kids', 'adults', 'alike', 'were', 'jokes', 'could', 'appeal', 'various', 'ages', 'kids', 'not', 'quite', 'getting', 'jokes', 'aimed', 'adults.I', 'now', 'have', 'three', 'sons', 'own', 'age', '8', 'enjoy', 'watching', 'Samurai', 'Jack', 'what', 'absorb', 'series', 'course', 'high', 'testosterone', 'appeal', 'sword', 'fighting', 'would', 'be', 'surprised', 'hear', 'Samurai', 'Jack', 'helped', 'boys', 'understand', 'concepts', 'determination', 'oppression', 'empathy', 'working', 'hard', 'achieve', 'goals', 'honor', 'Just', 'name', 'few.My', 'get', 'good', 'old', 'Jack', 'good', 'what', 'hard', 'see', 'Jack', 'try', 'talk', 'way', 'problems', 'when', 'can', 'see', 'being', 'sympathetic', 'others', 'who', 'are', 'hurt', 'trouble', 'see', 'standing', 'up', 'things', 'are', 'unfair', 'cruel', 'just', 'plain', 'nasty.The', 'conversations', 'have', 'boys', 'episode', 'Samurai', 'Jack', 'are', 'amazing', 'So', 'might', 'just', 'be', 'looking', 'something', 'entertain', 'overgrown', 'kid', 'home', 'do', ""n't"", 'overlook', 'kids', 'are', 'still', 'acting', 'age']",Samurai Jack Season 3
972183,A2V0OJY5BIDNZC,B000EGDAFC,"Tim Coogan ""CN fan""","[2, 2]","So now....Season Three of acclaimed Cartoon Network series Samurai Jack is finally out on DVD.  Like the first two seasons, there's two discs with 13 episodes of the really great show and a few DVD extras to boot !  One of those features happen to be ""The Martial Arts of Samurai Jack,"" featuring behind-the-scenes footage uncovering the martial arts moves used in the show; reminicent to moves used in the series ""Avatar: The Last Airbender.""  Another feature is ""The Lost Art Work Gallery"", self-explanatory.Finally, the moment you've been waiting for, here's the Season Three top five episodes !  Which are:5. ""The Birth of Evil"" (parts 1 & 2) - This two-part special tells the origin of AKU and how he was first defeated way before the birth of Jack.  To see and hear more, select the optional audio commentary on the two-parter by Genndy Tartakofsky himself in the special features section.4. ""Chicken Jack"" - A wizard grouchily turns the samurai into a chicken !  But even as a chicken, Jack is still quite the fighter !3. ""Jack and the Clenches"" (a.k.a. ""The Good, the Bad, and the Beautiful"") - Jack is in for a wild, wild-western train ride when he's up against a bounty hunter couple also aboard the train.  (Look for Quick-Draw McGraw in this episode !)2. ""Jack and the Temple"" - Jack comes across a mysterious hidden temple of monks in training with moves just like Jack.  The Ancient Master of the temple even informs Jack of a time portal to send him home.1. ""Jack and the Rave Slaves"" - This happens to be my most favorite episode in the whole series !  In this episode, Jack finds a huge group of teenagers pillaging the town he's staying at, and one of them was the innkeeper's daughter.  He goes undercover to find out what's going on.  It turns out the kids were being brainwashed by killer techno-dance music and Jack defeats AKU's dastardly deejay.  (P.S.  I sometimes even supply my OWN dance music for this episode !  I love that kind of music, you know.)Honorable Mention: ""Jack and the Labyrinth"" - Jack goes through a winding labyrinth in order to find a treasure.  Little did he know, a theif is after this treasure, too.Well, that about covers it.  I sure hope season four is just as good when that comes out.",4,"Look Out, Mack !  Jack's Back !",1148083200,"05 20, 2006",2006,2237,"['So', 'now', '.Season', 'Three', 'acclaimed', 'Cartoon', 'Network', 'series', 'Samurai', 'Jack', 'finally', 'out', 'DVD', 'first', 'two', 'seasons', 'two', 'discs', '13', 'episodes', 'really', 'great', 'show', 'few', 'DVD', 'extras', 'boot', 'One', 'features', 'happen', 'be', 'Martial', 'Arts', 'Samurai', 'Jack', 'featuring', 'behind-the-scenes', 'footage', 'uncovering', 'martial', 'arts', 'moves', 'used', 'show', 'reminicent', 'moves', 'used', 'series', 'Avatar', 'Last', 'Airbender', 'feature', 'Lost', 'Art', 'Work', 'Gallery', 'self-explanatory.Finally', 'moment', ""'ve"", 'been', 'waiting', 'here', 'Season', 'Three', 'top', 'five', 'episodes', 'Which', 'Birth', 'Evil', 'parts', '1', '2', 'two-part', 'special', 'origin', 'AKU', 'how', 'was', 'first', 'defeated', 'way', 'birth', 'Jack', 'see', 'hear', 'more', 'select', 'optional', 'audio', 'commentary', 'two-parter', 'Genndy', 'Tartakofsky', 'special', 'features', 'section.4', 'Chicken', 'Jack', 'wizard', 'grouchily', 'samurai', 'chicken', 'even', 'chicken', 'Jack', 'still', 'quite', 'fighter', '3', 'Jack', 'Clenches', 'a.k.a', 'Good', 'Bad', 'Beautiful', 'Jack', 'wild', 'wild-western', 'train', 'ride', 'when', 'up', 'bounty', 'hunter', 'couple', 'also', 'train', 'Look', 'Quick-Draw', 'McGraw', 'episode', '2', 'Jack', 'Temple', 'Jack', 'mysterious', 'hidden', 'temple', 'monks', 'training', 'moves', 'just', 'Jack', 'Ancient', 'Master', 'temple', 'even', 'Jack', 'time', 'portal', 'send', 'home.1', 'Jack', 'Rave', 'Slaves', 'be', 'most', 'favorite', 'episode', 'whole', 'series', 'episode', 'Jack', 'huge', 'group', 'teenagers', 'pillaging', 'town', 'staying', 'one', 'was', 'innkeeper', 'daughter', 'undercover', 'find', 'out', 'what', 'going', 'out', 'kids', 'were', 'being', 'brainwashed', 'killer', 'techno-dance', 'music', 'Jack', 'AKU', 'dastardly', 'deejay', 'P.S', 'sometimes', 'even', 'supply', 'OWN', 'dance', 'music', 'episode', 'love', 'kind', 'music', 'know', 'Honorable', 'Mention', 'Jack', 'Labyrinth', 'Jack', 'winding', 'labyrinth', 'order', 'find', 'treasure', 'Little', 'did', 'know', 'theif', 'treasure', 'too.Well', 'covers', 'sure', 'hope', 'season', 'four', 'just', 'as', 'good', 'when', 'out']",Samurai Jack Season 3
972184,A2D9A7C0WXLZLZ,B000EGDAFC,zep,"[0, 0]","this product was very entertaining. the series has always been one of my favorites, and with the price at a low rate! the only thing is wish you could have done would be to mention some of the episodes of the product. give the buyer a reason to buy with some episode insight.",5,samurai jacks word,1347408000,"09 12, 2012",2012,275,"['product', 'was', 'very', 'entertaining', 'series', 'always', 'been', 'one', 'favorites', 'price', 'low', 'rate', 'only', 'thing', 'wish', 'could', 'have', 'done', 'would', 'be', 'mention', 'episodes', 'product', 'give', 'buyer', 'reason', 'buy', 'episode', 'insight']",Samurai Jack Season 3
