,reviewerID,asin,reviewerName,helpful,reviewText,overall,summary,unixReviewTime,reviewTime,reviewYear,reviewLength,meaningfulWords,Title
929288,A3DGB4HN3QCGAL,B000AO9BSS,A. Burchfield,"[3, 5]","I always liked Eliza Dushku in this series but I'm not one of those that expected it to last. I was actually surprised that it even made it into a second season the way the series took a dark turn towards the end of 1st season. Still, having said that, I was glad when Fox did finally bring it back for a midseason replacement (I guess they called it). The stories were well thought out and written, even made Jason Priestley's character look like he wanted to switch sides once. It would definitely have been better programming (maybe even better ratings) if Fox had allowed the season to finish. Such a quick end to things although I did sort of like their Christmas cliffhanger.",4,"Not bad, much too short a season",1132099200,"11 16, 2005",2005,681,"['always', 'liked', 'Eliza', 'Dushku', 'series', ""'m"", 'not', 'one', 'expected', 'last', 'was', 'actually', 'surprised', 'even', 'made', 'second', 'season', 'way', 'series', 'took', 'dark', 'turn', 'end', '1st', 'season', 'Still', 'having', 'said', 'was', 'glad', 'when', 'Fox', 'did', 'finally', 'bring', 'back', 'midseason', 'replacement', 'guess', 'called', 'stories', 'were', 'well', 'thought', 'out', 'written', 'even', 'made', 'Jason', 'Priestley', 'character', 'look', 'wanted', 'switch', 'sides', 'once', 'would', 'definitely', 'have', 'been', 'better', 'programming', 'maybe', 'even', 'better', 'ratings', 'Fox', 'had', 'allowed', 'season', 'finish', 'quick', 'end', 'things', 'did', 'sort', 'Christmas', 'cliffhanger']",N/A
929289,A3JOOG7EQ19ISQ,B000AO9BSS,A. Cleveland,"[2, 2]","I really enjoyed Tru Calling on t.v thats why I purchased both season. I was, however, disappointed when I found out the second season only has 6 episodes and still is a cliff hanger ending due to the show being cancelled.Now,I don't know all the facts surrounding the cancellation of the show, but I would have appreciated it if they could have filmed at least a 2 hour final episode exposing her dad and the mole to Tru for the fans sake to tie up loose ends.The only reason I'm giving this season 4 stars instead of 5 is because the final episode wasn't really final. It was just the last episode they filmed and I would have REALLY appreciated them filming a finale. But I really enjoyed Tru Calling.",4,Wish there was a Finale,1309824000,"07 5, 2011",2011,704,"['really', 'enjoyed', 'Tru', 'Calling', 't.v', 'thats', 'why', 'purchased', 'season', 'was', 'however', 'disappointed', 'when', 'found', 'out', 'second', 'season', 'only', '6', 'episodes', 'still', 'cliff', 'hanger', 'ending', 'due', 'show', 'being', 'cancelled.Now', 'do', ""n't"", 'know', 'facts', 'surrounding', 'cancellation', 'show', 'would', 'have', 'appreciated', 'could', 'have', 'filmed', 'least', '2', 'hour', 'final', 'episode', 'exposing', 'dad', 'mole', 'Tru', 'fans', 'sake', 'tie', 'up', 'loose', 'only', 'reason', ""'m"", 'giving', 'season', '4', 'stars', 'instead', '5', 'final', 'episode', 'was', ""n't"", 'really', 'final', 'was', 'just', 'last', 'episode', 'filmed', 'would', 'have', 'REALLY', 'appreciated', 'filming', 'finale', 'really', 'enjoyed', 'Tru', 'Calling']",N/A
929290,ABSX5TGEGRH76,B000AO9BSS,"Andrew ""Radaar""","[111, 121]","I guess that I should be thankning FOX for even producing these six episodes, let alone airing and releasing them.  At the end of the first season, ratings were low, and I, along with all the other Tru Calling fans out there, were sure that it would be cancelled.  But it wasn't.  FOX decided to give the struggling show a second chance now that Friends (which aired at the same time) was ending.  However, after only six episodes were produced, FOX decided to pull the plug, and put on a different show instead.  Months later, after the show was cancelled due to poor ratings, the network decided to fill the timeslot by airing these episodes.Anyway, Luc (Matthew Bomer) has been dead for a few months now.  Tru (Eliza Dushku), Harrison (Shawn Reaves), and Davis (Zach Galifianakis) have continued to work together in order to save the lives of people who post-mortemly ask Tru for help.  And Jack (Jason Priestly), who is Tru's opposite, is nowhere to be found.  Jack tries to make sure that the bodies that ask for Tru's help stay dead when both of their days rewind.  Anyway, Harrison has given up his old life of gambling and scamming, and has chosen to go straight in life with a normal job.  Soon, Tru and Harrison's father Richard Davies (Cotter Smith), who was last seen working with Jack against his children, has moved back into the city where they live (still unnamed) in order to ""get closer to his kids"".  He even offers Harrison a job at his law firm.  Around the same time as Richard's arrival comes Jack's return, and the game is on again.Jack indirectly caused the death of Tru's old boyfriend Luc, which has caused their already bitter relationship to escalate to new levels of hatred.  Each member of Tru's team brings something different to the table; Tru has some detective skills, Harrison has certain connections, and Davis is the overall brains of the group.  Jack has his own team, including Richard and Dr. Carrie Allen (Liz Vassey), who acts as a mole within Tru's group.This year, however, Tru must also deal with medical school.  Davis pulled some strings which allowed her to audit med school classes this year, so when she isn't saving people's lives, she's studying to become a doctor.  With her old friend Lindsay (A.J. Cook) in Europe with her new husband, Tru makes new friends with fellow students Avery (Lizzy Caplan), Tyler (Parry Shen), and Jensen (Eric Christian Olsen), who begins to take Luc's place in her heart.Stories this year were formatted slightly differently than last year.  In Season 1, the rewind usually didn't occur until the end of the first act of the episode.  This year, about half of the rewinds happened at that point of the episode, while the other half occured at the end of the teaser, making the rewind day's time in the episode significantly longer than the ""Day 1"" portion.  Also, throughout most of S1, Tru only had to work against time and skepticism.  Now she has Jack to compete with, and he firmly believes in what he is doing.  I see him as a bit of a misunderstood character.  While Tru is clearly the protagonist and the hero, I don't think that it's right to call Jack a villain.  He just has a different point of view than Tru does.  While Tru thinks that the bodies who ask for her help weren't supposed to die, Jack believes that they were, and are trying to cheat fate, and when fate is messed with, there are dire consequences.Sadly, we never get to see those consequences pan out, and from what I've found online, one of them is a real doozy (although, it occurs because Tru breaks a major rule).  There were so many good storylines going when the show ended: What will Tru and Harrison do when they find out the truth about their father?  What will Davis do when he finds out he's being played?  What happened to a certain character after Tru wrongfully saved him?  Who is right, Jack or Tru?  Sadly, we may never get these answers.While S1 was very good, these episodes were superior in most ways.  The cast was trimmed down to the essentials (the third Davies sibling was nowhere to be seen this year), the actors were getting comfortable with their roles, and the stories were getting a lot better.  It's too bad that this show was cancelled.  With any luck, there will be some sort of movie, similar to Firefly/Serenity, but it's a longshot.  At least what we got was great.",5,If Only We Could Go Back And Save This Show,1123200000,"08 5, 2005",2005,4362,"['guess', 'should', 'be', 'thankning', 'FOX', 'even', 'producing', 'six', 'episodes', 'let', 'alone', 'airing', 'releasing', 'end', 'first', 'season', 'ratings', 'were', 'low', 'other', 'Tru', 'Calling', 'fans', 'out', 'there', 'were', 'sure', 'would', 'be', 'cancelled', 'was', ""n't"", 'FOX', 'decided', 'give', 'struggling', 'show', 'second', 'chance', 'now', 'Friends', 'aired', 'same', 'time', 'was', 'ending', 'However', 'only', 'six', 'episodes', 'were', 'produced', 'FOX', 'decided', 'pull', 'plug', 'put', 'different', 'show', 'instead', 'Months', 'later', 'show', 'was', 'cancelled', 'due', 'poor', 'ratings', 'network', 'decided', 'fill', 'timeslot', 'airing', 'episodes.Anyway', 'Luc', 'Matthew', 'Bomer', 'been', 'dead', 'few', 'months', 'now', 'Tru', 'Eliza', 'Dushku', 'Harrison', 'Shawn', 'Reaves', 'Davis', 'Zach', 'Galifianakis', 'have', 'continued', 'work', 'together', 'order', 'save', 'lives', 'people', 'who', 'post-mortemly', 'ask', 'Tru', 'help', 'Jack', 'Jason', 'Priestly', 'who', 'Tru', 'opposite', 'nowhere', 'be', 'found', 'Jack', 'make', 'sure', 'bodies', 'ask', 'Tru', 'help', 'stay', 'dead', 'when', 'days', 'rewind', 'Anyway', 'Harrison', 'given', 'up', 'old', 'life', 'gambling', 'scamming', 'chosen', 'go', 'straight', 'life', 'normal', 'job', 'Soon', 'Tru', 'Harrison', 'father', 'Richard', 'Davies', 'Cotter', 'Smith', 'who', 'was', 'last', 'seen', 'working', 'Jack', 'children', 'moved', 'back', 'city', 'where', 'live', 'still', 'unnamed', 'order', 'get', 'closer', 'kids', 'even', 'Harrison', 'job', 'law', 'firm', 'same', 'time', 'Richard', 'arrival', 'Jack', 'return', 'game', 'again.Jack', 'indirectly', 'caused', 'death', 'Tru', 'old', 'boyfriend', 'Luc', 'caused', 'already', 'bitter', 'relationship', 'escalate', 'new', 'levels', 'hatred', 'member', 'Tru', 'team', 'something', 'different', 'table', 'Tru', 'detective', 'skills', 'Harrison', 'certain', 'connections', 'Davis', 'overall', 'brains', 'group', 'Jack', 'own', 'team', 'including', 'Richard', 'Dr.', 'Carrie', 'Allen', 'Liz', 'Vassey', 'who', 'mole', 'Tru', 'group.This', 'year', 'however', 'Tru', 'must', 'also', 'deal', 'medical', 'school', 'Davis', 'pulled', 'strings', 'allowed', 'audit', 'med', 'school', 'classes', 'year', 'when', ""n't"", 'saving', 'people', 'lives', 'studying', 'become', 'doctor', 'old', 'friend', 'Lindsay', 'A.J', 'Cook', 'Europe', 'new', 'husband', 'Tru', 'new', 'friends', 'fellow', 'students', 'Avery', 'Lizzy', 'Caplan', 'Tyler', 'Parry', 'Shen', 'Jensen', 'Eric', 'Christian', 'Olsen', 'who', 'take', 'Luc', 'place', 'heart.Stories', 'year', 'were', 'formatted', 'slightly', 'differently', 'last', 'year', 'Season', '1', 'rewind', 'usually', 'did', ""n't"", 'occur', 'end', 'first', 'act', 'episode', 'year', 'half', 'rewinds', 'happened', 'point', 'episode', 'other', 'half', 'occured', 'end', 'teaser', 'making', 'rewind', 'day', 'time', 'episode', 'significantly', 'longer', 'Day', '1', 'portion', 'Also', 'most', 'S1', 'Tru', 'only', 'had', 'work', 'time', 'skepticism', 'Now', 'Jack', 'compete', 'firmly', 'what', 'doing', 'see', 'bit', 'misunderstood', 'character', 'Tru', 'clearly', 'protagonist', 'hero', 'do', ""n't"", 'think', 'right', 'call', 'Jack', 'villain', 'just', 'different', 'point', 'view', 'Tru', 'Tru', 'bodies', 'who', 'ask', 'help', 'were', ""n't"", 'supposed', 'die', 'Jack', 'were', 'are', 'trying', 'cheat', 'fate', 'when', 'fate', 'messed', 'are', 'dire', 'consequences.Sadly', 'never', 'get', 'see', 'consequences', 'pan', 'out', 'what', ""'ve"", 'found', 'online', 'one', 'real', 'doozy', 'Tru', 'major', 'rule', 'were', 'so', 'many', 'good', 'storylines', 'going', 'when', 'show', 'ended', 'What', 'will', 'Tru', 'Harrison', 'do', 'when', 'find', 'out', 'truth', 'father', 'What', 'will', 'Davis', 'do', 'when', 'out', 'being', 'played', 'What', 'happened', 'certain', 'character', 'Tru', 'wrongfully', 'saved', 'Who', 'right', 'Jack', 'Tru', 'Sadly', 'may', 'never', 'get', 'S1', 'was', 'very', 'good', 'episodes', 'were', 'superior', 'most', 'ways', 'cast', 'was', 'trimmed', 'down', 'essentials', 'third', 'Davies', 'sibling', 'was', 'nowhere', 'be', 'seen', 'year', 'actors', 'were', 'getting', 'comfortable', 'roles', 'stories', 'were', 'getting', 'lot', 'better', 'too', 'bad', 'show', 'was', 'cancelled', 'luck', 'will', 'be', 'sort', 'movie', 'similar', 'Firefly/Serenity', 'longshot', 'least', 'what', 'got', 'was', 'great']",N/A
929291,A338EB4DYEKI7R,B000AO9BSS,Anne,"[0, 0]",I hate that this show ended. I was not happy with the last show it was a cliff hanger. One that will never be finished.,5,Series,1211068800,"05 18, 2008",2008,119,"['hate', 'show', 'ended', 'was', 'not', 'happy', 'last', 'show', 'was', 'cliff', 'hanger', 'One', 'will', 'never', 'be', 'finished']",N/A
929292,A2T03R3SASPIVZ,B000AO9BSS,Ashley W,"[1, 1]","Came in wonderful condition. I with they would continue with this show, its really awesome. I highly recommend to everyone. YOu'll love it, totally worth every penny",5,Great show,1358035200,"01 13, 2013",2013,165,"['Came', 'wonderful', 'condition', 'would', 'continue', 'show', 'really', 'awesome', 'highly', 'recommend', 'everyone', ""'ll"", 'love', 'totally', 'worth', 'penny']",N/A
929293,A36AH31X84FIC8,B000AO9BSS,Brent Hilton,"[1, 1]",I personally would'nt call this set  of tru calling a complete set . because at the end your going that's it  ? they really could've use a couple more episodes to tie up some of the  questions and loose ends. it was  just a shame  because it was just getting interesting . shame on fox for canning the  show it  was just  about to hit it's stride only to be struck down a not so patient media company.  anyway the  episodes in the set are good but  not as complete as  season one.,4,Complete not really sorry Tru.,1181347200,"06 9, 2007",2007,480,"['personally', ""would'nt"", 'call', 'set', 'tru', 'calling', 'complete', 'set', 'end', 'going', 'really', 'could', ""'ve"", 'use', 'couple', 'more', 'episodes', 'tie', 'up', 'questions', 'loose', 'ends', 'was', 'just', 'shame', 'was', 'just', 'getting', 'interesting', 'shame', 'fox', 'canning', 'show', 'was', 'just', 'hit', 'stride', 'only', 'be', 'struck', 'down', 'not', 'so', 'patient', 'media', 'company', 'anyway', 'episodes', 'set', 'are', 'good', 'not', 'as', 'complete', 'season', 'one']",N/A
929294,A3T8G3FN3H3948,B000AO9BSS,bryhil_04,"[8, 10]","When Tru Calling's pilot started I originally thought, ""well, this show will be cancelled soon"". it was messy, unoriginal & kinda lame. but that's how it was supposed to start. then the 2nd episode was more believable & was a little better in every area that Pilot lacked! & from then to the middle of the season, it had its high points & its lows, Closure being one of my fav episodes! then, enter Jason Priestley as Jack, I'm thinking, why on Earth is he on this show? they must be desperate or something. but his character suddenly started making the show more interesting, things started moving faster & the show became darker, there were more things going on in the episodes & by the finale, Tru Calling hit its high point! everything was looking good for the show! but had they started out that good, maybe Fox would've gave it a better promotion. One of my fav moments is in Death Becomes Her when Jack saves Harrison's car by calling the thief's bluff. & from that moment, you have to know there's something up with Jack. especially after the audience presumably found out that he got a girl to commit suicide by making a phone call to her parents telling them about her constant gambling. & then with some help from Tru, Davis has to re-find out what he did on day one & tell her that Jack also relives days which in the next episode we find out why. He's there to stop her! & after getting Luc(Mat Bomber) killed, he takes a vacation & hopes that Tru will stop saving lives that are suppose to die. but Tru doesn't give up & when Jack comes back, things start getting tricky.Perfect Storm- 5/5 Jack's return makes it difficult for her to save the life of a cop who died in a white squal but Jack sending her back out in the water at night makes it even harder after Davis saved her the first time by making a ""phony"" phone call. & Davis gets a replacement psychiatrist & things don't go so well with her.Grace- 5/5 Jack sets Tru up for murder & things hit rock-bottom before they get better for her.In the Dark- 4/5 In one of the more obvious deaths for the viewers anyway, Tru is forced to figure out who died after a party is thrown by her brother at the morgue. Jack keeps Tru on her feet & makes her go on a wild goose chase.The Last Good Day- 5/5 My fav episode of Tru Calling. Everything changes when Jack gets asked for help from a girl who commited suicide. now the only question was, why? & why does the relive day feel so cold to Tru?Enough- 5/5 Tru crosses the line when she tries to save life of her boyfriend Jensen as Jack tries to stop her & even Davis warns her of the reprecussions of saving the life of someone who doesn't ask for her help. She shouldn't be able to choose, it's up to fate. but she doesn't listen & something severe does happen in return.Twas the Night Before Xmas, Again- 4/5 Harrison finds out about his dad's alliance with Jack but before he warn Tru, her day restarts. Tru reluctantly lets Jack help her in solving a murder case possibly after an old cadaver asks for help.It's an ok ending cause it at least it isn't a cliff hanger but it's a shame it didn't get a whole season & stupid shows that shouldn't be around cause their just getting stupid(cough*the oc*cough) are still on??? but Fox screwed Tru Calling, see my review for the first season for more about how ticked off I am at fox, lol.plus some features on the show & I think anyone should get into this show! the second season could've been so great had they had a whole season! these six episodes are worth your money just the same! a memorable show too bad it wasn't given a real chance cause it did become something great!",5,Tru takes on a 2nd season & the plot thickens,1159401600,"09 28, 2006",2006,3638,"['When', 'Tru', 'Calling', 'pilot', 'started', 'originally', 'thought', 'well', 'show', 'will', 'be', 'cancelled', 'soon', 'was', 'messy', 'unoriginal', 'kinda', 'lame', 'how', 'was', 'supposed', 'start', 'then', '2nd', 'episode', 'was', 'more', 'believable', 'was', 'little', 'better', 'area', 'Pilot', 'lacked', 'then', 'middle', 'season', 'had', 'high', 'points', 'lows', 'Closure', 'being', 'one', 'fav', 'episodes', 'then', 'enter', 'Jason', 'Priestley', 'Jack', ""'m"", 'thinking', 'why', 'Earth', 'show', 'must', 'be', 'desperate', 'something', 'character', 'suddenly', 'started', 'making', 'show', 'more', 'interesting', 'things', 'started', 'moving', 'faster', 'show', 'became', 'darker', 'were', 'more', 'things', 'going', 'episodes', 'finale', 'Tru', 'Calling', 'hit', 'high', 'point', 'everything', 'was', 'looking', 'good', 'show', 'had', 'started', 'out', 'good', 'maybe', 'Fox', 'would', ""'ve"", 'gave', 'better', 'promotion', 'One', 'fav', 'moments', 'Death', 'Becomes', 'Her', 'when', 'Jack', 'Harrison', 'car', 'calling', 'thief', 'bluff', 'moment', 'have', 'know', 'something', 'up', 'Jack', 'especially', 'audience', 'presumably', 'found', 'out', 'got', 'girl', 'commit', 'suicide', 'making', 'phone', 'call', 'parents', 'telling', 'constant', 'gambling', 'then', 'help', 'Tru', 'Davis', 're-find', 'out', 'what', 'did', 'day', 'one', 'tell', 'Jack', 'also', 'days', 'next', 'episode', 'find', 'out', 'why', 'there', 'stop', 'getting', 'Luc', 'Mat', 'Bomber', 'killed', 'vacation', 'Tru', 'will', 'stop', 'saving', 'lives', 'are', 'suppose', 'die', 'Tru', ""n't"", 'give', 'up', 'when', 'Jack', 'back', 'things', 'start', 'getting', 'tricky.Perfect', 'Storm-', '5/5', 'Jack', 'return', 'difficult', 'save', 'life', 'cop', 'who', 'died', 'white', 'squal', 'Jack', 'sending', 'back', 'water', 'night', 'even', 'harder', 'Davis', 'saved', 'first', 'time', 'making', 'phony', 'phone', 'call', 'Davis', 'replacement', 'psychiatrist', 'things', 'do', ""n't"", 'go', 'so', 'well', 'her.Grace-', '5/5', 'Jack', 'sets', 'Tru', 'up', 'murder', 'things', 'hit', 'rock-bottom', 'get', 'better', 'her.In', 'Dark-', '4/5', 'one', 'more', 'obvious', 'deaths', 'viewers', 'anyway', 'Tru', 'forced', 'figure', 'out', 'who', 'died', 'party', 'thrown', 'brother', 'morgue', 'Jack', 'Tru', 'feet', 'go', 'wild', 'goose', 'chase.The', 'Last', 'Good', 'Day-', '5/5', 'My', 'fav', 'episode', 'Tru', 'Calling', 'Everything', 'changes', 'when', 'Jack', 'asked', 'help', 'girl', 'who', 'commited', 'suicide', 'now', 'only', 'question', 'was', 'why', 'why', 'relive', 'day', 'feel', 'so', 'cold', 'Tru', 'Enough-', '5/5', 'Tru', 'line', 'when', 'save', 'life', 'boyfriend', 'Jensen', 'Jack', 'stop', 'even', 'Davis', 'reprecussions', 'saving', 'life', 'someone', 'who', ""n't"", 'ask', 'help', 'should', ""n't"", 'be', 'able', 'choose', 'up', 'fate', ""n't"", 'listen', 'something', 'severe', 'happen', 'return.Twas', 'Night', 'Before', 'Xmas', 'Again-', '4/5', 'Harrison', 'out', 'dad', 'alliance', 'Jack', 'warn', 'Tru', 'day', 'restarts', 'Tru', 'reluctantly', 'Jack', 'help', 'solving', 'murder', 'case', 'possibly', 'old', 'cadaver', 'help.It', 'ok', 'ending', 'cause', 'least', ""n't"", 'cliff', 'hanger', 'shame', 'did', ""n't"", 'get', 'whole', 'season', 'stupid', 'shows', 'should', ""n't"", 'be', 'around', 'cause', 'just', 'getting', 'stupid', 'cough*the', 'oc*cough', 'are', 'still', 'Fox', 'screwed', 'Tru', 'Calling', 'see', 'review', 'first', 'season', 'more', 'how', 'ticked', 'am', 'fox', 'features', 'show', 'think', 'anyone', 'should', 'get', 'show', 'second', 'season', 'could', ""'ve"", 'been', 'so', 'great', 'had', 'had', 'whole', 'season', 'six', 'episodes', 'are', 'worth', 'money', 'just', 'same', 'memorable', 'show', 'too', 'bad', 'was', ""n't"", 'given', 'real', 'chance', 'cause', 'did', 'become', 'something', 'great']",N/A
