,reviewerID,asin,reviewerName,helpful,reviewText,overall,summary,unixReviewTime,reviewTime,reviewYear,reviewLength,meaningfulWords,Title
929295,A1HX00DL0SZM1G,B000AO9BSS,"Darren Harrison ""DVD collector and reviewer""","[22, 23]","I never caught season one of this show when it was on television, but instead when Fox asked me to review the season one set for DVD. At that point Fox seemed to be playing up the release of that season as season two was set to appear in the fall. Then fall came and went and I was confused by the fact that this show which had proved to watchable and became addicted to over the course of reviewing the first season was nowhere to be found on the schedule. The first few episodes would eventually find their way on TV, but months after Fox had decided to cancel it. It is hardly surprising therefore that they did not invest the same energy in promoting the second season.It really is a shame that Fox pulled the plug on this entertaining show just as the second season was gathering steam. It's such a great show and Eliza Dushku (Faith from BUFFY and Arnie's daughter from TRUE LIES) is so good in it. Dushku plays Tru Davies, a medical student who works at the morgue to help pay her way through Medical school. She learns that she has the power to relive the previous day and save people from death. However countering her efforts is Jack (played by Jason Priestley) who is intent on keeping things the way they are and preventing Tru from completing her mission. They also tried to do some things different in these episodes, not resting on their success in the previous season.I hope that soon another network will pick up Tru Calling and we will get more episodes in the future.The Season 2 set contains the five episodes aired, one unaired episode and a making-of-featurette:Disc 1Ep. 1 - Perfect Storm: Jack returns and attempts to stop Tru from saving the life of a female Harbor Patrol Officer, who the previous day drowned answering an SOS. The tension is really ratcheted up here as the officer trusts Jack over Tru in the closing minutes.Ep. 2 - Grace: Slightly different angle used in this episode as Tru finds herself in the unfamiliar role of fugitive, framed by Jack for the murder of a psychiatrist who was shot by one of his patients.Ep. 3 - In the Dark: In another twist to the formula, Tru has no idea who has called for help when the lights go out during her surprise birthday party.Ep, 4 - The Last Good Day: Yet another twist to the formula. Instead of trying to stop Tru from saving a life, this time it is Jack who must save the life of a girl he likes. He turns to Tru's father for advice after she asks him for help. This is my personal favorite episode of the second season and the scenes between Tru and Jack really crackle here.Disc 2Ep. 5 - Enough: Another great episode. When Tru's boss from the morgue Jensen is killed and does not ask for help Tru desperately tries to find another body in need of help  so that the day will rewind and she can save Jensen.Ep. 6 - T'was the Night Before Christmas...Again: In this unaired episode Tru's brother Harrison catches his father meeting with Jack after suspecting that his father was having an affair and Jack offers to help Tru save a life.Special feature: Tru-Calling Opposing Forces - Making-of-Featurette",5,I hope another network gives this show a second chance,1137283200,"01 15, 2006",2006,3088,"['never', 'caught', 'season', 'one', 'show', 'when', 'was', 'television', 'instead', 'when', 'Fox', 'asked', 'review', 'season', 'one', 'set', 'DVD', 'point', 'Fox', 'seemed', 'be', 'playing', 'up', 'release', 'season', 'season', 'two', 'was', 'set', 'appear', 'fall', 'Then', 'fall', 'came', 'went', 'was', 'confused', 'fact', 'show', 'had', 'proved', 'watchable', 'became', 'addicted', 'course', 'reviewing', 'first', 'season', 'was', 'nowhere', 'be', 'found', 'schedule', 'first', 'few', 'episodes', 'would', 'eventually', 'find', 'way', 'TV', 'months', 'Fox', 'had', 'decided', 'cancel', 'hardly', 'surprising', 'therefore', 'did', 'not', 'invest', 'same', 'energy', 'promoting', 'second', 'season.It', 'really', 'shame', 'Fox', 'pulled', 'plug', 'entertaining', 'show', 'just', 'second', 'season', 'was', 'gathering', 'steam', 'such', 'great', 'show', 'Eliza', 'Dushku', 'Faith', 'BUFFY', 'Arnie', 'daughter', 'TRUE', 'LIES', 'so', 'good', 'Dushku', 'Tru', 'Davies', 'medical', 'student', 'who', 'morgue', 'help', 'pay', 'way', 'Medical', 'school', 'power', 'relive', 'previous', 'day', 'save', 'people', 'death', 'However', 'countering', 'efforts', 'Jack', 'played', 'Jason', 'Priestley', 'who', 'intent', 'keeping', 'things', 'way', 'are', 'preventing', 'Tru', 'completing', 'mission', 'also', 'tried', 'do', 'things', 'different', 'episodes', 'not', 'resting', 'success', 'previous', 'season.I', 'hope', 'soon', 'network', 'will', 'pick', 'up', 'Tru', 'Calling', 'will', 'get', 'more', 'episodes', 'future.The', 'Season', '2', 'set', 'five', 'episodes', 'aired', 'one', 'unaired', 'episode', 'making-of-featurette', 'Disc', '1Ep', '1', 'Perfect', 'Storm', 'Jack', 'returns', 'attempts', 'stop', 'Tru', 'saving', 'life', 'female', 'Harbor', 'Patrol', 'Officer', 'who', 'previous', 'day', 'drowned', 'answering', 'SOS', 'tension', 'really', 'ratcheted', 'up', 'here', 'officer', 'Jack', 'Tru', 'closing', 'minutes.Ep', '2', 'Grace', 'Slightly', 'different', 'angle', 'used', 'episode', 'Tru', 'unfamiliar', 'role', 'fugitive', 'framed', 'Jack', 'murder', 'psychiatrist', 'who', 'was', 'shot', 'one', 'patients.Ep', '3', 'Dark', 'twist', 'formula', 'Tru', 'idea', 'who', 'called', 'help', 'when', 'lights', 'go', 'out', 'surprise', 'birthday', 'party.Ep', '4', 'Last', 'Good', 'Day', 'Yet', 'twist', 'formula', 'Instead', 'trying', 'stop', 'Tru', 'saving', 'life', 'time', 'Jack', 'who', 'must', 'save', 'life', 'girl', 'Tru', 'father', 'advice', 'help', 'personal', 'favorite', 'episode', 'second', 'season', 'scenes', 'Tru', 'Jack', 'really', 'here.Disc', '2Ep', '5', 'Enough', 'great', 'episode', 'When', 'Tru', 'boss', 'morgue', 'Jensen', 'killed', 'not', 'ask', 'help', 'Tru', 'desperately', 'find', 'body', 'need', 'help', 'day', 'will', 'rewind', 'can', 'save', 'Jensen.Ep', '6', ""T'was"", 'Night', 'Before', 'Christmas', 'Again', 'unaired', 'episode', 'Tru', 'brother', 'Harrison', 'father', 'meeting', 'Jack', 'suspecting', 'father', 'was', 'having', 'affair', 'Jack', 'help', 'Tru', 'save', 'life.Special', 'feature', 'Tru-Calling', 'Opposing', 'Forces', 'Making-of-Featurette']",N/A
929296,A1K31NF81TS0CO,B000AO9BSS,"Dubyac99 ""Dubyac99""","[2, 16]","First of all, I love the star Eliza Dushku!  She is totally bangin'!  While I've never watched Buffy the Vampire Slayer (not into freaky Sci Fi) I do like this show, as it uses ""urban themes,"" and no scary monsters jump out of closets, and all characters are human, whereas, Sci Fi likes to throw in freaky non-human characters.The characters are developed well, but the storylines are kind of goofy.  Watching this show is like watching that recent remake of that TV show ""The Fugitive.""  After a while, even the biggest fans are saying: ""How the hell does she keep convincing folks to help her, a complete stranger?""  But, this show is much more believable than ""The Fugitive.""  And that's a big statement.Shows that get cancelled, than still come out on DVD, are quite sad.  They set us up for this great long storyline, than poof.  They're gone!I'll give this 3 stars.  It's just a'iiiight.MC White said:  It's a'iiiiigith for a rental (but you can't find it for rent anywhere.)  I bought it, then resold it on Amazon.com",3,Eliza is Bangin'!!!,1156896000,"08 30, 2006",2006,1025,"['First', 'love', 'star', 'Eliza', 'Dushku', 'totally', 'bangin', ""'ve"", 'never', 'watched', 'Buffy', 'Vampire', 'Slayer', 'not', 'freaky', 'Sci', 'Fi', 'do', 'show', 'urban', 'themes', 'scary', 'monsters', 'jump', 'closets', 'characters', 'are', 'human', 'whereas', 'Sci', 'Fi', 'throw', 'freaky', 'non-human', 'characters.The', 'characters', 'are', 'developed', 'well', 'storylines', 'are', 'kind', 'goofy', 'Watching', 'show', 'watching', 'recent', 'remake', 'TV', 'show', 'Fugitive', 'while', 'even', 'biggest', 'fans', 'are', 'saying', 'How', 'hell', 'keep', 'convincing', 'folks', 'help', 'complete', 'stranger', 'show', 'much', 'more', 'believable', 'Fugitive', 'big', 'statement.Shows', 'get', 'cancelled', 'still', 'come', 'out', 'DVD', 'are', 'quite', 'sad', 'set', 'up', 'great', 'long', 'storyline', 'poof', ""'re"", 'gone', ""'ll"", 'give', '3', 'stars', 'just', ""a'iiiight.MC"", 'White', 'said', ""a'iiiiigith"", 'rental', 'ca', ""n't"", 'find', 'rent', 'anywhere', 'bought', 'then', 'resold', 'Amazon.com']",N/A
929297,A3IKSXORTDGVH5,B000AO9BSS,Edmond Gauthier,"[12, 15]","Thank goodness this potentially great show with the gorgeous Eliza was killed off before the idiots at Fox made a fortune on it when it became a huge megahit. How do I know this?Why, of course that's because dead TV shows TALK to me.""Help me,"" cried Tru Calling as it was laid out in DVD form in the video morgue I work in. But it was far too late for it. The clown suits at Fox, due to their ridiiculous multiple scheduling of the show, had totally mucked things up so badly that even people like me couldn't relive any particular day in order to save it.The Fox clods have also screwed up in this very same way with other great shows like Wonderfalls and a host of others during recent years.So R.I.P., Tru Calling. You were solid gold placed at the feet of Fox and they were so stupid that they threw you out the window.That's why they deserve all the negative future karma which fate will be likewise throwing their way.",5,Tru Calling Joins The Fox List Of Good Show Graveyards,1137542400,"01 18, 2006",2006,924,"['Thank', 'goodness', 'potentially', 'great', 'show', 'gorgeous', 'Eliza', 'was', 'killed', 'off', 'idiots', 'Fox', 'made', 'fortune', 'when', 'became', 'huge', 'megahit', 'How', 'do', 'know', 'Why', 'course', 'dead', 'TV', 'shows', 'TALK', 'Help', 'cried', 'Tru', 'Calling', 'was', 'laid', 'out', 'DVD', 'form', 'video', 'morgue', 'work', 'was', 'far', 'too', 'late', 'clown', 'suits', 'Fox', 'due', 'ridiiculous', 'multiple', 'scheduling', 'show', 'had', 'totally', 'mucked', 'things', 'up', 'so', 'badly', 'even', 'people', 'could', ""n't"", 'relive', 'particular', 'day', 'order', 'save', 'it.The', 'Fox', 'clods', 'have', 'also', 'screwed', 'up', 'very', 'same', 'way', 'other', 'great', 'shows', 'Wonderfalls', 'host', 'others', 'recent', 'years.So', 'R.I.P.', 'Tru', 'Calling', 'were', 'solid', 'gold', 'placed', 'feet', 'Fox', 'were', 'so', 'stupid', 'threw', 'out', 'window.That', 'why', 'deserve', 'negative', 'future', 'karma', 'fate', 'will', 'be', 'likewise', 'throwing', 'way']",N/A
929298,A1IL8J4VRQV815,B000AO9BSS,"Fernanda Poltronieri ""Fernanda""","[3, 5]","Tru Calling was such a great show. FOX, however, cancelled it after two amazing seasons. I really don't think they know what they're doing. Eliza Dushku is probably one of the best actresses ever and the show was growing so much. Well, there's nothing we can do now except enjoy this new DVD. =[And there's an error in the DVD page here. The Complete Second Season is from 2004/2005, not even NEAR to be from 2003. The FIRST season was from 2003. Please put the right year, Amazon.",5,Best show ever.,1126915200,"09 17, 2005",2005,481,"['Tru', 'Calling', 'was', 'such', 'great', 'show', 'FOX', 'however', 'cancelled', 'two', 'amazing', 'seasons', 'really', 'do', ""n't"", 'think', 'know', 'what', ""'re"", 'doing', 'Eliza', 'Dushku', 'probably', 'one', 'best', 'actresses', 'ever', 'show', 'was', 'growing', 'so', 'much', 'Well', 'nothing', 'can', 'do', 'now', 'enjoy', 'new', 'DVD', '[', 'error', 'DVD', 'page', 'here', 'Complete', 'Second', 'Season', '2004/2005', 'not', 'even', 'NEAR', 'be', '2003', 'FIRST', 'season', 'was', '2003', 'Please', 'put', 'right', 'year', 'Amazon']",N/A
929299,ARJIAB8SLWAOU,B000AO9BSS,"George Buttner ""Agent0042""","[10, 12]","So once, there was a show. It aired on FOX and it was called ""Tru Calling."" It was about a girl named Tru Davies. She got a job at morgue and found out she has a calling --- dead bodies ask her for help. Her day rewinds and she tries to save the lives of these people. The show was for the most part brilliant, but the ratings weren't exactly top-notch. Nevertheless, FOX renewed it for a second season, and boy what developed. A character that had come in with a bang in the first season, Jack, returns with a vengeance to foil Tru's plans to save lives --- or if, you agree with his view, he's preserving fate. And so the show was good and getting better all the time, with new twists and compelling plots. And then, FOX cancelled it and left the final episode, a holiday episode, unaired.Now comes Tru Calling: The Complete Second Season DVD. This DVD features all six episodes from the second-season including the unaired episode ""'Twas the Night Before Christmas... Again."" I won't spoil what happens in this episode, but let's just say that there's some major stuff going down.The episodes are presented in their original full-screen format and fully close-captioned. Also including is Dolby Digital sound as well English, French and Spanish subtitles. The presentation and artwork are pretty nice --- nothing to complain about here.There's only one special feature, but it's a good one --- Opposing Forces Making Of Featurette. In this, Eliza Dushku and Jason Priestly talk about how things have changed in the new season and the dynamic between Jack and Tru. But we also get insights into the new season from not just them, but other characters as well. And there's a funny bit with ""Davis"" at the end that I won't spoil.Normally, I would give a DVD of a show I really liked, but only had one special feature 4 stars. However, because of the unique nature of this show and the fact that I'm in a holiday mood --- five stars.",5,Haunted By a Whisper of What Could Have Been,1135382400,"12 24, 2005",2005,1932,"['So', 'once', 'was', 'show', 'aired', 'FOX', 'was', 'called', 'Tru', 'Calling', 'was', 'girl', 'named', 'Tru', 'Davies', 'got', 'job', 'morgue', 'found', 'out', 'calling', 'dead', 'bodies', 'ask', 'help', 'day', 'rewinds', 'save', 'lives', 'people', 'show', 'was', 'most', 'part', 'brilliant', 'ratings', 'were', ""n't"", 'exactly', 'top-notch', 'Nevertheless', 'FOX', 'renewed', 'second', 'season', 'boy', 'what', 'developed', 'character', 'had', 'come', 'bang', 'first', 'season', 'Jack', 'vengeance', 'foil', 'Tru', 'plans', 'save', 'lives', 'agree', 'view', 'preserving', 'fate', 'show', 'was', 'good', 'getting', 'better', 'time', 'new', 'twists', 'compelling', 'plots', 'then', 'FOX', 'cancelled', 'left', 'final', 'episode', 'holiday', 'episode', 'unaired.Now', 'Tru', 'Calling', 'Complete', 'Second', 'Season', 'DVD', 'DVD', 'six', 'episodes', 'second-season', 'including', 'unaired', 'episode', ""'T"", 'was', 'Night', 'Before', 'Christmas', 'Again', 'wo', ""n't"", 'spoil', 'what', 'episode', 'let', 'just', 'say', 'major', 'stuff', 'going', 'down.The', 'episodes', 'are', 'presented', 'original', 'full-screen', 'format', 'fully', 'close-captioned', 'Also', 'including', 'Dolby', 'Digital', 'sound', 'as', 'well', 'English', 'French', 'Spanish', 'subtitles', 'presentation', 'artwork', 'are', 'pretty', 'nice', 'nothing', 'complain', 'here.There', 'only', 'one', 'special', 'feature', 'good', 'one', 'Opposing', 'Forces', 'Making', 'Featurette', 'Eliza', 'Dushku', 'Jason', 'Priestly', 'talk', 'how', 'things', 'have', 'changed', 'new', 'season', 'dynamic', 'Jack', 'Tru', 'also', 'get', 'insights', 'new', 'season', 'not', 'just', 'other', 'characters', 'well', 'funny', 'bit', 'Davis', 'end', 'wo', ""n't"", 'spoil.Normally', 'would', 'give', 'DVD', 'show', 'really', 'liked', 'only', 'had', 'one', 'special', 'feature', '4', 'stars', 'However', 'unique', 'nature', 'show', 'fact', ""'m"", 'holiday', 'mood', 'five', 'stars']",N/A
929300,A1H8JUI9GNQKNR,B000AO9BSS,Harold Harefoot,"[8, 15]","The ONLY reason I kept watching this show in season one was loyalty to Eliza Dushku, who is an incredibly talented actress.  Fortunately, for season two, the producers brought in some equally talented writers, such as Jane Espenson, to improve on the horrible writing of the first season.  The revamped show of season two is a HUGE improvement over season one.  I'd recommend buying the dvd for season two and just skipping season one.  That way you get the very best of this show and skip the very worst of it.",5,So much better than season 1,1133308800,"11 30, 2005",2005,511,"['ONLY', 'reason', 'kept', 'watching', 'show', 'season', 'one', 'was', 'loyalty', 'Eliza', 'Dushku', 'who', 'incredibly', 'talented', 'actress', 'Fortunately', 'season', 'two', 'producers', 'brought', 'equally', 'talented', 'writers', 'such', 'Jane', 'Espenson', 'improve', 'horrible', 'writing', 'first', 'season', 'revamped', 'show', 'season', 'two', 'HUGE', 'improvement', 'season', 'one', ""'d"", 'recommend', 'buying', 'dvd', 'season', 'two', 'just', 'skipping', 'season', 'one', 'way', 'get', 'very', 'best', 'show', 'skip', 'very', 'worst']",N/A
929301,A319SKSB556033,B000AO9BSS,"Inspector Gadget ""Go Go Gadget Reviews""","[7, 10]","Tru Calling wasn't exactly original but it had a great concept and had the chance to seriously develop into bigger and better things. By the end of this, unfortunately truncated, second season the show had a great deal of complexity. It will forever remain unfinished.It's a real shame, but this isn't reality TV and every single show that isn't reality TV these days gets cancelled. A sad, horrible fact but it's the world we live in. Since its invention the standard of programming on TV has gradually decreased in sophistication and Tru Calling is one of many casualties. At first I was hopeful that it might come back to another channel or even as a movie (Firefly only managed half the episodes Tru Calling did and THAT ended up a successful and critically acclaimed film) but I've since learned that Eliza Dushku (who, surprising for an actress of her age, keeps a low-profile on her career) does not want to play Tru again even if the opportunity arose.I totally recommend Tru Calling but, ultimately, you're setting yourself up for disappointment. This show slipped away without being freed.",3,Tru can't save this one.,1129852800,"10 21, 2005",2005,1099,"['Tru', 'Calling', 'was', ""n't"", 'exactly', 'original', 'had', 'great', 'concept', 'had', 'chance', 'seriously', 'develop', 'bigger', 'better', 'things', 'end', 'unfortunately', 'truncated', 'second', 'season', 'show', 'had', 'great', 'deal', 'complexity', 'will', 'forever', 'remain', 'unfinished.It', 'real', 'shame', ""n't"", 'reality', 'TV', 'single', 'show', ""n't"", 'reality', 'TV', 'days', 'cancelled', 'sad', 'horrible', 'fact', 'world', 'live', 'invention', 'standard', 'programming', 'TV', 'gradually', 'decreased', 'sophistication', 'Tru', 'Calling', 'one', 'many', 'casualties', 'first', 'was', 'hopeful', 'might', 'come', 'back', 'channel', 'even', 'movie', 'Firefly', 'only', 'managed', 'episodes', 'Tru', 'Calling', 'did', 'THAT', 'ended', 'up', 'successful', 'critically', 'acclaimed', 'film', ""'ve"", 'learned', 'Eliza', 'Dushku', 'who', 'surprising', 'actress', 'age', 'low-profile', 'career', 'not', 'want', 'play', 'Tru', 'again', 'even', 'opportunity', 'totally', 'recommend', 'Tru', 'Calling', 'ultimately', ""'re"", 'setting', 'up', 'disappointment', 'show', 'slipped', 'away', 'being', 'freed']",N/A
929302,A11T2C1VI2G3WZ,B000AO9BSS,"Jesus Cano ""Jesus""","[1, 2]","Tru Calling me enamor&oacute; desde el primer capitulo. Pese a saber que fue cancelada, la he comprado. Me encanta sus capitulos, es una pena que no siguiera. Era fant&aacute;stica!  Compral&aacute; y ver&aacute;s como te gusta a ti tambi&eacute;n :)",5,I love it!  Lastima su cancelamiento,1182729600,"06 25, 2007",2007,250,"['Tru', 'Calling', 'enamor', 'oacute', 'desde', 'el', 'primer', 'capitulo', 'Pese', 'saber', 'que', 'fue', 'cancelada', 'la', 'Me', 'encanta', 'sus', 'capitulos', 'es', 'una', 'pena', 'que', 'siguiera', 'Era', 'fant', 'aacute', 'stica', 'Compral', 'aacute', 'aacute', 'como', 'te', 'gusta', 'ti', 'tambi', 'eacute']",N/A
929303,A39KFTH8S609TZ,B000AO9BSS,JonaAmazon,"[5, 7]","Every episode in Season Two is a gem. Now that so much of the backstory has been established in Season One, this season starts at a vigorous pace and never slows down.This season reminds me of the genius of Fatboy Slim or Brahms. The writers take the leitmotif of rewinding a day, and replay it like a fugue & variations so that we can enjoy it from every conceptual angle. Each episode expands the mythology outward in surprising but logical directions.Like the best episodes of Buffy and Firefly, you find yourself exclaiming in surprise at the surprise twists at the beginning, middle and ending of the episodes.It's a tru tragedy that Fox sabotaged the success of this series. I hope the actors and writers go on to do the fantastic work they proved themselves capable of doing on Tru Calling.",5,Even More Brilliant Than Season One,1159228800,"09 26, 2006",2006,797,"['episode', 'Season', 'Two', 'gem', 'Now', 'so', 'much', 'backstory', 'been', 'established', 'Season', 'One', 'season', 'vigorous', 'pace', 'never', 'down.This', 'season', 'genius', 'Fatboy', 'Slim', 'Brahms', 'writers', 'take', 'leitmotif', 'rewinding', 'day', 'replay', 'fugue', 'variations', 'so', 'can', 'enjoy', 'conceptual', 'angle', 'episode', 'mythology', 'outward', 'surprising', 'logical', 'best', 'episodes', 'Buffy', 'Firefly', 'find', 'exclaiming', 'surprise', 'surprise', 'beginning', 'middle', 'ending', 'episodes.It', 'tru', 'tragedy', 'Fox', 'sabotaged', 'success', 'series', 'hope', 'actors', 'writers', 'go', 'do', 'fantastic', 'work', 'proved', 'capable', 'doing', 'Tru', 'Calling']",N/A
929304,A2QYKLVZKJPXTH,B000AO9BSS,"Kay Harvey ""Kay Harvey""","[0, 0]","You don't have to be a sci-fi fan to enjoy this series. ""Tru Calling"" is about a young woman who is studying to become a doctor. She takes a job at the morgue not just for the money, but it also leaves her extra study time. She is shocked one day when a corpse calls her name, turns its head and says, ""Help me.""Next scene, Tru wakes up and eventually realizes that the day has ""rewound."" With the facts she has from the corpse, she is able to prevent that person's death.Her boss is a quirky guy who doesn't go out much. Her brother bets on the horse races and doesn't have a job but is always there to help her when needed.This was a really good show and I wish it could have lasted more than two seasons.",5,Tru Calling,1314835200,"09 1, 2011",2011,707,"['do', ""n't"", 'have', 'be', 'sci-fi', 'fan', 'enjoy', 'series', 'Tru', 'Calling', 'young', 'woman', 'who', 'studying', 'become', 'doctor', 'job', 'morgue', 'not', 'just', 'money', 'also', 'extra', 'study', 'time', 'shocked', 'one', 'day', 'when', 'corpse', 'name', 'head', 'Help', 'Next', 'scene', 'Tru', 'up', 'eventually', 'day', 'rewound', 'facts', 'corpse', 'able', 'prevent', 'person', 'death.Her', 'boss', 'quirky', 'guy', 'who', ""n't"", 'go', 'out', 'much', 'brother', 'bets', 'horse', 'races', ""n't"", 'have', 'job', 'always', 'there', 'help', 'when', 'needed.This', 'was', 'really', 'good', 'show', 'wish', 'could', 'have', 'lasted', 'more', 'two', 'seasons']",N/A
929305,A16Z7G9BBYH9EN,B000AO9BSS,"Lauren H. Lavine ""Highlandlasse""","[268, 268]","I loved the premise of the show. This woman has the ability to save lives and does everything she can to, to the detriment of her own personal life does so. Eliza Dushku is a great actor and highly underrated. I loved her on Buffy the Vampire Slayer and she continues to prove her talent in Tru Calling. Shawn Reaves is talented and adds not just drama but certain type of comic relief. Jason Priestly, what can I say that hasn't already been said. He's not only extremely talented, but incredibly charming. He's got what they call in Hollywood the ""it"" quality. Rob Duncan who scores the show does a wonderful job. He did the final episode of Buffy the Vampire Slayer and it what an amazing work of art. He is quite the musical artist. I bought this DVD set without ever having seen any of it on television, trusting that the casting and creative people behind the scene would be enough for me to be assured that I would like it. Not only do I like it, but I love it. My only regret is that they didn't give the show a fair chance. It still had a lot of room for more great story telling and character development. You won't be wasting your money on this set Seasons one and Two.",5,Tru Calling Ended Too Soon,1171411200,"02 14, 2007",2007,1180,"['loved', 'premise', 'show', 'woman', 'ability', 'save', 'lives', 'everything', 'can', 'detriment', 'own', 'personal', 'life', 'so', 'Eliza', 'Dushku', 'great', 'actor', 'highly', 'underrated', 'loved', 'Buffy', 'Vampire', 'Slayer', 'prove', 'talent', 'Tru', 'Calling', 'Shawn', 'Reaves', 'talented', 'not', 'just', 'drama', 'certain', 'type', 'comic', 'relief', 'Jason', 'Priestly', 'what', 'can', 'say', ""n't"", 'already', 'been', 'said', 'not', 'only', 'extremely', 'talented', 'incredibly', 'charming', 'got', 'what', 'call', 'Hollywood', 'quality', 'Rob', 'Duncan', 'who', 'show', 'wonderful', 'job', 'did', 'final', 'episode', 'Buffy', 'Vampire', 'Slayer', 'what', 'amazing', 'work', 'art', 'quite', 'musical', 'artist', 'bought', 'DVD', 'set', 'ever', 'having', 'seen', 'television', 'trusting', 'casting', 'creative', 'people', 'scene', 'would', 'be', 'enough', 'be', 'assured', 'would', 'like', 'Not', 'only', 'do', 'love', 'My', 'only', 'did', ""n't"", 'give', 'show', 'fair', 'chance', 'still', 'had', 'lot', 'room', 'more', 'great', 'story', 'telling', 'character', 'development', 'wo', ""n't"", 'be', 'wasting', 'money', 'set', 'Seasons', 'one', 'Two']",N/A
