,reviewerID,asin,reviewerName,helpful,reviewText,overall,summary,unixReviewTime,reviewTime,reviewYear,reviewLength,meaningfulWords,Title
773250,A2V026TK7H80V3,B0000C2IWH,Carl Cheng,"[0, 0]","Well, in chronological order, the Christmas special was released first, the Spring special second, and the OAVs (titled Again) were released last.  That is the order I will talk about them in.Christmas special - 5 starsThis was the best thing to come out of Love Hina in my opinion.  The story of the episode was really sweet, chasing after the thought of a mini-Todai love story.  What I mean by this is that if someone confesses on Christmas, they will love each other and be together forever, so it is said.  The characters take this into account and you see their true feelings and how they want to go about dealing with it.  This is what I think Love Hina is really about.  Since the TV series didn't have much closure and the Spring Special only did so in a mediocre way, I feel this is the episode that I will keep on watching from time to time to remind me of why I love Love Hina.Spring Special - 3 StarsThis was the first true ending to Love Hina until the OAVs came out.  The premise of this special was that Keitaro and Naru took the entrance exam to Todai but Keitaro fell asleep and thought he totally bombed.  Dreadfully ashamed, he left which led to the cast of girls trying to find him.  The search ends on an island, meeting up with a girl named Nyamo.  The point of this is that it is very unfulfilling and that the OAVs did not help but to make the series become even more unfulfilling.Love Hina Again - 1 StarI always wonder, why make more if it doesn't serve any purpose but to ruin the earlier series?  This is what happened.  They introduce a new character, Kanako, who is Keitaro's step sister who is in love with Keitaro as well (big surprise).  This is after Keitaro leaves with Seta on another anthropological trip, leaving the Hinatasou unattended.  All this OAV did was create stupid plot lines and more fan service that just made me sad while watching it because I still remember how much I absolutely loved the TV series.  It didn't give closure to the series that I had put so much heart into.Final Note: Do not get me wrong and think that I am bashing Love Hina.  This series quickly became my favorite for its characters, lightheartedness and story about promise and love.  But I felt that a lot of that got lost on the way.  After the TV series and the Christmas special, I haven't felt that same spark from its other additions.  Love Hina Again turned a lot of the focus on fan service, (which I as a fan, was insulted) instead of keeping the original focus and flow of love as the aspect which they had originally built so beautifully.",3,Each have a different rating,1067731200,"11 2, 2003",2003,2573,"['Well', 'chronological', 'order', 'Christmas', 'special', 'was', 'released', 'first', 'Spring', 'special', 'second', 'OAVs', 'titled', 'Again', 'were', 'released', 'last', 'order', 'will', 'talk', 'in.Christmas', 'special', '5', 'starsThis', 'was', 'best', 'thing', 'come', 'Love', 'Hina', 'opinion', 'story', 'episode', 'was', 'really', 'sweet', 'chasing', 'thought', 'mini-Todai', 'love', 'story', 'What', 'mean', 'someone', 'Christmas', 'will', 'love', 'other', 'be', 'together', 'forever', 'said', 'characters', 'take', 'account', 'see', 'true', 'feelings', 'how', 'want', 'go', 'dealing', 'what', 'think', 'Love', 'Hina', 'really', 'about', 'TV', 'series', 'did', ""n't"", 'have', 'much', 'closure', 'Spring', 'Special', 'only', 'did', 'so', 'mediocre', 'way', 'feel', 'episode', 'will', 'keep', 'watching', 'time', 'time', 'remind', 'why', 'love', 'Love', 'Hina.Spring', 'Special', '3', 'StarsThis', 'was', 'first', 'true', 'ending', 'Love', 'Hina', 'OAVs', 'came', 'out', 'premise', 'special', 'was', 'Keitaro', 'Naru', 'took', 'entrance', 'exam', 'Todai', 'Keitaro', 'fell', 'asleep', 'thought', 'totally', 'bombed', 'Dreadfully', 'ashamed', 'left', 'led', 'cast', 'girls', 'trying', 'find', 'search', 'island', 'meeting', 'up', 'girl', 'named', 'Nyamo', 'point', 'very', 'unfulfilling', 'OAVs', 'did', 'not', 'help', 'make', 'series', 'become', 'even', 'more', 'unfulfilling.Love', 'Hina', 'Again', '1', 'StarI', 'always', 'wonder', 'why', 'make', 'more', ""n't"", 'serve', 'purpose', 'ruin', 'earlier', 'series', 'what', 'happened', 'introduce', 'new', 'character', 'Kanako', 'who', 'Keitaro', 'step', 'sister', 'who', 'love', 'Keitaro', 'as', 'well', 'big', 'surprise', 'Keitaro', 'Seta', 'anthropological', 'trip', 'leaving', 'Hinatasou', 'unattended', 'OAV', 'did', 'was', 'create', 'stupid', 'plot', 'lines', 'more', 'fan', 'service', 'just', 'made', 'sad', 'watching', 'still', 'remember', 'how', 'much', 'absolutely', 'loved', 'TV', 'series', 'did', ""n't"", 'give', 'closure', 'series', 'had', 'put', 'so', 'much', 'heart', 'into.Final', 'Note', 'Do', 'not', 'get', 'wrong', 'think', 'am', 'bashing', 'Love', 'Hina', 'series', 'quickly', 'became', 'favorite', 'characters', 'lightheartedness', 'story', 'promise', 'love', 'felt', 'lot', 'got', 'lost', 'way', 'TV', 'series', 'Christmas', 'special', 'have', ""n't"", 'felt', 'same', 'spark', 'other', 'additions', 'Love', 'Hina', 'Again', 'turned', 'lot', 'focus', 'fan', 'service', 'fan', 'was', 'insulted', 'instead', 'keeping', 'original', 'focus', 'flow', 'love', 'aspect', 'had', 'originally', 'built', 'so', 'beautifully']",N/A
773251,A57TNPQNZUVQN,B0000C2IWH,Dan Zhu,"[2, 3]","I own the whole DVD box set, both Movies and Series. And I have also read entire manga or comic books of Love Hina.The manga version include BOTH Series and Movie version of Love Hina. But it is very different from the Series. I guess the manga is more detailed and fun to read. Also the storyline is very different. DVD and manga are telling the same story, but DVD is kinda like director's cut edition.There are many stories shown in manga which have not shown in the DVD. There are also many stories shown in DVD that have not shown in manga.Some people say that manga version is better than the DVD version. I do not totally agree with it. I enjoy watching and read this great masterpiece. I think BOTH are very good and are worth to collect. Some people also say that Spring Movie is very BAD. Well, Over all, I think Spring Movie is not that good compare to the other two movies.Over all, I give this product 4.5/5 STARS! It is a great anime! But none of the anime is PERFECT, just like us human *^_^*If you like love story which is VERY VERY SAD. I highly recommend &lt;&lt;Saikano&gt;&gt;. I just bought &lt;&lt;FLCL&gt;&gt; recently, I think it is also one of the greatest anime ever made!Thank you for reading my review!!!",5,A Great Love Story,1080777600,"04 1, 2004",2004,1232,"['own', 'whole', 'DVD', 'box', 'set', 'Movies', 'Series', 'have', 'also', 'read', 'entire', 'manga', 'comic', 'books', 'Love', 'Hina.The', 'manga', 'version', 'include', 'BOTH', 'Series', 'Movie', 'version', 'Love', 'Hina', 'very', 'different', 'Series', 'guess', 'manga', 'more', 'detailed', 'fun', 'read', 'Also', 'storyline', 'very', 'different', 'DVD', 'manga', 'are', 'telling', 'same', 'story', 'DVD', 'kinda', 'director', 'cut', 'edition.There', 'are', 'many', 'stories', 'shown', 'manga', 'have', 'not', 'shown', 'DVD', 'are', 'also', 'many', 'stories', 'shown', 'DVD', 'have', 'not', 'shown', 'manga.Some', 'people', 'say', 'manga', 'version', 'better', 'DVD', 'version', 'do', 'not', 'totally', 'agree', 'enjoy', 'watching', 'read', 'great', 'masterpiece', 'think', 'are', 'very', 'good', 'are', 'worth', 'collect', 'people', 'also', 'say', 'Spring', 'Movie', 'very', 'BAD', 'Well', 'think', 'Spring', 'Movie', 'not', 'that', 'good', 'compare', 'other', 'two', 'give', 'product', '4.5/5', 'STARS', 'great', 'anime', 'none', 'anime', 'PERFECT', 'just', 'human', '*^_^*If', 'love', 'story', 'VERY', 'VERY', 'SAD', 'highly', 'recommend', 'lt', 'lt', 'Saikano', 'gt', 'gt', 'just', 'bought', 'lt', 'lt', 'FLCL', 'gt', 'gt', 'recently', 'think', 'also', 'one', 'greatest', 'anime', 'ever', 'made', 'Thank', 'reading', 'review']",N/A
773252,A3NIQK6ZLYEP1L,B0000C2IWH,Michael Valdivielso,"[6, 6]","The Love Hina Christmas Movie DVD is the first you should watch.  Not only does it have Episode 25 as one of the extras, but the movie itself is very touching, as Keitaro finally tells Naru he loves her.  But her reaction, which is to run away, is not the one he wanted.  Does she love him or is she still in love with somebody else?The Love Hina Spring Movie DVD is the next one you should watch.  Naru, Keitaro and Mutsumi have taken their entrance exam for Tokyo U BUT before the results can come in Keitaro disappears.  Naru pretends not to care, but in the end she runs off to rescue him.The story goes nuts, as we end up on a tropical island with a secret civilization, lots of flying turtles, missiles and a girl named Nyamo.  Pretty normal for Love Hina when you think about it.The third DVD, Love Hina Again, is three episodes.  We learn Keitaro and Naru have begun college life.  Yet Naru has still not told Keitaro she loves him (not to his face anyway).  And now he's gone off on another archaelogical dig with Naru's old flame Seta!THEN Keitaro's little step-sister shows up and things really get weird, even for Love Hina.  Talking cats, love magic and lots of new rules to live by.  This DVD also has cool outtakes!If you love Love Hina, you should try to get all the DVDs, used or new.",5,Three great movies in one collection...,1081036800,"04 4, 2004",2004,1301,"['Love', 'Hina', 'Christmas', 'Movie', 'DVD', 'first', 'should', 'watch', 'Not', 'only', 'have', 'Episode', '25', 'one', 'extras', 'movie', 'very', 'touching', 'Keitaro', 'finally', 'Naru', 'reaction', 'run', 'away', 'not', 'one', 'wanted', 'Does', 'love', 'still', 'love', 'somebody', 'else', 'Love', 'Hina', 'Spring', 'Movie', 'DVD', 'next', 'one', 'should', 'watch', 'Naru', 'Keitaro', 'Mutsumi', 'have', 'taken', 'entrance', 'exam', 'Tokyo', 'U', 'BUT', 'results', 'can', 'come', 'Keitaro', 'disappears', 'Naru', 'not', 'care', 'end', 'rescue', 'him.The', 'story', 'nuts', 'end', 'up', 'tropical', 'island', 'secret', 'civilization', 'lots', 'flying', 'turtles', 'missiles', 'girl', 'named', 'Nyamo', 'Pretty', 'normal', 'Love', 'Hina', 'when', 'think', 'it.The', 'third', 'DVD', 'Love', 'Hina', 'Again', 'three', 'episodes', 'learn', 'Keitaro', 'Naru', 'have', 'begun', 'college', 'life', 'Naru', 'still', 'not', 'told', 'Keitaro', 'not', 'face', 'anyway', 'now', 'gone', 'off', 'archaelogical', 'dig', 'Naru', 'old', 'flame', 'Seta', 'THEN', 'Keitaro', 'little', 'step-sister', 'up', 'things', 'really', 'get', 'weird', 'even', 'Love', 'Hina', 'Talking', 'cats', 'love', 'magic', 'lots', 'new', 'rules', 'live', 'DVD', 'also', 'cool', 'outtakes', 'love', 'Love', 'Hina', 'should', 'try', 'get', 'DVDs', 'used', 'new']",N/A
773253,AVJZB6FXKZ00Y,B0000C2IWH,"M. Metreyeon ""dhampir""","[0, 0]","While I haven't had a chance to watch this set, it did come in great condition and I do look forward to watching it are viewing the series. I've played the sim dating game on line and it is funny. So now I'll get to see the series to find out more about  all these crazy characters. Wish I had more to say, but I haven't viewed yet, but will soon.",5,Can't wait to watch it,1326412800,"01 13, 2012",2012,347,"['have', ""n't"", 'had', 'chance', 'watch', 'set', 'did', 'come', 'great', 'condition', 'do', 'look', 'forward', 'watching', 'are', 'viewing', 'series', ""'ve"", 'played', 'sim', 'dating', 'game', 'line', 'funny', 'So', 'now', ""'ll"", 'get', 'see', 'series', 'find', 'out', 'more', 'crazy', 'characters', 'Wish', 'had', 'more', 'say', 'have', ""n't"", 'viewed', 'yet', 'will', 'soon']",N/A
773254,A1VCLTAGM5RLND,B0000C2IWH,"Ronnie Clay ""R.C.""","[1, 1]","What a great collection having three movies and don't worrie about buying them sepertaly. The dubing needs some work. In Love Hina again movie who would of ever thought Keitaro and Naru would admit their in love, I do wished Naru would have broken Keitaro for breaking his at college.",5,Love the Movie Boxed Set,1118793600,"06 15, 2005",2005,284,"['What', 'great', 'collection', 'having', 'three', 'movies', 'do', ""n't"", 'worrie', 'buying', 'sepertaly', 'dubing', 'work', 'Love', 'Hina', 'again', 'movie', 'who', 'would', 'ever', 'thought', 'Keitaro', 'Naru', 'would', 'admit', 'love', 'do', 'wished', 'Naru', 'would', 'have', 'broken', 'Keitaro', 'breaking', 'college']",N/A
