,reviewerID,asin,reviewerName,helpful,reviewText,overall,summary,unixReviewTime,reviewTime,reviewYear,reviewLength,meaningfulWords,Title
707645,AM2IR1V5EU55U,B000069HYZ,"Brian J. Greene ""djbrian""","[2, 2]","Two very different types of nudist films, both excellent in their own way.  Doris Wishman's Diary of a Nudist has many of the features of a great campy movie- delightfully bad acting, pleasingly ugly set pieces, hilarious dialogue.  And if you're into just sitting back and watching a bunch of pretty girls (and none is prettier than the star of the film, a reporter who is sent to a nudist camp to ""expose"" the camp in her paper, but who becomes a nudie camp believer)  running around naked, there's that, too.  Naked Venus, although also somewhat campy, is more of a ""serious"" film, complete with dramatic courtroom scenes, wherein an uptight socialite American mother tries to get custody of her granndaughter from her French daughter-in-law, who is a nude model.  Because this package was put together by Something Weird, there's a whole boatload of delightful extras - trailers, short film, extra footage from the main features - all with a nudist camp theme.",4,Nude Shenanigans,1151193600,"06 25, 2006",2006,964,"['Two', 'very', 'different', 'types', 'nudist', 'films', 'excellent', 'own', 'way', 'Doris', 'Wishman', 'Diary', 'Nudist', 'many', 'features', 'great', 'campy', 'movie-', 'delightfully', 'bad', 'acting', 'pleasingly', 'ugly', 'set', 'pieces', 'hilarious', 'dialogue', ""'re"", 'just', 'sitting', 'back', 'watching', 'bunch', 'pretty', 'girls', 'none', 'prettier', 'star', 'film', 'reporter', 'who', 'sent', 'nudist', 'camp', 'expose', 'camp', 'paper', 'who', 'nudie', 'camp', 'believer', 'running', 'around', 'naked', 'too', 'Naked', 'Venus', 'also', 'somewhat', 'campy', 'more', 'serious', 'film', 'complete', 'dramatic', 'courtroom', 'scenes', 'wherein', 'uptight', 'socialite', 'American', 'mother', 'tries', 'get', 'custody', 'granndaughter', 'French', 'daughter-in-law', 'who', 'nude', 'model', 'package', 'was', 'put', 'together', 'Something', 'Weird', 'whole', 'boatload', 'delightful', 'extras', 'trailers', 'short', 'film', 'extra', 'footage', 'main', 'features', 'nudist', 'camp', 'theme']",Diary of a Nudist / The Naked Venus
707646,A1U3FRM4VW0ZCT,B000069HYZ,Creature Feature Fan,"[0, 0]",The Better Movie Of The Two Is The Naked Venus --- Black And White ( Where Are Those Colorizing People At ?) Very Well Done For The Late 50s A Gem In The Ruff . Diary Of a Nudist Is A Slice Of Americania Mania Shot In Florida And Some Place Up North Where I Think It Was Cold --- Watch The Nipps They Tells The Tale --- Ok To Watch ---In Color --- Lots Of Boobs And Butts ---- And Old Cars ---- Beware ! About Half Way Through Old Zelda Is Kickin It By The Pool Neked ---Oh My Eyes ---  Nude On The Moon Is Still My Favorite Wishman Flick ---- The Golden Lesson We Learn From Doris Is ---You Can Still Make Movies Even If They Suck ---People Will Watch Them,5,Doris Wishman At Her Best,1360108800,"02 6, 2013",2013,657,"['Better', 'Movie', 'Two', 'Naked', 'Venus', 'Black', 'White', 'Where', 'Are', 'Colorizing', 'People', 'Very', 'Well', 'Done', 'Late', '50s', 'A', 'Gem', 'Ruff', 'Diary', 'Nudist', 'A', 'Slice', 'Americania', 'Mania', 'Shot', 'Florida', 'Place', 'Up', 'North', 'Where', 'Think', 'Was', 'Cold', 'Watch', 'Nipps', 'Tells', 'Tale', 'Ok', 'Watch', '-In', 'Color', 'Lots', 'Boobs', 'Butts', 'Old', 'Cars', 'Beware', 'Way', 'Old', 'Zelda', 'Kickin', 'Pool', 'Neked', '-Oh', 'My', 'Eyes', 'Nude', 'Moon', 'Is', 'Still', 'My', 'Favorite', 'Wishman', 'Flick', 'Golden', 'Lesson', 'Learn', 'Doris', 'Is', '-You', 'Can', 'Still', 'Make', 'Movies', 'Even', 'Suck', '-People', 'Will', 'Watch', 'Them']",Diary of a Nudist / The Naked Venus
707647,ACJTUFZEUCCBL,B000069HYZ,"Eolake ""eolake (.com)""","[12, 13]","I agree with the two previous reviews.I would add that both films has a couple of very pretty ladies. One short scene in Diary of a couple of girls sqealing under a cold hose is wonderful, and more sexy than 98% of anything the adult industry has turned out.Also, some of the extras, ""info"" films about nudism from the fifties, are just hilarious. Quite amazing.",5,Great fun,1059436800,"07 29, 2003",2003,362,"['agree', 'two', 'previous', 'reviews.I', 'would', 'add', 'films', 'couple', 'very', 'pretty', 'ladies', 'One', 'short', 'scene', 'Diary', 'couple', 'girls', 'sqealing', 'cold', 'hose', 'wonderful', 'more', 'sexy', '98', '%', 'anything', 'adult', 'industry', 'turned', 'out.Also', 'extras', 'info', 'films', 'nudism', 'fifties', 'are', 'just', 'hilarious', 'Quite', 'amazing']",Diary of a Nudist / The Naked Venus
707648,A3GRN6J64F2C3X,B000069HYZ,"Joseph P. Menta, Jr.","[3, 3]","As I understand it, in years past the only way to show graphic nudity on movie screens was to depict non-sexual nudity, and that ultimately meant... movies about nudist camps!  So there was this whole rash of movies (especially in the 60's) that featured mainstream mystery stories, horror stories, dramas, etc., but with one big difference from regular theater fare: the movies were set in nudist resorts.  Talk about a weird, weird sub-genre of movies, a sub-genre nicely sampled on this DVD.""Diary of a Nudist"" is, the ridiculous story and low-budget production values notwithstanding, probably not a completely inaccurate look at what life in a 1960's nudist camp was like.  I would just add that in real life there would likely be a wider diversity of bodies than the perfect specimens on hand here.  So sit back, relax, and-- once you get past the endless scene of happy nudists arriving at the club and letting themselves in the gate-- enjoy a silly little drama (and ultimately romance story) set in the sunshine and peace of a 60's-era Florida nudist resort.""The Naked Venus"" is more of an outright hoot.  Filmed in crisp black and white, this is essentially a courtroom drama with a little bit of nudism thrown in for good measure.  Two things really stand out.  First, the movie revolves around a custody battle for a little kid.  So what does the woman who wants custody of her kid do once she runs off with the little tyke?  She immediately takes refuge in a nudist camp.  Now, there quite possibly may be nothing wrong with nudism, but would a nudist resort be the FIRST PLACE you'd go when the other side is looking for ANY LITTLE THING to put forth as a red flag and cause for concern about a person's fitness to be a mother?  Heck, just wait 'til you after win the case before you take your kid to the nudist camp!  Sheesh.  Secondly, the judge and lawyers in the case constantly confuse the meanings of the words ""overruled"" and ""sustained"".  It's a riot.This fun, generous DVD is rounded out with a nice variety of nudist ""short subjects"" from the silent era to the 60's.  I saw a recurring theme: while most of the short subjects emphasized the wholesome aspects of nudism, several of them (as well as the two main features, too) tried to sneak in a little light prurience here and there.  I guess that's fair.  Because while nudism purportedly isn't about overt sex, if you're a person who enjoys looking at attractive people at a regular beach or resort, you're going to enjoy looking at attractive people at a nudist beach or resort.  You just wouldn't be impolite and ogle.If you like this DVD, check out Something Weird's double-feature DVD of ""The Beast That Killed Women"" and ""The Monster of Camp Sunshine"".  After all, you haven't lived 'til you've seen that pinnacle of western civilization known as the nudist horror movie.",4,"Good , (mostly) clean nudist fun",1162166400,"10 30, 2006",2006,2853,"['understand', 'years', 'only', 'way', 'show', 'graphic', 'nudity', 'movie', 'screens', 'was', 'depict', 'non-sexual', 'nudity', 'ultimately', 'meant', 'movies', 'nudist', 'camps', 'So', 'there', 'was', 'whole', 'rash', 'movies', 'especially', '60', 'featured', 'mainstream', 'mystery', 'stories', 'horror', 'stories', 'dramas', 'etc.', 'one', 'big', 'difference', 'regular', 'theater', 'fare', 'movies', 'were', 'set', 'nudist', 'resorts', 'Talk', 'weird', 'weird', 'sub-genre', 'movies', 'sub-genre', 'nicely', 'sampled', 'DVD', 'Diary', 'Nudist', 'ridiculous', 'story', 'low-budget', 'production', 'values', 'notwithstanding', 'probably', 'not', 'completely', 'inaccurate', 'look', 'what', 'life', '1960', 'nudist', 'camp', 'was', 'would', 'just', 'add', 'real', 'life', 'would', 'likely', 'be', 'wider', 'diversity', 'bodies', 'perfect', 'specimens', 'hand', 'here', 'So', 'sit', 'back', 'relax', 'once', 'get', 'endless', 'scene', 'happy', 'nudists', 'arriving', 'club', 'letting', 'gate', 'enjoy', 'silly', 'little', 'drama', 'ultimately', 'romance', 'story', 'set', 'sunshine', 'peace', ""60's-era"", 'Florida', 'nudist', 'resort', 'Naked', 'Venus', 'more', 'outright', 'hoot', 'Filmed', 'crisp', 'black', 'white', 'essentially', 'courtroom', 'drama', 'little', 'bit', 'nudism', 'thrown', 'good', 'measure', 'Two', 'things', 'really', 'stand', 'out', 'First', 'movie', 'around', 'custody', 'battle', 'little', 'kid', 'So', 'what', 'woman', 'who', 'custody', 'kid', 'do', 'once', 'little', 'tyke', 'immediately', 'refuge', 'nudist', 'camp', 'Now', 'quite', 'possibly', 'may', 'be', 'nothing', 'wrong', 'nudism', 'would', 'nudist', 'resort', 'be', 'FIRST', 'PLACE', ""'d"", 'go', 'when', 'other', 'side', 'looking', 'ANY', 'LITTLE', 'THING', 'put', 'forth', 'red', 'flag', 'cause', 'concern', 'person', 'fitness', 'be', 'mother', 'Heck', 'just', 'wait', ""'til"", 'win', 'case', 'take', 'kid', 'nudist', 'camp', 'Sheesh', 'Secondly', 'judge', 'lawyers', 'case', 'constantly', 'meanings', 'words', 'overruled', 'sustained', 'riot.This', 'fun', 'generous', 'DVD', 'rounded', 'out', 'nice', 'variety', 'nudist', 'short', 'subjects', 'silent', 'era', '60', 'saw', 'recurring', 'theme', 'most', 'short', 'subjects', 'emphasized', 'wholesome', 'aspects', 'nudism', 'several', 'as', 'well', 'two', 'main', 'features', 'too', 'tried', 'sneak', 'little', 'light', 'prurience', 'here', 'there', 'guess', 'fair', 'nudism', 'purportedly', ""n't"", 'overt', 'sex', ""'re"", 'person', 'who', 'looking', 'attractive', 'people', 'regular', 'beach', 'resort', ""'re"", 'going', 'enjoy', 'looking', 'attractive', 'people', 'nudist', 'beach', 'resort', 'just', 'would', ""n't"", 'be', 'impolite', 'ogle.If', 'DVD', 'check', 'out', 'Something', 'Weird', 'double-feature', 'DVD', 'Beast', 'Killed', 'Women', 'Monster', 'Camp', 'Sunshine', 'have', ""n't"", 'lived', ""'til"", ""'ve"", 'seen', 'pinnacle', 'western', 'civilization', 'known', 'nudist', 'horror', 'movie']",Diary of a Nudist / The Naked Venus
707649,A26NOYY84RMWMT,B000069HYZ,Ronald Bingham,"[32, 33]","This disc is packed with stuff! There are the two movies with their very coy nudity (watch as the ladies artfully stand with their legs covering the 'rude' bits or with towels/papers/hats draped over their midsection. The picture is a good restoration of some poor quality (old poorly preserved) originals, but it is still very watchable. The movies themselves are not spectacular in their plot but still fun and interesting.The extra's (of which there is over an hour) are the piece de resistance. You get trailers from 6 nudism related movies, extra footage from The Naked Venus, four shorts on nudity, a heap of poster art/production stills from various nudity related movies (with radio discussions over the top) and an easter egg of a nudist wedding.About half of the extra's are in black and white (as is The Naked Venus). Some have been restored to very good quality but one or two are almost unwatchable. There is virtually no full frontal nudity, but lots of breasts and bottoms.Everything is from the 50's and 60's and looks it (even naked, you can tell the era from the hair/makeup (sometimes this is caked on) and the cars). If you're interested in the history of nudity or nudity in films then this is highly recommended.",4,Fascinating (and often amusing) look at nudity in the 50's,1034553600,"10 14, 2002",2002,1234,"['disc', 'packed', 'stuff', 'are', 'two', 'movies', 'very', 'coy', 'nudity', 'watch', 'ladies', 'artfully', 'stand', 'legs', 'covering', ""'rude"", 'bits', 'towels/papers/hats', 'draped', 'midsection', 'picture', 'good', 'restoration', 'poor', 'quality', 'old', 'poorly', 'preserved', 'originals', 'still', 'very', 'watchable', 'movies', 'are', 'not', 'spectacular', 'plot', 'still', 'fun', 'interesting.The', 'extra', 'hour', 'are', 'piece', 'de', 'resistance', 'get', 'trailers', '6', 'nudism', 'related', 'movies', 'extra', 'footage', 'Naked', 'Venus', 'four', 'shorts', 'nudity', 'heap', 'poster', 'art/production', 'stills', 'various', 'nudity', 'related', 'movies', 'radio', 'discussions', 'top', 'easter', 'egg', 'nudist', 'half', 'extra', 'are', 'black', 'white', 'Naked', 'Venus', 'have', 'been', 'restored', 'very', 'good', 'quality', 'one', 'two', 'are', 'almost', 'unwatchable', 'virtually', 'full', 'frontal', 'nudity', 'lots', 'breasts', 'bottoms.Everything', '50', '60', 'even', 'naked', 'can', 'tell', 'era', 'hair/makeup', 'sometimes', 'caked', 'cars', ""'re"", 'interested', 'history', 'nudity', 'nudity', 'films', 'then', 'highly', 'recommended']",Diary of a Nudist / The Naked Venus
