,reviewerID,asin,reviewerName,helpful,reviewText,overall,summary,unixReviewTime,reviewTime,reviewYear,reviewLength,meaningfulWords,Title
1304744,A3TYC8T6W81DDB,B002ZG9800,C. Sawin,"[31, 38]","When he's not forcing his rather over the top and extremely physical humor down your throat, Jim Carrey is actually an actor with talent. He's proven this fact in films like The Majestic and Eternal Sunshine of the Spotless Mind. Ewan McGregor also has a reputation for making the most out of what he has to work with. He was one of the few things that kept The Island from being a complete waste of time and it seems like nearly everybody loves Trainspotting (and for good reason). But what would a film be like if these two rather talented actors portrayed a gay couple that on top of that was also based on a true story? That's where I Love You Phillip Morris comes in.Steven Jay Russell (Carrey) decides to come out of the closet and be his true self after a fateful car accident. As a gay man, Steven wants to live it up but doesn't make enough money to live the type of life he wants to live. His other calling as a conman begins to show its face and it eventually leads him to prison. Once in prison, he meets Phillip Morris (McGregor) who he eventually falls in love with. They soon begin to realize they can't bear to be apart from one another. Steven takes it upon himself to come up with an elaborate scheme that would keep them together forever, but all doesn't go according to plan. One scheme leads to another, which leads to another, and so on. But even when things seem to be in the clear, Steven finds himself falling into old habits and may lose Phillip because of it. Despite what they say, falling in love isn't nearly as hard as staying out of prison.Steven and Phillip's relationship is the main attraction of the film. The chemistry Carrey and McGregor share on screen is really pretty phenomenal. Jim Carrey gives what is quite possibly the performance of his career. Steven is disturbed and driven in an insane, but ""I'm doing this for your own good"" kind of way. His struggle to figure out who he is is portrayed by Carrey to emotional perfection. Ewan McGregor certainly has his moments, as well. Phillip is shy, somewhat quiet, and is usually taken advantage of by those around him. Watching him go through that as Steven slowly begins to do the same thing to Phillip that everyone else has is half the fun of the character.A love story between two gay men may not be for everyone, so I Love You Phillip Morris is able to offer more than just that. There's the intriguing cinematography. Early on in the film, there's a scene where Steven is tucking his daughter in before bed. As you hear him talking to his daughter, we're shown things like the toilet paper roll in the bathroom and a play tea set in his daughter's bedroom. For some reason, that shot of that toilet paper roll sticks with you the entire film. It's just simple enough to never forget. Even though the film is a drama, there is also quite a bit of comedy in there as well. Steven confronting his mother for something she did in her past is the best example of that. The dialogue is what really sticks out though, especially during the second viewing. There's a speech that Phillip makes to Steven near the end of the film about not being able to love someone who doesn't exist that is exceptional.I Love You Phillip Morris is an emotional and heartfelt love story that's driven by the on-screen chemistry between Jim Carrey and Ewan McGregor. It's laugh out loud funny one minute and tugging at your heart strings the next, I Love You Phillip Morris is a well-written and well presented drama that deserves to be giving a chance.",4,A fantastic film driven by the engaging chemistry between Carrey and McGregor,1291939200,"12 10, 2010",2010,3525,"['When', 'not', 'forcing', 'rather', 'top', 'extremely', 'physical', 'humor', 'throat', 'Jim', 'Carrey', 'actually', 'actor', 'talent', 'proven', 'fact', 'films', 'Majestic', 'Eternal', 'Sunshine', 'Spotless', 'Mind', 'Ewan', 'McGregor', 'also', 'reputation', 'making', 'most', 'what', 'work', 'was', 'one', 'few', 'things', 'kept', 'Island', 'being', 'complete', 'waste', 'time', 'nearly', 'everybody', 'Trainspotting', 'good', 'reason', 'what', 'would', 'film', 'be', 'two', 'rather', 'talented', 'actors', 'portrayed', 'gay', 'couple', 'top', 'was', 'also', 'based', 'true', 'story', 'where', 'Love', 'Phillip', 'Morris', 'in.Steven', 'Jay', 'Russell', 'Carrey', 'come', 'closet', 'be', 'true', 'self', 'fateful', 'car', 'accident', 'gay', 'man', 'Steven', 'live', 'up', ""n't"", 'make', 'enough', 'money', 'live', 'type', 'life', 'live', 'other', 'calling', 'conman', 'show', 'face', 'eventually', 'prison', 'Once', 'prison', 'Phillip', 'Morris', 'McGregor', 'who', 'eventually', 'love', 'soon', 'begin', 'realize', 'ca', ""n't"", 'bear', 'be', 'apart', 'one', 'Steven', 'come', 'up', 'elaborate', 'scheme', 'would', 'keep', 'together', 'forever', ""n't"", 'go', 'according', 'plan', 'One', 'scheme', 'so', 'even', 'when', 'things', 'seem', 'be', 'clear', 'Steven', 'falling', 'old', 'habits', 'may', 'lose', 'Phillip', 'what', 'say', 'falling', 'love', ""n't"", 'nearly', 'as', 'hard', 'staying', 'prison.Steven', 'Phillip', 'relationship', 'main', 'attraction', 'film', 'chemistry', 'Carrey', 'McGregor', 'share', 'screen', 'really', 'pretty', 'phenomenal', 'Jim', 'Carrey', 'what', 'quite', 'possibly', 'performance', 'career', 'Steven', 'disturbed', 'driven', 'insane', ""'m"", 'doing', 'own', 'good', 'kind', 'way', 'struggle', 'figure', 'out', 'who', 'portrayed', 'Carrey', 'emotional', 'perfection', 'Ewan', 'McGregor', 'certainly', 'moments', 'as', 'well', 'Phillip', 'shy', 'somewhat', 'quiet', 'usually', 'taken', 'advantage', 'Watching', 'go', 'through', 'that', 'Steven', 'slowly', 'do', 'same', 'thing', 'Phillip', 'everyone', 'else', 'fun', 'character.A', 'love', 'story', 'two', 'gay', 'men', 'may', 'not', 'be', 'everyone', 'Love', 'Phillip', 'Morris', 'able', 'offer', 'more', 'just', 'intriguing', 'cinematography', 'Early', 'film', 'scene', 'where', 'Steven', 'tucking', 'daughter', 'before', 'bed', 'hear', 'talking', 'daughter', ""'re"", 'shown', 'things', 'toilet', 'paper', 'roll', 'bathroom', 'play', 'tea', 'set', 'daughter', 'bedroom', 'reason', 'shot', 'toilet', 'paper', 'roll', 'sticks', 'entire', 'film', 'just', 'simple', 'enough', 'never', 'forget', 'Even', 'film', 'drama', 'also', 'quite', 'bit', 'comedy', 'there', 'as', 'well', 'Steven', 'confronting', 'mother', 'something', 'did', 'past', 'best', 'example', 'dialogue', 'what', 'really', 'out', 'especially', 'second', 'viewing', 'speech', 'Phillip', 'Steven', 'end', 'film', 'not', 'being', 'able', 'love', 'someone', 'who', ""n't"", 'exist', 'exceptional.I', 'Love', 'Phillip', 'Morris', 'emotional', 'heartfelt', 'love', 'story', 'driven', 'on-screen', 'chemistry', 'Jim', 'Carrey', 'Ewan', 'McGregor', 'laugh', 'loud', 'funny', 'one', 'minute', 'tugging', 'heart', 'next', 'Love', 'Phillip', 'Morris', 'well-written', 'well', 'presented', 'drama', 'be', 'giving', 'chance']",N/A
1304745,ATAWJ0EOWAMZH,B002ZG9800,Cynthia,"[0, 0]",This movie is very funny. I would not recommend this movie for anyone under 17. I like almost anything with Jim Carrey.,4,Funny movie for adults!,1391212800,"02 1, 2014",2014,119,"['movie', 'very', 'funny', 'would', 'not', 'recommend', 'movie', 'anyone', '17', 'like', 'almost', 'anything', 'Jim', 'Carrey']",N/A
1304746,A3I5UC6KY9N63B,B002ZG9800,Dan Williams,"[5, 19]",At least La Cage aux Folles was funny. This is not. Just dumb. Not even dumber. Good thing it was only 99 cents.,1,Made it to the one hour mark without a chuckle,1305504000,"05 16, 2011",2011,112,"['least', 'La', 'Cage', 'aux', 'Folles', 'was', 'funny', 'not', 'Just', 'dumb', 'Not', 'even', 'dumber', 'Good', 'thing', 'was', 'only', '99', 'cents']",N/A
1304747,A22M4O4HRKK3S2,B002ZG9800,David Holubetz,"[7, 41]","If only I could have passed on this one.  Jim Carrey, while not my favorite actor, has done some great stuff over the years (Truman, Majestic, Yes Man) and Ewan McGregor is solid and talented.  Why they chose to do this film is beyond me.  Supposed to be about white collar crime.  Maybe I expected some kind of intelligent sticking-it-to-the-man heist or something.  Instead, they were sticking it to each other.  I was pretty put off by the rampant homosexuality, but beyond that, the movie is just dysfunctional and depressing.  There's no character to like, most of the time they are in prison, and it all ends very badly.  WTF ? I guess I should have researched it first - I thought that two talented actors at the top of their game would make an amazing movie together.  Hard to imagine who this would appeal to.  Very disappointing.",1,Warning : 2 great actors does not equal a great movie,1302048000,"04 6, 2011",2011,839,"['only', 'could', 'have', 'passed', 'one', 'Jim', 'Carrey', 'not', 'favorite', 'actor', 'done', 'great', 'stuff', 'years', 'Truman', 'Majestic', 'Yes', 'Man', 'Ewan', 'McGregor', 'solid', 'talented', 'Why', 'chose', 'do', 'film', 'Supposed', 'be', 'white', 'collar', 'crime', 'Maybe', 'expected', 'kind', 'intelligent', 'sticking-it-to-the-man', 'heist', 'something', 'Instead', 'were', 'sticking', 'other', 'was', 'pretty', 'put', 'off', 'rampant', 'homosexuality', 'movie', 'just', 'dysfunctional', 'depressing', 'character', 'like', 'most', 'time', 'are', 'prison', 'very', 'badly', 'WTF', 'guess', 'should', 'have', 'researched', 'first', 'thought', 'two', 'talented', 'actors', 'top', 'game', 'would', 'make', 'amazing', 'movie', 'together', 'Hard', 'imagine', 'who', 'would', 'appeal', 'Very', 'disappointing']",N/A
1304748,A2K2RV6SD6IAVK,B002ZG9800,Dean Marconi,"[0, 0]","I love Jim Carrey. I have seen everything he's been in. Even his minor or supporting roles like in Peggy Sue Got Married or The Dead Pool. I had high hopes for this movie.I then watched this movie and have never felt such terrible regret. This movie feels like it is 47 hours long. In it, there are two guys that do essentially nothing. I mean, they get in and out of trouble and stuff but nothing really happens. This has a plot as much as the sun has a polar ice cap.The acting's great: if you like watching guys act like they aren't doing anything. And the sets and script-writing and effects are all great too - they completely immerse you in a world where nothing interested ever really happens.I don't know if maybe they wanted to ride the coattails of Brokeback Mountain by making a drama about a gay couple or what their agenda might have been with this film, but after a while, I forgot the couple were gay because my brain was so bored it shut itself down and all that I could think were the words &#34;It is now safe to turn off your computer.&#34;So, I only recommend this as a way to torture prisoners of war or possible as a present for someone with severe Alzheimer's because they will forget everything every few minutes and keep thinking something funny is about to happen. Lucky for them, they'll never have to be disappointed.",1,If you want to be bored... Still don't watch this!,1398729600,"04 29, 2014",2014,1345,"['love', 'Jim', 'Carrey', 'have', 'seen', 'everything', 'been', 'Even', 'minor', 'supporting', 'roles', 'Peggy', 'Sue', 'Got', 'Married', 'Dead', 'Pool', 'had', 'high', 'hopes', 'movie.I', 'then', 'watched', 'movie', 'have', 'never', 'felt', 'such', 'terrible', 'regret', 'movie', '47', 'hours', 'long', 'are', 'two', 'guys', 'do', 'essentially', 'nothing', 'mean', 'get', 'trouble', 'stuff', 'nothing', 'really', 'plot', 'as', 'much', 'sun', 'polar', 'ice', 'cap.The', 'acting', 'great', 'like', 'watching', 'guys', 'act', 'are', ""n't"", 'doing', 'anything', 'sets', 'script-writing', 'effects', 'are', 'great', 'too', 'completely', 'immerse', 'world', 'where', 'nothing', 'interested', 'ever', 'really', 'happens.I', 'do', ""n't"", 'know', 'maybe', 'wanted', 'ride', 'coattails', 'Brokeback', 'Mountain', 'making', 'drama', 'gay', 'couple', 'what', 'agenda', 'might', 'have', 'been', 'film', 'while', 'forgot', 'couple', 'were', 'gay', 'brain', 'was', 'so', 'bored', 'shut', 'down', 'could', 'think', 'were', 'words', '34', 'now', 'safe', 'turn', 'off', 'computer.', '34', 'So', 'only', 'recommend', 'way', 'torture', 'prisoners', 'war', 'possible', 'present', 'someone', 'severe', 'Alzheimer', 'will', 'forget', 'everything', 'few', 'minutes', 'keep', 'thinking', 'something', 'funny', 'happen', 'Lucky', ""'ll"", 'never', 'have', 'be', 'disappointed']",N/A
1304749,A3T66AZP34RK7L,B002ZG9800,"Dennis Hinkamp ""offcenter""","[5, 6]","You would think that just by looking at the movie poster and the title, people could figure out the characters are gay...most of the really low ratings seem to come from those who were surprised. If this bothers you, you probably should stay away. Similar to ""The Kids are Alright"" the characters just happen to be gay, it's not all that integral to the plot.I admire Carey for taking on roles like this since he could have made more money just playing Ace Ventura for the rest of his life. McGregor is sort of wasted in this movie; he doesn't do much other than provide motivation for Carey's character. The fun part of the movie is watching him go from cop to con man; not being very successful at either career.",4,They just happen to be gay,1302134400,"04 7, 2011",2011,714,"['would', 'think', 'just', 'looking', 'movie', 'poster', 'title', 'people', 'could', 'figure', 'out', 'characters', 'are', 'gay', 'most', 'really', 'low', 'ratings', 'seem', 'come', 'who', 'were', 'surprised', 'bothers', 'probably', 'should', 'stay', 'away', 'Similar', 'Kids', 'are', 'Alright', 'characters', 'just', 'happen', 'be', 'gay', 'not', 'integral', 'plot.I', 'admire', 'Carey', 'taking', 'roles', 'could', 'have', 'made', 'more', 'money', 'just', 'playing', 'Ace', 'Ventura', 'rest', 'life', 'McGregor', 'sort', 'wasted', 'movie', ""n't"", 'do', 'much', 'other', 'provide', 'motivation', 'Carey', 'character', 'fun', 'part', 'movie', 'watching', 'go', 'cop', 'con', 'man', 'not', 'being', 'very', 'successful', 'career']",N/A
1304750,AU32ZJ0LGMBSA,B002ZG9800,"dgdbear ""David""","[2, 2]","When a serious car accident shakes him out of the complacency of his ""normal"" life, Steven Russell steps out ofthe closet and into a brand new life of lavishness and good-natured con-artistry. During one of his inevitable stintsin prison, Russell befriends and falls in love with Phillip Morris, a naive younger inmate with whom he wishes toshare the rest of his life. Although his con-man ways threaten to keep him and Morris apart, Russell will doeverything he can to make sure the law doesn't stand in the way of their love!Part comedy, part drama and part love-story, this gentle and amusing take on the real-life antics of Steven Russellwas both a wonderful surprise and a thoroughly enjoyable film. Solid performances by Carrey and McGregor.(More information on the real Steven Russell here:[...])PQ and AQ were very good.",4,Really Interesting Story,1309651200,"07 3, 2011",2011,828,"['When', 'serious', 'car', 'accident', 'complacency', 'normal', 'life', 'Steven', 'Russell', 'out', 'ofthe', 'closet', 'brand', 'new', 'life', 'lavishness', 'good-natured', 'con-artistry', 'one', 'inevitable', 'stintsin', 'prison', 'Russell', 'love', 'Phillip', 'Morris', 'naive', 'younger', 'inmate', 'whom', 'rest', 'life', 'con-man', 'ways', 'threaten', 'keep', 'Morris', 'apart', 'Russell', 'will', 'doeverything', 'can', 'make', 'sure', 'law', ""n't"", 'stand', 'way', 'love', 'Part', 'comedy', 'part', 'drama', 'part', 'love-story', 'gentle', 'amusing', 'take', 'real-life', 'antics', 'Steven', 'Russellwas', 'wonderful', 'surprise', 'thoroughly', 'enjoyable', 'film', 'Solid', 'performances', 'Carrey', 'McGregor', 'More', 'information', 'real', 'Steven', 'Russell', 'here', '[', ']', 'PQ', 'AQ', 'were', 'very', 'good']",N/A
1304751,A4PPZNQF1X2IY,B002ZG9800,"EugeSchu ""be-bop""","[1, 5]","i'm a big jim carey fan, but he's been in a rough patch.  this movie can't figure out what kind of vibe it's in and doesn't tell a good story.  good have been more successful in better hands, but doesn't hit the right notes, the chemistry is never there, and it's lost between a comedy, a drama, a doc... who knows.  Explicit where it should be implied and subtle where it should be graphic... a miss.",2,really a movie that doesn't know what it's about,1304985600,"05 10, 2011",2011,401,"['i', ""'m"", 'big', 'jim', 'carey', 'fan', 'been', 'rough', 'patch', 'movie', 'ca', ""n't"", 'figure', 'out', 'what', 'kind', 'vibe', ""n't"", 'tell', 'good', 'story', 'good', 'have', 'been', 'more', 'successful', 'better', 'hands', ""n't"", 'hit', 'right', 'notes', 'chemistry', 'never', 'there', 'lost', 'comedy', 'drama', 'doc', 'who', 'Explicit', 'where', 'should', 'be', 'implied', 'subtle', 'where', 'should', 'be', 'graphic', 'miss']",N/A
1304752,A1P5HWNCWNM6K3,B002ZG9800,Farrell,"[0, 2]","it was okay. very inappropriate. i'm a huge fan of jim carrey and ewan mcgregor, they were very funny but again inappropiate.",3,okay,1366588800,"04 22, 2013",2013,125,"['was', 'okay', 'very', 'inappropriate', 'i', ""'m"", 'huge', 'fan', 'jim', 'carrey', 'ewan', 'mcgregor', 'were', 'very', 'funny', 'again', 'inappropiate']",N/A
1304753,A3DMY9EK0ANVDI,B002ZG9800,Gerald Masan,"[0, 0]","Gay,straight or bi...there's plenty of the usual Carrey-style flambouyant turns combined with an underlying tone of darkness in this character-driven tale to please everyone.  From an ostensibly conventional married heterosexualrelationship, this clever con artist does an abrupt flip to a gay persona, but eventually pushes the envelope and winds up in the slammer for his fraudulent pursuits. There he encounters the winsome blond sweet-natured Phillip, fetchingly played by the superb Ewan McGregor, and the rest is a torrid love story played out in what might seem like an improbable locale......behind bars. There is plenty of classic Carrey over-the-top hilarity cleverly woven into this touching tale of twowould-be soulmates, one of whom never quite overcomes his deceitful nature. This sleeper is worth a reawakening!",4,Love Is Where You Find It.,1404345600,"07 3, 2014",2014,826,"['Gay', 'straight', 'bi', 'plenty', 'usual', 'Carrey-style', 'flambouyant', 'turns', 'combined', 'underlying', 'tone', 'darkness', 'character-driven', 'tale', 'please', 'everyone', 'ostensibly', 'conventional', 'married', 'heterosexualrelationship', 'clever', 'artist', 'abrupt', 'flip', 'gay', 'persona', 'eventually', 'envelope', 'up', 'slammer', 'fraudulent', 'pursuits', 'winsome', 'blond', 'sweet-natured', 'Phillip', 'fetchingly', 'played', 'superb', 'Ewan', 'McGregor', 'rest', 'torrid', 'love', 'story', 'played', 'out', 'what', 'might', 'seem', 'improbable', 'locale', 'bars', 'plenty', 'classic', 'Carrey', 'over-the-top', 'hilarity', 'cleverly', 'woven', 'touching', 'tale', 'twowould-be', 'soulmates', 'one', 'whom', 'never', 'quite', 'deceitful', 'nature', 'sleeper', 'reawakening']",N/A
1304754,A2YP45I4D63NAN,B002ZG9800,Giddy Giddy Carousel,"[10, 12]","Import Blu-Ray/Region A pressing. Hong Kong Pressing.I Love You Phillip Morris is the improbable but true story of a spectacularly charismatic conman's journey from small-town businessman to flamboyant white-collar criminal, who repeatedly finds himself in trouble with the law and on the lam, brilliantly escaping from the Texas prison system on four separate occasions--all in the name of love. Told with an uncanny sense of humor and a lot of heart, I Love You Phillip Morris is an oddball tale of what can happen when the legal system, a daredevil spirit and undying love collide. A lovesick prison inmate (Jim Carrey) goes to great lengths to reconnect with his old cellmate, Phillip Morris (Ewan McGregor), in this prison-breakout black comedy from first-time helmers Glenn Ficarra and John Requa, the screenwriters of Bad Santa. Leslie Mann co-stars in the Europacorp production.",5,Details,1284940800,"09 20, 2010",2010,886,"['Import', 'Blu-Ray/Region', 'A', 'pressing', 'Hong', 'Kong', 'Pressing.I', 'Love', 'Phillip', 'Morris', 'improbable', 'true', 'story', 'spectacularly', 'charismatic', 'conman', 'journey', 'small-town', 'businessman', 'flamboyant', 'white-collar', 'criminal', 'who', 'repeatedly', 'trouble', 'law', 'lam', 'brilliantly', 'escaping', 'Texas', 'prison', 'system', 'four', 'separate', 'occasions', 'name', 'love', 'Told', 'uncanny', 'sense', 'humor', 'lot', 'heart', 'Love', 'Phillip', 'Morris', 'oddball', 'tale', 'what', 'can', 'happen', 'when', 'legal', 'system', 'daredevil', 'spirit', 'undying', 'love', 'collide', 'lovesick', 'prison', 'inmate', 'Jim', 'Carrey', 'great', 'lengths', 'reconnect', 'old', 'cellmate', 'Phillip', 'Morris', 'Ewan', 'McGregor', 'prison-breakout', 'black', 'comedy', 'first-time', 'helmers', 'Glenn', 'Ficarra', 'John', 'Requa', 'screenwriters', 'Bad', 'Santa', 'Leslie', 'Mann', 'co-stars', 'Europacorp', 'production']",N/A
