,reviewerID,asin,reviewerName,helpful,reviewText,overall,summary,unixReviewTime,reviewTime,reviewYear,reviewLength,meaningfulWords,Title
1304780,A29T4QDORQAGQN,B002ZG9800,"Milo Dandee ""MilDan""","[3, 4]","Jim Carrey was always making over the top funny stories BUT this is entirely different, even for him. Yeah there were some scenes that werent so funny(dressing in lady shorts and ankle boots just to name one)but overall, I like it and it was worth the wait. Some people have hard time with it BUT I say this is better and Jim will always be better than Will Farrell or even Steve Carrell in every and each way possible! Kudos Man",5,EXCELLENT MOVIE...,1302307200,"04 9, 2011",2011,429,"['Jim', 'Carrey', 'was', 'always', 'making', 'top', 'funny', 'stories', 'BUT', 'entirely', 'different', 'even', 'were', 'scenes', 'werent', 'so', 'funny', 'dressing', 'lady', 'shorts', 'ankle', 'boots', 'just', 'name', 'one', 'overall', 'like', 'was', 'worth', 'wait', 'people', 'have', 'hard', 'time', 'BUT', 'say', 'better', 'Jim', 'will', 'always', 'be', 'better', 'Will', 'Farrell', 'even', 'Steve', 'Carrell', 'way', 'possible', 'Kudos', 'Man']",N/A
1304781,A31JRSZQ76YA1N,B002ZG9800,"Minnie and Henery Krumb ""yingtongyingtongyidd...","[0, 0]","A DELIGHTFULLY [?] DARING 'crime' caper type biopic with gasps of shocking and gut-punching laughter here and there ... there are a few 'fall out of your seat' moments.  ""Send the kiddies to bed Martha"" - there 'graphic' intimacy here and there.Jim Carrey is astounding as our sweet-faced hero who can absolutely con the pants off anything that moves - KNOWS his sexuality [although initially married with children] and finds his soul mate in prison [a bemused and muse like Golden Boy - Ewan McGregor - it's absolutely a heaven made love].  However, fate intervenes in the form of material temptation as 'our hero' takes anyone who comes his way for a ride .... and robs them blind with his dashing smile.  The tale does mess around with ones heat - and one's not quite sure just where this delightful train-castastrophe is heading ....... but there are a few silver-plated linings.Carrey's flawless technique [is it?] is a joy to watch and applaud - and he does bring great humanity to the anguished laddie who just cannot resist temptations along the way - but dearly loves his Phillip.  McGregor also gives us quite a turn as the love object - sweet, sincere and charming.  NOT the 'usual' hilarious 'stick' - this a a very real person on the screen - quite moving!Nods to Rodrigo Santoro - the first love ""Jimmy"" and Leslie Mann as the patient ex-wife who never condemns any of the mayhem!Costume Design [David C. Robinson], Art Direction - tech credits - all above average.An unusual entertainment - not quite for all - but well worth watching!  [Slightly ahead of its time perhaps?]",4,We love you Jim Carrey!!!,1400976000,"05 25, 2014",2014,1589,"['DELIGHTFULLY', '[', ']', 'DARING', ""'crime"", 'caper', 'type', 'biopic', 'gasps', 'shocking', 'gut-punching', 'laughter', 'here', 'there', 'are', 'few', ""'fall"", 'seat', 'moments', 'Send', 'kiddies', 'bed', 'Martha', ""'graphic"", 'intimacy', 'here', 'there.Jim', 'Carrey', 'astounding', 'sweet-faced', 'hero', 'who', 'can', 'absolutely', 'con', 'pants', 'off', 'anything', 'KNOWS', 'sexuality', '[', 'initially', 'married', 'children', ']', 'soul', 'mate', 'prison', '[', 'bemused', 'muse', 'Golden', 'Boy', 'Ewan', 'McGregor', 'absolutely', 'heaven', 'made', ']', 'However', 'fate', 'intervenes', 'form', 'material', 'temptation', ""'our"", 'hero', 'anyone', 'who', 'way', 'ride', 'robs', 'blind', 'dashing', 'smile', 'tale', 'mess', 'ones', 'heat', 'one', 'not', 'quite', 'sure', 'just', 'where', 'delightful', 'train-castastrophe', 'heading', 'are', 'few', 'silver-plated', 'linings.Carrey', 'flawless', 'technique', '[', 'joy', 'watch', 'applaud', 'bring', 'great', 'humanity', 'anguished', 'laddie', 'who', 'just', 'can', 'not', 'resist', 'temptations', 'way', 'dearly', 'Phillip', 'McGregor', 'also', 'quite', 'turn', 'love', 'object', 'sweet', 'sincere', 'charming', ""'usual"", 'hilarious', ""'stick"", 'very', 'real', 'person', 'screen', 'quite', 'moving', 'Nods', 'Rodrigo', 'Santoro', 'first', 'love', 'Jimmy', 'Leslie', 'Mann', 'patient', 'ex-wife', 'who', 'never', 'condemns', 'mayhem', 'Costume', 'Design', '[', 'David', 'C.', 'Robinson', ']', 'Art', 'Direction', 'tech', 'credits', 'average.An', 'unusual', 'entertainment', 'not', 'quite', 'well', 'worth', 'watching', '[', 'Slightly', 'ahead', 'time', 'perhaps', ']']",N/A
1304782,A1SJAGYF17UP3K,B002ZG9800,Morgan,"[0, 2]",Its stupid nothing is funny and it didn't have any point to it i barley finshed it and have to change it blahh,2,blahh:(,1365897600,"04 14, 2013",2013,110,"['stupid', 'nothing', 'funny', 'did', ""n't"", 'have', 'point', 'i', 'barley', 'finshed', 'have', 'change', 'blahh']",N/A
1304783,AQ0EO10KTRJ4V,B002ZG9800,"M. Spitzer ""mas017""","[4, 18]","This film was bad in every way.Not funny.Bizarre behaviour just for the heck of it ?Offensive if you are gay.Repulsive if you are straight.Ejected after 40 minutes with the thought ........ ""What was this supposed to be ?""Seems like it was just an exercise in seeing how weird they could make different scenes just to be weird.",1,Bad in every possible way,1316304000,"09 18, 2011",2011,327,"['film', 'was', 'bad', 'way.Not', 'funny.Bizarre', 'behaviour', 'just', 'heck', 'Offensive', 'are', 'gay.Repulsive', 'are', 'straight.Ejected', '40', 'minutes', 'thought', 'What', 'was', 'supposed', 'be', 'was', 'just', 'exercise', 'seeing', 'how', 'weird', 'could', 'make', 'different', 'scenes', 'just', 'be', 'weird']",N/A
1304784,A3DDPQ9342UNMY,B002ZG9800,"N. Doyle ""film buff""","[5, 6]","JIM CARREY ventures into new territory in this tragicomedy as a gay con man who uses his lawyer-sized brain to seize the moment and immerse himself in his homosexual side (he's married in a hetero relationship), to look for love while he's serving time in prison. He locks glances with EWAN McGREGOR and comes on pretty strong to the soft-spoken, naive Southern boy who's afraid to go into the prison yard because of his blond good looks.The story leaps forward with a lot of twists and turns as Carrey uses all of his escape artist techniques to con everyone he comes into contact with. But things get rough for the intimate relationship with McGregor when the naive and simple blond man rebels against the lavish life style Carrey buys for him with his fraudulent schemes.The acting is splendid from Carrey and McGregor, but the film doesn't get really touching until the last forty minutes when the amazing con artist takes drastic measures to keep McGregor at his side.Clearly, not a film for a wide public but it's a story that is not only involving, especially toward the end, but is based on an amazing true ""catch me if you can"" kind of story that has been given some artistic license for minor changes.McGregor gives a heartfelt performance as the embittered and broken lover who still cannot let go of someone who let him down with lies. His last few scenes are especially moving.Played for both tragedy and comedy, it's a mixture that doesn't always work but it's certainly not a complete misfire and deserves wider acceptance from open-minded viewers without hearts of stone.",4,"Daringly different tragicomedy based on a true ""catch me if you can"" kind of story...",1302307200,"04 9, 2011",2011,1587,"['JIM', 'CARREY', 'ventures', 'new', 'territory', 'tragicomedy', 'gay', 'con', 'man', 'who', 'lawyer-sized', 'brain', 'seize', 'moment', 'immerse', 'homosexual', 'side', 'married', 'hetero', 'relationship', 'look', 'love', 'serving', 'time', 'prison', 'glances', 'EWAN', 'McGREGOR', 'pretty', 'strong', 'soft-spoken', 'naive', 'Southern', 'boy', 'who', 'afraid', 'go', 'prison', 'yard', 'blond', 'good', 'looks.The', 'story', 'forward', 'lot', 'twists', 'as', 'Carrey', 'escape', 'artist', 'techniques', 'con', 'everyone', 'contact', 'things', 'get', 'rough', 'intimate', 'relationship', 'McGregor', 'when', 'naive', 'simple', 'blond', 'man', 'rebels', 'lavish', 'life', 'style', 'Carrey', 'fraudulent', 'schemes.The', 'acting', 'splendid', 'Carrey', 'McGregor', 'film', ""n't"", 'get', 'really', 'touching', 'last', 'forty', 'minutes', 'when', 'amazing', 'con', 'artist', 'drastic', 'measures', 'keep', 'McGregor', 'side.Clearly', 'not', 'film', 'wide', 'public', 'story', 'not', 'only', 'involving', 'especially', 'end', 'based', 'amazing', 'true', 'catch', 'can', 'kind', 'story', 'been', 'given', 'artistic', 'license', 'minor', 'changes.McGregor', 'heartfelt', 'performance', 'embittered', 'broken', 'lover', 'who', 'still', 'can', 'not', 'let', 'go', 'someone', 'who', 'let', 'down', 'lies', 'last', 'few', 'scenes', 'are', 'especially', 'moving.Played', 'tragedy', 'comedy', 'mixture', ""n't"", 'always', 'work', 'certainly', 'not', 'complete', 'misfire', 'wider', 'acceptance', 'open-minded', 'viewers', 'hearts', 'stone']",N/A
1304785,A2BNSD19Y3W94V,B002ZG9800,Nev Okyay,"[0, 6]","When I read the title of this movie, I thought it was a movie about a cigarette company, along the lines of 'Thank you for smoking'.  Reading the description on the outside did not tell me much about the contents of the movie.This movie is about a love story, between two men.  Also it is about the escapes of a con man from a prison so many times, and the life in prison.  In most other movies about prisons, the gay people or new guys to the prison are beaten or raped, but this movie is different and seems like they are accommodated nicely.I liked the story line, and the various adventures that they go through.  But the gay love scenes were a turn-off for me. It is not the type of movie you would want to watch with your girlfriend, unless of course you are a girl.  :)",2,Interesting Story,1311724800,"07 27, 2011",2011,776,"['When', 'read', 'title', 'movie', 'thought', 'was', 'movie', 'cigarette', 'company', 'lines', ""'Thank"", 'smoking', 'Reading', 'description', 'outside', 'did', 'not', 'tell', 'much', 'contents', 'movie.This', 'movie', 'love', 'story', 'two', 'men', 'Also', 'escapes', 'con', 'man', 'prison', 'so', 'many', 'times', 'life', 'prison', 'most', 'other', 'movies', 'prisons', 'gay', 'people', 'new', 'guys', 'prison', 'are', 'beaten', 'raped', 'movie', 'different', 'are', 'accommodated', 'nicely.I', 'liked', 'story', 'line', 'various', 'adventures', 'go', 'gay', 'love', 'scenes', 'were', 'turn-off', 'not', 'type', 'movie', 'would', 'want', 'watch', 'girlfriend', 'course', 'are', 'girl']",N/A
1304786,A331S5N5PNSOV0,B002ZG9800,"N. Pawar ""thestoneman""","[1, 4]","3.5 stars.  I picked this movie up without reading the description which is a common mistake I make when I'm in a hurry.  Anyway this is a ""based on a true story"" about a conman who enjoys the ""company"" of men.  More or less it's a ""finding himself"" drama/comedy this particular guy (Jim Carrey's character) found himself in jail for a long time despite breaking out multiple times.  No happy ending there.  Dude should've took off for tijuana and never looked back.",3,Not my cup of tea but still entertaining,1302307200,"04 9, 2011",2011,466,"['3.5', 'stars', 'picked', 'movie', 'up', 'reading', 'description', 'common', 'mistake', 'make', 'when', ""'m"", 'hurry', 'Anyway', 'based', 'true', 'story', 'conman', 'who', 'company', 'men', 'More', 'less', 'finding', 'drama/comedy', 'particular', 'guy', 'Jim', 'Carrey', 'character', 'found', 'jail', 'long', 'time', 'breaking', 'out', 'multiple', 'times', 'happy', 'ending', 'there', 'Dude', 'should', ""'ve"", 'took', 'off', 'tijuana', 'never', 'looked', 'back']",N/A
1304787,A3V61K0EF38GP4,B002ZG9800,Philip Scholz,"[0, 0]","This film, apparently finansed by a French company (it's said to be a French film and everyone speaks English...I can't make the connection any other way) really deserved a wider release in North America.  I'm normally hesitant to see anything involving Jim Carrey because he basically just plays himself in different clothes every time.  This movie was thankfully a change of pace.  Though you could still tell it was Jim Carrey playing the lead as he is cursed with a very recognizable voice, he is making a genuine effort to not just be himself.  I'd say that the normal rate of his jokes as compared to his other films is cut by 88%...they're still there but they don't dominate and they're relatively appropriate when they do pop up.  Nothing in this film was overdone...if it seemed that way at times, that's because those events actually happened.  Ewan McGregor complimented Mr. Carrey as his jailhouse lover, Phillip Morris.  While some of their dialogue was clearly scripted, especially when they first met, both men soon got into it and things felt much more natural.  If you know anything about the man this film is based on, con artist Steven Jay Russell, the only thing you ought to really be wondering before watching this film is ""which parts of his life are they gonna use?""  There was just no need to embellish details.  The only reason I don't give it that coveted five stars is because you could still clearly tell it was Jim Carrey leading this cast...also because Leslie Mann didn't get more screen time.  Otherwise, this was a very enjoyable film that didn't find itself turning to the cliches of any movie genre but instead just told the story.  I'd reccomend it to anyone.  Enjoy.",4,Should Have Had A Wider Release,1391990400,"02 10, 2014",2014,1705,"['film', 'apparently', 'finansed', 'French', 'company', 'said', 'be', 'French', 'film', 'everyone', 'speaks', 'English', 'ca', ""n't"", 'make', 'connection', 'other', 'way', 'really', 'deserved', 'wider', 'release', 'North', 'America', ""'m"", 'normally', 'hesitant', 'see', 'anything', 'involving', 'Jim', 'Carrey', 'basically', 'just', 'different', 'clothes', 'time', 'movie', 'was', 'thankfully', 'change', 'pace', 'could', 'still', 'tell', 'was', 'Jim', 'Carrey', 'playing', 'lead', 'cursed', 'very', 'recognizable', 'voice', 'making', 'genuine', 'effort', 'not', 'just', 'be', ""'d"", 'say', 'normal', 'rate', 'jokes', 'compared', 'other', 'films', 'cut', '88', '%', ""'re"", 'still', 'there', 'do', ""n't"", 'dominate', ""'re"", 'relatively', 'appropriate', 'when', 'do', 'pop', 'up', 'Nothing', 'film', 'was', 'overdone', 'seemed', 'way', 'times', 'events', 'actually', 'happened', 'Ewan', 'McGregor', 'complimented', 'Mr.', 'Carrey', 'jailhouse', 'lover', 'Phillip', 'Morris', 'dialogue', 'was', 'clearly', 'scripted', 'especially', 'when', 'first', 'met', 'men', 'soon', 'got', 'things', 'felt', 'much', 'more', 'natural', 'know', 'anything', 'man', 'film', 'based', 'con', 'artist', 'Steven', 'Jay', 'Russell', 'only', 'thing', 'ought', 'really', 'be', 'wondering', 'watching', 'film', 'parts', 'life', 'are', 'gon', 'use', 'was', 'just', 'no', 'need', 'embellish', 'details', 'only', 'reason', 'do', ""n't"", 'give', 'coveted', 'five', 'stars', 'could', 'still', 'clearly', 'tell', 'was', 'Jim', 'Carrey', 'leading', 'cast', 'also', 'Leslie', 'Mann', 'did', ""n't"", 'get', 'more', 'screen', 'time', 'Otherwise', 'was', 'very', 'enjoyable', 'film', 'did', ""n't"", 'find', 'turning', 'cliches', 'movie', 'genre', 'instead', 'just', 'told', 'story', ""'d"", 'reccomend', 'anyone', 'Enjoy']",N/A
1304788,A2F8K58ETMWRTJ,B002ZG9800,"PJ ""PJ""","[0, 0]",I really enjoyed this movie.  Different from any other movie I've seen and with a smattering of funny bits thrown in.  Carrey and MacGregor were good.,5,Cute movie,1363564800,"03 18, 2013",2013,150,"['really', 'enjoyed', 'movie', 'Different', 'other', 'movie', ""'ve"", 'seen', 'smattering', 'funny', 'bits', 'thrown', 'Carrey', 'MacGregor', 'were', 'good']",N/A
1304789,AIFZ0OK68B1YN,B002ZG9800,Pooh Bear,"[8, 9]","I absolutely don't know why the hang-up in getting this fantastic film onto the American screen and onto DVD.  I have been waiting and waiting and each time it gets held up back in the courts system.  I was able to get it through Amazon.com through one of its sellers and I was definitely NOT disappointed.  Jim Carrey deserves an Oscar for his performance, and Ewan McGregor, well, simply amazing!  I hope everyone here in the USA can have a chance to see this wonderful and tastefully done film.  I was totally blown away!",5,UNBELIEVABLE MOVIE!!!!!,1291075200,"11 30, 2010",2010,524,"['absolutely', 'do', ""n't"", 'know', 'why', 'hang-up', 'getting', 'fantastic', 'film', 'American', 'screen', 'DVD', 'have', 'been', 'waiting', 'waiting', 'time', 'held', 'up', 'back', 'courts', 'system', 'was', 'able', 'get', 'Amazon.com', 'one', 'sellers', 'was', 'definitely', 'NOT', 'disappointed', 'Jim', 'Carrey', 'Oscar', 'performance', 'Ewan', 'McGregor', 'well', 'simply', 'amazing', 'hope', 'everyone', 'here', 'USA', 'can', 'have', 'chance', 'see', 'wonderful', 'tastefully', 'done', 'film', 'was', 'totally', 'blown', 'away']",N/A
1304790,AX148M3X6EUGN,B002ZG9800,"pumpkin ""booklver""","[1, 2]",JIM CAREY PLAYS SUCH A GREAT GAY MAN! THIS WAS A FUN MOVIE! THE STORY LINE IS SO ORIGINAL AND UNBELIEVEABLE ITS CRAZY THAT IT ACTUALLY HAPPENED! I ACTUALLY FEEL SORRY FOR THE GUY EVENTHOUGH HE WAS A CROOK. THIS IS A MUST SEE!,5,GREAT FILM!,1302220800,"04 8, 2011",2011,225,"['JIM', 'CAREY', 'PLAYS', 'SUCH', 'A', 'GREAT', 'GAY', 'MAN', 'THIS', 'WAS', 'FUN', 'MOVIE', 'THE', 'STORY', 'LINE', 'IS', 'SO', 'ORIGINAL', 'AND', 'UNBELIEVEABLE', 'ITS', 'CRAZY', 'IT', 'ACTUALLY', 'HAPPENED', 'ACTUALLY', 'FEEL', 'SORRY', 'THE', 'GUY', 'EVENTHOUGH', 'HE', 'WAS', 'CROOK', 'THIS', 'MUST', 'SEE']",N/A
1304791,A1TOXCG4QWQLHA,B002ZG9800,"Ranjan Chari ""Ranjan Chari""","[12, 14]","Jim Carrey was the singular reason I watched this film. The problem with this movie is that its not really a comedy, its not really a con-artist movie, its not really about gay relationships. It does all of these 3 things in somewhat equal measure and then loses out overall. I liked bits and pieces of it but too many times lost interest and was left with the feeling that if the director had focused on making a good con-artist movie, Jim Carrey could have turned it into something spectacular.",3,Sporadically funny but if only I knew what to make of it.,1309824000,"07 5, 2011",2011,496,"['Jim', 'Carrey', 'was', 'singular', 'reason', 'watched', 'film', 'problem', 'movie', 'not', 'really', 'comedy', 'not', 'really', 'con-artist', 'movie', 'not', 'really', 'gay', 'relationships', '3', 'things', 'somewhat', 'equal', 'measure', 'then', 'out', 'overall', 'liked', 'bits', 'pieces', 'too', 'many', 'times', 'lost', 'interest', 'was', 'left', 'feeling', 'director', 'had', 'focused', 'making', 'good', 'con-artist', 'movie', 'Jim', 'Carrey', 'could', 'have', 'turned', 'something', 'spectacular']",N/A
1304792,A12X2J7AVZ04IQ,B002ZG9800,"R. Gawlitta ""Coolmoan""","[5, 5]","A Jim Carrey film generallly screams goofy comedy. In this case, we have goofy behavior in a ""dramedy"", based on a true story. The outrageous events are reminiscent of ""Catch Me If You Can"", but the bottom line is it's a love story. It just happens to involve gay persons. After reading some reviews, I decided to get in my own 5-stars. Carrey really centers this complex character with terrific sensitivity, as well as his requsite smarm and charm. He is the perfect choice to play this most charismatic character.  It's actually sweet natured, and, regarding the love story aspect, quite profound. Ewan McGregor looked pretty, but it wasn't too much of a stretch for him. He's always reliable. There was very little reference to gay activity, rather a simple desire of 2 people who want to be together. DVD extras are fine; there's an AIDS sub-plot that was left out, only referenced at the end. The ""Sull'aria"" from The Marriage of Figaro, so well used in ""The Shawshank Redemption"", figures in, I think, as a tribute to good prison films.This is not a prison film; it's a love story. Pure and simple. The fact that it's based on fact made it quite intriguing, at least to me.",5,Not just for laffs...,1310169600,"07 9, 2011",2011,1179,"['Jim', 'Carrey', 'film', 'generallly', 'screams', 'goofy', 'comedy', 'case', 'have', 'goofy', 'behavior', 'dramedy', 'based', 'true', 'story', 'outrageous', 'events', 'are', 'reminiscent', 'Catch', 'Me', 'Can', 'bottom', 'line', 'love', 'story', 'just', 'involve', 'gay', 'persons', 'reading', 'reviews', 'decided', 'get', 'own', '5-stars', 'Carrey', 'really', 'complex', 'character', 'terrific', 'sensitivity', 'as', 'well', 'requsite', 'smarm', 'charm', 'perfect', 'choice', 'play', 'most', 'charismatic', 'character', 'actually', 'sweet', 'natured', 'regarding', 'love', 'story', 'aspect', 'quite', 'profound', 'Ewan', 'McGregor', 'looked', 'pretty', 'was', ""n't"", 'too', 'much', 'stretch', 'always', 'reliable', 'was', 'very', 'little', 'reference', 'gay', 'activity', 'rather', 'simple', 'desire', '2', 'people', 'who', 'want', 'be', 'together', 'DVD', 'extras', 'are', 'fine', 'AIDS', 'sub-plot', 'was', 'left', 'out', 'only', 'referenced', 'end', ""Sull'aria"", 'Marriage', 'Figaro', 'so', 'well', 'used', 'Shawshank', 'Redemption', 'figures', 'think', 'tribute', 'good', 'prison', 'films.This', 'not', 'prison', 'film', 'love', 'story', 'Pure', 'simple', 'fact', 'based', 'fact', 'made', 'quite', 'intriguing', 'least']",N/A
