,reviewerID,asin,reviewerName,helpful,reviewText,overall,summary,unixReviewTime,reviewTime,reviewYear,reviewLength,meaningfulWords,Title
1304765,A18P0T2NZTGWYX,B002ZG9800,J. Martin,"[4, 15]","I don't enjoy watching straight movie stars having a self-indulgent ball playing gay characters. There's no way to watch this movie without seeing Jim Carrey overacting as he always does (except in Eternal Sunshine, when he had a director who kept him on a very short leash and made him act instead of acting up), but this time overacting a gay role instead of a straight role.There's no Steven Russell in this movie, just Jim Carrey being Jim Carrey but getting to say ""fa9got"" as much as he wants to. I hate it. I assume it's mainly straight people who like this movie; I can't imagine a gay person enjoying seeing an obnoxious goofball clown play an obnoxious goofball clown with ""gay"" written across his forehead. It's insulting and irritating. As a Southerner, I find his phony, erratic Southern accent insulting and irritating too.I wish this overpaid jerk would move back to Canada and raise pigs out in the sticks by himself where he belongs. Ewan McGregor is a little better, because he's Ewan McGregor and not Jim Carrey, but not enough better to make this insulting, self-indulgent star vehicle watchable.",1,"Insulting, self-indulgent, obnoxious - in other words: typical Jim Carrey",1343088000,"07 24, 2012",2012,1116,"['do', ""n't"", 'enjoy', 'watching', 'straight', 'movie', 'stars', 'having', 'self-indulgent', 'ball', 'playing', 'gay', 'characters', 'way', 'watch', 'movie', 'seeing', 'Jim', 'Carrey', 'overacting', 'always', 'Eternal', 'Sunshine', 'when', 'had', 'director', 'who', 'kept', 'very', 'short', 'leash', 'made', 'act', 'instead', 'acting', 'up', 'time', 'overacting', 'gay', 'role', 'instead', 'straight', 'role.There', 'Steven', 'Russell', 'movie', 'just', 'Jim', 'Carrey', 'being', 'Jim', 'Carrey', 'getting', 'say', 'fa9got', 'as', 'much', 'hate', 'assume', 'mainly', 'straight', 'people', 'who', 'movie', 'ca', ""n't"", 'imagine', 'gay', 'person', 'enjoying', 'seeing', 'obnoxious', 'goofball', 'clown', 'play', 'obnoxious', 'goofball', 'clown', 'gay', 'written', 'forehead', 'insulting', 'irritating', 'Southerner', 'find', 'phony', 'erratic', 'Southern', 'accent', 'insulting', 'irritating', 'too.I', 'wish', 'overpaid', 'jerk', 'would', 'move', 'back', 'Canada', 'raise', 'pigs', 'out', 'sticks', 'where', 'Ewan', 'McGregor', 'little', 'better', 'Ewan', 'McGregor', 'not', 'Jim', 'Carrey', 'not', 'enough', 'better', 'make', 'insulting', 'self-indulgent', 'star', 'vehicle', 'watchable']",N/A
1304766,A23NOI7WB9AKGJ,B002ZG9800,Joe,"[0, 0]","Jim Carrey was good. It had me cyring until the twist at the end. This was a crazy, mixed up movie.",4,I Love You Phillip Morris- Entertaining!,1359849600,"02 3, 2013",2013,99,"['Jim', 'Carrey', 'was', 'good', 'had', 'cyring', 'twist', 'end', 'was', 'crazy', 'mixed', 'up', 'movie']",N/A
1304767,A1NI0VOVXZBM7Y,B002ZG9800,"Jose Lopez ""Jose Lopez""","[2, 17]","I am a huge Jim Carrey Fan,but sometimes he comes out with Flops and some disturbing stuff,The Part I like is with The Vette'. but then to see it Trashed?No.The subject matter is gross,repulsing and disturbing.One of those weird-let's make a statement about society movies that I would pass on.",1,Disturbing and not worth watching even for Free on NetfixInstant.,1331337600,"03 10, 2012",2012,294,"['am', 'huge', 'Jim', 'Carrey', 'Fan', 'sometimes', 'out', 'Flops', 'disturbing', 'stuff', 'Part', 'like', 'Vette', 'then', 'see', 'Trashed', 'No.The', 'subject', 'matter', 'gross', 'repulsing', 'disturbing.One', 'weird-let', 'make', 'statement', 'society', 'movies', 'would', 'pass']",N/A
1304768,A34D06JL7LC6MU,B002ZG9800,"Joshua Miller ""Josh""","[4, 5]","I Love You, Phillip Morris is the directorial debut of screenwriters John Requa and Glenn Ficarra, who are best known for penning the screenplay to Bad Santa. This film is based on a true story and a book by Steve McVicker that details the exploits of conman Steven Jay Russell. This film is a great example of the idea that truth is stranger than fiction, as many of Steven's cons are outlandish and seemingly exaggerated. Some have rejected the film due to the implausibility of it. If the events here were fictional, it would work against the film. The film opens with ""This really happened...It really did"" and despite how over-the-top and unbelievable much of the film seems, it sticks remarkably close to the facts and makes the proceedings even more fascinating.Jim Carrey plays Steven Jay Russell, who finds out at a young age that he's adopted. Steven goes on to become a small-town police officer with a wife (Leslie Mann) and a young daughter. Quitting the force and moving from Georgia to Texas, Steven decides to come out as gay after a car accident and leaves his wife to move to Florida and live his life the way he wants. Not long after, Steven ends up in prison where he meets Phillip Morris (Ewan McGregor) and falls in love. I don't want to reveal any more of the plot, because it unfolds in some surprising and hysterical ways.The screenplay by Requa and Ficarra is terrific, finding a perfect balance of exaggerated humor and genuine emotion. The love story between Steven and Phillip is handled remarkably well for this type of film and is actually rather poignant despite being played for laughs. The two also show skill as directors of both comedy and drama. The film is funny, but it has well-played and effective dramatic elements that never get too heavy. Finding the right tone to tell a complicated story like this isn't easy, but they found exactly how to do it and have succeeded admirably. Nick Urata's simple, but memorable score compliments the tone of the film perfectly. Furthermore, even when dealing with the absurdity of everything they bring a remarkable truthfulness to the story. Steven's wife Debbie is shown to be a sweet, but extremely religious woman, yet they never allow her to become a caricature and show her to be supportive of Steven even after he reveals his sexual orientation to her.I Love You, Phillip Morris is not a typical laugh-a-minute Carrey film, but good comedy is not about how much you laugh but about achieving a particular comedic tone, maintaining it, and seeing it through successfully. I assure you that this film does that quite well. It's one of Carrey's best films and, while it's not immediately apparent, it's one of Carrey's most intricate and eclectic performances in how it achieves a perfect balance of over-the-top comedic energy and grounded pathos. McGregor plays Phillip in a way that makes no secret of his homosexuality due to the voice and mannerisms, yet he's not playing a gay stereotype. It's a sensitive, believable performance that is also intensely likable. Quite simply, the two leads give much better performances than necessary for this type of film.There's an unsung hero in this film that I've noticed is largely unmentioned by reviewers of this film and that is Cleavon, played by newcomer Michael Mandel. I found Cleavon, a black inmate whose ""word is his [expletive] bond,"" to be one of the funniest people in the film. He doesn't have a large role and his funniest scene with his funniest lines occurs offscreen. Despite this, he had me in stitches. I want to see this guy pop up in more films. I Love You, Phillip Morris was delayed endlessly before finally receiving a very limited release. Does it tackle subject matter typical of what's played in mainstream theatres? No, but considering it's so much better, in so many ways, from many blockbuster Hollywood comedies that are simple cash-ins, it's a travesty this film wasn't given the chance for a wider audience.GRADE: A-",5,"A Terrific, Entertaining Comedy",1303948800,"04 28, 2011",2011,3979,"['Love', 'Phillip', 'Morris', 'directorial', 'debut', 'screenwriters', 'John', 'Requa', 'Glenn', 'Ficarra', 'who', 'are', 'best', 'known', 'penning', 'screenplay', 'Bad', 'Santa', 'film', 'based', 'true', 'story', 'book', 'Steve', 'McVicker', 'details', 'exploits', 'conman', 'Steven', 'Jay', 'Russell', 'film', 'great', 'example', 'idea', 'truth', 'stranger', 'fiction', 'many', 'Steven', 'cons', 'are', 'outlandish', 'seemingly', 'exaggerated', 'have', 'rejected', 'film', 'due', 'implausibility', 'events', 'here', 'were', 'fictional', 'would', 'work', 'film', 'film', 'really', 'happened', 'really', 'did', 'how', 'over-the-top', 'unbelievable', 'much', 'film', 'remarkably', 'close', 'facts', 'proceedings', 'even', 'more', 'fascinating.Jim', 'Carrey', 'plays', 'Steven', 'Jay', 'Russell', 'who', 'out', 'young', 'age', 'adopted', 'Steven', 'become', 'small-town', 'police', 'officer', 'wife', 'Leslie', 'Mann', 'young', 'daughter', 'Quitting', 'force', 'moving', 'Georgia', 'Texas', 'Steven', 'come', 'out', 'gay', 'car', 'accident', 'wife', 'move', 'Florida', 'live', 'life', 'way', 'Not', 'long', 'Steven', 'up', 'prison', 'where', 'Phillip', 'Morris', 'Ewan', 'McGregor', 'love', 'do', ""n't"", 'want', 'reveal', 'more', 'plot', 'surprising', 'hysterical', 'ways.The', 'screenplay', 'Requa', 'Ficarra', 'terrific', 'finding', 'perfect', 'balance', 'exaggerated', 'humor', 'genuine', 'emotion', 'love', 'story', 'Steven', 'Phillip', 'handled', 'remarkably', 'well', 'type', 'film', 'actually', 'rather', 'poignant', 'being', 'played', 'laughs', 'two', 'also', 'show', 'skill', 'directors', 'comedy', 'drama', 'film', 'funny', 'well-played', 'effective', 'dramatic', 'elements', 'never', 'get', 'too', 'heavy', 'Finding', 'right', 'tone', 'tell', 'complicated', 'story', ""n't"", 'easy', 'found', 'exactly', 'how', 'do', 'have', 'succeeded', 'admirably', 'Nick', 'Urata', 'simple', 'memorable', 'score', 'compliments', 'tone', 'film', 'perfectly', 'Furthermore', 'even', 'when', 'dealing', 'absurdity', 'everything', 'bring', 'remarkable', 'truthfulness', 'story', 'Steven', 'wife', 'Debbie', 'shown', 'be', 'sweet', 'extremely', 'religious', 'woman', 'yet', 'never', 'allow', 'become', 'caricature', 'show', 'be', 'supportive', 'Steven', 'even', 'sexual', 'orientation', 'her.I', 'Love', 'Phillip', 'Morris', 'not', 'typical', 'laugh-a-minute', 'Carrey', 'film', 'good', 'comedy', 'not', 'how', 'much', 'achieving', 'particular', 'comedic', 'tone', 'maintaining', 'seeing', 'successfully', 'assure', 'film', 'quite', 'well', 'one', 'Carrey', 'best', 'films', 'not', 'immediately', 'apparent', 'one', 'Carrey', 'most', 'intricate', 'eclectic', 'performances', 'how', 'perfect', 'balance', 'over-the-top', 'comedic', 'energy', 'grounded', 'pathos', 'McGregor', 'Phillip', 'way', 'secret', 'homosexuality', 'due', 'voice', 'mannerisms', 'not', 'playing', 'gay', 'stereotype', 'sensitive', 'believable', 'performance', 'also', 'intensely', 'likable', 'Quite', 'simply', 'two', 'leads', 'give', 'much', 'better', 'performances', 'necessary', 'type', 'film.There', 'unsung', 'hero', 'film', ""'ve"", 'noticed', 'largely', 'unmentioned', 'reviewers', 'film', 'Cleavon', 'played', 'newcomer', 'Michael', 'Mandel', 'found', 'Cleavon', 'black', 'inmate', 'word', '[', 'expletive', ']', 'bond', 'be', 'one', 'funniest', 'people', 'film', ""n't"", 'have', 'large', 'role', 'funniest', 'scene', 'funniest', 'lines', 'offscreen', 'had', 'stitches', 'want', 'see', 'guy', 'up', 'more', 'films', 'Love', 'Phillip', 'Morris', 'was', 'delayed', 'endlessly', 'finally', 'receiving', 'very', 'limited', 'release', 'tackle', 'subject', 'matter', 'typical', 'what', 'played', 'mainstream', 'theatres', 'No', 'considering', 'so', 'much', 'better', 'so', 'many', 'ways', 'many', 'blockbuster', 'Hollywood', 'comedies', 'are', 'simple', 'cash-ins', 'travesty', 'film', 'was', ""n't"", 'given', 'chance', 'wider', 'audience.GRADE', 'A-']",N/A
1304769,AEL6AD2AL2UX8,B002ZG9800,"Kevin ""Revolution""","[5, 5]","I was hesitant to watching this because I thought it would be lame.  I was pleasantly surprised to find it very entertaining.  It was much more complex than I thought it would be.  Yeah, yeah it's got two men in it who love each other, but its a lot more than that.  It's funny.  It's witty and wise.  The acting is fantastic.  As long as you're comfortable with your sexuality enough to get past the two men having sexual and romantic relations then give this a shot.  I'm sure you'll find it to be well done.  It's a great love story about what a con man and the guy he loves.",5,A con man attempting to find out who he really is,1312156800,"08 1, 2011",2011,578,"['was', 'hesitant', 'watching', 'thought', 'would', 'be', 'lame', 'was', 'pleasantly', 'surprised', 'find', 'very', 'entertaining', 'was', 'much', 'more', 'complex', 'thought', 'would', 'be', 'Yeah', 'got', 'two', 'men', 'who', 'love', 'other', 'lot', 'more', 'funny', 'witty', 'wise', 'acting', 'fantastic', 'As', 'long', ""'re"", 'comfortable', 'sexuality', 'enough', 'get', 'two', 'men', 'having', 'sexual', 'romantic', 'relations', 'then', 'give', 'shot', ""'m"", 'sure', ""'ll"", 'find', 'be', 'well', 'done', 'great', 'love', 'story', 'what', 'con', 'man', 'guy']",N/A
1304770,A3IXN7GF26GN9N,B002ZG9800,KM,"[0, 0]","I saw the previews and I have yet to watch it, but the previews look great. Full gay funny movie.",4,HaHa funny gay movie,1403395200,"06 22, 2014",2014,97,"['saw', 'previews', 'have', 'yet', 'watch', 'previews', 'look', 'great', 'Full', 'gay', 'funny', 'movie']",N/A
1304771,A2ATH9N4MGL1JJ,B002ZG9800,L. A. Reynolds,"[0, 0]",I wouldn't have purchased this if I didn't already love it. Cannot stand Jim Carrey but put up with him because the story is so wonderful. I saw it when it came out and first went to DVD. Now that I see it again I see that it is one of those horrible TEAL and ORANGE  movies that they're making now - it's disgusting color manipulation that ruins a good film - and it ruined it for me too. That's why the three stars...other wise it would be five.,3,Love this Movie!,1382227200,"10 20, 2013",2013,447,"['would', ""n't"", 'have', 'purchased', 'did', ""n't"", 'already', 'love', 'Can', 'not', 'stand', 'Jim', 'Carrey', 'put', 'up', 'story', 'so', 'wonderful', 'saw', 'when', 'came', 'out', 'first', 'went', 'DVD', 'Now', 'see', 'again', 'see', 'one', 'horrible', 'TEAL', 'ORANGE', 'movies', ""'re"", 'making', 'now', 'disgusting', 'color', 'manipulation', 'good', 'film', 'ruined', 'too', 'why', 'three', 'stars', 'other', 'wise', 'would', 'be', 'five']",N/A
1304772,A18HHKM6WGEF9D,B002ZG9800,"L. Erickson ""Mommy Mystic""","[1, 1]","Although I enjoyed some scenes in this movie, and felt Jim Carrey and Ewan McGregor turned in good performances and did some interesting things with their characters, overall I didn't think it worked. I think the problem is that it could not decide what it wanted to be. It started out like a fairly typical off-the-wall Jim Carrey comedy, but in other movies that works because his character is generally likeable, and we side with him. In this film, as his swindles and lies get bigger and bigger, I found it harder and harder to like his character, or to find the humor in it. Plus prison, deception, AIDS, and homosexuality are not easy comedic material anyway. And I think this story got hampered by the fact it was based on a true story. I read some reviews that compared the quirky tone of this to Coen brothers films, but those are generally fiction as far as I know, so they don't have the hindrance of trying to follow the basic outlines of a true story.On the other hand, it is amazing that so many of the prison escapes and cons in this movie actually did occur (google fact vs fiction on I Love Phillip Morris for details.) But while that adds interest, it doesn't actually change the experience of watching the movie. Overall, a solid 3 stars for me - some funny moments and good performances, but the film as a whole didn't come together.",3,Film Couldn't Decide What It Was,1307318400,"06 6, 2011",2011,1353,"['enjoyed', 'scenes', 'movie', 'felt', 'Jim', 'Carrey', 'Ewan', 'McGregor', 'turned', 'good', 'performances', 'did', 'interesting', 'things', 'characters', 'overall', 'did', ""n't"", 'think', 'worked', 'think', 'problem', 'could', 'not', 'decide', 'what', 'wanted', 'be', 'started', 'out', 'fairly', 'typical', 'off-the-wall', 'Jim', 'Carrey', 'comedy', 'other', 'movies', 'character', 'generally', 'likeable', 'side', 'film', 'swindles', 'get', 'bigger', 'bigger', 'found', 'harder', 'harder', 'like', 'character', 'find', 'humor', 'prison', 'deception', 'AIDS', 'homosexuality', 'are', 'not', 'easy', 'comedic', 'material', 'anyway', 'think', 'story', 'got', 'hampered', 'fact', 'was', 'based', 'true', 'story', 'read', 'reviews', 'compared', 'quirky', 'tone', 'Coen', 'brothers', 'films', 'are', 'generally', 'fiction', 'as', 'far', 'know', 'do', ""n't"", 'have', 'hindrance', 'trying', 'follow', 'basic', 'outlines', 'true', 'story.On', 'other', 'hand', 'amazing', 'so', 'many', 'prison', 'escapes', 'cons', 'movie', 'actually', 'did', 'occur', 'google', 'fact', 'vs', 'fiction', 'Love', 'Phillip', 'Morris', 'details', 'interest', ""n't"", 'actually', 'change', 'experience', 'watching', 'movie', 'Overall', 'solid', '3', 'stars', 'funny', 'moments', 'good', 'performances', 'film', 'whole', 'did', ""n't"", 'come', 'together']",N/A
1304773,A1VHEKYG8ZG0EF,B002ZG9800,mary ann broadus,"[5, 5]","Waited & waited for release of this film, finally heard it was being shown as an in-flight movie (!!),so Amazon to the rescue, & what a gem it is!! I'm a big Jim Carrey fan anyway, & as others have mentioned, the chemistry beween him & McGregor makes all the difference, that, plus a great script. Also, the word ""heartfelt"" keeps cropping up; it is indeed that, as well as erotic, very funny, tender & sweet-natured & raunchy. Wouldn't call it a ""gay"" film, it's a human film. Check out the marvelous ""Happy, Texas"", if you liked ""ILY,PM"", & all praise to the folks who brought this to the screen, it's really something to be proud of,& to enjoy in the profoundest sense of the word.",5,"It's about LOVE, folks, & it's about time...",1312070400,"07 31, 2011",2011,684,"['Waited', 'waited', 'release', 'film', 'finally', 'heard', 'was', 'being', 'shown', 'in-flight', 'movie', 'so', 'Amazon', 'rescue', 'what', 'gem', ""'m"", 'big', 'Jim', 'Carrey', 'fan', 'anyway', 'others', 'have', 'mentioned', 'chemistry', 'beween', 'McGregor', 'difference', 'great', 'script', 'Also', 'word', 'heartfelt', 'keeps', 'cropping', 'up', 'indeed', 'that', 'as', 'well', 'erotic', 'very', 'funny', 'tender', 'sweet-natured', 'raunchy', 'Would', ""n't"", 'call', 'gay', 'film', 'human', 'film', 'Check', 'marvelous', 'Happy', 'Texas', 'liked', 'ILY', 'PM', 'praise', 'folks', 'who', 'brought', 'screen', 'really', 'something', 'be', 'proud', 'enjoy', 'profoundest', 'sense', 'word']",N/A
1304774,A3I4PNY9STVH7F,B002ZG9800,matt,"[0, 0]",Im a big jim carry fan and loved this movie and luaghed thru the whole thing and would recomend it.,5,Phillip,1388534400,"01 1, 2014",2014,99,"['Im', 'big', 'jim', 'carry', 'fan', 'loved', 'movie', 'luaghed', 'whole', 'thing', 'would', 'recomend']",N/A
1304775,A2UUSINAX6T51T,B002ZG9800,"Maximus ""MIRR""","[7, 11]","Be advised, this is not your typical harmless, feelgood, ""rubber-faced"", family-friendly, Jim Carrey-kind of comedy like ""Liar Liar"", ""Yes Man"" and ""Bruce Almighty"". This is a black comedy. As black as they come. Jim Carrey portrays the (gay) con artist Steven Jay Russell, and this is actually based on a true story. I don't want to go too much into detail, because the whole story will probably just sound weird, but it kind of reminds me of ""Catch Me If You Can"", only way more funny, sick and twisted. I recommend it.I'm not gay, but I think this movie is funny nonetheless. Mostly for Jim Carrey-fans. I doubt I would have even seen it if you removed Jim Carrey. Much less found it amusing.",5,Homolarious,1286668800,"10 10, 2010",2010,695,"['Be', 'advised', 'not', 'typical', 'harmless', 'feelgood', 'rubber-faced', 'family-friendly', 'Jim', 'Carrey-kind', 'comedy', 'Liar', 'Liar', 'Yes', 'Man', 'Bruce', 'Almighty', 'black', 'comedy', 'As', 'black', 'come', 'Jim', 'Carrey', 'gay', 'con', 'artist', 'Steven', 'Jay', 'Russell', 'actually', 'based', 'true', 'story', 'do', ""n't"", 'want', 'go', 'too', 'much', 'detail', 'whole', 'story', 'will', 'probably', 'just', 'sound', 'weird', 'kind', 'reminds', 'Catch', 'Me', 'Can', 'only', 'way', 'more', 'funny', 'sick', 'twisted', 'recommend', 'it.I', ""'m"", 'not', 'gay', 'think', 'movie', 'funny', 'nonetheless', 'Mostly', 'Jim', 'Carrey-fans', 'doubt', 'would', 'have', 'even', 'seen', 'removed', 'Jim', 'Carrey', 'Much', 'less', 'found', 'amusing']",N/A
1304776,A17CI160P3A6KA,B002ZG9800,Michael D. Lindsey,"[2, 3]","I generally don't like Jim Carrey's movies, but I have seen one or twofilms where he really gets to show his talent; and this is one of those films.Although he plays a con man and gets to mug for the camera (many times); healso gets to play really sweet and touching love scenes with Ewan McGregor.Everything about this film fits right. It's a little over 90 minutes, whichkeeps things moving swiftly.It's so terrific that these two male actors agreed to take on the challengeof playing gay lovers. Everyone should see this film!",4,A Genuine Funny but tender and romantic story,1302998400,"04 17, 2011",2011,529,"['generally', 'do', ""n't"", 'like', 'Jim', 'Carrey', 'movies', 'have', 'seen', 'one', 'twofilms', 'where', 'really', 'show', 'talent', 'one', 'con', 'man', 'mug', 'camera', 'many', 'times', 'play', 'really', 'sweet', 'touching', 'love', 'scenes', 'Ewan', 'McGregor.Everything', 'film', 'right', 'little', '90', 'minutes', 'whichkeeps', 'things', 'moving', 'swiftly.It', 'so', 'terrific', 'two', 'male', 'actors', 'agreed', 'take', 'challengeof', 'playing', 'gay', 'lovers', 'Everyone', 'should', 'see', 'film']",N/A
1304777,A3CKOFIE4TEW7N,B002ZG9800,Michael Greenwaldt,"[3, 6]","At least most of the reviews on Amazon aren't as moronic as the ones on the Redbox website. Those have to be seen to be believed. I'm not usually a huge fan of Jim Carrey. Not when he's in over-the-top slapstick mode in broad comedies like Liar Liar or *shudders* Ace Ventura (I did really enjoy Yes Man though), but he was terrific here and the movie was very cute and funny. The only reason it's getting bashed is because Jim Carrey plays a homosexual. If you're a homophobe, don't watch it. It's as simple as that. This is really no different than other characters Carrey would play except that he's gay. This movie deserved a wider release. Don't be closed-minded and give this movie a chance. It's a quality comedy.",5,One of Jim Carrey's Best Performances,1304985600,"05 10, 2011",2011,720,"['least', 'most', 'reviews', 'Amazon', 'are', ""n't"", 'as', 'moronic', 'ones', 'Redbox', 'website', 'have', 'be', 'seen', 'be', 'believed', ""'m"", 'not', 'usually', 'huge', 'fan', 'Jim', 'Carrey', 'Not', 'when', 'over-the-top', 'slapstick', 'mode', 'broad', 'comedies', 'Liar', 'Liar', '*shudders*', 'Ace', 'Ventura', 'did', 'really', 'enjoy', 'Yes', 'Man', 'was', 'terrific', 'here', 'movie', 'was', 'very', 'cute', 'funny', 'only', 'reason', 'getting', 'bashed', 'Jim', 'Carrey', 'homosexual', ""'re"", 'homophobe', 'do', ""n't"", 'watch', 'as', 'simple', 'really', 'different', 'other', 'characters', 'Carrey', 'would', 'play', 'gay', 'movie', 'deserved', 'wider', 'release', 'Do', ""n't"", 'be', 'closed-minded', 'give', 'movie', 'chance', 'quality', 'comedy']",N/A
1304778,A153NZD2WZN5S3,B002ZG9800,Michael Kerjman,"[1, 5]","It seems, this movie is based on real personages who themselves care much less of their affairs than producers did.Father of a young daughter left family and job for police behind to be himself that is a top at some stages demonstrating nicely as one could suggest, artist's copulating skills.The rest is satire on the US both judiciary and penetrating system a prototype serves a life for his tricks with while movie-makers are looking forward to new cinematographic awards, perhaps.",3,Bonking Nicely,1326672000,"01 16, 2012",2012,484,"['movie', 'based', 'real', 'personages', 'who', 'care', 'much', 'less', 'affairs', 'producers', 'did.Father', 'young', 'daughter', 'left', 'family', 'job', 'police', 'be', 'top', 'stages', 'demonstrating', 'nicely', 'one', 'could', 'suggest', 'artist', 'copulating', 'skills.The', 'rest', 'satire', 'US', 'judiciary', 'penetrating', 'system', 'prototype', 'life', 'tricks', 'movie-makers', 'are', 'looking', 'forward', 'new', 'cinematographic', 'awards', 'perhaps']",N/A
1304779,ADBAJLF1ZJ0TB,B002ZG9800,Mikey,"[1, 1]",Ewan McGregor kept me watching this film. An enjoyable account of a true story. The story of two fraudsters in Texas and their stints in and out of prison. The film is quite funny in places and it passed an hour and a half away. Not the best film I've ever seen and not the worst either.,4,Enjoyable film with Ewan McGregor,1332806400,"03 27, 2012",2012,287,"['Ewan', 'McGregor', 'kept', 'watching', 'film', 'enjoyable', 'account', 'true', 'story', 'story', 'two', 'fraudsters', 'Texas', 'stints', 'prison', 'film', 'quite', 'funny', 'places', 'passed', 'hour', 'half', 'away', 'Not', 'best', 'film', ""'ve"", 'ever', 'seen', 'not', 'worst']",N/A
